id,name,full_name,language,new stars,description,forks_count,stargazers_count,avatar_url
85077558,developer-roadmap,kamranahmedse/developer-roadmap,TypeScript,891,"Interactive roadmaps, guides and other educational content to help developers grow in their careers.",35792,259751,https://avatars.githubusercontent.com/u/4921183?u=d6ed3573fc67b699e0c3bc2c7e1fb82c98c40dec&v=4
21289110,awesome-python,vinta/awesome-python,Python,885,"A curated list of awesome Python frameworks, libraries, software and resources",24196,189104,https://avatars.githubusercontent.com/u/652070?u=95b472a9a11b64ee0f74512ad918d762d42c213c&v=4
36633370,awesome-selfhosted,awesome-selfhosted/awesome-selfhosted,,1890,A list of Free Software network services and web applications which can be hosted on your own servers,8740,159328,https://avatars.githubusercontent.com/u/24270415?v=4
88011908,project-based-learning,practical-tutorials/project-based-learning,,2315,Curated list of project-based tutorials,17311,125270,https://avatars.githubusercontent.com/u/89421154?v=4
184456251,PowerToys,microsoft/PowerToys,C#,343,Windows system utilities to maximize productivity,5978,99478,https://avatars.githubusercontent.com/u/6154722?v=4
162998479,sherlock,sherlock-project/sherlock,Python,710,🔎 Hunt down social media accounts by username across social networks,5762,45500,https://avatars.githubusercontent.com/u/48293496?v=4
11171548,json,nlohmann/json,C++,621,JSON for Modern C++,6577,38220,https://avatars.githubusercontent.com/u/159488?u=7d63c3efe48fc8c84dd1219413787f2acc8aab63&v=4
510607652,pocketbase,pocketbase/pocketbase,Go,352,Open Source realtime backend in 1 file,1166,27453,https://avatars.githubusercontent.com/u/101000011?v=4
640079149,quivr,StanGirard/quivr,TypeScript,1434,"Your GenAI Second Brain 🧠  A personal productivity assistant (RAG) ⚡️🤖 Chat with your docs (PDF, CSV, ...)  & apps using Langchain, GPT 3.5 / 4 turbo, Private, Anthropic, VertexAI, Ollama, LLMs, that you can share with users !  Local & Private alternative to OpenAI GPTs & ChatGPT powered by retrieval-augmented generation ",2952,25979,https://avatars.githubusercontent.com/u/19614572?u=173c2e47345431892f3101b4febe851ea99c08ad&v=4
676676006,Fooocus,lllyasviel/Fooocus,Python,5962,Focus on prompting and generating,2288,24075,https://avatars.githubusercontent.com/u/19834515?u=4c7144779a6b13904fec478c4e98e676b91516ee&v=4
568098118,plane,makeplane/plane,TypeScript,1197,"🔥 🔥 🔥 Open Source JIRA, Linear and Height Alternative. Plane helps you track your issues, epics, and product roadmaps in the simplest way possible.",1024,19712,https://avatars.githubusercontent.com/u/115727700?v=4
589831718,ComfyUI,comfyanonymous/ComfyUI,Python,2012,The most powerful and modular stable diffusion GUI with a graph/nodes interface.,1912,18539,https://avatars.githubusercontent.com/u/121283862?u=f3e53b07cfbae7136f1796d4f6453827a12c2307&v=4
634043200,mojo,modularml/mojo,Jupyter Notebook,185,The Mojo Programming Language,2106,16048,https://avatars.githubusercontent.com/u/39327063?v=4
419661684,data-engineering-zoomcamp,DataTalksClub/data-engineering-zoomcamp,Jupyter Notebook,269,Free Data Engineering course! ,3610,15840,https://avatars.githubusercontent.com/u/72699292?v=4
1864233,erpnext,frappe/erpnext,Python,116,Free and Open Source Enterprise Resource Planning (ERP),6142,15488,https://avatars.githubusercontent.com/u/836974?v=4
614764248,tabby,TabbyML/tabby,Rust,748,Self-hosted AI coding assistant,514,13920,https://avatars.githubusercontent.com/u/125617854?v=4
272457606,cosmopolitan,jart/cosmopolitan,C,500,build-once run-anywhere c library,485,13158,https://avatars.githubusercontent.com/u/49262?u=ac68933ab61c639ab59ae693a41ae89cd874c16e&v=4
673524886,seamless_communication,facebookresearch/seamless_communication,C,2169,Foundational Models for State-of-the-Art Speech and Text Translation,802,8172,https://avatars.githubusercontent.com/u/16943930?v=4
124365799,Modern-CPP-Programming,federico-busato/Modern-CPP-Programming,,3452,Modern C++ Programming Course (C++11/14/17/20),555,7268,https://avatars.githubusercontent.com/u/55920584?u=fcdb76add5bc8ad6ecd816cbe854bb8b251bfa76&v=4
605673387,FastGPT,labring/FastGPT,TypeScript,593,"FastGPT is a knowledge-based QA system built on the LLM, offers out-of-the-box data processing and model invocation capabilities, allows for workflow orchestration through Flow visualization!",1457,6630,https://avatars.githubusercontent.com/u/102226726?v=4
714143245,self-operating-computer,OthersideAI/self-operating-computer,Python,4207,A framework to enable multimodal models to operate a computer.,770,5019,https://avatars.githubusercontent.com/u/76227954?v=4
703089836,insanely-fast-whisper,Vaibhavs10/insanely-fast-whisper,Jupyter Notebook,1140,,368,3877,https://avatars.githubusercontent.com/u/18682411?u=2f385b88a4eac9b94ec3f9b05c5ea73292be285a&v=4
246203444,leo,AleoHQ/leo,Rust,735,"🦁 The Leo Programming Language. A Programming Language for Formally Verified, Zero-Knowledge Applications",496,3423,https://avatars.githubusercontent.com/u/57516293?v=4
240039769,gost,go-gost/gost,Go,452,GO Simple Tunnel - a simple tunnel written in golang,420,2574,https://avatars.githubusercontent.com/u/33850973?v=4
685001175,ComfyUI_IPAdapter_plus,cubiq/ComfyUI_IPAdapter_plus,Python,189,,56,597,https://avatars.githubusercontent.com/u/427614?v=4
