id,name,full_name,language,new stars,description,forks_count,stargazers_count,avatar_url
13233158,obs-studio,obsproject/obs-studio,C,309,OBS Studio - Free and open source software for live streaming and screen recording,5483,34653,https://avatars.githubusercontent.com/u/7725691?v=4
569041,curl,curl/curl,C,99,"A command line tool and library for transferring data with URL syntax, supporting DICT, FILE, FTP, FTPS, GOPHER, GOPHERS, HTTP, HTTPS, IMAP, IMAPS, LDAP, LDAPS, MQTT, POP3, POP3S, RTMP, RTMPS, RTSP, SCP, SFTP, SMB, SMBS, SMTP, SMTPS, TELNET and TFTP. libcurl offers a myriad of powerful features",4797,22974,https://avatars.githubusercontent.com/u/16928085?v=4
102578345,lede,coolsnowwolf/lede,C,108,Lean's OpenWrt source,15892,19193,https://avatars.githubusercontent.com/u/31687149?u=caa956c5f80318ea674625f9e9efa49c98335d74&v=4
20159867,stb,nothings/stb,C,87,stb single-file public domain libraries for C/C++,6140,17579,https://avatars.githubusercontent.com/u/7525026?u=a23ba3a549fff291e35446cb32c8979bd29be6c9&v=4
18496166,mimikatz,gentilkiwi/mimikatz,C,88,A little tool to play with Windows security,2922,14655,https://avatars.githubusercontent.com/u/2307945?v=4
47409672,hashcat,hashcat/hashcat,C,414,World's fastest and most advanced password recovery utility,1928,11461,https://avatars.githubusercontent.com/u/15949799?v=4
27737393,qmk_firmware,qmk/qmk_firmware,C,48,Open-source keyboard firmware for Atmel AVR and Arm USB families,23479,11225,https://avatars.githubusercontent.com/u/25358678?v=4
105627846,reactos,reactos/reactos,C,89,A free Windows-compatible Operating System,1249,10363,https://avatars.githubusercontent.com/u/1056157?v=4
45821540,openwrt,openwrt/openwrt,C,61,This repository is a mirror of https://git.openwrt.org/openwrt/openwrt.git It is for reference only and is not active for check-ins or for reporting issues.  We will continue to accept Pull Requests here. They will be merged via staging trees then into openwrt.git. All issues should be reported at: https://bugs.openwrt.org,6617,10250,https://avatars.githubusercontent.com/u/2528830?v=4
1856976,libevent,libevent/libevent,C,30,Event notification library,2941,8257,https://avatars.githubusercontent.com/u/833750?v=4
70127218,arduino-esp32,espressif/arduino-esp32,C,53,Arduino core for the ESP32,4954,7854,https://avatars.githubusercontent.com/u/9460735?v=4
5414488,mongoose,cesanta/mongoose,C,34,Embedded Web Server,2210,7799,https://avatars.githubusercontent.com/u/5111322?v=4
65899476,esp-idf,espressif/esp-idf,C,45,Espressif IoT Development Framework. Official development framework for Espressif SoCs.,4893,7678,https://avatars.githubusercontent.com/u/9460735?v=4
211381291,BlackHole,ExistentialAudio/BlackHole,C,97,BlackHole is a modern macOS virtual audio driver that allows applications to pass audio to other applications with zero additional latency.,301,7185,https://avatars.githubusercontent.com/u/55156514?v=4
689344,RetroArch,libretro/RetroArch,C,27,"Cross-platform, sophisticated frontend for the libretro API. Licensed GPLv3.",1343,6126,https://avatars.githubusercontent.com/u/1812827?v=4
3791835,darktable,darktable-org/darktable,C,83,darktable is an open source photography workflow application and raw developer,892,6112,https://avatars.githubusercontent.com/u/1561544?v=4
2997204,john,openwall/john,C,74,"John the Ripper jumbo - advanced offline password cracker, which supports hundreds of hash and cipher types, and runs on many operating systems, CPUs, GPUs, and even some FPGAs",1534,5746,https://avatars.githubusercontent.com/u/1579552?v=4
91493088,GoodbyeDPI,ValdikSS/GoodbyeDPI,C,123,GoodbyeDPI — Deep Packet Inspection circumvention utility (for Windows),564,5055,https://avatars.githubusercontent.com/u/3054729?u=db712da584cc0d21a860b786b9ab2f2323758598&v=4
431433455,qoi,phoboslab/qoi,C,798,"The “Quite OK Image Format” for fast, lossless image compression",175,3974,https://avatars.githubusercontent.com/u/443987?v=4
58132544,RediSearch,RediSearch/RediSearch,C,35,"A query and indexing engine for Redis, providing secondary indexing, full-text search, and aggregations. ",360,3451,https://avatars.githubusercontent.com/u/46899501?v=4
425159471,flash-linux0.11-talk,sunym1993/flash-linux0.11-talk,C,260,你管这破玩意叫操作系统源码 — 像小说一样品读 Linux 0.11 核心代码,268,3445,https://avatars.githubusercontent.com/u/25787738?u=b3d34b2077983e3632c0da01246c56235fb14c21&v=4
79160357,fivem,citizenfx/fivem,C,23,"The source code for the Cfx.re modification frameworks, such as FiveM, RedM and LibertyM, as well as FXServer.",1281,2261,https://avatars.githubusercontent.com/u/25160833?v=4
144465372,proxmark3,RfidResearchGroup/proxmark3,C,18,"RRG / Iceman repo, the most totally wicked repo around if you are into Proxmark3 and RFID hacking",483,1341,https://avatars.githubusercontent.com/u/40314039?v=4
226167620,InfiniTime,InfiniTimeOrg/InfiniTime,C,27,Firmware for Pinetime smartwatch written in C/C++ and based on FreeRTOS,447,1182,https://avatars.githubusercontent.com/u/91782433?v=4
438747534,log4jscanwin,Qualys/log4jscanwin,C,15,Log4j Vulnerability Scanner for Windows,14,110,https://avatars.githubusercontent.com/u/871765?v=4
