id,name,full_name,language,new stars,description,forks_count,stargazers_count,avatar_url
1863329,laravel,laravel/laravel,PHP,91,A PHP framework for web artisans.,21943,67774,https://avatars.githubusercontent.com/u/958072?v=4
7548986,framework,laravel/framework,PHP,66,The Laravel Framework.,8768,25750,https://avatars.githubusercontent.com/u/958072?v=4
2253830,PHPMailer,PHPMailer/PHPMailer,PHP,32,The classic email sending library for PHP,9075,17510,https://avatars.githubusercontent.com/u/3959702?v=4
82238168,monica,monicahq/monica,PHP,47,"Personal CRM. Remember everything about your friends, family and business relationships.",1600,15551,https://avatars.githubusercontent.com/u/25832602?v=4
3431193,yii2,yiisoft/yii2,PHP,7,"Yii 2: The Fast, Secure and Professional PHP Framework",6976,13858,https://avatars.githubusercontent.com/u/993323?v=4
7704544,image,Intervention/image,PHP,22,PHP Image Manipulation,1384,12322,https://avatars.githubusercontent.com/u/3258272?v=4
56728437,labs,docker/labs,PHP,28,This is a collection of tutorials for learning how to use Docker with various tools. Contributions welcome.,5141,10468,https://avatars.githubusercontent.com/u/5429470?v=4
23680678,jwt-auth,tymondesigns/jwt-auth,PHP,20,ğŸ” JSON Web Token Authentication for Laravel & Lumen,1405,10329,https://avatars.githubusercontent.com/u/1801923?u=15eeeb0c2817253aea520178e9d15def0883b8fe&v=4
48796179,laravel-admin,z-song/laravel-admin,PHP,10,Build a full-featured administrative interface in ten minutes,2625,10280,https://avatars.githubusercontent.com/u/1479100?v=4
42480275,laravel-permission,spatie/laravel-permission,PHP,18,Associate users with roles and permissions,1513,10047,https://avatars.githubusercontent.com/u/7535935?v=4
2884111,magento2,magento/magento2,PHP,21,"All Submissions you make to Magento Inc. (""Magento"") through GitHub are subject to the following terms and conditions: (1) You grant Magento a perpetual, worldwide, non-exclusive, no charge, royalty free, irrevocable license under your applicable copyrights and patents to reproduce, prepare derivative works of, display, publically perform, sublicense and distribute any feedback, ideas, code, or other information (â€œSubmission"") you submit through GitHub. (2) Your Submission is an original work of authorship and you are the owner or are legally entitled to grant the license stated above. (3) You agree to the Contributor License Agreement found here:  https://github.com/magento/magento2/blob/master/CONTRIBUTOR_LICENSE_AGREEMENT.html",8741,9830,https://avatars.githubusercontent.com/u/168457?v=4
21298446,firefly-iii,firefly-iii/firefly-iii,PHP,39,Firefly III: a personal finances manager,787,7035,https://avatars.githubusercontent.com/u/22821986?v=4
2141186,opencart,opencart/opencart,PHP,9,A free shopping cart system. OpenCart is an open source PHP-based online e-commerce solution.,4465,6287,https://avatars.githubusercontent.com/u/214225?v=4
95011974,akaunting,akaunting/akaunting,PHP,32,Free and Online Accounting Software,1667,4638,https://avatars.githubusercontent.com/u/26357771?v=4
60010673,elementor,elementor/elementor,PHP,17,"The most advanced frontend drag & drop page builder. Create high-end, pixel perfect websites at record speeds. Any theme, any page, any design.",1039,4228,https://avatars.githubusercontent.com/u/47606894?v=4
148129143,bagisto,bagisto/bagisto,PHP,25,"An easy to use, free and open source laravel eCommerce platform to build your online shop in no time.",1385,4160,https://avatars.githubusercontent.com/u/43133047?v=4
62937181,PrivateBin,PrivateBin/PrivateBin,PHP,21,"A minimalist, open source online pastebin where the server has zero knowledge of pasted data. Data is encrypted/decrypted in the browser using 256 bits AES.",507,3651,https://avatars.githubusercontent.com/u/20367028?v=4
1957456,dolibarr,Dolibarr/dolibarr,PHP,25,"Dolibarr ERP CRM is a modern software package to manage your company or foundation's activity (contacts, suppliers, invoices, orders, stocks, agenda, accounting, ...). It is open source software (written in PHP) and designed for small and medium businesses, foundations and freelancers. You can freely install, use and distribute it as a standalone application or as a web application to use it from every internet access and media.",1907,2904,https://avatars.githubusercontent.com/u/877491?v=4
57961433,openmediavault,openmediavault/openmediavault,PHP,23,"openmediavault is the next generation network attached storage (NAS) solution based on Debian Linux. It contains services like SSH, (S)FTP, SMB/CIFS, DAAP media server, RSync, BitTorrent client and many more. Thanks to the modular design of the framework it can be enhanced via plugins.  OpenMediaVault is primarily designed to be used in home environments or small home offices, but is not limited to those scenarios. It is a simple and easy to use out-of-the-box solution that will allow everyone to install and administrate a Network Attached Storage without deeper knowledge.",337,2686,https://avatars.githubusercontent.com/u/1897994?v=4
73781385,platform,orchidsoftware/platform,PHP,20,"A @laravel based RAD platform for back-office applications, admin/user panels, and dashboards.",441,2645,https://avatars.githubusercontent.com/u/16124498?v=4
248372441,filament,laravel-filament/filament,PHP,63,"A collection of tools for rapidly building beautiful TALL stack interfaces, designed for humans.",247,2308,https://avatars.githubusercontent.com/u/64450473?v=4
17722440,alltube,Rudloff/alltube,PHP,97,Web GUI for youtube-dl,447,2019,https://avatars.githubusercontent.com/u/840125?u=df7b8715c3c28c78e3752d51f95b617c86d36cd3&v=4
400984450,dootask,kuaifan/dootask,PHP,440,DooTaskæ˜¯ä¸€æ¬¾è½»é‡çº§çš„å¼€æºåœ¨çº¿é¡¹ç›®ä»»åŠ¡ç®¡ç†å·¥å…·ï¼Œæä¾›å„ç±»æ–‡æ¡£åä½œå·¥å…·ã€åœ¨çº¿æ€ç»´å¯¼å›¾ã€åœ¨çº¿æµç¨‹å›¾ã€é¡¹ç›®ç®¡ç†ã€ä»»åŠ¡åˆ†å‘ã€å³æ—¶IMï¼Œæ–‡ä»¶ç®¡ç†ç­‰å·¥å…·ã€‚,225,1124,https://avatars.githubusercontent.com/u/36875852?u=379dd42f7823a7747859b4845b873bfe1af254e0&v=4
428315972,laravel-health,spatie/laravel-health,PHP,66,Check the health of your Laravel app,29,269,https://avatars.githubusercontent.com/u/7535935?v=4
314646531,laravel-geographical-calculator,karam-mustafa/laravel-geographical-calculator,PHP,37,"laravel package help you to implement geographical calculation, with several algorithms that help you deal with coordinates and distances.",1,211,https://avatars.githubusercontent.com/u/71431942?u=c601d444cfdc9478e08682cb0ca391ca003a7b86&v=4
