id,name,full_name,language,new stars,description,forks_count,stargazers_count,avatar_url
8514,rails,rails/rails,Ruby,47,Ruby on Rails,21813,56610,https://avatars.githubusercontent.com/u/4223?v=4
65252,jekyll,jekyll/jekyll,Ruby,48,:globe_with_meridians: Jekyll is a blog-aware static site generator in Ruby,10070,49770,https://avatars.githubusercontent.com/u/3083652?v=4
52281283,mastodon,mastodon/mastodon,Ruby,50,"Your self-hosted, globally interconnected microblogging community",7135,47960,https://avatars.githubusercontent.com/u/24979032?v=4
8681349,huginn,huginn/huginn,Ruby,92,Create agents that monitor and act on your behalf.  Your agents are standing by!,3910,45266,https://avatars.githubusercontent.com/u/23225142?v=4
53238813,brew,Homebrew/brew,Ruby,107,🍺 The missing package manager for macOS (or Linux),10095,42950,https://avatars.githubusercontent.com/u/1503512?v=4
27442967,fastlane,fastlane/fastlane,Ruby,38,🚀 The easiest way to automate building and releasing your iOS and Android apps,5784,39991,https://avatars.githubusercontent.com/u/11098337?v=4
13840241,devdocs,freeCodeCamp/devdocs,Ruby,46,API Documentation Browser,2404,35912,https://avatars.githubusercontent.com/u/9892522?v=4
2293158,metasploit-framework,rapid7/metasploit-framework,Ruby,113,Metasploit Framework,14217,35132,https://avatars.githubusercontent.com/u/1013671?v=4
308770,devise,heartcombo/devise,Ruby,13,Flexible authentication solution for Rails with Warden.,5538,24140,https://avatars.githubusercontent.com/u/59584037?v=4
202291859,chatwoot,chatwoot/chatwoot,Ruby,122,"Open-source live-chat, email support, omni-channel desk. An alternative to Intercom, Zendesk, Salesforce Service Cloud etc. 🔥💬",4054,22853,https://avatars.githubusercontent.com/u/23416667?v=4
538746,ruby,ruby/ruby,Ruby,28,The Ruby Programming Language,5395,22444,https://avatars.githubusercontent.com/u/210414?v=4
3623050,homebrew-cask,Homebrew/homebrew-cask,Ruby,24,🍻 A CLI workflow for the administration of macOS applications distributed as binaries,10890,21204,https://avatars.githubusercontent.com/u/1503512?v=4
2203645,CocoaPods,CocoaPods/CocoaPods,Ruby,11,The Cocoa Dependency Manager.,2661,14671,https://avatars.githubusercontent.com/u/1189714?v=4
3195124,sidekiq,sidekiq/sidekiq,Ruby,10,"Simple, efficient background processing for Ruby",2440,13272,https://avatars.githubusercontent.com/u/124714131?v=4
1918677,fluentd,fluent/fluentd,Ruby,17,Fluentd: Unified Logging Layer (project under CNCF),1363,13073,https://avatars.githubusercontent.com/u/859518?v=4
15435,liquid,Shopify/liquid,Ruby,13,"Liquid markup language. Safe, customer facing template language for flexible web apps. ",1433,11291,https://avatars.githubusercontent.com/u/8085?v=4
361310,capybara,teamcapybara/capybara,Ruby,5,Acceptance test framework for web applications,1457,10062,https://avatars.githubusercontent.com/u/23465623?v=4
2802565,doorkeeper,doorkeeper-gem/doorkeeper,Ruby,6,Doorkeeper is an OAuth 2 provider for Ruby on Rails / Grape.,1076,5371,https://avatars.githubusercontent.com/u/7275750?v=4
93163073,dependabot-core,dependabot/dependabot-core,Ruby,26,🤖 Dependabot's core logic for creating update PRs.,1086,4944,https://avatars.githubusercontent.com/u/27347476?v=4
7050,prawn,prawnpdf/prawn,Ruby,4,"Fast, Nimble PDF Writer for Ruby",694,4703,https://avatars.githubusercontent.com/u/1440292?v=4
103766152,explore,github/explore,Ruby,8,Community-curated topic and collection pages on GitHub,13071,4366,https://avatars.githubusercontent.com/u/9919?v=4
284824224,ruby-openai,alexrudall/ruby-openai,Ruby,29,OpenAI API + Ruby! 🤖❤️ Now with Responses API + DeepSeek!,356,2995,https://avatars.githubusercontent.com/u/7175262?u=1c7a93502c0d7247a8f3e7383b100405f07f2d9d&v=4
65914086,decidim,decidim/decidim,Ruby,4,The participatory democracy framework. A generator and multiple gems made with Ruby on Rails,413,1527,https://avatars.githubusercontent.com/u/22474646?v=4
