id,name,full_name,language,new stars,description,forks_count,stargazers_count,avatar_url
9384267,electron,electron/electron,C++,19,":electron: Build cross-platform desktop apps with JavaScript, HTML, and CSS",13089,99627,https://avatars.githubusercontent.com/u/13409222?v=4
100060912,terminal,microsoft/terminal,C++,22,"The new Windows Terminal and the original Windows console host, all in the same place!",7094,79634,https://avatars.githubusercontent.com/u/6154722?v=4
65600975,pytorch,pytorch/pytorch,C++,27,Tensors and Dynamic neural networks in Python with strong GPU acceleration,14612,53150,https://avatars.githubusercontent.com/u/21003710?v=4
39840932,googletest,google/googletest,C++,59,GoogleTest - Google Testing and Mocking Framework,8168,24690,https://avatars.githubusercontent.com/u/1342004?v=4
60246359,ClickHouse,ClickHouse/ClickHouse,C++,17,ClickHouse® is a free analytics DBMS for big data,4196,21427,https://avatars.githubusercontent.com/u/54801242?v=4
81227005,faiss,facebookresearch/faiss,C++,13,A library for efficient similarity search and clustering of dense vectors.,2467,15902,https://avatars.githubusercontent.com/u/16943930?v=4
191820100,mediapipe,google/mediapipe,C++,18,"Cross-platform, customizable ML solutions for live and streaming media.",3209,15667,https://avatars.githubusercontent.com/u/1342004?v=4
64991887,LightGBM,microsoft/LightGBM,C++,9,"A fast, distributed, high performance gradient boosting (GBT, GBDT, GBRT, GBM or MART) framework based on decision tree algorithms, used for ranking, classification and many other machine learning tasks.",3457,13350,https://avatars.githubusercontent.com/u/6154722?v=4
7056202,fmt,fmtlib/fmt,C++,86,A modern formatting library,1564,13161,https://avatars.githubusercontent.com/u/7280830?v=4
17391973,rapidjson,Tencent/rapidjson,C++,4,A fast JSON parser/generator for C++ with both SAX/DOM style API,3077,11602,https://avatars.githubusercontent.com/u/18461506?v=4
51905353,arrow,apache/arrow,C++,4,Apache Arrow is a multi-language toolbox for accelerated data interchange and in-memory processing,2161,8901,https://avatars.githubusercontent.com/u/47359?v=4
33294473,mactype,snowie2000/mactype,C++,20,Better font rendering for Windows.,376,6888,https://avatars.githubusercontent.com/u/11767189?v=4
181436799,MNN,alibaba/MNN,C++,4,"MNN is a blazing fast, lightweight deep learning framework, battle-tested by business-critical use cases in Alibaba",1310,6334,https://avatars.githubusercontent.com/u/1961952?v=4
104208128,Paddle-Lite,PaddlePaddle/Paddle-Lite,C++,4,Multi-platform high performance  deep learning inference engine (『飞桨』多平台高性能深度学习预测引擎）,1378,5836,https://avatars.githubusercontent.com/u/23534030?v=4
64561753,jetson-inference,dusty-nv/jetson-inference,C++,9,Hello AI World guide to deploying deep-learning inference networks and deep vision primitives with TensorRT and NVIDIA Jetson.,2375,5253,https://avatars.githubusercontent.com/u/15352619?u=2931352d1f495aba1c172e0c6ae5bfeac8152b06&v=4
31197250,glog,google/glog,C++,1,C++ implementation of the Google logging module,1785,5022,https://avatars.githubusercontent.com/u/1342004?v=4
189205663,TinyWebServer,qinguoyi/TinyWebServer,C++,19,:fire: Linux下C++轻量级Web服务器,1494,4929,https://avatars.githubusercontent.com/u/25760295?u=a4474a249cca515146041e4b6bfaf5f448d9a113&v=4
114128199,multipass,canonical/multipass,C++,37,Multipass orchestrates virtual Ubuntu instances,374,4264,https://avatars.githubusercontent.com/u/53057619?v=4
36832736,cryptopp,weidai11/cryptopp,C++,6,free C++ class library of cryptographic schemes,956,3185,https://avatars.githubusercontent.com/u/1622188?v=4
329265231,safetynet-fix,kdrag0n/safetynet-fix,C++,19,Universal fix for Google SafetyNet on Android devices with hardware attestation and unlocked bootloaders.,119,1918,https://avatars.githubusercontent.com/u/7930239?u=ff09f9ad902b038246cd5cdd689c3068870595d5&v=4
402945349,starrocks,StarRocks/starrocks,C++,20,"StarRocks is a next-gen sub-second MPP database for full analysis scenarios, including multi-dimensional analytics, real-time analytics and ad-hoc query.",363,1901,https://avatars.githubusercontent.com/u/88238841?v=4
404724835,r3live,hku-mars/r3live,C++,41,"A Robust, Real-time, RGB-colored, LiDAR-Inertial-Visual tightly-coupled state Estimation and mapping package",98,611,https://avatars.githubusercontent.com/u/51474179?v=4
356055024,tflite-micro,tensorflow/tflite-micro,C++,5,TensorFlow Lite for Microcontrollers,228,447,https://avatars.githubusercontent.com/u/15658638?v=4
378240208,TaskbarXI,ChrisAnd1998/TaskbarXI,C++,30,An application written in C++ to modify the Windows 11 Taskbar. ,40,343,https://avatars.githubusercontent.com/u/50437199?u=3dbf14d47e9544c76abfef5f10f3b9736f4d5192&v=4
443488412,AVP-SLAM-PLUS,liuguitao/AVP-SLAM-PLUS,C++,12,An implementation of AVP-SLAM and some new contributions,58,161,https://avatars.githubusercontent.com/u/49521527?v=4
