id,name,full_name,language,new stars,description,forks_count,stargazers_count,avatar_url
7548986,framework,laravel/framework,PHP,26,The Laravel Framework.,10807,31856,https://avatars.githubusercontent.com/u/958072?v=4
1420053,guzzle,guzzle/guzzle,PHP,18,"Guzzle, an extensible PHP HTTP client",2397,23053,https://avatars.githubusercontent.com/u/638632?v=4
170355508,livewire,livewire/livewire,PHP,28,A full-stack framework for Laravel that takes the pain out of building dynamic UIs.,1509,22001,https://avatars.githubusercontent.com/u/51960834?v=4
82238168,monica,monicahq/monica,PHP,64,"Personal CRM. Remember everything about your friends, family and business relationships.",2113,21183,https://avatars.githubusercontent.com/u/25832602?v=4
2253830,PHPMailer,PHPMailer/PHPMailer,PHP,25,The classic email sending library for PHP,9705,20809,https://avatars.githubusercontent.com/u/3959702?v=4
248372441,filament,filamentphp/filament,PHP,189,"A collection of beautiful full-stack components for Laravel. The perfect starting point for your next app. Using Livewire, Alpine.js and Tailwind CSS.",2598,16414,https://avatars.githubusercontent.com/u/64450473?v=4
47495360,koel,koel/koel,PHP,59,🐦 A personal music streaming server that works.,1928,15719,https://avatars.githubusercontent.com/u/20983373?v=4
21298446,firefly-iii,firefly-iii/firefly-iii,PHP,80,Firefly III: a personal finances manager,1368,15003,https://avatars.githubusercontent.com/u/22821986?v=4
41589337,BookStack,BookStackApp/BookStack,PHP,60,A platform to create documentation/wiki content built with PHP & Laravel,1835,14476,https://avatars.githubusercontent.com/u/20912696?v=4
42480275,laravel-permission,spatie/laravel-permission,PHP,14,Associate users with roles and permissions,1753,11970,https://avatars.githubusercontent.com/u/7535935?v=4
926544,Slim,slimphp/Slim,PHP,14,Slim is a PHP micro framework that helps you quickly write simple yet powerful web applications and APIs.,1943,11880,https://avatars.githubusercontent.com/u/11195762?v=4
2884111,magento2,magento/magento2,PHP,16,"Prior to making any Submission(s), you must sign an Adobe Contributor License Agreement, available here at: https://opensource.adobe.com/cla.html. All Submissions you make to Adobe Inc. and its affiliates, assigns and subsidiaries (collectively “Adobe”) are subject to the terms of the Adobe Contributor License Agreement.",9290,11400,https://avatars.githubusercontent.com/u/168457?v=4
6322699,FreshRSS,FreshRSS/FreshRSS,PHP,46,"A free, self-hostable news aggregator…",798,9018,https://avatars.githubusercontent.com/u/9414285?v=4
374132359,laravel-crm,krayin/laravel-crm,PHP,230,Free & Opensource Laravel CRM solution for SMEs and Enterprises for complete customer lifecycle management.,518,7917,https://avatars.githubusercontent.com/u/86250863?v=4
95011974,akaunting,akaunting/akaunting,PHP,40,Online Accounting Software,2368,7781,https://avatars.githubusercontent.com/u/26357771?v=4
60010673,elementor,elementor/elementor,PHP,10,"The most advanced frontend drag & drop page builder. Create high-end, pixel perfect websites at record speeds. Any theme, any page, any design.",1405,6492,https://avatars.githubusercontent.com/u/47606894?v=4
433383766,all-in-one,nextcloud/all-in-one,PHP,63,📦 The official Nextcloud installation method. Provides easy deployment and maintenance with most features included in this one Nextcloud instance.,563,4756,https://avatars.githubusercontent.com/u/19211038?v=4
541322916,client,openai-php/client,PHP,22,⚡️ OpenAI PHP is a supercharged community-maintained PHP API client that allows you to interact with OpenAI API.,471,4626,https://avatars.githubusercontent.com/u/114351357?v=4
27965134,core,opnsense/core,PHP,16,"OPNsense GUI, API and systems backend",706,3114,https://avatars.githubusercontent.com/u/9979117?v=4
715878832,PHP_CodeSniffer,PHPCSStandards/PHP_CodeSniffer,PHP,13,PHP_CodeSniffer tokenizes PHP files and detects violations of a defined set of coding standards.,50,823,https://avatars.githubusercontent.com/u/54010123?v=4
274940489,NexoPOS,Blair2004/NexoPOS,PHP,30,"The base version of NexoPOS, which is a web-Based Point Of Sale (POS) System build with Laravel, TailwindCSS, and Vue.Js.",331,797,https://avatars.githubusercontent.com/u/5265663?u=4bfbccfd4f424329fee273ee9397d541c377593e&v=4
