id,name,full_name,language,new stars,description,forks_count,stargazers_count,avatar_url
2561582,animate.css,animate-css/animate.css,CSS,52,🍿 A cross-browser library of CSS animations. As easy to use as an easy thing.,16526,78544,https://avatars.githubusercontent.com/u/64791939?v=4
1700621,normalize.css,necolas/normalize.css,CSS,53,A modern alternative to CSS resets,11001,50922,https://avatars.githubusercontent.com/u/239676?u=4b545d3dd62d217b40a624ebbe987cfc67e73803&v=4
50264296,bulma,jgthms/bulma,CSS,45,Modern CSS framework based on Flexbox,3988,47507,https://avatars.githubusercontent.com/u/1254808?u=1d9df343bac6f57e7bff85f0074aac2de34f5dcc&v=4
27574418,nerd-fonts,ryanoasis/nerd-fonts,CSS,163,"Iconic font aggregator, collection, & patcher. 3,600+ icons, 50+ patched fonts: Hack, Source Code Pro, more. Glyph collections: Font Awesome, Material Design Icons, Octicons, & more",3386,46267,https://avatars.githubusercontent.com/u/8083459?u=1645f43000c842a948268609231bdecb1433c470&v=4
313330998,50projects50days,bradtraversy/50projects50days,CSS,159,"50+ mini web projects using HTML, CSS & JS",8091,30575,https://avatars.githubusercontent.com/u/5550850?u=45352e59e108ddd00ead26981cd6a4a53b151b1d&v=4
68592809,iCSS,chokcoco/iCSS,CSS,23,不止于 CSS,1683,16019,https://avatars.githubusercontent.com/u/8554143?u=c322501aeb96b3f90f504512d501830b70894eae&v=4
13099301,flag-icons,lipis/flag-icons,CSS,19,:flags: A curated collection of all country flags in SVG — plus the CSS for easier integration,1787,9713,https://avatars.githubusercontent.com/u/125676?u=ed6b72344fe5cb2195b3e213b2ee5be905bd2766&v=4
49767244,primeng,primefaces/primeng,CSS,25,The Most Complete Angular UI Component Library,4241,8448,https://avatars.githubusercontent.com/u/3494069?v=4
7517918,spring-petclinic,spring-projects/spring-petclinic,CSS,16,A sample Spring-based application,20825,6775,https://avatars.githubusercontent.com/u/317776?v=4
264441033,missing-semester-cn.github.io,missing-semester-cn/missing-semester-cn.github.io,CSS,48,the CS missing semester Chinese version,708,5472,https://avatars.githubusercontent.com/u/65452715?v=4
41443539,vscode-docs,microsoft/vscode-docs,CSS,14,Public documentation for Visual Studio Code,4297,5184,https://avatars.githubusercontent.com/u/6154722?v=4
76666208,primereact,primefaces/primereact,CSS,23,The Most Complete React UI Component Library,777,4519,https://avatars.githubusercontent.com/u/3494069?v=4
329751286,youtube,safak/youtube,CSS,25,,5097,4501,https://avatars.githubusercontent.com/u/1486366?u=c367d218a8cf89ad09c3dbfb3c7ad7a929142f20&v=4
160313905,primevue,primefaces/primevue,CSS,36,Next Generation Vue UI Component Library,793,4346,https://avatars.githubusercontent.com/u/3494069?v=4
107962707,advanced-css-course,jonasschmedtmann/advanced-css-course,CSS,10,"Starter files, final projects and FAQ for my Advanced CSS course",5106,4258,https://avatars.githubusercontent.com/u/18718850?u=9e3b84d1871a03690c758df5b5e9b967223a6def&v=4
119437761,SocialFish,UndeadSec/SocialFish,CSS,16,Phishing Tool & Information Collector ,1234,3617,https://avatars.githubusercontent.com/u/29824686?v=4
420352316,project_modern_ui_ux_gpt3,adrianhajdin/project_modern_ui_ux_gpt3,CSS,19,Master the creation of Modern UX/UI Websites,805,3271,https://avatars.githubusercontent.com/u/24898559?u=fd2baba143bcb62cc0f2bc646ec33c2ba9ef013e&v=4
366437783,responsive-portfolio-website-Alexa,bedimcode/responsive-portfolio-website-Alexa,CSS,20,"Responsive Portfolio Website Using HTML, CSS & JavaScript",1352,1718,https://avatars.githubusercontent.com/u/61248995?u=ce8e7f12481e60e88d2480d1215211558ca4b137&v=4
433605398,openai-quickstart-python,openai/openai-quickstart-python,CSS,7,Python example app from the OpenAI API quickstart tutorial,1270,1501,https://avatars.githubusercontent.com/u/14957082?v=4
351877974,python_interview_questions,yakimka/python_interview_questions,CSS,15,Вопросы для подготовки к интервью на позицию Python Developer,231,901,https://avatars.githubusercontent.com/u/28621349?u=973eef21adf71f2c7da1caaaacf41d66e3f7d27f&v=4
616351992,Next.js-Developer-Portfolio-Starter-Code,codebucks27/Next.js-Developer-Portfolio-Starter-Code,CSS,14,"⭐Build a stunning portfolio website with Next.js, Tailwind CSS and Framer-motion. If you want to learn to create this you can follow the tutorial link given in the Read me file.",214,332,https://avatars.githubusercontent.com/u/70878044?u=2440c945ab064a31db243cd34cb7b6037fc0bc68&v=4
524784838,js-developer-pokedex,digitalinnovationone/js-developer-pokedex,CSS,45,,2183,324,https://avatars.githubusercontent.com/u/26231823?v=4
400791217,chatbot-deployment,patrickloeber/chatbot-deployment,CSS,2,Deployment of PyTorch chatbot with Flask,303,219,https://avatars.githubusercontent.com/u/50772274?u=5d63cb1b53e5702ea3dd12f865c3b9b252f37a02&v=4
559039482,tailbliss,nusserstudios/tailbliss,CSS,6,"TailBliss is a Hugo Starter theme built on TailwindCSS 3, and Alpine.JS.",71,166,https://avatars.githubusercontent.com/u/7240155?u=056926471f7d02f389d3b7d38b9a41a9a83e4a93&v=4
677443393,css-projects,CodeCrafter11/css-projects,CSS,35,You can find all source codes for all css projects here,29,154,https://avatars.githubusercontent.com/u/141913142?u=8ec162f95c79487c93a5f3383d6c8631669ed11a&v=4
