id,name,full_name,language,new stars,description,forks_count,stargazers_count,avatar_url
184456251,PowerToys,microsoft/PowerToys,C#,66,Windows system utilities to maximize productivity,5047,87811,https://avatars.githubusercontent.com/u/6154722?v=4
17620347,aspnetcore,dotnet/aspnetcore,C#,12,"ASP.NET Core is a cross-platform .NET framework for building modern cloud-based web applications on Windows, Mac, or Linux.",8871,31105,https://avatars.githubusercontent.com/u/9141961?v=4
13428264,ShareX,ShareX/ShareX,C#,21,"ShareX is a free and open source program that lets you capture or record any area of your screen and share it with a single press of a key. It also allows uploading images, text or other types of files to many supported destinations you can choose from.",2805,23489,https://avatars.githubusercontent.com/u/5548736?v=4
70104825,eShopOnContainers,dotnet-architecture/eShopOnContainers,C#,8,"Cross-platform .NET sample microservices and container based application that runs on Linux Windows and macOS. Powered by .NET 7, Docker Containers and Azure Kubernetes Services. Supports Visual Studio, VS for Mac and CLI based environments with Docker CLI, dotnet CLI, VS Code or any other code editor.",9771,22673,https://avatars.githubusercontent.com/u/27453006?v=4
262395224,maui,dotnet/maui,C#,9,".NET MAUI is the .NET Multi-platform App UI, a framework for building native device applications spanning mobile, tablet, and desktop.",1241,18483,https://avatars.githubusercontent.com/u/9141961?v=4
83380995,eShopOnWeb,dotnet-architecture/eShopOnWeb,C#,13,"Sample ASP.NET Core 6.0 reference application, powered by Microsoft, demonstrating a layered application architecture with monolithic deployment model. Download the eBook PDF from docs folder.",4382,8553,https://avatars.githubusercontent.com/u/27453006?v=4
11591313,refit,reactiveui/refit,C#,11,"The automatic type-safe REST library for .NET Core, Xamarin and .NET. Heavily inspired by Square's Retrofit library, Refit turns your REST API into a live interface.",685,6879,https://avatars.githubusercontent.com/u/2327577?v=4
281360869,spectre.console,spectreconsole/spectre.console,C#,27,A .NET library that makes it easier to create beautiful console applications.,315,6712,https://avatars.githubusercontent.com/u/80390616?v=4
152370823,AspNetCoreDiagnosticScenarios,davidfowl/AspNetCoreDiagnosticScenarios,C#,11,This repository has examples of broken patterns in ASP.NET Core applications,606,6166,https://avatars.githubusercontent.com/u/95136?u=598ed17571853b315c1b21f792f2652a3513c02b&v=4
54213490,Xamarin.Forms,xamarin/Xamarin.Forms,C#,1,Xamarin.Forms Official Home,1922,5644,https://avatars.githubusercontent.com/u/790012?v=4
50605426,MixedRealityToolkit-Unity,microsoft/MixedRealityToolkit-Unity,C#,2,Mixed Reality Toolkit (MRTK) provides a set of components and features to accelerate cross-platform MR app development in Unity.,2110,5632,https://avatars.githubusercontent.com/u/6154722?v=4
1208824,quartznet,quartznet/quartznet,C#,2,Quartz Enterprise Scheduler .NET,1593,5526,https://avatars.githubusercontent.com/u/685655?v=4
778828,MassTransit,MassTransit/MassTransit,C#,2,Distributed Application Framework for .NET,1458,5210,https://avatars.githubusercontent.com/u/317796?v=4
288428676,MudBlazor,MudBlazor/MudBlazor,C#,8,Blazor Component Library based on Material design with an emphasis on ease of use. Mainly written in C# with Javascript kept to a bare minimum it empowers .NET developers to easily debug it if needed.,851,4906,https://avatars.githubusercontent.com/u/79755064?v=4
103370157,optimizer,hellzerg/optimizer,C#,16,The finest Windows Optimizer,415,4501,https://avatars.githubusercontent.com/u/3146835?u=012a457ae34fc7f8a0e55e66f7e3f1702a6e7a47&v=4
119571446,samples,dotnet/samples,C#,5,Sample code referenced by the .NET documentation,4668,2727,https://avatars.githubusercontent.com/u/9141961?v=4
137433882,arfoundation-samples,Unity-Technologies/arfoundation-samples,C#,3,Example content for Unity projects based on AR Foundation,914,2435,https://avatars.githubusercontent.com/u/426196?v=4
185478059,opentelemetry-dotnet,open-telemetry/opentelemetry-dotnet,C#,7,The OpenTelemetry .NET Client,583,2281,https://avatars.githubusercontent.com/u/49998002?v=4
370188376,RoundedTB,torchgm/RoundedTB,C#,6,"Add margins, rounded corners and segments to your taskbars!",150,2072,https://avatars.githubusercontent.com/u/31840547?u=9fa4ec223ee2f981b47f9927e2fc81ab9970807e&v=4
609844970,AIShader,keijiro/AIShader,C#,317,ChatGPT-powered shader generator for Unity,90,1052,https://avatars.githubusercontent.com/u/343936?u=b6fa096837340c2b4783bbf3b3ec88f8387d1849&v=4
126898329,PowerApps-Samples,microsoft/PowerApps-Samples,C#,1,"Sample code for Power Apps, including Dataverse, model-driven apps, canvas apps, Power Apps component framework, portals, and ai-builder.",1399,1020,https://avatars.githubusercontent.com/u/6154722?v=4
591430510,CFScanner,MortezaBashsiz/CFScanner,C#,15,Cloud Flare scanner,148,694,https://avatars.githubusercontent.com/u/19620677?u=aecc7e859586537a26d577c6b354d3a9b757dd65&v=4
304453048,VpnHood,vpnhood/VpnHood,C#,7,Undetectable Fast Portable VPN,104,541,https://avatars.githubusercontent.com/u/72891211?v=4
111510915,dotnet-api-docs,dotnet/dotnet-api-docs,C#,2,".NET API reference documentation (.NET 5+, .NET Core, .NET Framework)",1375,519,https://avatars.githubusercontent.com/u/9141961?v=4
610195972,Melon,azzu0/Melon,C#,1,MelonLoader but for an 4nime g4me,11,22,https://avatars.githubusercontent.com/u/121842489?v=4
