id,name,full_name,language,new stars,description,forks_count,stargazers_count,avatar_url
13491895,free-programming-books,EbookFoundation/free-programming-books,,6543,:books: Freely available programming books,49874,242064,https://avatars.githubusercontent.com/u/14127308?v=4
60493101,coding-interview-university,jwasham/coding-interview-university,,4479,A complete computer science study plan to become a software engineer.,60931,226163,https://avatars.githubusercontent.com/u/3771963?u=4b348c742192b1963aabbf803a1174d2a4de155a&v=4
21737465,awesome,sindresorhus/awesome,,5561,😎 Awesome lists about all kinds of interesting topics,23832,210620,https://avatars.githubusercontent.com/u/170270?u=34acd557a042ac478d273a4621570cadb6b0bd89&v=4
112507086,30-seconds-of-code,30-seconds/30-seconds-of-code,JavaScript,3545,Short JavaScript code snippets for all your development needs,10481,100114,https://avatars.githubusercontent.com/u/43479428?v=4
16408992,neovim,neovim/neovim,Vim script,1429,Vim-fork focused on extensibility and usability,3971,55848,https://avatars.githubusercontent.com/u/6471485?v=4
257485422,vite,vitejs/vite,TypeScript,1733,Next generation frontend tooling. It's fast!,3622,44797,https://avatars.githubusercontent.com/u/65625612?v=4
162998479,sherlock,sherlock-project/sherlock,Python,1682,🔎 Hunt down social media accounts by username across social networks,3942,34072,https://avatars.githubusercontent.com/u/48293496?v=4
40997482,vim,vim/vim,Vim script,708,The official Vim repository,4300,27955,https://avatars.githubusercontent.com/u/11618545?v=4
42489829,rustlings,rust-lang/rustlings,Rust,2116,:crab: Small exercises to get you used to reading and writing Rust code!,4299,27268,https://avatars.githubusercontent.com/u/5430905?v=4
237791077,diagrams,mingrammer/diagrams,Python,6123,:art: Diagram as Code for prototyping cloud system architectures,1479,24603,https://avatars.githubusercontent.com/u/6178510?u=f9940c5492bc7ede04a9f2ea7df3aae973e45165&v=4
101782647,fairseq,facebookresearch/fairseq,Python,1314,Facebook AI Research Sequence-to-Sequence Toolkit written in Python.,4720,18535,https://avatars.githubusercontent.com/u/16943930?v=4
196760810,linkedin-skill-assessments-quizzes,Ebazhanov/linkedin-skill-assessments-quizzes,,1132,"Full reference of LinkedIn answers 2022 for skill assessments (aws-lambda, rest-api, javascript, react, git, html, jquery, mongodb, java, Go, python, machine-learning, power-point) linkedin excel test lösungen, linkedin machine learning test LinkedIn test questions and answers ",9015,16425,https://avatars.githubusercontent.com/u/13170022?u=3947478ed6fd9a0be9a0cd5f46c2d2316c1d2503&v=4
40276274,zig,ziglang/zig,Zig,1890,"General-purpose programming language and toolchain for maintaining robust, optimal, and reusable software.",1237,16073,https://avatars.githubusercontent.com/u/27973237?v=4
323048702,OpenBBTerminal,OpenBB-finance/OpenBBTerminal,Python,802,"Investment Research for Everyone, Anywhere.",1410,12996,https://avatars.githubusercontent.com/u/80064875?v=4
372240402,bulletproof-react,alan2207/bulletproof-react,TypeScript,1440,"🛡️ ⚛️ A simple, scalable, and powerful architecture for building production ready React applications. ",955,12738,https://avatars.githubusercontent.com/u/12713315?u=524f8d6767ac109d7f7eb0a030f46b0ed7603d29&v=4
208728772,milvus,milvus-io/milvus,Go,769,Vector database for scalable similarity search and AI applications.,1612,11347,https://avatars.githubusercontent.com/u/51735404?v=4
161951219,wails,wailsapp/wails,Go,2148,Create beautiful applications using Go,458,9565,https://avatars.githubusercontent.com/u/39746503?v=4
365263843,fresh,denoland/fresh,TypeScript,5296,The next-gen web framework.,254,7658,https://avatars.githubusercontent.com/u/42048915?v=4
241176242,a-picture-is-worth-a-1000-words,girliemac/a-picture-is-worth-a-1000-words,,3879,I am trying to describe complex matters in simple doodles!,504,6879,https://avatars.githubusercontent.com/u/107763?u=ef06484010f9aafe44a8258d15e45ffb3a1dd3c6&v=4
182849188,delta,delta-io/delta,Scala,541,This connector allows Apache Spark™ to read from and write to Delta Lake.,1119,4982,https://avatars.githubusercontent.com/u/49767398?v=4
330914717,ivy,unifyai/ivy,Python,1544,The Unified Machine Learning Framework,1115,4155,https://avatars.githubusercontent.com/u/63879146?v=4
402945349,starrocks,StarRocks/starrocks,C++,338,"StarRocks is a next-gen sub-second MPP database for full analytics scenarios, including multi-dimensional analytics, real-time analytics and ad-hoc query.",650,2986,https://avatars.githubusercontent.com/u/88238841?v=4
390607649,spring-cloud-tencent,Tencent/spring-cloud-tencent,Java,1542,Spring Cloud Tencent is a Spring Boot based Service Governance Framework provided by Tencent.,318,2078,https://avatars.githubusercontent.com/u/18461506?v=4
461824274,dotfiles,rxyhn/dotfiles,Lua,1029,My awesomewm dotfiles for awesome people! ✨,114,1971,https://avatars.githubusercontent.com/u/93292023?u=cad17e492034b237a6006e14a1ad8904f34b95ac&v=4
490465859,Flipper,UberGuidoZ/Flipper,Python,334,Playground (and dump) of stuff I make or modify for the Flipper Zero,78,610,https://avatars.githubusercontent.com/u/57457139?u=3b283c3083a1fee457b897d7c8fda97b873e9807&v=4
