id,name,full_name,language,new stars,description,forks_count,stargazers_count,avatar_url
199570071,v2rayN,2dust/v2rayN,C#,931,"A V2Ray client for Windows, support Xray core and v2fly core",6199,30380,https://avatars.githubusercontent.com/u/31833384?v=4
38380854,dnSpy,dnSpy/dnSpy,C#,284,.NET debugger and assembly editor,4150,21220,https://avatars.githubusercontent.com/u/67931932?v=4
13428264,ShareX,ShareX/ShareX,C#,726,"ShareX is a free and open source program that lets you capture or record any area of your screen and share it with a single press of a key. It also allows uploading images, text or other types of files to many supported destinations you can choose from.",2586,20715,https://avatars.githubusercontent.com/u/5548736?v=4
29078997,roslyn,dotnet/roslyn,C#,152,The Roslyn .NET compiler provides C# and Visual Basic languages with rich code analysis APIs.,3646,16145,https://avatars.githubusercontent.com/u/9141961?v=4
16157746,efcore,dotnet/efcore,C#,118,"EF Core is a modern object-database mapper for .NET. It supports LINQ queries, change tracking, updates, and schema migrations.",2800,11479,https://avatars.githubusercontent.com/u/9141961?v=4
28239455,AspNetCore.Docs,dotnet/AspNetCore.Docs,C#,132,Documentation for ASP.NET Core,24504,10685,https://avatars.githubusercontent.com/u/9141961?v=4
210716005,runtime,dotnet/runtime,C#,289,".NET is a cross-platform runtime for cloud, mobile, desktop, and IoT apps.",3275,9507,https://avatars.githubusercontent.com/u/9141961?v=4
165548191,PEASS-ng,carlospolop/PEASS-ng,C#,551,PEASS - Privilege Escalation Awesome Scripts SUITE (with colors),2262,9517,https://avatars.githubusercontent.com/u/17181413?u=7bab6cb28b2c583ee1f5f6ce8b3e0195601b6dde&v=4
3476845,Newtonsoft.Json,JamesNK/Newtonsoft.Json,C#,100,Json.NET is a popular high-performance JSON framework for .NET,3054,9436,https://avatars.githubusercontent.com/u/303201?u=a4521438844aae7f844f8717a79a9858d6c805da&v=4
213460285,CleanArchitecture,jasontaylordev/CleanArchitecture,C#,258,Clean Architecture Solution Template for .NET 6,2079,9089,https://avatars.githubusercontent.com/u/1988321?u=f96f36eed8f5bc57c4aab7213306f960efc072b1&v=4
44897462,ArchiSteamFarm,JustArchiNET/ArchiSteamFarm,C#,276,C# application with primary purpose of farming Steam cards from multiple accounts simultaneously.,922,8306,https://avatars.githubusercontent.com/u/40950157?v=4
201188122,lively,rocksdanister/lively,C#,496,Free and open-source software that allows users to set animated desktop wallpapers and screensavers.,666,7883,https://avatars.githubusercontent.com/u/17554161?u=8e8419fd0693513282e55e212a0ef21e58310687&v=4
743436,ET,egametang/ET,C#,150,Unity3D Client And C# Server Framework,2254,5967,https://avatars.githubusercontent.com/u/315758?v=4
441460974,PDFPatcher,wmjordan/PDFPatcher,C#,555,PDF补丁丁——PDF工具箱，可以编辑书签、剪裁旋转页面、解除限制、提取或合并文档，探查文档结构，提取图片、转成图片等等,1006,5949,https://avatars.githubusercontent.com/u/12182730?u=57bbd0642728592e67379ad8fd3ed818a350eece&v=4
50605426,MixedRealityToolkit-Unity,microsoft/MixedRealityToolkit-Unity,C#,86,Mixed Reality Toolkit (MRTK) provides a set of components and features to accelerate cross-platform MR app development in Unity.,1993,5237,https://avatars.githubusercontent.com/u/6154722?v=4
366663429,jynew,jynew/jynew,C#,221,金庸群侠传3D重制版,1114,5126,https://avatars.githubusercontent.com/u/82129705?v=4
125612271,EntityComponentSystemSamples,Unity-Technologies/EntityComponentSystemSamples,C#,58,,1063,4498,https://avatars.githubusercontent.com/u/426196?v=4
187499284,UniTask,Cysharp/UniTask,C#,248,Provides an efficient allocation free async/await integration for Unity.,374,3543,https://avatars.githubusercontent.com/u/44487420?v=4
23891194,azure-powershell,Azure/azure-powershell,C#,64,Microsoft Azure PowerShell,3095,3185,https://avatars.githubusercontent.com/u/6844498?v=4
158405551,git-credential-manager,GitCredentialManager/git-credential-manager,C#,222,"Secure, cross-platform Git credential storage with authentication to GitHub, Azure Repos, and other popular Git hosting services.",591,2820,https://avatars.githubusercontent.com/u/64464614?v=4
39425864,tModLoader,tModLoader/tModLoader,C#,146,A mod to make and play Terraria mods. Supports Terraria 1.4 (and earlier) installations ,1459,2696,https://avatars.githubusercontent.com/u/36521970?v=4
209623885,ViVe,thebookisclosed/ViVe,C#,242,C# library and console app for using new feature control APIs available in Windows 10 version 2004 and newer,100,1306,https://avatars.githubusercontent.com/u/13197516?u=8520083385e3527426d638b30974c2bb06b2d25d&v=4
255952484,maui-samples,dotnet/maui-samples,C#,123,Samples for .NET Multi-Platform App UI (.NET MAUI),219,1168,https://avatars.githubusercontent.com/u/9141961?v=4
278114481,MediaPipeUnityPlugin,homuler/MediaPipeUnityPlugin,C#,48,Unity plugin to run MediaPipe graphs,232,806,https://avatars.githubusercontent.com/u/4690128?u=ca93281e9656e9e837580143d03034157def787c&v=4
491611289,GI_Assets,zeroruka/GI_Assets,C#,181,"Character textures, models and mods for a certain anime game. ",193,349,https://avatars.githubusercontent.com/u/89210318?u=4c1ea716fabfa2bc88f7a92098443a810ff8f5e3&v=4
