id,name,full_name,language,new stars,description,forks_count,stargazers_count,avatar_url
2325298,linux,torvalds/linux,C,1783,Linux kernel source tree,43552,134017,https://avatars.githubusercontent.com/u/1024025?v=4
111583593,scrcpy,Genymobile/scrcpy,C,1420,Display and control your Android device,7212,67108,https://avatars.githubusercontent.com/u/3427627?v=4
156018,redis,redis/redis,C,651,"Redis is an in-memory database that persists on disk. The data model is key-value, but many different kind of values are supported: Strings, Lists, Sets, Sorted Sets, Hashes, Streams, HyperLogLogs, Bitmaps.",21456,55750,https://avatars.githubusercontent.com/u/1529926?v=4
13233158,obs-studio,obsproject/obs-studio,C,809,OBS Studio - Free and open source software for live streaming and screen recording,6016,39340,https://avatars.githubusercontent.com/u/7725691?v=4
569041,curl,curl/curl,C,439,"A command line tool and library for transferring data with URL syntax, supporting DICT, FILE, FTP, FTPS, GOPHER, GOPHERS, HTTP, HTTPS, IMAP, IMAPS, LDAP, LDAPS, MQTT, POP3, POP3S, RTMP, RTMPS, RTSP, SCP, SFTP, SMB, SMBS, SMTP, SMTPS, TELNET and TFTP. libcurl offers a myriad of powerful features",5146,25608,https://avatars.githubusercontent.com/u/16928085?v=4
2810292,rufus,pbatard/rufus,C,460,The Reliable USB Formatting Utility,1971,18842,https://avatars.githubusercontent.com/u/1206968?u=ed1be5451352656cffecc840d661bb793c3bad05&v=4
29759715,zstd,facebook/zstd,C,238,Zstandard - Fast real-time compression algorithm,1662,17151,https://avatars.githubusercontent.com/u/69631?v=4
15337142,micropython,micropython/micropython,C,337,MicroPython - a lean and efficient Python implementation for microcontrollers and constrained systems,5507,14547,https://avatars.githubusercontent.com/u/6298560?v=4
179354282,OpenCorePkg,acidanthera/OpenCorePkg,C,204,OpenCore bootloader,1754,9720,https://avatars.githubusercontent.com/u/39672954?v=4
65899476,esp-idf,espressif/esp-idf,C,189,Espressif IoT Development Framework. Official development framework for Espressif SoCs.,5548,8695,https://avatars.githubusercontent.com/u/9460735?v=4
50824485,systeminformer,winsiderss/systeminformer,C,436,"A free, powerful, multi-purpose tool that helps you monitor system resources, debug software and detect malware. Brought to you by Winsider Seminars & Solutions, Inc. @ http://www.windows-internals.com",1080,7675,https://avatars.githubusercontent.com/u/105516054?v=4
272457606,cosmopolitan,jart/cosmopolitan,C,409,build-once run-anywhere c library,225,7362,https://avatars.githubusercontent.com/u/49262?u=ac68933ab61c639ab59ae693a41ae89cd874c16e&v=4
50874442,citus,citusdata/citus,C,630,Distributed PostgreSQL as an extension,486,6784,https://avatars.githubusercontent.com/u/2545424?v=4
91493088,GoodbyeDPI,ValdikSS/GoodbyeDPI,C,308,GoodbyeDPI — Deep Packet Inspection circumvention utility (for Windows),690,6648,https://avatars.githubusercontent.com/u/3054729?u=db712da584cc0d21a860b786b9ab2f2323758598&v=4
59771425,zephyr,zephyrproject-rtos/zephyr,C,130,"Primary Git Repository for the Zephyr Project. Zephyr is a new generation, scalable, optimized, secure RTOS for multiple hardware architectures.",3937,6255,https://avatars.githubusercontent.com/u/19595895?v=4
213916896,blender,blender/blender,C,275,Official mirror of Blender,1059,5928,https://avatars.githubusercontent.com/u/52924476?v=4
241659610,itlwm,OpenIntelWireless/itlwm,C,106,Intel Wi-Fi Drivers for macOS,558,5563,https://avatars.githubusercontent.com/u/67850724?v=4
44781140,gpdb,greenplum-db/gpdb,C,70,"Greenplum Database - Massively Parallel PostgreSQL for Analytics. An open-source massively parallel data platform for analytics, machine learning and AI.",1484,5259,https://avatars.githubusercontent.com/u/14097842?v=4
40556106,wazuh,wazuh/wazuh,C,754,Wazuh - The Open Source Security Platform,796,4426,https://avatars.githubusercontent.com/u/13752566?v=4
101866073,AliOS-Things,alibaba/AliOS-Things,C,47,面向IoT领域的、高可伸缩的物联网操作系统，可去官网了解更多信息https://www.aliyun.com/product/aliosthings,1034,4239,https://avatars.githubusercontent.com/u/1961952?v=4
469303019,ecapture,ehids/ecapture,C,653,"capture SSL/TLS text content without CA cert using eBPF. supports Linux x86_64/Aarch64, Android(GKI) Aarch64.",424,3865,https://avatars.githubusercontent.com/u/95527736?v=4
184654298,wasm-micro-runtime,bytecodealliance/wasm-micro-runtime,C,72,WebAssembly Micro Runtime (WAMR),348,2853,https://avatars.githubusercontent.com/u/54038801?v=4
200663555,liburing,axboe/liburing,C,83,,225,1437,https://avatars.githubusercontent.com/u/2619634?v=4
207354223,FreeRTOS-Kernel,FreeRTOS/FreeRTOS-Kernel,C,48,"FreeRTOS kernel files only, submoduled into https://github.com/FreeRTOS/FreeRTOS and various other repos.",586,1073,https://avatars.githubusercontent.com/u/54647343?v=4
442041737,Onion,jimgraygit/Onion,C,125,Stock OS overhaul for Miyoo Mini ,30,462,https://avatars.githubusercontent.com/u/85693713?v=4
