id,name,full_name,language,new stars,description,forks_count,stargazers_count,avatar_url
1863329,laravel,laravel/laravel,PHP,469,"Laravel is a web application framework with expressive, elegant syntax. We’ve already laid the foundation for your next big idea — freeing you to create without sweating the small things.",22775,70292,https://avatars.githubusercontent.com/u/958072?v=4
7548986,framework,laravel/framework,PHP,261,The Laravel Framework.,9347,27381,https://avatars.githubusercontent.com/u/958072?v=4
1864363,composer,composer/composer,PHP,134,Dependency Manager for PHP,6380,26715,https://avatars.githubusercontent.com/u/837015?v=4
1420053,guzzle,guzzle/guzzle,PHP,89,"Guzzle, an extensible PHP HTTP client",2312,21956,https://avatars.githubusercontent.com/u/638632?v=4
2253830,PHPMailer,PHPMailer/PHPMailer,PHP,142,The classic email sending library for PHP,9305,18428,https://avatars.githubusercontent.com/u/3959702?v=4
12615154,laravel-debugbar,barryvdh/laravel-debugbar,PHP,142,Laravel Debugbar (Integrates PHP Debug Bar),1386,14199,https://avatars.githubusercontent.com/u/973269?u=5c91f55a44fa388c096c4d77111346dee758bd44&v=4
13899674,flysystem,thephpleague/flysystem,PHP,43,Abstraction for local and remote filesystems,745,12525,https://avatars.githubusercontent.com/u/527621?v=4
42480275,laravel-permission,spatie/laravel-permission,PHP,90,Associate users with roles and permissions,1592,10540,https://avatars.githubusercontent.com/u/7535935?v=4
2884111,magento2,magento/magento2,PHP,60,"All Submissions you make to Magento Inc. (""Magento"") through GitHub are subject to the following terms and conditions: (1) You grant Magento a perpetual, worldwide, non-exclusive, no charge, royalty free, irrevocable license under your applicable copyrights and patents to reproduce, prepare derivative works of, display, publically perform, sublicense and distribute any feedback, ideas, code, or other information (“Submission"") you submit through GitHub. (2) Your Submission is an original work of authorship and you are the owner or are legally entitled to grant the license stated above. (3) You agree to the Contributor License Agreement found here:  https://github.com/magento/magento2/blob/master/CONTRIBUTOR_LICENSE_AGREEMENT.html",8939,10132,https://avatars.githubusercontent.com/u/168457?v=4
2699935,PHP_CodeSniffer,squizlabs/PHP_CodeSniffer,PHP,135,PHP_CodeSniffer tokenizes PHP files and detects violations of a defined set of coding standards.,1450,9530,https://avatars.githubusercontent.com/u/997547?v=4
6660366,dompdf,dompdf/dompdf,PHP,104,HTML to PDF converter for PHP,1656,8963,https://avatars.githubusercontent.com/u/2776605?v=4
2179920,woocommerce,woocommerce/woocommerce,PHP,189,"A customizable, open-source eCommerce platform built on WordPress. Build any commerce solution you can imagine.",10292,8046,https://avatars.githubusercontent.com/u/473596?v=4
6763587,PrestaShop,PrestaShop/PrestaShop,PHP,40,"PrestaShop is an Open Source e-commerce platform, committed to providing the best shopping cart experience for both merchants and customers.",4396,6536,https://avatars.githubusercontent.com/u/2815696?v=4
14716368,invoiceninja,invoiceninja/invoiceninja,PHP,56,"Invoices, Expenses and Tasks built with Laravel and Flutter",1967,6542,https://avatars.githubusercontent.com/u/15712270?v=4
14346979,snipe-it,snipe/snipe-it,PHP,227,A free open source IT asset/license management system,2216,6400,https://avatars.githubusercontent.com/u/197404?u=3a3faa7eb52d0ccb5d757cab2633677328bbffb2&v=4
9826184,elasticsearch-php,elastic/elasticsearch-php,PHP,29,Official PHP client for Elasticsearch.,933,4907,https://avatars.githubusercontent.com/u/6764390?v=4
74386167,psalm,vimeo/psalm,PHP,56,A static analysis tool for finding errors in PHP applications,537,4836,https://avatars.githubusercontent.com/u/317769?v=4
60010673,elementor,elementor/elementor,PHP,46,"The most advanced frontend drag & drop page builder. Create high-end, pixel perfect websites at record speeds. Any theme, any page, any design.",1118,4489,https://avatars.githubusercontent.com/u/47606894?v=4
47508644,panel,pterodactyl/panel,PHP,375,"Pterodactyl® is a free, open-source game server management panel built with PHP, React, and Go. Designed with security in mind, Pterodactyl runs all game servers in isolated Docker containers while exposing a beautiful and intuitive UI to end users.",1030,3957,https://avatars.githubusercontent.com/u/16179146?v=4
248372441,filament,filamentphp/filament,PHP,325,"Admin panel, form builder and table builder for Laravel. Built with the TALL stack. Designed for humans.",507,3858,https://avatars.githubusercontent.com/u/64450473?v=4
291805291,jetstream,laravel/jetstream,PHP,39,Tailwind scaffolding for the Laravel framework.,661,3367,https://avatars.githubusercontent.com/u/958072?v=4
141720301,countries-states-cities-database,dr5hn/countries-states-cities-database,PHP,173,"🌍 World countries, states, regions, provinces, cities, towns in JSON, SQL, XML, YAML, and CSV. All Countries, States, Cities with ISO2, ISO3, Country Code, Phone Code, Capital, Native Language, Timezones, Latitude, Longitude, Region, Subregion, Flag Emoji, and Currency. #countries #states #cities",1484,3374,https://avatars.githubusercontent.com/u/6929121?u=71cfda00052973345244b2831e50aac7c83c0415&v=4
69691727,PocketMine-MP,pmmp/PocketMine-MP,PHP,45,A server software for Minecraft: Bedrock Edition in PHP,1602,2836,https://avatars.githubusercontent.com/u/22548559?v=4
443605948,ProxiTok,pablouser1/ProxiTok,PHP,201,Open source alternative frontend for TikTok made using PHP,46,604,https://avatars.githubusercontent.com/u/17802865?v=4
