id,name,full_name,language,new stars,description,forks_count,stargazers_count,avatar_url
1863329,laravel,laravel/laravel,PHP,517,"Laravel is a web application framework with expressive, elegant syntax. We’ve already laid the foundation for your next big idea — freeing you to create without sweating the small things.",23366,72422,https://avatars.githubusercontent.com/u/958072?v=4
7548986,framework,laravel/framework,PHP,294,The Laravel Framework.,9875,28946,https://avatars.githubusercontent.com/u/958072?v=4
448045,phpunit,sebastianbergmann/phpunit,PHP,108,The PHP Unit Testing framework.,2135,18926,https://avatars.githubusercontent.com/u/25218?u=01bb70d9be43ded7572eb3862127ff281daa2725&v=4
12615154,laravel-debugbar,barryvdh/laravel-debugbar,PHP,148,Debugbar for Laravel (Integrates PHP Debug Bar),1449,14901,https://avatars.githubusercontent.com/u/973269?u=5c91f55a44fa388c096c4d77111346dee758bd44&v=4
8678290,laravel-ide-helper,barryvdh/laravel-ide-helper,PHP,95,IDE Helper for Laravel,1110,12903,https://avatars.githubusercontent.com/u/973269?u=5c91f55a44fa388c096c4d77111346dee758bd44&v=4
41589337,BookStack,BookStackApp/BookStack,PHP,277,A platform to create documentation/wiki content built with PHP & Laravel,1460,10989,https://avatars.githubusercontent.com/u/20912696?v=4
597887,orm,doctrine/orm,PHP,60,Doctrine Object Relational Mapper (ORM),2458,9512,https://avatars.githubusercontent.com/u/209254?v=4
6660366,dompdf,dompdf/dompdf,PHP,96,HTML to PDF converter for PHP,1720,9442,https://avatars.githubusercontent.com/u/2776605?v=4
3217621,phpmyadmin,phpmyadmin/phpmyadmin,PHP,72,A web interface for MySQL and MariaDB,3275,6432,https://avatars.githubusercontent.com/u/1351977?v=4
95011974,akaunting,akaunting/akaunting,PHP,119,Free and Online Accounting Software,2029,5960,https://avatars.githubusercontent.com/u/26357771?v=4
14075080,bedrock,roots/bedrock,PHP,35,"WordPress boilerplate with Composer, easier configuration, and an improved folder structure",1135,5726,https://avatars.githubusercontent.com/u/4986074?v=4
47508644,panel,pterodactyl/panel,PHP,142,"Pterodactyl® is a free, open-source game server management panel built with PHP, React, and Go. Designed with security in mind, Pterodactyl runs all game servers in isolated Docker containers while exposing a beautiful and intuitive UI to end users.",1212,4691,https://avatars.githubusercontent.com/u/16179146?v=4
439861,moodle,moodle/moodle,PHP,58,Moodle - the world's open source learning platform,5839,4545,https://avatars.githubusercontent.com/u/168672?v=4
1957456,dolibarr,Dolibarr/dolibarr,PHP,98,"Dolibarr ERP CRM is a modern software package to manage your company or foundation's activity (contacts, suppliers, invoices, orders, stocks, agenda, accounting, ...). It is open source software (written in PHP) and designed for small and medium businesses, foundations and freelancers. You can freely install, use and distribute it as a standalone application or as a web application to use it from every internet access and media.",2251,3786,https://avatars.githubusercontent.com/u/877491?v=4
73781385,platform,orchidsoftware/platform,PHP,88,"Orchid is a @laravel package that allows for rapid application development of back-office applications, admin/user panels, and dashboards.",565,3533,https://avatars.githubusercontent.com/u/16124498?v=4
13044600,SuiteCRM,salesagility/SuiteCRM,PHP,67,SuiteCRM - Open source CRM for the world,1739,3355,https://avatars.githubusercontent.com/u/1450870?v=4
400984450,dootask,kuaifan/dootask,PHP,222,DooTask是一款轻量级的开源在线项目任务管理工具，提供各类文档协作工具、在线思维导图、在线流程图、项目管理、任务分发、即时IM，文件管理等工具。,689,3232,https://avatars.githubusercontent.com/u/36875852?u=379dd42f7823a7747859b4845b873bfe1af254e0&v=4
13914116,librenms,librenms/librenms,PHP,72,Community-based GPL-licensed network monitoring system,2022,3075,https://avatars.githubusercontent.com/u/5791783?v=4
39182755,glpi,glpi-project/glpi,PHP,60,"GLPI is a Free Asset and IT Management Software package, Data center management, ITIL Service Desk, licenses tracking and software auditing.",999,3000,https://avatars.githubusercontent.com/u/13361707?v=4
311448648,breeze,laravel/breeze,PHP,40,"Minimal Laravel authentication scaffolding with Blade, Vue, or React + Tailwind.",332,2153,https://avatars.githubusercontent.com/u/958072?v=4
131995661,platform,shopware/platform,PHP,28,Shopware 6 is an open commerce platform based on Symfony Framework and Vue and supported by a worldwide community and more than 1.500 community extensions,826,2145,https://avatars.githubusercontent.com/u/612628?v=4
679584,openemr,openemr/openemr,PHP,41,The most popular open source electronic health records and medical practice management solution.,1625,2129,https://avatars.githubusercontent.com/u/283089?v=4
75645659,wordpress-develop,WordPress/wordpress-develop,PHP,48,"WordPress Develop, Git-ified. Synced from git://develop.git.wordpress.org/, including branches and tags! This repository is just a mirror of the WordPress subversion repository. Please include a link to a pre-existing ticket on https://core.trac.wordpress.org/ with every pull request.",1700,1788,https://avatars.githubusercontent.com/u/276006?v=4
433383766,all-in-one,nextcloud/all-in-one,PHP,193,Nextcloud AIO stands for Nextcloud All In One and provides easy deployment and maintenance with most features included in this one Nextcloud instance.,213,1377,https://avatars.githubusercontent.com/u/19211038?v=4
440520058,open-ai,orhanerday/open-ai,PHP,252,"OpenAI PHP SDK : Most downloaded, forked, contributed, huge community supported, and used PHP (Laravel , Symfony, Yii, Cake PHP or any PHP framework) SDK for OpenAI GPT-3 and DALL-E. It also supports chatGPT-like streaming.",98,804,https://avatars.githubusercontent.com/u/22305274?u=bffc3f07793066adf6c46cc6495a5e709bf04fa8&v=4
