id,name,full_name,language,new stars,description,forks_count,stargazers_count,avatar_url
1700621,normalize.css,necolas/normalize.css,CSS,9,A modern alternative to CSS resets,10734,51688,https://avatars.githubusercontent.com/u/239676?u=4b545d3dd62d217b40a624ebbe987cfc67e73803&v=4
5362524,source-code-pro,adobe-fonts/source-code-pro,CSS,6,Monospaced font family for user interface and coding environments,1628,19569,https://avatars.githubusercontent.com/u/4028872?v=4
49767244,primeng,primefaces/primeng,CSS,7,The Most Complete Angular UI Component Library,4419,9297,https://avatars.githubusercontent.com/u/3494069?v=4
7517918,spring-petclinic,spring-projects/spring-petclinic,CSS,6,A sample Spring-based application,22230,7167,https://avatars.githubusercontent.com/u/317776?v=4
160313905,primevue,primefaces/primevue,CSS,15,Next Generation Vue UI Component Library,968,7162,https://avatars.githubusercontent.com/u/3494069?v=4
329751286,youtube,safak/youtube,CSS,6,,5288,4797,https://avatars.githubusercontent.com/u/1486366?u=c367d218a8cf89ad09c3dbfb3c7ad7a929142f20&v=4
282550237,obsidian-minimal,kepano/obsidian-minimal,CSS,5,A distraction-free and highly customizable theme for Obsidian.,179,3264,https://avatars.githubusercontent.com/u/10565871?u=331db9a72c1d1d7ff58c32b3e7236fd6d2753527&v=4
10321675,the-internet,saucelabs/the-internet,CSS,1,An example application that captures prominent and ugly functionality found on the web. Perfect for writing automated acceptance tests against.,590,741,https://avatars.githubusercontent.com/u/88837?v=4
525270566,springsecurity6,eazybytes/springsecurity6,CSS,2,"Spring Security Zero to Master along with JWT, OAUTH2 - Code Examples",529,428,https://avatars.githubusercontent.com/u/79041235?u=8c44655cb8f59240f224bf58ff8ff996c56483b6&v=4
730105421,hugging-multi-agent,datawhalechina/hugging-multi-agent,CSS,28,A tutorial based on MetaGPT to quickly help you understand the concept of agent and muti-agent and get started with coding development,61,395,https://avatars.githubusercontent.com/u/46047812?v=4
560376505,sakai-vue,primefaces/sakai-vue,CSS,2,,198,347,https://avatars.githubusercontent.com/u/3494069?v=4
668453226,hextra,imfing/hextra,CSS,4,"🔯 Modern, batteries-included Hugo theme for creating beautiful doc, blog and static websites",92,298,https://avatars.githubusercontent.com/u/5097752?u=2c29af47e2785926f25bb4745bd63c7e3ea8482d&v=4
559941751,nlw-10-copa,maykbrito/nlw-10-copa,CSS,1,Calendário pessoal de jogos da Copa 2022,479,57,https://avatars.githubusercontent.com/u/6643122?u=1d043ff00f27f67273252b796cc9f4d24b38b809&v=4
772000647,react-poke,TheBridge-FullStackDeveloper/react-poke,CSS,1,,27,1,https://avatars.githubusercontent.com/u/62714526?v=4
