id,name,full_name,language,new stars,description,forks_count,stargazers_count,avatar_url
54346799,public-apis,public-apis/public-apis,Python,10683,A collective list of free APIs,17645,155795,https://avatars.githubusercontent.com/u/51121562?v=4
3638964,ansible,ansible/ansible,Python,539,"Ansible is a radically simple IT automation platform that makes your applications and systems easier to deploy and maintain. Automate everything from code deployment to network configuration to cloud management, in a language that approaches plain English, using SSH, with no agents to install on remote systems. https://docs.ansible.com.",21030,49767,https://avatars.githubusercontent.com/u/1507452?v=4
5483330,you-get,soimort/you-get,Python,475,:arrow_double_down: Dumb downloader that scrapes the web,8537,41646,https://avatars.githubusercontent.com/u/342945?u=b401a4b8bb874adcdca99bc893488b86e476d428&v=4
71948498,localstack,localstack/localstack,Python,2364,💻  A fully functional local AWS cloud stack. Develop and test your cloud & Serverless apps offline!,2642,33965,https://avatars.githubusercontent.com/u/28732122?v=4
28751632,linux-insides,0xAX/linux-insides,Python,447,A little bit about a linux kernel,2716,23555,https://avatars.githubusercontent.com/u/2699235?u=6b9135d5c583701b84620f5dd84b3217aa588591&v=4
262296122,PaddleOCR,PaddlePaddle/PaddleOCR,Python,1618,"Awesome multilingual OCR toolkits based on PaddlePaddle （practical ultra lightweight OCR system, support 80+ languages recognition, provide data annotation and synthesis tools, support training and deployment among server, mobile, embedded and IoT devices）",3163,15244,https://avatars.githubusercontent.com/u/23534030?v=4
91629816,freqtrade,freqtrade/freqtrade,Python,1477,"Free, open source crypto trading bot",2551,11726,https://avatars.githubusercontent.com/u/37536846?v=4
300592907,GHunt,mxrch/GHunt,Python,526,🕵️‍♂️ Investigate Google emails and documents.,797,10140,https://avatars.githubusercontent.com/u/17338428?u=39dc96fa42eb8106c9a69a49e00f4226209adbc2&v=4
52796596,netbox,netbox-community/netbox,Python,544,Infrastructure resource modeling for network automation. Open source under Apache 2. Public demo: https://demo.netbox.dev,1610,8850,https://avatars.githubusercontent.com/u/44905828?v=4
41179827,discord.py,Rapptz/discord.py,Python,701,An API wrapper for Discord written in Python.,2787,8774,https://avatars.githubusercontent.com/u/1695103?v=4
120710644,ddia,Vonng/ddia,Python,777,《Designing Data-Intensive Application》DDIA中文翻译,1917,8621,https://avatars.githubusercontent.com/u/8587410?u=cf4bf2dc20cda87e09a0feff8b103fe8ec8bbb32&v=4
222751131,30-Days-Of-Python,Asabeneh/30-Days-Of-Python,Python,854,"30 days of Python programming challenge is a step-by-step guide to learn the Python programming language in 30 days. This challenge may take more than100 days, follow your own pace. ",1662,7469,https://avatars.githubusercontent.com/u/9008063?u=ec6ff77196b998a4e6b6e3ca1429c524c169c189&v=4
265122478,manim,ManimCommunity/manim,Python,2155,A community-maintained Python framework for creating mathematical animations. ,563,6775,https://avatars.githubusercontent.com/u/65579849?v=4
307260205,yt-dlp,yt-dlp/yt-dlp,Python,4650,A youtube-dl fork with additional features and fixes,336,5942,https://avatars.githubusercontent.com/u/79589310?v=4
196613241,binance-trade-bot,edeng23/binance-trade-bot,Python,313,Automated cryptocurrency trading bot,1216,4928,https://avatars.githubusercontent.com/u/14821747?u=817ea585f2d470ce269a93091e75236e55fb3e31&v=4
355959597,textual,willmcgugan/textual,Python,3122,Textual is a TUI (Text User Interface) framework for Python inspired by modern web development.,96,4600,https://avatars.githubusercontent.com/u/554369?u=8015a7d742d8bd7ee9d1efe30c138737d6098cd3&v=4
231972503,public-api-lists,public-api-lists/public-api-lists,Python,1657,A collective list of free APIs for use in software and web development 🚀 (Clone of https://github.com/public-apis/public-apis),174,3358,https://avatars.githubusercontent.com/u/59540994?v=4
349321229,GFPGAN,TencentARC/GFPGAN,Python,2272,GFPGAN aims at developing Practical Algorithms for Real-world Face Restoration.,427,3105,https://avatars.githubusercontent.com/u/83739826?v=4
246183538,Practical-Ethical-Hacking-Resources,TCM-Course-Resources/Practical-Ethical-Hacking-Resources,Python,788,Compilation of Resources from TCM's Practical Ethical Hacking Udemy Course ,607,2571,https://avatars.githubusercontent.com/u/74793658?v=4
193519496,OnlyFans,DIGITALCRIMINAL/OnlyFans,Python,695,Scrape all the media from an OnlyFans account - Updated regularly,353,2556,https://avatars.githubusercontent.com/u/21285176?u=485bf8339a547c38edf7f5e037d4f4774a5388f9&v=4
148657183,darts,unit8co/darts,Python,1195,A python library for easy manipulation and forecasting of time series.,178,2452,https://avatars.githubusercontent.com/u/39619745?v=4
253044228,nuclei-templates,projectdiscovery/nuclei-templates,Python,312,Community curated list of templates for the nuclei engine to find security vulnerabilities.,713,2232,https://avatars.githubusercontent.com/u/50994705?v=4
387326890,Real-ESRGAN,xinntao/Real-ESRGAN,Python,1272,Real-ESRGAN aims at developing Practical Algorithms for General Image Restoration.,145,1611,https://avatars.githubusercontent.com/u/17445847?u=dc0cf716873f6809f46f105917500699ae1aafd3&v=4
118317539,freqtrade-strategies,freqtrade/freqtrade-strategies,Python,115,Free trading strategies for Freqtrade bot,512,1394,https://avatars.githubusercontent.com/u/37536846?v=4
380526791,jd_cookie,Zy143L/jd_cookie,Python,262,Python练习,250,464,https://avatars.githubusercontent.com/u/21352718?u=815de1a950de267697970977cf2a85a1d2f4b26e&v=4
