id,name,full_name,language,new stars,description,forks_count,stargazers_count,avatar_url
156018,redis,redis/redis,C,19,"Redis is an in-memory database that persists on disk. The data model is key-value, but many different kind of values are supported: Strings, Lists, Sets, Sorted Sets, Hashes, Streams, HyperLogLogs, Bitmaps.",21701,56621,https://avatars.githubusercontent.com/u/1529926?v=4
36502,git,git/git,C,14,Git Source Code Mirror - This is a publish-only repository but pull requests can be turned into patches to the mailing list via GitGitGadget (https://gitgitgadget.github.io/). Please follow Documentation/SubmittingPatches procedure for any of your improvements.,23959,43417,https://avatars.githubusercontent.com/u/18133?v=4
13233158,obs-studio,obsproject/obs-studio,C,39,OBS Studio - Free and open source software for live streaming and screen recording,6196,41240,https://avatars.githubusercontent.com/u/7725691?v=4
102578345,lede,coolsnowwolf/lede,C,13,Lean's OpenWrt source,17914,22836,https://avatars.githubusercontent.com/u/31687149?u=caa956c5f80318ea674625f9e9efa49c98335d74&v=4
80286288,Tasmota,arendst/Tasmota,C,6,"Alternative firmware for ESP8266 with easy configuration using webUI, OTA updates, automation using timers or rules, expandability and entirely local control over MQTT, HTTP, Serial or KNX. Full documentation at",4048,18297,https://avatars.githubusercontent.com/u/11044339?u=b54c71859c551426b6738921138b740804ca1d62&v=4
47409672,hashcat,hashcat/hashcat,C,8,World's fastest and most advanced password recovery utility,2318,15260,https://avatars.githubusercontent.com/u/15949799?v=4
27737393,qmk_firmware,qmk/qmk_firmware,C,13,Open-source keyboard firmware for Atmel AVR and Arm USB families,28050,13192,https://avatars.githubusercontent.com/u/25358678?v=4
90320494,ish,ish-app/ish,C,2,Linux shell for iOS,683,12527,https://avatars.githubusercontent.com/u/38895825?v=4
45821540,openwrt,openwrt/openwrt,C,10,This repository is a mirror of https://git.openwrt.org/openwrt/openwrt.git It is for reference only and is not active for check-ins.  We will continue to accept Pull Requests here. They will be merged via staging trees then into openwrt.git.,7686,12490,https://avatars.githubusercontent.com/u/2528830?v=4
13836499,raylib,raysan5/raylib,C,10,A simple and easy-to-use library to enjoy videogames programming,1281,10583,https://avatars.githubusercontent.com/u/5766837?u=28d52cd1077b2f8b48d3897e82f03280a565e8d6&v=4
7715820,rofi,davatorium/rofi,C,11,"Rofi: A window switcher, application launcher and dmenu replacement",523,9797,https://avatars.githubusercontent.com/u/48837683?v=4
9524997,glfw,glfw/glfw,C,9,"A multi-platform library for OpenGL, OpenGL ES, Vulkan, window and input",3822,9536,https://avatars.githubusercontent.com/u/3905364?v=4
70127218,arduino-esp32,espressif/arduino-esp32,C,7,Arduino core for the ESP32,5878,9252,https://avatars.githubusercontent.com/u/9460735?v=4
272457606,cosmopolitan,jart/cosmopolitan,C,16,build-once run-anywhere c library,282,9025,https://avatars.githubusercontent.com/u/49262?u=ac68933ab61c639ab59ae693a41ae89cd874c16e&v=4
394318710,ExplorerPatcher,valinet/ExplorerPatcher,C,36,This project aims to enhance the working environment on Windows,443,7765,https://avatars.githubusercontent.com/u/6503598?u=25d850b7dcc57d2a488d83646fff7cca48cf7fc7&v=4
91493088,GoodbyeDPI,ValdikSS/GoodbyeDPI,C,6,GoodbyeDPI — Deep Packet Inspection circumvention utility (for Windows),724,7462,https://avatars.githubusercontent.com/u/3054729?u=db712da584cc0d21a860b786b9ab2f2323758598&v=4
40504480,xv6-public,mit-pdos/xv6-public,C,6,xv6 OS,3147,5773,https://avatars.githubusercontent.com/u/12404246?v=4
130578889,smartdns,pymumu/smartdns,C,10,A local DNS server to obtain the fastest website IP for the best Internet experience， 一个本地DNS服务器，获取最快的网站IP，获得最佳上网体验。,839,5284,https://avatars.githubusercontent.com/u/3275997?u=6eafad1c66232f210a74f5dda345195d16be8f07&v=4
59676171,klipper,Klipper3d/klipper,C,2,Klipper is a 3d-printer firmware,3587,5273,https://avatars.githubusercontent.com/u/90982958?v=4
330008801,SDL,libsdl-org/SDL,C,11,Simple Directmedia Layer,734,3734,https://avatars.githubusercontent.com/u/77683370?v=4
187042471,bytehound,koute/bytehound,C,29,A memory profiler for Linux.,122,3050,https://avatars.githubusercontent.com/u/246574?v=4
204459250,xv6-riscv,mit-pdos/xv6-riscv,C,8,Xv6 for RISC-V,995,2962,https://avatars.githubusercontent.com/u/12404246?v=4
257113637,minecraft-weekend,jdah/minecraft-weekend,C,1,"Minecraft, but I made it in 48 hours.",326,2920,https://avatars.githubusercontent.com/u/20308439?u=8e2b119cf048b01bd2fc2cbcf620cb1b8aebed74&v=4
531976789,TrollStore,opa334/TrollStore,C,248,Jailed iOS app that can install IPAs permanently with arbitary entitlements and root helpers because it trolls Apple,55,848,https://avatars.githubusercontent.com/u/18235760?v=4
403314395,1337-Piscine-42,48d31kh413k/1337-Piscine-42,C,3,June Piscine 2021 from 1337 Benguerir 42 Network.,89,204,https://avatars.githubusercontent.com/u/65833007?u=9be65d007cd7391e8ba5e099e47644a3aa9d918e&v=4
