id,name,full_name,language,new stars,description,forks_count,stargazers_count,avatar_url
119811010,tabler,tabler/tabler,HTML,317,Tabler is free and open-source HTML Dashboard UI Kit built on Bootstrap,2862,25124,https://avatars.githubusercontent.com/u/35471246?v=4
224663696,alpine,alpinejs/alpine,HTML,352,"A rugged, minimal framework for composing JavaScript behavior in your markup. ",877,19958,https://avatars.githubusercontent.com/u/59030169?v=4
75867720,JavaScript30,wesbos/JavaScript30,HTML,535,30 Day Vanilla JS Challenge,21700,18200,https://avatars.githubusercontent.com/u/176013?u=1d436e62dc32dbbf1bfefb4d658cd67553154c42&v=4
93253246,en.javascript.info,javascript-tutorial/en.javascript.info,HTML,499,Modern JavaScript Tutorial ,3014,16282,https://avatars.githubusercontent.com/u/49552305?v=4
30675533,fonts,google/fonts,HTML,136,"Font files available from Google Fonts, and a public issue tracker for all things Google Fonts",2359,15048,https://avatars.githubusercontent.com/u/1342004?v=4
1300192,Spoon-Knife,octocat/Spoon-Knife,HTML,227,This repo is for demonstration purposes only.,124352,10895,https://avatars.githubusercontent.com/u/583231?u=a59fef2a493e2b67dd13754231daf220c82ba84d&v=4
194216404,simplefolio,cobiwave/simplefolio,HTML,324,⚡️ A minimal portfolio template for Developers,3567,9723,https://avatars.githubusercontent.com/u/35739742?u=482b39ff7e32cbd71929743b45821bcab5e76cea&v=4
72586805,awesome-creative-coding,terkelg/awesome-creative-coding,HTML,211,"Creative Coding: Generative Art, Data visualization, Interaction Design, Resources.",719,9078,https://avatars.githubusercontent.com/u/2302254?u=fcf14e386c1f1667db828a14796e778efea2d487&v=4
62263938,computer-science-flash-cards,jwasham/computer-science-flash-cards,HTML,133,Mini website for testing both general CS knowledge and enforce coding practice and common algorithm/data structure memorization.,1662,6514,https://avatars.githubusercontent.com/u/3771963?u=4b348c742192b1963aabbf803a1174d2a4de155a&v=4
181746158,hyperblog,freddier/hyperblog,HTML,279,Un blog increíble para el curso de Git y Github de Platzi,8991,6055,https://avatars.githubusercontent.com/u/824191?u=b6489963b9bdf24377e1c4dacdf983426c2aaaeb&v=4
45870793,proposal-pipeline-operator,tc39/proposal-pipeline-operator,HTML,109,A proposal for adding a useful pipe operator to JavaScript.,104,6050,https://avatars.githubusercontent.com/u/1725583?v=4
246128823,html-css,gustavoguanabara/html-css,HTML,400,Curso de HTML5 e CSS3,1610,5590,https://avatars.githubusercontent.com/u/8683378?u=01b06a154f04dadaa4e4131497fa2442e6323cbc&v=4
11969507,html,whatwg/html,HTML,117,HTML Standard,2143,5394,https://avatars.githubusercontent.com/u/2226336?v=4
79055279,craftinginterpreters,munificent/craftinginterpreters,HTML,225,"Repository for the book ""Crafting Interpreters""",596,4693,https://avatars.githubusercontent.com/u/46275?v=4
53416555,learning-area,mdn/learning-area,HTML,99,Github repo for the MDN Learning Area. ,17350,4635,https://avatars.githubusercontent.com/u/7565578?v=4
125241352,tidytuesday,rfordatascience/tidytuesday,HTML,113,Official repo for the #tidytuesday project,1812,4494,https://avatars.githubusercontent.com/u/31736571?v=4
295774370,content,mdn/content,HTML,231,The content behind MDN Web Docs,6590,4308,https://avatars.githubusercontent.com/u/7565578?v=4
74809720,Dism-Multi-language,Chuyu-Team/Dism-Multi-language,HTML,444,Dism++ Multi-language Support & BUG Report,459,4131,https://avatars.githubusercontent.com/u/19919835?v=4
28312955,home-assistant.io,home-assistant/home-assistant.io,HTML,119,:blue_book: Home Assistant User documentation,5640,2593,https://avatars.githubusercontent.com/u/13844975?v=4
165360641,jekyll-theme-chirpy,cotes2020/jekyll-theme-chirpy,HTML,131,"A minimal, responsive, and powerful Jekyll theme for presenting professional writing",2298,1640,https://avatars.githubusercontent.com/u/11371340?u=082cc1c5d921b18f2ba2308237741a494146ea2f&v=4
246902076,javascript,gustavoguanabara/javascript,HTML,97,Curso de JavaScript,303,1526,https://avatars.githubusercontent.com/u/8683378?u=01b06a154f04dadaa4e4131497fa2442e6323cbc&v=4
390399065,flowbite,themesberg/flowbite,HTML,227,The most popular library of interactive components built with Tailwind CSS,63,993,https://avatars.githubusercontent.com/u/52166837?v=4
20895915,web,OCA/web,HTML,20,Odoo web client UI related addons,1529,631,https://avatars.githubusercontent.com/u/7600578?v=4
397384430,css-exercises,TheOdinProject/css-exercises,HTML,87,,8187,295,https://avatars.githubusercontent.com/u/4441966?v=4
406706766,investAPI,Tinkoff/investAPI,HTML,50,,40,87,https://avatars.githubusercontent.com/u/5486989?v=4
