id,name,full_name,language,new stars,description,forks_count,stargazers_count,avatar_url
27193779,node,nodejs/node,JavaScript,1393,Node.js JavaScript runtime :sparkles::turtle::rocket::sparkles:,22862,85781,https://avatars.githubusercontent.com/u/9950313?v=4
70107786,next.js,vercel/next.js,JavaScript,2048,The React Framework,16978,82005,https://avatars.githubusercontent.com/u/14985020?v=4
3470471,Font-Awesome,FortAwesome/Font-Awesome,JavaScript,1682,"The iconic SVG, font, and CSS toolkit",11953,68798,https://avatars.githubusercontent.com/u/1505683?v=4
147350463,33-js-concepts,leonardomso/33-js-concepts,JavaScript,1156,📜 33 JavaScript concepts every developer should know.,6338,47262,https://avatars.githubusercontent.com/u/8030067?u=5cdc59ff39d4ebcecafea22cebab34fb9baa8028&v=4
26066727,mermaid,mermaid-js/mermaid,JavaScript,4270,Generation of diagram and flowchart from text in a similar manner as markdown,3185,44285,https://avatars.githubusercontent.com/u/57169982?v=4
35866694,Rocket.Chat,RocketChat/Rocket.Chat,JavaScript,409,The communications platform that puts data protection first.,7223,31766,https://avatars.githubusercontent.com/u/12508788?v=4
85031442,hiring-without-whiteboards,poteto/hiring-without-whiteboards,JavaScript,1192,⭐️  Companies that don't have a broken hiring process,2408,27507,https://avatars.githubusercontent.com/u/1390709?u=45549fb0ee4a83cf3e054ccb1a72aa6b7750b437&v=4
17372733,OpenAPI-Specification,OAI/OpenAPI-Specification,JavaScript,364,The OpenAPI Specification Repository,8105,23183,https://avatars.githubusercontent.com/u/16343502?v=4
306977633,AI-Expert-Roadmap,AMAI-GmbH/AI-Expert-Roadmap,JavaScript,2782,Roadmap to becoming an Artificial Intelligence Expert in 2022,1593,18420,https://avatars.githubusercontent.com/u/54247845?v=4
97086543,Javascript,TheAlgorithms/Javascript,JavaScript,1224,"Algorithms implemented in Javascript for beginners, following best practices.",3082,17734,https://avatars.githubusercontent.com/u/20487725?v=4
229764465,30-Days-Of-JavaScript,Asabeneh/30-Days-Of-JavaScript,JavaScript,2862,"30 days of JavaScript programming challenge is a step-by-step guide to learn JavaScript programming language in 30 days. This challenge may take more than 100 days,  please just follow your own pace. ",3580,17585,https://avatars.githubusercontent.com/u/9008063?u=ec6ff77196b998a4e6b6e3ca1429c524c169c189&v=4
92111509,trilium,zadam/trilium,JavaScript,2072,Build your personal knowledge base with Trilium Notes,889,14860,https://avatars.githubusercontent.com/u/617641?v=4
110178895,brave-browser,brave/brave-browser,JavaScript,362,"Next generation Brave browser for Android, Linux, macOS, Windows.",1373,12213,https://avatars.githubusercontent.com/u/12301619?v=4
190729906,budibase,Budibase/budibase,JavaScript,1887,"Budibase is an open-source low-code platform for creating internal apps in minutes. Supports PostgreSQL, MySQL, MSSQL, MongoDB, Rest API, Docker, K8s 🚀 ",543,10444,https://avatars.githubusercontent.com/u/45009727?v=4
234739976,medusa,medusajs/medusa,JavaScript,2751,The open-source Shopify alternative ⚡️,442,8892,https://avatars.githubusercontent.com/u/62591822?v=4
80862584,gutenberg,WordPress/gutenberg,JavaScript,155,The Block Editor project for WordPress and beyond. Plugin is available from the official repository.,2792,7594,https://avatars.githubusercontent.com/u/276006?v=4
2833881,beef,beefproject/beef,JavaScript,445,The Browser Exploitation Framework Project,1556,6716,https://avatars.githubusercontent.com/u/1214850?u=c8e3746e2759b66844f1cdc8279d99dd2163734c&v=4
352933140,ToolJet,ToolJet/ToolJet,JavaScript,1617,"Extensible low-code framework for building business applications. Connect to databases, cloud storages, GraphQL, API endpoints, Airtable, etc and build apps using drag and drop application builder. Built using JavaScript/TypeScript. 🚀",502,6360,https://avatars.githubusercontent.com/u/82193554?v=4
171072967,whatsapp-web.js,pedroslopez/whatsapp-web.js,JavaScript,735,A WhatsApp client library for NodeJS that connects through the WhatsApp Web browser app,1200,4968,https://avatars.githubusercontent.com/u/4368928?u=cbe1262c53382c8b14aad065ffd9ff85d07ee153&v=4
82208127,user.js,arkenfox/user.js,JavaScript,320,"Firefox privacy, security and anti-tracking: a comprehensive user.js template for configuration and hardening",335,4919,https://avatars.githubusercontent.com/u/71147620?v=4
406091035,hashlips_art_engine,HashLips/hashlips_art_engine,JavaScript,1000,HashLips Art Engine is a tool used to create multiple different instances of artworks based on provided layers.,2351,4354,https://avatars.githubusercontent.com/u/88177839?u=b7a7758dd9e420a52c3083fcf6f1456132e42fc2&v=4
105473537,BetterDiscord,BetterDiscord/BetterDiscord,JavaScript,297,Better Discord enhances Discord desktop app with new features.,753,4008,https://avatars.githubusercontent.com/u/72631062?v=4
48157366,NN-SVG,alexlenail/NN-SVG,JavaScript,1305,Publication-ready NN-architecture schematics. ,310,2232,https://avatars.githubusercontent.com/u/2761597?u=2e803350ea299b40297d8c9d8ce23130d0d053cc&v=4
429851205,Cider,ciderapp/Cider,JavaScript,1251,Project Cider. A new look into listening and enjoying Apple Music in style and performance. 🚀,119,1575,https://avatars.githubusercontent.com/u/87914859?v=4
433989147,breeze-next,laravel/breeze-next,JavaScript,137,An application / authentication starter kit frontend in Next.js for Laravel Breeze.,56,315,https://avatars.githubusercontent.com/u/958072?v=4
