id,name,full_name,language,new stars,description,forks_count,stargazers_count,avatar_url
626805178,dify,langgenius/dify,TypeScript,692,"Dify is an open-source LLM app development platform. Dify's intuitive interface combines AI workflow, RAG pipeline, agent capabilities, model management, observability features and more, letting you quickly go from prototype to production.",11018,75567,https://avatars.githubusercontent.com/u/127165244?v=4
4279682,fish-shell,fish-shell/fish-shell,Rust,200,The user-friendly command line shell.,1996,28480,https://avatars.githubusercontent.com/u/1828073?v=4
667110339,drawdb,drawdb-io/drawdb,JavaScript,79,"Free, simple, and intuitive online database diagram editor and SQL generator.",1773,25136,https://avatars.githubusercontent.com/u/139706923?v=4
514553345,OrcaSlicer,SoftFever/OrcaSlicer,C++,41,"G-code generator for 3D printers (Bambu, Prusa, Voron, VzBot, RatRig, Creality, etc.)",1066,8849,https://avatars.githubusercontent.com/u/103989404?u=5ce996a351ee08333a2e41329d5f7a09823b3724&v=4
854807707,GenAI_Agents,NirDiamant/GenAI_Agents,Jupyter Notebook,306,"This repository provides tutorials and implementations for various Generative AI Agent techniques, from basic to advanced. It serves as a comprehensive guide for building intelligent, interactive AI systems.",1002,7802,https://avatars.githubusercontent.com/u/28316913?u=3d82b50356b9928eab0680470b568a10faaf605f&v=4
858798469,olmocr,allenai/olmocr,Python,1329,Toolkit for linearizing PDFs for LLM datasets/training,259,4343,https://avatars.githubusercontent.com/u/5667695?v=4
575865240,AstrBot,Soulter/AstrBot,Python,397,✨易上手的多平台 LLM 聊天机器人及开发框架✨。支持 QQ、QQ频道、Telegram、微信个人号(Gewechat)、企业微信、飞书、内置 Web Chat，OpenAI GPT、DeepSeek、Ollama、Llama、GLM、Gemini、硅基流动、月之暗面、OneAPI、LLMTuner，支持 LLM Agent 插件开发，可视化面板。一键部署。支持 Dify 工作流、代码执行器、Whisper 语音转文字。,247,4321,https://avatars.githubusercontent.com/u/37870767?u=d60e7b9ac031ec86afaf417b8ec45608efe30945&v=4
756637341,vision-agent,landing-ai/vision-agent,Python,116,Vision agent,372,3331,https://avatars.githubusercontent.com/u/34525670?v=4
863050120,fastrtc,freddyaboulton/fastrtc,Python,391,The python library for real-time communication,117,1362,https://avatars.githubusercontent.com/u/41651716?u=60b482aca07034ffd5a9ca96b5d56aa2c2ad5e71&v=4
