id,name,full_name,language,new stars,description,forks_count,stargazers_count,avatar_url
701547123,open-webui,open-webui/open-webui,JavaScript,14965,"User-friendly AI Interface (Supports Ollama, OpenAI API, ...)",9617,80286,https://avatars.githubusercontent.com/u/158137808?v=4
649170660,anything-llm,Mintplex-Labs/anything-llm,JavaScript,7994,"The all-in-one Desktop & Docker AI application with built-in RAG, AI agents, No-code agent builder, and more.",3804,39650,https://avatars.githubusercontent.com/u/134426827?v=4
667110339,drawdb,drawdb-io/drawdb,JavaScript,1399,"Free, simple, and intuitive online database diagram editor and SQL generator.",1784,25328,https://avatars.githubusercontent.com/u/139706923?v=4
110178895,brave-browser,brave/brave-browser,JavaScript,361,"Brave browser for Android, iOS, Linux, macOS, Windows.",2486,18665,https://avatars.githubusercontent.com/u/12301619?v=4
123220152,FreeTube,FreeTubeApp/FreeTube,JavaScript,2592,An Open Source YouTube app for privacy,1055,16732,https://avatars.githubusercontent.com/u/35975737?v=4
599524116,SillyTavern,SillyTavern/SillyTavern,JavaScript,1741,LLM Frontend for Power Users.,2871,11923,https://avatars.githubusercontent.com/u/134869877?v=4
438514144,wechat-bot,wangrongding/wechat-bot,JavaScript,1384,ğŸ¤–ä¸€ä¸ªåŸºäº WeChaty ç»“åˆ DeepSeek / ChatGPT / Kimi / è®¯é£ç­‰AiæœåŠ¡å®ç°çš„å¾®ä¿¡æœºå™¨äºº ï¼Œå¯ä»¥ç”¨æ¥å¸®åŠ©ä½ è‡ªåŠ¨å›å¤å¾®ä¿¡æ¶ˆæ¯ï¼Œæˆ–è€…ç®¡ç†å¾®ä¿¡ç¾¤/å¥½å‹ï¼Œæ£€æµ‹åƒµå°¸ç²‰ç­‰...,949,7625,https://avatars.githubusercontent.com/u/42437658?u=b4ca014df2ea1b3a80445d99972a377e51bbf11a&v=4
301216792,register,is-a-dev/register,JavaScript,1397,Grab your own sweet-looking '.is-a.dev' subdomain.,10895,6030,https://avatars.githubusercontent.com/u/72358814?v=4
