id,name,full_name,language,new stars,description,forks_count,stargazers_count,avatar_url
1039520,youtube-dl,ytdl-org/youtube-dl,Python,747,Command-line program to download videos from YouTube.com and other video sites,6623,103871,https://avatars.githubusercontent.com/u/48381040?v=4
33614304,thefuck,nvbn/thefuck,Python,167,Magnificent app which corrects your previous console command.,3011,65228,https://avatars.githubusercontent.com/u/1114542?v=4
58028038,HelloGitHub,521xueweihan/HelloGitHub,Python,629,":octocat: 分享 GitHub 上有趣、入门级的开源项目。Share interesting, entry-level open source projects on GitHub.",7232,50145,https://avatars.githubusercontent.com/u/8255800?u=2024c0f3979fd65c8aab945856eae0852f1186f6&v=4
160919119,fastapi,tiangolo/fastapi,Python,470,"FastAPI framework, high performance, easy to learn, fast to code, ready for production",2959,39813,https://avatars.githubusercontent.com/u/1326112?u=5cad72c846b7aba2e960546af490edc7375dafc4&v=4
41058054,CppCoreGuidelines,isocpp/CppCoreGuidelines,Python,120,"The C++ Core Guidelines are a set of tried-and-true guidelines, rules, and best practices about coding in C++",4437,32687,https://avatars.githubusercontent.com/u/13841574?v=4
220809393,rich,willmcgugan/rich,Python,272,Rich is a Python library for rich text and beautiful formatting in the terminal.,1031,31735,https://avatars.githubusercontent.com/u/554369?u=8015a7d742d8bd7ee9d1efe30c138737d6098cd3&v=4
125266328,black,psf/black,Python,119,The uncompromising Python code formatter,1550,24031,https://avatars.githubusercontent.com/u/50630501?v=4
262296122,PaddleOCR,PaddlePaddle/PaddleOCR,Python,221,"Awesome multilingual OCR toolkits based on PaddlePaddle (practical ultra lightweight OCR system, support 80+ languages recognition, provide data annotation and synthesis tools, support training and deployment among server, mobile, embedded and IoT devices)",3715,18244,https://avatars.githubusercontent.com/u/23534030?v=4
154739597,jax,google/jax,Python,119,"Composable transformations of Python+NumPy programs: differentiate, vectorize, JIT to GPU/TPU, and more",1433,15641,https://avatars.githubusercontent.com/u/1342004?v=4
307260205,yt-dlp,yt-dlp/yt-dlp,Python,1335,A youtube-dl fork with additional features and fixes,924,14254,https://avatars.githubusercontent.com/u/79589310?v=4
349321229,GFPGAN,TencentARC/GFPGAN,Python,2939,GFPGAN aims at developing Practical Algorithms for Real-world Face Restoration.,1940,12932,https://avatars.githubusercontent.com/u/83739826?v=4
120710644,ddia,Vonng/ddia,Python,190,《Designing Data-Intensive Application》DDIA中文翻译,2379,10677,https://avatars.githubusercontent.com/u/8587410?u=cf4bf2dc20cda87e09a0feff8b103fe8ec8bbb32&v=4
274594200,Bringing-Old-Photos-Back-to-Life,microsoft/Bringing-Old-Photos-Back-to-Life,Python,76,Bringing Old Photo Back to Life (CVPR 2020 oral),1145,9568,https://avatars.githubusercontent.com/u/6154722?v=4
387326890,Real-ESRGAN,xinntao/Real-ESRGAN,Python,361,Real-ESRGAN aims at developing Practical Algorithms for General Image Restoration.,745,7977,https://avatars.githubusercontent.com/u/17445847?u=dc0cf716873f6809f46f105917500699ae1aafd3&v=4
355959597,textual,willmcgugan/textual,Python,202,Textual is a TUI (Text User Interface) framework for Python inspired by modern web development.,155,6623,https://avatars.githubusercontent.com/u/554369?u=8015a7d742d8bd7ee9d1efe30c138737d6098cd3&v=4
437729997,log4j-scan,fullhunt/log4j-scan,Python,831,"A fully automated, accurate, and extensive scanner for finding log4j RCE CVE-2021-44228 ",507,2245,https://avatars.githubusercontent.com/u/34830403?v=4
437470348,log4shell,NCSC-NL/log4shell,Python,532,Operational information regarding the log4shell vulnerabilities in the Log4j logging library.,605,1612,https://avatars.githubusercontent.com/u/16208471?v=4
157246127,helm-charts,elastic/helm-charts,Python,16,"You know, for Kubernetes",1426,1405,https://avatars.githubusercontent.com/u/6764390?v=4
437139341,log4j-shell-poc,kozmer/log4j-shell-poc,Python,655,A Proof-Of-Concept for the recently found CVE-2021-44228 vulnerability. ,223,942,https://avatars.githubusercontent.com/u/87979263?u=dd7f23490c7b9d1bd1dca84ccaf723402debf769&v=4
435572813,minitorch,minitorch/minitorch,Python,161,The full minitorch student suite. ,77,804,https://avatars.githubusercontent.com/u/69814924?v=4
437264961,log4shell-detector,Neo23x0/log4shell-detector,Python,76,Detector for Log4Shell exploitation attempts,118,665,https://avatars.githubusercontent.com/u/2851492?u=c08fdd9b75c1097410e101837974ce59a6a1fa09&v=4
437314230,sam-the-admin,WazeHell/sam-the-admin,Python,114,Exploiting CVE-2021-42278 and CVE-2021-42287 to impersonate DA from standard domain user ,133,640,https://avatars.githubusercontent.com/u/20618414?u=c3aed2b6df2ad19ff650eb051f090e41c1c19f50&v=4
436900024,log4jpwn,leonjza/log4jpwn,Python,68,log4j rce test environment and poc,57,248,https://avatars.githubusercontent.com/u/1148127?v=4
437438829,python-log4rce,alexandre-lavoie/python-log4rce,Python,25,An All-In-One Pure Python PoC for CVE-2021-44228,29,170,https://avatars.githubusercontent.com/u/36684879?u=adc266030a726090eb40187b018db4139bee40d9&v=4
437595483,Log4Shell-IOCs,curated-intel/Log4Shell-IOCs,Python,37,A collection of intelligence about Log4Shell and its exploitation activity. ,27,125,https://avatars.githubusercontent.com/u/92964523?v=4
