id,name,full_name,language,new stars,description,forks_count,stargazers_count,avatar_url
184456251,PowerToys,microsoft/PowerToys,C#,1734,Windows system utilities to maximize productivity,6446,109407,https://avatars.githubusercontent.com/u/6154722?v=4
199570071,v2rayN,2dust/v2rayN,C#,1523,"A GUI client for Windows, support Xray core and v2fly core and others",11166,66877,https://avatars.githubusercontent.com/u/31833384?v=4
17620347,aspnetcore,dotnet/aspnetcore,C#,285,"ASP.NET Core is a cross-platform .NET framework for building modern cloud-based web applications on Windows, Mac, or Linux.",9928,35182,https://avatars.githubusercontent.com/u/9141961?v=4
161012019,jellyfin,jellyfin/jellyfin,C#,1001,The Free Software Media System,3034,33298,https://avatars.githubusercontent.com/u/45698031?v=4
22456440,osu,ppy/osu,C#,247,rhythm is just a *click* away!,2217,15035,https://avatars.githubusercontent.com/u/995763?v=4
201188122,lively,rocksdanister/lively,C#,250,Free and open-source software that allows users to set animated desktop wallpapers and screensavers powered by WinUI 3.,1048,14762,https://avatars.githubusercontent.com/u/17554161?u=65f51a36d9c0072b244c13d215fc743e464f5cce&v=4
16157746,efcore,dotnet/efcore,C#,85,"EF Core is a modern object-database mapper for .NET. It supports LINQ queries, change tracking, updates, and schema migrations.",3150,13636,https://avatars.githubusercontent.com/u/9141961?v=4
45195614,Jackett,Jackett/Jackett,C#,264,API Support for your favorite torrent trackers,1279,11992,https://avatars.githubusercontent.com/u/15383019?v=4
791611,mono,mono/mono,C#,124,"Mono open source ECMA CLI, C# and .NET implementation.",3818,11080,https://avatars.githubusercontent.com/u/53395?v=4
2465723,Sonarr,Sonarr/Sonarr,C#,176,Smart PVR for newsgroup and bittorrent users.,1334,10575,https://avatars.githubusercontent.com/u/1082903?v=4
681372871,garnet,microsoft/garnet,C#,211,"Garnet is a remote cache-store from Microsoft Research that offers strong performance (throughput and latency), scalability, storage, recovery, cluster sharding, key migration, and replication features. Garnet can work with existing Redis clients.",499,10116,https://avatars.githubusercontent.com/u/6154722?v=4
18586705,nopCommerce,nopSolutions/nopCommerce,C#,81,ASP.NET Core eCommerce software. nopCommerce is a free and open-source shopping cart.,5269,9175,https://avatars.githubusercontent.com/u/7234683?v=4
95366680,Dependencies,lucasg/Dependencies,C#,242,"A rewrite of the old legacy software ""depends.exe"" in C# for Windows devs to troubleshoot dll load dependencies issues.",722,8875,https://avatars.githubusercontent.com/u/2520861?v=4
21611723,Quasar,quasar/Quasar,C#,161,Remote Administration Tool for Windows,2435,8583,https://avatars.githubusercontent.com/u/13819829?v=4
157858597,YoutubeDownloader,Tyrrrz/YoutubeDownloader,C#,539,Downloads videos and playlists from YouTube,1152,8240,https://avatars.githubusercontent.com/u/1935960?u=40a06549de224471e1a81877536f8e24d4e96f09&v=4
187499284,UniTask,Cysharp/UniTask,C#,207,Provides an efficient allocation free async/await integration for Unity.,820,8010,https://avatars.githubusercontent.com/u/44487420?v=4
600246354,g-helper,seerge/g-helper,C#,644,"Lightweight Armoury Crate alternative for Asus laptops and ROG Ally. Control tool for ROG Zephyrus G14, G15, G16, M16, Flow X13, Flow X16, TUF, Strix, Scar and other models",251,6897,https://avatars.githubusercontent.com/u/5920850?u=80e9cb264b3e5070554c2ddc3ece67df71804927&v=4
683560668,better-genshin-impact,babalae/better-genshin-impact,C#,883,ğŸ“¦BetterGI Â· æ›´å¥½çš„åŸç¥ - è‡ªåŠ¨æ‹¾å– | è‡ªåŠ¨å‰§æƒ… | å…¨è‡ªåŠ¨é’“é±¼(AI) | å…¨è‡ªåŠ¨ä¸ƒåœ£å¬å”¤ | è‡ªåŠ¨ä¼æœ¨ | è‡ªåŠ¨åˆ·æœ¬ | è‡ªåŠ¨é‡‡é›† - UI Automation Testing Tools For Genshin Impact,296,4709,https://avatars.githubusercontent.com/u/72920340?v=4
247198136,1Remote,1Remote/1Remote,C#,274,One Remote Access Manager to Rule Them All,374,3927,https://avatars.githubusercontent.com/u/105551232?v=4
385118073,AssetRipper,AssetRipper/AssetRipper,C#,222,"GUI Application to work with engine assets, asset bundles, and serialized files",523,3824,https://avatars.githubusercontent.com/u/96150378?v=4
419415576,dotnet,CommunityToolkit/dotnet,C#,117,".NET Community Toolkit is a collection of helpers and APIs that work for all .NET developers and are agnostic of any specific UI platform. The toolkit is maintained and published by Microsoft, and part of the .NET Foundation.",292,2960,https://avatars.githubusercontent.com/u/41346473?v=4
323665366,kiota,microsoft/kiota,C#,307,OpenAPI based HTTP Client code generator,193,2825,https://avatars.githubusercontent.com/u/6154722?v=4
728573769,R3,Cysharp/R3,C#,164,The new future of dotnet/reactive and UniRx.,91,2010,https://avatars.githubusercontent.com/u/44487420?v=4
425837195,sourcegit,sourcegit-scm/sourcegit,C#,216,Windows/macOS/Linux GUI client for GIT users,99,966,https://avatars.githubusercontent.com/u/85621660?u=29acc609f775d7c2ff74a39ec7476fe3be4ec801&v=4
