id,name,full_name,language,new stars,description,forks_count,stargazers_count,avatar_url
246335987,Ventoy,ventoy/Ventoy,C,707,A new bootable USB solution.,4024,61867,https://avatars.githubusercontent.com/u/59477474?u=16f38c14b69580f87f4717b71c0e5e85e9559cb1&v=4
37912398,nginx,nginx/nginx,C,3360,The official NGINX Open Source repository.,6892,24369,https://avatars.githubusercontent.com/u/1412239?v=4
45821540,openwrt,openwrt/openwrt,C,402,This repository is a mirror of https://git.openwrt.org/openwrt/openwrt.git It is for reference only and is not active for check-ins.  We will continue to accept Pull Requests here. They will be merged via staging trees then into openwrt.git.,10304,19768,https://avatars.githubusercontent.com/u/2528830?v=4
775743011,valkey,valkey-io/valkey,C,1081,A flexible distributed key-value datastore that supports both caching and beyond caching workloads.,605,16265,https://avatars.githubusercontent.com/u/164458127?v=4
490465859,Flipper,UberGuidoZ/Flipper,C,298,Playground (and dump) of stuff I make or modify for the Flipper Zero,3174,13525,https://avatars.githubusercontent.com/u/57457139?u=3b283c3083a1fee457b897d7c8fda97b873e9807&v=4
65899476,esp-idf,espressif/esp-idf,C,209,Espressif IoT Development Framework. Official development framework for Espressif SoCs.,7246,13407,https://avatars.githubusercontent.com/u/9460735?v=4
469303019,ecapture,gojue/ecapture,C,3691,Capturing SSL/TLS plaintext without a CA certificate using eBPF. Supported on Linux/Android kernels for amd64/arm64.,1370,12916,https://avatars.githubusercontent.com/u/113109442?v=4
284134871,flipperzero-firmware,flipperdevices/flipperzero-firmware,C,497,Flipper Zero firmware source code,2683,12537,https://avatars.githubusercontent.com/u/57576566?v=4
59771425,zephyr,zephyrproject-rtos/zephyr,C,221,"Primary Git Repository for the Zephyr Project. Zephyr is a new generation, scalable, optimized, secure RTOS for multiple hardware architectures.",6466,10559,https://avatars.githubusercontent.com/u/19595895?v=4
340181518,fastfetch,fastfetch-cli/fastfetch,C,747,"An actively maintained, feature-rich and performance oriented, neofetch like system information tool.",395,9847,https://avatars.githubusercontent.com/u/136235211?v=4
40504480,xv6-public,mit-pdos/xv6-public,C,99,xv6 OS,3883,7779,https://avatars.githubusercontent.com/u/12404246?v=4
14735429,capstone,capstone-engine/capstone,C,193,"Capstone disassembly/disassembler framework for ARM, ARM64 (ARMv8), Alpha, BPF, Ethereum VM, HPPA, LoongArch, M68K, M680X, Mips, MOS65XX, PPC, RISC-V(rv32G/rv64G), SH, Sparc, SystemZ, TMS320C64X, TriCore, Webassembly, XCore and X86.",1546,7482,https://avatars.githubusercontent.com/u/13388937?v=4
86245815,pygame,pygame/pygame,C,101,"🐍🎮 pygame (the library) is a Free and Open Source python programming language library for making multimedia applications like games built on top of the excellent SDL library. C, Python, Native, OpenGL.",3262,7355,https://avatars.githubusercontent.com/u/20628127?v=4
204459250,xv6-riscv,mit-pdos/xv6-riscv,C,197,Xv6 for RISC-V,2566,6952,https://avatars.githubusercontent.com/u/12404246?v=4
203759896,immortalwrt,immortalwrt/immortalwrt,C,440,An opensource OpenWrt variant for mainland China users.,1685,5899,https://avatars.githubusercontent.com/u/53193414?v=4
251043704,mayhem-firmware,portapack-mayhem/mayhem-firmware,C,156,Custom firmware for the HackRF+PortaPack H1/H2,537,3289,https://avatars.githubusercontent.com/u/136080346?v=4
76599439,frr,FRRouting/frr,C,118,The FRRouting Protocol Suite,1243,3280,https://avatars.githubusercontent.com/u/24592672?v=4
4830334,WiringPi,WiringPi/WiringPi,C,60,The arguably fastest GPIO Library for the Raspberry Pi,1206,2666,https://avatars.githubusercontent.com/u/1950827?v=4
270692521,zmk,zmkfirmware/zmk,C,81,ZMK Firmware Repository,2723,2658,https://avatars.githubusercontent.com/u/66629601?v=4
65514205,liboqs,open-quantum-safe/liboqs,C,63,C library for prototyping and experimenting with quantum-resistant cryptography,442,1797,https://avatars.githubusercontent.com/u/20689385?v=4
5870069,librdkafka,confluentinc/librdkafka,C,106,The Apache Kafka C/C++ library,3141,208,https://avatars.githubusercontent.com/u/9439498?v=4
