id,name,full_name,language,new stars,description,forks_count,stargazers_count,avatar_url
111583593,scrcpy,Genymobile/scrcpy,C,1731,Display and control your Android device,10468,108754,https://avatars.githubusercontent.com/u/3427627?v=4
246335987,Ventoy,ventoy/Ventoy,C,801,A new bootable USB solution.,4006,61615,https://avatars.githubusercontent.com/u/59477474?u=16f38c14b69580f87f4717b71c0e5e85e9559cb1&v=4
6201092,mpv,mpv-player/mpv,C,836,🎥 Command line video player,2867,27807,https://avatars.githubusercontent.com/u/2550273?v=4
37912398,nginx,nginx/nginx,C,2414,The official NGINX Open Source repository.,6831,23528,https://avatars.githubusercontent.com/u/1412239?v=4
45821540,openwrt,openwrt/openwrt,C,367,This repository is a mirror of https://git.openwrt.org/openwrt/openwrt.git It is for reference only and is not active for check-ins.  We will continue to accept Pull Requests here. They will be merged via staging trees then into openwrt.git.,10241,19590,https://avatars.githubusercontent.com/u/2528830?v=4
490465859,Flipper,UberGuidoZ/Flipper,C,310,Playground (and dump) of stuff I make or modify for the Flipper Zero,3141,13407,https://avatars.githubusercontent.com/u/57457139?u=3b283c3083a1fee457b897d7c8fda97b873e9807&v=4
284134871,flipperzero-firmware,flipperdevices/flipperzero-firmware,C,279,Flipper Zero firmware source code,2661,12269,https://avatars.githubusercontent.com/u/57576566?v=4
192805335,mimalloc,microsoft/mimalloc,C,532,mimalloc is a compact general purpose allocator with excellent performance.,839,10368,https://avatars.githubusercontent.com/u/6154722?v=4
671061529,winlator,brunodev85/winlator,C,566,Android application for running Windows applications with Wine and Box86/Box64,367,7851,https://avatars.githubusercontent.com/u/11407071?u=b8e72693930cd1e2d2ea4e0423fb27e0e905b84d&v=4
2328181,freebsd-src,freebsd/freebsd-src,C,90,The FreeBSD src tree publish-only repository. Experimenting with 'simple' pull requests....,2845,7763,https://avatars.githubusercontent.com/u/811839?v=4
40504480,xv6-public,mit-pdos/xv6-public,C,89,xv6 OS,3834,7746,https://avatars.githubusercontent.com/u/12404246?v=4
66016134,simplewall,henrypp/simplewall,C,189,Simple tool to configure Windows Filtering Platform (WFP) which can configure network activity on your computer.,481,6058,https://avatars.githubusercontent.com/u/3902025?u=b0ece819da48142eab03300731168783d7a2307b&v=4
700860305,PlayIntegrityFix,chiteroman/PlayIntegrityFix,C,320,Fix Play Integrity (and SafetyNet) verdicts.,240,4546,https://avatars.githubusercontent.com/u/98092901?v=4
144465372,proxmark3,RfidResearchGroup/proxmark3,C,134,Iceman Fork - Proxmark3,1014,3834,https://avatars.githubusercontent.com/u/40314039?v=4
76599439,frr,FRRouting/frr,C,54,The FRRouting Protocol Suite,1234,3203,https://avatars.githubusercontent.com/u/24592672?v=4
331381105,pico-examples,raspberrypi/pico-examples,C,109,,810,2781,https://avatars.githubusercontent.com/u/1294177?v=4
207354223,FreeRTOS-Kernel,FreeRTOS/FreeRTOS-Kernel,C,90,"FreeRTOS kernel files only, submoduled into https://github.com/FreeRTOS/FreeRTOS and various other repos.",1098,2660,https://avatars.githubusercontent.com/u/54647343?v=4
