id,name,full_name,language,new stars,description,forks_count,stargazers_count,avatar_url
13233158,obs-studio,obsproject/obs-studio,C,25,OBS Studio - Free and open source software for live streaming and screen recording,5899,38393,https://avatars.githubusercontent.com/u/7725691?v=4
7634677,openssl,openssl/openssl,C,8,TLS/SSL and crypto library,8056,18449,https://avatars.githubusercontent.com/u/3279138?v=4
196353673,TDengine,taosdata/TDengine,C,8,"An open-source time-series database with high-performance, scalability and SQL support. It can be widely used in IoT, Connected Vehicles, DevOps, Energy, Finance and other fields.",4361,18359,https://avatars.githubusercontent.com/u/48876650?v=4
47409672,hashcat,hashcat/hashcat,C,24,World's fastest and most advanced password recovery utility,2222,14496,https://avatars.githubusercontent.com/u/15949799?v=4
15337142,micropython,micropython/micropython,C,9,MicroPython - a lean and efficient Python implementation for microcontrollers and constrained systems,5408,14179,https://avatars.githubusercontent.com/u/6298560?v=4
66150122,nnn,jarun/nnn,C,13,n³ The unorthodox terminal file manager,579,14160,https://avatars.githubusercontent.com/u/5959286?u=2288d112a2d27a09182801b737af71c280a40f61&v=4
27737393,qmk_firmware,qmk/qmk_firmware,C,7,Open-source keyboard firmware for Atmel AVR and Arm USB families,26280,12335,https://avatars.githubusercontent.com/u/25358678?v=4
40217904,sway,swaywm/sway,C,7,i3-compatible Wayland compositor,901,10589,https://avatars.githubusercontent.com/u/32400794?v=4
7715820,rofi,davatorium/rofi,C,6,"Rofi: A window switcher, application launcher and dmenu replacement",495,9162,https://avatars.githubusercontent.com/u/48837683?v=4
9524997,glfw,glfw/glfw,C,7,"A multi-platform library for OpenGL, OpenGL ES, Vulkan, window and input",3584,9074,https://avatars.githubusercontent.com/u/3905364?v=4
70127218,arduino-esp32,espressif/arduino-esp32,C,5,Arduino core for the ESP32,5518,8645,https://avatars.githubusercontent.com/u/9460735?v=4
277194804,NoiseTorch,noisetorch/NoiseTorch,C,82,Real-time microphone noise suppression on Linux.,133,6461,https://avatars.githubusercontent.com/u/105936236?v=4
394318710,ExplorerPatcher,valinet/ExplorerPatcher,C,18,This project aims to enhance the working environment on Windows,334,5644,https://avatars.githubusercontent.com/u/6503598?u=25d850b7dcc57d2a488d83646fff7cca48cf7fc7&v=4
86245815,pygame,pygame/pygame,C,6,"pygame (the library) is a Free and Open Source python programming language library for making multimedia applications like games built on top of the excellent SDL library. C, Python, Native, OpenGL.",2119,4829,https://avatars.githubusercontent.com/u/20628127?v=4
59676171,klipper,Klipper3d/klipper,C,5,Klipper is a 3d-printer firmware,3281,4783,https://avatars.githubusercontent.com/u/90982958?v=4
146397768,libhv,ithewei/libhv,C,6,🔥 比libevent、libuv更易用的网络库。A c/c++ network library for developing TCP/UDP/SSL/HTTP/WebSocket/MQTT client/server.,740,4090,https://avatars.githubusercontent.com/u/26049660?u=2252b64651629ba953139d461c0fd4658ed1706e&v=4
157590294,Telegram-iOS,TelegramMessenger/Telegram-iOS,C,3,Telegram-iOS,954,3582,https://avatars.githubusercontent.com/u/22377696?v=4
40306512,LuaJIT,LuaJIT/LuaJIT,C,2,Mirror of the LuaJIT git repository,709,3164,https://avatars.githubusercontent.com/u/11773774?v=4
124678204,aircrack-ng,aircrack-ng/aircrack-ng,C,8,WiFi security auditing tools suite,668,2996,https://avatars.githubusercontent.com/u/4042925?u=2e4aed03769fc637d27c21e223a530d4240e59e0&v=4
204459250,xv6-riscv,mit-pdos/xv6-riscv,C,6,Xv6 for RISC-V,845,2517,https://avatars.githubusercontent.com/u/12404246?v=4
284134871,flipperzero-firmware,flipperdevices/flipperzero-firmware,C,12,Flipper Zero Firmware,320,1598,https://avatars.githubusercontent.com/u/57576566?v=4
1638129,simh,simh/simh,C,3,The Computer History Simulation Project ,283,1412,https://avatars.githubusercontent.com/u/1672889?v=4
331380723,pico-sdk,raspberrypi/pico-sdk,C,1,,324,1374,https://avatars.githubusercontent.com/u/1294177?v=4
191266671,go-algorand,algorand/go-algorand,C,4,Algorand's official implementation in Go. ,325,1053,https://avatars.githubusercontent.com/u/23182699?v=4
403256810,small-package,kenzok8/small-package,C,3,自动同步更新上游库软件,237,269,https://avatars.githubusercontent.com/u/39034242?u=93d00c03b02cae25686ff25c48e60b871a353213&v=4
