id,name,full_name,language,new stars,description,forks_count,stargazers_count,avatar_url
21289110,awesome-python,vinta/awesome-python,Python,1212,"A curated list of awesome Python frameworks, libraries, software and resources",21734,138680,https://avatars.githubusercontent.com/u/652070?u=95b472a9a11b64ee0f74512ad918d762d42c213c&v=4
123458551,Python-100-Days,jackfrued/Python-100-Days,Python,563,Python - 100天从新手到大师,46453,122939,https://avatars.githubusercontent.com/u/7474657?u=902200c2389c203cf2139888e10314845edd2a2a&v=4
155220641,transformers,huggingface/transformers,Python,363,"🤗 Transformers: State-of-the-art Machine Learning for Pytorch, TensorFlow, and JAX.",15904,68822,https://avatars.githubusercontent.com/u/25720743?v=4
12888993,core,home-assistant/core,Python,131,:house_with_garden: Open source home automation that puts local control and privacy first.,19291,54495,https://avatars.githubusercontent.com/u/13844975?v=4
71220757,PayloadsAllTheThings,swisskyrepo/PayloadsAllTheThings,Python,362,A list of useful payloads and bypass for Web Application Security and Pentest/CTF,10898,40386,https://avatars.githubusercontent.com/u/12152583?u=e368c891b81d41b1ce12825f52049e5eb146d401&v=4
307260205,yt-dlp,yt-dlp/yt-dlp,Python,382,A youtube-dl fork with additional features and fixes,2415,30552,https://avatars.githubusercontent.com/u/79589310?v=4
168799526,pytorch-image-models,rwightman/pytorch-image-models,Python,167,"PyTorch image models, scripts, pretrained weights -- ResNet, ResNeXT, EfficientNet, EfficientNetV2, NFNet, Vision Transformer, MixNet, MobileNet-V3/V2, RegNet, DPN, CSPNet, and more",3357,20443,https://avatars.githubusercontent.com/u/5702664?u=df4f0a66cd454d176039c595bb197c7fcecfd8ba&v=4
240315046,jina,jina-ai/jina,Python,422,Build cross-modal and multimodal applications on the cloud · Neural Search · Creative AI · Cloud Native,1955,15707,https://avatars.githubusercontent.com/u/60539444?v=4
387326890,Real-ESRGAN,xinntao/Real-ESRGAN,Python,326,Real-ESRGAN aims at developing Practical Algorithms for General Image/Video Restoration.,1451,13070,https://avatars.githubusercontent.com/u/17445847?u=dc0cf716873f6809f46f105917500699ae1aafd3&v=4
266417772,Summer2023-Internships,pittcsc/Summer2023-Internships,Python,380,Collection of Summer 2023 tech internships!,1230,12083,https://avatars.githubusercontent.com/u/7276234?v=4
1864233,erpnext,frappe/erpnext,Python,46,Free and Open Source Enterprise Resource Planning (ERP),4749,11703,https://avatars.githubusercontent.com/u/836974?v=4
479491550,memray,bloomberg/memray,Python,82,Memray is a memory profiler for Python,247,9130,https://avatars.githubusercontent.com/u/1416818?v=4
217475193,PaddleDetection,PaddlePaddle/PaddleDetection,Python,43,"Object Detection toolkit based on PaddlePaddle. It supports object detection, instance segmentation, multiple object tracking and real-time multi-person keypoint detection.",2132,8302,https://avatars.githubusercontent.com/u/23534030?v=4
333483116,changedetection.io,dgtlmoon/changedetection.io,Python,155,"changedetection.io - The best and simplest self-hosted free open source website change detection tracking, monitoring and notification service. An alternative to Visualping, Watchtower etc. Designed for simplicity - the main goal is to simply monitor which websites had a text change for free. Free Open source web page change detection",292,5367,https://avatars.githubusercontent.com/u/275001?u=94abd34c8fa06db18e09f1e6ade5a3f4f1202f9f&v=4
496680191,RedditVideoMakerBot,elebumm/RedditVideoMakerBot,Python,188,Create Reddit Videos with just✨ one command ✨,968,3869,https://avatars.githubusercontent.com/u/6053155?u=9a9628a8d5df3e6a7f02f0f14182caa2d5a67999&v=4
149554797,consensus-specs,ethereum/consensus-specs,Python,35,Ethereum Proof-of-Stake Consensus Specifications,658,2720,https://avatars.githubusercontent.com/u/6250754?v=4
498011141,diffusers,huggingface/diffusers,Python,477,🤗 Diffusers: State-of-the-art diffusion models for image and audio generation in PyTorch,129,2110,https://avatars.githubusercontent.com/u/25720743?v=4
362242108,guided-diffusion,openai/guided-diffusion,Python,70,,301,2036,https://avatars.githubusercontent.com/u/14957082?v=4
290373506,denoising-diffusion-pytorch,lucidrains/denoising-diffusion-pytorch,Python,80,Implementation of Denoising Diffusion Probabilistic Model in Pytorch,190,1359,https://avatars.githubusercontent.com/u/108653?u=779c8d79413f8c2fa20b9ec3b0ec4189ba6e4f37&v=4
283868135,instagrapi,adw0rd/instagrapi,Python,70,🔥 The fastest and powerful Python library for Instagram Private API 2022,244,1295,https://avatars.githubusercontent.com/u/546889?u=fc3a21cf375c0fc420dfec64e73ecd1b625c7618&v=4
522646351,ofrak,redballoonsecurity/ofrak,Python,119,"OFRAK: unpack, modify, and repack binaries.",62,985,https://avatars.githubusercontent.com/u/48032083?v=4
516904877,multinerf,google-research/multinerf,Python,270,"A Code Release for Mip-NeRF 360, Ref-NeRF, and RawNeRF",64,913,https://avatars.githubusercontent.com/u/43830688?v=4
520969009,Hello-Python,mouredev/Hello-Python,Python,99,Python desde cero,22,381,https://avatars.githubusercontent.com/u/17043402?u=0fe848503eee627223a1e8af9ff3f08a657e18f4&v=4
443613613,chasing_your_tail,azmatt/chasing_your_tail,Python,96,Tool for using wireless signals to see if you're being followed.,37,354,https://avatars.githubusercontent.com/u/5846627?v=4
520483837,python-keylogger,davidbombal/python-keylogger,Python,142,,103,348,https://avatars.githubusercontent.com/u/22679022?u=cd8054d71772b5eb90a66362b09654425f560123&v=4
