id,name,full_name,language,new stars,description,forks_count,stargazers_count,avatar_url
54346799,public-apis,public-apis/public-apis,Python,186,A collective list of free APIs,30717,281055,https://avatars.githubusercontent.com/u/51121562?v=4
83222441,system-design-primer,donnemartin/system-design-primer,Python,121,Learn how to design large-scale systems. Prep for the system design interview.  Includes Anki flashcards.,42490,247543,https://avatars.githubusercontent.com/u/5458997?u=f1007b583e55e7ccfb6ccf0e200051156112dd9b&v=4
21289110,awesome-python,vinta/awesome-python,Python,139,"An opinionated list of awesome Python frameworks, libraries, software and resources.",24231,199126,https://avatars.githubusercontent.com/u/652070?u=95b472a9a11b64ee0f74512ad918d762d42c213c&v=4
123458551,Python-100-Days,jackfrued/Python-100-Days,Python,227,Python - 100天从新手到大师,50898,147530,https://avatars.githubusercontent.com/u/7474657?u=902200c2389c203cf2139888e10314845edd2a2a&v=4
12888993,core,home-assistant/core,Python,188,:house_with_garden: Open source home automation that puts local control and privacy first.,27244,67662,https://avatars.githubusercontent.com/u/13844975?v=4
212639071,devops-exercises,bregman-arie/devops-exercises,Python,49,"Linux, Jenkins, AWS, SRE, Prometheus, Docker, Python, Ansible, Git, Kubernetes, Terraform, OpenStack, SQL, NoSQL, Azure, GCP, DNS, Elastic, Network, Virtualization. DevOps Interview Questions",13359,62157,https://avatars.githubusercontent.com/u/10349437?u=bb7c3c533587d7cb2e3dd336e0f8a0d40544e5f5&v=4
220809393,rich,Textualize/rich,Python,14,Rich is a Python library for rich text and beautiful formatting in the terminal.,1654,46522,https://avatars.githubusercontent.com/u/93378883?v=4
666299222,open-interpreter,KillianLucas/open-interpreter,Python,67,A natural language interface for computers,3561,40948,https://avatars.githubusercontent.com/u/63927363?u=9a5a30771011c3cfdde19cd51d18d85e7ed6d53f&v=4
679237742,gpt-pilot,Pythagora-io/gpt-pilot,Python,164,Dev tool that writes scalable apps from scratch while the developer oversees the implementation,1901,21849,https://avatars.githubusercontent.com/u/123263103?v=4
520969009,Hello-Python,mouredev/Hello-Python,Python,154,"Curso para aprender el lenguaje de programación Python desde cero y para principiantes. 75 clases, 37 horas en vídeo, código, proyectos y grupo de chat. Fundamentos, frontend, backend, testing, IA...",1353,20286,https://avatars.githubusercontent.com/u/17043402?u=0fe848503eee627223a1e8af9ff3f08a657e18f4&v=4
167694194,frigate,blakeblackshear/frigate,Python,20,NVR with realtime local object detection for IP cameras,1259,13779,https://avatars.githubusercontent.com/u/569905?u=a454086144f531389a73fbea93a7835eea06f2a1&v=4
710601088,crewAI,joaomdmoura/crewAI,Python,88,"Framework for orchestrating role-playing, autonomous AI agents. By fostering collaborative intelligence, CrewAI empowers agents to work together seamlessly, tackling complex tasks.",887,8212,https://avatars.githubusercontent.com/u/667063?u=c0ea6956bba58ee8baabb6568f0374263ed96f1d&v=4
725839295,mamba,state-spaces/mamba,Python,85,,542,6855,https://avatars.githubusercontent.com/u/146159090?v=4
638629097,aider,paul-gauthier/aider,Python,12,aider is AI pair programming in your terminal,768,6500,https://avatars.githubusercontent.com/u/69695708?u=1b1a608998950cb407854549123a52c964a202ec&v=4
1864194,frappe,frappe/frappe,Python,6,"Low code web framework for real world applications, in Python and Javascript",3032,6279,https://avatars.githubusercontent.com/u/836974?v=4
636372163,lit-gpt,Lightning-AI/lit-gpt,Python,31,"Hackable implementation of state-of-the-art open-source LLMs based on nanoGPT. Supports flash attention, 4-bit and 8-bit quantization, LoRA and LLaMA-Adapter fine-tuning, pre-training. Apache 2.0-licensed.",532,5112,https://avatars.githubusercontent.com/u/58386951?v=4
759338070,yolov9,WongKinYiu/yolov9,Python,1034,Implementation of paper - YOLOv9: Learning What You Want to Learn Using Programmable Gradient Information,482,4124,https://avatars.githubusercontent.com/u/12152972?v=4
682254415,WARP-Clash-API,vvbbnn00/WARP-Clash-API,Python,394,"该项目可以让你通过订阅的方式使用Cloudflare WARP+，自动获取流量。This project enables you to use Cloudflare WARP+ through subscription, automatically acquiring traffic.",436,3215,https://avatars.githubusercontent.com/u/46409975?u=7c599a070ad9356282987ea38a636e1aba893983&v=4
733465661,crewAI-examples,joaomdmoura/crewAI-examples,Python,15,,222,812,https://avatars.githubusercontent.com/u/667063?u=c0ea6956bba58ee8baabb6568f0374263ed96f1d&v=4
730753909,PyRIT,Azure/PyRIT,Python,192,The Python Risk Identification Tool for generative AI (PyRIT) is an open access automation framework to empower security professionals and machine learning engineers to proactively find risks in their generative AI systems.,90,643,https://avatars.githubusercontent.com/u/6844498?v=4
759896046,OpenCodeInterpreter,OpenCodeInterpreter/OpenCodeInterpreter,Python,114,,68,602,https://avatars.githubusercontent.com/u/160508878?v=4
726570398,AutoPrompt,Eladlev/AutoPrompt,Python,75,A framework for prompt tuning using Intent-based Prompt Calibration ,13,334,https://avatars.githubusercontent.com/u/28984104?v=4
10022320,mud-pi,Frimkron/mud-pi,Python,26,"A simple MUD server in Python, for teaching purposes, which could be run on a Raspberry Pi",87,320,https://avatars.githubusercontent.com/u/46865?v=4
754887592,r2d2,dnakov/r2d2,Python,63,🤖🏴‍☠️ radare2 plugin for GPT-4 🦜. Solve crackmes automatically 🪄,11,174,https://avatars.githubusercontent.com/u/3777433?u=54e9bbd6d8bafea5dc418d6a79884b47b2f9a86b&v=4
706701320,scroll,czbag/scroll,Python,10,Скрипт по работе со Scroll,76,147,https://avatars.githubusercontent.com/u/129870465?u=0e20ea316e7a7631bfe4db4a0072270e4b397858&v=4
