id,name,full_name,language,new stars,description,forks_count,stargazers_count,avatar_url
20580498,kubernetes,kubernetes/kubernetes,Go,273,Production-Grade Container Scheduling and Management,32906,89755,https://avatars.githubusercontent.com/u/13629408?v=4
56353740,minikube,kubernetes/minikube,Go,98,Run Kubernetes locally,4171,24258,https://avatars.githubusercontent.com/u/13629408?v=4
37448451,mattermost-server,mattermost/mattermost-server,Go,228,Mattermost is an open source platform for secure collaboration across the entire software development lifecycle.,5550,23354,https://avatars.githubusercontent.com/u/9828093?v=4
24268127,nvm-windows,coreybutler/nvm-windows,Go,134,A node.js version management utility for Windows. Ironically written in Go.,2295,21853,https://avatars.githubusercontent.com/u/770982?u=81e8d113dd0628720745aa8869123f9f28c955eb&v=4
135516270,k3s,k3s-io/k3s,Go,76,Lightweight Kubernetes,1796,20332,https://avatars.githubusercontent.com/u/49319725?v=4
6247705,testify,stretchr/testify,Go,175,A toolkit with common assertions and mocks that plays nicely with the standard library,1268,16896,https://avatars.githubusercontent.com/u/1841476?v=4
36653430,nomad,hashicorp/nomad,Go,461,"Nomad is an easy-to-use, flexible, and performant workload orchestrator that can deploy a mix of microservice, batch, containerized, and non-containerized applications. Nomad is easy to operate and scale and has native Consul and Vault integrations.",1600,11720,https://avatars.githubusercontent.com/u/761456?v=4
100982449,argo-workflows,argoproj/argo-workflows,Go,55,Workflow engine for Kubernetes,2313,11290,https://avatars.githubusercontent.com/u/30269780?v=4
208728772,milvus,milvus-io/milvus,Go,408,Vector database for scalable similarity search and AI applications.,1591,11150,https://avatars.githubusercontent.com/u/51735404?v=4
66156850,Go,TheAlgorithms/Go,Go,100,"Algorithms implemented in Go for beginners, following best practices.",1829,10207,https://avatars.githubusercontent.com/u/20487725?v=4
27051771,protobuf,golang/protobuf,Go,21,Go support for Google's protocol buffers,1546,8536,https://avatars.githubusercontent.com/u/4314092?v=4
237523442,tailscale,tailscale/tailscale,Go,79,"The easiest, most secure way to use WireGuard and 2FA.",499,8031,https://avatars.githubusercontent.com/u/48932923?v=4
161951219,wails,wailsapp/wails,Go,364,Create beautiful applications using Go,407,7935,https://avatars.githubusercontent.com/u/39746503?v=4
14508450,gophish,gophish/gophish,Go,482,Open-Source Phishing Toolkit,1421,7560,https://avatars.githubusercontent.com/u/16602581?v=4
93444615,terraform-provider-aws,hashicorp/terraform-provider-aws,Go,35,Terraform AWS provider,6787,7483,https://avatars.githubusercontent.com/u/761456?v=4
367758176,dtm,dtm-labs/dtm,Go,128,"A distributed transaction framework that supports multiple languages, supports saga, tcc, xa, 2-phase message, outbox patterns.",730,6657,https://avatars.githubusercontent.com/u/6055142?v=4
59522149,terragrunt,gruntwork-io/terragrunt,Go,19,Terragrunt is a thin wrapper for Terraform that provides extra tools for working with multiple Terraform modules.,761,5945,https://avatars.githubusercontent.com/u/17118990?v=4
273871859,headscale,juanfont/headscale,Go,111,"An open source, self-hosted implementation of the Tailscale control server",302,5130,https://avatars.githubusercontent.com/u/181059?u=56e87e3bf1145a99035e3ef576bc8c099214ac70&v=4
384451028,kitex,cloudwego/kitex,Go,77,A high-performance and strong-extensibility Go RPC framework that helps developers build microservices.,481,4549,https://avatars.githubusercontent.com/u/79236453?v=4
22485114,hcl,hashicorp/hcl,Go,20,HCL is the HashiCorp configuration language.,469,4129,https://avatars.githubusercontent.com/u/761456?v=4
221849341,asynq,hibiken/asynq,Go,251,"Simple, reliable, and efficient distributed task queue in Go",263,3562,https://avatars.githubusercontent.com/u/10953044?u=8a795841e6979ef992316dea37c7d2ac807aad04&v=4
52481933,navidrome,navidrome/navidrome,Go,196,ğŸ§â˜ï¸ Modern Music Server and Streamer compatible with Subsonic/Airsonic,352,3682,https://avatars.githubusercontent.com/u/26692192?v=4
491539130,hertz,cloudwego/hertz,Go,709,A high-performance and strong-extensibility Go HTTP framework that helps developers build microservices.,86,1103,https://avatars.githubusercontent.com/u/79236453?v=4
493181533,IOC-golang,alibaba/IOC-golang,Go,118,"ä¸€æ¬¾æœåŠ¡äº Go å¼€å‘è€…çš„ä¾èµ–æ³¨å…¥æ¡†æ¶ï¼Œæ–¹ä¾¿æ­å»ºä»»ä½• Go åº”ç”¨ã€‚ A Golang depenedency injection framework, helps developers to build any go application.",66,709,https://avatars.githubusercontent.com/u/1961952?v=4
502623865,GoMinerTool,MinerProxyBTC/GoMinerTool,Go,119,"æ”¯æŒBTC/ETH/XMR/ETC/BCH/CFX/ERG/RVNç­‰å¤šå¸ç§ä¸­è½¬çŸ¿æ± ä»£ç†ï¼Œç‹¬å®¶æ‰çº¿æé†’ï¼Œä¼ªè£…ç®—åŠ›ï¼Œæ”¯æŒæŠ½æ°´ï¼Œé˜²CCï¼Œæ— æŸè€—æŠ½æ°´,æ’å®šå¼€å‘è´¹ï¼æ”¯æŒTCPå’ŒSSLåè®®ï¼Œæ”¯æŒè‡ªå®šä¹‰è·¨çŸ¿æ± æŠ½æ°´ï¼Œé«˜æ€§èƒ½é«˜å¹¶å‘ï¼Œæ”¯æŒwebç•Œé¢ç®¡ç†ï¼Œå…¨è‡ªåŠ¨è¿›ç¨‹å®ˆæŠ¤ä»¥åŠå¼€æœºå¯åŠ¨,é…å¥—æœ¬åœ°éš§é“åŠ å¯†è½¯ä»¶ï¼Œä¿®æ”¹çŸ¿æ± æœ¬åœ°ç®—åŠ›ï¼Œipé»‘åå•ï¼Œç²¾ç¡®åˆ°å•å°è®¾å¤‡çš„24å°æ—¶æ•°æ®ç»Ÿè®¡ã€è‡ªå®šä¹‰éš§é“æ¨é€å·¥å…·ç­‰å¼ºå¤§åŠŸèƒ½...ethminerproxy",36,157,https://avatars.githubusercontent.com/u/99313894?u=e41403286933097ad8f859b66c7e8cea2dddcc7b&v=4
