id,name,full_name,language,new stars,description,forks_count,stargazers_count,avatar_url
49767244,primeng,primefaces/primeng,CSS,3,The Most Complete Angular UI Component Library,4469,9534,https://avatars.githubusercontent.com/u/3494069?v=4
160313905,primevue,primefaces/primevue,CSS,12,Next Generation Vue UI Component Library,1020,7861,https://avatars.githubusercontent.com/u/3494069?v=4
7517918,spring-petclinic,spring-projects/spring-petclinic,CSS,2,A sample Spring-based application,22609,7274,https://avatars.githubusercontent.com/u/317776?v=4
379916997,micro-app,micro-zoe/micro-app,CSS,5,"A simple, efficient and powerful micro front-end framework. 一款简约、高效、功能强大的微前端框架",544,5262,https://avatars.githubusercontent.com/u/86414403?v=4
329751286,youtube,safak/youtube,CSS,3,,5334,4863,https://avatars.githubusercontent.com/u/1486366?u=c367d218a8cf89ad09c3dbfb3c7ad7a929142f20&v=4
55240856,restful-api-guidelines,zalando/restful-api-guidelines,CSS,18,"A model set of guidelines for RESTful APIs and Events, created by Zalando",367,2375,https://avatars.githubusercontent.com/u/1564818?v=4
5169716,Anthias,Screenly/Anthias,CSS,1,The world's most popular open source digital signage project.,590,2284,https://avatars.githubusercontent.com/u/20972724?v=4
366437783,responsive-portfolio-website-Alexa,bedimcode/responsive-portfolio-website-Alexa,CSS,2,"Responsive Portfolio Website Using HTML, CSS & JavaScript",1483,2110,https://avatars.githubusercontent.com/u/61248995?u=ce8e7f12481e60e88d2480d1215211558ca4b137&v=4
116700454,hugo-paper,nanxiaobei/hugo-paper,CSS,3,"🪺 A simple, clean, customizable Hugo theme",457,1990,https://avatars.githubusercontent.com/u/13369712?v=4
351877974,python_interview_questions,yakimka/python_interview_questions,CSS,0,Вопросы для подготовки к интервью на позицию Python Developer,310,1400,https://avatars.githubusercontent.com/u/28621349?u=973eef21adf71f2c7da1caaaacf41d66e3f7d27f&v=4
133927297,sakai-react,primefaces/sakai-react,CSS,1,Free React Admin Template ,519,785,https://avatars.githubusercontent.com/u/3494069?v=4
263862433,Intro-to-Vue-3,Code-Pop/Intro-to-Vue-3,CSS,1,Code for Vue Mastery's Intro to Vue 3 course:,3063,747,https://avatars.githubusercontent.com/u/22382188?v=4
657272727,Dashboard-Designs,AsmrProg-YT/Dashboard-Designs,CSS,2,AsmrProg Youtube Channel Dashboard Designs Code Collection,309,654,https://avatars.githubusercontent.com/u/117723154?u=775754335a0e0644f76e4a44183770f79acc51ea&v=4
705310178,gevstack,gevendra2004/gevstack,CSS,6,All Gevstack projects,61,514,https://avatars.githubusercontent.com/u/123631888?u=8659a2b1994fac510b0155042b236f0e8265a454&v=4
14271569,scribe,stephband/scribe,JavaScript,0,Renders music in HTML.,19,409,https://avatars.githubusercontent.com/u/69022?v=4
684268923,font-awesome-pro,eliyantosarage/font-awesome-pro,CSS,0,CDN Font Awesome Pro v6.5.2 for Dekstop & Web,84,212,https://avatars.githubusercontent.com/u/20050290?u=55f27f79fa6f580cbed508b4f1eb68d9d357e58c&v=4
773453149,FF-ULTIMA,soulhotel/FF-ULTIMA,CSS,4,"Native Vertical Tabs, keep your sidebar, no extensions needed. No overthinking. FF Ultima.",5,189,https://avatars.githubusercontent.com/u/155501797?u=6cd0f3a9c96c6e359f2f45fd994b8c5606b39e0a&v=4
717213102,HWlD-spoofer-2024,m-datsu/HWlD-spoofer-2024,CSS,43,HWID-Spoofer/Changer-2024-for-free,0,144,https://avatars.githubusercontent.com/u/150476627?u=64d47d4921eb37a447cfdc6cd9cb412b54d0317b&v=4
720682413,slider_1,HoanghoDev/slider_1,CSS,0,,77,127,https://avatars.githubusercontent.com/u/110652388?u=6ef221bb952d3ab8ba823a40f21be3558d5e848b&v=4
639115534,Community-Site,Its-Aman-Yadav/Community-Site,CSS,5,This is open source village community site,83,54,https://avatars.githubusercontent.com/u/97724135?u=12f5edcb9691ac1f375e63ec67f3788b73859637&v=4
311546211,discord,rose-pine/discord,CSS,0,Soho vibes for Discord,27,52,https://avatars.githubusercontent.com/u/62077688?v=4
723786905,blogzen-OpenSource,piug-07/blogzen-OpenSource,CSS,5,"A collection of resources categorised by tech domains, languages, expertise and much more. Blogzen gives you a quick access to all the resources that you could need at a single place, with a click!",88,47,https://avatars.githubusercontent.com/u/105561630?u=a74d9a3f9c8966c4b005b71086162814ddb3c3b3&v=4
772013946,CareerZunction_Intern,HimanshuNarware/CareerZunction_Intern,CSS,3,"CareerZunction, an open-source platform, offers 200+ internships. Its user-friendly interface enables students to access career resources and foster professional growth. By connecting students with diverse opportunities, it empowers them in their career journeys.",60,44,https://avatars.githubusercontent.com/u/83147410?u=b83d4739fd5c83388fab447796358dd52fd690ab&v=4
698895438,RAPIDOC-HEALTHCARE-WEBSITE-,Anishkagupta04/RAPIDOC-HEALTHCARE-WEBSITE-,CSS,5,"It is an online platform based on providing healthcare facilites to the user and information regarding hospital like availability of beds, total number of patients,,helping user to prebook appointments for OPD ,check availability of blood groups in hospitals and many more .",68,36,https://avatars.githubusercontent.com/u/123764336?u=fded2fb7e8258e0a9a2702fe3f1585d0f85d5632&v=4
785287609,Spring-Music-Player,Satyam1923/Spring-Music-Player,CSS,3,"The JioSaavn Player project aims to create a feature-rich music player application leveraging the unofficial JioSaavn API. This application will provide users with a seamless experience to discover, stream, and organize their favorite music tracks from the extensive JioSaavn library.",42,28,https://avatars.githubusercontent.com/u/104068640?u=1c144170d08f38e0b231a32ac711ea7fc26bbb0a&v=4
