id,name,full_name,language,new stars,description,forks_count,stargazers_count,avatar_url
111583593,scrcpy,Genymobile/scrcpy,C,478,Display and control your Android device,10697,111741,https://avatars.githubusercontent.com/u/3427627?v=4
102578345,lede,coolsnowwolf/lede,C,56,Lean's LEDE source,19523,29807,https://avatars.githubusercontent.com/u/31687149?u=caa956c5f80318ea674625f9e9efa49c98335d74&v=4
7634677,openssl,openssl/openssl,C,69,TLS/SSL and crypto library,10132,25854,https://avatars.githubusercontent.com/u/3279138?v=4
184909163,yabai,koekeishiya/yabai,C,182,A tiling window manager for macOS based on binary space partitioning,650,23910,https://avatars.githubusercontent.com/u/6175959?u=e07b472bc4fa5500439c2c099a4736bcfd636769&v=4
11715753,masscan,robertdavidgraham/masscan,C,56,"TCP port scanner, spews SYN packets asynchronously, scanning entire Internet in under 5 minutes.",3074,23654,https://avatars.githubusercontent.com/u/3814757?v=4
214011414,WindTerm,kingToolbox/WindTerm,C,104,A professional cross-platform SSH/Sftp/Shell/Telnet/Serial terminal.,1800,23237,https://avatars.githubusercontent.com/u/51009775?v=4
80286288,Tasmota,arendst/Tasmota,C,42,"Alternative firmware for ESP8266 and ESP32 based devices with easy configuration using webUI, OTA updates, automation using timers or rules, expandability and entirely local control over MQTT, HTTP, Serial or KNX. Full documentation at",4807,22191,https://avatars.githubusercontent.com/u/11044339?u=b54c71859c551426b6738921138b740804ca1d62&v=4
470579591,unleashed-firmware,DarkFlippers/unleashed-firmware,C,79,Flipper Zero Unleashed Firmware,1450,17465,https://avatars.githubusercontent.com/u/115378555?v=4
60667730,lvgl,lvgl/lvgl,C,111,"Embedded graphics library to create beautiful UIs for any MCU, MPU and display type. ",3256,16644,https://avatars.githubusercontent.com/u/19811762?v=4
179354282,OpenCorePkg,acidanthera/OpenCorePkg,C,25,OpenCore bootloader,2110,13391,https://avatars.githubusercontent.com/u/39672954?v=4
32921736,audacity,audacity/audacity,C,64,Audio Editor                                     ,2267,12552,https://avatars.githubusercontent.com/u/11648186?v=4
39242894,coturn,coturn/coturn,C,44,coturn TURN server project,2023,11378,https://avatars.githubusercontent.com/u/6572098?v=4
59771425,zephyr,zephyrproject-rtos/zephyr,C,53,"Primary Git Repository for the Zephyr Project. Zephyr is a new generation, scalable, optimized, secure RTOS for multiple hardware architectures.",6603,10838,https://avatars.githubusercontent.com/u/19595895?v=4
106586124,atomic-red-team,redcanaryco/atomic-red-team,C,33,Small and highly portable detection tests based on MITRE's ATT&CK.,2801,9758,https://avatars.githubusercontent.com/u/6877001?v=4
59676171,klipper,Klipper3d/klipper,C,38,Klipper is a 3d-printer firmware,5316,9502,https://avatars.githubusercontent.com/u/90982958?v=4
32222044,box2d,erincatto/box2d,C,39,Box2D is a 2D physics engine for games,1545,8296,https://avatars.githubusercontent.com/u/7284063?u=1b7798b1dc7fa1c4167a4e110686094a3fad37ae&v=4
190845267,sm64,n64decomp/sm64,C,104,"A Super Mario 64 decompilation, brought to you by a bunch of clever folks.",1373,7748,https://avatars.githubusercontent.com/u/47247020?v=4
124678204,aircrack-ng,aircrack-ng/aircrack-ng,C,32,WiFi security auditing tools suite,943,5435,https://avatars.githubusercontent.com/u/4042925?u=2e4aed03769fc637d27c21e223a530d4240e59e0&v=4
251043704,mayhem-firmware,portapack-mayhem/mayhem-firmware,C,37,Custom firmware for the HackRF+PortaPack H1/H2/H4,560,3448,https://avatars.githubusercontent.com/u/136080346?v=4
199931048,c3c,c3lang/c3c,C,72,Compiler for the C3 language,182,2931,https://avatars.githubusercontent.com/u/53541653?v=4
573377157,bpf-developer-tutorial,eunomia-bpf/bpf-developer-tutorial,C,38,eBPF Developer Tutorial: Learning eBPF Step by Step with Examples,364,2597,https://avatars.githubusercontent.com/u/111646515?v=4
157359627,esp32-camera,espressif/esp32-camera,C,17,,641,1919,https://avatars.githubusercontent.com/u/9460735?v=4
