id,name,full_name,language,new stars,description,forks_count,stargazers_count,avatar_url
1700621,normalize.css,necolas/normalize.css,CSS,60,A modern alternative to CSS resets,10954,49616,https://avatars.githubusercontent.com/u/239676?u=4b545d3dd62d217b40a624ebbe987cfc67e73803&v=4
50264296,bulma,jgthms/bulma,CSS,65,Modern CSS framework based on Flexbox,3923,46730,https://avatars.githubusercontent.com/u/1254808?u=1d9df343bac6f57e7bff85f0074aac2de34f5dcc&v=4
27574418,nerd-fonts,ryanoasis/nerd-fonts,CSS,174,"Iconic font aggregator, collection, & patcher. 3,600+ icons, 50+ patched fonts: Hack, Source Code Pro, more. Glyph collections: Font Awesome, Material Design Icons, Octicons, & more",3180,41262,https://avatars.githubusercontent.com/u/8083459?u=1645f43000c842a948268609231bdecb1433c470&v=4
313330998,50projects50days,bradtraversy/50projects50days,CSS,541,"50+ mini web projects using HTML, CSS & JS",6705,25262,https://avatars.githubusercontent.com/u/5550850?u=45352e59e108ddd00ead26981cd6a4a53b151b1d&v=4
1365679,tomorrow-theme,chriskempson/tomorrow-theme,CSS,17,Tomorrow Theme,3253,13372,https://avatars.githubusercontent.com/u/473831?u=9f381d4ce4aae902a11b604533134ba111582220&v=4
27844645,jupyter-themes,dunovank/jupyter-themes,CSS,13,Custom Jupyter Notebook Themes,1049,9414,https://avatars.githubusercontent.com/u/3844814?u=db8013079ad8185467256ec8d2e50f65a3922720&v=4
13099301,flag-icons,lipis/flag-icons,CSS,22,:flags: A curated collection of all country flags in SVG — plus the CSS for easier integration,1696,9178,https://avatars.githubusercontent.com/u/125676?u=ed6b72344fe5cb2195b3e213b2ee5be905bd2766&v=4
259354262,scaffold-eth,scaffold-eth/scaffold-eth,CSS,36,🏗 forkable Ethereum dev stack focused on fast product iterations ,2975,8377,https://avatars.githubusercontent.com/u/90008925?v=4
49767244,primeng,primefaces/primeng,CSS,12,The Most Complete Angular UI Component Library,4049,7931,https://avatars.githubusercontent.com/u/3494069?v=4
41443539,vscode-docs,microsoft/vscode-docs,CSS,12,Public documentation for Visual Studio Code,3928,4858,https://avatars.githubusercontent.com/u/6154722?v=4
23981144,Infosec_Reference,rmusser01/Infosec_Reference,CSS,33,An Information Security Reference That Doesn't Suck; https://rmusser.net/git/admin-2/Infosec_Reference for non-MS Git hosted version.,1117,4760,https://avatars.githubusercontent.com/u/1444720?v=4
141040549,seeker,thewhiteh4t/seeker,CSS,29,Accurately Locate Smartphones using Social Engineering ,1312,4415,https://avatars.githubusercontent.com/u/36354846?u=99d06a9237c301569774dac1c70218d5c032773a&v=4
204008310,spicetify-themes,spicetify/spicetify-themes,CSS,17,A community-driven collection of themes for customizing Spotify through Spicetify - https://github.com/spicetify/spicetify-cli,1209,4044,https://avatars.githubusercontent.com/u/100136310?v=4
233306241,hass-config,matt8707/hass-config,CSS,30,✨ A different take on designing a Lovelace UI (Dashboard),590,3786,https://avatars.githubusercontent.com/u/36163594?v=4
76666208,primereact,primefaces/primereact,CSS,27,The Most Complete React UI Component Library,678,3470,https://avatars.githubusercontent.com/u/3494069?v=4
160313905,primevue,primefaces/primevue,CSS,25,Next Generation Vue UI Component Library,636,3279,https://avatars.githubusercontent.com/u/3494069?v=4
299116052,react-projects,john-smilga/react-projects,CSS,16,,3131,2844,https://avatars.githubusercontent.com/u/42133389?u=9d63b6d71fba139347cddf2c840a858c8ff97168&v=4
5169716,Anthias,Screenly/Anthias,CSS,18,The world's most popular open source digital signage project.,543,1652,https://avatars.githubusercontent.com/u/20972724?v=4
292673424,cloudflare-docs,cloudflare/cloudflare-docs,CSS,22,Cloudflare’s documentation,1989,1607,https://avatars.githubusercontent.com/u/314135?v=4
116700454,hugo-paper,nanxiaobei/hugo-paper,CSS,11,"🪺 A simple, clean, flexible Hugo theme",300,1347,https://avatars.githubusercontent.com/u/13369712?v=4
433605398,openai-quickstart-python,openai/openai-quickstart-python,CSS,32,Python example app from the OpenAI API quickstart tutorial,431,448,https://avatars.githubusercontent.com/u/14957082?v=4
351877974,python_interview_questions,yakimka/python_interview_questions,CSS,26,Вопросы для подготовки к интервью на позицию Python Developer,114,379,https://avatars.githubusercontent.com/u/28621349?u=973eef21adf71f2c7da1caaaacf41d66e3f7d27f&v=4
482952731,intro-to-dotnet-web-dev,dotnet/intro-to-dotnet-web-dev,CSS,12,"Get Started as a Web Developer with .NET, C#, and ASP.NET Core",378,306,https://avatars.githubusercontent.com/u/9141961?v=4
574579578,Ooogle-it,foyer-work/Ooogle-it,CSS,23,Open AI’s ChatGPT powered extension to use anywhere!,26,111,https://avatars.githubusercontent.com/u/105641366?v=4
348011934,Incognito,caracal-js/Incognito,CSS,1,Source code.,435,61,https://avatars.githubusercontent.com/u/59297610?u=6d62a7d9a36ff517ab48b37825da52589eb14822&v=4
