id,name,full_name,language,new stars,description,forks_count,stargazers_count,avatar_url
59239347,portainer,portainer/portainer,Go,14,Making Docker and Kubernetes management easy.,2282,27105,https://avatars.githubusercontent.com/u/22225832?v=4
208728772,milvus,milvus-io/milvus,Go,32,"A cloud-native vector database, storage for next generation AI applications",2605,24075,https://avatars.githubusercontent.com/u/51735404?v=4
48109239,cilium,cilium/cilium,Go,11,"eBPF-based Networking, Security, and Observability",2480,17032,https://avatars.githubusercontent.com/u/21054566?v=4
31558937,teleport,gravitational/teleport,Go,5,Protect access to all of your infrastructure.,1606,15372,https://avatars.githubusercontent.com/u/10781132?v=4
30711774,validator,go-playground/validator,Go,5,":100:Go Struct and Field validation, including Cross Field, Cross Struct, Map, Slice and Array diving",1228,14435,https://avatars.githubusercontent.com/u/14768796?v=4
36653430,nomad,hashicorp/nomad,Go,6,"Nomad is an easy-to-use, flexible, and performant workload orchestrator that can deploy a mix of microservice, batch, containerized, and non-containerized applications. Nomad is easy to operate and scale and has native Consul and Vault integrations.",1886,14093,https://avatars.githubusercontent.com/u/761456?v=4
7083242,mysql,go-sql-driver/mysql,Go,5,Go MySQL Driver is a MySQL driver for Go's (golang) database/sql package,2374,13819,https://avatars.githubusercontent.com/u/3002971?v=4
33258973,telegraf,influxdata/telegraf,Go,3,The plugin-driven server agent for collecting & reporting metrics.,5445,13360,https://avatars.githubusercontent.com/u/5713248?v=4
118105436,migrate,golang-migrate/migrate,Go,8,Database migrations. CLI and Golang library.,1252,12627,https://avatars.githubusercontent.com/u/35595841?v=4
10270722,go-github,google/go-github,Go,4,Go library for accessing the GitHub v3 API,2074,9745,https://avatars.githubusercontent.com/u/1342004?v=4
27051771,protobuf,golang/protobuf,Go,4,Go support for Google's protocol buffers,1642,9336,https://avatars.githubusercontent.com/u/4314092?v=4
41288708,sourcegraph,sourcegraph/sourcegraph,Go,4,Code AI platform with Code Search & Cody,1193,9140,https://avatars.githubusercontent.com/u/3979584?v=4
66509131,client-go,kubernetes/client-go,Go,2,Go client for Kubernetes.,2872,8193,https://avatars.githubusercontent.com/u/13629408?v=4
11759482,godotenv,joho/godotenv,Go,8,A Go port of Ruby's dotenv library (Loads environment variables from .env files),398,6867,https://avatars.githubusercontent.com/u/4092?u=57ba376fe5e8346fdad11d8f4dbae07562a7ff8b&v=4
120519269,atlantis,runatlantis/atlantis,Go,12,Terraform Pull Request Automation,951,6652,https://avatars.githubusercontent.com/u/32311288?v=4
110027931,metallb,metallb/metallb,Go,3,A network load-balancer implementation for Kubernetes using standard routing protocols,825,6231,https://avatars.githubusercontent.com/u/60239468?v=4
58821882,go-grpc-middleware,grpc-ecosystem/go-grpc-middleware,Go,2,"Golang gRPC Middlewares: interceptor chaining, auth, logging, retries and more.",684,5776,https://avatars.githubusercontent.com/u/19352526?v=4
192178626,docker-development-youtube-series,marcel-dempers/docker-development-youtube-series,Go,8,,3676,4653,https://avatars.githubusercontent.com/u/34320559?u=8b1daab2937d0174c953379c3fd05bb2f89bab2c&v=4
187086161,opentelemetry-go,open-telemetry/opentelemetry-go,Go,3,OpenTelemetry Go API and SDK,976,4358,https://avatars.githubusercontent.com/u/49998002?v=4
84610043,aws-load-balancer-controller,kubernetes-sigs/aws-load-balancer-controller,Go,4,A Kubernetes controller for Elastic Load Balancers,1322,3582,https://avatars.githubusercontent.com/u/36015203?v=4
107600830,aws-lambda-go,aws/aws-lambda-go,Go,0,"Libraries, samples and tools to help Go developers develop AWS Lambda functions.",592,3466,https://avatars.githubusercontent.com/u/2232217?v=4
473137633,tetragon,cilium/tetragon,Go,26,eBPF-based Security Observability and Runtime Enforcement,257,2875,https://avatars.githubusercontent.com/u/21054566?v=4
106473613,k8s-device-plugin,NVIDIA/k8s-device-plugin,Go,5,NVIDIA device plugin for Kubernetes,591,2071,https://avatars.githubusercontent.com/u/1728152?v=4
100061496,spire,spiffe/spire,Go,2,The SPIFFE Runtime Environment,424,1556,https://avatars.githubusercontent.com/u/19497462?v=4
715923298,clash-rev,MerlinKodo/clash-rev,Go,399,Continuation of Clash core project,43,1016,https://avatars.githubusercontent.com/u/150133030?u=8d9e050f5ba8c4d96eeed8753892c73fc401b9c4&v=4
