id,name,full_name,language,new stars,description,forks_count,stargazers_count,avatar_url
2325298,linux,torvalds/linux,C,487,Linux kernel source tree,46409,144973,https://avatars.githubusercontent.com/u/1024025?v=4
36502,git,git/git,C,127,Git Source Code Mirror - This is a publish-only repository but pull requests can be turned into patches to the mailing list via GitGitGadget (https://gitgitgadget.github.io/). Please follow Documentation/SubmittingPatches procedure for any of your improvements.,24570,44958,https://avatars.githubusercontent.com/u/18133?v=4
5101141,jq,stedolan/jq,C,62,Command-line JSON processor,1391,24050,https://avatars.githubusercontent.com/u/79765?v=4
7634677,openssl,openssl/openssl,C,60,TLS/SSL and crypto library,8783,20639,https://avatars.githubusercontent.com/u/3279138?v=4
84240850,timescaledb,timescale/timescaledb,C,53,An open-source time-series SQL database optimized for fast ingest and complex queries.  Packaged as a PostgreSQL extension.,757,14377,https://avatars.githubusercontent.com/u/8986001?v=4
45821540,openwrt,openwrt/openwrt,C,61,This repository is a mirror of https://git.openwrt.org/openwrt/openwrt.git It is for reference only and is not active for check-ins.  We will continue to accept Pull Requests here. They will be merged via staging trees then into openwrt.git.,8214,13706,https://avatars.githubusercontent.com/u/2528830?v=4
13836499,raylib,raysan5/raylib,C,65,A simple and easy-to-use library to enjoy videogames programming,1387,11488,https://avatars.githubusercontent.com/u/5766837?u=28d52cd1077b2f8b48d3897e82f03280a565e8d6&v=4
394318710,ExplorerPatcher,valinet/ExplorerPatcher,C,190,This project aims to enhance the working environment on Windows,582,11017,https://avatars.githubusercontent.com/u/6503598?u=25d850b7dcc57d2a488d83646fff7cca48cf7fc7&v=4
65899476,esp-idf,espressif/esp-idf,C,50,Espressif IoT Development Framework. Official development framework for Espressif SoCs.,6114,9780,https://avatars.githubusercontent.com/u/9460735?v=4
1979797,FreeRDP,FreeRDP/FreeRDP,C,31,FreeRDP is a free remote desktop protocol library and clients,20576,7811,https://avatars.githubusercontent.com/u/663376?v=4
105944401,yugabyte-db,yugabyte/yugabyte-db,C,18,YugabyteDB - the cloud native distributed SQL database for mission-critical applications.,880,7421,https://avatars.githubusercontent.com/u/17074854?v=4
59771425,zephyr,zephyrproject-rtos/zephyr,C,31,"Primary Git Repository for the Zephyr Project. Zephyr is a new generation, scalable, optimized, secure RTOS for multiple hardware architectures.",4502,7133,https://avatars.githubusercontent.com/u/19595895?v=4
37060852,betaflight,betaflight/betaflight,C,30,Open Source Flight Controller Firmware,2444,6436,https://avatars.githubusercontent.com/u/19597933?v=4
40556106,wazuh,wazuh/wazuh,C,26,Wazuh - The Open Source Security Platform. Unified XDR and SIEM protection for endpoints and cloud workloads.,943,5470,https://avatars.githubusercontent.com/u/13752566?v=4
537699,CMake,Kitware/CMake,C,44,Mirror of CMake upstream repository,2380,5434,https://avatars.githubusercontent.com/u/87549?v=4
541269386,whisper.cpp,ggerganov/whisper.cpp,C,243,Port of OpenAI's Whisper model in C/C++,369,5217,https://avatars.githubusercontent.com/u/1991296?u=28314d364d7c28f8ec232fadb767970d3ad74e7b&v=4
400501136,mujoco,deepmind/mujoco,C,30,Multi-Joint dynamics with Contact. A general purpose physics simulator.,471,5214,https://avatars.githubusercontent.com/u/8596759?v=4
6687936,mbedtls,Mbed-TLS/mbedtls,C,11,"An open source, portable, easy to use, readable and flexible TLS library, and reference implementation of the PSA Cryptography API.",2180,3951,https://avatars.githubusercontent.com/u/97226525?v=4
5720995,lxc,lxc/lxc,C,17,LXC - Linux Containers,1063,3949,https://avatars.githubusercontent.com/u/2301756?v=4
128791889,haproxy,haproxy/haproxy,C,13,HAProxy Load Balancer's development branch (mirror of git.haproxy.org),646,3418,https://avatars.githubusercontent.com/u/38220289?v=4
217654199,msquic,microsoft/msquic,C,15,"Cross-platform, C implementation of the IETF QUIC protocol, exposed to C, C++, C# and Rust.",410,3187,https://avatars.githubusercontent.com/u/6154722?v=4
331380723,pico-sdk,raspberrypi/pico-sdk,C,31,,504,1986,https://avatars.githubusercontent.com/u/1294177?v=4
226167620,InfiniTime,InfiniTimeOrg/InfiniTime,C,19,Firmware for Pinetime smartwatch written in C/C++ and based on FreeRTOS,699,1970,https://avatars.githubusercontent.com/u/91782433?v=4
646423,pgbouncer,pgbouncer/pgbouncer,C,10,lightweight connection pooler for PostgreSQL,355,1880,https://avatars.githubusercontent.com/u/11858179?v=4
568919373,caretta,groundcover-com/caretta,C,530,"Instant K8s service dependency map, right to your Grafana.",26,709,https://avatars.githubusercontent.com/u/86922185?v=4
