id,name,full_name,language,new stars,description,forks_count,stargazers_count,avatar_url
184456251,PowerToys,microsoft/PowerToys,C#,2016,Windows system utilities to maximize productivity,4565,79933,https://avatars.githubusercontent.com/u/6154722?v=4
49609581,PowerShell,PowerShell/PowerShell,C#,344,PowerShell for every system!,5950,35291,https://avatars.githubusercontent.com/u/11524380?v=4
199570071,v2rayN,2dust/v2rayN,C#,841,"A V2Ray client for Windows, support Xray core and v2fly core",6511,32654,https://avatars.githubusercontent.com/u/31833384?v=4
164140756,Files,files-community/Files,C#,598,Building the best File Manager for Windows,1547,24621,https://avatars.githubusercontent.com/u/65931357?v=4
54086969,awesome-dotnet-core,thangchung/awesome-dotnet-core,C#,204,":honeybee: A collection of awesome .NET core libraries, tools, frameworks and software",2618,16941,https://avatars.githubusercontent.com/u/422341?u=b24af4c3b730fe4554fac2408390b646294facdc&v=4
16157746,efcore,dotnet/efcore,C#,125,"EF Core is a modern object-database mapper for .NET. It supports LINQ queries, change tracking, updates, and schema migrations.",2826,11798,https://avatars.githubusercontent.com/u/9141961?v=4
210716005,runtime,dotnet/runtime,C#,302,".NET is a cross-platform runtime for cloud, mobile, desktop, and IoT apps.",3462,10286,https://avatars.githubusercontent.com/u/9141961?v=4
213460285,CleanArchitecture,jasontaylordev/CleanArchitecture,C#,328,Clean Architecture Solution Template for .NET 6,2247,9901,https://avatars.githubusercontent.com/u/1988321?u=f96f36eed8f5bc57c4aab7213306f960efc072b1&v=4
375939072,FastGithub,dotnetcore/FastGithub,C#,508,github加速神器，解决github打不开、用户头像无法加载、releases无法上传下载、git-clone、git-pull、git-push失败等问题,1204,8861,https://avatars.githubusercontent.com/u/19404084?v=4
201188122,lively,rocksdanister/lively,C#,359,Free and open-source software that allows users to set animated desktop wallpapers and screensavers.,732,8803,https://avatars.githubusercontent.com/u/17554161?u=8e8419fd0693513282e55e212a0ef21e58310687&v=4
135050219,CMWTAT_Digital_Edition,TGSAN/CMWTAT_Digital_Edition,C#,322,"CloudMoe Windows 10/11 Activation Toolkit get digital license, the best open source Win 10/11 activator in GitHub. GitHub 上最棒的开源 Win10/Win11 数字权利（数字许可证）激活工具！",1388,8658,https://avatars.githubusercontent.com/u/7440847?u=9a04b599cc7d75db6aa271e76d4a7d5ac722661b&v=4
18586705,nopCommerce,nopSolutions/nopCommerce,C#,110,ASP.NET Core eCommerce software. nopCommerce is a free and open-source shopping cart.,4310,7591,https://avatars.githubusercontent.com/u/7234683?v=4
113807330,Terminal.Gui,gui-cs/Terminal.Gui,C#,469,Cross Platform Terminal UI toolkit for .NET,569,7472,https://avatars.githubusercontent.com/u/106351764?v=4
125612271,EntityComponentSystemSamples,Unity-Technologies/EntityComponentSystemSamples,C#,119,,1115,4674,https://avatars.githubusercontent.com/u/426196?v=4
122837111,xdm,subhra74/xdm,C#,125,Powerfull download accelerator and video downloader,863,4471,https://avatars.githubusercontent.com/u/8403090?v=4
288428676,MudBlazor,MudBlazor/MudBlazor,C#,200,"Blazor Component Library based on Material design. The goal is to do more with Blazor, utilizing CSS and keeping Javascript to a bare minimum.",719,4091,https://avatars.githubusercontent.com/u/79755064?v=4
245033131,ProxySU,proxysu/ProxySU,C#,160,"Xray,V2ray，Trojan，NaiveProxy, Trojan-Go, ShadowsocksR(SSR),Shadowsocks-libev及相关插件,MTProto+TLS 一键安装工具，windows下用（一键科学上网）",1369,4089,https://avatars.githubusercontent.com/u/61810006?u=c4001a94fbecdda67bfd1b29c7e1ee17fe9d5f11&v=4
100711978,btcpayserver,btcpayserver/btcpayserver,C#,76,"Accept Bitcoin payments. Free, open-source & self-hosted, Bitcoin payment processor. ",952,3804,https://avatars.githubusercontent.com/u/31132886?v=4
158405551,git-credential-manager,GitCredentialManager/git-credential-manager,C#,200,"Secure, cross-platform Git credential storage with authentication to GitHub, Azure Repos, and other popular Git hosting services.",823,3272,https://avatars.githubusercontent.com/u/64464614?v=4
387542412,ThisIsWin11,builtbybel/ThisIsWin11,C#,239,The real PowerToys for Windows 11,254,3269,https://avatars.githubusercontent.com/u/48735732?v=4
46233451,example-voting-app,dockersamples/example-voting-app,C#,61,Example Docker Compose app,6095,3202,https://avatars.githubusercontent.com/u/25759379?v=4
103370157,optimizer,hellzerg/optimizer,C#,452,The finest Windows Optimizer,317,3153,https://avatars.githubusercontent.com/u/3146835?u=012a457ae34fc7f8a0e55e66f7e3f1702a6e7a47&v=4
325787527,DesignPatternsLibrary,nemanjarogic/DesignPatternsLibrary,C#,408,"A comprehensive design patterns library implemented in C#, which covers various design patterns from the most commonly used ones to the lesser-known ones. Get familiar with and learn design patterns through moderately realistic examples.",139,1511,https://avatars.githubusercontent.com/u/12249325?u=bc5a60c88469611353783c7bbb81aee486ee215f&v=4
373274891,Maui,CommunityToolkit/Maui,C#,107,"The .NET MAUI Community Toolkit is a community-created library that contains .NET MAUI Extensions, Advanced UI/UX Controls, and Behaviors to help make your life as a .NET MAUI developer easier",126,983,https://avatars.githubusercontent.com/u/41346473?v=4
307848141,com.unity.multiplayer.samples.coop,Unity-Technologies/com.unity.multiplayer.samples.coop,C#,67,"A small-scale cooperative game sample built on the new, Unity networking framework to teach developers about creating a similar multiplayer game.",281,975,https://avatars.githubusercontent.com/u/426196?v=4
