id,name,full_name,language,new stars,description,forks_count,stargazers_count,avatar_url
45717250,tensorflow,tensorflow/tensorflow,C++,858,An Open Source Machine Learning Framework for Everyone,87342,168565,https://avatars.githubusercontent.com/u/15658638?v=4
5108051,opencv,opencv/opencv,C++,623,Open Source Computer Vision Library,52764,64418,https://avatars.githubusercontent.com/u/5009934?v=4
65600975,pytorch,pytorch/pytorch,C++,847,Tensors and Dynamic neural networks in Python with strong GPU acceleration,16669,59760,https://avatars.githubusercontent.com/u/21003710?v=4
27729880,grpc,grpc/grpc,C++,392,"The C based gRPC (C++, Python, Ruby, Objective-C, PHP, C#)",9473,36013,https://avatars.githubusercontent.com/u/7802525?v=4
39840932,googletest,google/googletest,C++,582,GoogleTest - Google Testing and Mocking Framework,8895,28165,https://avatars.githubusercontent.com/u/1342004?v=4
1116542,aria2,aria2/aria2,C++,372,"aria2 is a lightweight multi-protocol & multi-source, cross platform download utility operated in command-line. It supports HTTP/HTTPS, FTP, SFTP, BitTorrent and Metalink.",3107,27813,https://avatars.githubusercontent.com/u/13545224?v=4
168008797,calculator,microsoft/calculator,C++,439,Windows Calculator: A simple yet powerful calculator that ships with Windows,4675,26029,https://avatars.githubusercontent.com/u/6154722?v=4
4524181,folly,facebook/folly,C++,376,An open-source C++ library developed and used at Facebook.,4871,23513,https://avatars.githubusercontent.com/u/69631?v=4
98771110,TrafficMonitor,zhongyang219/TrafficMonitor,C++,1064,è¿™æ˜¯ä¸€ä¸ªç”¨äºæ˜¾ç¤ºå½“å‰ç½‘é€Ÿã€CPUåŠå†…å­˜åˆ©ç”¨ç‡çš„æ¡Œé¢æ‚¬æµ®çª—è½¯ä»¶ï¼Œå¹¶æ”¯æŒä»»åŠ¡æ æ˜¾ç¤ºï¼Œæ”¯æŒæ›´æ¢çš®è‚¤ã€‚,2476,23179,https://avatars.githubusercontent.com/u/30562462?u=18ad9b9dfa6e784088d28deb7e0dbe830afcc0b7&v=4
160083795,serenity,SerenityOS/serenity,C++,804,The Serenity Operating System ğŸ,2385,22352,https://avatars.githubusercontent.com/u/50811782?v=4
63477612,C-Plus-Plus,TheAlgorithms/C-Plus-Plus,C++,1186,"Collection of various algorithms in mathematics, machine learning, computer science and physics implemented in C++ for educational purposes.",5906,22024,https://avatars.githubusercontent.com/u/20487725?v=4
1062572,Catch2,catchorg/Catch2,C++,225,"A modern, C++-native, test framework for unit-tests, TDD and BDD - using C++14, C++17 and later (C++11 support is in v2.x branch, and C++03 on the Catch1.x branch)",2678,15759,https://avatars.githubusercontent.com/u/33321405?v=4
437245741,dragonfly,dragonflydb/dragonfly,C++,3381,A modern replacement for Redis and Memcached,476,15355,https://avatars.githubusercontent.com/u/104819355?v=4
104231541,abseil-cpp,abseil/abseil-cpp,C++,183,Abseil Common Libraries (C++),2083,11124,https://avatars.githubusercontent.com/u/26718316?v=4
35129809,transmission,transmission/transmission,C++,633,Official Transmission BitTorrent client repository,985,7876,https://avatars.githubusercontent.com/u/223312?v=4
128479644,esphome,esphome/esphome,C++,128,ESPHome is a system to control your ESP8266/ESP32 by simple yet powerful configuration files and control them remotely through Home Automation systems.,1855,5358,https://avatars.githubusercontent.com/u/45919759?v=4
309512982,redpanda,redpanda-data/redpanda,C++,227,Redpanda is a streaming data platform for developers. Kafka API compatible. 10x faster. No ZooKeeper. No JVM!,335,5079,https://avatars.githubusercontent.com/u/49406389?v=4
244694174,connectedhomeip,project-chip/connectedhomeip,C++,475,"Matter (formerly Project CHIP) creates more connections between more objects, simplifying development for manufacturers and increasing compatibility for consumers, guided by the Connectivity Standards Alliance.",1057,4837,https://avatars.githubusercontent.com/u/61027988?v=4
384520418,MaaAssistantArknights,MaaAssistantArknights/MaaAssistantArknights,C++,748,"ã€Šæ˜æ—¥æ–¹èˆŸã€‹å°åŠ©æ‰‹ï¼Œå…¨æ—¥å¸¸ä¸€é”®é•¿è‰ï¼| An Arknights assistant compatible with EN, JP, KR, ZH_TW clients",493,4392,https://avatars.githubusercontent.com/u/97677443?v=4
23496542,triton,openai/triton,C++,106,Development repository for the Triton language and compiler,347,4128,https://avatars.githubusercontent.com/u/14957082?v=4
224468265,NotepadNext,dail8859/NotepadNext,C++,1340,"A cross-platform, reimplementation of Notepad++",238,3999,https://avatars.githubusercontent.com/u/3694843?v=4
470730648,Hyprland,hyprwm/Hyprland,C++,468,Hyprland is a dynamic tiling Wayland compositor that doesn't sacrifice on its looks.,118,3375,https://avatars.githubusercontent.com/u/107882187?v=4
15667250,ceres-solver,ceres-solver/ceres-solver,C++,219,A large scale non-linear optimization library,907,2818,https://avatars.githubusercontent.com/u/6327561?v=4
439448087,PolyMC,PolyMC/PolyMC,C++,304,A custom launcher for Minecraft that allows you to easily manage multiple installations of Minecraft at once (Fork of MultiMC),328,1817,https://avatars.githubusercontent.com/u/96310119?v=4
521191759,FluidX3D,ProjectPhysX/FluidX3D,C++,383,"The fastest and most memory efficient lattice Boltzmann CFD software, running on any GPU via OpenCL.",70,746,https://avatars.githubusercontent.com/u/90851087?u=42f86cacbdddb2da5e6bf1ce0a9cc4ea425851b2&v=4
