id,name,full_name,language,new stars,description,forks_count,stargazers_count,avatar_url
2325298,linux,torvalds/linux,C,2047,Linux kernel source tree,45165,140231,https://avatars.githubusercontent.com/u/1024025?v=4
36502,git,git/git,C,457,Git Source Code Mirror - This is a publish-only repository but pull requests can be turned into patches to the mailing list via GitGitGadget (https://gitgitgadget.github.io/). Please follow Documentation/SubmittingPatches procedure for any of your improvements.,24196,43999,https://avatars.githubusercontent.com/u/18133?v=4
102578345,lede,coolsnowwolf/lede,C,439,Lean's LEDE source,18161,23427,https://avatars.githubusercontent.com/u/31687149?u=caa956c5f80318ea674625f9e9efa49c98335d74&v=4
7634677,openssl,openssl/openssl,C,260,TLS/SSL and crypto library,8480,19618,https://avatars.githubusercontent.com/u/3279138?v=4
80286288,Tasmota,arendst/Tasmota,C,145,"Alternative firmware for ESP8266 with easy configuration using webUI, OTA updates, automation using timers or rules, expandability and entirely local control over MQTT, HTTP, Serial or KNX. Full documentation at",4136,18518,https://avatars.githubusercontent.com/u/11044339?u=b54c71859c551426b6738921138b740804ca1d62&v=4
18496166,mimikatz,gentilkiwi/mimikatz,C,198,A little tool to play with Windows security,3161,16199,https://avatars.githubusercontent.com/u/2307945?v=4
47409672,hashcat,hashcat/hashcat,C,467,World's fastest and most advanced password recovery utility,2381,15857,https://avatars.githubusercontent.com/u/15949799?v=4
34921116,bcc,iovisor/bcc,C,267,"BCC - Tools for BPF-based Linux IO analysis, networking, monitoring, and more",3112,15764,https://avatars.githubusercontent.com/u/12766186?v=4
63477515,C,TheAlgorithms/C,C,375,"Collection of various algorithms in mathematics, machine learning, computer science, physics, etc implemented in C for educational purposes.",3764,14763,https://avatars.githubusercontent.com/u/20487725?v=4
488002779,open-gpu-kernel-modules,NVIDIA/open-gpu-kernel-modules,C,202,NVIDIA Linux open GPU kernel module source,883,12635,https://avatars.githubusercontent.com/u/1728152?v=4
78281075,esp8266_deauther,SpacehuhnTech/esp8266_deauther,C,191,Affordable WiFi hacking platform for testing and learning,2246,10664,https://avatars.githubusercontent.com/u/64325017?v=4
70127218,arduino-esp32,espressif/arduino-esp32,C,179,Arduino core for the ESP32,6041,9517,https://avatars.githubusercontent.com/u/9460735?v=4
394318710,ExplorerPatcher,valinet/ExplorerPatcher,C,771,This project aims to enhance the working environment on Windows,499,8892,https://avatars.githubusercontent.com/u/6503598?u=25d850b7dcc57d2a488d83646fff7cca48cf7fc7&v=4
32921736,audacity,audacity/audacity,C,223,Audio Editor                                     ,1932,8291,https://avatars.githubusercontent.com/u/11648186?v=4
437011,zfs,openzfs/zfs,C,130,OpenZFS on Linux and FreeBSD,1527,8237,https://avatars.githubusercontent.com/u/4510897?v=4
105944401,yugabyte-db,yugabyte/yugabyte-db,C,262,"The high-performance distributed SQL database for global, internet-scale apps.",854,7183,https://avatars.githubusercontent.com/u/17074854?v=4
47057247,vlmcsd,Wind4/vlmcsd,C,250,"KMS Emulator in C (currently runs on Linux including Android, FreeBSD, Solaris, Minix, Mac OS, iOS, Windows with or without Cygwin)",1894,6706,https://avatars.githubusercontent.com/u/3997851?v=4
40504480,xv6-public,mit-pdos/xv6-public,C,90,xv6 OS,3246,5913,https://avatars.githubusercontent.com/u/12404246?v=4
59676171,klipper,Klipper3d/klipper,C,133,Klipper is a 3d-printer firmware,3729,5478,https://avatars.githubusercontent.com/u/90982958?v=4
40556106,wazuh,wazuh/wazuh,C,341,Wazuh - The Open Source Security Platform,880,5092,https://avatars.githubusercontent.com/u/13752566?v=4
3681392,hackrf,greatscottgadgets/hackrf,C,82,low cost software radio platform,1318,4897,https://avatars.githubusercontent.com/u/5904722?v=4
330008801,SDL,libsdl-org/SDL,C,230,Simple Directmedia Layer,807,4086,https://avatars.githubusercontent.com/u/77683370?v=4
29933948,fluent-bit,fluent/fluent-bit,C,141,"Fast and Lightweight Logs and Metrics processor for Linux, BSD, OSX and Windows",1139,4050,https://avatars.githubusercontent.com/u/859518?v=4
127023441,cuda-samples,NVIDIA/cuda-samples,C,120,Samples for CUDA Developers which demonstrates features in CUDA Toolkit,963,2631,https://avatars.githubusercontent.com/u/1728152?v=4
200663555,liburing,axboe/liburing,C,84,,257,1673,https://avatars.githubusercontent.com/u/2619634?v=4
