id,name,full_name,language,new stars,description,forks_count,stargazers_count,avatar_url
29028775,react-native,facebook/react-native,JavaScript,653,A framework for building native applications using React,22472,105155,https://avatars.githubusercontent.com/u/69631?v=4
70107786,next.js,vercel/next.js,JavaScript,1552,The React Framework,20499,93396,https://avatars.githubusercontent.com/u/14985020?v=4
27193779,node,nodejs/node,JavaScript,903,Node.js JavaScript runtime :sparkles::turtle::rocket::sparkles:,24443,90716,https://avatars.githubusercontent.com/u/9950313?v=4
23083156,material-ui,mui/material-ui,JavaScript,831,"MUI Core: Ready-to-use foundational React components, free forever. It includes Material UI that implement Google's Material Design.",28144,81722,https://avatars.githubusercontent.com/u/33663932?v=4
311525798,Web-Dev-For-Beginners,microsoft/Web-Dev-For-Beginners,JavaScript,1375,"24 Lessons, 12 Weeks, Get Started as a Web Developer",8860,57973,https://avatars.githubusercontent.com/u/6154722?v=4
43441403,strapi,strapi/strapi,JavaScript,1090,"🚀 Strapi is the leading open-source headless CMS. It’s 100% JavaScript, fully customizable and developer-first.",5915,48531,https://avatars.githubusercontent.com/u/19872173?v=4
9852918,Ghost,TryGhost/Ghost,JavaScript,386,"Turn your audience into a business. Publishing, memberships, subscriptions and newsletters.",8914,41286,https://avatars.githubusercontent.com/u/2178663?v=4
31629751,cypress,cypress-io/cypress,JavaScript,784,"Fast, easy and reliable testing for anything that runs in a browser.",2562,41018,https://avatars.githubusercontent.com/u/8908513?v=4
33263118,uBlock,gorhill/uBlock,JavaScript,914,uBlock Origin - An efficient blocker for Chromium and Firefox. Fast and lean.,2527,32600,https://avatars.githubusercontent.com/u/585534?v=4
19745004,odoo,odoo/odoo,JavaScript,363,Odoo. Open Source Apps To Grow Your Business.,17052,26374,https://avatars.githubusercontent.com/u/6368483?v=4
135614069,reactjs-interview-questions,sudheerj/reactjs-interview-questions,JavaScript,925,List of top 500 ReactJS Interview Questions & Answers....Coding exercise questions are coming soon!!,6025,24392,https://avatars.githubusercontent.com/u/3127317?u=0ae9c57bd70b06b2e2293323841ebf59cf3dca90&v=4
97086543,JavaScript,TheAlgorithms/JavaScript,JavaScript,1139,"Algorithms and Data Structures implemented in JavaScript for beginners, following best practices.",3952,22983,https://avatars.githubusercontent.com/u/20487725?v=4
43695474,quasar,quasarframework/quasar,JavaScript,215,Quasar Framework - Build high-performance VueJS user interfaces in record time,2971,22075,https://avatars.githubusercontent.com/u/23064371?v=4
382496361,uptime-kuma,louislam/uptime-kuma,JavaScript,1135,A fancy self-hosted monitoring tool,1793,21840,https://avatars.githubusercontent.com/u/1336778?u=5f96cafa12ed95d786d4b84bcf284e8fb2bedd89&v=4
74962515,CyberChef,gchq/CyberChef,JavaScript,1213,"The Cyber Swiss Army Knife - a web app for encryption, encoding, compression and data analysis",2259,18927,https://avatars.githubusercontent.com/u/15800240?v=4
352933140,ToolJet,ToolJet/ToolJet,JavaScript,685,"Extensible low-code framework for building business applications. Connect to databases, cloud storages, GraphQL, API endpoints, Airtable, etc and build apps using drag and drop application builder. Built using JavaScript/TypeScript. 🚀",1185,13692,https://avatars.githubusercontent.com/u/82193554?v=4
280363952,umami,umami-software/umami,JavaScript,687,"Umami is a simple, fast, privacy-focused alternative to Google Analytics.",2003,13329,https://avatars.githubusercontent.com/u/105618662?v=4
169975410,leon,leon-ai/leon,JavaScript,2147,🧠 Leon is your open-source personal assistant.,874,11185,https://avatars.githubusercontent.com/u/35167224?v=4
114938943,nginx-proxy-manager,NginxProxyManager/nginx-proxy-manager,JavaScript,616,"Docker container for managing Nginx proxy hosts with a simple, powerful interface",1165,9511,https://avatars.githubusercontent.com/u/88089605?v=4
128636610,zigbee2mqtt,Koenkk/zigbee2mqtt,JavaScript,119,"Zigbee 🐝 to MQTT bridge 🌉, get rid of your proprietary Zigbee bridges 🔨",1346,8573,https://avatars.githubusercontent.com/u/2892853?u=bba54d718dc6d81a73d463bb3f35e403c719b06f&v=4
68287594,academicpages.github.io,academicpages/academicpages.github.io,JavaScript,371,"Github Pages template for academic personal websites, forked from mmistakes/minimal-mistakes",22846,6529,https://avatars.githubusercontent.com/u/22107085?v=4
105473537,BetterDiscord,BetterDiscord/BetterDiscord,JavaScript,217,Better Discord enhances Discord desktop app with new features.,844,5073,https://avatars.githubusercontent.com/u/72631062?v=4
353775942,notesnook,streetwriters/notesnook,JavaScript,2805,A fully open source & end-to-end encrypted note taking alternative to Evernote.,205,3922,https://avatars.githubusercontent.com/u/63662537?v=4
84378779,Index,HowProgrammingWorks/Index,JavaScript,114,Metarhia educational program index 📖,359,2739,https://avatars.githubusercontent.com/u/17366055?v=4
528152092,stable-diffusion-ui,cmdr2/stable-diffusion-ui,JavaScript,1335,"A simple 1-click way to install and use Stable Diffusion on your own computer. Provides a browser UI for generating images from text prompts and images. Just enter your text prompt, and see the generated image.",137,1782,https://avatars.githubusercontent.com/u/844287?v=4
