id,name,full_name,language,new stars,description,forks_count,stargazers_count,avatar_url
8514,rails,rails/rails,Ruby,214,Ruby on Rails,20711,51610,https://avatars.githubusercontent.com/u/4223?v=4
65252,jekyll,jekyll/jekyll,Ruby,207,:globe_with_meridians: Jekyll is a blog-aware static site generator in Ruby,9900,45461,https://avatars.githubusercontent.com/u/3083652?v=4
8681349,huginn,huginn/huginn,Ruby,256,Create agents that monitor and act on your behalf.  Your agents are standing by!,3319,36686,https://avatars.githubusercontent.com/u/23225142?v=4
27442967,fastlane,fastlane/fastlane,Ruby,157,🚀 The easiest way to automate building and releasing your iOS and Android apps,5329,35939,https://avatars.githubusercontent.com/u/11098337?v=4
53238813,brew,Homebrew/brew,Ruby,360,🍺 The missing package manager for macOS (or Linux),8137,33724,https://avatars.githubusercontent.com/u/1503512?v=4
52281283,mastodon,mastodon/mastodon,Ruby,215,"Your self-hosted, globally interconnected microblogging community",4689,30106,https://avatars.githubusercontent.com/u/24979032?v=4
13840241,devdocs,freeCodeCamp/devdocs,Ruby,287,API Documentation Browser,2034,29897,https://avatars.githubusercontent.com/u/9892522?v=4
2293158,metasploit-framework,rapid7/metasploit-framework,Ruby,322,Metasploit Framework,12591,28502,https://avatars.githubusercontent.com/u/1013671?v=4
481872,vagrant,hashicorp/vagrant,Ruby,222,Vagrant is a tool for building and distributing development environments.,4311,24542,https://avatars.githubusercontent.com/u/761456?v=4
73648678,forem,forem/forem,Ruby,177,For empowering community 🌱,3523,19781,https://avatars.githubusercontent.com/u/65030610?v=4
538746,ruby,ruby/ruby,Ruby,119,The Ruby Programming Language [mirror],5176,19599,https://avatars.githubusercontent.com/u/210414?v=4
18486300,setup,lewagon/setup,Ruby,949,Setup instructions for Le Wagon's students on their first day of Web Development Bootcamp,1388,14601,https://avatars.githubusercontent.com/u/5470001?v=4
202291859,chatwoot,chatwoot/chatwoot,Ruby,385,"Open-source customer engagement suite, an alternative to Intercom, Zendesk, Salesforce Service Cloud etc. 🔥💬",1838,13867,https://avatars.githubusercontent.com/u/23416667?v=4
2203645,CocoaPods,CocoaPods/CocoaPods,Ruby,47,The Cocoa Dependency Manager.,2575,13865,https://avatars.githubusercontent.com/u/1189714?v=4
106995,sinatra,sinatra/sinatra,Ruby,44,Classy web-development dressed in a DSL (official / canonical repo),2071,11731,https://avatars.githubusercontent.com/u/8312?v=4
96395,faker,faker-ruby/faker,Ruby,64,"A library for generating fake data such as names, addresses, and phone numbers.",3001,10438,https://avatars.githubusercontent.com/u/47637297?v=4
1725199,linguist,github/linguist,Ruby,100,"Language Savant. If your repository's language is being reported incorrectly, send us a pull request!",3784,10332,https://avatars.githubusercontent.com/u/9919?v=4
361310,capybara,teamcapybara/capybara,Ruby,33,Acceptance test framework for web applications,1425,9696,https://avatars.githubusercontent.com/u/23465623?v=4
103766152,explore,github/explore,Ruby,74,Community-curated topic and collection pages on GitHub,11391,3426,https://avatars.githubusercontent.com/u/9919?v=4
3898922,zammad,zammad/zammad,Ruby,51,Zammad is a web based open source helpdesk/customer support system,617,3167,https://avatars.githubusercontent.com/u/1380327?v=4
93163073,dependabot-core,dependabot/dependabot-core,Ruby,68,🤖 The core logic behind Dependabot's update PR creation. For product feedback see: https://github.com/orgs/community/discussions/categories/code-security,706,2964,https://avatars.githubusercontent.com/u/27347476?v=4
297419763,india,github/india,Ruby,128,GitHub resources and information for the developer community in India,377,1636,https://avatars.githubusercontent.com/u/9919?v=4
212813096,data-setup,lewagon/data-setup,Ruby,45,Setup instructions for Le Wagon's students on their first day of Data Science Bootcamp,361,1605,https://avatars.githubusercontent.com/u/5470001?v=4
502760,danbooru,danbooru/danbooru,Ruby,78,A taggable image board written in Rails.,373,1578,https://avatars.githubusercontent.com/u/57931572?v=4
365723058,phase-4-creating-a-rails-api,learn-co-curriculum/phase-4-creating-a-rails-api,Ruby,0,,324,0,https://avatars.githubusercontent.com/u/6208017?v=4
