id,name,full_name,language,new stars,description,forks_count,stargazers_count,avatar_url
45717250,tensorflow,tensorflow/tensorflow,C++,184,An Open Source Machine Learning Framework for Everyone,74310,186304,https://avatars.githubusercontent.com/u/15658638?v=4
100060912,terminal,microsoft/terminal,C++,152,"The new Windows Terminal and the original Windows console host, all in the same place!",8328,95667,https://avatars.githubusercontent.com/u/6154722?v=4
15634981,godot,godotengine/godot,C++,341,Godot Engine – Multi-platform 2D and 3D game engine,21176,91034,https://avatars.githubusercontent.com/u/6318500?v=4
5108051,opencv,opencv/opencv,C++,163,Open Source Computer Vision Library,55820,79034,https://avatars.githubusercontent.com/u/5009934?v=4
612354784,llama.cpp,ggerganov/llama.cpp,C++,375,LLM inference in C/C++,9709,67643,https://avatars.githubusercontent.com/u/1991296?u=28314d364d7c28f8ec232fadb767970d3ad74e7b&v=4
1357796,emscripten,emscripten-core/emscripten,C++,34,Emscripten: An LLVM-to-WebAssembly Compiler,3310,25814,https://avatars.githubusercontent.com/u/46011144?v=4
615869301,LocalAI,mudler/LocalAI,C++,277,":robot: The free, Open Source alternative to OpenAI, Claude and others. Self-hosted and local-first. Drop-in replacement for OpenAI,  running on consumer-grade hardware. No GPU required. Runs gguf, transformers, diffusers and many more models architectures. Features: Generate Text, Audio, Video, Images, Voice Cloning, Distributed, P2P inference",1892,24892,https://avatars.githubusercontent.com/u/2420543?u=88a72adb708b5bf2ca40acda912778e65ac4cf43&v=4
197275130,winget-cli,microsoft/winget-cli,C++,62,"WinGet is the Windows Package Manager. This project includes a CLI (Command Line Interface), PowerShell modules, and a COM (Component Object Model) API (Application Programming Interface).",1452,23255,https://avatars.githubusercontent.com/u/6154722?v=4
5736080,FreeCAD,FreeCAD/FreeCAD,C++,89,"This is the official source code of FreeCAD, a free and opensource multiplatform 3D parametric modeler.",4055,19775,https://avatars.githubusercontent.com/u/2306237?v=4
438803890,Sunshine,LizardByte/Sunshine,C++,218,Self-hosted game stream host for Moonlight.,950,19563,https://avatars.githubusercontent.com/u/84790584?v=4
724854743,mlx,ml-explore/mlx,C++,127,MLX: An array framework for Apple silicon,991,17126,https://avatars.githubusercontent.com/u/102832242?v=4
2200856,Marlin,MarlinFirmware/Marlin,C++,22,Marlin is an optimized firmware for RepRap 3D printers based on the Arduino platform. Many commercial 3D printers come with Marlin installed. Check with your vendor if you need source code for your specific machine.,19235,16279,https://avatars.githubusercontent.com/u/10418365?v=4
14981376,dogecoin,dogecoin/dogecoin,C++,33,very currency,2864,14522,https://avatars.githubusercontent.com/u/6122353?v=4
283410102,workflow,sogou/workflow,C++,31,C++ Parallel Computing and Asynchronous Networking Framework,2415,13112,https://avatars.githubusercontent.com/u/15903299?v=4
6486826,ppsspp,hrydgard/ppsspp,C++,113,"A PSP emulator for Android, Windows, Mac and Linux, written in C++. Want to contribute? Join us on Discord at https://discord.gg/5NJB6dD or just send pull requests / issues. For discussion use the forums at forums.ppsspp.org.",2183,11364,https://avatars.githubusercontent.com/u/130929?u=3f6a75a1ef554e8faac09efa30c4d8f0c826a231&v=4
204593825,STL,microsoft/STL,C++,46,MSVC's implementation of the C++ Standard Library.,1504,10193,https://avatars.githubusercontent.com/u/6154722?v=4
679366051,TensorRT-LLM,NVIDIA/TensorRT-LLM,C++,69,TensorRT-LLM provides users with an easy-to-use Python API to define Large Language Models (LLMs) and build TensorRT engines that contain state-of-the-art optimizations to perform inference efficiently on NVIDIA GPUs. TensorRT-LLM also contains components to create Python and C++ runtimes that execute those TensorRT engines.,979,8617,https://avatars.githubusercontent.com/u/1728152?v=4
467157951,FileCentipede,filecxx/FileCentipede,C++,416,"Cross-platform internet upload/download manager for HTTP(S), FTP(S), SSH, magnet-link, BitTorrent, m3u8, ed2k, and online videos.  WebDAV client, FTP client, SSH client.",512,8129,https://avatars.githubusercontent.com/u/100348948?u=d8563d779bdb796b1ad7ba640313a8da4c2c354a&v=4
31197250,glog,google/glog,C++,17,C++ implementation of the Google logging module,2057,7061,https://avatars.githubusercontent.com/u/1342004?v=4
395341383,JoltPhysics,jrouwe/JoltPhysics,C++,74,A multi core friendly rigid body physics and collision detection library. Written in C++. Suitable for games and VR applications. Used by Horizon Forbidden West.,450,6735,https://avatars.githubusercontent.com/u/1621693?u=14b293a7095d074e6653d7ad73269a5e785e1399&v=4
14268809,FastLED,FastLED/FastLED,C++,23,"The FastLED library for colored LED animation on Arduino.  Please direct questions/requests for help to the FastLED Reddit community: http://fastled.io/r   We'd like to use github ""issues"" just for tracking library bugs / enhancements. ",1641,6456,https://avatars.githubusercontent.com/u/5899270?v=4
1368195,asio,chriskohlhoff/asio,C++,18,Asio C++ Library,1219,4955,https://avatars.githubusercontent.com/u/462538?v=4
545381143,PhysX,NVIDIA-Omniverse/PhysX,C++,16,NVIDIA PhysX SDK,374,2587,https://avatars.githubusercontent.com/u/57824658?v=4
108592307,sumo,eclipse-sumo/sumo,C++,16,"Eclipse SUMO is an open source, highly portable, microscopic and continuous traffic simulation package designed to handle large networks. It allows for intermodal simulation including pedestrians and comes with a large set of tools for scenario creation.",1433,2561,https://avatars.githubusercontent.com/u/144824549?v=4
