id,name,full_name,language,new stars,description,forks_count,stargazers_count,avatar_url
83222441,system-design-primer,donnemartin/system-design-primer,Python,566,Learn how to design large-scale systems. Prep for the system design interview.  Includes Anki flashcards.,39493,223036,https://avatars.githubusercontent.com/u/5458997?u=f1007b583e55e7ccfb6ccf0e200051156112dd9b&v=4
843222,scikit-learn,scikit-learn/scikit-learn,Python,270,scikit-learn: machine learning in Python,24406,54903,https://avatars.githubusercontent.com/u/365630?v=4
307260205,yt-dlp,yt-dlp/yt-dlp,Python,461,A youtube-dl fork with additional features and fixes,4121,50083,https://avatars.githubusercontent.com/u/79589310?v=4
634224458,gpt-engineer,AntonOsika/gpt-engineer,Python,11557,"Specify what you want it to build, the AI asks for clarification, and then builds it.",5575,33534,https://avatars.githubusercontent.com/u/4467025?u=c2388ec6b40a2c362b274741158ccafed41ce4c4&v=4
569927055,stablediffusion,Stability-AI/stablediffusion,Python,776,High-Resolution Image Synthesis with Latent Diffusion Models,3269,25705,https://avatars.githubusercontent.com/u/100950301?v=4
642323624,DragGAN,XingangPan/DragGAN,Python,5707,Official Code for DragGAN (SIGGRAPH 2023),1963,23272,https://avatars.githubusercontent.com/u/13579537?u=d3436a58b7f07f60d1ddd0e30e33e9c1f0b5e331&v=4
580642043,text-generation-webui,oobabooga/text-generation-webui,Python,598,"A gradio web UI for running Large Language Models like LLaMA, llama.cpp, GPT-J, Pythia, OPT, and GALACTICA.",2046,16226,https://avatars.githubusercontent.com/u/112222186?u=b632bfe07653fcd5b3a4345703d06877e5005805&v=4
305144746,tinygrad,geohot/tinygrad,Python,1161,You like pytorch? You like micrograd? You love tinygrad! ❤️ ,1672,15315,https://avatars.githubusercontent.com/u/72895?u=64c16e3f87c708f1f3920331f1f6285f6529960e&v=4
41179827,discord.py,Rapptz/discord.py,Python,128,An API wrapper for Discord written in Python.,3729,13124,https://avatars.githubusercontent.com/u/1695103?v=4
330914717,ivy,unifyai/ivy,Python,306,Unified AI,4471,11576,https://avatars.githubusercontent.com/u/63879146?v=4
167694194,frigate,blakeblackshear/frigate,Python,95,NVR with realtime local object detection for IP cameras,862,8521,https://avatars.githubusercontent.com/u/569905?u=a454086144f531389a73fbea93a7835eea06f2a1&v=4
619825247,LMFlow,OptimalScale/LMFlow,Python,548,An Extensible Toolkit for Finetuning and Inference of Large Foundation Models. Large Model for All.,969,6539,https://avatars.githubusercontent.com/u/128913633?v=4
414545335,stylegan3,NVlabs/stylegan3,Python,223,Official PyTorch implementation of StyleGAN3,969,5480,https://avatars.githubusercontent.com/u/2695301?v=4
629749002,OpenLLM,bentoml/OpenLLM,Python,1577,"An open platform for operating large language models (LLMs) in production. Fine-tune, serve, deploy, and monitor any LLMs with ease.",280,4468,https://avatars.githubusercontent.com/u/49176046?v=4
654905384,infinigen,princeton-vl/infinigen,Python,1624,Infinite Photorealistic Worlds using Procedural Generation,358,3542,https://avatars.githubusercontent.com/u/29677746?v=4
631580207,WizardLM,nlpxucan/WizardLM,Python,513,"Family of instruction-following LLMs powered by Evol-Instruct: WizardLM, WizardCoder",253,3471,https://avatars.githubusercontent.com/u/12636990?u=72c8357874bc1abed76e09d111025f9cde0c1806&v=4
432652408,super-gradients,Deci-AI/super-gradients,Python,137,Easily train or fine-tune SOTA computer vision models with one open source training library. The home of Yolo-NAS.,286,3033,https://avatars.githubusercontent.com/u/56918593?v=4
634046345,llm-foundry,mosaicml/llm-foundry,Python,189,LLM training code for MosaicML foundation models,223,2398,https://avatars.githubusercontent.com/u/75143706?v=4
629142696,h2o-llmstudio,h2oai/h2o-llmstudio,Python,166,H2O LLM Studio - a framework and no-code GUI for fine-tuning LLMs,174,1941,https://avatars.githubusercontent.com/u/1402695?v=4
637237273,simpleaichat,minimaxir/simpleaichat,Python,163,"Python package for easily interfacing with chat apps, with robust features and minimal code complexity.",42,1026,https://avatars.githubusercontent.com/u/2179708?u=fa33a847bd260bee190d2994538a1ca32d467445&v=4
646410686,LLaMA-Efficient-Tuning,hiyouga/LLaMA-Efficient-Tuning,Python,204,Fine-tuning LLaMA with PEFT (PT+SFT+RLHF with QLoRA),477,958,https://avatars.githubusercontent.com/u/16256802?u=9622ad4c25aa0a0bfc6dfac3db6bd0d7732c0f1e&v=4
646488027,WebGLM,THUDM/WebGLM,Python,431,WebGLM: An Efficient Web-enhanced Question Answering System (KDD 2023),74,780,https://avatars.githubusercontent.com/u/48590610?v=4
636467087,exllama,turboderp/exllama,Python,188,A more memory-efficient rewrite of the HF transformers implementation of Llama for use with quantized weights.,55,685,https://avatars.githubusercontent.com/u/11859846?u=9edfe1b9984e47b374f503ae200802d1039c0026&v=4
642830548,ask-multiple-pdfs,alejandro-ao/ask-multiple-pdfs,Python,187,A Langchain app that allows you to chat with multiple PDFs,178,488,https://avatars.githubusercontent.com/u/18406448?v=4
653262447,Zehef,N0rz3/Zehef,Python,49,Zehef is an osint tool to track emails,15,257,https://avatars.githubusercontent.com/u/123885505?u=fad974e8c45c7991d949daafd7f49fe08fda6a69&v=4
