id,name,full_name,language,new stars,description,forks_count,stargazers_count,avatar_url
17620347,aspnetcore,dotnet/aspnetcore,C#,67,"ASP.NET Core is a cross-platform .NET framework for building modern cloud-based web applications on Windows, Mac, or Linux.",7107,26544,https://avatars.githubusercontent.com/u/9141961?v=4
199570071,v2rayN,2dust/v2rayN,C#,178,,5073,24014,https://avatars.githubusercontent.com/u/31833384?v=4
70104825,eShopOnContainers,dotnet-architecture/eShopOnContainers,C#,73,"Cross-platform .NET sample microservices and container based application that runs on Linux Windows and macOS. Powered by .NET 6, Docker Containers and Azure Kubernetes Services. Supports Visual Studio, VS for Mac and CLI based environments with Docker CLI, dotnet CLI, VS Code or any other code editor.",8153,19235,https://avatars.githubusercontent.com/u/27453006?v=4
30474266,MaterialDesignInXamlToolkit,MaterialDesignInXAML/MaterialDesignInXamlToolkit,C#,32,"Google's Material Design in XAML & WPF, for C# & VB.Net. ",2823,11510,https://avatars.githubusercontent.com/u/16655083?v=4
120231691,Ryujinx,Ryujinx/Ryujinx,C#,68,Experimental Nintendo Switch Emulator written in C#,1253,10346,https://avatars.githubusercontent.com/u/39036280?v=4
88064357,QuickLook,QL-Win/QuickLook,C#,73,Bring macOS “Quick Look” feature to Windows,784,10147,https://avatars.githubusercontent.com/u/41779057?v=4
193681686,netch,netchx/netch,C#,72,A simple proxy client,1595,10141,https://avatars.githubusercontent.com/u/52199683?v=4
46755185,server,bitwarden/server,C#,54,"The core infrastructure backend (API, database, Docker, etc).",735,8686,https://avatars.githubusercontent.com/u/15990069?v=4
69673033,CleanArchitecture,ardalis/CleanArchitecture,C#,445,Clean Architecture Solution Template: A starting point for Clean Architecture with ASP.NET Core,1565,8556,https://avatars.githubusercontent.com/u/782127?u=75698de8f7b1cc3fda730cd742d8d8d59bd7a15c&v=4
213460285,CleanArchitecture,jasontaylordev/CleanArchitecture,C#,86,Clean Architecture Solution Template for .NET 6,1570,7040,https://avatars.githubusercontent.com/u/1988321?u=f96f36eed8f5bc57c4aab7213306f960efc072b1&v=4
165548191,PEASS-ng,carlospolop/PEASS-ng,C#,53,PEASS - Privilege Escalation Awesome Scripts SUITE (with colors),1736,6951,https://avatars.githubusercontent.com/u/17181413?u=7bab6cb28b2c583ee1f5f6ce8b3e0195601b6dde&v=4
83380995,eShopOnWeb,dotnet-architecture/eShopOnWeb,C#,133,"Sample ASP.NET Core 5.0 reference application, powered by Microsoft, demonstrating a layered application architecture with monolithic deployment model. Download the eBook PDF from docs folder.",3311,6821,https://avatars.githubusercontent.com/u/27453006?v=4
182095352,N_m3u8DL-CLI,nilaoda/N_m3u8DL-CLI,C#,146,"[.NET] m3u8 downloader 开源的命令行m3u8/HLS/dash下载器，支持普通AES-128-CBC解密，多线程，自定义请求头等. 支持简体中文,繁体中文和英文. English Supported.",1200,6458,https://avatars.githubusercontent.com/u/20772925?u=6332a7ef3fc5f4f6ce844a764e912638fc01b64a&v=4
130160795,ShadowsocksR-Windows,HMBSbige/ShadowsocksR-Windows,C#,35,Ship of Theseus,965,5269,https://avatars.githubusercontent.com/u/19153265?u=199dd8df485fb1fec5c9558de3361f164c18f748&v=4
245235133,reverse-proxy,microsoft/reverse-proxy,C#,222,A toolkit for developing high-performance HTTP reverse proxy applications.,392,4239,https://avatars.githubusercontent.com/u/6154722?v=4
38992233,SqlSugar,donet5/SqlSugar,C#,28,Best ORM    Fastest ORM   Simple Easy  Sqlite  orm Oracle ORM Mysql Orm  postgresql ORm  SqlServer oRm     达梦 ORM 人大金仓 ORM 神通ORM  C# ORM,1086,3714,https://avatars.githubusercontent.com/u/12455385?u=0bb8a2f59a5dc279a562c83fee70d9d6b82aef62&v=4
285618804,RunCat_for_windows,Kyome22/RunCat_for_windows,C#,447,A cute running cat animation on your windows taskbar.,250,2753,https://avatars.githubusercontent.com/u/19896354?u=3ff74d6272427ddc3f3997916c74405eb243f0f6&v=4
341704034,Power-Fx,microsoft/Power-Fx,C#,69,Power Fx low-code programming language,140,2516,https://avatars.githubusercontent.com/u/6154722?v=4
184286875,runner,actions/runner,C#,28,The Runner for GitHub Actions :rocket:,466,2241,https://avatars.githubusercontent.com/u/44036562?v=4
119571446,samples,dotnet/samples,C#,14,Sample code referenced by the .NET documentation,3427,1847,https://avatars.githubusercontent.com/u/9141961?v=4
21311240,PKHeX,kwsch/PKHeX,C#,48,Pokémon Save File Editor,406,1747,https://avatars.githubusercontent.com/u/6393368?v=4
73510119,aws-lambda-dotnet,aws/aws-lambda-dotnet,C#,6,"Libraries, samples and tools to help .NET Core developers develop AWS Lambda functions.",349,1057,https://avatars.githubusercontent.com/u/2232217?v=4
307049136,PowerUp,badamczewski/PowerUp,C#,128,Decompilation Tools and High Productivity Utilities,16,540,https://avatars.githubusercontent.com/u/752380?u=d587aef080ee604c8e616d25785bcc22329112aa&v=4
27212980,OpenUtau,stakira/OpenUtau,C#,22,Open source UTAU successor,82,353,https://avatars.githubusercontent.com/u/5784202?u=ed5fe7e294af0a07b9d94d6a5f2ca958b0bf7c11&v=4
369698813,web3.unity,ChainSafe/web3.unity,C#,25,Unity SDK for building games that interact with blockchains.,44,212,https://avatars.githubusercontent.com/u/27474093?v=4
