id,name,full_name,language,new stars,description,forks_count,stargazers_count,avatar_url
2325298,linux,torvalds/linux,C,429,Linux kernel source tree,39923,121729,https://avatars.githubusercontent.com/u/1024025?v=4
111583593,scrcpy,Genymobile/scrcpy,C,389,Display and control your Android device,6020,57907,https://avatars.githubusercontent.com/u/3427627?v=4
13233158,obs-studio,obsproject/obs-studio,C,575,OBS Studio - Free and open source software for live streaming and screen recording,5346,33399,https://avatars.githubusercontent.com/u/7725691?v=4
10446890,ijkplayer,bilibili/ijkplayer,C,32,"Android/iOS video player based on FFmpeg n3.4, with MediaCodec, VideoToolbox support.",7665,29648,https://avatars.githubusercontent.com/u/12002442?v=4
102578345,lede,coolsnowwolf/lede,C,175,Lean's OpenWrt source,15610,18745,https://avatars.githubusercontent.com/u/31687149?u=caa956c5f80318ea674625f9e9efa49c98335d74&v=4
80286288,Tasmota,arendst/Tasmota,C,44,"Alternative firmware for ESP8266 with easy configuration using webUI, OTA updates, automation using timers or rules, expandability and entirely local control over MQTT, HTTP, Serial or KNX. Full documentation at",3614,16468,https://avatars.githubusercontent.com/u/11044339?u=b54c71859c551426b6738921138b740804ca1d62&v=4
28515839,kcp,skywind3000/kcp,C,38,:zap: KCP - A Fast and Reliable ARQ Protocol,2027,10361,https://avatars.githubusercontent.com/u/3035071?u=082cfef5e6dbd57bf6ee4c481e163d103014a1f3&v=4
184909163,yabai,koekeishiya/yabai,C,549,A tiling window manager for macOS based on binary space partitioning,342,9418,https://avatars.githubusercontent.com/u/6175959?u=e07b472bc4fa5500439c2c099a4736bcfd636769&v=4
32921736,audacity,audacity/audacity,C,58,Audio Editor                                     ,1704,6693,https://avatars.githubusercontent.com/u/11648186?v=4
254327261,Sandboxie,sandboxie-plus/Sandboxie,C,80,Sandboxie - Open Source,606,5773,https://avatars.githubusercontent.com/u/63755826?v=4
59771425,zephyr,zephyrproject-rtos/zephyr,C,49,"Primary Git Repository for the Zephyr Project. Zephyr is a new generation, scalable, optimized, secure RTOS for multiple hardware architectures.",3298,5221,https://avatars.githubusercontent.com/u/19595895?v=4
673267,hiredis,redis/hiredis,C,14,Minimalistic C client for Redis >= 1.2,1617,5070,https://avatars.githubusercontent.com/u/1529926?v=4
37060852,betaflight,betaflight/betaflight,C,27,Open Source Flight Controller Firmware,2128,4922,https://avatars.githubusercontent.com/u/19597933?v=4
44781140,gpdb,greenplum-db/gpdb,C,21,"Greenplum Database - Massively Parallel PostgreSQL for Analytics. An open-source massively parallel data platform for analytics, machine learning and AI.",1388,4876,https://avatars.githubusercontent.com/u/14097842?v=4
8270972,mbed-os,ARMmbed/mbed-os,C,5,Arm Mbed OS is a platform operating system designed for the internet of things,2740,3903,https://avatars.githubusercontent.com/u/8916057?v=4
27788471,mgba,mgba-emu/mgba,C,103,mGBA Game Boy Advance Emulator,470,3254,https://avatars.githubusercontent.com/u/10085927?v=4
146397768,libhv,ithewei/libhv,C,47,ğŸ”¥ æ¯”libeventã€libuvæ›´æ˜“ç”¨çš„å›½äº§ç½‘ç»œåº“ã€‚A c/c++ network library for developing TCP/UDP/SSL/HTTP/WebSocket client/server.,583,3232,https://avatars.githubusercontent.com/u/26049660?u=2252b64651629ba953139d461c0fd4658ed1706e&v=4
327491895,HoloCubic,peng-zhihui/HoloCubic,C,92,å¸¦ç½‘ç»œåŠŸèƒ½çš„ä¼ªå…¨æ¯é€æ˜æ˜¾ç¤ºæ¡Œé¢ç«™,572,2993,https://avatars.githubusercontent.com/u/12994887?u=6bfec84cb512892557cfed7fd7c52b0b0f41f95b&v=4
425159471,flash-linux0.11-talk,sunym1993/flash-linux0.11-talk,C,1099,ä½ ç®¡è¿™ç ´ç©æ„å«æ“ä½œç³»ç»Ÿæºç  â€” åƒå°è¯´ä¸€æ ·å“è¯» Linux 0.11 æ ¸å¿ƒä»£ç ,166,2272,https://avatars.githubusercontent.com/u/25787738?u=b3d34b2077983e3632c0da01246c56235fb14c21&v=4
394318710,ExplorerPatcher,valinet/ExplorerPatcher,C,156,This project aims to bring back a productive working environment on Windows 11,82,1872,https://avatars.githubusercontent.com/u/6503598?u=25d850b7dcc57d2a488d83646fff7cca48cf7fc7&v=4
247875738,oot,zeldaret/oot,C,21,Decompilation of The Legend of Zelda: Ocarina of Time,159,905,https://avatars.githubusercontent.com/u/50950276?v=4
428357167,mako,chjj/mako,C,29,Bitcoin node written in C,29,457,https://avatars.githubusercontent.com/u/470564?v=4
380887013,hydromisc,hydromisc/hydromisc,C,45,"Open hardware to measure EC and pH, drive pumps, and otherwise manage a mid-size hydroponic grow over Wi-Fi.",22,441,https://avatars.githubusercontent.com/u/86581932?v=4
53432472,sonic-buildimage,Azure/sonic-buildimage,C,3,Scripts which perform an installable binary image build for SONiC,842,357,https://avatars.githubusercontent.com/u/6844498?v=4
356098390,cpuminer-gr-avx2,WyvernTKC/cpuminer-gr-avx2,C,52,Optimised Version of GR miner for RTM,136,314,https://avatars.githubusercontent.com/u/78566127?v=4
