id,name,full_name,language,new stars,description,forks_count,stargazers_count,avatar_url
83222441,system-design-primer,donnemartin/system-design-primer,Python,1072,Learn how to design large-scale systems. Prep for the system design interview.  Includes Anki flashcards.,27890,151037,https://avatars.githubusercontent.com/u/5458997?u=f1007b583e55e7ccfb6ccf0e200051156112dd9b&v=4
123458551,Python-100-Days,jackfrued/Python-100-Days,Python,991,Python - 100å¤©ä»æ–°æ‰‹åˆ°å¤§å¸ˆ,43777,112338,https://avatars.githubusercontent.com/u/7474657?u=902200c2389c203cf2139888e10314845edd2a2a&v=4
160919119,fastapi,tiangolo/fastapi,Python,656,"FastAPI framework, high performance, easy to learn, fast to code, ready for production",2851,38680,https://avatars.githubusercontent.com/u/1326112?u=5cad72c846b7aba2e960546af490edc7375dafc4&v=4
71948498,localstack,localstack/localstack,Python,795,ğŸ’»  A fully functional local AWS cloud stack. Develop and test your cloud & Serverless apps offline!,2816,37318,https://avatars.githubusercontent.com/u/28732122?v=4
191113739,interview_internal_reference,0voice/interview_internal_reference,Python,94,2021å¹´æœ€æ–°æ€»ç»“ï¼Œé˜¿é‡Œï¼Œè…¾è®¯ï¼Œç™¾åº¦ï¼Œç¾å›¢ï¼Œå¤´æ¡ç­‰æŠ€æœ¯é¢è¯•é¢˜ç›®ï¼Œä»¥åŠç­”æ¡ˆï¼Œä¸“å®¶å‡ºé¢˜äººåˆ†ææ±‡æ€»ã€‚,8895,32822,https://avatars.githubusercontent.com/u/43104160?v=4
145670234,mmdetection,open-mmlab/mmdetection,Python,107,OpenMMLab Detection Toolbox and Benchmark,6176,17303,https://avatars.githubusercontent.com/u/10245193?v=4
91629816,freqtrade,freqtrade/freqtrade,Python,384,"Free, open source crypto trading bot",2992,13663,https://avatars.githubusercontent.com/u/37536846?v=4
130375797,dgl,dmlc/dgl,Python,122,"Python package built to ease deep learning on graph, on top of existing DL frameworks.",1884,8490,https://avatars.githubusercontent.com/u/11508361?v=4
202498093,YYeTsBot,tgbot-collection/YYeTsBot,Python,128,ğŸ¬ äººäººå½±è§†botï¼Œå®Œå…¨å¯¹æ¥äººäººå½±è§†å…¨éƒ¨æ— åˆ å‡èµ„æº,1231,8231,https://avatars.githubusercontent.com/u/73354211?v=4
254832799,hackingtool,Z4nzu/hackingtool,Python,130,ALL IN ONE Hacking Tool For Hackers,1143,7345,https://avatars.githubusercontent.com/u/25708027?u=43d51529db320284423e8eab65383767c6f52fa7&v=4
287463830,qlib,microsoft/qlib,Python,168,"Qlib is an AI-oriented quantitative investment platform, which aims to realize the potential, empower the research, and create the value of AI technologies in quantitative investment. With Qlib, you can easily try your ideas to create better Quant investment strategies. An increasing number of  SOTA Quant research works/papers are released in Qlib.",1162,7227,https://avatars.githubusercontent.com/u/6154722?v=4
300996055,vit-pytorch,lucidrains/vit-pytorch,Python,213,"Implementation of Vision Transformer, a simple way to achieve SOTA in vision classification with only a single transformer encoder, in Pytorch",955,6674,https://avatars.githubusercontent.com/u/108653?u=3a5a0a10e79f22d5b98e6de9a6e0df8b11dc2bc5&v=4
202693400,scientific-visualization-book,rougier/scientific-visualization-book,Python,1501,An open access book on scientific visualization using python and matplotlib,382,5583,https://avatars.githubusercontent.com/u/327203?v=4
217475193,PaddleDetection,PaddlePaddle/PaddleDetection,Python,149,Object detection and instance segmentation toolkit based on PaddlePaddle.,1323,5048,https://avatars.githubusercontent.com/u/23534030?v=4
198350484,unilm,microsoft/unilm,Python,126,"Large-scale Self-supervised Pre-training Across Tasks, Languages, and Modalities",728,3802,https://avatars.githubusercontent.com/u/6154722?v=4
204380779,PaddleSeg,PaddlePaddle/PaddleSeg,Python,167,"Easy-to-use image segmentation library with awesome pre-trained model zoo, supporting wide-range of practical tasks from research to industrial applications.",731,3218,https://avatars.githubusercontent.com/u/23534030?v=4
56251096,web3.py,ethereum/web3.py,Python,44,A python interface for interacting with the Ethereum blockchain and ecosystem.,860,2544,https://avatars.githubusercontent.com/u/6250754?v=4
273400964,PyTorch-StudioGAN,POSTECH-CVLab/PyTorch-StudioGAN,Python,101,StudioGAN is a Pytorch library providing implementations of representative Generative Adversarial Networks (GANs) for conditional/unconditional image generation.,193,2246,https://avatars.githubusercontent.com/u/62027764?v=4
346138085,pytorchvideo,facebookresearch/pytorchvideo,Python,108,A deep learning library for video understanding research.,182,2040,https://avatars.githubusercontent.com/u/16943930?v=4
285840886,AnimeGANv2,TachibanaYoshino/AnimeGANv2,Python,422,[Open Source].  The improved version of AnimeGAN. Landscape photos/videos to anime,232,1919,https://avatars.githubusercontent.com/u/36946777?u=b233cd161659aee0caddda09e375ff61fa1c0bdf&v=4
390327676,Image-Super-Resolution-via-Iterative-Refinement,Janspiry/Image-Super-Resolution-via-Iterative-Refinement,Python,357,Unoffical implementation about Image Super-Resolution via Iterative Refinement by Pytorch,139,1415,https://avatars.githubusercontent.com/u/32922494?u=372c34fba5b42851ee8bcf9c2257a8e575acdbdb&v=4
319302752,pycryptobot,whittlem/pycryptobot,Python,155,Python Crypto Bot,415,1227,https://avatars.githubusercontent.com/u/19817919?v=4
400837389,pycord,Pycord-Development/pycord,Python,50,"Pycord, a maintained fork of discord.py, is a python wrapper for the Discord API",188,847,https://avatars.githubusercontent.com/u/89700626?v=4
369428935,torchgeo,microsoft/torchgeo,Python,112,"TorchGeo: datasets, transforms, and models for geospatial data",34,390,https://avatars.githubusercontent.com/u/6154722?v=4
421392166,Everything-Tech,moabukar/Everything-Tech,Python,112,A collection of online resources to help you on your Tech journey.,86,298,https://avatars.githubusercontent.com/u/76791648?u=a38d927ace3ae3547faa4f7e0a8a905a5b8c4cf0&v=4
