id,name,full_name,language,new stars,description,forks_count,stargazers_count,avatar_url
70107786,next.js,vercel/next.js,JavaScript,1926,The React Framework,26944,126743,https://avatars.githubusercontent.com/u/14985020?v=4
74293321,svelte,sveltejs/svelte,JavaScript,1323,web development for the rest of us,4229,79707,https://avatars.githubusercontent.com/u/23617963?v=4
382496361,uptime-kuma,louislam/uptime-kuma,JavaScript,1895,A fancy self-hosted monitoring tool,5265,58397,https://avatars.githubusercontent.com/u/1336778?u=5f96cafa12ed95d786d4b84bcf284e8fb2bedd89&v=4
9852918,Ghost,TryGhost/Ghost,JavaScript,497,"Independent technology for modern publishing, memberships, subscriptions and newsletters.",10337,47379,https://avatars.githubusercontent.com/u/2178663?v=4
33263118,uBlock,gorhill/uBlock,JavaScript,1084,uBlock Origin - An efficient blocker for Chromium and Firefox. Fast and lean.,3138,47210,https://avatars.githubusercontent.com/u/585534?v=4
85031442,hiring-without-whiteboards,poteto/hiring-without-whiteboards,JavaScript,882,⭐️  Companies that don't have a broken hiring process,3597,45582,https://avatars.githubusercontent.com/u/1390709?u=2bbc6819de88b779dfade2cb2b011d7bd7d83c82&v=4
97086543,JavaScript,TheAlgorithms/JavaScript,JavaScript,392,"Algorithms and Data Structures implemented in JavaScript for beginners, following best practices.",5590,32495,https://avatars.githubusercontent.com/u/20487725?v=4
352933140,ToolJet,ToolJet/ToolJet,JavaScript,3355,"Low-code platform for building business applications. Connect to databases, cloud storages, GraphQL, API endpoints, Airtable, Google sheets, OpenAI, etc and build apps using drag and drop application builder. Built using JavaScript/TypeScript. 🚀",4147,32155,https://avatars.githubusercontent.com/u/82193554?v=4
44150497,remote-jobs,remoteintech/remote-jobs,JavaScript,607,A list of semi to fully remote-friendly companies (jobs) in tech.,3142,29817,https://avatars.githubusercontent.com/u/31714327?v=4
114938943,nginx-proxy-manager,NginxProxyManager/nginx-proxy-manager,JavaScript,608,"Docker container for managing Nginx proxy hosts with a simple, powerful interface",2648,22826,https://avatars.githubusercontent.com/u/88089605?v=4
667110339,drawdb,drawdb-io/drawdb,JavaScript,1770,"Free, simple, and intuitive online database diagram editor and SQL generator.",1542,21959,https://avatars.githubusercontent.com/u/139706923?v=4
601161044,transformers.js,huggingface/transformers.js,JavaScript,718,"State-of-the-art Machine Learning for the web. Run 🤗 Transformers directly in your browser, with no need for a server!",745,11809,https://avatars.githubusercontent.com/u/25720743?v=4
253044228,nuclei-templates,projectdiscovery/nuclei-templates,JavaScript,194,Community curated list of templates for the nuclei engine to find security vulnerabilities.,2626,9249,https://avatars.githubusercontent.com/u/50994705?v=4
31771754,WebGoat,WebGoat/WebGoat,JavaScript,108,WebGoat is a deliberately insecure application,5491,7013,https://avatars.githubusercontent.com/u/7718244?v=4
397401267,audiobookshelf,advplyr/audiobookshelf,JavaScript,311,Self-hosted audiobook and podcast server,470,6646,https://avatars.githubusercontent.com/u/67830747?u=5ca70ec09cabed26eb4a62b141df77eb475f9ec7&v=4
643285887,apihub,hiteshchoudhary/apihub,JavaScript,2829,"Your own API Hub to learn and master API interaction. Ideal for frontend, mobile dev and backend developers. ",1063,6396,https://avatars.githubusercontent.com/u/11613311?u=eb5b71a918effbaf14260160d8d7dee7caaffe1f&v=4
583820372,dots-hyprland,end-4/dots-hyprland,JavaScript,440,i hate minimalism so...,298,4342,https://avatars.githubusercontent.com/u/97237370?u=44a6599bbf0173c31fefaaa7f2cfcecfc8fe4d93&v=4
679125280,mindcraft,kolbytn/mindcraft,JavaScript,959,,221,1767,https://avatars.githubusercontent.com/u/25499651?u=75eb8797af6407a6e5d90812136b974ccf4bc432&v=4
685484384,materialYouNewTab,XengShi/materialYouNewTab,JavaScript,1283,A Simple New Tab ( browsers's home page ) inspired with Google's 'Material You' design ,127,1375,https://avatars.githubusercontent.com/u/48722764?u=4b3706597aed9231511b0b8da8a15409fca13afb&v=4
585712715,Interstellar,UseInterstellar/Interstellar,JavaScript,115,One of the most popular modern web proxies with blazing fast speeds and a variety of games.,12143,1030,https://avatars.githubusercontent.com/u/103917385?v=4
