id,name,full_name,language,new stars,description,forks_count,stargazers_count,avatar_url
13491895,free-programming-books,EbookFoundation/free-programming-books,,5734,:books: Freely available programming books,46520,216709,https://avatars.githubusercontent.com/u/14127308?v=4
85077558,developer-roadmap,kamranahmedse/developer-roadmap,TypeScript,5170,Roadmap to becoming a developer in 2021,26013,181207,https://avatars.githubusercontent.com/u/4921183?u=9a67bfd198f1a73f262d08b53eeb6ad2befc572f&v=4
1039520,youtube-dl,ytdl-org/youtube-dl,Python,1624,Command-line program to download videos from YouTube.com and other video sites,6616,103857,https://avatars.githubusercontent.com/u/48381040?v=4
14098069,free-programming-books-zh_CN,justjavac/free-programming-books-zh_CN,,1496,:books: 免费的计算机编程类中文书籍，欢迎投稿,24625,85737,https://avatars.githubusercontent.com/u/359395?u=bb50dde6882b70d87c0b074e1d4986762cf294ad&v=4
54173593,storybook,storybookjs/storybook,TypeScript,1311,"📓 The UI component explorer. Develop, document, & test React, Vue, Angular, Web Components, Ember, Svelte & more!",6903,67570,https://avatars.githubusercontent.com/u/22632046?v=4
507775,elasticsearch,elastic/elasticsearch,Java,605,"Free and Open, Distributed, RESTful Search Engine",21037,57846,https://avatars.githubusercontent.com/u/6764390?v=4
15111821,grafana,grafana/grafana,TypeScript,1159,"The open and composable observability and data visualization platform. Visualize metrics, logs, and traces from multiple sources like Prometheus, Loki, Elasticsearch, InfluxDB, Postgres and many more. ",9127,46078,https://avatars.githubusercontent.com/u/7195757?v=4
3482588,SecLists,danielmiessler/SecLists,PHP,1257,"SecLists is the security tester's companion. It's a collection of multiple types of lists used during security assessments, collected in one place. List types include usernames, passwords, URLs, sensitive data patterns, fuzzing payloads, web shells, and many more.",18558,35967,https://avatars.githubusercontent.com/u/50654?u=d5b77e639134c95d79f922589cde11239d8e0c2c&v=4
214587193,supabase,supabase/supabase,TypeScript,3239,The open source Firebase alternative. Follow to stay updated about our public Beta.,1318,25326,https://avatars.githubusercontent.com/u/54469796?v=4
134017286,lazygit,jesseduffield/lazygit,Go,3106,simple terminal UI for git commands,937,25054,https://avatars.githubusercontent.com/u/8456633?u=1183e9d1442669992861877a4f313b51e3bbd119&v=4
179613976,REKCARC-TSC-UHT,PKUanonym/REKCARC-TSC-UHT,HTML,1885,"清华大学计算机系课程攻略 Guidance for courses in Department of Computer Science and Technology, Tsinghua University",5656,20702,https://avatars.githubusercontent.com/u/49298122?u=a30d1a325003dea6b0fbfa61ba350c010bc3ec45&v=4
377496562,appflowy,AppFlowy-IO/appflowy,Rust,6268,AppFlowy is an open-source alternative to Notion. You are in charge of your data and customizations. Built with Flutter and Rust.,600,13566,https://avatars.githubusercontent.com/u/86002201?v=4
143455116,filament,google/filament,C++,1148,"Filament is a real-time physically based rendering engine for Android, iOS, Windows, Linux, macOS, and WebGL2",1214,13251,https://avatars.githubusercontent.com/u/1342004?v=4
349321229,GFPGAN,TencentARC/GFPGAN,Python,9091,GFPGAN aims at developing Practical Algorithms for Real-world Face Restoration.,1916,12800,https://avatars.githubusercontent.com/u/83739826?v=4
1090311,logstash,elastic/logstash,Ruby,91,"Logstash - transport and process your logs, events, or other data",3264,12558,https://avatars.githubusercontent.com/u/6764390?v=4
281975310,type-challenges,type-challenges/type-challenges,TypeScript,1798,Collection of TypeScript type challenges with online judge,694,10948,https://avatars.githubusercontent.com/u/68700335?v=4
307489284,remix,remix-run/remix,TypeScript,8616,"Build Better Websites. Create modern, resilient user experiences with web fundamentals.",547,9310,https://avatars.githubusercontent.com/u/64235328?v=4
293498508,compose-jb,JetBrains/compose-jb,Kotlin,955,"Jetpack Compose for Desktop and Web, a modern UI framework for Kotlin that makes building performant and beautiful user interfaces easy and enjoyable.",461,7662,https://avatars.githubusercontent.com/u/878437?v=4
217475193,PaddleDetection,PaddlePaddle/PaddleDetection,Python,903,"Object Detection toolkit based on PaddlePaddle. It supports object detection, instance segmentation, multiple object tracking and real-time multi-person keypoint detection.",1471,5835,https://avatars.githubusercontent.com/u/23534030?v=4
107833072,flame,flame-engine/flame,Dart,651,A minimalist Flutter game engine,475,5582,https://avatars.githubusercontent.com/u/47222401?v=4
234739976,medusa,medusajs/medusa,JavaScript,3334,The open-source Shopify alternative ⚡️,266,5542,https://avatars.githubusercontent.com/u/62591822?v=4
50160261,Paper,PaperMC/Paper,Java,598,High performance Spigot fork that aims to fix gameplay and mechanics inconsistencies,1354,5328,https://avatars.githubusercontent.com/u/7608950?v=4
422821402,FerretDB,FerretDB/FerretDB,Go,1608,A truly Open Source MongoDB alternative,103,3770,https://avatars.githubusercontent.com/u/95204649?v=4
285840886,AnimeGANv2,TachibanaYoshino/AnimeGANv2,Python,1266,[Open Source].  The improved version of AnimeGAN. Landscape photos/videos to anime,374,3020,https://avatars.githubusercontent.com/u/36946777?u=b233cd161659aee0caddda09e375ff61fa1c0bdf&v=4
412776131,Real-Time-Rendering-4th-Bibliography-Collection,QianMo/Real-Time-Rendering-4th-Bibliography-Collection,HTML,1211,Real-Time Rendering 4th (RTR4) 参考文献合集典藏 | Collection of <Real-Time Rendering 4th (RTR4)> Bibliography / Reference,638,2061,https://avatars.githubusercontent.com/u/7830161?u=f2f84dade40e05cd89c7e0266e4466394ea83349&v=4
