id,name,full_name,language,new stars,description,forks_count,stargazers_count,avatar_url
184456251,PowerToys,microsoft/PowerToys,C#,1848,Windows system utilities to maximize productivity,3589,64767,https://avatars.githubusercontent.com/u/6154722?v=4
17620347,aspnetcore,dotnet/aspnetcore,C#,402,"ASP.NET Core is a cross-platform .NET framework for building modern cloud-based web applications on Windows, Mac, or Linux.",7171,26702,https://avatars.githubusercontent.com/u/9141961?v=4
199570071,v2rayN,2dust/v2rayN,C#,771,,5148,24315,https://avatars.githubusercontent.com/u/31833384?v=4
1327739,ILSpy,icsharpcode/ILSpy,C#,214,".NET Decompiler with support for PDB generation, ReadyToRun, Metadata (&more) - cross-platform!",2678,13965,https://avatars.githubusercontent.com/u/343434?v=4
262395224,maui,dotnet/maui,C#,841,".NET MAUI is the .NET Multi-platform App UI, a framework for building native device applications spanning mobile, tablet, and desktop.",639,13038,https://avatars.githubusercontent.com/u/9141961?v=4
14964475,Avalonia,AvaloniaUI/Avalonia,C#,221,A cross platform XAML framework for .NET,1125,12528,https://avatars.githubusercontent.com/u/14075148?v=4
30474266,MaterialDesignInXamlToolkit,MaterialDesignInXAML/MaterialDesignInXamlToolkit,C#,147,"Google's Material Design in XAML & WPF, for C# & VB.Net. ",2841,11578,https://avatars.githubusercontent.com/u/16655083?v=4
120231691,Ryujinx,Ryujinx/Ryujinx,C#,331,Experimental Nintendo Switch Emulator written in C#,1270,10470,https://avatars.githubusercontent.com/u/39036280?v=4
193681686,netch,netchx/netch,C#,304,A simple proxy client,1623,10255,https://avatars.githubusercontent.com/u/52199683?v=4
28239455,AspNetCore.Docs,dotnet/AspNetCore.Docs,C#,121,Documentation for ASP.NET Core,23205,9920,https://avatars.githubusercontent.com/u/9141961?v=4
69673033,CleanArchitecture,ardalis/CleanArchitecture,C#,871,Clean Architecture Solution Template: A starting point for Clean Architecture with ASP.NET Core,1612,8827,https://avatars.githubusercontent.com/u/782127?u=75698de8f7b1cc3fda730cd742d8d8d59bd7a15c&v=4
126486701,UnityCsReference,Unity-Technologies/UnityCsReference,C#,138,Unity C# reference source code.,1868,8546,https://avatars.githubusercontent.com/u/426196?v=4
75990888,csharplang,dotnet/csharplang,C#,353,The official repo for the design of the C# programming language,853,8107,https://avatars.githubusercontent.com/u/9141961?v=4
213460285,CleanArchitecture,jasontaylordev/CleanArchitecture,C#,411,Clean Architecture Solution Template for .NET 6,1610,7180,https://avatars.githubusercontent.com/u/1988321?u=f96f36eed8f5bc57c4aab7213306f960efc072b1&v=4
83380995,eShopOnWeb,dotnet-architecture/eShopOnWeb,C#,283,"Sample ASP.NET Core 6.0 reference application, powered by Microsoft, demonstrating a layered application architecture with monolithic deployment model. Download the eBook PDF from docs folder.",3359,6911,https://avatars.githubusercontent.com/u/27453006?v=4
182095352,N_m3u8DL-CLI,nilaoda/N_m3u8DL-CLI,C#,461,"[.NET] m3u8 downloader 开源的命令行m3u8/HLS/dash下载器，支持普通AES-128-CBC解密，多线程，自定义请求头等. 支持简体中文,繁体中文和英文. English Supported.",1235,6658,https://avatars.githubusercontent.com/u/20772925?u=6332a7ef3fc5f4f6ce844a764e912638fc01b64a&v=4
743436,ET,egametang/ET,C#,125,Unity3D Client And C# Server Framework,1913,5066,https://avatars.githubusercontent.com/u/315758?v=4
245235133,reverse-proxy,microsoft/reverse-proxy,C#,441,A toolkit for developing high-performance HTTP reverse proxy applications.,404,4322,https://avatars.githubusercontent.com/u/6154722?v=4
285618804,RunCat_for_windows,Kyome22/RunCat_for_windows,C#,2738,A cute running cat animation on your windows taskbar.,324,3344,https://avatars.githubusercontent.com/u/19896354?u=3ff74d6272427ddc3f3997916c74405eb243f0f6&v=4
375939072,FastGithub,dotnetcore/FastGithub,C#,697,github加速神器，解决github打不开、用户头像无法加载、releases无法上传下载、git-clone、git-pull、git-push失败等问题,421,3333,https://avatars.githubusercontent.com/u/19404084?v=4
366663429,jynew,jynew/jynew,C#,898,金庸群侠传3D重制版,668,3079,https://avatars.githubusercontent.com/u/82129705?v=4
116210568,ScottPlot,ScottPlot/ScottPlot,C#,597,Interactive Plotting Library for .NET,248,1720,https://avatars.githubusercontent.com/u/76536295?v=4
387542412,ThisIsWin11,builtbybel/ThisIsWin11,C#,496,The real PowerToys for Windows 11,71,1303,https://avatars.githubusercontent.com/u/48735732?v=4
370188376,RoundedTB,torchgm/RoundedTB,C#,428,"Add margins, rounded corners and segments to your taskbars!",69,1140,https://avatars.githubusercontent.com/u/31840547?u=9fa4ec223ee2f981b47f9927e2fc81ab9970807e&v=4
398181340,dotnet-webapi-boilerplate,fullstackhero/dotnet-webapi-boilerplate,C#,707,Clean Architecture Template for .NET 6.0 WebApi built with Multitenancy Support.,115,1053,https://avatars.githubusercontent.com/u/89242069?v=4
