id,name,full_name,language,new stars,description,forks_count,stargazers_count,avatar_url
1181927,bitcoin,bitcoin/bitcoin,C++,1305,Bitcoin Core integration/staging tree,30836,60024,https://avatars.githubusercontent.com/u/528860?v=4
5108051,opencv,opencv/opencv,C++,745,Open Source Computer Vision Library,49421,58500,https://avatars.githubusercontent.com/u/5009934?v=4
65600975,pytorch,pytorch/pytorch,C++,746,Tensors and Dynamic neural networks in Python with strong GPU acceleration,14457,52685,https://avatars.githubusercontent.com/u/21003710?v=4
23357588,protobuf,protocolbuffers/protobuf,C++,684,Protocol Buffers - Google's data interchange format,13526,52208,https://avatars.githubusercontent.com/u/26310541?v=4
15634981,godot,godotengine/godot,C++,935,Godot Engine – Multi-platform 2D and 3D game engine,8029,44427,https://avatars.githubusercontent.com/u/6318500?v=4
22887094,tesseract,tesseract-ocr/tesseract,C++,572,Tesseract Open Source OCR Engine (main repository),7678,43109,https://avatars.githubusercontent.com/u/8401422?v=4
27729880,grpc,grpc/grpc,C++,501,"The C based gRPC (C++, Python, Ruby, Objective-C, PHP, C#)",8600,32820,https://avatars.githubusercontent.com/u/7802525?v=4
39840932,googletest,google/googletest,C++,256,GoogleTest - Google Testing and Mocking Framework,8087,24389,https://avatars.githubusercontent.com/u/1342004?v=4
89247811,openpose,CMU-Perceptual-Computing-Lab/openpose,C++,341,"OpenPose: Real-time multi-person keypoint detection library for body, face, hands, and foot estimation",6806,22822,https://avatars.githubusercontent.com/u/12239573?v=4
19374812,tdesktop,telegramdesktop/tdesktop,C++,379,Telegram Desktop messaging app,3726,17463,https://avatars.githubusercontent.com/u/6113871?v=4
196813750,CPlusPlusThings,Light-City/CPlusPlusThings,C++,1004,C++那些事,4151,17170,https://avatars.githubusercontent.com/u/25699850?u=ae1ceddf2cd1d69488bc3132d29b5ca3bb57ee26&v=4
160083795,serenity,SerenityOS/serenity,C++,659,The Serenity Operating System 🐞,1740,16771,https://avatars.githubusercontent.com/u/50811782?v=4
66088979,modern-cpp-tutorial,changkun/modern-cpp-tutorial,C++,388,📚 Modern C++ Tutorial: C++11/14/17/20 On the Fly | https://changkun.de/modern-cpp/,2010,15845,https://avatars.githubusercontent.com/u/5498964?u=87ee45485df99fe40f92e4d6f83c0060c2ea502d&v=4
191820100,mediapipe,google/mediapipe,C++,474,"Cross-platform, customizable ML solutions for live and streaming media.",3105,15027,https://avatars.githubusercontent.com/u/1342004?v=4
32969220,Arduino,esp8266/Arduino,C++,117,ESP8266 core for Arduino,11813,13591,https://avatars.githubusercontent.com/u/8943775?v=4
26038648,spdlog,gabime/spdlog,C++,329,Fast C++ logging library.,2815,13311,https://avatars.githubusercontent.com/u/6052198?u=a5aaa778f219603fd3a6e221c79370ac5f0fa182&v=4
143455116,filament,google/filament,C++,1119,"Filament is a real-time physically based rendering engine for Android, iOS, Windows, Linux, macOS, and WebGL2",1204,13167,https://avatars.githubusercontent.com/u/1342004?v=4
102343794,incubator-brpc,apache/incubator-brpc,C++,134,"Industrial-grade RPC framework used throughout Baidu, with 1,000,000+ instances and thousands kinds of services. ""brpc"" means ""better RPC"".",3155,12628,https://avatars.githubusercontent.com/u/47359?v=4
76990209,WLED,Aircoookie/WLED,C++,327,Control WS2812B and many more types of digital RGB LEDs with an ESP8266 or ESP32 over WiFi!,1444,7526,https://avatars.githubusercontent.com/u/21045690?u=b6ef8107e15c7fc6c160235afba9c3813117a768&v=4
283410102,workflow,sogou/workflow,C++,479,C++ Parallel Computing and Asynchronous Networking Engine,1225,6608,https://avatars.githubusercontent.com/u/15903299?v=4
128479644,esphome,esphome/esphome,C++,118,ESPHome is a system to control your ESP8266/ESP32 by simple yet powerful configuration files and control them remotely through Home Automation systems.,1295,4298,https://avatars.githubusercontent.com/u/45919759?v=4
115883761,td,tdlib/td,C++,111,Cross-platform library for building Telegram clients,868,4242,https://avatars.githubusercontent.com/u/34513022?v=4
114128199,multipass,canonical/multipass,C++,454,Multipass orchestrates virtual Ubuntu instances,343,3928,https://avatars.githubusercontent.com/u/53057619?v=4
339217472,re3,td512/re3,C++,228,"GTA III, Vice City",70,1021,https://avatars.githubusercontent.com/u/9508934?u=abbcb459bbc99c49ab77cf28f74a0cfea4d1365d&v=4
416649448,Windows11DragAndDropToTaskbarFix,HerMajestyDrMona/Windows11DragAndDropToTaskbarFix,C++,245,"""Windows 11 Drag & Drop to the Taskbar (Fix)"" fixes the missing ""Drag & Drop to the Taskbar"" support in Windows 11. It works with the new Windows 11 taskbar and does not require nasty changes like UndockingDisabled or restoration of the classic taskbar.",41,564,https://avatars.githubusercontent.com/u/24290461?v=4
