id,name,full_name,language,new stars,description,forks_count,stargazers_count,avatar_url
6296790,spring-boot,spring-projects/spring-boot,Java,679,Spring Boot,35129,58606,https://avatars.githubusercontent.com/u/317776?v=4
507775,elasticsearch,elastic/elasticsearch,Java,526,"Free and Open, Distributed, RESTful Search Engine",20959,57639,https://avatars.githubusercontent.com/u/6764390?v=4
206462776,GitHub-Chinese-Top-Charts,kon9chunkit/GitHub-Chinese-Top-Charts,Java,1245,:cn: GitHubä¸­æ–‡æ’è¡Œæ¦œï¼Œå¸®åŠ©ä½ å‘ç°é«˜åˆ†ä¼˜ç§€ä¸­æ–‡é¡¹ç›®ï¼Œæ— è¯­è¨€éšœç¢åœ°ã€æ›´é«˜æ•ˆåœ°å¸æ”¶å›½äººä¼˜ç§€ç»éªŒæˆæœï¼›æ¦œå•å‘¨æ›´ï¼Œæ•¬è¯·å…³æ³¨ï¼,5891,41587,https://avatars.githubusercontent.com/u/21018904?u=4a36658ac09281fb3a7591b905e494694800583a&v=4
9754983,tutorials,eugenp/tutorials,Java,503,"Just Announced - ""Learn Spring Security OAuth"": ",45769,28550,https://avatars.githubusercontent.com/u/1022859?v=4
159152904,jeecg-boot,jeecgboot/jeecg-boot,Java,591,ã€Œä¼ä¸šçº§ä½ä»£ç å¹³å°ã€å‰åç«¯åˆ†ç¦»æ¶æ„SpringBoot 2.xï¼ŒSpringCloudï¼ŒAnt Design&Vueï¼ŒMybatis-plusï¼ŒShiroï¼ŒJWTã€‚å¼ºå¤§çš„ä»£ç ç”Ÿæˆå™¨è®©å‰åç«¯ä»£ç ä¸€é”®ç”Ÿæˆï¼Œæ— éœ€å†™ä»»ä½•ä»£ç ! å¼•é¢†æ–°çš„å¼€å‘æ¨¡å¼OnlineCoding->ä»£ç ç”Ÿæˆ->æ‰‹å·¥MERGEï¼Œå¸®åŠ©Javaé¡¹ç›®è§£å†³70%é‡å¤å·¥ä½œï¼Œè®©å¼€å‘æ›´å…³æ³¨ä¸šåŠ¡ï¼Œæ—¢èƒ½å¿«é€Ÿæé«˜æ•ˆç‡ï¼Œå¸®åŠ©å…¬å¸èŠ‚çœæˆæœ¬ï¼ŒåŒæ—¶åˆä¸å¤±çµæ´»æ€§ã€‚,10243,26344,https://avatars.githubusercontent.com/u/86360035?v=4
112785414,spring-cloud-alibaba,alibaba/spring-cloud-alibaba,Java,326,Spring Cloud Alibaba provides a one-stop solution for application development for the distributed solutions of Alibaba middleware.,6409,20876,https://avatars.githubusercontent.com/u/1961952?v=4
137451403,nacos,alibaba/nacos,Java,409,"an easy-to-use dynamic service discovery, configuration and service management platform for building cloud native applications.",8648,20619,https://avatars.githubusercontent.com/u/1961952?v=4
2211243,kafka,apache/kafka,Java,281,Mirror of Apache Kafka,10858,20578,https://avatars.githubusercontent.com/u/47359?v=4
47023603,xxl-job,xuxueli/xxl-job,Java,291,A distributed task scheduling framework.ï¼ˆåˆ†å¸ƒå¼ä»»åŠ¡è°ƒåº¦å¹³å°XXL-JOBï¼‰,8535,20136,https://avatars.githubusercontent.com/u/10633817?u=89329d69ca512f24ce0ee669bf679e30c9503243&v=4
75164823,rocketmq,apache/rocketmq,Java,270,Mirror of Apache RocketMQ,8947,16098,https://avatars.githubusercontent.com/u/47359?v=4
148496687,SpringBoot-Labs,YunaiV/SpringBoot-Labs,Java,518,ä¸€ä¸ªæ¶µç›–å…­ä¸ªä¸“æ ï¼šSpring Boot 2.Xã€Spring Cloudã€Spring Cloud Alibabaã€Dubboã€åˆ†å¸ƒå¼æ¶ˆæ¯é˜Ÿåˆ—ã€åˆ†å¸ƒå¼äº‹åŠ¡çš„ä»“åº“ã€‚å¸Œæœ›èƒ–å‹å°æ‰‹ä¸€æŠ–ï¼Œå³ä¸Šè§’æ¥ä¸ª Starï¼Œæ„Ÿæ© 1024,4173,12729,https://avatars.githubusercontent.com/u/2015545?u=cb494dbc67c9004f32a4535f466e75b9f8702627&v=4
149001365,leetcode,doocs/leetcode,Java,1523,ğŸ˜ LeetCode solutions in any programming language | å¤šç§ç¼–ç¨‹è¯­è¨€å®ç° LeetCodeã€ã€Šå‰‘æŒ‡ Offerï¼ˆç¬¬ 2 ç‰ˆï¼‰ã€‹ã€ã€Šç¨‹åºå‘˜é¢è¯•é‡‘å…¸ï¼ˆç¬¬ 6 ç‰ˆï¼‰ã€‹é¢˜è§£,1789,9081,https://avatars.githubusercontent.com/u/43716716?v=4
173335706,dolphinscheduler,apache/dolphinscheduler,Java,190,"Apache DolphinScheduler is a distributed and extensible workflow scheduler platform with powerful DAG visual interfaces, dedicated to solving complex job dependencies in the data pipeline and providing various types of jobs available out of box.",2512,6873,https://avatars.githubusercontent.com/u/47359?v=4
237867883,metersphere,metersphere/metersphere,Java,331,MeterSphere æ˜¯ä¸€ç«™å¼å¼€æºæŒç»­æµ‹è¯•å¹³å°ï¼Œè¦†ç›–æµ‹è¯•ç®¡ç†ã€æ¥å£æµ‹è¯•ã€æ€§èƒ½æµ‹è¯•ç­‰ã€‚ææµ‹è¯•ï¼Œå°±é€‰ MeterSphereï¼,1444,6137,https://avatars.githubusercontent.com/u/56869043?v=4
191744942,Shadow,Tencent/Shadow,Java,265,é›¶åå°„å…¨åŠ¨æ€Androidæ’ä»¶æ¡†æ¶,928,6036,https://avatars.githubusercontent.com/u/18461506?v=4
13421878,pentaho-kettle,pentaho/pentaho-kettle,Java,82,Pentaho Data Integration ( ETL ) a.k.a Kettle,2794,5410,https://avatars.githubusercontent.com/u/1022787?v=4
50160261,Paper,PaperMC/Paper,Java,448,High performance Spigot fork that aims to fix gameplay and mechanics inconsistencies,1320,5166,https://avatars.githubusercontent.com/u/7608950?v=4
83799439,lawnchair,LawnchairLauncher/lawnchair,Java,184,No clever tagline needed.,760,4693,https://avatars.githubusercontent.com/u/34144436?v=4
46398090,datahub,linkedin/datahub,Java,432,The Metadata Platform for the Modern Data Stack,1174,4191,https://avatars.githubusercontent.com/u/357098?v=4
283211901,SmartTubeNext,yuliskov/SmartTubeNext,Java,454,Ad free app for watching tube videos on Android TV boxes,279,3495,https://avatars.githubusercontent.com/u/5897464?u=bcb1a508a8fdbf9da441be0db25672e42ad4ec64&v=4
237553513,sodium-fabric,CaffeineMC/sodium-fabric,Java,274,A Fabric mod designed to improve frame rates and reduce micro-stutter,510,2950,https://avatars.githubusercontent.com/u/78509697?v=4
195856796,Geyser,GeyserMC/Geyser,Java,110,A bridge/proxy allowing you to connect to Minecraft: Java Edition servers with Minecraft: Bedrock Edition.,400,2825,https://avatars.githubusercontent.com/u/52673035?v=4
282994686,flink-cdc-connectors,ververica/flink-cdc-connectors,Java,270,Change Data Capture (CDC) Connectors for Apache Flink,498,1554,https://avatars.githubusercontent.com/u/47454737?v=4
377354200,dynamic-threadpool,acmenlt/dynamic-threadpool,Java,917,"ğŸ”¥ å¼ºå¤§çš„åŠ¨æ€çº¿ç¨‹æ± ï¼Œé™„å¸¦ç›‘æ§æŠ¥è­¦åŠŸèƒ½ï¼ˆæ²¡æœ‰ä¾èµ–ä¸­é—´ä»¶ï¼‰ï¼Œå®Œå…¨éµå¾ªé˜¿é‡Œå·´å·´ç¼–ç è§„èŒƒã€‚Powerful dynamic thread pool, does not rely on any middleware, with monitoring and alarm function.",219,1446,https://avatars.githubusercontent.com/u/77398366?u=362ab74c104677018318200e72c5e549bc82d681&v=4
281866198,seckill,lyrric/seckill,Java,391,è‹—è‹— çº¦è‹— ä¹ä»· ç§’æ€ è„šæœ¬,446,1349,https://avatars.githubusercontent.com/u/20310859?u=59cfc26d92b4d4a8856b42ce308194608a65e774&v=4
