id,name,full_name,language,new stars,description,forks_count,stargazers_count,avatar_url
8514,rails,rails/rails,Ruby,45,Ruby on Rails,20658,51531,https://avatars.githubusercontent.com/u/4223?v=4
65252,jekyll,jekyll/jekyll,Ruby,36,:globe_with_meridians: Jekyll is a blog-aware static site generator in Ruby,9886,45379,https://avatars.githubusercontent.com/u/3083652?v=4
7569578,discourse,discourse/discourse,Ruby,49,"A platform for community discussion. Free, open, simple.",7785,36567,https://avatars.githubusercontent.com/u/3220138?v=4
53238813,brew,Homebrew/brew,Ruby,94,🍺 The missing package manager for macOS (or Linux),8091,33597,https://avatars.githubusercontent.com/u/1503512?v=4
52281283,mastodon,mastodon/mastodon,Ruby,42,"Your self-hosted, globally interconnected microblogging community",4674,30012,https://avatars.githubusercontent.com/u/24979032?v=4
2293158,metasploit-framework,rapid7/metasploit-framework,Ruby,63,Metasploit Framework,12550,28371,https://avatars.githubusercontent.com/u/1013671?v=4
308770,devise,heartcombo/devise,Ruby,26,Flexible authentication solution for Rails with Warden.,5466,22771,https://avatars.githubusercontent.com/u/59584037?v=4
73648678,forem,forem/forem,Ruby,52,For empowering community 🌱,3502,19718,https://avatars.githubusercontent.com/u/65030610?v=4
18486300,setup,lewagon/setup,Ruby,121,Setup instructions for Le Wagon's students on their first day of Web Development Bootcamp,1331,13822,https://avatars.githubusercontent.com/u/5470001?v=4
3195124,sidekiq,mperham/sidekiq,Ruby,24,"Simple, efficient background processing for Ruby",2201,12073,https://avatars.githubusercontent.com/u/2911?u=9e18eee0dc7fe4564dba7cdc7e22711a47171a8b&v=4
3314,spree,spree/spree,Ruby,7,Open Source multi-language/multi-currency/multi-store eCommerce platform,4879,11974,https://avatars.githubusercontent.com/u/56702?v=4
106995,sinatra,sinatra/sinatra,Ruby,11,Classy web-development dressed in a DSL (official / canonical repo),2066,11711,https://avatars.githubusercontent.com/u/8312?v=4
96395,faker,faker-ruby/faker,Ruby,14,"A library for generating fake data such as names, addresses, and phone numbers.",2979,10403,https://avatars.githubusercontent.com/u/47637297?v=4
1725199,linguist,github/linguist,Ruby,19,"Language Savant. If your repository's language is being reported incorrectly, send us a pull request!",3748,10277,https://avatars.githubusercontent.com/u/9919?v=4
611921,activeadmin,activeadmin/activeadmin,Ruby,9,The administration framework for Ruby on Rails applications.,3317,9252,https://avatars.githubusercontent.com/u/814570?v=4
30337170,graphql-ruby,rmosolgo/graphql-ruby,Ruby,9,Ruby implementation of GraphQL ,1261,5136,https://avatars.githubusercontent.com/u/2231765?u=3a7cc7f1a74a605f80bfd6cedda333df6c61a927&v=4
1314319,canvas-lms,instructure/canvas-lms,Ruby,9,"The open LMS by Instructure, Inc.",2013,4540,https://avatars.githubusercontent.com/u/515326?v=4
3898922,zammad,zammad/zammad,Ruby,13,Zammad is a web based open source helpdesk/customer support system,611,3145,https://avatars.githubusercontent.com/u/1380327?v=4
11426474,choosealicense.com,github/choosealicense.com,Ruby,16,A site to provide non-judgmental guidance on choosing a license for your open source project,1344,3020,https://avatars.githubusercontent.com/u/9919?v=4
297419763,india,github/india,Ruby,30,GitHub resources and information for the developer community in India,377,1619,https://avatars.githubusercontent.com/u/9919?v=4
502760,danbooru,danbooru/danbooru,Ruby,19,A taggable image board written in Rails.,364,1527,https://avatars.githubusercontent.com/u/57931572?v=4
225463,shopify-api-ruby,Shopify/shopify-api-ruby,Ruby,4,ShopifyAPI is a lightweight gem for accessing the Shopify admin REST and GraphQL web services.,397,914,https://avatars.githubusercontent.com/u/8085?v=4
498774921,phlex,joeldrapper/phlex,Ruby,77,A framework for building object-oriented views in Ruby.,38,421,https://avatars.githubusercontent.com/u/246692?u=be9d5a38ba1dce7d1fa74fd7961598fe149ed731&v=4
66497320,dd-trace-rb,DataDog/dd-trace-rb,Ruby,4,Datadog Tracing Ruby Client,305,206,https://avatars.githubusercontent.com/u/365230?v=4
365723058,phase-4-creating-a-rails-api,learn-co-curriculum/phase-4-creating-a-rails-api,Ruby,0,,316,0,https://avatars.githubusercontent.com/u/6208017?v=4
