id,name,full_name,language,new stars,description,forks_count,stargazers_count,avatar_url
27574418,nerd-fonts,ryanoasis/nerd-fonts,CSS,25,"Iconic font aggregator, collection, & patcher. 3,600+ icons, 50+ patched fonts: Hack, Source Code Pro, more. Glyph collections: Font Awesome, Material Design Icons, Octicons, & more",3506,48634,https://avatars.githubusercontent.com/u/8083459?u=1645f43000c842a948268609231bdecb1433c470&v=4
50264296,bulma,jgthms/bulma,CSS,6,Modern CSS framework based on Flexbox,4012,47757,https://avatars.githubusercontent.com/u/1254808?u=1d9df343bac6f57e7bff85f0074aac2de34f5dcc&v=4
313330998,50projects50days,bradtraversy/50projects50days,CSS,17,"50+ mini web projects using HTML, CSS & JS",8338,32036,https://avatars.githubusercontent.com/u/5550850?u=45352e59e108ddd00ead26981cd6a4a53b151b1d&v=4
68592809,iCSS,chokcoco/iCSS,CSS,192,不止于 CSS,1759,16883,https://avatars.githubusercontent.com/u/8554143?u=c322501aeb96b3f90f504512d501830b70894eae&v=4
49767244,primeng,primefaces/primeng,CSS,7,The Most Complete Angular UI Component Library,4336,8894,https://avatars.githubusercontent.com/u/3494069?v=4
264441033,missing-semester-cn.github.io,missing-semester-cn/missing-semester-cn.github.io,CSS,5,the CS missing semester Chinese version,780,5722,https://avatars.githubusercontent.com/u/65452715?v=4
160313905,primevue,primefaces/primevue,CSS,30,Next Generation Vue UI Component Library,893,5682,https://avatars.githubusercontent.com/u/3494069?v=4
76666208,primereact,primefaces/primereact,CSS,8,The Most Complete React UI Component Library,851,4969,https://avatars.githubusercontent.com/u/3494069?v=4
379916997,micro-app,micro-zoe/micro-app,CSS,3,"A simple, efficient and powerful micro front-end framework. 一款简约、高效、功能强大的微前端框架",529,4908,https://avatars.githubusercontent.com/u/86414403?v=4
329751286,youtube,safak/youtube,CSS,1,,5249,4664,https://avatars.githubusercontent.com/u/1486366?u=c367d218a8cf89ad09c3dbfb3c7ad7a929142f20&v=4
107962707,advanced-css-course,jonasschmedtmann/advanced-css-course,CSS,2,"Starter files, final projects and FAQ for my Advanced CSS course",5159,4356,https://avatars.githubusercontent.com/u/18718850?u=9e3b84d1871a03690c758df5b5e9b967223a6def&v=4
222361926,javascript-basic-projects,john-smilga/javascript-basic-projects,CSS,1,,3710,3480,https://avatars.githubusercontent.com/u/42133389?u=9d63b6d71fba139347cddf2c840a858c8ff97168&v=4
292673424,cloudflare-docs,cloudflare/cloudflare-docs,CSS,2,Cloudflare’s documentation,2670,2328,https://avatars.githubusercontent.com/u/314135?v=4
116700454,hugo-paper,nanxiaobei/hugo-paper,CSS,1,"🪺 A simple, clean, customizable Hugo theme",423,1808,https://avatars.githubusercontent.com/u/13369712?v=4
229504810,littlelink,sethcottle/littlelink,CSS,3,A lightweight DIY alternative to services like Linktree.,716,1178,https://avatars.githubusercontent.com/u/1301949?u=4daba74ec4f36ed6fa9b9373566b6520eb1356b7&v=4
351877974,python_interview_questions,yakimka/python_interview_questions,CSS,2,Вопросы для подготовки к интервью на позицию Python Developer,268,1105,https://avatars.githubusercontent.com/u/28621349?u=973eef21adf71f2c7da1caaaacf41d66e3f7d27f&v=4
10321675,the-internet,saucelabs/the-internet,CSS,1,An example application that captures prominent and ugly functionality found on the web. Perfect for writing automated acceptance tests against.,565,719,https://avatars.githubusercontent.com/u/88837?v=4
133927297,sakai-react,primefaces/sakai-react,CSS,2,Free React Admin Template ,443,696,https://avatars.githubusercontent.com/u/3494069?v=4
616351992,Next.js-Developer-Portfolio-Starter-Code,codebucks27/Next.js-Developer-Portfolio-Starter-Code,CSS,3,"⭐Build a stunning portfolio website with Next.js, Tailwind CSS and Framer-motion. If you want to learn to create this you can follow the tutorial link given in the Read me file.",279,461,https://avatars.githubusercontent.com/u/70878044?u=2440c945ab064a31db243cd34cb7b6037fc0bc68&v=4
436884632,sakai-ng,primefaces/sakai-ng,CSS,2,Free Angular Admin Template by PrimeNG,358,366,https://avatars.githubusercontent.com/u/3494069?v=4
263538907,Evilginx2-Phishlets,An0nUD4Y/Evilginx2-Phishlets,CSS,1,Evilginx3 Phishlets version (0.2.3 & above) Only For Testing/Learning Purposes,194,358,https://avatars.githubusercontent.com/u/37680540?u=3af9806b5b93d0f1add2ae9b62d4eb8e9bcf2c18&v=4
730738728,hydration-overlay,BuilderIO/hydration-overlay,CSS,36,Overlay for hydration errors with explicit diff between renders.,4,212,https://avatars.githubusercontent.com/u/35700027?v=4
723569614,tinawina,OlieWu/tinawina,CSS,6,A webpage for ma girlfriend ,29,38,https://avatars.githubusercontent.com/u/91023757?u=f83755bd73fab3ef3dd7fda2905b173e9a091eb9&v=4
694366857,actions-learning-pathway,github/actions-learning-pathway,CSS,0,"Learning pathway resources for building, testing, and deploying a GitHub Action to GitHub Pages.",39,32,https://avatars.githubusercontent.com/u/9919?v=4
729751811,Chato,Atuti/Chato,CSS,0,,12,0,https://avatars.githubusercontent.com/u/40859558?v=4
