id,name,full_name,language,new stars,description,forks_count,stargazers_count,avatar_url
1039520,youtube-dl,ytdl-org/youtube-dl,Python,542,Command-line program to download videos from YouTube.com and other video sites,7224,106956,https://avatars.githubusercontent.com/u/48381040?v=4
83844720,face_recognition,ageitgey/face_recognition,Python,108,The world's simplest facial recognition api for Python and the command line,12025,43289,https://avatars.githubusercontent.com/u/896692?u=ea39271fb0e41dbfee2431f55e568124e6f4d8cc&v=4
160919119,fastapi,tiangolo/fastapi,Python,584,"FastAPI framework, high performance, easy to learn, fast to code, ready for production",3234,42545,https://avatars.githubusercontent.com/u/1326112?u=5cad72c846b7aba2e960546af490edc7375dafc4&v=4
74627617,openpilot,commaai/openpilot,Python,581,openpilot is an open source driver assistance system. openpilot performs the functions of Automated Lane Centering and Adaptive Cruise Control for over 150 supported car makes and models.,6107,33416,https://avatars.githubusercontent.com/u/16128714?v=4
4578002,python-patterns,faif/python-patterns,Python,245,A collection of design patterns/idioms in Python,6217,30641,https://avatars.githubusercontent.com/u/1304661?u=3c1b0dbad33966d8eea133e85724bda354dedc89&v=4
6007295,jieba,fxsjy/jieba,Python,64,ç»“å·´ä¸­æ–‡åˆ†è¯,6505,27968,https://avatars.githubusercontent.com/u/167837?v=4
264818686,yolov5,ultralytics/yolov5,Python,281,YOLOv5 ğŸš€ in PyTorch > ONNX > CoreML > TFLite,8080,22648,https://avatars.githubusercontent.com/u/26833451?v=4
168799526,pytorch-image-models,rwightman/pytorch-image-models,Python,146,"PyTorch image models, scripts, pretrained weights -- ResNet, ResNeXT, EfficientNet, EfficientNetV2, NFNet, Vision Transformer, MixNet, MobileNet-V3/V2, RegNet, DPN, CSPNet, and more",2749,16740,https://avatars.githubusercontent.com/u/5702664?u=df4f0a66cd454d176039c595bb197c7fcecfd8ba&v=4
91629816,freqtrade,freqtrade/freqtrade,Python,610,"Free, open source crypto trading bot",3475,16491,https://avatars.githubusercontent.com/u/37536846?v=4
273839530,python-mini-projects,Python-World/python-mini-projects,Python,246,A collection of simple python mini projects to enhance your python skills,2682,9493,https://avatars.githubusercontent.com/u/68968126?v=4
323048702,GamestonkTerminal,GamestonkTerminal/GamestonkTerminal,Python,59,Investment Research for Everyone.,1014,9077,https://avatars.githubusercontent.com/u/80064875?v=4
43425480,awesome-quant,wilsonfreitas/awesome-quant,Python,79,"A curated list of insanely awesome libraries, packages and resources for Quants (Quantitative Finance)",1578,8854,https://avatars.githubusercontent.com/u/1583922?u=dfb647bb564331eb2c1dbba35f8bafd8b1abb9e2&v=4
428202741,awesome-oss-alternatives,RunaCapital/awesome-oss-alternatives,Python,2699,Awesome list of open-source startup alternatives to well-known SaaS products ğŸš€,370,7919,https://avatars.githubusercontent.com/u/16305757?v=4
114619595,byob,malwaredllc/byob,Python,92,"An open-source post-exploitation framework for students, researchers and developers.",1752,7182,https://avatars.githubusercontent.com/u/30509968?u=f5fa2375c0c78aad86142426df747a19ef0699b8&v=4
112070198,Hitomi-Downloader,KurtBestor/Hitomi-Downloader,Python,488,":cake: Desktop utility to download images/videos/music/text from various websites, and more.",818,6954,https://avatars.githubusercontent.com/u/14768120?v=4
221723816,deep-learning-for-image-processing,WZMIAOMIAO/deep-learning-for-image-processing,Python,147,deep learning for image processing including classification and object-detection etc.,3332,6793,https://avatars.githubusercontent.com/u/31005897?u=a6dfb78a5caad98747e8103beaf4aec4467272f6&v=4
167349656,FATE,FederatedAI/FATE,Python,111,An Industrial Grade Federated Learning Framework,1182,4039,https://avatars.githubusercontent.com/u/54675540?v=4
253044228,nuclei-templates,projectdiscovery/nuclei-templates,Python,47,Community curated list of templates for the nuclei engine to find security vulnerabilities.,1105,3489,https://avatars.githubusercontent.com/u/50994705?v=4
321659062,DeepFaceLive,iperov/DeepFaceLive,Python,452,Real-time face swap for PC streaming or video calls,507,3259,https://avatars.githubusercontent.com/u/8076202?u=2928fa5264ebcdb64c8175e726cbc2438e483ba2&v=4
303802588,MHDDoS,MHProDev/MHDDoS,Python,1072,"Best DDoS Attack Script  Python3, Cyber Attack With 40 Methods",498,1919,https://avatars.githubusercontent.com/u/63018646?u=2f41ead3b394f6bbd5878f863f3c3b4908ad5734&v=4
334412452,sahi,obss/sahi,Python,161,A lightweight vision library for performing large scale object detection/ instance segmentation.,159,1217,https://avatars.githubusercontent.com/u/63360722?v=4
433296683,typoraCracker,Mas0nShi/typoraCracker,Python,66,A extract & decryption and pack & encryption tools for typora.,359,1052,https://avatars.githubusercontent.com/u/60805843?u=36b3b0c682e6f90fd2dc5b2f269a81186cf66055&v=4
423775360,anomalib,openvinotoolkit/anomalib,Python,179,"An anomaly detection library comprising state-of-the-art algorithms and features such as experiment management, hyper-parameter optimization, and edge inference.",44,482,https://avatars.githubusercontent.com/u/55443902?v=4
460464085,data-engineering-practice,danielbeach/data-engineering-practice,Python,139,Data Engineering Practice Problems,52,435,https://avatars.githubusercontent.com/u/34192225?u=f8f510e7d64298c1ed59dc15834d741146354cc0&v=4
452783826,movie_robot,pofey/movie_robot,Python,60,å¯ä»¥è‡ªåŠ¨ä»è±†ç“£ç”¨æˆ·çš„æƒ³çœ‹ã€åœ¨çœ‹ã€çœ‹è¿‡åˆ—è¡¨ä¸­è‡ªåŠ¨è·å–ç”µå½±ï¼Œå¹¶é€šè¿‡mteamæŸ¥æ‰¾ç§å­ï¼Œæäº¤åˆ°qbittorrentä¸­ä¸‹è½½ï¼ˆä¾èµ–Embyç®¡ç†å½±è§†åŸæ•°æ®ï¼‰,33,217,https://avatars.githubusercontent.com/u/1396975?v=4
