id,name,full_name,language,new stars,description,forks_count,stargazers_count,avatar_url
1039520,youtube-dl,ytdl-org/youtube-dl,Python,532,Command-line program to download videos from YouTube.com and other video sites,7229,106974,https://avatars.githubusercontent.com/u/48381040?v=4
160919119,fastapi,tiangolo/fastapi,Python,484,"FastAPI framework, high performance, easy to learn, fast to code, ready for production",3237,42569,https://avatars.githubusercontent.com/u/1326112?u=5cad72c846b7aba2e960546af490edc7375dafc4&v=4
74627617,openpilot,commaai/openpilot,Python,346,openpilot is an open source driver assistance system. openpilot performs the functions of Automated Lane Centering and Adaptive Cruise Control for over 150 supported car makes and models.,6108,33426,https://avatars.githubusercontent.com/u/16128714?v=4
136026789,DeepFaceLab,iperov/DeepFaceLab,Python,137,DeepFaceLab is the leading software for creating deepfakes.,7153,31475,https://avatars.githubusercontent.com/u/8076202?u=2928fa5264ebcdb64c8175e726cbc2438e483ba2&v=4
4578002,python-patterns,faif/python-patterns,Python,223,A collection of design patterns/idioms in Python,6218,30655,https://avatars.githubusercontent.com/u/1304661?u=3c1b0dbad33966d8eea133e85724bda354dedc89&v=4
264818686,yolov5,ultralytics/yolov5,Python,278,YOLOv5 ğŸš€ in PyTorch > ONNX > CoreML > TFLite,8086,22667,https://avatars.githubusercontent.com/u/26833451?v=4
212639071,devops-exercises,bregman-arie/devops-exercises,Python,116,"Linux, Jenkins, AWS, SRE, Prometheus, Docker, Python, Ansible, Git, Kubernetes, Terraform, OpenStack, SQL, NoSQL, Azure, GCP, DNS, Elastic, Network, Virtualization. DevOps Interview Questions",4530,21501,https://avatars.githubusercontent.com/u/10349437?u=bb7c3c533587d7cb2e3dd336e0f8a0d40544e5f5&v=4
91629816,freqtrade,freqtrade/freqtrade,Python,615,"Free, open source crypto trading bot",3478,16507,https://avatars.githubusercontent.com/u/37536846?v=4
106024057,pytorch_geometric,pyg-team/pytorch_geometric,Python,65,Graph Neural Network Library for PyTorch,2461,13922,https://avatars.githubusercontent.com/u/89995122?v=4
273839530,python-mini-projects,Python-World/python-mini-projects,Python,246,A collection of simple python mini projects to enhance your python skills,2689,9507,https://avatars.githubusercontent.com/u/68968126?v=4
323048702,GamestonkTerminal,GamestonkTerminal/GamestonkTerminal,Python,65,Investment Research for Everyone.,1013,9086,https://avatars.githubusercontent.com/u/80064875?v=4
130375797,dgl,dmlc/dgl,Python,58,"Python package built to ease deep learning on graph, on top of existing DL frameworks.",2061,9028,https://avatars.githubusercontent.com/u/11508361?v=4
428202741,awesome-oss-alternatives,RunaCapital/awesome-oss-alternatives,Python,2891,Awesome list of open-source startup alternatives to well-known SaaS products ğŸš€,379,8133,https://avatars.githubusercontent.com/u/16305757?v=4
43509302,scapy,secdev/scapy,Python,32,Scapy: the Python-based interactive packet manipulation program & library. Supports Python 2 & Python 3.,1609,7113,https://avatars.githubusercontent.com/u/14927208?v=4
112070198,Hitomi-Downloader,KurtBestor/Hitomi-Downloader,Python,472,":cake: Desktop utility to download images/videos/music/text from various websites, and more.",820,6971,https://avatars.githubusercontent.com/u/14768120?v=4
221723816,deep-learning-for-image-processing,WZMIAOMIAO/deep-learning-for-image-processing,Python,152,deep learning for image processing including classification and object-detection etc.,3334,6806,https://avatars.githubusercontent.com/u/31005897?u=a6dfb78a5caad98747e8103beaf4aec4467272f6&v=4
253044228,nuclei-templates,projectdiscovery/nuclei-templates,Python,48,Community curated list of templates for the nuclei engine to find security vulnerabilities.,1106,3492,https://avatars.githubusercontent.com/u/50994705?v=4
321659062,DeepFaceLive,iperov/DeepFaceLive,Python,294,Real-time face swap for PC streaming or video calls,514,3274,https://avatars.githubusercontent.com/u/8076202?u=2928fa5264ebcdb64c8175e726cbc2438e483ba2&v=4
277982133,mmdetection3d,open-mmlab/mmdetection3d,Python,28,OpenMMLab's next-generation platform for general 3D object detection.,578,2084,https://avatars.githubusercontent.com/u/10245193?v=4
303802588,MHDDoS,MHProDev/MHDDoS,Python,1210,"Best DDoS Attack Script  Python3, Cyber Attack With 40 Methods",516,2057,https://avatars.githubusercontent.com/u/63018646?u=2f41ead3b394f6bbd5878f863f3c3b4908ad5734&v=4
433296683,typoraCracker,Mas0nShi/typoraCracker,Python,66,A extract & decryption and pack & encryption tools for typora.,361,1056,https://avatars.githubusercontent.com/u/60805843?u=36b3b0c682e6f90fd2dc5b2f269a81186cf66055&v=4
423775360,anomalib,openvinotoolkit/anomalib,Python,121,"An anomaly detection library comprising state-of-the-art algorithms and features such as experiment management, hyper-parameter optimization, and edge inference.",45,500,https://avatars.githubusercontent.com/u/55443902?v=4
460464085,data-engineering-practice,danielbeach/data-engineering-practice,Python,73,Data Engineering Practice Problems,53,436,https://avatars.githubusercontent.com/u/34192225?u=f8f510e7d64298c1ed59dc15834d741146354cc0&v=4
461353485,RedTeam-Resources,J0hnbX/RedTeam-Resources,Python,109,,53,291,https://avatars.githubusercontent.com/u/98451016?v=4
452783826,movie_robot,pofey/movie_robot,Python,57,å¯ä»¥è‡ªåŠ¨ä»è±†ç“£ç”¨æˆ·çš„æƒ³çœ‹ã€åœ¨çœ‹ã€çœ‹è¿‡åˆ—è¡¨ä¸­è‡ªåŠ¨è·å–ç”µå½±ï¼Œå¹¶é€šè¿‡mteamæŸ¥æ‰¾ç§å­ï¼Œæäº¤åˆ°qbittorrentä¸­ä¸‹è½½ï¼ˆä¾èµ–Embyç®¡ç†å½±è§†åŸæ•°æ®ï¼‰,33,219,https://avatars.githubusercontent.com/u/1396975?v=4
