id,name,full_name,language,new stars,description,forks_count,stargazers_count,avatar_url
8514,rails,rails/rails,Ruby,60,Ruby on Rails,20759,51766,https://avatars.githubusercontent.com/u/4223?v=4
65252,jekyll,jekyll/jekyll,Ruby,56,:globe_with_meridians: Jekyll is a blog-aware static site generator in Ruby,9924,45596,https://avatars.githubusercontent.com/u/3083652?v=4
8681349,huginn,huginn/huginn,Ruby,58,Create agents that monitor and act on your behalf.  Your agents are standing by!,3338,36895,https://avatars.githubusercontent.com/u/23225142?v=4
27442967,fastlane,fastlane/fastlane,Ruby,35,🚀 The easiest way to automate building and releasing your iOS and Android apps,5356,36037,https://avatars.githubusercontent.com/u/11098337?v=4
52281283,mastodon,mastodon/mastodon,Ruby,1465,"Your self-hosted, globally interconnected microblogging community",5210,34934,https://avatars.githubusercontent.com/u/24979032?v=4
53238813,brew,Homebrew/brew,Ruby,86,🍺 The missing package manager for macOS (or Linux),8240,34027,https://avatars.githubusercontent.com/u/1503512?v=4
308770,devise,heartcombo/devise,Ruby,14,Flexible authentication solution for Rails with Warden.,5479,22850,https://avatars.githubusercontent.com/u/59584037?v=4
3623050,homebrew-cask,Homebrew/homebrew-cask,Ruby,27,🍻 A CLI workflow for the administration of macOS applications distributed as binaries,10023,19560,https://avatars.githubusercontent.com/u/1503512?v=4
3195124,sidekiq,mperham/sidekiq,Ruby,23,"Simple, efficient background processing for Ruby",2225,12162,https://avatars.githubusercontent.com/u/2911?u=9e18eee0dc7fe4564dba7cdc7e22711a47171a8b&v=4
106995,sinatra,sinatra/sinatra,Ruby,8,Classy web-development dressed in a DSL (official / canonical repo),2079,11766,https://avatars.githubusercontent.com/u/8312?v=4
1918677,fluentd,fluent/fluentd,Ruby,21,Fluentd: Unified Logging Layer (project under CNCF),1278,11615,https://avatars.githubusercontent.com/u/859518?v=4
1725199,linguist,github/linguist,Ruby,32,"Language Savant. If your repository's language is being reported incorrectly, send us a pull request!",3831,10456,https://avatars.githubusercontent.com/u/9919?v=4
275604,resque,resque/resque,Ruby,3,"Resque is a Redis-backed Ruby library for creating background jobs, placing them on multiple queues, and processing them later.",1670,9213,https://avatars.githubusercontent.com/u/3876747?v=4
6529205,pundit,varvet/pundit,Ruby,4,Minimal authorization through OO design and pure Ruby classes,603,7800,https://avatars.githubusercontent.com/u/3612746?v=4
16549503,scientist,github/scientist,Ruby,18,:microscope: A Ruby library for carefully refactoring critical paths.,491,6803,https://avatars.githubusercontent.com/u/9919?v=4
22059578,pghero,ankane/pghero,Ruby,19,A performance dashboard for Postgres,399,6705,https://avatars.githubusercontent.com/u/220358?u=ba13f3240d7992dc4124a33a4fc65bf4924e5375&v=4
1548802,ransack,activerecord-hackery/ransack,Ruby,8,Object-based searching. ,754,5291,https://avatars.githubusercontent.com/u/5951504?v=4
96071,rack,rack/rack,Ruby,10,A modular Ruby web server interface.,1646,4550,https://avatars.githubusercontent.com/u/42379?v=4
30985840,solidus,solidusio/solidus,Ruby,12,"🛒 Solidus, the open-source eCommerce framework for industry trailblazers.",1229,4486,https://avatars.githubusercontent.com/u/11045486?v=4
52316423,react-native-config,luggit/react-native-config,Ruby,7,Bring some 12 factor love to your mobile apps!,617,4321,https://avatars.githubusercontent.com/u/10248925?v=4
95798441,colorls,athityakumar/colorls,Ruby,9,"A Ruby gem that beautifies the terminal's ls command, with color and font-awesome icons. :tada:",341,4273,https://avatars.githubusercontent.com/u/17109060?u=766f5a6ef0a4743779d51678e721ba75d0ebdb55&v=4
103766152,explore,github/explore,Ruby,20,Community-curated topic and collection pages on GitHub,11523,3468,https://avatars.githubusercontent.com/u/9919?v=4
1175581,styles,citation-style-language/styles,Ruby,16,Official repository for Citation Style Language (CSL) citation styles.,3395,2778,https://avatars.githubusercontent.com/u/526476?v=4
3698608,sidekiq-scheduler,sidekiq-scheduler/sidekiq-scheduler,Ruby,2,Lightweight job scheduler extension for Sidekiq,217,1536,https://avatars.githubusercontent.com/u/107698623?v=4
99692620,mastodon-twitter-poster,renatolond/mastodon-twitter-poster,Ruby,40,Crossposter to post statuses between Mastodon and Twitter,53,665,https://avatars.githubusercontent.com/u/173791?u=4f82f66970c8f18a613630ff95b475c4e7a06263&v=4
