id,name,full_name,language,new stars,description,forks_count,stargazers_count,avatar_url
126577260,javascript-algorithms,trekhleb/javascript-algorithms,JavaScript,1828,ğŸ“ Algorithms and data structures implemented in JavaScript with explanations and links to further readings,20350,125017,https://avatars.githubusercontent.com/u/3000285?u=1e62782f227030b78b7aa78cbbcab5f8a24e658a&v=4
63476337,Python,TheAlgorithms/Python,Python,1157,All Algorithms implemented in Python,32617,121659,https://avatars.githubusercontent.com/u/20487725?v=4
1039520,youtube-dl,ytdl-org/youtube-dl,Python,316,Command-line program to download videos from YouTube.com and other video sites,6212,101660,https://avatars.githubusercontent.com/u/48381040?v=4
19415064,computer-science,ossu/computer-science,,681,:mortar_board: Path to a free self-taught education in Computer Science!,13600,99090,https://avatars.githubusercontent.com/u/14957346?v=4
65600975,pytorch,pytorch/pytorch,C++,195,Tensors and Dynamic neural networks in Python with strong GPU acceleration,14142,51685,https://avatars.githubusercontent.com/u/21003710?v=4
114747226,faceswap,deepfakes/faceswap,Python,423,Deepfakes Software For All,11276,39101,https://avatars.githubusercontent.com/u/34667098?u=694bb8572af60931d10ae4d2e600b989cffd0ff0&v=4
71220757,PayloadsAllTheThings,swisskyrepo/PayloadsAllTheThings,Python,512,A list of useful payloads and bypass for Web Application Security and Pentest/CTF,8594,31443,https://avatars.githubusercontent.com/u/12152583?u=e368c891b81d41b1ce12825f52049e5eb146d401&v=4
154739597,jax,google/jax,Python,249,"Composable transformations of Python+NumPy programs: differentiate, vectorize, JIT to GPU/TPU, and more",1371,14723,https://avatars.githubusercontent.com/u/1342004?v=4
120156076,Cloudreve,cloudreve/Cloudreve,Go,528,"ğŸŒ©æ”¯æŒå¤šå®¶äº‘å­˜å‚¨çš„äº‘ç›˜ç³»ç»Ÿ (Self-deployed file management and sharing system, supports multiple storage providers)",1956,11342,https://avatars.githubusercontent.com/u/48898462?v=4
307260205,yt-dlp,yt-dlp/yt-dlp,Python,771,A youtube-dl fork with additional features and fixes,542,8991,https://avatars.githubusercontent.com/u/79589310?v=4
180481986,apisix,apache/apisix,Lua,182,The Cloud-Native API Gateway,1304,7215,https://avatars.githubusercontent.com/u/47359?v=4
266231149,logseq,logseq/logseq,Clojure,297,"A privacy-first, open-source platform for knowledge management and collaboration. Desktop app download link: https://github.com/logseq/logseq/releases, roadmap: https://trello.com/b/8txSM12G/roadmap",405,6816,https://avatars.githubusercontent.com/u/63385289?v=4
105963253,reactjs.org,reactjs/reactjs.org,JavaScript,472,The React documentation website,5504,6402,https://avatars.githubusercontent.com/u/6412038?v=4
341944220,all-of-frontend,KieSun/all-of-frontend,JavaScript,393,ä½ æƒ³çŸ¥é“çš„å‰ç«¯å†…å®¹éƒ½åœ¨è¿™,557,3774,https://avatars.githubusercontent.com/u/11811888?u=2d330564df93a5291ea8f261c588670ae01f20de&v=4
260869160,laravel-tips,LaravelDaily/laravel-tips,,381,Awesome tips for Laravel,596,2968,https://avatars.githubusercontent.com/u/15341846?v=4
392596825,ddosify,ddosify/ddosify,Go,679,"High-performance load testing tool, written in Golang.",71,2526,https://avatars.githubusercontent.com/u/75415501?v=4
400501136,mujoco,deepmind/mujoco,C,1192,Multi-Joint dynamics with Contact. A general purpose physics simulator.,154,2503,https://avatars.githubusercontent.com/u/8596759?v=4
417600655,guiadevbrasil,arthurspk/guiadevbrasil,,985,GUIA EXTENSO DE PROGRAMAÃ‡ÃƒO:,310,2172,https://avatars.githubusercontent.com/u/70382532?u=06731ca80680ffd047bfdc30e8f3494007d12188&v=4
206300925,PathOfBuilding,PathOfBuildingCommunity/PathOfBuilding,Lua,82,Offline build planner for Path of Exile.,1021,1648,https://avatars.githubusercontent.com/u/60926656?v=4
389551726,audio_video_streaming,0voice/audio_video_streaming,,721,éŸ³è§†é¢‘æµåª’ä½“æƒå¨èµ„æ–™æ•´ç†ï¼Œ500+ä»½æ–‡ç« ï¼Œè®ºæ–‡ï¼Œè§†é¢‘ï¼Œå®è·µé¡¹ç›®ï¼Œåè®®ï¼Œä¸šç•Œå¤§ç¥åå•ã€‚,267,1369,https://avatars.githubusercontent.com/u/43104160?v=4
415421172,MediaCreationTool.bat,AveYo/MediaCreationTool.bat,Batchfile,304,Universal MCT wrapper script for all Windows 10/11 versions from 1507 to 21H2!,325,1319,https://avatars.githubusercontent.com/u/12874843?u=b9b71a3705d98cf7a446d713902edcc8bd3a0de5&v=4
375345894,ani-cli,pystardust/ani-cli,Shell,242,A cli tool to browse and play anime,103,1011,https://avatars.githubusercontent.com/u/79201151?u=fb584506dd724f48d56b6dc85a1c8bccb401fc90&v=4
387531333,swift-docc,apple/swift-docc,Swift,132,Documentation compiler that produces rich API reference documentation and interactive tutorials for your Swift framework or package.,20,460,https://avatars.githubusercontent.com/u/10639145?v=4
416595276,craftzdog-homepage,craftzdog/craftzdog-homepage,JavaScript,196,My homepage,52,330,https://avatars.githubusercontent.com/u/1332805?u=5b6e5cff00fb7e5ff533f3d3a0f5aa71b54337d4&v=4
416917474,MapAssist,misterokaygo/MapAssist,C#,90,,131,147,https://avatars.githubusercontent.com/u/11061489?v=4
