id,name,full_name,language,new stars,description,forks_count,stargazers_count,avatar_url
2325298,linux,torvalds/linux,C,399,Linux kernel source tree,39403,120075,https://avatars.githubusercontent.com/u/1024025?v=4
10744183,netdata,netdata/netdata,C,89,"Real-time performance monitoring, done right! https://www.netdata.cloud",5080,56464,https://avatars.githubusercontent.com/u/43390781?v=4
111583593,scrcpy,Genymobile/scrcpy,C,325,Display and control your Android device,5834,56084,https://avatars.githubusercontent.com/u/3427627?v=4
1903522,php-src,php/php-src,C,83,The PHP Interpreter,6865,31539,https://avatars.githubusercontent.com/u/25158?v=4
246335987,Ventoy,ventoy/Ventoy,C,253,A new bootable USB solution.,2033,27766,https://avatars.githubusercontent.com/u/59477474?u=16f38c14b69580f87f4717b71c0e5e85e9559cb1&v=4
102578345,lede,coolsnowwolf/lede,C,81,Lean's OpenWrt source,15328,18260,https://avatars.githubusercontent.com/u/31687149?u=caa956c5f80318ea674625f9e9efa49c98335d74&v=4
196353673,TDengine,taosdata/TDengine,C,693,An open-source big data platform designed and optimized for the Internet of Things (IoT).,4080,16973,https://avatars.githubusercontent.com/u/48876650?v=4
80286288,Tasmota,arendst/Tasmota,C,55,"Alternative firmware for ESP8266 with easy configuration using webUI, OTA updates, automation using timers or rules, expandability and entirely local control over MQTT, HTTP, Serial or KNX. Full documentation at",3563,16308,https://avatars.githubusercontent.com/u/11044339?u=b54c71859c551426b6738921138b740804ca1d62&v=4
6201092,mpv,mpv-player/mpv,C,119,🎥 Command line video player,2032,16294,https://avatars.githubusercontent.com/u/2550273?v=4
95879426,ncnn,Tencent/ncnn,C,65,ncnn is a high-performance neural network inference framework optimized for the mobile platform,3119,12951,https://avatars.githubusercontent.com/u/18461506?v=4
179354282,OpenCorePkg,acidanthera/OpenCorePkg,C,46,OpenCore bootloader,1468,8283,https://avatars.githubusercontent.com/u/39672954?v=4
70127218,arduino-esp32,espressif/arduino-esp32,C,32,Arduino core for the ESP32,4684,7469,https://avatars.githubusercontent.com/u/9460735?v=4
1979797,FreeRDP,FreeRDP/FreeRDP,C,44,FreeRDP is a free remote desktop protocol library and clients,10659,5712,https://avatars.githubusercontent.com/u/663376?v=4
254327261,Sandboxie,sandboxie-plus/Sandboxie,C,60,Sandboxie - Open Source,582,5481,https://avatars.githubusercontent.com/u/63755826?v=4
19112091,thc-hydra,vanhauser-thc/thc-hydra,C,27,hydra,1388,5477,https://avatars.githubusercontent.com/u/7396244?u=952127371f345a18656cb9c91a67cde499fbfdc6&v=4
2997204,john,openwall/john,C,37,"John the Ripper jumbo - advanced offline password cracker, which supports hundreds of hash and cipher types, and runs on many operating systems, CPUs, GPUs, and even some FPGAs",1459,5468,https://avatars.githubusercontent.com/u/1579552?v=4
59771425,zephyr,zephyrproject-rtos/zephyr,C,32,"Primary Git Repository for the Zephyr Project. Zephyr is a new generation, scalable, optimized, secure RTOS for multiple hardware architectures.",3212,5052,https://avatars.githubusercontent.com/u/19595895?v=4
44781140,gpdb,greenplum-db/gpdb,C,16,"Greenplum Database - Massively Parallel PostgreSQL for Analytics. An open-source massively parallel data platform for analytics, machine learning and AI.",1375,4819,https://avatars.githubusercontent.com/u/14097842?v=4
91493088,GoodbyeDPI,ValdikSS/GoodbyeDPI,C,43,GoodbyeDPI—Passive Deep Packet Inspection blocker and Active DPI circumvention utility (for Windows),541,4738,https://avatars.githubusercontent.com/u/3054729?u=db712da584cc0d21a860b786b9ab2f2323758598&v=4
40556106,wazuh,wazuh/wazuh,C,18,Wazuh - The Open Source Security Platform,611,2697,https://avatars.githubusercontent.com/u/13752566?v=4
257113637,minecraft-weekend,jdah/minecraft-weekend,C,40,"Minecraft, but I made it in 48 hours.",220,2168,https://avatars.githubusercontent.com/u/20308439?u=8e2b119cf048b01bd2fc2cbcf620cb1b8aebed74&v=4
226167620,InfiniTime,InfiniTimeOrg/InfiniTime,C,32,Firmware for Pinetime smartwatch written in C/C++ and based on FreeRTOS,403,1010,https://avatars.githubusercontent.com/u/91782433?v=4
394318710,ExplorerPatcher,valinet/ExplorerPatcher,C,192,This project aims to bring back a productive working environment on Windows 11,44,954,https://avatars.githubusercontent.com/u/6503598?u=25d850b7dcc57d2a488d83646fff7cca48cf7fc7&v=4
308092559,SysmonForLinux,Sysinternals/SysmonForLinux,C,159,,76,780,https://avatars.githubusercontent.com/u/44955850?v=4
383940088,FNF-PsychEngine,ShadowMario/FNF-PsychEngine,C,23,Engine originally used on Mind Games mod,120,121,https://avatars.githubusercontent.com/u/44785097?u=d1dbdd299c562c87f6328009758bb8d901ee96c7&v=4
