id,name,full_name,language,new stars,description,forks_count,stargazers_count,avatar_url
17620347,aspnetcore,dotnet/aspnetcore,C#,15,"ASP.NET Core is a cross-platform .NET framework for building modern cloud-based web applications on Windows, Mac, or Linux.",8019,28950,https://avatars.githubusercontent.com/u/9141961?v=4
262395224,maui,dotnet/maui,C#,17,".NET MAUI is the .NET Multi-platform App UI, a framework for building native device applications spanning mobile, tablet, and desktop.",953,16250,https://avatars.githubusercontent.com/u/9141961?v=4
29078997,roslyn,dotnet/roslyn,C#,10,The Roslyn .NET compiler provides C# and Visual Basic languages with rich code analysis APIs.,3646,16137,https://avatars.githubusercontent.com/u/9141961?v=4
198071756,RevokeMsgPatcher,huiyadanli/RevokeMsgPatcher,C#,29,:trollface: A hex editor for WeChat/QQ/TIM - PCç‰ˆå¾®ä¿¡/QQ/TIMé˜²æ’¤å›è¡¥ä¸ï¼ˆæˆ‘å·²ç»çœ‹åˆ°äº†ï¼Œæ’¤å›ä¹Ÿæ²¡ç”¨äº†ï¼‰,2225,15997,https://avatars.githubusercontent.com/u/15783049?u=86f380636f7c09b86788a977ea96272cb7484a30&v=4
102904613,ml-agents,Unity-Technologies/ml-agents,C#,9,The Unity Machine Learning Agents Toolkit (ML-Agents) is an open-source project that enables games and simulations to serve as environments for training intelligent agents using deep reinforcement learning and imitation learning.,3483,13116,https://avatars.githubusercontent.com/u/426196?v=4
16157746,efcore,dotnet/efcore,C#,12,"EF Core is a modern object-database mapper for .NET. It supports LINQ queries, change tracking, updates, and schema migrations.",2799,11475,https://avatars.githubusercontent.com/u/9141961?v=4
28239455,AspNetCore.Docs,dotnet/AspNetCore.Docs,C#,6,Documentation for ASP.NET Core,24504,10682,https://avatars.githubusercontent.com/u/9141961?v=4
132453438,uno,unoplatform/uno,C#,5,"Build Mobile, Desktop and WebAssembly apps with C# and XAML. Today. Open source and professionally supported.",536,6634,https://avatars.githubusercontent.com/u/52228309?v=4
23315232,LiteDB,mbdavid/LiteDB,C#,6,LiteDB - A .NET NoSQL Document Store in a single data file - https://www.litedb.org,1006,6599,https://avatars.githubusercontent.com/u/1137197?u=8149e692570b9bfdd4a79b62ea4cdec7fa3139a0&v=4
11591313,refit,reactiveui/refit,C#,13,"The automatic type-safe REST library for .NET Core, Xamarin and .NET. Heavily inspired by Square's Retrofit library, Refit turns your REST API into a live interface.",636,6210,https://avatars.githubusercontent.com/u/2327577?v=4
366663429,jynew,jynew/jynew,C#,25,é‡‘åº¸ç¾¤ä¾ ä¼ 3Dé‡åˆ¶ç‰ˆ,1111,5104,https://avatars.githubusercontent.com/u/82129705?v=4
142480903,microsoft-ui-xaml,microsoft/microsoft-ui-xaml,C#,4,Windows UI Library: the latest Windows 10 native controls and Fluent styles for your applications,560,4898,https://avatars.githubusercontent.com/u/6154722?v=4
26732453,language-ext,louthy/language-ext,C#,13,C# functional language extensions - a base class library for functional programming,351,4679,https://avatars.githubusercontent.com/u/1991827?u=9ddd1b76138c52afa311b1513e58a85842fa9c43&v=4
2928944,azure-sdk-for-net,Azure/azure-sdk-for-net,C#,2,This repository is for active development of the Azure SDK for .NET. For consumers of the SDK we recommend visiting our public developer docs at https://docs.microsoft.com/dotnet/azure/ or our versioned developer docs at https://azure.github.io/azure-sdk-for-net. ,3559,3839,https://avatars.githubusercontent.com/u/6844498?v=4
187499284,UniTask,Cysharp/UniTask,C#,12,Provides an efficient allocation free async/await integration for Unity.,368,3527,https://avatars.githubusercontent.com/u/44487420?v=4
219113096,Ladon,k8gege/Ladon,C#,2,"å¤§å‹å†…ç½‘æ¸—é€æ‰«æå™¨&Cobalt Strikeï¼ŒLadon9.1.4å†…ç½®150ä¸ªæ¨¡å—ï¼ŒåŒ…å«ä¿¡æ¯æ”¶é›†/å­˜æ´»ä¸»æœº/ç«¯å£æ‰«æ/æœåŠ¡è¯†åˆ«/å¯†ç çˆ†ç ´/æ¼æ´æ£€æµ‹/æ¼æ´åˆ©ç”¨ã€‚æ¼æ´æ£€æµ‹å«MS17010/SMBGhost/Weblogic/ActiveMQ/Tomcat/Struts2ï¼Œå¯†ç å£ä»¤çˆ†ç ´(Mysql/Oracle/MSSQL)/FTP/SSH(Linux)/VNC/Windows(IPC/WMI/SMB/Netbios/LDAP/SmbHash/WmiHash/Winrm),è¿œç¨‹æ‰§è¡Œå‘½ä»¤(smbexec/wmiexe/psexec/atexec/sshexec/webshell),é™æƒææƒRunasã€GetSystemï¼ŒPoc/Exploit,æ”¯æŒCobalt Strike 3.X-4.0",756,3315,https://avatars.githubusercontent.com/u/42312878?u=bd2f481fee4372ac29e768b17f4d39635d5eb999&v=4
119571446,samples,dotnet/samples,C#,2,Sample code referenced by the .NET documentation,4114,2271,https://avatars.githubusercontent.com/u/9141961?v=4
68534745,FFXIVQuickLauncher,goatcorp/FFXIVQuickLauncher,C#,2,Custom launcher for FFXIV,227,1785,https://avatars.githubusercontent.com/u/64093182?v=4
56403253,dafny,dafny-lang/dafny,C#,4,Dafny is a verification-aware programming language,207,1743,https://avatars.githubusercontent.com/u/52358127?v=4
252826419,Graphics,Unity-Technologies/Graphics,C#,1,Unity Graphics - Including Scriptable Render Pipeline,589,1734,https://avatars.githubusercontent.com/u/426196?v=4
430330681,p2p,miroslavpejic85/p2p,C#,6,"ğŸ–¥ï¸ P2P Remote Desktop - Portable, No Configuration or Installation Needed.",134,1264,https://avatars.githubusercontent.com/u/70838434?u=e77430c8a5712be79189a9dbfeac4789247d4383&v=4
485145295,KrbRelayUp,Dec0ne/KrbRelayUp,C#,3,KrbRelayUp - a universal no-fix local privilege escalation in windows domain environments where LDAP signing is not enforced (the default settings).,141,1022,https://avatars.githubusercontent.com/u/54464773?v=4
498824328,sbom-tool,microsoft/sbom-tool,C#,71,The SBOM tool is a highly scalable and enterprise ready tool to create SPDX 2.2 compatible SBOMs for any variety of artifacts.,12,280,https://avatars.githubusercontent.com/u/6154722?v=4
101895131,dd-trace-dotnet,DataDog/dd-trace-dotnet,C#,0,.NET Tracer for Datadog APM,92,211,https://avatars.githubusercontent.com/u/365230?v=4
512543715,Chisel-Strike,m3rcer/Chisel-Strike,C#,16,A .NET XOR encrypted cobalt strike aggressor implementation for chisel to utilize faster proxy and advanced socks5 capabilities.,26,230,https://avatars.githubusercontent.com/u/81712403?u=b0458a3a7a7fa7f371ce4c0454b64d79895b4af5&v=4
