id,name,full_name,language,new stars,description,forks_count,stargazers_count,avatar_url
1863329,laravel,laravel/laravel,PHP,116,A PHP framework for web artisans.,21671,67026,https://avatars.githubusercontent.com/u/958072?v=4
3482588,SecLists,danielmiessler/SecLists,PHP,168,"SecLists is the security tester's companion. It's a collection of multiple types of lists used during security assessments, collected in one place. List types include usernames, passwords, URLs, sensitive data patterns, fuzzing payloads, web shells, and many more.",17751,34138,https://avatars.githubusercontent.com/u/50654?u=136860fa06a1fd6c80912231b565f018a64f2b97&v=4
458058,symfony,symfony/symfony,PHP,43,The Symfony PHP framework,8356,25887,https://avatars.githubusercontent.com/u/143937?v=4
1864363,composer,composer/composer,PHP,46,Dependency Manager for PHP,6174,25704,https://avatars.githubusercontent.com/u/837015?v=4
7548986,framework,laravel/framework,PHP,77,The Laravel Framework.,8566,25106,https://avatars.githubusercontent.com/u/958072?v=4
448045,phpunit,sebastianbergmann/phpunit,PHP,35,The PHP Unit Testing framework.,2046,17943,https://avatars.githubusercontent.com/u/25218?u=01bb70d9be43ded7572eb3862127ff281daa2725&v=4
60243197,server,nextcloud/server,PHP,57,"☁️ Nextcloud server, a safe home for all your data",2799,17155,https://avatars.githubusercontent.com/u/19211038?v=4
2884111,magento2,magento/magento2,PHP,15,"All Submissions you make to Magento Inc. (""Magento"") through GitHub are subject to the following terms and conditions: (1) You grant Magento a perpetual, worldwide, non-exclusive, no charge, royalty free, irrevocable license under your applicable copyrights and patents to reproduce, prepare derivative works of, display, publically perform, sublicense and distribute any feedback, ideas, code, or other information (“Submission"") you submit through GitHub. (2) Your Submission is an original work of authorship and you are the owner or are legally entitled to grant the license stated above. (3) You agree to the Contributor License Agreement found here:  https://github.com/magento/magento2/blob/master/CONTRIBUTOR_LICENSE_AGREEMENT.html",8645,9703,https://avatars.githubusercontent.com/u/168457?v=4
79111500,clean-code-php,jupeter/clean-code-php,PHP,68,:bathtub: Clean Code concepts adapted for PHP,2378,9676,https://avatars.githubusercontent.com/u/674766?u=a32a6a1bb09ab8567781e43ff24ef26ec82e3aeb&v=4
597887,orm,doctrine/orm,PHP,25,Doctrine Object Relational Mapper (ORM),2339,8830,https://avatars.githubusercontent.com/u/209254?v=4
2179920,woocommerce,woocommerce/woocommerce,PHP,16,An open source eCommerce plugin for WordPress.,9699,7345,https://avatars.githubusercontent.com/u/473596?v=4
41589337,BookStack,BookStackApp/BookStack,PHP,89,A platform to create documentation/wiki content built with PHP & Laravel,1101,7329,https://avatars.githubusercontent.com/u/20912696?v=4
7577142,annotations,doctrine/annotations,PHP,22,Annotations Docblock Parser,220,6232,https://avatars.githubusercontent.com/u/209254?v=4
6763587,PrestaShop,PrestaShop/PrestaShop,PHP,11,"PrestaShop is an Open Source e-commerce platform, committed to providing the best shopping cart experience for both merchants and customers.",4222,6109,https://avatars.githubusercontent.com/u/2815696?v=4
14346979,snipe-it,snipe/snipe-it,PHP,43,A free open source IT asset/license management system,1958,5423,https://avatars.githubusercontent.com/u/197404?u=3a3faa7eb52d0ccb5d757cab2633677328bbffb2&v=4
576099,migrations,doctrine/migrations,PHP,18,Doctrine Database Migrations Library,360,4146,https://avatars.githubusercontent.com/u/209254?v=4
60010673,elementor,elementor/elementor,PHP,10,"The most advanced frontend drag & drop page builder. Create high-end, pixel perfect websites at record speeds. Any theme, any page, any design.",1010,4069,https://avatars.githubusercontent.com/u/47606894?v=4
4224042,roundcubemail,roundcube/roundcubemail,PHP,16,The Roundcube Webmail suite,1426,4053,https://avatars.githubusercontent.com/u/1432918?v=4
439861,moodle,moodle/moodle,PHP,16,Moodle - the world's open source learning platform,5213,3857,https://avatars.githubusercontent.com/u/168672?v=4
351298555,wave,thedevdojo/wave,PHP,23,"Wave - The Software as a Service Starter Kit, designed to help you build the SAAS of your dreams 🚀 💰 ",290,3193,https://avatars.githubusercontent.com/u/3056664?v=4
69691727,PocketMine-MP,pmmp/PocketMine-MP,PHP,14,A server software for Minecraft: Bedrock Edition in PHP,1467,2530,https://avatars.githubusercontent.com/u/22548559?v=4
17253775,zabbix,zabbix/zabbix,PHP,23,"Real-time monitoring of IT components and services, such as networks, servers, VMs, applications and the cloud.",575,1826,https://avatars.githubusercontent.com/u/4561226?v=4
131995661,platform,shopware/platform,PHP,7,Shopware 6 is an open source eCommerce platform realised by the ideas and the spirit of its community.,592,1515,https://avatars.githubusercontent.com/u/612628?v=4
57463067,AzuraCast,AzuraCast/AzuraCast,PHP,21,"A self-hosted web radio management suite, including turnkey installer tools for the full radio software stack and a modern, easy-to-use web app to manage your stations.",399,1512,https://avatars.githubusercontent.com/u/28115974?v=4
15836700,phoronix-test-suite,phoronix-test-suite/phoronix-test-suite,PHP,13,"The Phoronix Test Suite open-source, cross-platform automated testing/benchmarking software.",263,1476,https://avatars.githubusercontent.com/u/6300594?v=4
