id,name,full_name,language,new stars,description,forks_count,stargazers_count,avatar_url
184456251,PowerToys,microsoft/PowerToys,C#,1647,Windows system utilities to maximize productivity,4361,76743,https://avatars.githubusercontent.com/u/6154722?v=4
49609581,PowerShell,PowerShell/PowerShell,C#,559,PowerShell for every system!,5801,34838,https://avatars.githubusercontent.com/u/11524380?v=4
17620347,aspnetcore,dotnet/aspnetcore,C#,366,"ASP.NET Core is a cross-platform .NET framework for building modern cloud-based web applications on Windows, Mac, or Linux.",8181,29329,https://avatars.githubusercontent.com/u/9141961?v=4
262395224,maui,dotnet/maui,C#,374,".NET MAUI is the .NET Multi-platform App UI, a framework for building native device applications spanning mobile, tablet, and desktop.",1017,16692,https://avatars.githubusercontent.com/u/9141961?v=4
29078997,roslyn,dotnet/roslyn,C#,158,The Roslyn .NET compiler provides C# and Visual Basic languages with rich code analysis APIs.,3679,16312,https://avatars.githubusercontent.com/u/9141961?v=4
14964475,Avalonia,AvaloniaUI/Avalonia,C#,651,A cross-platform UI framework for .NET,1321,15012,https://avatars.githubusercontent.com/u/14075148?v=4
120231691,Ryujinx,Ryujinx/Ryujinx,C#,367,Experimental Nintendo Switch Emulator written in C#,1546,12670,https://avatars.githubusercontent.com/u/39036280?v=4
411493648,DevToys,veler/DevToys,C#,501,A Swiss Army knife for developers.,586,11116,https://avatars.githubusercontent.com/u/3747805?u=044bffcd8836f3a15f9f26378a9d7c85c5cffcfe&v=4
22456440,osu,ppy/osu,C#,291,rhythm is just a *click* away!,1702,10531,https://avatars.githubusercontent.com/u/995763?v=4
46755185,server,bitwarden/server,C#,222,"The core infrastructure backend (API, database, Docker, etc).",887,10320,https://avatars.githubusercontent.com/u/15990069?v=4
210716005,runtime,dotnet/runtime,C#,309,".NET is a cross-platform runtime for cloud, mobile, desktop, and IoT apps.",3337,9844,https://avatars.githubusercontent.com/u/9141961?v=4
321682465,SteamTools,BeyondDimension/SteamTools,C#,724,🛠「Watt Toolkit」是一个开源跨平台的多功能 Steam 工具箱。,616,9702,https://avatars.githubusercontent.com/u/79355691?v=4
75505125,abp,abpframework/abp,C#,172,Open Source Web Application Framework for ASP.NET Core,2672,8504,https://avatars.githubusercontent.com/u/42068324?v=4
132453438,uno,unoplatform/uno,C#,273,"Build Mobile, Desktop and WebAssembly apps with C# and XAML. Today. Open source and professionally supported.",553,6924,https://avatars.githubusercontent.com/u/52228309?v=4
288428676,MudBlazor,MudBlazor/MudBlazor,C#,204,"Blazor Component Library based on Material design. The goal is to do more with Blazor, utilizing CSS and keeping Javascript to a bare minimum.",671,3768,https://avatars.githubusercontent.com/u/79755064?v=4
326826023,QuestPDF,QuestPDF/QuestPDF,C#,430,"QuestPDF is an open-source, modern and battle-tested library that can help you with generating PDF documents by offering friendly, discoverable and predictable C# fluent API.",185,3363,https://avatars.githubusercontent.com/u/73763469?v=4
184286875,runner,actions/runner,C#,113,The Runner for GitHub Actions :rocket:,675,3071,https://avatars.githubusercontent.com/u/44036562?v=4
387542412,ThisIsWin11,builtbybel/ThisIsWin11,C#,184,The real PowerToys for Windows 11,226,2979,https://avatars.githubusercontent.com/u/48735732?v=4
389218073,wpfui,lepoco/wpfui,C#,275,"A simple way to make your application written in WPF keep up with modern design trends. Library changes the base elements like Page, ToggleButton or List, and also includes additional controls like Navigation, NumberBox, Dialog or Snackbar.",174,2752,https://avatars.githubusercontent.com/u/87412094?v=4
170988906,testcontainers-dotnet,testcontainers/testcontainers-dotnet,C#,691,🐋 A library to support tests with throwaway instances of Docker containers for all compatible .NET Standard versions.,105,1874,https://avatars.githubusercontent.com/u/13393021?v=4
255952484,maui-samples,dotnet/maui-samples,C#,207,Samples for .NET Multi-Platform App UI (.NET MAUI),307,1406,https://avatars.githubusercontent.com/u/9141961?v=4
262661480,warp-plus-cloudflare,ALIILAPRO/warp-plus-cloudflare,C#,174,Script for getting unlimited GB on Warp+ ( https://1.1.1.1/ ),483,1368,https://avatars.githubusercontent.com/u/27723504?u=ddfc79a712086278d16ebba38bffbd1ef8e185ab&v=4
419415576,dotnet,CommunityToolkit/dotnet,C#,345,".NET Community Toolkit is a collection of helpers and APIs that work for all .NET developers and are agnostic of any specific UI platform. The toolkit is maintained and published by Microsoft, and part of the .NET Foundation.",85,1298,https://avatars.githubusercontent.com/u/41346473?v=4
258225166,OpenBullet2,openbullet/OpenBullet2,C#,88,OpenBullet reinvented,271,752,https://avatars.githubusercontent.com/u/48930622?u=253ccf41d3ca550e90745cbf84051115fc512cd5&v=4
491611289,GI-Assets,zeroruka/GI-Assets,C#,225,"Character textures, models and mods for a certain anime game. ",433,695,https://avatars.githubusercontent.com/u/89210318?u=4c1ea716fabfa2bc88f7a92098443a810ff8f5e3&v=4
