id,name,full_name,language,new stars,description,forks_count,stargazers_count,avatar_url
9384267,electron,electron/electron,C++,836,":electron: Build cross-platform desktop apps with JavaScript, HTML, and CSS",13813,103418,https://avatars.githubusercontent.com/u/13409222?v=4
23357588,protobuf,protocolbuffers/protobuf,C++,493,Protocol Buffers - Google's data interchange format,14385,56007,https://avatars.githubusercontent.com/u/26310541?v=4
15634981,godot,godotengine/godot,C++,1401,Godot Engine – Multi-platform 2D and 3D game engine,9198,52640,https://avatars.githubusercontent.com/u/6318500?v=4
22067521,imgui,ocornut/imgui,C++,867,Dear ImGui: Bloat-free Graphical User interface for C++ with minimal dependencies,7192,40855,https://avatars.githubusercontent.com/u/8225057?u=de42cf0fa1f1970187db446beea30c61b9c1e6d3&v=4
311683390,ImHex,WerWolv/ImHex,C++,5441,"🔍 A Hex Editor for Reverse Engineers, Programmers and people who value their retinas when working at 3 AM.",924,20746,https://avatars.githubusercontent.com/u/10835354?u=df34a21c99e8b5470fb39a106d328372e7abc115&v=4
125098880,Proton,ValveSoftware/Proton,C++,507,Compatibility tool for Steam Play based on Wine and additional components,784,18126,https://avatars.githubusercontent.com/u/3082775?v=4
40892817,solidity,ethereum/solidity,C++,438,"Solidity, the Smart Contract Programming Language",4282,18036,https://avatars.githubusercontent.com/u/6250754?v=4
65750241,expo,expo/expo,C++,312,"An open-source platform for making universal native apps with React. Expo runs on Android, iOS, and the web.",3480,17279,https://avatars.githubusercontent.com/u/12504344?v=4
18503721,yoga,facebook/yoga,C++,149,Yoga is a cross-platform layout engine which implements Flexbox. Follow https://twitter.com/yogalayout for updates.,1325,15491,https://avatars.githubusercontent.com/u/69631?v=4
7056202,fmt,fmtlib/fmt,C++,442,A modern formatting library,1825,15059,https://avatars.githubusercontent.com/u/7280830?v=4
2200856,Marlin,MarlinFirmware/Marlin,C++,220,Marlin is an optimized firmware for RepRap 3D printers based on the Arduino platform. | Many commercial 3D printers come with Marlin installed. Check with your vendor if you need source code for your specific machine.,17112,13691,https://avatars.githubusercontent.com/u/10418365?v=4
114187903,foundationdb,apple/foundationdb,C++,163,"FoundationDB - the open source, distributed, transactional key-value store",1145,11652,https://avatars.githubusercontent.com/u/10639145?v=4
437245741,dragonfly,dragonflydb/dragonfly,C++,2272,A modern replacement for Redis and Memcached,258,11338,https://avatars.githubusercontent.com/u/104819355?v=4
2168780,minetest,minetest/minetest,C++,621,Minetest is an open source voxel game engine with easy modding and game creation,1612,7940,https://avatars.githubusercontent.com/u/2624745?v=4
20976138,Stockfish,official-stockfish/Stockfish,C++,187,UCI chess engine,1611,6616,https://avatars.githubusercontent.com/u/7926882?v=4
138754790,duckdb,duckdb/duckdb,C++,460,DuckDB is an in-process SQL OLAP Database Management System,577,6065,https://avatars.githubusercontent.com/u/82039556?v=4
99919302,doris,apache/doris,C++,605,"Apache Doris is an easy-to-use, high performance and unified analytics database.",1677,5535,https://avatars.githubusercontent.com/u/47359?v=4
52882701,PrusaSlicer,prusa3d/PrusaSlicer,C++,150,"G-code generator for 3D printers (RepRap, Makerbot, Ultimaker etc.)",1310,4752,https://avatars.githubusercontent.com/u/14859759?v=4
23496542,triton,openai/triton,C++,124,Development repository for the Triton language and compiler,316,3947,https://avatars.githubusercontent.com/u/14957082?v=4
207245092,duckstation,stenzek/duckstation,C++,157,Fast PlayStation 1 emulator for x86-64/AArch32/AArch64,406,3937,https://avatars.githubusercontent.com/u/11288319?u=40beea037e6f06e444c12d74a387caec34d60086&v=4
58168143,USD,PixarAnimationStudios/USD,C++,92,Universal Scene Description,864,3746,https://avatars.githubusercontent.com/u/1672744?v=4
427306303,Kyty,InoriRus/Kyty,C++,256,PS4 & PS5 emulator,82,1744,https://avatars.githubusercontent.com/u/7149418?v=4
439011383,userver,userver-framework/userver,C++,768,The C++ Asynchronous Framework (beta),87,1341,https://avatars.githubusercontent.com/u/95299656?v=4
493029626,Akebi-GC,Akebi-Group/Akebi-GC,C++,514,The great software for some game that exploiting anime girls (and boys).,322,1335,https://avatars.githubusercontent.com/u/105681966?v=4
325036684,pineapple-src,pineappleEA/pineapple-src,C++,103,yuzu Early Access source code,91,840,https://avatars.githubusercontent.com/u/67879877?u=7376b3a05a54da81e1a1319651192349051020ff&v=4
