id,name,full_name,language,new stars,description,forks_count,stargazers_count,avatar_url
151834062,advanced-java,doocs/advanced-java,Java,706,ğŸ˜® Core Interview Questions & Answers For Experienced Java(Backend) Developers | äº’è”ç½‘ Java å·¥ç¨‹å¸ˆè¿›é˜¶çŸ¥è¯†å®Œå…¨æ‰«ç›²ï¼šæ¶µç›–é«˜å¹¶å‘ã€åˆ†å¸ƒå¼ã€é«˜å¯ç”¨ã€å¾®æœåŠ¡ã€æµ·é‡æ•°æ®å¤„ç†ç­‰é¢†åŸŸçŸ¥è¯†,17395,64887,https://avatars.githubusercontent.com/u/43716716?v=4
6296790,spring-boot,spring-projects/spring-boot,Java,633,Spring Boot,36979,62685,https://avatars.githubusercontent.com/u/317776?v=4
146633589,arthas,alibaba/arthas,Java,582,Alibaba Java Diagnostic Tool Arthas/Alibaba Javaè¯Šæ–­åˆ©å™¨Arthas,6585,30121,https://avatars.githubusercontent.com/u/1961952?v=4
41889031,NewPipe,TeamNewPipe/NewPipe,Java,536,A libre lightweight streaming front-end for Android.,2373,20247,https://avatars.githubusercontent.com/u/22159318?v=4
45721011,skywalking,apache/skywalking,Java,233,"APM, Application Performance Monitoring System",5820,19954,https://avatars.githubusercontent.com/u/47359?v=4
20773773,bazel,bazelbuild/bazel,Java,246,"a fast, scalable, multi-language and extensible build system",3488,19189,https://avatars.githubusercontent.com/u/11684617?v=4
49876476,shardingsphere,apache/shardingsphere,Java,726,"Ecosystem to transform any database into a distributed database system, and enhance it with sharding, elastic scaling, encryption features & more",5883,17009,https://avatars.githubusercontent.com/u/47359?v=4
89822531,Mindustry,Anuken/Mindustry,Java,589,The automation tower defense RTS,2164,15595,https://avatars.githubusercontent.com/u/10100000?u=04db575020c71ba186488d3f24392b6870a8514b&v=4
149001365,leetcode,doocs/leetcode,Java,584,ğŸ˜ LeetCode solutions in any programming language | å¤šç§ç¼–ç¨‹è¯­è¨€å®ç° LeetCodeã€ã€Šå‰‘æŒ‡ Offerï¼ˆç¬¬ 2 ç‰ˆï¼‰ã€‹ã€ã€Šç¨‹åºå‘˜é¢è¯•é‡‘å…¸ï¼ˆç¬¬ 6 ç‰ˆï¼‰ã€‹é¢˜è§£,2950,15298,https://avatars.githubusercontent.com/u/43716716?v=4
11125589,keycloak,keycloak/keycloak,Java,325,Open Source Identity and Access Management For Modern Applications and Services,4681,13145,https://avatars.githubusercontent.com/u/4921466?v=4
45363955,ip2region,lionsoul2014/ip2region,Java,940,"Ip2region (2.0 - xdb) is a offline IP address manager framework and locator, support billions of data segments, ten microsecond searching performance. xdb engine implementation for many programming languages",2131,11638,https://avatars.githubusercontent.com/u/7111577?u=a51b0a2bb86351414783468b460723217636d785&v=4
156317154,onedev,theonedev/onedev,Java,1530,Self-hosted Git Server with CI/CD and Kanban,628,9389,https://avatars.githubusercontent.com/u/44279871?v=4
223881576,mall-swarm,macrozheng/mall-swarm,Java,433,mall-swarmæ˜¯ä¸€å¥—å¾®æœåŠ¡å•†åŸç³»ç»Ÿï¼Œé‡‡ç”¨äº† Spring Cloud 2021 & Alibabaã€Spring Boot 2.7ã€Oauth2ã€MyBatisã€Dockerã€Elasticsearchã€Kubernetesç­‰æ ¸å¿ƒæŠ€æœ¯ï¼ŒåŒæ—¶æä¾›äº†åŸºäºVueçš„ç®¡ç†åå°æ–¹ä¾¿å¿«é€Ÿæ­å»ºç³»ç»Ÿã€‚mall-swarmåœ¨ç”µå•†ä¸šåŠ¡çš„åŸºç¡€é›†æˆäº†æ³¨å†Œä¸­å¿ƒã€é…ç½®ä¸­å¿ƒã€ç›‘æ§ä¸­å¿ƒã€ç½‘å…³ç­‰ç³»ç»ŸåŠŸèƒ½ã€‚æ–‡æ¡£é½å…¨ï¼Œé™„å¸¦å…¨å¥—Spring Cloudæ•™ç¨‹ã€‚,4243,9164,https://avatars.githubusercontent.com/u/15903809?u=c76ae8e89e30a5aeeaf667fbcb749efa73fa28b3&v=4
391055597,DSA-Bootcamp-Java,kunal-kushwaha/DSA-Bootcamp-Java,Java,577,"This repository consists of the code samples, assignments, and notes for the Java Data Structures & Algorithms bootcamp of Community Classroom.",5180,8279,https://avatars.githubusercontent.com/u/42698533?u=0b64f10aa6528ef363a9fe0eb802da40db71cd14&v=4
283046497,airbyte,airbytehq/airbyte,Java,360,"Airbyte is an open-source EL(T) platform that helps you replicate your data in your warehouses, lakes and databases.",1603,7621,https://avatars.githubusercontent.com/u/59758427?v=4
193305104,QtScrcpy,barry-ran/QtScrcpy,Java,310,Android real-time display control software,1304,7356,https://avatars.githubusercontent.com/u/18702692?u=f25ec5f42e12c0a02e518f4d11fe01bc9c3cb1a2&v=4
140543886,shenyu,apache/shenyu,Java,525,"Apache ShenYu is a Java native API Gateway for service proxy, protocol conversion and API governance.",2381,6883,https://avatars.githubusercontent.com/u/47359?v=4
46398090,datahub,datahub-project/datahub,Java,390,The Metadata Platform for the Modern Data Stack,1695,6154,https://avatars.githubusercontent.com/u/78121374?v=4
83799439,lawnchair,LawnchairLauncher/lawnchair,Java,270,No clever tagline needed.,885,5996,https://avatars.githubusercontent.com/u/34144436?v=4
206905065,springcloud-learning,macrozheng/springcloud-learning,Java,341,ä¸€å¥—æ¶µç›–å¤§éƒ¨åˆ†æ ¸å¿ƒç»„ä»¶ä½¿ç”¨çš„Spring Cloudæ•™ç¨‹ï¼ŒåŒ…æ‹¬Spring Cloud AlibabaåŠåˆ†å¸ƒå¼äº‹åŠ¡Seataï¼ŒåŸºäºSpring Cloud GreenwichåŠSpringBoot 2.1.7ã€‚ç¯‡ç¯‡ç²¾åï¼Œæ¶µç›–å¤§éƒ¨åˆ†åº”ç”¨åœºæ™¯ã€‚,2409,5261,https://avatars.githubusercontent.com/u/15903809?u=c76ae8e89e30a5aeeaf667fbcb749efa73fa28b3&v=4
99412308,incubator-seatunnel,apache/incubator-seatunnel,Java,134,"SeaTunnel is a distributed, high-performance data integration platform for the synchronization and transformation of massive data (offline & real-time).",637,3739,https://avatars.githubusercontent.com/u/47359?v=4
165214494,library,ddd-by-examples/library,Java,173,A comprehensive Domain-Driven Design example with problem space strategic analysis and various tactical patterns.,516,3211,https://avatars.githubusercontent.com/u/37220248?v=4
158256479,iceberg,apache/iceberg,Java,158,Apache Iceberg,1197,3144,https://avatars.githubusercontent.com/u/47359?v=4
195184058,mall4j,gz-yami/mall4j,Java,293,â­ï¸â­ï¸â­ï¸ ç”µå•†å•†åŸ javaç”µå•†å•†åŸç³»ç»Ÿ uniappå•†åŸ å¤šç”¨æˆ·å•†åŸ,678,2526,https://avatars.githubusercontent.com/u/52097630?u=802528c1e03e73c67875d69e5b88416723e73b4c&v=4
142085119,Velocity,PaperMC/Velocity,Java,64,"The modern, next-generation Minecraft server proxy.",285,1080,https://avatars.githubusercontent.com/u/7608950?v=4
