id,name,full_name,language,new stars,description,forks_count,stargazers_count,avatar_url
54346799,public-apis,public-apis/public-apis,Python,4549,A collective list of free APIs,23572,205890,https://avatars.githubusercontent.com/u/51121562?v=4
123458551,Python-100-Days,jackfrued/Python-100-Days,Python,2216,Python - 100å¤©ä»æ–°æ‰‹åˆ°å¤§å¸ˆ,46421,122786,https://avatars.githubusercontent.com/u/7474657?u=902200c2389c203cf2139888e10314845edd2a2a&v=4
71220757,PayloadsAllTheThings,swisskyrepo/PayloadsAllTheThings,Python,1121,A list of useful payloads and bypass for Web Application Security and Pentest/CTF,10880,40284,https://avatars.githubusercontent.com/u/12152583?u=e368c891b81d41b1ce12825f52049e5eb146d401&v=4
41058054,CppCoreGuidelines,isocpp/CppCoreGuidelines,Python,618,"The C++ Core Guidelines are a set of tried-and-true guidelines, rules, and best practices about coding in C++",4765,35155,https://avatars.githubusercontent.com/u/13841574?v=4
349321229,GFPGAN,TencentARC/GFPGAN,Python,1623,GFPGAN aims at developing Practical Algorithms for Real-world Face Restoration.,3210,21242,https://avatars.githubusercontent.com/u/83739826?v=4
323048702,OpenBBTerminal,OpenBB-finance/OpenBBTerminal,Python,3189,"Investment Research for Everyone, Anywhere.",1668,16120,https://avatars.githubusercontent.com/u/80064875?v=4
222751131,30-Days-Of-Python,Asabeneh/30-Days-Of-Python,Python,3051,"30 days of Python programming challenge is a step-by-step guide to learn the Python programming language in 30 days. This challenge may take more than100 days, follow your own pace. ",3220,13971,https://avatars.githubusercontent.com/u/9008063?u=ec6ff77196b998a4e6b6e3ca1429c524c169c189&v=4
355959597,textual,Textualize/textual,Python,1004,Textual is a TUI (Text User Interface) framework for Python inspired by modern web development.,342,13014,https://avatars.githubusercontent.com/u/93378883?v=4
16479108,wagtail,wagtail/wagtail,Python,256,A Django content management system focused on flexibility and user experience,2712,12578,https://avatars.githubusercontent.com/u/23708009?v=4
266417772,Summer2023-Internships,pittcsc/Summer2023-Internships,Python,1662,Collection of Summer 2023 tech internships!,1217,12002,https://avatars.githubusercontent.com/u/7276234?v=4
52728517,zhao,programthink/zhao,Python,331,ã€ç¼–ç¨‹éšæƒ³ã€‘æ•´ç†çš„ã€Šå¤ªå­å…šå…³ç³»ç½‘ç»œã€‹ï¼Œä¸“é—¨æ­éœ²èµµå›½çš„æƒè´µ,2576,10663,https://avatars.githubusercontent.com/u/4027957?u=e630bf304844ff741944cfd50ae7420c229f47b1&v=4
112070198,Hitomi-Downloader,KurtBestor/Hitomi-Downloader,Python,846,":cake: Desktop utility to download images/videos/music/text from various websites, and more.",1099,9648,https://avatars.githubusercontent.com/u/14768120?v=4
89266735,ParlAI,facebookresearch/ParlAI,Python,443,A framework for training and evaluating AI models on a variety of openly available dialogue datasets.,1909,9376,https://avatars.githubusercontent.com/u/16943930?v=4
377851948,alphafold,deepmind/alphafold,Python,384,Open source code for AlphaFold.,1509,8959,https://avatars.githubusercontent.com/u/8596759?v=4
21800813,english-words,dwyl/english-words,Python,454,:memo: A text file containing 479k English words for all your dictionary/word-based projects e.g: auto-completion / autosuggestion,1477,7765,https://avatars.githubusercontent.com/u/11708465?v=4
235860204,DeepSpeed,microsoft/DeepSpeed,Python,523,"DeepSpeed is a deep learning optimization library that makes distributed training and inference easy, efficient, and effective.",877,7617,https://avatars.githubusercontent.com/u/6154722?v=4
303802588,MHDDoS,MatrixTM/MHDDoS,Python,1374,"Best DDoS Attack Script  Python3, (Cyber / DDos) Attack With 56 Methods",1304,6148,https://avatars.githubusercontent.com/u/102809114?v=4
131619646,dagster,dagster-io/dagster,Python,248,"An orchestration platform for the development, production, and observation of data assets.",660,5251,https://avatars.githubusercontent.com/u/40032576?v=4
190823163,Osintgram,Datalux/Osintgram,Python,723,Osintgram is a OSINT tool on Instagram. It offers an interactive shell to perform analysis on Instagram account of any users by its nickname,991,4879,https://avatars.githubusercontent.com/u/26717218?u=560d1ce8e49270894d0b31f11d9dd92a8e98e031&v=4
73461676,vyper,vyperlang/vyper,Python,210,Pythonic Smart Contract Language for the EVM,699,4170,https://avatars.githubusercontent.com/u/57152025?v=4
246183538,Practical-Ethical-Hacking-Resources,TCM-Course-Resources/Practical-Ethical-Hacking-Resources,Python,372,Compilation of Resources from TCM's Practical Ethical Hacking Udemy Course ,996,4087,https://avatars.githubusercontent.com/u/74793658?v=4
509153572,discoart,jina-ai/discoart,Python,1475,Create Disco Diffusion artworks in one line,123,2586,https://avatars.githubusercontent.com/u/60539444?v=4
498011141,diffusers,huggingface/diffusers,Python,1150,ğŸ¤— Diffusers: State-of-the-art diffusion models for image and audio generation in PyTorch,93,1741,https://avatars.githubusercontent.com/u/25720743?v=4
370055539,AutoMihoyoBBS,Womsxd/AutoMihoyoBBS,Python,278,ç±³æ¸¸ç¤¾è‡ªåŠ¨ç­¾åˆ°ï¼Œæ”¯æŒï¼šå´©åäºŒã€å´©åä¸‰ã€åŸç¥ã€æœªå®šäº‹ä»¶ç°¿ï¼Œç±³æ¸¸å¸è‡ªåŠ¨è·å–,269,899,https://avatars.githubusercontent.com/u/45663319?u=07fe79adf9f0a0926eac1ae8d88da12b0b360f04&v=4
484291308,FlipperAmiibo,Gioman101/FlipperAmiibo,Python,100,Made to be used with Flipper just drag the folder into NFC,22,301,https://avatars.githubusercontent.com/u/31381542?v=4
