id,name,full_name,language,new stars,description,forks_count,stargazers_count,avatar_url
36502,git,git/git,C,481,Git Source Code Mirror - This is a publish-only repository but pull requests can be turned into patches to the mailing list via GitGitGadget (https://gitgitgadget.github.io/). Please follow Documentation/SubmittingPatches procedure for any of your improvements.,23410,41888,https://avatars.githubusercontent.com/u/18133?v=4
1614410,FFmpeg,FFmpeg/FFmpeg,C,548,Mirror of https://git.ffmpeg.org/ffmpeg.git,9522,29235,https://avatars.githubusercontent.com/u/729418?v=4
102578345,lede,coolsnowwolf/lede,C,554,Lean's OpenWrt source,17088,20906,https://avatars.githubusercontent.com/u/31687149?u=caa956c5f80318ea674625f9e9efa49c98335d74&v=4
20159867,stb,nothings/stb,C,362,stb single-file public domain libraries for C/C++,6492,18644,https://avatars.githubusercontent.com/u/7525026?u=a23ba3a549fff291e35446cb32c8979bd29be6c9&v=4
196353673,TDengine,taosdata/TDengine,C,275,"An open-source time-series database with high-performance, scalability and SQL support. It can be widely used in IoT, Connected Vehicles, DevOps, Energy, Finance and other fields.",4329,18205,https://avatars.githubusercontent.com/u/48876650?v=4
47409672,hashcat,hashcat/hashcat,C,1236,World's fastest and most advanced password recovery utility,2106,13166,https://avatars.githubusercontent.com/u/15949799?v=4
184981,memcached,memcached/memcached,C,186,memcached development tree,3075,11766,https://avatars.githubusercontent.com/u/41836?v=4
45821540,openwrt,openwrt/openwrt,C,383,This repository is a mirror of https://git.openwrt.org/openwrt/openwrt.git It is for reference only and is not active for check-ins.  We will continue to accept Pull Requests here. They will be merged via staging trees then into openwrt.git.,7245,11330,https://avatars.githubusercontent.com/u/2528830?v=4
70127218,arduino-esp32,espressif/arduino-esp32,C,198,Arduino core for the ESP32,5429,8479,https://avatars.githubusercontent.com/u/9460735?v=4
7408108,rt-thread,RT-Thread/rt-thread,C,171,RT-Thread is an open source IoT operating system.,3847,6951,https://avatars.githubusercontent.com/u/1783729?v=4
277194804,NoiseTorch,lawl/NoiseTorch,C,309,Real-time microphone noise suppression on Linux.,120,6152,https://avatars.githubusercontent.com/u/680451?v=4
5870069,librdkafka,edenhill/librdkafka,C,93,The Apache Kafka C/C++ library,2676,5931,https://avatars.githubusercontent.com/u/524990?v=4
37060852,betaflight,betaflight/betaflight,C,100,Open Source Flight Controller Firmware,2267,5658,https://avatars.githubusercontent.com/u/19597933?v=4
40504480,xv6-public,mit-pdos/xv6-public,C,107,xv6 OS,3063,5440,https://avatars.githubusercontent.com/u/12404246?v=4
431433455,qoi,phoboslab/qoi,C,863,"The “Quite OK Image Format” for fast, lossless image compression",247,5278,https://avatars.githubusercontent.com/u/443987?v=4
200321698,chibicc,rui314/chibicc,C,1207,A small C compiler,444,4868,https://avatars.githubusercontent.com/u/47400?v=4
394318710,ExplorerPatcher,valinet/ExplorerPatcher,C,844,This project aims to enhance the working environment on Windows,305,5123,https://avatars.githubusercontent.com/u/6503598?u=25d850b7dcc57d2a488d83646fff7cca48cf7fc7&v=4
108110706,redis,tporadowski/redis,C,244,"Native port of Redis for Windows. Redis is an in-memory database that persists on disk. The data model is key-value, but many different kind of values are supported: Strings, Lists, Sets, Sorted Sets, Hashes, Streams, HyperLogLogs. This repository contains unofficial port of Redis to Windows.",751,4954,https://avatars.githubusercontent.com/u/6212622?u=27e7a140d39b98e8ee04e3123740139dab9f199c&v=4
23007417,colmap,colmap/colmap,C,132,COLMAP - Structure-from-Motion and Multi-View Stereo,998,3890,https://avatars.githubusercontent.com/u/8461936?v=4
7705639,rtl_433,merbanan/rtl_433,C,122,Program to decode radio transmissions from devices on the ISM bands (and other frequencies),987,3749,https://avatars.githubusercontent.com/u/124883?u=ef929342b768484f9109ca1270a1de69b07ff19e&v=4
2359378,zlib,madler/zlib,C,111,A massively spiffy yet delicately unobtrusive compression library.,1828,3498,https://avatars.githubusercontent.com/u/240717?v=4
469303019,ecapture,ehids/ecapture,C,1830,capture SSL/TLS text content without CA cert using eBPF.,328,3015,https://avatars.githubusercontent.com/u/95527736?v=4
27359183,GmSSL,guanzhi/GmSSL,C,104,支持国密SM2/SM3/SM4/SM9/SSL的密码工具箱,1181,3004,https://avatars.githubusercontent.com/u/1787781?u=c71c577b7da3afe39a461344fdca316d82f91735&v=4
204459250,xv6-riscv,mit-pdos/xv6-riscv,C,149,Xv6 for RISC-V,776,2406,https://avatars.githubusercontent.com/u/12404246?v=4
226167620,InfiniTime,InfiniTimeOrg/InfiniTime,C,111,Firmware for Pinetime smartwatch written in C/C++ and based on FreeRTOS,530,1519,https://avatars.githubusercontent.com/u/91782433?v=4
