id,name,full_name,language,new stars,description,forks_count,stargazers_count,avatar_url
2325298,linux,torvalds/linux,C,610,Linux kernel source tree,46874,146997,https://avatars.githubusercontent.com/u/1024025?v=4
102578345,lede,coolsnowwolf/lede,C,108,Lean's LEDE source,18709,25027,https://avatars.githubusercontent.com/u/31687149?u=caa956c5f80318ea674625f9e9efa49c98335d74&v=4
80286288,Tasmota,arendst/Tasmota,C,46,"Alternative firmware for ESP8266 and ESP32 based devices with easy configuration using webUI, OTA updates, automation using timers or rules, expandability and entirely local control over MQTT, HTTP, Serial or KNX. Full documentation at",4311,19283,https://avatars.githubusercontent.com/u/11044339?u=b54c71859c551426b6738921138b740804ca1d62&v=4
34921116,bcc,iovisor/bcc,C,76,"BCC - Tools for BPF-based Linux IO analysis, networking, monitoring, and more",3299,16675,https://avatars.githubusercontent.com/u/12766186?v=4
214011414,WindTerm,kingToolbox/WindTerm,C,321,A professional cross-platform SSH/Sftp/Shell/Telnet/Serial terminal.,982,12850,https://avatars.githubusercontent.com/u/51009775?v=4
28515839,kcp,skywind3000/kcp,C,135,:zap: KCP - A Fast and Reliable ARQ Protocol,2328,12691,https://avatars.githubusercontent.com/u/3035071?u=082cfef5e6dbd57bf6ee4c481e163d103014a1f3&v=4
927442,postgres,postgres/postgres,C,54,"Mirror of the official PostgreSQL GIT repository. Note that this is just a *mirror* - we don't work with pull requests on github. To contribute, please see https://wiki.postgresql.org/wiki/Submitting_a_Patch",3730,11876,https://avatars.githubusercontent.com/u/177543?v=4
179354282,OpenCorePkg,acidanthera/OpenCorePkg,C,57,OpenCore bootloader,1942,11005,https://avatars.githubusercontent.com/u/39672954?v=4
1856976,libevent,libevent/libevent,C,32,Event notification library,3184,9576,https://avatars.githubusercontent.com/u/833750?v=4
7408108,rt-thread,RT-Thread/rt-thread,C,38,RT-Thread is an open source IoT operating system.,4296,8020,https://avatars.githubusercontent.com/u/1783729?v=4
14049216,cockpit,cockpit-project/cockpit,C,36,Cockpit is a web-based graphical interface for servers.,940,7999,https://avatars.githubusercontent.com/u/5765104?v=4
59771425,zephyr,zephyrproject-rtos/zephyr,C,36,"Primary Git Repository for the Zephyr Project. Zephyr is a new generation, scalable, optimized, secure RTOS for multiple hardware architectures.",4596,7337,https://avatars.githubusercontent.com/u/19595895?v=4
108110706,redis,tporadowski/redis,C,52,"Native port of Redis for Windows. Redis is an in-memory database that persists on disk. The data model is key-value, but many different kind of values are supported: Strings, Lists, Sets, Sorted Sets, Hashes, Streams, HyperLogLogs. This repository contains unofficial port of Redis to Windows.",929,6615,https://avatars.githubusercontent.com/u/6212622?u=27e7a140d39b98e8ee04e3123740139dab9f199c&v=4
469303019,ecapture,gojue/ecapture,C,300,capture SSL/TLS text content without CA cert using eBPF. supports Linux/Android  x86_64/Aarch64.,627,6008,https://avatars.githubusercontent.com/u/113109442?v=4
130578889,smartdns,pymumu/smartdns,C,67,"A local DNS server to obtain the fastest website IP for the best Internet experience, support DoT, DoH. 一个本地DNS服务器，获取最快的网站IP，获得最佳上网体验，支持DoH，DoT。",916,5937,https://avatars.githubusercontent.com/u/3275997?u=6eafad1c66232f210a74f5dda345195d16be8f07&v=4
21329550,wireshark,wireshark/wireshark,C,35,Read-only mirror of Wireshark's Git repository at https://gitlab.com/wireshark/wireshark. GitHub won't let us disable pull requests. ☞ THEY WILL BE IGNORED HERE ☜ Please upload them at GitLab.,1613,5257,https://avatars.githubusercontent.com/u/6233056?v=4
58132544,RediSearch,RediSearch/RediSearch,C,30,"A query and indexing engine for Redis, providing secondary indexing, full-text search, and aggregations. ",436,4148,https://avatars.githubusercontent.com/u/46899501?v=4
204459250,xv6-riscv,mit-pdos/xv6-riscv,C,53,Xv6 for RISC-V,1338,3633,https://avatars.githubusercontent.com/u/12404246?v=4
184654298,wasm-micro-runtime,bytecodealliance/wasm-micro-runtime,C,35,WebAssembly Micro Runtime (WAMR),447,3541,https://avatars.githubusercontent.com/u/54038801?v=4
82754556,TFT_eSPI,Bodmer/TFT_eSPI,C,26,"Arduino and PlatformIO IDE compatible TFT library optimised for the Raspberry Pi Pico (RP2040), STM32, ESP8266 and ESP32 that supports different driver chips",807,2460,https://avatars.githubusercontent.com/u/15824805?u=b1e96717565629413242cedba5b5ecd3fc546f3b&v=4
200663555,liburing,axboe/liburing,C,30,,284,1937,https://avatars.githubusercontent.com/u/2619634?v=4
207354223,FreeRTOS-Kernel,FreeRTOS/FreeRTOS-Kernel,C,25,"FreeRTOS kernel files only, submoduled into https://github.com/FreeRTOS/FreeRTOS and various other repos.",732,1515,https://avatars.githubusercontent.com/u/54647343?v=4
254994387,dwl,djpohly/dwl,C,31,dwm for Wayland,199,1450,https://avatars.githubusercontent.com/u/521294?v=4
48721582,misc,wuzhouhui/misc,C,29,学习与工作中收集的一些资料,460,1179,https://avatars.githubusercontent.com/u/9639726?u=1c6cd7f699542f51cd44ac781269d584e2acb5d3&v=4
342120988,arduino-pico,earlephilhower/arduino-pico,C,22,"Raspberry Pi Pico Arduino core, for all RP2040 boards",234,1058,https://avatars.githubusercontent.com/u/11875?u=fefb7f1675bab97530a8c6a77f07dde76662cd80&v=4
