id,name,full_name,language,new stars,description,forks_count,stargazers_count,avatar_url
24195339,angular,angular/angular,TypeScript,2264,Deliver web apps with confidence 🚀,24886,92801,https://avatars.githubusercontent.com/u/139426?v=4
157616880,iptv,iptv-org/iptv,JavaScript,2744,Collection of publicly available IPTV channels from all over the world,1172,72316,https://avatars.githubusercontent.com/u/55937028?v=4
343965132,ML-For-Beginners,microsoft/ML-For-Beginners,HTML,7988,"12 weeks, 26 lessons, 52 quizzes, classic Machine Learning for all",12504,62045,https://avatars.githubusercontent.com/u/6154722?v=4
612344730,ChatGPT-Next-Web,Yidadaa/ChatGPT-Next-Web,TypeScript,4990,A well-designed cross-platform ChatGPT UI (Web / PWA / Linux / Win / MacOS). 一键拥有你自己的跨平台 ChatGPT 应用。,46826,52659,https://avatars.githubusercontent.com/u/16968934?u=c98e4b11a628e0d18b7774d62dd5c5da9b9dedd3&v=4
537603333,whisper,openai/whisper,Python,4731,Robust Speech Recognition via Large-Scale Weak Supervision,5924,51904,https://avatars.githubusercontent.com/u/14957082?v=4
377496562,AppFlowy,AppFlowy-IO/AppFlowy,Dart,2852,AppFlowy is an open-source alternative to Notion. You are in charge of your data and customizations. Built with Flutter and Rust.,2757,42690,https://avatars.githubusercontent.com/u/86002201?v=4
365739812,tldraw,tldraw/tldraw,TypeScript,6543,a very good whiteboard,1571,28056,https://avatars.githubusercontent.com/u/86724562?v=4
344190478,AI-For-Beginners,microsoft/AI-For-Beginners,Jupyter Notebook,6421,"12 Weeks, 24 Lessons, AI for All!",4042,24494,https://avatars.githubusercontent.com/u/6154722?v=4
676676006,Fooocus,lllyasviel/Fooocus,Python,8326,Focus on prompting and generating,2161,23350,https://avatars.githubusercontent.com/u/19834515?u=4c7144779a6b13904fec478c4e98e676b91516ee&v=4
305144746,tinygrad,tinygrad/tinygrad,Python,1364,You like pytorch? You like micrograd? You love tinygrad! ❤️ ,2724,21110,https://avatars.githubusercontent.com/u/132956020?v=4
655806940,generative-ai-for-beginners,microsoft/generative-ai-for-beginners,Jupyter Notebook,16563,"12 Lessons, Get Started Building with Generative AI  🔗 https://microsoft.github.io/generative-ai-for-beginners/",9960,18988,https://avatars.githubusercontent.com/u/6154722?v=4
589831718,ComfyUI,comfyanonymous/ComfyUI,Python,3489,The most powerful and modular stable diffusion GUI with a graph/nodes interface.,1885,18213,https://avatars.githubusercontent.com/u/121283862?u=f3e53b07cfbae7136f1796d4f6453827a12c2307&v=4
307213173,openai-python,openai/openai-python,Python,3237,The official Python library for the OpenAI API,2218,16523,https://avatars.githubusercontent.com/u/14957082?v=4
656933936,generative-models,Stability-AI/generative-models,Python,6731,Generative Models by Stability AI,1960,16437,https://avatars.githubusercontent.com/u/100950301?v=4
626805178,dify,langgenius/dify,TypeScript,2775,"An Open-Source Assistants API and GPTs alternative. Dify.AI is an LLM application development platform. It integrates the concepts of Backend as a Service and LLMOps, covering the core tech stack required for building generative AI-native applications, including a built-in RAG engine.",1583,11708,https://avatars.githubusercontent.com/u/127165244?v=4
673524886,seamless_communication,facebookresearch/seamless_communication,C,1865,Foundational Models for State-of-the-Art Speech and Text Translation,725,7791,https://avatars.githubusercontent.com/u/16943930?v=4
638629097,aider,paul-gauthier/aider,Python,922,aider is AI pair programming in your terminal,693,5334,https://avatars.githubusercontent.com/u/69695708?u=1b1a608998950cb407854549123a52c964a202ec&v=4
539888500,DeepLearningSystem,chenzomi12/DeepLearningSystem,Jupyter Notebook,1698,Deep Learning System core principles introduction.,699,4952,https://avatars.githubusercontent.com/u/6355024?u=5cba82fbf18034407e8d40f6c36a8a0e6fa8804f&v=4
713967573,Yi,01-ai/Yi,Python,4742,A series of large language models trained from scratch by developers @01-ai,258,4799,https://avatars.githubusercontent.com/u/139308978?v=4
643445235,lobe-chat,lobehub/lobe-chat,TypeScript,2515,"🤖 Lobe Chat - an open-source, high-performance chatbot framework that supports speech synthesis, multimodal, and extensible Function Call plugin system. Supports one-click free deployment of your private ChatGPT/LLM web application.",781,4176,https://avatars.githubusercontent.com/u/131470832?v=4
304981340,idurar-erp-crm,idurar/idurar-erp-crm,JavaScript,2310,IDURAR Open Code Source ERP CRM Alternative to SalesForce | Node Js React AntD MERN,957,4086,https://avatars.githubusercontent.com/u/50052356?v=4
520128820,udlbook,udlbook/udlbook,Jupyter Notebook,1502,Understanding Deep Learning - Simon J.D. Prince,715,3632,https://avatars.githubusercontent.com/u/110402648?v=4
701218262,latent-consistency-model,luosiallen/latent-consistency-model,Python,2654,Latent Consistency Models: Synthesizing High-Resolution Images with Few-Step Inference,166,3152,https://avatars.githubusercontent.com/u/47499850?u=971d6b9a0d755c78d8da5a22f448bc6deeab3d21&v=4
643504282,hiddify-next,hiddify/hiddify-next,Dart,1247,"Multi-platform auto-proxy client, supporting Sing-box, X-ray, TUIC, Hysteria, Reality, Trojan, SSH etc. It’s an open-source, secure and ad-free.",149,1981,https://avatars.githubusercontent.com/u/126981719?v=4
693305379,atomicals-js,atomicals/atomicals-js,TypeScript,619,Atomicals CLI and Javascript Library,293,595,https://avatars.githubusercontent.com/u/127462044?u=32fd59f682ae810f4409f9f61f73ac1ee166e90e&v=4
