id,name,full_name,language,new stars,description,forks_count,stargazers_count,avatar_url
15634981,godot,godotengine/godot,C++,4525,Godot Engine – Multi-platform 2D and 3D game engine,14567,74616,https://avatars.githubusercontent.com/u/6318500?v=4
3955647,lodash,lodash/lodash,JavaScript,286,"A modern JavaScript utility library delivering modularity, performance, & extras.",7092,57533,https://avatars.githubusercontent.com/u/2565403?v=4
188660663,Real-Time-Voice-Cloning,CorentinJ/Real-Time-Voice-Cloning,Python,1715,Clone a voice in 5 seconds to generate arbitrary speech in real-time,8139,46717,https://avatars.githubusercontent.com/u/12038136?u=e6c8b4d673fba64e7d29b29605ce9c868094423b&v=4
173228436,ghidra,NationalSecurityAgency/ghidra,Java,403,Ghidra is a software reverse engineering (SRE) framework,5235,43043,https://avatars.githubusercontent.com/u/11298292?v=4
49609581,PowerShell,PowerShell/PowerShell,C#,327,PowerShell for every system!,7548,40893,https://avatars.githubusercontent.com/u/11524380?v=4
71932349,ray,ray-project/ray,Python,156,Ray is a unified framework for scaling AI and Python applications. Ray consists of a core distributed runtime and a set of AI Libraries for accelerating ML workloads.,4788,27765,https://avatars.githubusercontent.com/u/22125274?v=4
234798675,bevy,bevyengine/bevy,Rust,542,A refreshingly simple data-driven game engine built in Rust,2629,26605,https://avatars.githubusercontent.com/u/60047606?v=4
265612440,TTS,coqui-ai/TTS,Python,3737,"🐸💬 - a deep learning toolkit for Text-to-Speech, battle-tested in research and production",2173,19142,https://avatars.githubusercontent.com/u/75583352?v=4
436297812,memos,usememos/memos,Go,658,"A privacy-first, lightweight note-taking service. Easily capture and share your great thoughts",1362,19123,https://avatars.githubusercontent.com/u/95764151?v=4
568098118,plane,makeplane/plane,TypeScript,1634,"🔥 🔥 🔥 Open Source JIRA, Linear and Height Alternative. Plane helps you track your issues, epics, and product roadmaps in the simplest way possible.",678,16268,https://avatars.githubusercontent.com/u/115727700?v=4
679421146,opentofu,opentofu/opentofu,Go,6046,OpenTofu lets you declaratively manage your cloud infrastructure.,391,12490,https://avatars.githubusercontent.com/u/142061836?v=4
614764248,tabby,TabbyML/tabby,TypeScript,799,Self-hosted AI coding assistant,349,10427,https://avatars.githubusercontent.com/u/125617854?v=4
190416463,runner-images,actions/runner-images,PowerShell,42,GitHub Actions runner images,3025,8140,https://avatars.githubusercontent.com/u/44036562?v=4
683892956,ChatDev,OpenBMB/ChatDev,Python,1672,Create Customized Software using Natural Language Idea (through LLM-powered Multi-Agent Collaboration),796,7994,https://avatars.githubusercontent.com/u/89920203?v=4
257434373,hysteria,apernet/hysteria,Go,325,"Hysteria is a powerful, lightning fast and censorship resistant proxy.",813,7311,https://avatars.githubusercontent.com/u/79422552?v=4
586265895,kamal,basecamp/kamal,Ruby,829,Deploy web apps anywhere.,250,7276,https://avatars.githubusercontent.com/u/13131?v=4
1381673,incubator-kie-drools,apache/incubator-kie-drools,Java,63,"Drools is a rule engine, DMN engine and complex event processing (CEP) engine for Java.",2457,5494,https://avatars.githubusercontent.com/u/47359?v=4
136570231,stride,stride3d/stride,C#,379,Stride Game Engine (formerly Xenko),819,5325,https://avatars.githubusercontent.com/u/33477741?v=4
667645956,agents,aiwaves-cn/agents,Python,2169,An Open-source Framework for Autonomous Language Agents,182,2934,https://avatars.githubusercontent.com/u/129118469?v=4
636922549,AgentVerse,OpenBMB/AgentVerse,JavaScript,568,🤖 AgentVerse 🪐 provides a flexible framework that simplifies the process of building custom multi-agent environments for large language models (LLMs).,184,2225,https://avatars.githubusercontent.com/u/89920203?v=4
685444668,Baichuan2,baichuan-inc/Baichuan2,Python,486,A series of large language models developed by Baichuan Intelligent Technology,106,2116,https://avatars.githubusercontent.com/u/136167093?v=4
690561136,pandora,zhile-io/pandora,Python,958,"潘多拉，一个让你呼吸顺畅的ChatGPT。Pandora, a ChatGPT client that lets you breathe freely.",311,2053,https://avatars.githubusercontent.com/u/144572553?u=6994d52c5e921bfca44277191ee8b5ef444db4bb&v=4
684031003,bisheng,dataelement/bisheng,TypeScript,282,Bisheng is an open LLM devops platform for next generation AI applications.,141,972,https://avatars.githubusercontent.com/u/103249391?v=4
682723630,UnityGaussianSplatting,aras-p/UnityGaussianSplatting,C#,184,Toy Gaussian Splatting visualization in Unity,32,613,https://avatars.githubusercontent.com/u/348087?u=41311731f3f004fab8817c14c0440e09a29caa48&v=4
624184221,efficientvit,mit-han-lab/efficientvit,Python,138,EfficientViT is a new family of vision models for efficient high-resolution vision.,32,419,https://avatars.githubusercontent.com/u/39571499?v=4
