id,name,full_name,language,new stars,description,forks_count,stargazers_count,avatar_url
527591471,stable-diffusion-webui,AUTOMATIC1111/stable-diffusion-webui,Python,550,Stable Diffusion web UI,26117,137197,https://avatars.githubusercontent.com/u/20920490?u=8bdc7c9401f507e51b55e558baa8184d4ed30c7d&v=4
307260205,yt-dlp,yt-dlp/yt-dlp,Python,672,A feature-rich command-line audio/video downloader,6140,78470,https://avatars.githubusercontent.com/u/79589310?v=4
601538369,llama,meta-llama/llama,Python,246,Inference code for Llama models,9399,54837,https://avatars.githubusercontent.com/u/153379578?v=4
237791077,diagrams,mingrammer/diagrams,Python,633,:art: Diagram as Code for prototyping cloud system architectures,2363,36373,https://avatars.githubusercontent.com/u/6178510?u=f9940c5492bc7ede04a9f2ea7df3aae973e45165&v=4
91629816,freqtrade,freqtrade/freqtrade,Python,641,"Free, open source crypto trading bot",5878,27279,https://avatars.githubusercontent.com/u/37536846?v=4
772699441,llama3,meta-llama/llama3,Python,667,The official Meta Llama 3 GitHub site,2770,25156,https://avatars.githubusercontent.com/u/153379578?v=4
71056775,kitty,kovidgoyal/kitty,Python,219,"Cross-platform, fast, feature-rich, GPU based terminal",944,23222,https://avatars.githubusercontent.com/u/1308621?u=b3fb9d6c1fe72bbc3d3b3b1192e8e421cad810c9&v=4
638629097,aider,paul-gauthier/aider,Python,812,aider is AI pair programming in your terminal,1437,15325,https://avatars.githubusercontent.com/u/69695708?u=1b1a608998950cb407854549123a52c964a202ec&v=4
765083837,MinerU,opendatalab/MinerU,Python,4310,"A one-stop, open-source, high-quality data extraction tool, supports PDF/webpage/e-book extraction.一站式开源高质量数据提取工具，支持PDF/网页/多格式电子书提取。",471,6066,https://avatars.githubusercontent.com/u/97503431?v=4
595921199,Jenkins-Zero-To-Hero,iam-veeramalla/Jenkins-Zero-To-Hero,Python,83,"Install Jenkins, configure Docker as slave, set up cicd, deploy applications to k8s using Argo CD in GitOps way.",10554,5780,https://avatars.githubusercontent.com/u/43399466?u=91e78018b666dba78f75f296340e3251942158c9&v=4
743116659,stable-diffusion-webui-forge,lllyasviel/stable-diffusion-webui-forge,Python,139,,565,5591,https://avatars.githubusercontent.com/u/19834515?u=4c7144779a6b13904fec478c4e98e676b91516ee&v=4
224896494,metube,alexta69/metube,Python,1112,Self-hosted YouTube downloader (web UI for youtube-dl / yt-dlp),316,5268,https://avatars.githubusercontent.com/u/7450369?v=4
729453988,ollama-python,ollama/ollama-python,Python,338,Ollama Python library,274,3386,https://avatars.githubusercontent.com/u/151674099?v=4
733283939,metahuman-stream,lipku/metahuman-stream,Python,1218,Real time interactive streaming digital human,354,2339,https://avatars.githubusercontent.com/u/5893340?v=4
