id,name,full_name,language,new stars,description,forks_count,stargazers_count,avatar_url
14712850,syncthing,syncthing/syncthing,Go,687,Open Source Continuous File Synchronization,3542,46655,https://avatars.githubusercontent.com/u/7628018?v=4
15452919,go-ethereum,ethereum/go-ethereum,Go,566,Official Go implementation of the Ethereum protocol,14908,39258,https://avatars.githubusercontent.com/u/6250754?v=4
136815833,clash,Dreamacro/clash,Go,1119,A rule-based tunnel in Go.,4272,31024,https://avatars.githubusercontent.com/u/8615343?u=327152a798c877f098eaa24ec15448e9e21df323&v=4
212613049,cli,cli/cli,Go,466,GitHub’s official command line tool,4139,29834,https://avatars.githubusercontent.com/u/59704711?v=4
59239347,portainer,portainer/portainer,Go,360,Making Docker and Kubernetes management easy.,2028,22945,https://avatars.githubusercontent.com/u/22225832?v=4
234231371,fiber,gofiber/fiber,Go,747,⚡️ Express inspired web framework written in Go,1136,22357,https://avatars.githubusercontent.com/u/59947262?v=4
53632140,micro,zyedidia/micro,Go,352,A modern and intuitive terminal-based text editor,1043,20271,https://avatars.githubusercontent.com/u/5513065?u=15db609dac90ac481ec89b92bf02f59e91974fb7&v=4
192632000,dapr,dapr/dapr,Go,453,"Dapr is a portable, event-driven, runtime for building distributed applications across cloud and edge.",1515,19225,https://avatars.githubusercontent.com/u/51932459?v=4
105279544,colly,gocolly/colly,Go,512,Elegant Scraper and Crawler Framework for Golang,1472,17678,https://avatars.githubusercontent.com/u/33584194?v=4
129717717,loki,grafana/loki,Go,326,"Like Prometheus, but for logs.",2158,17029,https://avatars.githubusercontent.com/u/7195757?v=4
48109239,cilium,cilium/cilium,Go,322,"eBPF-based Networking, Security, and Observability",1779,12996,https://avatars.githubusercontent.com/u/21054566?v=4
62712899,AdGuardHome,AdguardTeam/AdGuardHome,Go,520,Network-wide ads & trackers blocking DNS server,1225,12857,https://avatars.githubusercontent.com/u/8361145?v=4
208728772,milvus,milvus-io/milvus,Go,770,Vector database for scalable similarity search and AI applications.,1689,12327,https://avatars.githubusercontent.com/u/51735404?v=4
434218673,zinc,zinclabs/zinc,Go,1943,"ZincSearch. A lightweight alternative to elasticsearch that requires minimal resources, written in Go.",507,11817,https://avatars.githubusercontent.com/u/95867656?v=4
121086193,gqlgen,99designs/gqlgen,Go,149,go generate based graphql server library,928,8089,https://avatars.githubusercontent.com/u/17182?v=4
273871859,headscale,juanfont/headscale,Go,1429,"An open source, self-hosted implementation of the Tailscale control server",422,7852,https://avatars.githubusercontent.com/u/181059?u=56e87e3bf1145a99035e3ef576bc8c099214ac70&v=4
395283401,kubescape,kubescape/kubescape,Go,795,"Kubescape is a K8s open-source tool providing a multi-cloud K8s single pane of glass, including risk analysis, security compliance, RBAC visualizer and image vulnerabilities scanning. ",541,6892,https://avatars.githubusercontent.com/u/100554170?v=4
410430370,CasaOS,IceWhaleTech/CasaOS,Go,1189,"CasaOS - A simple, easy-to-use, elegant open-source Home Cloud system.",384,5648,https://avatars.githubusercontent.com/u/91336243?v=4
76221943,bk-cmdb,Tencent/bk-cmdb,Go,177,蓝鲸智云配置平台(BlueKing CMDB),1460,4696,https://avatars.githubusercontent.com/u/18461506?v=4
166304026,sliver,BishopFox/sliver,Go,750,Adversary Emulation Framework,555,4120,https://avatars.githubusercontent.com/u/4523757?v=4
139727567,Reloader,stakater/Reloader,Go,256,"A Kubernetes controller to watch changes in ConfigMap and Secrets and do rolling upgrades on Pods with their associated Deployment, StatefulSet, DaemonSet and DeploymentConfig – [✩Star] if you're using it!",303,4023,https://avatars.githubusercontent.com/u/15930712?v=4
57333709,test-infra,kubernetes/test-infra,Go,52,Test infrastructure for the Kubernetes project.,2312,3453,https://avatars.githubusercontent.com/u/13629408?v=4
117156031,prysm,prysmaticlabs/prysm,Go,128,Go implementation of Ethereum proof of stake,652,2729,https://avatars.githubusercontent.com/u/35349758?v=4
57912964,enhancements,kubernetes/enhancements,Go,69,Enhancements tracking repo for Kubernetes,1172,2430,https://avatars.githubusercontent.com/u/13629408?v=4
429165235,mev-boost,flashbots/mev-boost,Go,116,MEV-boost allows proof-of-stake Ethereum consensus clients to outsource block construction,61,459,https://avatars.githubusercontent.com/u/71380475?v=4
