id,name,full_name,language,new stars,description,forks_count,stargazers_count,avatar_url
1863329,laravel,laravel/laravel,PHP,458,"Laravel is a web application framework with expressive, elegant syntax. We’ve already laid the foundation for your next big idea — freeing you to create without sweating the small things.",22906,70844,https://avatars.githubusercontent.com/u/958072?v=4
3482588,SecLists,danielmiessler/SecLists,PHP,884,"SecLists is the security tester's companion. It's a collection of multiple types of lists used during security assessments, collected in one place. List types include usernames, passwords, URLs, sensitive data patterns, fuzzing payloads, web shells, and many more.",20797,41430,https://avatars.githubusercontent.com/u/50654?u=d5b77e639134c95d79f922589cde11239d8e0c2c&v=4
60243197,server,nextcloud/server,PHP,248,"☁️ Nextcloud server, a safe home for all your data",3174,19857,https://avatars.githubusercontent.com/u/19211038?v=4
82238168,monica,monicahq/monica,PHP,218,"Personal CRM. Remember everything about your friends, family and business relationships.",1734,17082,https://avatars.githubusercontent.com/u/25832602?v=4
2889328,WordPress,WordPress/WordPress,PHP,130,"WordPress, Git-ified. This repository is just a mirror of the WordPress subversion repository. Please do not send pull requests. Submit pull requests to https://github.com/WordPress/wordpress-develop and patches to https://core.trac.wordpress.org/ instead.",11561,16576,https://avatars.githubusercontent.com/u/276006?v=4
47495360,koel,koel/koel,PHP,153,🐦 A personal music streaming server that works.,1768,13940,https://avatars.githubusercontent.com/u/20983373?v=4
28628034,flarum,flarum/flarum,PHP,266,Simple forum software for building great communities.,1424,13289,https://avatars.githubusercontent.com/u/5549034?v=4
4916869,uuid,ramsey/uuid,PHP,98,A PHP library for generating universally unique identifiers (UUIDs).,472,11804,https://avatars.githubusercontent.com/u/42941?v=4
2884111,magento2,magento/magento2,PHP,68,"All Submissions you make to Magento Inc. (""Magento"") through GitHub are subject to the following terms and conditions: (1) You grant Magento a perpetual, worldwide, non-exclusive, no charge, royalty free, irrevocable license under your applicable copyrights and patents to reproduce, prepare derivative works of, display, publically perform, sublicense and distribute any feedback, ideas, code, or other information (“Submission"") you submit through GitHub. (2) Your Submission is an original work of authorship and you are the owner or are legally entitled to grant the license stated above. (3) You agree to the Contributor License Agreement found here:  https://github.com/magento/magento2/blob/master/CONTRIBUTOR_LICENSE_AGREEMENT.html",9005,10218,https://avatars.githubusercontent.com/u/168457?v=4
597887,orm,doctrine/orm,PHP,47,Doctrine Object Relational Mapper (ORM),2428,9338,https://avatars.githubusercontent.com/u/209254?v=4
677464,dbal,doctrine/dbal,PHP,65,Doctrine Database Abstraction Layer,1216,8799,https://avatars.githubusercontent.com/u/209254?v=4
364315,predis,predis/predis,PHP,59,A flexible and feature-complete Redis client for PHP.,949,7184,https://avatars.githubusercontent.com/u/69525311?v=4
14346979,snipe-it,snipe/snipe-it,PHP,195,A free open source IT asset/license management system,2291,6746,https://avatars.githubusercontent.com/u/197404?u=3a3faa7eb52d0ccb5d757cab2633677328bbffb2&v=4
2141186,opencart,opencart/opencart,PHP,37,A free shopping cart system. OpenCart is an open source PHP-based online e-commerce solution.,4596,6558,https://avatars.githubusercontent.com/u/214225?v=4
9791525,DVWA,digininja/DVWA,PHP,128,Damn Vulnerable Web Application (DVWA),2187,6485,https://avatars.githubusercontent.com/u/117081?u=cee7912aa7d3832b009472e54c3d6f5aaacd9c61&v=4
222873550,crater,crater-invoice/crater,PHP,170,Open Source Invoicing Solution for Individuals & Businesses,1204,6346,https://avatars.githubusercontent.com/u/93989578?v=4
97311017,rector,rectorphp/rector,PHP,231,Instant Upgrades and Automated Refactoring of any PHP 5.3+ code,537,5858,https://avatars.githubusercontent.com/u/32097581?v=4
6269013,aws-sdk-php,aws/aws-sdk-php,PHP,38,Official repository of the AWS SDK for PHP (@awsforphp),1126,5632,https://avatars.githubusercontent.com/u/2232217?v=4
60010673,elementor,elementor/elementor,PHP,82,"The most advanced frontend drag & drop page builder. Create high-end, pixel perfect websites at record speeds. Any theme, any page, any design.",1136,4599,https://avatars.githubusercontent.com/u/47606894?v=4
248372441,filament,filamentphp/filament,PHP,316,"Admin panel, form builder and table builder for Laravel. Built with the TALL stack. Designed for humans.",578,4379,https://avatars.githubusercontent.com/u/64450473?v=4
2464908,joomla-cms,joomla/joomla-cms,PHP,33,Home of the Joomla! Content Management System,3501,4248,https://avatars.githubusercontent.com/u/751633?v=4
22751672,TCPDF,tecnickcom/TCPDF,PHP,45,Official clone of PHP library to generate PDF documents and barcodes,1346,3442,https://avatars.githubusercontent.com/u/4163527?v=4
29745084,leantime,Leantime/leantime,PHP,291,Leantime is a lean project management system for innovators. Designed to help you manage your projects from ideation to delivery.,298,1592,https://avatars.githubusercontent.com/u/11252321?v=4
359687154,readme-typing-svg,DenverCoder1/readme-typing-svg,PHP,192,"⚡ Dynamically generated, customizable SVG that gives the appearance of typing and deleting text. Typing SVGs can be used as a bio on your Github profile readme or repository.",267,1402,https://avatars.githubusercontent.com/u/20955511?u=5bbdbfe0199b05d6ca913fb799236c8beedcd192&v=4
433383766,all-in-one,nextcloud/all-in-one,PHP,93,Nextcloud AIO stands for Nextcloud All In One and provides easy deployment and maintenance with most features included in this one Nextcloud instance.,77,566,https://avatars.githubusercontent.com/u/19211038?v=4
