id,name,full_name,language,new stars,description,forks_count,stargazers_count,avatar_url
63476337,Python,TheAlgorithms/Python,Python,3080,All Algorithms implemented in Python,36944,145234,https://avatars.githubusercontent.com/u/20487725?v=4
123458551,Python-100-Days,jackfrued/Python-100-Days,Python,2538,Python - 100天从新手到大师,46965,125291,https://avatars.githubusercontent.com/u/7474657?u=902200c2389c203cf2139888e10314845edd2a2a&v=4
58028038,HelloGitHub,521xueweihan/HelloGitHub,Python,1169,":octocat: 分享 GitHub 上有趣、入门级的开源项目。Share interesting, entry-level open source projects on GitHub.",8054,59546,https://avatars.githubusercontent.com/u/8255800?u=2024c0f3979fd65c8aab945856eae0852f1186f6&v=4
160919119,fastapi,tiangolo/fastapi,Python,1303,"FastAPI framework, high performance, easy to learn, fast to code, ready for production",3982,49776,https://avatars.githubusercontent.com/u/1326112?u=740f11212a731f56798f558ceddb0bd07642afa7&v=4
40416236,big-list-of-naughty-strings,minimaxir/big-list-of-naughty-strings,Python,946,The Big List of Naughty Strings is a list of strings which have a high probability of causing issues when used as user-input data.,2073,43687,https://avatars.githubusercontent.com/u/2179708?u=fa33a847bd260bee190d2994538a1ca32d467445&v=4
307260205,yt-dlp,yt-dlp/yt-dlp,Python,2060,A youtube-dl fork with additional features and fixes,2576,32581,https://avatars.githubusercontent.com/u/79589310?v=4
212639071,devops-exercises,bregman-arie/devops-exercises,Python,1972,"Linux, Jenkins, AWS, SRE, Prometheus, Docker, Python, Ansible, Git, Kubernetes, Terraform, OpenStack, SQL, NoSQL, Azure, GCP, DNS, Elastic, Network, Virtualization. DevOps Interview Questions",6500,30447,https://avatars.githubusercontent.com/u/10349437?u=bb7c3c533587d7cb2e3dd336e0f8a0d40544e5f5&v=4
262296122,PaddleOCR,PaddlePaddle/PaddleOCR,Python,851,"Awesome multilingual OCR toolkits based on PaddlePaddle (practical ultra lightweight OCR system, support 80+ languages recognition, provide data annotation and synthesis tools, support training and deployment among server, mobile, embedded and IoT devices)",5116,24962,https://avatars.githubusercontent.com/u/23534030?v=4
349321229,GFPGAN,TencentARC/GFPGAN,Python,1335,GFPGAN aims at developing Practical Algorithms for Real-world Face Restoration.,3339,22592,https://avatars.githubusercontent.com/u/83739826?v=4
123303402,poetry,python-poetry/poetry,Python,921,Python packaging and dependency management made easy,1757,21918,https://avatars.githubusercontent.com/u/48722593?v=4
54376220,PythonRobotics,AtsushiSakai/PythonRobotics,Python,368,Python sample codes for robotics algorithms.,5207,16288,https://avatars.githubusercontent.com/u/3813847?v=4
387326890,Real-ESRGAN,xinntao/Real-ESRGAN,Python,1764,Real-ESRGAN aims at developing Practical Algorithms for General Image/Video Restoration.,1595,14881,https://avatars.githubusercontent.com/u/17445847?u=dc0cf716873f6809f46f105917500699ae1aafd3&v=4
266417772,Summer2023-Internships,pittcsc/Summer2023-Internships,Python,1653,Collection of Summer 2023 tech internships!,1406,13701,https://avatars.githubusercontent.com/u/7276234?v=4
399495186,sqlmodel,tiangolo/sqlmodel,Python,730,"SQL databases in Python, designed for simplicity, compatibility, and robustness.",365,8644,https://avatars.githubusercontent.com/u/1326112?u=740f11212a731f56798f558ceddb0bd07642afa7&v=4
198350484,unilm,microsoft/unilm,Python,509,"Large-scale Self-supervised Pre-training Across Tasks, Languages, and Modalities",1231,6707,https://avatars.githubusercontent.com/u/6154722?v=4
333483116,changedetection.io,dgtlmoon/changedetection.io,Python,508,"changedetection.io - The best and simplest self-hosted free open source website change detection tracking, monitoring and notification service. An alternative to Visualping, Watchtower etc. Designed for simplicity - the main goal is to simply monitor which websites had a text change for free. Free Open source web page change detection",313,5891,https://avatars.githubusercontent.com/u/275001?u=94abd34c8fa06db18e09f1e6ade5a3f4f1202f9f&v=4
498011141,diffusers,huggingface/diffusers,Python,2656,🤗 Diffusers: State-of-the-art diffusion models for image and audio generation in PyTorch,523,5672,https://avatars.githubusercontent.com/u/25720743?v=4
221654678,haystack,deepset-ai/haystack,Python,282,":mag: Haystack is an open source NLP framework that leverages pre-trained Transformer models. It enables developers to quickly implement production-ready semantic search, question answering, summarization and document ranking for a wide range of NLP applications.",880,5502,https://avatars.githubusercontent.com/u/51827949?v=4
122758193,video2x,k4yt3x/video2x,Python,530,"A lossless video/GIF/image upscaler achieved with waifu2x, Anime4K, SRMD and RealSR. Started in Hack the Valley 2, 2018.",571,5302,https://avatars.githubusercontent.com/u/21986859?u=58a2817b46138b45ee4065de0ac129a7fbbd9237&v=4
528378201,stable-diffusion-webui,sd-webui/stable-diffusion-webui,Python,4382,Stable Diffusion web UI,484,4390,https://avatars.githubusercontent.com/u/112985304?v=4
392603437,nas-tools,jxxghp/nas-tools,Python,1025,NAS媒体库资源归集、整理自动化工具,405,3029,https://avatars.githubusercontent.com/u/51039935?u=18c1e26169a7f62e43f665926750ef152e8ab11a&v=4
149554797,consensus-specs,ethereum/consensus-specs,Python,102,Ethereum Proof-of-Stake Consensus Specifications,680,2816,https://avatars.githubusercontent.com/u/6250754?v=4
100787342,wpa-dictionary,conwnet/wpa-dictionary,Python,287,WPA/WPA2 密码字典，用于 wifi 密码暴力破解,470,1545,https://avatars.githubusercontent.com/u/17734694?u=81bf2b653451e487f62a3954e824724f519eaf18&v=4
520969009,Hello-Python,mouredev/Hello-Python,Python,404,Python desde cero,61,819,https://avatars.githubusercontent.com/u/17043402?u=0fe848503eee627223a1e8af9ff3f08a657e18f4&v=4
