id,name,full_name,language,new stars,description,forks_count,stargazers_count,avatar_url
199570071,v2rayN,2dust/v2rayN,C#,1815,"A V2Ray client for Windows, support Xray core and v2fly core",7538,39379,https://avatars.githubusercontent.com/u/31833384?v=4
49609581,PowerShell,PowerShell/PowerShell,C#,463,PowerShell for every system!,6395,37606,https://avatars.githubusercontent.com/u/11524380?v=4
69662720,WaveFunctionCollapse,mxgmn/WaveFunctionCollapse,C#,271,Bitmap & tilemap generation from a single example with the help of ideas from quantum mechanics,1115,20917,https://avatars.githubusercontent.com/u/14931730?u=2a63214b1fe8ce6058b4be7e19ed1199d814f7eb&v=4
262395224,maui,dotnet/maui,C#,426,".NET MAUI is the .NET Multi-platform App UI, a framework for building native device applications spanning mobile, tablet, and desktop.",1251,18645,https://avatars.githubusercontent.com/u/9141961?v=4
14964475,Avalonia,AvaloniaUI/Avalonia,C#,389,A cross-platform UI framework for .NET,1510,17273,https://avatars.githubusercontent.com/u/14075148?v=4
30474266,MaterialDesignInXamlToolkit,MaterialDesignInXAML/MaterialDesignInXamlToolkit,C#,148,"Google's Material Design in XAML & WPF, for C# & VB.Net. ",3200,13305,https://avatars.githubusercontent.com/u/16655083?v=4
959908,OpenRA,OpenRA/OpenRA,C#,210,"Open Source real-time strategy game engine for early Westwood games such as Command & Conquer: Red Alert written in C# using SDL and OpenGL. Runs on Windows, Linux, *BSD and Mac OS X.",2486,12538,https://avatars.githubusercontent.com/u/409046?v=4
165548191,PEASS-ng,carlospolop/PEASS-ng,C#,365,PEASS - Privilege Escalation Awesome Scripts SUITE (with colors),2613,11708,https://avatars.githubusercontent.com/u/17181413?u=7bab6cb28b2c583ee1f5f6ce8b3e0195601b6dde&v=4
324473895,downkyi,leiurayer/downkyi,C#,726,哔哩下载姬downkyi，哔哩哔哩网站视频下载工具，支持批量下载，支持8K、HDR、杜比视界，提供工具箱（音视频提取、去水印等）。,1456,11653,https://avatars.githubusercontent.com/u/19290097?u=589c798ec2b77363ddf03308123a6f8c718a8426&v=4
210716005,runtime,dotnet/runtime,C#,263,".NET is a cross-platform runtime for cloud, mobile, desktop, and IoT apps.",3821,11514,https://avatars.githubusercontent.com/u/9141961?v=4
213460285,CleanArchitecture,jasontaylordev/CleanArchitecture,C#,378,Clean Architecture Solution Template for .NET 7,2559,11384,https://avatars.githubusercontent.com/u/1988321?u=f96f36eed8f5bc57c4aab7213306f960efc072b1&v=4
201188122,lively,rocksdanister/lively,C#,358,Free and open-source software that allows users to set animated desktop wallpapers and screensavers powered by WinUI 3.,828,10265,https://avatars.githubusercontent.com/u/17554161?u=65f51a36d9c0072b244c13d215fc743e464f5cce&v=4
203892454,modular-monolith-with-ddd,kgrzybek/modular-monolith-with-ddd,C#,213,Full Modular Monolith application with Domain-Driven Design approach.,1227,8186,https://avatars.githubusercontent.com/u/1327418?v=4
27251463,Lean,QuantConnect/Lean,C#,109,"Lean Algorithmic Trading Engine by QuantConnect (Python, C#)",2780,7231,https://avatars.githubusercontent.com/u/3912814?v=4
153711945,wpf,dotnet/wpf,C#,117,WPF is a .NET Core UI framework for building Windows desktop applications.,1031,6244,https://avatars.githubusercontent.com/u/9141961?v=4
64677873,Bulk-Crap-Uninstaller,Klocman/Bulk-Crap-Uninstaller,C#,1459,Remove large amounts of unwanted applications quickly.,360,5883,https://avatars.githubusercontent.com/u/14913904?u=4d9a783d1e951054ca1217ae5821398bd39a601e&v=4
125612271,EntityComponentSystemSamples,Unity-Technologies/EntityComponentSystemSamples,C#,124,,1252,5279,https://avatars.githubusercontent.com/u/426196?v=4
187499284,UniTask,Cysharp/UniTask,C#,206,Provides an efficient allocation free async/await integration for Unity.,545,5029,https://avatars.githubusercontent.com/u/44487420?v=4
557943202,GoogleTranslateIpCheck,Ponderfly/GoogleTranslateIpCheck,C#,541,,239,2174,https://avatars.githubusercontent.com/u/22912560?v=4
131145697,cognitive-services-speech-sdk,Azure-Samples/cognitive-services-speech-sdk,C#,84,Sample code for the Microsoft Cognitive Services Speech SDK,1455,1626,https://avatars.githubusercontent.com/u/1844662?v=4
204367833,TwitchDownloader,lay295/TwitchDownloader,C#,107,Twitch VOD/Clip Downloader - Chat Download/Render/Replay,165,1395,https://avatars.githubusercontent.com/u/1060681?u=f47d387dd09cea974ae2aa62676120e9ff285285&v=4
432730711,openai,betalgo/openai,C#,767,"OpenAI ChatGPT, Whisper, GPT-3 and DALL-E dotnet SDK",189,1237,https://avatars.githubusercontent.com/u/7516303?v=4
591430510,CFScanner,MortezaBashsiz/CFScanner,C#,365,Cloud Flare scanner,166,805,https://avatars.githubusercontent.com/u/19620677?u=f3bc760bb042018e21672c84ecdd74886c9b32c9&v=4
281805770,OpenAI-API-dotnet,OkGoDoIt/OpenAI-API-dotnet,C#,241,An unofficial C#/.NET SDK for accessing the OpenAI GPT-3 API,172,741,https://avatars.githubusercontent.com/u/1185444?v=4
574666627,ChatGPT,wieslawsoltes/ChatGPT,C#,291,"A ChatGPT C# client for MacOS, Windows, Linux, Android, iOS and Browser.",64,419,https://avatars.githubusercontent.com/u/2297442?v=4
