id,name,full_name,language,new stars,description,forks_count,stargazers_count,avatar_url
243950408,HowToCook,Anduin2017/HowToCook,HTML,1157,ç¨‹åºå‘˜åœ¨å®¶åšé¥­æ–¹æ³•æŒ‡å—ã€‚Programmer's guide about how to cook at home (Chinese only).,7607,52188,https://avatars.githubusercontent.com/u/19531547?u=9bfa4b5f7256f64a05b280019f26a56319955cd0&v=4
574523116,awesome-chatgpt-prompts,f/awesome-chatgpt-prompts,HTML,16694,This repo includes ChatGPT prompt curation to use ChatGPT better.,5265,44699,https://avatars.githubusercontent.com/u/196477?u=22fbf9ad92cb9f014b0332238284cabf5ab2b00e&v=4
119811010,tabler,tabler/tabler,HTML,499,Tabler is free and open-source HTML Dashboard UI Kit built on Bootstrap,3525,33415,https://avatars.githubusercontent.com/u/35471246?v=4
109484365,Coursera-ML-AndrewNg-Notes,fengdu78/Coursera-ML-AndrewNg-Notes,HTML,298,å´æ©è¾¾è€å¸ˆçš„æœºå™¨å­¦ä¹ è¯¾ç¨‹ä¸ªäººç¬”è®°,10047,27223,https://avatars.githubusercontent.com/u/26119052?u=64357994632ab7e6be27e8a6549727e5bee3c077&v=4
63484632,fastText,facebookresearch/fastText,HTML,123,Library for fast text representation and classification.,4554,24306,https://avatars.githubusercontent.com/u/16943930?v=4
240215314,awesome-compose,docker/awesome-compose,HTML,759,Awesome Docker Compose samples,3971,22113,https://avatars.githubusercontent.com/u/5429470?v=4
35658863,gentelella,ColorlibHQ/gentelella,HTML,36,Free Bootstrap 4 Admin Dashboard Template,6829,20721,https://avatars.githubusercontent.com/u/39128121?v=4
162405963,gradio,gradio-app/gradio,HTML,1438,Create UIs for your machine learning model in Python in 3 minutes,916,14048,https://avatars.githubusercontent.com/u/51063788?v=4
6561551,Tailwind-Elements,mdbootstrap/Tailwind-Elements,HTML,242,"ğ™ƒğ™ªğ™œğ™š collection of Tailwind components, sections and templates ğŸ˜",1544,10603,https://avatars.githubusercontent.com/u/20553039?v=4
246128823,html-css,gustavoguanabara/html-css,HTML,325,Curso de HTML5 e CSS3,2546,9507,https://avatars.githubusercontent.com/u/8683378?u=01b06a154f04dadaa4e4131497fa2442e6323cbc&v=4
240419888,vpncn.github.io,vpncn/vpncn.github.io,HTML,593,2023ä¸­å›½ç¿»å¢™è½¯ä»¶VPNæ¨èä»¥åŠç§‘å­¦ä¸Šç½‘é¿å‘ï¼Œç¨³å®šå¥½ç”¨ã€‚å¯¹æ¯”SSRæœºåœºã€è“ç¯ã€V2rayã€è€ç‹VPNã€VPSæ­å»ºæ¢¯å­ç­‰ç§‘å­¦ä¸Šç½‘ä¸ç¿»å¢™è½¯ä»¶ï¼Œä¸­å›½æœ€æ–°ç§‘å­¦ä¸Šç½‘ç¿»å¢™æ¢¯å­VPNä¸‹è½½æ¨èã€‚,1726,8990,https://avatars.githubusercontent.com/u/60838758?u=5c0ddcaece49df42e6a6ae6de818fb2bab426dba&v=4
62263938,computer-science-flash-cards,jwasham/computer-science-flash-cards,HTML,99,Mini website for testing both general CS knowledge and enforce coding practice and common algorithm/data structure memorization.,1850,7435,https://avatars.githubusercontent.com/u/3771963?u=4b348c742192b1963aabbf803a1174d2a4de155a&v=4
79055279,craftinginterpreters,munificent/craftinginterpreters,HTML,187,"Repository for the book ""Crafting Interpreters""",813,6432,https://avatars.githubusercontent.com/u/46275?v=4
369764441,wg-easy,WeeJeWel/wg-easy,HTML,380,The easiest way to run WireGuard VPN + Web-based Admin UI.,606,5988,https://avatars.githubusercontent.com/u/319873?u=4ef741d2973b4487cbc12b3ca56ff3606767b12b&v=4
7474917,dragon-book-exercise-answers,fool2fish/dragon-book-exercise-answers,HTML,101,"Compilers Principles, Techniques, & Tools (purple dragon book) second edition exercise answers. ç¼–è¯‘åŸç†ï¼ˆç´«é¾™ä¹¦ï¼‰ç¬¬2ç‰ˆä¹ é¢˜ç­”æ¡ˆã€‚",1728,5705,https://avatars.githubusercontent.com/u/340282?u=40eb8f8c4476d5388f8207e73dbd79bfb62b5208&v=4
3618133,wpt,web-platform-tests/wpt,HTML,62,"Test suites for Web platform specs â€” including WHATWG, W3C, and others",2943,4258,https://avatars.githubusercontent.com/u/37226233?v=4
68730444,BotBuilder-Samples,microsoft/BotBuilder-Samples,HTML,35,"Welcome to the Bot Framework samples repository. Here you will find task-focused samples in C#, JavaScript and TypeScript to help you get started with the Bot Framework SDK!",4762,3969,https://avatars.githubusercontent.com/u/6154722?v=4
215689781,RuoYi,yangzongzhuan/RuoYi,HTML,166,:tada: (RuoYi)å®˜æ–¹ä»“åº“ åŸºäºSpringBootçš„æƒé™ç®¡ç†ç³»ç»Ÿ æ˜“è¯»æ˜“æ‡‚ã€ç•Œé¢ç®€æ´ç¾è§‚ã€‚ æ ¸å¿ƒæŠ€æœ¯é‡‡ç”¨Springã€MyBatisã€Shiroæ²¡æœ‰ä»»ä½•å…¶å®ƒé‡åº¦ä¾èµ–ã€‚ç›´æ¥è¿è¡Œå³å¯ç”¨,1201,3671,https://avatars.githubusercontent.com/u/19240310?u=2790505072242292c171c88b18244d00fe9db0f0&v=4
167393144,Markdown-Resume,CyC2018/Markdown-Resume,HTML,50,â­ï¸ Markdown ç®€å†æ¨¡ç‰ˆ,1394,2440,https://avatars.githubusercontent.com/u/36260787?u=70a8c2cbcaeb2f7dbcf84c1c40eea8c87a6d9bc3&v=4
395623073,technote,henryhu712/technote,HTML,439,ç¼–ç¨‹ç¬”è®°,103,756,https://avatars.githubusercontent.com/u/1261891?u=08ea71ccf7804c50a8244f688694fe56648327ad&v=4
522612085,Blooket-Cheats,Minesraft2/Blooket-Cheats,HTML,209,The best Blooket Hacks made by someone who actually knows what they're doing,1253,462,https://avatars.githubusercontent.com/u/49218878?u=d7ebd70bbebfe12593d08765fbcb7d727bae8cf5&v=4
586946500,flowbite-admin-dashboard,themesberg/flowbite-admin-dashboard,HTML,100,Free and open-source admin dashboard template built with Tailwind CSS and Flowbite,52,290,https://avatars.githubusercontent.com/u/52166837?v=4
584912713,3kh0.github.io,3kh0/3kh0.github.io,HTML,86,"3kh0, the better unblocked games website. If you fork this repo please give me a star to support me.",433,177,https://avatars.githubusercontent.com/u/58097612?v=4
574623336,introduction-to-apis-notes,TwilioDevEd/introduction-to-apis-notes,HTML,73,Introduction to APIs - v2,51,159,https://avatars.githubusercontent.com/u/8114879?v=4
590789943,fullstackwebdevelopment,pwlive/fullstackwebdevelopment,HTML,35,,272,101,https://avatars.githubusercontent.com/u/123061119?u=41ee0d84c170d9da71cda63e53579674956cad3d&v=4
