id,name,full_name,language,new stars,description,forks_count,stargazers_count,avatar_url
1181927,bitcoin,bitcoin/bitcoin,C++,270,Bitcoin Core integration/staging tree,32608,64890,https://avatars.githubusercontent.com/u/528860?v=4
5108051,opencv,opencv/opencv,C++,178,Open Source Computer Vision Library,51855,62279,https://avatars.githubusercontent.com/u/5009934?v=4
65600975,pytorch,pytorch/pytorch,C++,227,Tensors and Dynamic neural networks in Python with strong GPU acceleration,15802,56849,https://avatars.githubusercontent.com/u/21003710?v=4
15634981,godot,godotengine/godot,C++,272,Godot Engine â€“ Multi-platform 2D and 3D game engine,8841,49824,https://avatars.githubusercontent.com/u/6318500?v=4
4524181,folly,facebook/folly,C++,58,An open-source C++ library developed and used at Facebook.,4684,22157,https://avatars.githubusercontent.com/u/69631?v=4
108110,mongo,mongodb/mongo,C++,175,The MongoDB Database,5242,21974,https://avatars.githubusercontent.com/u/45120?v=4
19374812,tdesktop,telegramdesktop/tdesktop,C++,96,Telegram Desktop messaging app,4088,19095,https://avatars.githubusercontent.com/u/6113871?v=4
4279682,fish-shell,fish-shell/fish-shell,C++,58,The user-friendly command line shell.,1562,19071,https://avatars.githubusercontent.com/u/1828073?v=4
76222419,mars,Tencent/mars,C++,19,Mars is a cross-platform network component  developed by WeChat.,3438,16232,https://avatars.githubusercontent.com/u/18461506?v=4
26038648,spdlog,gabime/spdlog,C++,79,Fast C++ logging library.,3162,14881,https://avatars.githubusercontent.com/u/6052198?u=a5aaa778f219603fd3a6e221c79370ac5f0fa182&v=4
149111813,MMKV,Tencent/MMKV,C++,47,"An efficient, small mobile key-value storage framework developed by WeChat. Works on Android, iOS, macOS, Windows, and POSIX.",1638,14618,https://avatars.githubusercontent.com/u/18461506?v=4
186309296,3d-game-shaders-for-beginners,lettier/3d-game-shaders-for-beginners,C++,58,"ğŸ® A step-by-step guide to implementing SSAO, depth of field, lighting, normal mapping, and more for your 3D game.",1007,13165,https://avatars.githubusercontent.com/u/1661343?u=255910af9979c71a82f379f360378e8573edaa94&v=4
5736080,FreeCAD,FreeCAD/FreeCAD,C++,98,"This is the official source code of FreeCAD, a free and opensource multiplatform 3D parametric modeler.",2805,11590,https://avatars.githubusercontent.com/u/2306237?v=4
6930489,watchman,facebook/watchman,C++,23,"Watches files and records, or triggers actions, when they change. ",905,10941,https://avatars.githubusercontent.com/u/69631?v=4
76990209,WLED,Aircoookie/WLED,C++,61,Control WS2812B and many more types of digital RGB LEDs with an ESP8266 or ESP32 over WiFi!,1821,9020,https://avatars.githubusercontent.com/u/21045690?u=b6ef8107e15c7fc6c160235afba9c3813117a768&v=4
283410102,workflow,sogou/workflow,C++,186,C++ Parallel Computing and Asynchronous Networking Engine,1650,8424,https://avatars.githubusercontent.com/u/15903299?v=4
31197250,glog,google/glog,C++,20,C++ implementation of the Google logging module,1862,5385,https://avatars.githubusercontent.com/u/1342004?v=4
99919302,doris,apache/doris,C++,164,Apache Doris is an MPP-based interactive SQL data warehousing for reporting and analysis.,1468,4584,https://avatars.githubusercontent.com/u/47359?v=4
99799314,MusicPlayer2,zhongyang219/MusicPlayer2,C++,55,è¿™æ˜¯ä¸€æ¬¾å¯ä»¥æ’­æ”¾å¸¸è§éŸ³é¢‘æ ¼å¼çš„éŸ³é¢‘æ’­æ”¾å™¨ã€‚æ”¯æŒæ­Œè¯æ˜¾ç¤ºã€æ­Œè¯å¡æ‹‰OKæ ·å¼æ˜¾ç¤ºã€æ­Œè¯åœ¨çº¿ä¸‹è½½ã€æ­Œè¯ç¼–è¾‘ã€æ­Œæ›²æ ‡ç­¾è¯†åˆ«ã€Win10å°å¨œæœç´¢æ˜¾ç¤ºæ­Œè¯ã€é¢‘è°±åˆ†æã€éŸ³æ•ˆè®¾ç½®ã€ä»»åŠ¡æ ç¼©ç•¥å›¾æŒ‰é’®ã€ä¸»é¢˜é¢œè‰²ç­‰åŠŸèƒ½ã€‚ æ’­æ”¾å†…æ ¸ä¸ºBASSéŸ³é¢‘åº“(V2.4)ã€‚,233,1909,https://avatars.githubusercontent.com/u/30562462?u=18ad9b9dfa6e784088d28deb7e0dbe830afcc0b7&v=4
331360188,leetcode,neetcode-gh/leetcode,C++,91,Leetcode solutions,474,934,https://avatars.githubusercontent.com/u/77742485?u=1b03d88f14b671c63c2b69ebe02a01b66978ae05&v=4
436366606,CodeHelp-DSA-Busted-Series,loveBabbar/CodeHelp-DSA-Busted-Series,C++,35,This repo is creating providing students easy access to all the programs taught under Codehelp's DSA Busted Series.,608,834,https://avatars.githubusercontent.com/u/29489915?u=fcf37f59ad74d0389bcb06a49c324a4cab771e4e&v=4
502462488,ascii-video-player,IonelPopJara/ascii-video-player,C++,112,A simple script that turns .mp4 files into ASCII characters,46,327,https://avatars.githubusercontent.com/u/72368518?v=4
501947445,embedx,Tencent/embedx,C++,62,embedx æ˜¯åŸºäº c++ å¼€å‘çš„ã€å®Œå…¨è‡ªç ”çš„åˆ†å¸ƒå¼ embedding è®­ç»ƒå’Œæ¨ç†æ¡†æ¶ã€‚å®ƒç›®å‰æ”¯æŒ å›¾æ¨¡å‹ã€æ·±åº¦æ’åºã€å¬å›æ¨¡å‹å’Œå›¾ä¸æ’åºã€å›¾ä¸å¬å›çš„è”åˆè®­ç»ƒæ¨¡å‹ç­‰,24,175,https://avatars.githubusercontent.com/u/18461506?v=4
