id,name,full_name,language,new stars,description,forks_count,stargazers_count,avatar_url
1181927,bitcoin,bitcoin/bitcoin,C++,279,Bitcoin Core integration/staging tree,32626,64948,https://avatars.githubusercontent.com/u/528860?v=4
65600975,pytorch,pytorch/pytorch,C++,221,Tensors and Dynamic neural networks in Python with strong GPU acceleration,15840,56934,https://avatars.githubusercontent.com/u/21003710?v=4
15634981,godot,godotengine/godot,C++,274,Godot Engine – Multi-platform 2D and 3D game engine,8851,49894,https://avatars.githubusercontent.com/u/6318500?v=4
67702184,Magisk,topjohnwu/Magisk,C++,266,The Magic Mask for Android,6804,27112,https://avatars.githubusercontent.com/u/7337301?v=4
39840932,googletest,google/googletest,C++,112,GoogleTest - Google Testing and Mocking Framework,8645,26695,https://avatars.githubusercontent.com/u/1342004?v=4
4524181,folly,facebook/folly,C++,76,An open-source C++ library developed and used at Facebook.,4685,22189,https://avatars.githubusercontent.com/u/69631?v=4
196813750,CPlusPlusThings,Light-City/CPlusPlusThings,C++,249,C++那些事,5595,22381,https://avatars.githubusercontent.com/u/25699850?u=ae1ceddf2cd1d69488bc3132d29b5ca3bb57ee26&v=4
108110,mongo,mongodb/mongo,C++,62,The MongoDB Database,5246,21992,https://avatars.githubusercontent.com/u/45120?v=4
74660642,taichi,taichi-dev/taichi,C++,67,Productive & portable high-performance programming in Python.,1988,19301,https://avatars.githubusercontent.com/u/33354891?v=4
19374812,tdesktop,telegramdesktop/tdesktop,C++,115,Telegram Desktop messaging app,4093,19138,https://avatars.githubusercontent.com/u/6113871?v=4
34777562,srs,ossrs/srs,C++,64,"SRS is a simple, high efficiency and realtime video server, supports RTMP, WebRTC, HLS, HTTP-FLV and SRT.",4566,18416,https://avatars.githubusercontent.com/u/12165287?v=4
81227005,faiss,facebookresearch/faiss,C++,67,A library for efficient similarity search and clustering of dense vectors.,2631,17241,https://avatars.githubusercontent.com/u/16943930?v=4
149111813,MMKV,Tencent/MMKV,C++,55,"An efficient, small mobile key-value storage framework developed by WeChat. Works on Android, iOS, macOS, Windows, and POSIX.",1639,14646,https://avatars.githubusercontent.com/u/18461506?v=4
5736080,FreeCAD,FreeCAD/FreeCAD,C++,102,"This is the official source code of FreeCAD, a free and opensource multiplatform 3D parametric modeler.",2808,11622,https://avatars.githubusercontent.com/u/2306237?v=4
420580521,smartknob,scottbez1/smartknob,C++,385,Haptic input knob with software-defined endstops and virtual detents,565,10373,https://avatars.githubusercontent.com/u/414890?u=589508b11b9260a496d1735579ab79c77b49558e&v=4
283410102,workflow,sogou/workflow,C++,120,C++ Parallel Computing and Asynchronous Networking Engine,1654,8447,https://avatars.githubusercontent.com/u/15903299?v=4
299510783,mold,rui314/mold,C++,284,mold: A Modern Linker,245,7746,https://avatars.githubusercontent.com/u/47400?v=4
86897963,ZLMediaKit,ZLMediaKit/ZLMediaKit,C++,90,WebRTC/RTSP/RTMP/HTTP/HLS/HTTP-FLV/WebSocket-FLV/HTTP-TS/HTTP-fMP4/WebSocket-TS/WebSocket-fMP4/GB28181/SRT server and client framework based on C++11,1892,6844,https://avatars.githubusercontent.com/u/84565724?v=4
64987779,MyTinySTL,Alinshans/MyTinySTL,C++,98,Achieve a tiny STL in C++11,2312,6461,https://avatars.githubusercontent.com/u/20122802?u=bb9f1e515310d7a18c6327a9e255f156bfe013d7&v=4
31197250,glog,google/glog,C++,20,C++ implementation of the Google logging module,1864,5390,https://avatars.githubusercontent.com/u/1342004?v=4
99919302,doris,apache/doris,C++,118,Apache Doris is an MPP-based interactive SQL data warehousing for reporting and analysis.,1479,4624,https://avatars.githubusercontent.com/u/47359?v=4
3884981,JUCE,juce-framework/JUCE,C++,32,"JUCE is an open-source cross-platform C++ application framework for desktop and mobile applications, including VST, VST3, AU, AUv3, RTAS and AAX audio plug-ins.",1273,4286,https://avatars.githubusercontent.com/u/62880632?v=4
67641996,oneTBB,oneapi-src/oneTBB,C++,21,oneAPI Threading Building Blocks (oneTBB),741,3760,https://avatars.githubusercontent.com/u/60144784?v=4
446669267,huatuo,focus-creative-games/huatuo,C++,120,"huatuo是一个特性完整、零成本、高性能、低内存的近乎完美的Unity全平台原生c#热更方案。 Huatuo is a fully featured, zero-cost, high-performance, low-memory solution for Unity's all-platform native c# hotfix",293,1805,https://avatars.githubusercontent.com/u/71439677?v=4
331360188,leetcode,neetcode-gh/leetcode,C++,85,Leetcode solutions,485,956,https://avatars.githubusercontent.com/u/77742485?u=1b03d88f14b671c63c2b69ebe02a01b66978ae05&v=4
