id,name,full_name,language,new stars,description,forks_count,stargazers_count,avatar_url
612354784,llama.cpp,ggerganov/llama.cpp,C,4100,Port of Facebook's LLaMA model in C/C++,2818,20063,https://avatars.githubusercontent.com/u/1991296?u=28314d364d7c28f8ec232fadb767970d3ad74e7b&v=4
63477515,C,TheAlgorithms/C,C,65,"Collection of various algorithms in mathematics, machine learning, computer science, physics, etc implemented in C for educational purposes.",3952,15940,https://avatars.githubusercontent.com/u/20487725?v=4
214011414,WindTerm,kingToolbox/WindTerm,C,188,A professional cross-platform SSH/Sftp/Shell/Telnet/Serial terminal.,1064,13694,https://avatars.githubusercontent.com/u/51009775?v=4
179354282,OpenCorePkg,acidanthera/OpenCorePkg,C,56,OpenCore bootloader,1973,11214,https://avatars.githubusercontent.com/u/39672954?v=4
414577657,Dummy-Robot,peng-zhihui/Dummy-Robot,C,78,我的超迷你机械臂机器人项目。,2104,9314,https://avatars.githubusercontent.com/u/12994887?u=6bfec84cb512892557cfed7fd7c52b0b0f41f95b&v=4
4151993,openvpn,OpenVPN/openvpn,C,58,OpenVPN  is  an open source VPN daemon,2675,8370,https://avatars.githubusercontent.com/u/1569141?v=4
7408108,rt-thread,RT-Thread/rt-thread,C,61,RT-Thread is an open source IoT real-time operating system (RTOS).,4368,8206,https://avatars.githubusercontent.com/u/1783729?v=4
88327406,xmrig,xmrig/xmrig,C,28,"RandomX, KawPow, CryptoNight and GhostRider unified CPU/GPU miner and RandomX benchmark",3390,7491,https://avatars.githubusercontent.com/u/27528955?u=555699fb82e7598ed7dd1f6e47302042b48a10c3&v=4
470579591,unleashed-firmware,DarkFlippers/unleashed-firmware,C,340,Flipper Zero Unleashed Firmware,613,6685,https://avatars.githubusercontent.com/u/115378555?v=4
284134871,flipperzero-firmware,flipperdevices/flipperzero-firmware,C,114,Flipper Zero firmware source code,1738,6267,https://avatars.githubusercontent.com/u/57576566?v=4
468685658,ElectronBot,peng-zhihui/ElectronBot,C,55,,1509,6201,https://avatars.githubusercontent.com/u/12994887?u=6bfec84cb512892557cfed7fd7c52b0b0f41f95b&v=4
490465859,Flipper,UberGuidoZ/Flipper,C,182,Playground (and dump) of stuff I make or modify for the Flipper Zero,1457,5906,https://avatars.githubusercontent.com/u/57457139?u=3b283c3083a1fee457b897d7c8fda97b873e9807&v=4
400501136,mujoco,deepmind/mujoco,C,52,Multi-Joint dynamics with Contact. A general purpose physics simulator.,507,5479,https://avatars.githubusercontent.com/u/8596759?v=4
146155284,flecs,SanderMertens/flecs,C,282,A fast entity component system (ECS) for C & C++,308,4102,https://avatars.githubusercontent.com/u/9919222?u=c255d45d76514ff1c73de590bc5793f2e080a6ee&v=4
34807561,nanopb,nanopb/nanopb,C,20,Protocol Buffers with small code size,722,3443,https://avatars.githubusercontent.com/u/12173937?v=4
7966650,gnucash,Gnucash/gnucash,C,24,GnuCash Double-Entry Accounting Program.,696,2573,https://avatars.githubusercontent.com/u/544952?v=4
359952601,pgvector,pgvector/pgvector,C,177,Open-source vector similarity search for Postgres,68,2078,https://avatars.githubusercontent.com/u/98363230?v=4
576303915,KernelSU,tiann/KernelSU,C,93,A Kernel based root solution for Android,325,2018,https://avatars.githubusercontent.com/u/4233744?u=b77ba695239c04c10b7d539f9fe3ae2220d4b963&v=4
207354223,FreeRTOS-Kernel,FreeRTOS/FreeRTOS-Kernel,C,31,"FreeRTOS kernel files only, submoduled into https://github.com/FreeRTOS/FreeRTOS and various other repos.",761,1595,https://avatars.githubusercontent.com/u/54647343?v=4
181022316,unikraft,unikraft/unikraft,C,37,Unikraft is an automated system for building specialized OSes known as unikernels. Unikraft can be configured to be POSIX-compliant. (Core repository),1065,1327,https://avatars.githubusercontent.com/u/44058005?v=4
538180525,ggml,ggerganov/ggml,C,195,Tensor library for machine learning,80,1245,https://avatars.githubusercontent.com/u/1991296?u=28314d364d7c28f8ec232fadb767970d3ad74e7b&v=4
505613691,Onion,OnionUI/Onion,C,50,OS overhaul for Miyoo Mini ,52,1046,https://avatars.githubusercontent.com/u/109221246?v=4
617734467,Chinese-Vicuna,Facico/Chinese-Vicuna,C,427,Chinese-Vicuna: A Chinese Instruction-following LLaMA-based Model —— 一个中文低资源的llama+lora方案，结构参考alpaca,73,674,https://avatars.githubusercontent.com/u/56598258?u=c1dc8bbfcfe1afc9e1f7b695d9a9adff96546d61&v=4
403314395,1337-Piscine-42,48d31kh413k/1337-Piscine-42,C,18,June Piscine 2021 from 1337 Benguerir 42 Network.,181,400,https://avatars.githubusercontent.com/u/65833007?u=9be65d007cd7391e8ba5e099e47644a3aa9d918e&v=4
577573233,macstealer,vanhoefm/macstealer,C,124,,29,274,https://avatars.githubusercontent.com/u/637995?u=bb829a3cc53f17ec1622d5fe63a42d842cb2639d&v=4
