id,name,full_name,language,new stars,description,forks_count,stargazers_count,avatar_url
65252,jekyll,jekyll/jekyll,Ruby,50,:globe_with_meridians: Jekyll is a blog-aware static site generator in Ruby,9939,48737,https://avatars.githubusercontent.com/u/3083652?v=4
52281283,mastodon,mastodon/mastodon,Ruby,57,"Your self-hosted, globally interconnected microblogging community",6849,46512,https://avatars.githubusercontent.com/u/24979032?v=4
8681349,huginn,huginn/huginn,Ruby,69,Create agents that monitor and act on your behalf.  Your agents are standing by!,3730,42499,https://avatars.githubusercontent.com/u/23225142?v=4
7569578,discourse,discourse/discourse,Ruby,85,"A platform for community discussion. Free, open, simple.",8235,41391,https://avatars.githubusercontent.com/u/3220138?v=4
27442967,fastlane,fastlane/fastlane,Ruby,39,🚀 The easiest way to automate building and releasing your iOS and Android apps,5651,38921,https://avatars.githubusercontent.com/u/11098337?v=4
13840241,devdocs,freeCodeCamp/devdocs,Ruby,188,API Documentation Browser,2310,34723,https://avatars.githubusercontent.com/u/9892522?v=4
2293158,metasploit-framework,rapid7/metasploit-framework,Ruby,79,Metasploit Framework,13836,33495,https://avatars.githubusercontent.com/u/1013671?v=4
21600440,awesome-awesomeness,bayandin/awesome-awesomeness,Ruby,30,A curated list of awesome awesomeness,3542,31528,https://avatars.githubusercontent.com/u/864213?u=bece5170441fbfed6963d934553abf048d0b14e1&v=4
481872,vagrant,hashicorp/vagrant,Ruby,33,Vagrant is a tool for building and distributing development environments.,4422,26082,https://avatars.githubusercontent.com/u/761456?v=4
308770,devise,heartcombo/devise,Ruby,10,Flexible authentication solution for Rails with Warden.,5533,23865,https://avatars.githubusercontent.com/u/59584037?v=4
73648678,forem,forem/forem,Ruby,28,For empowering community 🌱,3983,21802,https://avatars.githubusercontent.com/u/65030610?v=4
202291859,chatwoot,chatwoot/chatwoot,Ruby,66,"Open-source live-chat, email support, omni-channel desk. An alternative to Intercom, Zendesk, Salesforce Service Cloud etc. 🔥💬",3215,19894,https://avatars.githubusercontent.com/u/23416667?v=4
3195124,sidekiq,sidekiq/sidekiq,Ruby,9,"Simple, efficient background processing for Ruby",2398,13074,https://avatars.githubusercontent.com/u/124714131?v=4
1725199,linguist,github-linguist/linguist,Ruby,18,"Language Savant. If your repository's language is being reported incorrectly, send us a pull request!",4161,12009,https://avatars.githubusercontent.com/u/20014732?v=4
361310,capybara,teamcapybara/capybara,Ruby,2,Acceptance test framework for web applications,1446,10001,https://avatars.githubusercontent.com/u/23465623?v=4
586265895,kamal,basecamp/kamal,Ruby,20,Deploy web apps anywhere.,366,9458,https://avatars.githubusercontent.com/u/13131?v=4
6899875,openproject,opf/openproject,Ruby,36,OpenProject is the leading open source project management software.,2250,8853,https://avatars.githubusercontent.com/u/1756674?v=4
69193081,how-to-contribute-to-open-source,freeCodeCamp/how-to-contribute-to-open-source,Ruby,17,A guide to contributing to open source,1795,8660,https://avatars.githubusercontent.com/u/9892522?v=4
1314319,canvas-lms,instructure/canvas-lms,Ruby,17,"The open LMS by Instructure, Inc.",2446,5473,https://avatars.githubusercontent.com/u/515326?v=4
10088951,theodinproject,TheOdinProject/theodinproject,Ruby,18,Main Website for The Odin Project,2064,3604,https://avatars.githubusercontent.com/u/4441966?v=4
1404127,ruby-jwt,jwt/ruby-jwt,Ruby,0,A ruby implementation of the RFC 7519 OAuth JSON Web Token (JWT) standard.,374,3575,https://avatars.githubusercontent.com/u/10998651?v=4
2725544,Xcodeproj,CocoaPods/Xcodeproj,Ruby,2,Create and modify Xcode projects from Ruby.,454,2330,https://avatars.githubusercontent.com/u/1189714?v=4
317981738,turbo-rails,hotwired/turbo-rails,Ruby,4,Use Turbo in your Ruby on Rails app,311,2050,https://avatars.githubusercontent.com/u/75388917?v=4
