id,name,full_name,language,new stars,description,forks_count,stargazers_count,avatar_url
7600409,shadowsocks-windows,shadowsocks/shadowsocks-windows,C#,275,A C# port of shadowsocks,16332,54621,https://avatars.githubusercontent.com/u/3006190?v=4
199570071,v2rayN,2dust/v2rayN,C#,982,"A V2Ray client for Windows, support Xray core and v2fly core",6105,29812,https://avatars.githubusercontent.com/u/31833384?v=4
164140756,Files,files-community/Files,C#,679,A modern file manager for Windows,1387,22935,https://avatars.githubusercontent.com/u/65931357?v=4
70104825,eShopOnContainers,dotnet-architecture/eShopOnContainers,C#,282,"Cross-platform .NET sample microservices and container based application that runs on Linux Windows and macOS. Powered by .NET 6, Docker Containers and Azure Kubernetes Services. Supports Visual Studio, VS for Mac and CLI based environments with Docker CLI, dotnet CLI, VS Code or any other code editor.",8968,20940,https://avatars.githubusercontent.com/u/27453006?v=4
29078997,roslyn,dotnet/roslyn,C#,157,The Roslyn .NET compiler provides C# and Visual Basic languages with rich code analysis APIs.,3633,16065,https://avatars.githubusercontent.com/u/9141961?v=4
198071756,RevokeMsgPatcher,huiyadanli/RevokeMsgPatcher,C#,632,:trollface: A hex editor for WeChat/QQ/TIM - PCç‰ˆå¾®ä¿¡/QQ/TIMé˜²æ’¤å›è¡¥ä¸ï¼ˆæˆ‘å·²ç»çœ‹åˆ°äº†ï¼Œæ’¤å›ä¹Ÿæ²¡ç”¨äº†ï¼‰,2194,15713,https://avatars.githubusercontent.com/u/15783049?u=86f380636f7c09b86788a977ea96272cb7484a30&v=4
193681686,netch,netchx/netch,C#,358,A simple proxy client,1979,11732,https://avatars.githubusercontent.com/u/52199683?v=4
16157746,efcore,dotnet/efcore,C#,115,"EF Core is a modern object-database mapper for .NET. It supports LINQ queries, change tracking, updates, and schema migrations.",2789,11412,https://avatars.githubusercontent.com/u/9141961?v=4
28239455,AspNetCore.Docs,dotnet/AspNetCore.Docs,C#,144,Documentation for ASP.NET Core,24428,10611,https://avatars.githubusercontent.com/u/9141961?v=4
12201538,aspnetboilerplate,aspnetboilerplate/aspnetboilerplate,C#,100,ASP.NET Boilerplate - Web Application Framework,3608,10430,https://avatars.githubusercontent.com/u/5957277?v=4
3476845,Newtonsoft.Json,JamesNK/Newtonsoft.Json,C#,94,Json.NET is a popular high-performance JSON framework for .NET,3045,9392,https://avatars.githubusercontent.com/u/303201?u=a4521438844aae7f844f8717a79a9858d6c805da&v=4
210716005,runtime,dotnet/runtime,C#,336,".NET is a cross-platform runtime for cloud, mobile, desktop, and IoT apps.",3206,9337,https://avatars.githubusercontent.com/u/9141961?v=4
213460285,CleanArchitecture,jasontaylordev/CleanArchitecture,C#,306,Clean Architecture Solution Template for .NET 6,2038,8940,https://avatars.githubusercontent.com/u/1988321?u=f96f36eed8f5bc57c4aab7213306f960efc072b1&v=4
321682465,SteamTools,BeyondDimension/SteamTools,C#,858,ğŸ› ã€ŒWatt Toolkitã€æ˜¯ä¸€ä¸ªå¼€æºè·¨å¹³å°çš„å¤šåŠŸèƒ½ Steam å·¥å…·ç®±ã€‚,548,8507,https://avatars.githubusercontent.com/u/79355691?v=4
44897462,ArchiSteamFarm,JustArchiNET/ArchiSteamFarm,C#,329,C# application with primary purpose of farming Steam cards from multiple accounts simultaneously.,913,8174,https://avatars.githubusercontent.com/u/40950157?v=4
375939072,FastGithub,dotnetcore/FastGithub,C#,1029,githubåŠ é€Ÿç¥å™¨ï¼Œè§£å†³githubæ‰“ä¸å¼€ã€ç”¨æˆ·å¤´åƒæ— æ³•åŠ è½½ã€releasesæ— æ³•ä¸Šä¼ ä¸‹è½½ã€git-cloneã€git-pullã€git-pushå¤±è´¥ç­‰é—®é¢˜,991,7282,https://avatars.githubusercontent.com/u/19404084?v=4
27251463,Lean,QuantConnect/Lean,C#,133,"Lean Algorithmic Trading Engine by QuantConnect (Python, C#)",2590,6296,https://avatars.githubusercontent.com/u/3912814?v=4
50605426,MixedRealityToolkit-Unity,microsoft/MixedRealityToolkit-Unity,C#,94,Mixed Reality Toolkit (MRTK) provides a set of components and features to accelerate cross-platform MR app development in Unity.,1985,5195,https://avatars.githubusercontent.com/u/6154722?v=4
187499284,UniTask,Cysharp/UniTask,C#,166,Provides an efficient allocation free async/await integration for Unity.,357,3361,https://avatars.githubusercontent.com/u/44487420?v=4
158405551,git-credential-manager,GitCredentialManager/git-credential-manager,C#,237,"Secure, cross-platform Git credential storage with authentication to GitHub, Azure Repos, and other popular Git hosting services.",547,2706,https://avatars.githubusercontent.com/u/64464614?v=4
39425864,tModLoader,tModLoader/tModLoader,C#,112,A mod to make and play Terraria mods. Supports Terraria 1.4 (and earlier) installations ,1427,2596,https://avatars.githubusercontent.com/u/36521970?v=4
137433882,arfoundation-samples,Unity-Technologies/arfoundation-samples,C#,57,Example content for Unity projects based on AR Foundation,796,2159,https://avatars.githubusercontent.com/u/426196?v=4
80280403,EventSourcing.NetCore,oskardudycz/EventSourcing.NetCore,C#,124,Examples and Tutorials of Event Sourcing in .NET,330,2143,https://avatars.githubusercontent.com/u/5562528?u=decd12aa824a26a72a9685b64ba5612823d0d0c1&v=4
255952484,maui-samples,dotnet/maui-samples,C#,122,Samples for .NET Multi-Platform App UI (.NET MAUI),192,1093,https://avatars.githubusercontent.com/u/9141961?v=4
464654186,dotnet-maui-workshop,dotnet-presentations/dotnet-maui-workshop,C#,242,"A full day workshop (.NET MAUI Workshop in a Box) on how to build apps with .NET MAUI for iOS, Android, macOS, and Windows",144,817,https://avatars.githubusercontent.com/u/31487945?v=4
