id,name,full_name,language,new stars,description,forks_count,stargazers_count,avatar_url
45717250,tensorflow,tensorflow/tensorflow,C++,1098,An Open Source Machine Learning Framework for Everyone,86879,165942,https://avatars.githubusercontent.com/u/15658638?v=4
44838949,swift,apple/swift,C++,412,The Swift Programming Language,9648,59931,https://avatars.githubusercontent.com/u/10639145?v=4
65600975,pytorch,pytorch/pytorch,C++,814,Tensors and Dynamic neural networks in Python with strong GPU acceleration,15836,56921,https://avatars.githubusercontent.com/u/21003710?v=4
23357588,protobuf,protocolbuffers/protobuf,C++,524,Protocol Buffers - Google's data interchange format,14211,55089,https://avatars.githubusercontent.com/u/26310541?v=4
22887094,tesseract,tesseract-ocr/tesseract,C++,447,Tesseract Open Source OCR Engine (main repository),8037,45676,https://avatars.githubusercontent.com/u/8401422?v=4
27729880,grpc,grpc/grpc,C++,402,"The C based gRPC (C++, Python, Ruby, Objective-C, PHP, C#)",9188,34735,https://avatars.githubusercontent.com/u/7802525?v=4
67702184,Magisk,topjohnwu/Magisk,C++,943,The Magic Mask for Android,6801,27101,https://avatars.githubusercontent.com/u/7337301?v=4
4524181,folly,facebook/folly,C++,324,An open-source C++ library developed and used at Facebook.,4687,22181,https://avatars.githubusercontent.com/u/69631?v=4
143455116,filament,google/filament,C++,228,"Filament is a real-time physically based rendering engine for Android, iOS, Windows, Linux, macOS, and WebGL2",1407,14214,https://avatars.githubusercontent.com/u/1342004?v=4
102692863,onnx,onnx/onnx,C++,246,Open standard for machine learning interoperability,2808,12763,https://avatars.githubusercontent.com/u/31675368?v=4
5736080,FreeCAD,FreeCAD/FreeCAD,C++,271,"This is the official source code of FreeCAD, a free and opensource multiplatform 3D parametric modeler.",2808,11616,https://avatars.githubusercontent.com/u/2306237?v=4
6930489,watchman,facebook/watchman,C++,94,"Watches files and records, or triggers actions, when they change. ",905,10953,https://avatars.githubusercontent.com/u/69631?v=4
365005377,btop,aristocratos/btop,C++,420,A monitor of resources,267,7628,https://avatars.githubusercontent.com/u/59659483?u=013726d4c29cc927a5beda366ad3d023a2c6e766&v=4
6486826,ppsspp,hrydgard/ppsspp,C++,187,"A PSP emulator for Android, Windows, Mac and Linux, written in C++. Want to contribute? Join us on Discord at https://discord.gg/5NJB6dD or just send pull requests / issues. For discussion use the forums on ppsspp.org.",1809,7467,https://avatars.githubusercontent.com/u/130929?u=3f6a75a1ef554e8faac09efa30c4d8f0c826a231&v=4
156939672,onnxruntime,microsoft/onnxruntime,C++,298,"ONNX Runtime: cross-platform, high performance ML inferencing and training accelerator",1640,7045,https://avatars.githubusercontent.com/u/6154722?v=4
86897963,ZLMediaKit,ZLMediaKit/ZLMediaKit,C++,336,WebRTC/RTSP/RTMP/HTTP/HLS/HTTP-FLV/WebSocket-FLV/HTTP-TS/HTTP-fMP4/WebSocket-TS/WebSocket-fMP4/GB28181/SRT server and client framework based on C++11,1891,6843,https://avatars.githubusercontent.com/u/84565724?v=4
39211337,engine,flutter/engine,C++,111,The Flutter engine,4516,5877,https://avatars.githubusercontent.com/u/14101776?v=4
99919302,doris,apache/doris,C++,300,Apache Doris is an MPP-based interactive SQL data warehousing for reporting and analysis.,1478,4620,https://avatars.githubusercontent.com/u/47359?v=4
244694174,connectedhomeip,project-chip/connectedhomeip,C++,233,"Matter (formerly Project CHIP) is creating more connections between more objects, simplifying development for manufacturers and increasing compatibility for consumers,  guided by the Connectivity Standards Alliance (formerly Zigbee Alliance).",861,3932,https://avatars.githubusercontent.com/u/61027988?v=4
470730648,Hyprland,hyprwm/Hyprland,C++,963,Hyprland is a dynamic tiling Wayland compositor that doesn't sacrifice on its looks.,50,1662,https://avatars.githubusercontent.com/u/107882187?v=4
427306303,Kyty,InoriRus/Kyty,C++,1099,PS4 & PS5 emulator,66,1401,https://avatars.githubusercontent.com/u/7149418?v=4
444900243,symforce,symforce-org/symforce,C++,526,"Fast symbolic computation, code generation, and nonlinear optimization for robotics",81,859,https://avatars.githubusercontent.com/u/72229494?v=4
436366606,CodeHelp-DSA-Busted-Series,loveBabbar/CodeHelp-DSA-Busted-Series,C++,106,This repo is creating providing students easy access to all the programs taught under Codehelp's DSA Busted Series.,611,840,https://avatars.githubusercontent.com/u/29489915?u=fcf37f59ad74d0389bcb06a49c324a4cab771e4e&v=4
493029626,Akebi-GC,Akebi-Group/Akebi-GC,C++,371,The great software for some game that exploiting anime girls (and boys).,104,464,https://avatars.githubusercontent.com/u/105681966?v=4
491862462,SoftGLRender,keith2018/SoftGLRender,C++,213,Tiny C++ Software Renderer / Rasterizer,57,322,https://avatars.githubusercontent.com/u/23111762?u=3e2e530b58b0f692228b33eb15018bae52c7c658&v=4
