id,name,full_name,language,new stars,description,forks_count,stargazers_count,avatar_url
15634981,godot,godotengine/godot,C++,256,Godot Engine – Multi-platform 2D and 3D game engine,16698,79285,https://avatars.githubusercontent.com/u/6318500?v=4
1181927,bitcoin,bitcoin/bitcoin,C++,266,Bitcoin Core integration/staging tree,36389,73092,https://avatars.githubusercontent.com/u/528860?v=4
619959033,gpt4all,nomic-ai/gpt4all,C++,1192,gpt4all: open-source LLM chatbots that you can run anywhere,6600,59241,https://avatars.githubusercontent.com/u/102670180?v=4
22067521,imgui,ocornut/imgui,C++,179,Dear ImGui: Bloat-free Graphical User interface for C++ with minimal dependencies,9448,52953,https://avatars.githubusercontent.com/u/8225057?u=de42cf0fa1f1970187db446beea30c61b9c1e6d3&v=4
116167731,yuzu,yuzu-emu/yuzu,C++,145,Nintendo Switch emulator,2789,32750,https://avatars.githubusercontent.com/u/35075882?v=4
311683390,ImHex,WerWolv/ImHex,C++,134,"🔍 A Hex Editor for Reverse Engineers, Programmers and people who value their retinas when working at 3 AM.",1559,31330,https://avatars.githubusercontent.com/u/10835354?u=df34a21c99e8b5470fb39a106d328372e7abc115&v=4
63477612,C-Plus-Plus,TheAlgorithms/C-Plus-Plus,C++,932,"Collection of various algorithms in mathematics, machine learning, computer science and physics implemented in C++ for educational purposes.",6890,28016,https://avatars.githubusercontent.com/u/20487725?v=4
1217614,xbmc,xbmc/xbmc,C++,55,"Kodi is an award-winning free and open source home theater/media center software and entertainment hub for digital media. With its beautiful interface and powerful skinning engine, it's available for Android, BSD, Linux, macOS, iOS, tvOS and Windows.",6260,16758,https://avatars.githubusercontent.com/u/199122?v=4
5736080,FreeCAD,FreeCAD/FreeCAD,C++,105,"This is the official source code of FreeCAD, a free and opensource multiplatform 3D parametric modeler.",3601,16189,https://avatars.githubusercontent.com/u/2306237?v=4
2200856,Marlin,MarlinFirmware/Marlin,C++,37,Marlin is an optimized firmware for RepRap 3D printers based on the Arduino platform. Many commercial 3D printers come with Marlin installed. Check with your vendor if you need source code for your specific machine.,18856,15568,https://avatars.githubusercontent.com/u/10418365?v=4
615869301,LocalAI,mudler/LocalAI,C++,261,":robot: The free, Open Source OpenAI alternative. Self-hosted, community-driven and local-first. Drop-in replacement for OpenAI running on consumer-grade hardware. No GPU required. Runs ggml, gguf, GPTQ, onnx, TF compatible models: llama, llama2, rwkv, whisper, vicuna, koala, cerebras, falcon, dolly, starcoder, and many others",1308,15056,https://avatars.githubusercontent.com/u/2420543?u=88a72adb708b5bf2ca40acda912778e65ac4cf43&v=4
470730648,Hyprland,hyprwm/Hyprland,C++,199,Hyprland is a highly customizable dynamic tiling Wayland compositor that doesn't sacrifice on its looks.,496,13235,https://avatars.githubusercontent.com/u/107882187?v=4
20976138,Stockfish,official-stockfish/Stockfish,C++,52,A free and strong UCI chess engine,2151,9922,https://avatars.githubusercontent.com/u/7926882?v=4
438803890,Sunshine,LizardByte/Sunshine,C++,185,Self-hosted game stream host for Moonlight.,431,9326,https://avatars.githubusercontent.com/u/84790584?v=4
1204412,TrinityCore,TrinityCore/TrinityCore,C++,44,"TrinityCore Open Source MMO Framework (master = 10.2.0.52649, 3.3.5 = 3.3.5a.12340)",5906,8768,https://avatars.githubusercontent.com/u/539602?v=4
114128199,multipass,canonical/multipass,C++,50,Multipass orchestrates virtual Ubuntu instances,633,6931,https://avatars.githubusercontent.com/u/53057619?v=4
32231207,endless-sky,endless-sky/endless-sky,C++,26,"Space exploration, trading, and combat game.",922,4702,https://avatars.githubusercontent.com/u/11450262?v=4
514553345,OrcaSlicer,SoftFever/OrcaSlicer,C++,150,"G-code generator for 3D printers (Bambu, Prusa, Voron, VzBot, RatRig, Creality, etc.)",412,3573,https://avatars.githubusercontent.com/u/103989404?u=b07a80c2bad1dc452303b696bd6cf67d040c398d&v=4
48289924,ESPAsyncWebServer,me-no-dev/ESPAsyncWebServer,C++,57,Async Web Server for ESP8266 and ESP32,1094,3274,https://avatars.githubusercontent.com/u/12663778?u=73fccd3b044318b8c0dece627b58c0ad608d65ba&v=4
11489037,rathena,rathena/rathena,C++,7,rAthena is an open-source cross-platform MMORPG server.,2181,2615,https://avatars.githubusercontent.com/u/1776606?v=4
237647258,firmware,meshtastic/firmware,C++,48,Meshtastic device firmware,501,2282,https://avatars.githubusercontent.com/u/61627050?v=4
168555392,REFramework,praydog/REFramework,C++,44,"Scripting platform, modding framework and VR support for all RE Engine games",308,2261,https://avatars.githubusercontent.com/u/2909949?v=4
659205972,tachyon,kroma-network/tachyon,C++,361,Modular ZK(Zero Knowledge) backend accelerated by GPU,29,924,https://avatars.githubusercontent.com/u/126645000?v=4
361430837,VoxelEngine-Cpp,MihailRis/VoxelEngine-Cpp,C++,43,Minecraft-like game engine in C++ with OpenGL,30,245,https://avatars.githubusercontent.com/u/20257603?u=88de22f6f94abf7162e8439b59cf80b26d81a505&v=4
439002575,GDH,TobyAdd/GDH,C++,25,Cheat menu for Geometry Dash. Powered by ImGui,17,96,https://avatars.githubusercontent.com/u/66429886?u=caa123e817ad2becdc789ed906cdf80c982ea4f3&v=4
