id,name,full_name,language,new stars,description,forks_count,stargazers_count,avatar_url
83222441,system-design-primer,donnemartin/system-design-primer,Python,2884,Learn how to design large-scale systems. Prep for the system design interview.  Includes Anki flashcards.,41961,241351,https://avatars.githubusercontent.com/u/5458997?u=f1007b583e55e7ccfb6ccf0e200051156112dd9b&v=4
63476337,Python,TheAlgorithms/Python,Python,281,All Algorithms implemented in Python,43634,174481,https://avatars.githubusercontent.com/u/20487725?v=4
307260205,yt-dlp,yt-dlp/yt-dlp,Python,636,A youtube-dl fork with additional features and fixes,5209,63455,https://avatars.githubusercontent.com/u/79589310?v=4
74627617,openpilot,commaai/openpilot,Python,904,openpilot is an open source driver assistance system. openpilot performs the functions of Automated Lane Centering and Adaptive Cruise Control for 250+ supported car makes and models.,8185,45436,https://avatars.githubusercontent.com/u/16128714?v=4
458648791,paperless-ngx,paperless-ngx/paperless-ngx,Python,1058,"A community-supported supercharged version of paperless: scan, index and archive all your physical documents",711,14458,https://avatars.githubusercontent.com/u/99562962?v=4
167694194,frigate,blakeblackshear/frigate,Python,179,NVR with realtime local object detection for IP cameras,1178,12690,https://avatars.githubusercontent.com/u/569905?u=a454086144f531389a73fbea93a7835eea06f2a1&v=4
710159073,ChatGLM3,THUDM/ChatGLM3,Python,413,ChatGLM3 series: Open Bilingual Chat LLMs | 开源双语对话语言模型,874,8162,https://avatars.githubusercontent.com/u/48590610?v=4
725089041,OpenVoice,myshell-ai/OpenVoice,Python,5503,Instant voice cloning by MyShell.,531,7578,https://avatars.githubusercontent.com/u/127754094?v=4
559584476,kohya_ss,bmaltais/kohya_ss,Python,114,,936,7029,https://avatars.githubusercontent.com/u/7474674?u=9080e36bd542746d6ecd104f11b22ce8c5305b0f&v=4
656099147,embedchain,embedchain/embedchain,Python,162,The Open Source RAG framework,1158,6495,https://avatars.githubusercontent.com/u/137054526?v=4
701540574,ml-ferret,apple/ml-ferret,Python,985,,287,5951,https://avatars.githubusercontent.com/u/10639145?v=4
686267501,TinyLlama,jzhang38/TinyLlama,Python,553,The TinyLlama project is an open endeavor to pretrain a 1.1B Llama model on 3 trillion tokens.,201,4305,https://avatars.githubusercontent.com/u/42993249?v=4
692935244,CogVLM,THUDM/CogVLM,Python,255,a state-of-the-art-level open visual language model | 多模态预训练模型,193,3530,https://avatars.githubusercontent.com/u/48590610?v=4
595921199,Jenkins-Zero-To-Hero,iam-veeramalla/Jenkins-Zero-To-Hero,Python,80,"Install Jenkins, configure Docker as slave, set up cicd, deploy applications to k8s using Argo CD in GitOps way.",6120,3522,https://avatars.githubusercontent.com/u/43399466?u=91e78018b666dba78f75f296340e3251942158c9&v=4
549007739,TikTokDownloader,JoeanAmier/TikTokDownloader,Python,451,完全免费开源，基于 Requests 模块实现：TikTok 主页/视频/图集/原声；抖音主页/视频/图集/收藏/直播/原声/合集/评论/账号/搜索/热榜数据采集工具,543,3489,https://avatars.githubusercontent.com/u/49263334?u=42a02c220c618b58a61c1f9e4a39b506cee241de&v=4
733899994,AppAgent,mnotgod96/AppAgent,Python,571,"AppAgent: Multimodal Agents as Smartphone Users, an LLM-based multimodal agent framework designed to operate smartphone apps.",265,2824,https://avatars.githubusercontent.com/u/27103154?v=4
569959091,FunASR,alibaba-damo-academy/FunASR,Python,309,A Fundamental End-to-End Speech Recognition Toolkit and Open Source SOTA Pretrained Models.,256,2106,https://avatars.githubusercontent.com/u/115537614?v=4
663667786,Rope,Hillobar/Rope,Python,332,GUI-focused roop,266,1868,https://avatars.githubusercontent.com/u/63615199?v=4
479415631,shuyuan,shidahuilang/shuyuan,Python,623,香色闺阁+阅读3.0书源+源阅读+爱阅书香+花火阅读+读不舍手+IPTV源+IPA巨魔应用=自动更新,104,1774,https://avatars.githubusercontent.com/u/81285256?u=9385184eff1719df340d0349fd637919ad51ff47&v=4
653171718,promptbench,microsoft/promptbench,Python,306,A unified evaluation framework for large language models,112,1603,https://avatars.githubusercontent.com/u/6154722?v=4
710601088,crewAI,joaomdmoura/crewAI,Python,830,,133,1443,https://avatars.githubusercontent.com/u/667063?u=c0ea6956bba58ee8baabb6568f0374263ed96f1d&v=4
664870244,Emu,baaivision/Emu,Python,187,Emu Series: Generative Multimodal Models from BAAI,70,1262,https://avatars.githubusercontent.com/u/118160626?v=4
681002458,mergekit,cg123/mergekit,Python,215,Tools for merging pretrained large language models.,92,952,https://avatars.githubusercontent.com/u/397199?v=4
652336197,Wall-of-Flippers,K3YOMI/Wall-of-Flippers,Python,99,A simple and easy way to find Flipper Zero Devices and Bluetooth Low Energy Based Attacks,31,400,https://avatars.githubusercontent.com/u/54733885?u=d3dfe17b4e47b371c280c391cdf2b87ed2e62cc1&v=4
693307640,atomicals-electrumx,atomicals/atomicals-electrumx,Python,31,Electrumx Atomicals Indexer Server,35,111,https://avatars.githubusercontent.com/u/127462044?u=32fd59f682ae810f4409f9f61f73ac1ee166e90e&v=4
