id,name,full_name,language,new stars,description,forks_count,stargazers_count,avatar_url
23096959,go,golang/go,Go,52,The Go programming language,14312,95801,https://avatars.githubusercontent.com/u/4314092?v=4
48378947,frp,fatedier/frp,Go,44,A fast reverse proxy to help you expose a local server behind a NAT or firewall to the internet.,9768,53651,https://avatars.githubusercontent.com/u/7346661?u=721c6ac19c725486a09c728572e7aee0460e42c0&v=4
6838921,prometheus,prometheus/prometheus,Go,19,The Prometheus monitoring system and time series database.,6839,41208,https://avatars.githubusercontent.com/u/3380462?v=4
29261473,minio,minio/minio,Go,26,"High Performance, Kubernetes Native Object Storage",3676,31842,https://avatars.githubusercontent.com/u/695951?v=4
72495579,gitea,go-gitea/gitea,Go,20,"Git with a cup of tea, painless self-hosted git service",3585,28535,https://avatars.githubusercontent.com/u/12724356?v=4
13124802,influxdb,influxdata/influxdb,Go,30,"Scalable datastore for metrics, events, and real-time analytics",3122,23064,https://avatars.githubusercontent.com/u/5713248?v=4
18369373,viper,spf13/viper,Go,8,Go configuration with fangs,1602,18378,https://avatars.githubusercontent.com/u/173412?u=4865036ec60149f8354adcae563ff5cba01e0022&v=4
11008207,vitess,vitessio/vitess,Go,14,Vitess is a database clustering system for horizontal scaling of MySQL.,1702,13411,https://avatars.githubusercontent.com/u/33043890?v=4
100982449,argo-workflows,argoproj/argo-workflows,Go,11,Workflow engine for Kubernetes,2050,10522,https://avatars.githubusercontent.com/u/30269780?v=4
109162639,thanos,thanos-io/thanos,Go,9,Highly available Prometheus setup with long term storage capabilities. A CNCF Incubating project.,1509,10046,https://avatars.githubusercontent.com/u/49725059?v=4
208728772,milvus,milvus-io/milvus,Go,21,An open-source vector database for scalable similarity search and AI applications.,1443,9560,https://avatars.githubusercontent.com/u/51735404?v=4
11206255,sarama,Shopify/sarama,Go,4,Sarama is a Go library for Apache Kafka.,1423,8204,https://avatars.githubusercontent.com/u/8085?v=4
370977430,Open-IM-Server,OpenIMSDK/Open-IM-Server,Go,20,OpenIM: Instant messaging open source project based on go built by former WeChat technology experts. Backend in Go.ï¼ˆç”±å‰å¾®ä¿¡æŠ€æœ¯ä¸“å®¶æ‰“é€ çš„åŸºäº Go å®ç°çš„å³æ—¶é€šè®¯ï¼ˆIMï¼‰é¡¹ç›®ï¼Œä»æœåŠ¡ç«¯åˆ°å®¢æˆ·ç«¯SDKå¼€æºå³æ—¶é€šè®¯ï¼ˆIMï¼‰æ•´ä½“è§£å†³æ–¹æ¡ˆï¼Œå¯ä»¥è½»æ¾æ›¿ä»£ç¬¬ä¸‰æ–¹IMäº‘æœåŠ¡ï¼Œæ‰“é€ å…·å¤‡èŠå¤©ã€ç¤¾äº¤åŠŸèƒ½çš„appã€‚ï¼‰,947,6562,https://avatars.githubusercontent.com/u/84842645?v=4
106704041,air,cosmtrek/air,Go,28,â˜ï¸ Live reload for Go apps,427,6155,https://avatars.githubusercontent.com/u/8832222?v=4
94173064,filestash,mickael-kerjean/filestash,Go,20,"ğŸ¦„ A modern web client for SFTP, S3, FTP, WebDAV, Git, Minio, LDAP, CalDAV, CardDAV, Mysql, Backblaze, ...",401,5656,https://avatars.githubusercontent.com/u/13233076?v=4
120519269,atlantis,runatlantis/atlantis,Go,9,Terraform Pull Request Automation,638,4484,https://avatars.githubusercontent.com/u/32311288?v=4
212465715,buf,bufbuild/buf,Go,27,A new way of working with Protocol Buffers.,106,3747,https://avatars.githubusercontent.com/u/54191850?v=4
18372716,tunny,Jeffail/tunny,Go,8,A goroutine pool for Go,252,2876,https://avatars.githubusercontent.com/u/3921142?u=fe0d6a57975fe51ab8e0e5890b8750e92b72e852&v=4
187086161,opentelemetry-go,open-telemetry/opentelemetry-go,Go,2,OpenTelemetry Go API and SDK,531,2348,https://avatars.githubusercontent.com/u/49998002?v=4
126576769,velociraptor,Velocidex/velociraptor,Go,6,Digging Deeper....,204,1115,https://avatars.githubusercontent.com/u/36671444?v=4
403559729,yao,YaoApp/yao,Go,232,Yao A low code engine to create web services and dashboard.,44,712,https://avatars.githubusercontent.com/u/61642237?v=4
351043495,teller,SpectralOps/teller,Go,10,A secrets management tool for developers built in Go - never leave your command line for secrets.,104,649,https://avatars.githubusercontent.com/u/58907701?v=4
434059318,minerProxy,Char1esOrz/minerProxy,Go,4,"ä»¥å¤ªåŠçŸ¿æ± ä»£ç†,å¯ä»¥è‡ªå®šä¹‰æŠ½æ°´åœ°å€å’Œæ¯”ä¾‹ ,goè¯­è¨€ç¼–å†™,æ€§èƒ½æé«˜ã€‚æŒ‚å‡ ä¸ªç›—ç‰ˆç‹—minerproxyeth/minerproxyå’ŒMinerPr0xy/MinerProxyå’Œnicococococ/MinerProxyLiteå’ŒCharIesOrz/minerProxyå’Œryu-shen/minerProxyéƒ½æ˜¯ç›—ç‰ˆåŠ æ–™çš„ï¼Œå¤§å®¶æ³¨æ„åˆ†è¾¨,å¯ä»¥æŸ¥çœ‹git commitsè®°å½•æŸ¥çœ‹è°å…ˆå‘å¸ƒçš„",123,279,https://avatars.githubusercontent.com/u/28600640?u=8ae60c0ce250e106155b84815c9354dc2a35e758&v=4
442716595,mogo,shimohq/mogo,Go,22,A light weight log visual analytic platform  for clickhouse.,36,264,https://avatars.githubusercontent.com/u/13383310?v=4
449649393,keploy,keploy/keploy,Go,23,No code API testing platform. Create unit tests and data mocks from API calls. ,14,247,https://avatars.githubusercontent.com/u/92252339?v=4
