id,name,full_name,language,new stars,description,forks_count,stargazers_count,avatar_url
28457823,freeCodeCamp,freeCodeCamp/freeCodeCamp,TypeScript,945,freeCodeCamp.org's open-source codebase and curriculum. Learn to code for free.,34133,375555,https://avatars.githubusercontent.com/u/9892522?v=4
13491895,free-programming-books,EbookFoundation/free-programming-books,,1401,:books: Freely available programming books,57706,300103,https://avatars.githubusercontent.com/u/14127308?v=4
14440270,You-Dont-Know-JS,getify/You-Dont-Know-JS,,311,A book series on JavaScript. @YDKJS on twitter.,33125,171972,https://avatars.githubusercontent.com/u/150330?u=41aa48771028d34bcf025eefe919bf75fbda77d4&v=4
63477660,Java,TheAlgorithms/Java,Java,358,All Algorithms implemented in Java,18442,54127,https://avatars.githubusercontent.com/u/20487725?v=4
233472199,Microsoft-Activation-Scripts,massgravel/Microsoft-Activation-Scripts,Batchfile,2169,"A Windows and Office activator using HWID / KMS38 / Online KMS activation methods, with a focus on open-source code and fewer antivirus detections.",4769,45771,https://avatars.githubusercontent.com/u/59795046?v=4
180190854,appwrite,appwrite/appwrite,TypeScript,3245,Build like a team of hundreds_,3311,36545,https://avatars.githubusercontent.com/u/25003669?v=4
400215964,novu,novuhq/novu,TypeScript,4391,🔥 The open-source notification infrastructure with fully functional embedded notification center 🚀🚀🚀,2426,28878,https://avatars.githubusercontent.com/u/77433905?v=4
352933140,ToolJet,ToolJet/ToolJet,JavaScript,2910,"Low-code platform for building business applications. Connect to databases, cloud storages, GraphQL, API endpoints, Airtable, Google sheets, OpenAI, etc and build apps using drag and drop application builder. Built using JavaScript/TypeScript. 🚀",2272,23558,https://avatars.githubusercontent.com/u/82193554?v=4
43160685,zulip,zulip/zulip,Python,86,Zulip server and web application. Open-source team chat that helps teams stay productive and focused.,6670,18535,https://avatars.githubusercontent.com/u/4921959?v=4
16989371,MagicMirror,MichMich/MagicMirror,JavaScript,96,"MagicMirror² is an open source modular smart mirror platform. With a growing list of installable modules, the MagicMirror² allows you to convert your hallway or bathroom mirror into your personal assistant.",4054,18204,https://avatars.githubusercontent.com/u/210954?v=4
189621607,docs,github/docs,JavaScript,221,The open-source repo for docs.github.com,61619,14683,https://avatars.githubusercontent.com/u/9919?v=4
307213173,openai-python,openai/openai-python,Python,814,The official Python library for the OpenAI API,1779,12245,https://avatars.githubusercontent.com/u/14957082?v=4
519882617,leptos,leptos-rs/leptos,Rust,177,Build fast web applications with Rust.,449,12144,https://avatars.githubusercontent.com/u/118319153?v=4
596516907,DocsGPT,arc53/DocsGPT,Python,2238,"GPT-powered chat for documentation, chat with your documents",887,9049,https://avatars.githubusercontent.com/u/103419759?v=4
528313152,homepage,gethomepage/homepage,JavaScript,289,A highly customizable homepage (or startpage / application dashboard) with Docker and service API integrations.,508,8921,https://avatars.githubusercontent.com/u/122929872?v=4
315490189,OpenCore-Legacy-Patcher,dortania/OpenCore-Legacy-Patcher,Python,700,Experience macOS just like before,864,8608,https://avatars.githubusercontent.com/u/46268266?v=4
680120071,autogen,microsoft/autogen,Jupyter Notebook,4401,Enable Next-Gen Large Language Model Applications. Join our Discord: https://discord.gg/pAbnFJrkgZ,634,6626,https://avatars.githubusercontent.com/u/6154722?v=4
509091576,sing-box,SagerNet/sing-box,Go,185,The universal proxy platform,607,5174,https://avatars.githubusercontent.com/u/83217677?v=4
542284380,bruno,usebruno/bruno,JavaScript,3095,Opensource IDE For Exploring and Testing Api's (lightweight alternative to postman/insomnia),132,4135,https://avatars.githubusercontent.com/u/114530840?v=4
697302510,mistral-src,mistralai/mistral-src,Python,1172,Reference implementation of Mistral AI 7B v0.1 model.,167,3024,https://avatars.githubusercontent.com/u/132372032?v=4
514553345,OrcaSlicer,SoftFever/OrcaSlicer,C++,125,"G-code generator for 3D printers (Bambu, Prusa, Voron, VzBot, RatRig, Creality, etc.)",263,2242,https://avatars.githubusercontent.com/u/103989404?u=b07a80c2bad1dc452303b696bd6cf67d040c398d&v=4
671269505,litellm,BerriAI/litellm,Python,268,"Call all LLM APIs using the OpenAI format. Use Azure, OpenAI, Cohere, Anthropic, Ollama, VLLM, Sagemaker, HuggingFace, Replicate (100+ LLMs)",128,1786,https://avatars.githubusercontent.com/u/121462774?v=4
697339753,dreamgaussian,dreamgaussian/dreamgaussian,Python,1120,Generative Gaussian Splatting for Efficient 3D Content Creation,110,1747,https://avatars.githubusercontent.com/u/146207981?v=4
686983834,vizro,mckinsey/vizro,Python,467,Vizro is a toolkit for creating modular data visualization applications.,45,1415,https://avatars.githubusercontent.com/u/4265350?v=4
696990839,Sigma-Web-Dev-Course,CodeWithHarry/Sigma-Web-Dev-Course,HTML,617,Source Code for Sigma Web Development Course,260,892,https://avatars.githubusercontent.com/u/48705673?u=472aded90489332ecedb819278fc2cfbe485e4da&v=4
