id,name,full_name,language,new stars,description,forks_count,stargazers_count,avatar_url
22790488,java-design-patterns,iluwatar/java-design-patterns,Java,136,Design patterns implemented in Java,25579,83988,https://avatars.githubusercontent.com/u/582346?u=7aecf4c397c8dffaf0b84bd4c9d4198290f00de1&v=4
63477660,Java,TheAlgorithms/Java,Java,351,All Algorithms implemented in Java,18398,54058,https://avatars.githubusercontent.com/u/20487725?v=4
7613257,selenium,SeleniumHQ/selenium,Java,112,A browser automation framework and ecosystem.,7814,27933,https://avatars.githubusercontent.com/u/983927?v=4
41889031,NewPipe,TeamNewPipe/NewPipe,Java,104,A libre lightweight streaming front-end for Android.,2777,25456,https://avatars.githubusercontent.com/u/22159318?v=4
44804216,termux-app,termux/termux-app,Java,220,Termux - a terminal emulator application for Android OS extendible by variety of packages.,2850,25124,https://avatars.githubusercontent.com/u/8104776?v=4
2990192,Signal-Android,signalapp/Signal-Android,Java,49,A private messenger for Android.,5912,24092,https://avatars.githubusercontent.com/u/702459?v=4
89822531,Mindustry,Anuken/Mindustry,Java,152,The automation tower defense RTS,2645,19212,https://avatars.githubusercontent.com/u/10100000?u=614db4c9ac9d539c72840ca9c2b7e522efe1b0c1&v=4
85371262,Algorithms,williamfiset/Algorithms,Java,177,A collection of algorithms and data structures,4091,15470,https://avatars.githubusercontent.com/u/5898848?u=a15cc2ea56c35736424b178b0794da2642284931&v=4
482520194,Grasscutter,Grasscutters/Grasscutter,Java,55,A server software reimplementation for a certain anime game.,4343,14347,https://avatars.githubusercontent.com/u/104039209?v=4
391055597,DSA-Bootcamp-Java,kunal-kushwaha/DSA-Bootcamp-Java,Java,119,"This repository consists of the code samples, assignments, and notes for the Java data structures & algorithms + interview preparation bootcamp of WeMakeDevs.",8952,13546,https://avatars.githubusercontent.com/u/42698533?u=49bc72f21fee9f03e15be699ff035c7741d716e4&v=4
19257422,questdb,questdb/questdb,Java,182,An open source time-series database for fast ingest and SQL queries,987,12735,https://avatars.githubusercontent.com/u/52297642?v=4
139914932,quarkus,quarkusio/quarkus,Java,40,Quarkus: Supersonic Subatomic Java. ,2355,12338,https://avatars.githubusercontent.com/u/47638783?v=4
75882172,conductor,Netflix/conductor,Java,420,Conductor is a microservices orchestration engine.,2261,10720,https://avatars.githubusercontent.com/u/913567?v=4
231921809,supertokens-core,supertokens/supertokens-core,Java,69,Open source alternative to Auth0 / Firebase Auth / AWS Cognito ,377,10158,https://avatars.githubusercontent.com/u/50478857?v=4
46398090,datahub,datahub-project/datahub,Java,146,The Metadata Platform for the Modern Data Stack,2444,8469,https://avatars.githubusercontent.com/u/78121374?v=4
33816473,testcontainers-java,testcontainers/testcontainers-java,Java,30,"Testcontainers is a Java library that supports JUnit tests, providing lightweight, throwaway instances of common databases, Selenium web browsers, or anything else that can run in a Docker container.",1535,7379,https://avatars.githubusercontent.com/u/13393021?v=4
5244445,AntennaPod,AntennaPod/AntennaPod,Java,35,A podcast manager for Android,1256,5201,https://avatars.githubusercontent.com/u/10713470?v=4
60377070,vespa,vespa-engine/vespa,Java,150,The open big data serving engine. https://vespa.ai,558,4870,https://avatars.githubusercontent.com/u/29299694?v=4
49610798,TelegramBots,rubenlagus/TelegramBots,Java,15,Java library to create bots using Telegram Bots API,1127,4018,https://avatars.githubusercontent.com/u/2874352?u=df14ba64316d56167c87c246021a5246756e3583&v=4
60561834,android,nextcloud/android,Java,12,📱 Nextcloud Android app,1664,3593,https://avatars.githubusercontent.com/u/19211038?v=4
594155488,Stirling-PDF,Frooodle/Stirling-PDF,Java,520,locally hosted web application that allows you to perform various operations on PDF files,167,2720,https://avatars.githubusercontent.com/u/77850077?u=6a9b596bb97f3ddfcf8c50a9294c8d15a69d43bd&v=4
442405131,LakeSoul,lakesoul-io/LakeSoul,Java,124,"LakeSoul is an end-to-end, realtime and cloud native Lakehouse framework with fast data ingestion, concurrent update and incremental data analytics on cloud storages for both BI and AI applications.",350,1627,https://avatars.githubusercontent.com/u/132748458?v=4
142085119,Velocity,PaperMC/Velocity,Java,8,"The modern, next-generation Minecraft server proxy.",442,1441,https://avatars.githubusercontent.com/u/7608950?v=4
694009642,bindiff,google/bindiff,Java,431,Quickly find differences and similarities in disassembled code,66,1281,https://avatars.githubusercontent.com/u/1342004?v=4
659402878,spring-ai,spring-projects-experimental/spring-ai,Java,53,An Application Framework for AI Engineering,58,291,https://avatars.githubusercontent.com/u/45858759?v=4
