id,name,full_name,language,new stars,description,forks_count,stargazers_count,avatar_url
35955666,the-art-of-command-line,jlevy/the-art-of-command-line,,6168,"Master the command line, in one page",12500,122455,https://avatars.githubusercontent.com/u/2058167?u=b5317cb662c72e859da8a39969013e5c809dbfd0&v=4
34526884,ant-design,ant-design/ant-design,TypeScript,889,An enterprise-class UI design language and React UI library,37309,83389,https://avatars.githubusercontent.com/u/12101536?v=4
214587193,supabase,supabase/supabase,TypeScript,1747,The open source Firebase alternative. Follow to stay updated about our public Beta.,2691,42521,https://avatars.githubusercontent.com/u/54469796?v=4
52281283,mastodon,mastodon/mastodon,Ruby,2978,"Your self-hosted, globally interconnected microblogging community",5649,37588,https://avatars.githubusercontent.com/u/24979032?v=4
90563585,cheat.sh,chubin/cheat.sh,Python,2898,the only cheat sheet you need,1640,34055,https://avatars.githubusercontent.com/u/3875145?u=0c0dbcc7f979c86eaa3bb89b412b04d5db4a1bec&v=4
163883279,act,nektos/act,Go,3516,Run your GitHub Actions locally ğŸš€,825,32807,https://avatars.githubusercontent.com/u/3813618?v=4
240215314,awesome-compose,docker/awesome-compose,HTML,819,Awesome Docker Compose samples,3337,20000,https://avatars.githubusercontent.com/u/5429470?v=4
120231691,Ryujinx,Ryujinx/Ryujinx,C#,1850,Experimental Nintendo Switch Emulator written in C#,1755,15493,https://avatars.githubusercontent.com/u/39036280?v=4
525592995,InvokeAI,invoke-ai/InvokeAI,Jupyter Notebook,2983,"This version of Stable Diffusion features a slick WebGUI, an interactive command-line script that combines text2img and img2img functionality in a ""dream bot"" style interface, and multiple features and other enhancements. For more info, see the website link below.",937,8344,https://avatars.githubusercontent.com/u/113954515?v=4
436297812,memos,usememos/memos,TypeScript,2981,"An open-source, self-hosted memo hub with knowledge management and socialization.",248,4427,https://avatars.githubusercontent.com/u/95764151?v=4
58146669,sapling,facebook/sapling,Rust,2743,"A Scalable, User-Friendly Source Control System.",161,4335,https://avatars.githubusercontent.com/u/69631?v=4
541269386,whisper.cpp,ggerganov/whisper.cpp,C,3305,Port of OpenAI's Whisper model in C/C++,271,4145,https://avatars.githubusercontent.com/u/1991296?u=28314d364d7c28f8ec232fadb767970d3ad74e7b&v=4
540917299,reference,jaywcjlove/reference,Dockerfile,2048,ä¸ºå¼€å‘äººå‘˜åˆ†äº«å¿«é€Ÿå‚è€ƒå¤‡å¿˜æ¸…å•(é€ŸæŸ¥è¡¨),523,3879,https://avatars.githubusercontent.com/u/1680273?u=4471b74deb9973096418a93960c664c5ea3bd159&v=4
519882617,leptos,gbj/leptos,Rust,2457,Build fast web applications with Rust.,75,3521,https://avatars.githubusercontent.com/u/286622?u=28c0cc74ebc6da8687eb041c9587622d2288b798&v=4
490465859,Flipper,UberGuidoZ/Flipper,Batchfile,816,Playground (and dump) of stuff I make or modify for the Flipper Zero,639,3333,https://avatars.githubusercontent.com/u/57457139?u=3b283c3083a1fee457b897d7c8fda97b873e9807&v=4
470579591,unleashed-firmware,DarkFlippers/unleashed-firmware,C,946,Flipper Zero Unleashed Firmware,293,3166,https://avatars.githubusercontent.com/u/115378555?v=4
390536799,open_clip,mlfoundations/open_clip,Python,460,An open source implementation of CLIP.,280,2612,https://avatars.githubusercontent.com/u/87461581?v=4
240971104,snarkOS,AleoHQ/snarkOS,Rust,399,A Decentralized Operating System for ZK Applications,600,2232,https://avatars.githubusercontent.com/u/57516293?v=4
564058707,twitter-archive-parser,timhutton/twitter-archive-parser,Python,969,Python code to parse a Twitter archive and output in various ways,107,2114,https://avatars.githubusercontent.com/u/647092?u=891dc826e22b8b42a74a0df108134c692b282cd1&v=4
342854098,gotosocial,superseriousbusiness/gotosocial,Go,676,"Fast, fun, ActivityPub server, powered by Go.",150,1915,https://avatars.githubusercontent.com/u/79751420?v=4
537803484,palera1n,palera1n/palera1n,Shell,823,iOS 15.0-16.2 (semi-)tethered checkm8 jailbreak,189,1673,https://avatars.githubusercontent.com/u/114239186?v=4
509850056,Book4_Power-of-Matrix,Visualize-ML/Book4_Power-of-Matrix,Python,1027,Book_4_ã€ŠçŸ©é˜µåŠ›é‡ã€‹ |   é¸¢å°¾èŠ±ä¹¦ï¼šä»åŠ å‡ä¹˜é™¤åˆ°æœºå™¨å­¦ä¹ ï¼›æœ¬å†Œæœ‰ï¼Œ584å¹…å›¾ï¼Œ81ä¸ªä»£ç æ–‡ä»¶ï¼Œå…¶ä¸­18ä¸ªStreamlit Appï¼›çŠ¶æ€ï¼šæ¸…åç¤¾äº”å®¡äº”æ ¡ä¸­ï¼›Githubç¨¿ä»¶åŸºæœ¬ç¨³å®šï¼Œæ¬¢è¿ææ„è§ï¼Œä¼šåŠæ—¶ä¿®æ”¹,187,1566,https://avatars.githubusercontent.com/u/105787223?u=b35ad4405d5bbcd61f0a2b1cf00911d3f9fd1683&v=4
364304792,TodoApi,davidfowl/TodoApi,C#,785,"Todo application with ASP.NET Core Blazor WASM, Minimal APIs and Authentication ",162,1260,https://avatars.githubusercontent.com/u/95136?u=7c54b5f134fd50fa67af8d3e7604f51626242985&v=4
552661142,langchain,hwchase17/langchain,Python,731,âš¡ Building applications with LLMs through composability âš¡,98,1058,https://avatars.githubusercontent.com/u/11986836?v=4
562338288,sd_dreambooth_extension,d8ahazard/sd_dreambooth_extension,Python,203,,74,446,https://avatars.githubusercontent.com/u/1633844?v=4
