id,name,full_name,language,new stars,description,forks_count,stargazers_count,avatar_url
2325298,linux,torvalds/linux,C,1949,Linux kernel source tree,45827,142761,https://avatars.githubusercontent.com/u/1024025?v=4
111583593,scrcpy,Genymobile/scrcpy,C,1328,Display and control your Android device,7866,73939,https://avatars.githubusercontent.com/u/3427627?v=4
246335987,Ventoy,ventoy/Ventoy,C,1453,A new bootable USB solution.,3066,42481,https://avatars.githubusercontent.com/u/59477474?u=16f38c14b69580f87f4717b71c0e5e85e9559cb1&v=4
1903522,php-src,php/php-src,C,211,The PHP Interpreter,7387,34705,https://avatars.githubusercontent.com/u/25158?v=4
102578345,lede,coolsnowwolf/lede,C,557,Lean's LEDE source,18415,24121,https://avatars.githubusercontent.com/u/31687149?u=caa956c5f80318ea674625f9e9efa49c98335d74&v=4
2810292,rufus,pbatard/rufus,C,394,The Reliable USB Formatting Utility,2149,21026,https://avatars.githubusercontent.com/u/1206968?u=ed1be5451352656cffecc840d661bb793c3bad05&v=4
6201092,mpv,mpv-player/mpv,C,410,🎥 Command line video player,2482,20867,https://avatars.githubusercontent.com/u/2550273?v=4
20159867,stb,nothings/stb,C,291,stb single-file public domain libraries for C/C++,7199,20557,https://avatars.githubusercontent.com/u/7525026?u=a23ba3a549fff291e35446cb32c8979bd29be6c9&v=4
196353673,TDengine,taosdata/TDengine,C,675,"TDengine is an open source, high-performance, cloud native time-series database optimized for Internet of Things (IoT), Connected Cars, Industrial IoT and DevOps.",4561,20202,https://avatars.githubusercontent.com/u/48876650?v=4
80286288,Tasmota,arendst/Tasmota,C,195,"Alternative firmware for ESP8266 with easy configuration using webUI, OTA updates, automation using timers or rules, expandability and entirely local control over MQTT, HTTP, Serial or KNX. Full documentation at",4194,18784,https://avatars.githubusercontent.com/u/11044339?u=b54c71859c551426b6738921138b740804ca1d62&v=4
394318710,ExplorerPatcher,valinet/ExplorerPatcher,C,806,This project aims to enhance the working environment on Windows,545,10069,https://avatars.githubusercontent.com/u/6503598?u=25d850b7dcc57d2a488d83646fff7cca48cf7fc7&v=4
3299208,vlc,videolan/vlc,C,205,"VLC media player - All pull requests are ignored, please follow https://wiki.videolan.org/Sending_Patches_VLC/",3229,9999,https://avatars.githubusercontent.com/u/1389585?v=4
70127218,arduino-esp32,espressif/arduino-esp32,C,200,Arduino core for the ESP32,6201,9757,https://avatars.githubusercontent.com/u/9460735?v=4
65899476,esp-idf,espressif/esp-idf,C,181,Espressif IoT Development Framework. Official development framework for Espressif SoCs.,6009,9552,https://avatars.githubusercontent.com/u/9460735?v=4
50824485,systeminformer,winsiderss/systeminformer,C,200,"A free, powerful, multi-purpose tool that helps you monitor system resources, debug software and detect malware. Brought to you by Winsider Seminars & Solutions, Inc. @ http://www.windows-internals.com",1151,8276,https://avatars.githubusercontent.com/u/105516054?v=4
14049216,cockpit,cockpit-project/cockpit,C,294,Cockpit is a web-based graphical interface for servers.,899,7646,https://avatars.githubusercontent.com/u/5765104?v=4
19112091,thc-hydra,vanhauser-thc/thc-hydra,C,194,hydra,1622,6987,https://avatars.githubusercontent.com/u/7396244?u=952127371f345a18656cb9c91a67cde499fbfdc6&v=4
200321698,chibicc,rui314/chibicc,C,443,A small C compiler,637,6904,https://avatars.githubusercontent.com/u/47400?v=4
7037996,yara,VirusTotal/yara,C,101,The pattern matching swiss knife,1273,6226,https://avatars.githubusercontent.com/u/7701252?v=4
59676171,klipper,Klipper3d/klipper,C,216,Klipper is a 3d-printer firmware,3904,5766,https://avatars.githubusercontent.com/u/90982958?v=4
330008801,SDL,libsdl-org/SDL,C,258,Simple Directmedia Layer,865,4447,https://avatars.githubusercontent.com/u/77683370?v=4
284134871,flipperzero-firmware,flipperdevices/flipperzero-firmware,C,483,Flipper Zero firmware source code,1015,4270,https://avatars.githubusercontent.com/u/57576566?v=4
541269386,whisper.cpp,ggerganov/whisper.cpp,C,2590,Port of OpenAI's Whisper model in C/C++,227,3334,https://avatars.githubusercontent.com/u/1991296?u=28314d364d7c28f8ec232fadb767970d3ad74e7b&v=4
63369078,picom,yshui/picom,C,83,A lightweight compositor for X11,459,3100,https://avatars.githubusercontent.com/u/366851?v=4
470579591,unleashed-firmware,DarkFlippers/unleashed-firmware,C,862,Flipper Zero Unleashed Firmware,283,2964,https://avatars.githubusercontent.com/u/115378555?v=4
