id,name,full_name,language,new stars,description,forks_count,stargazers_count,avatar_url
2325298,linux,torvalds/linux,C,1963,Linux kernel source tree,45825,142722,https://avatars.githubusercontent.com/u/1024025?v=4
111583593,scrcpy,Genymobile/scrcpy,C,1326,Display and control your Android device,7862,73911,https://avatars.githubusercontent.com/u/3427627?v=4
246335987,Ventoy,ventoy/Ventoy,C,1421,A new bootable USB solution.,3061,42440,https://avatars.githubusercontent.com/u/59477474?u=16f38c14b69580f87f4717b71c0e5e85e9559cb1&v=4
102578345,lede,coolsnowwolf/lede,C,556,Lean's LEDE source,18414,24107,https://avatars.githubusercontent.com/u/31687149?u=caa956c5f80318ea674625f9e9efa49c98335d74&v=4
2810292,rufus,pbatard/rufus,C,397,The Reliable USB Formatting Utility,2145,21020,https://avatars.githubusercontent.com/u/1206968?u=ed1be5451352656cffecc840d661bb793c3bad05&v=4
6201092,mpv,mpv-player/mpv,C,409,🎥 Command line video player,2481,20857,https://avatars.githubusercontent.com/u/2550273?v=4
20159867,stb,nothings/stb,C,299,stb single-file public domain libraries for C/C++,7193,20552,https://avatars.githubusercontent.com/u/7525026?u=a23ba3a549fff291e35446cb32c8979bd29be6c9&v=4
196353673,TDengine,taosdata/TDengine,C,667,"TDengine is an open source, high-performance, cloud native time-series database optimized for Internet of Things (IoT), Connected Cars, Industrial IoT and DevOps.",4560,20193,https://avatars.githubusercontent.com/u/48876650?v=4
80286288,Tasmota,arendst/Tasmota,C,199,"Alternative firmware for ESP8266 with easy configuration using webUI, OTA updates, automation using timers or rules, expandability and entirely local control over MQTT, HTTP, Serial or KNX. Full documentation at",4193,18779,https://avatars.githubusercontent.com/u/11044339?u=b54c71859c551426b6738921138b740804ca1d62&v=4
78281075,esp8266_deauther,SpacehuhnTech/esp8266_deauther,C,224,Affordable WiFi hacking platform for testing and learning,2301,10990,https://avatars.githubusercontent.com/u/64325017?v=4
60667730,lvgl,lvgl/lvgl,C,207,"Embedded graphics library to create beautiful UIs for any MCU, MPU and display type. It's boosted by a professional yet affordable drag and drop UI editor, called SquareLine Studio.",2229,10863,https://avatars.githubusercontent.com/u/19811762?v=4
394318710,ExplorerPatcher,valinet/ExplorerPatcher,C,822,This project aims to enhance the working environment on Windows,544,10049,https://avatars.githubusercontent.com/u/6503598?u=25d850b7dcc57d2a488d83646fff7cca48cf7fc7&v=4
3299208,vlc,videolan/vlc,C,207,"VLC media player - All pull requests are ignored, please follow https://wiki.videolan.org/Sending_Patches_VLC/",3228,9996,https://avatars.githubusercontent.com/u/1389585?v=4
70127218,arduino-esp32,espressif/arduino-esp32,C,197,Arduino core for the ESP32,6198,9755,https://avatars.githubusercontent.com/u/9460735?v=4
65899476,esp-idf,espressif/esp-idf,C,175,Espressif IoT Development Framework. Official development framework for Espressif SoCs.,6006,9543,https://avatars.githubusercontent.com/u/9460735?v=4
14049216,cockpit,cockpit-project/cockpit,C,289,Cockpit is a web-based graphical interface for servers.,899,7642,https://avatars.githubusercontent.com/u/5765104?v=4
19112091,thc-hydra,vanhauser-thc/thc-hydra,C,191,hydra,1622,6980,https://avatars.githubusercontent.com/u/7396244?u=952127371f345a18656cb9c91a67cde499fbfdc6&v=4
200321698,chibicc,rui314/chibicc,C,448,A small C compiler,636,6900,https://avatars.githubusercontent.com/u/47400?v=4
59676171,klipper,Klipper3d/klipper,C,214,Klipper is a 3d-printer firmware,3907,5761,https://avatars.githubusercontent.com/u/90982958?v=4
31791482,Windows-driver-samples,microsoft/Windows-driver-samples,C,105,This repo contains driver samples prepared for use with Microsoft Visual Studio and the Windows Driver Kit (WDK). It contains both Universal Windows Driver and desktop-only driver samples.,4576,5686,https://avatars.githubusercontent.com/u/6154722?v=4
330008801,SDL,libsdl-org/SDL,C,257,Simple Directmedia Layer,863,4441,https://avatars.githubusercontent.com/u/77683370?v=4
284134871,flipperzero-firmware,flipperdevices/flipperzero-firmware,C,478,Flipper Zero firmware source code,1008,4258,https://avatars.githubusercontent.com/u/57576566?v=4
541269386,whisper.cpp,ggerganov/whisper.cpp,C,2508,Port of OpenAI's Whisper model in C/C++,222,3220,https://avatars.githubusercontent.com/u/1991296?u=28314d364d7c28f8ec232fadb767970d3ad74e7b&v=4
470579591,unleashed-firmware,DarkFlippers/unleashed-firmware,C,841,Flipper Zero Unleashed Firmware,280,2929,https://avatars.githubusercontent.com/u/115378555?v=4
329933755,pimoroni-pico,pimoroni/pimoroni-pico,C,62,Libraries and examples to support Pimoroni Pico add-ons in C++ and MicroPython.,276,738,https://avatars.githubusercontent.com/u/2399917?v=4
