id,name,full_name,language,new stars,description,forks_count,stargazers_count,avatar_url
32484381,free-for-dev,ripienaar/free-for-dev,HTML,1486,"A list of SaaS, PaaS and IaaS offerings that have free tiers of interest to devops and infradev",6910,63263,https://avatars.githubusercontent.com/u/82342?v=4
35969061,styleguide,google/styleguide,HTML,377,Style guides for Google-originated open-source projects,12746,32359,https://avatars.githubusercontent.com/u/1342004?v=4
63484632,fastText,facebookresearch/fastText,HTML,84,Library for fast text representation and classification.,4536,24076,https://avatars.githubusercontent.com/u/16943930?v=4
224663696,alpine,alpinejs/alpine,HTML,300,"A rugged, minimal framework for composing JavaScript behavior in your markup. ",992,22376,https://avatars.githubusercontent.com/u/59030169?v=4
75867720,JavaScript30,wesbos/JavaScript30,HTML,578,30 Day Vanilla JS Challenge,29129,22221,https://avatars.githubusercontent.com/u/176013?u=1d436e62dc32dbbf1bfefb4d658cd67553154c42&v=4
419347358,cs-self-learning,PKUFlyingPig/cs-self-learning,HTML,7738,è®¡ç®—æœºè‡ªå­¦æŒ‡å—,2914,21545,https://avatars.githubusercontent.com/u/60659728?u=6d9732dc87e3cf8d6952b25499519c2c3f289680&v=4
240215314,awesome-compose,docker/awesome-compose,HTML,742,Awesome Docker Compose samples,3270,19778,https://avatars.githubusercontent.com/u/5429470?v=4
26291683,twemoji,twitter/twemoji,HTML,146,Emoji for everyone. https://twemoji.twitter.com/,1717,14938,https://avatars.githubusercontent.com/u/50278?v=4
25659723,dotnet,microsoft/dotnet,HTML,68,"This repo is the official home of .NET on GitHub. It's a great starting point to find many .NET OSS projects from Microsoft and the community, including many that are part of the .NET Foundation.",2122,13146,https://avatars.githubusercontent.com/u/6154722?v=4
223824546,machine-learning-systems-design,chiphuyen/machine-learning-systems-design,HTML,89,"A booklet on machine learning systems design with exercises. NOT the repo for the book ""Designing Machine Learning Systems""",1223,7533,https://avatars.githubusercontent.com/u/11997567?u=a15b7aade7630ac68ca9388a349a999a09021f56&v=4
240419888,vpncn.github.io,vpncn/vpncn.github.io,HTML,479,2022ä¸­å›½ç¿»å¢™è½¯ä»¶VPNæ¨èä»¥åŠç§‘å­¦ä¸Šç½‘é¿å‘ï¼Œç¨³å®šå¥½ç”¨ã€‚å¯¹æ¯”SSRæœºåœºã€è“ç¯ã€V2rayã€è€ç‹VPNã€VPSæ­å»ºæ¢¯å­ç­‰ç§‘å­¦ä¸Šç½‘ä¸ç¿»å¢™è½¯ä»¶ï¼Œä¸­å›½æœ€æ–°ç§‘å­¦ä¸Šç½‘ç¿»å¢™æ¢¯å­VPNä¸‹è½½æ¨èã€‚,1616,7524,https://avatars.githubusercontent.com/u/60838758?u=5c0ddcaece49df42e6a6ae6de818fb2bab426dba&v=4
125241352,tidytuesday,rfordatascience/tidytuesday,HTML,107,Official repo for the #tidytuesday project,2073,5215,https://avatars.githubusercontent.com/u/31736571?v=4
304940629,web-development-resources,markodenic/web-development-resources,HTML,333,Awesome Web Development Resources.,903,5105,https://avatars.githubusercontent.com/u/25146984?u=e54374b9dea923b09dd9ee1c0e30c29fc685cdf3&v=4
281297416,hugo-PaperMod,adityatelange/hugo-PaperMod,HTML,251," A fast, clean, responsive Hugo theme.",1569,5007,https://avatars.githubusercontent.com/u/21258296?u=a66c03831373c2c0e4f7227177650a57bd3f4c7a&v=4
246278216,openwrt-packages,kenzok8/openwrt-packages,HTML,178,openwrtå¸¸ç”¨è½¯ä»¶åŒ…,2372,4088,https://avatars.githubusercontent.com/u/39034242?u=93d00c03b02cae25686ff25c48e60b871a353213&v=4
454015416,cve,trickest/cve,HTML,103,Gather and update all available and newest CVEs with their PoC.,473,3835,https://avatars.githubusercontent.com/u/62057399?v=4
215689781,RuoYi,yangzongzhuan/RuoYi,HTML,178,:tada: (RuoYi)å®˜æ–¹ä»“åº“ åŸºäºSpringBootçš„æƒé™ç®¡ç†ç³»ç»Ÿ æ˜“è¯»æ˜“æ‡‚ã€ç•Œé¢ç®€æ´ç¾è§‚ã€‚ æ ¸å¿ƒæŠ€æœ¯é‡‡ç”¨Springã€MyBatisã€Shiroæ²¡æœ‰ä»»ä½•å…¶å®ƒé‡åº¦ä¾èµ–ã€‚ç›´æ¥è¿è¡Œå³å¯ç”¨,1089,3255,https://avatars.githubusercontent.com/u/19240310?u=2790505072242292c171c88b18244d00fe9db0f0&v=4
390399065,flowbite,themesberg/flowbite,HTML,247,The most popular and open-source library of Tailwind CSS components,354,3203,https://avatars.githubusercontent.com/u/52166837?v=4
34169414,py4e,csev/py4e,HTML,169,Web site for www.py4e.com and source to the Python 3.0 textbook,1617,2134,https://avatars.githubusercontent.com/u/1197222?u=d6dc85c064736ab851c6d9e3318dcdd1be00fb2c&v=4
141455769,blackeye,An0nUD4Y/blackeye,HTML,88,The ultimate phishing tool with 38 websites available!,1281,1642,https://avatars.githubusercontent.com/u/37680540?u=3af9806b5b93d0f1add2ae9b62d4eb8e9bcf2c18&v=4
347434932,epg,iptv-org/epg,HTML,77,EPG (Electronic Program Guide) for thousands of TV channels collected from different sources,274,922,https://avatars.githubusercontent.com/u/55937028?v=4
509765587,programador.cs-reels,Cassianosch/programador.cs-reels,HTML,82,,84,318,https://avatars.githubusercontent.com/u/28737079?u=d9978d1698ede3b520cbe0bedc21514fdfe67bc1&v=4
468079613,Tailwind-Css-UI-Components,jareer12/Tailwind-Css-UI-Components,HTML,43,ğŸš€ Source code of all the components of TailwindsUI.,108,177,https://avatars.githubusercontent.com/u/57962439?u=40f80c42dd51449188ab2a50e0af272df7a29c54&v=4
522612085,Blooket-Cheats,Minesraft2/Blooket-Cheats,HTML,33,Blooket Cheats made by someone who actually knows what they're doing,93,65,https://avatars.githubusercontent.com/u/49218878?u=d7ebd70bbebfe12593d08765fbcb7d727bae8cf5&v=4
319138079,huckleberry,css-for-js/huckleberry,HTML,4,,1532,55,https://avatars.githubusercontent.com/u/75588294?v=4
