id,name,full_name,language,new stars,description,forks_count,stargazers_count,avatar_url
8514,rails,rails/rails,Ruby,244,Ruby on Rails,20831,51980,https://avatars.githubusercontent.com/u/4223?v=4
65252,jekyll,jekyll/jekyll,Ruby,203,:globe_with_meridians: Jekyll is a blog-aware static site generator in Ruby,9946,45771,https://avatars.githubusercontent.com/u/3083652?v=4
8681349,huginn,huginn/huginn,Ruby,228,Create agents that monitor and act on your behalf.  Your agents are standing by!,3357,37134,https://avatars.githubusercontent.com/u/23225142?v=4
2293158,metasploit-framework,rapid7/metasploit-framework,Ruby,270,Metasploit Framework,12776,28990,https://avatars.githubusercontent.com/u/1013671?v=4
308770,devise,heartcombo/devise,Ruby,76,Flexible authentication solution for Rails with Warden.,5502,22905,https://avatars.githubusercontent.com/u/59584037?v=4
538746,ruby,ruby/ruby,Ruby,125,The Ruby Programming Language [mirror],5216,19776,https://avatars.githubusercontent.com/u/210414?v=4
3195124,sidekiq,mperham/sidekiq,Ruby,68,"Simple, efficient background processing for Ruby",2256,12232,https://avatars.githubusercontent.com/u/2911?u=9e18eee0dc7fe4564dba7cdc7e22711a47171a8b&v=4
4095287,rubocop,rubocop/rubocop,Ruby,62,"A Ruby static code analyzer and formatter, based on the community Ruby style guide.",2965,12088,https://avatars.githubusercontent.com/u/10871348?v=4
3314,spree,spree/spree,Ruby,48,Open Source multi-language/multi-currency/multi-store eCommerce platform,4894,12068,https://avatars.githubusercontent.com/u/56702?v=4
52855516,homebrew-core,Homebrew/homebrew-core,Ruby,126,🍻 Default formulae for the missing package manager for macOS (or Linux),11049,11965,https://avatars.githubusercontent.com/u/1503512?v=4
1725199,linguist,github/linguist,Ruby,101,"Language Savant. If your repository's language is being reported incorrectly, send us a pull request!",3867,10558,https://avatars.githubusercontent.com/u/9919?v=4
211588,paper_trail,paper-trail-gem/paper_trail,Ruby,23,Track changes to your rails models,865,6434,https://avatars.githubusercontent.com/u/38986600?v=4
6899875,openproject,opf/openproject,Ruby,116,OpenProject is the leading open source project management software.,1734,6343,https://avatars.githubusercontent.com/u/1756674?v=4
355893,markup,github/markup,Ruby,25,Determines which markup library to use to render a content file (e.g. README) on GitHub,3625,5572,https://avatars.githubusercontent.com/u/9919?v=4
1548802,ransack,activerecord-hackery/ransack,Ruby,27,Object-based searching. ,754,5318,https://avatars.githubusercontent.com/u/5951504?v=4
103766152,explore,github/explore,Ruby,71,Community-curated topic and collection pages on GitHub,11708,3532,https://avatars.githubusercontent.com/u/9919?v=4
79352,mail,mikel/mail,Ruby,21,A Really Ruby Mail Library,910,3486,https://avatars.githubusercontent.com/u/3366?v=4
2050163,aws-sdk-ruby,aws/aws-sdk-ruby,Ruby,10,The official AWS SDK for Ruby.,1219,3404,https://avatars.githubusercontent.com/u/2232217?v=4
614070,rubygems,rubygems/rubygems,Ruby,31,Library packaging and distribution for Ruby.,1679,3226,https://avatars.githubusercontent.com/u/208761?v=4
55288882,homebrew-emacs-plus,d12frosted/homebrew-emacs-plus,Ruby,52,Emacs Plus formulae for the Homebrew package manager,143,1679,https://avatars.githubusercontent.com/u/6507913?u=654b551fe0e08457faac30af46752ab916f28eef&v=4
229187949,homebrew-php,shivammathur/homebrew-php,Ruby,84,:beer: Homebrew tap for PHP 5.6 to 8.3. PHP 8.3 are nightly builds.,105,1492,https://avatars.githubusercontent.com/u/1571086?u=00cd11e19774448c0b7c9a47e2015d280b358ae2&v=4
79618507,fluentd-kubernetes-daemonset,fluent/fluentd-kubernetes-daemonset,Ruby,10,Fluentd daemonset for Kubernetes and it Docker image,949,1135,https://avatars.githubusercontent.com/u/859518?v=4
467296689,bullet_train,bullet-train-co/bullet_train,Ruby,52,The Open Source Ruby on Rails SaaS Template,129,759,https://avatars.githubusercontent.com/u/5976880?v=4
375363780,project-template-react-rails-api,learn-co-curriculum/project-template-react-rails-api,Ruby,5,,473,46,https://avatars.githubusercontent.com/u/6208017?v=4
365723058,phase-4-creating-a-rails-api,learn-co-curriculum/phase-4-creating-a-rails-api,Ruby,5,,421,4,https://avatars.githubusercontent.com/u/6208017?v=4
