id,name,full_name,language,new stars,description,forks_count,stargazers_count,avatar_url
54346799,public-apis,public-apis/public-apis,Python,911,A collective list of free APIs,22438,194745,https://avatars.githubusercontent.com/u/51121562?v=4
2126244,bootstrap,twbs/bootstrap,JavaScript,294,"The most popular HTML, CSS, and JavaScript framework for developing responsive, mobile first projects on the web.",76756,157706,https://avatars.githubusercontent.com/u/2918581?v=4
126577260,javascript-algorithms,trekhleb/javascript-algorithms,JavaScript,1360,ğŸ“ Algorithms and data structures implemented in JavaScript with explanations and links to further readings,23592,142831,https://avatars.githubusercontent.com/u/3000285?u=1e62782f227030b78b7aa78cbbcab5f8a24e658a&v=4
29028775,react-native,facebook/react-native,JavaScript,238,A framework for building native applications using React,22141,103052,https://avatars.githubusercontent.com/u/69631?v=4
23357588,protobuf,protocolbuffers/protobuf,C++,130,Protocol Buffers - Google's data interchange format,14137,54767,https://avatars.githubusercontent.com/u/26310541?v=4
83844720,face_recognition,ageitgey/face_recognition,Python,444,The world's simplest facial recognition api for Python and the command line,12281,44719,https://avatars.githubusercontent.com/u/896692?u=ea39271fb0e41dbfee2431f55e568124e6f4d8cc&v=4
420459569,copilot-docs,github/copilot-docs,Python,1563,Documentation for GitHub Copilot,2111,19290,https://avatars.githubusercontent.com/u/9919?v=4
157166750,lens,lensapp/lens,TypeScript,860,Lens - The way the world runs Kubernetes,957,18453,https://avatars.githubusercontent.com/u/62133242?v=4
65848095,wiki,requarks/wiki,Vue,768,Wiki.js | A modern and powerful wiki app built on Node.js,1936,17477,https://avatars.githubusercontent.com/u/16729233?v=4
262395224,maui,dotnet/maui,C#,263,".NET MAUI is the .NET Multi-platform App UI, a framework for building native device applications spanning mobile, tablet, and desktop.",903,15667,https://avatars.githubusercontent.com/u/9141961?v=4
344191198,Data-Science-For-Beginners,microsoft/Data-Science-For-Beginners,Jupyter Notebook,1143,"10 Weeks, 20 Lessons, Data Science for All!",2164,13255,https://avatars.githubusercontent.com/u/6154722?v=4
11847500,coreutils,uutils/coreutils,Rust,283,Cross-platform Rust rewrite of the GNU coreutils,862,11861,https://avatars.githubusercontent.com/u/5148717?v=4
299628763,30-Days-Of-React,Asabeneh/30-Days-Of-React,JavaScript,1286,"30 Days of  React challenge is a step by step guide to learn React in 30 days. It requires HTML, CSS, and JavaScript knowledge. You should be comfortable with JavaScript before you start to React.  If you are not comfortable with JavaScript check out 30DaysOfJavaScript. This is a continuation of 30 Days Of JS.  This challenge may take more than 100 days, follow your own pace. ",3170,12420,https://avatars.githubusercontent.com/u/9008063?u=ec6ff77196b998a4e6b6e3ca1429c524c169c189&v=4
105963253,reactjs.org,reactjs/reactjs.org,TypeScript,49,The React documentation website,6127,7424,https://avatars.githubusercontent.com/u/6412038?v=4
400501136,mujoco,deepmind/mujoco,C,468,Multi-Joint dynamics with Contact. A general purpose physics simulator.,340,4283,https://avatars.githubusercontent.com/u/8596759?v=4
110688239,PaddleSpeech,PaddlePaddle/PaddleSpeech,C++,631,"Easy-to-use Speech Toolkit including SOTA/Streaming ASR with punctuation, influential TTS with text frontend, Speaker Verification System and End-to-End Speech Simultaneous Translation.",890,4037,https://avatars.githubusercontent.com/u/23534030?v=4
382756807,TechXueXi,TechXueXi/TechXueXi,Python,91,å¼ºå›½é€š ç§‘æŠ€å¼ºå›½ å­¦ä¹ å¼ºå›½ xuexiqiangguo å…¨ç½‘æœ€å¥½ç”¨å¼€æºç½‘é¡µå­¦ä¹ å¼ºå›½åŠ©æ‰‹ï¼šTechXueXi ï¼ˆæ‡’äººåˆ·åˆ†å·¥å…· è‡ªåŠ¨å­¦ä¹ ï¼‰æŠ€æœ¯å¼ºå›½ï¼Œæ”¯æŒç­”é¢˜ï¼Œæ”¯æŒ docker 45åˆ†/å¤©,864,3206,https://avatars.githubusercontent.com/u/63344348?v=4
453068084,risingwave,singularity-data/risingwave,Rust,820,RisingWave: the next-generation streaming database in the cloud.,180,2515,https://avatars.githubusercontent.com/u/77175557?v=4
482621452,bud,livebud/bud,JavaScript,1410,The Full-Stack Web Framework for Go,82,2954,https://avatars.githubusercontent.com/u/93525642?v=4
494567206,jiffyreader.com,ansh/jiffyreader.com,JavaScript,789,A Chrome Extension for Bionic Reading on ANY website!,133,2293,https://avatars.githubusercontent.com/u/8207733?u=3d3503f984477f35a72161dbad34305690ccebab&v=4
306829688,nocobase,nocobase/nocobase,TypeScript,928,"NocoBase is a scalability-first, open-source no-code/low-code development platform. ",231,2127,https://avatars.githubusercontent.com/u/66196787?v=4
299354666,rustdesk-server,rustdesk/rustdesk-server,Rust,128,RustDesk Server Program,188,937,https://avatars.githubusercontent.com/u/71636191?u=2a82300d822331f687ec5f00a250fa9862b34cc5&v=4
494666336,123elf,taviso/123elf,C,168,A native port of Lotus 1-2-3 to Linux.,39,518,https://avatars.githubusercontent.com/u/123814?u=b62bec1a41456a2f68b4f22641f9bf816d4bbddf&v=4
456170084,project_syncfusion_dashboard,adrianhajdin/project_syncfusion_dashboard,JavaScript,230,This is a code repository for the corresponding YouTube video. In this tutorial we are going to build and deploy a an admin dashboard app using React.js and Syncfusion,182,696,https://avatars.githubusercontent.com/u/24898559?u=227355c5200ae22f733b39ce05f4dab51db5ec9a&v=4
492677199,core,terra-money/core,JavaScript,196,GO implementation of the Terra 2.0 Protocol,36,271,https://avatars.githubusercontent.com/u/38208150?v=4
