id,name,full_name,language,new stars,description,forks_count,stargazers_count,avatar_url
58028038,HelloGitHub,521xueweihan/HelloGitHub,Python,269,":octocat: åˆ†äº« GitHub ä¸Šæœ‰è¶£ã€å…¥é—¨çº§çš„å¼€æºé¡¹ç›®ã€‚Share interesting, entry-level open source projects on GitHub.",7892,56048,https://avatars.githubusercontent.com/u/8255800?u=2024c0f3979fd65c8aab945856eae0852f1186f6&v=4
33015583,keras,keras-team/keras,Python,86,Deep Learning for humans,19099,55344,https://avatars.githubusercontent.com/u/34455048?v=4
843222,scikit-learn,scikit-learn/scikit-learn,Python,105,scikit-learn: machine learning in Python,23064,50299,https://avatars.githubusercontent.com/u/365630?v=4
83844720,face_recognition,ageitgey/face_recognition,Python,463,The world's simplest facial recognition api for Python and the command line,12289,44763,https://avatars.githubusercontent.com/u/896692?u=ea39271fb0e41dbfee2431f55e568124e6f4d8cc&v=4
4578002,python-patterns,faif/python-patterns,Python,1743,A collection of design patterns/idioms in Python,6385,33180,https://avatars.githubusercontent.com/u/1304661?u=3c1b0dbad33966d8eea133e85724bda354dedc89&v=4
136026789,DeepFaceLab,iperov/DeepFaceLab,Python,175,DeepFaceLab is the leading software for creating deepfakes.,7502,32909,https://avatars.githubusercontent.com/u/8076202?u=2928fa5264ebcdb64c8175e726cbc2438e483ba2&v=4
101684374,wtfpython,satwikkansal/wtfpython,Python,1820,What the f*ck Python? ğŸ˜±,2443,30584,https://avatars.githubusercontent.com/u/10217535?u=b12d6ef74ea297de9e46da6933b1a5b7ba9e6a61&v=4
118861276,python-cheatsheet,gto76/python-cheatsheet,Python,143,Comprehensive Python Cheatsheet,5331,29231,https://avatars.githubusercontent.com/u/1396046?u=852f59cf0d778cb9863e623352049d42c2fac10c&v=4
212639071,devops-exercises,bregman-arie/devops-exercises,Python,669,"Linux, Jenkins, AWS, SRE, Prometheus, Docker, Python, Ansible, Git, Kubernetes, Terraform, OpenStack, SQL, NoSQL, Azure, GCP, DNS, Elastic, Network, Virtualization. DevOps Interview Questions",5271,25055,https://avatars.githubusercontent.com/u/10349437?u=bb7c3c533587d7cb2e3dd336e0f8a0d40544e5f5&v=4
204086862,streamlit,streamlit/streamlit,Python,132,Streamlit â€” The fastest way to build data apps in Python,1741,19433,https://avatars.githubusercontent.com/u/45109972?v=4
420459569,copilot-docs,github/copilot-docs,Python,1317,Documentation for GitHub Copilot,2136,19529,https://avatars.githubusercontent.com/u/9919?v=4
11407242,cookiecutter,cookiecutter/cookiecutter,Python,336,"A cross-platform command-line utility that creates projects from cookiecutters (project templates), e.g. Python package projects, C projects.",1658,17320,https://avatars.githubusercontent.com/u/12502901?v=4
136202695,mlflow,mlflow/mlflow,Python,57,Open source platform for the machine learning lifecycle,2749,11960,https://avatars.githubusercontent.com/u/39938107?v=4
266417772,Summer2023-Internships,pittcsc/Summer2023-Internships,Python,544,Collection of Summer 2023 tech internships!,956,8664,https://avatars.githubusercontent.com/u/7276234?v=4
70746484,tvm,apache/tvm,Python,29,"Open deep learning compiler stack for cpu, gpu and specialized accelerators",2541,8151,https://avatars.githubusercontent.com/u/47359?v=4
143328315,mindsdb,mindsdb/mindsdb,Python,233,In-Database Machine Learning,722,7251,https://avatars.githubusercontent.com/u/31035808?v=4
77276660,sigma,SigmaHQ/sigma,Python,38,Generic Signature Format for SIEM Systems,1500,5098,https://avatars.githubusercontent.com/u/79842123?v=4
321659062,DeepFaceLive,iperov/DeepFaceLive,Python,386,Real-time face swap for PC streaming or video calls,717,4695,https://avatars.githubusercontent.com/u/8076202?u=2928fa5264ebcdb64c8175e726cbc2438e483ba2&v=4
135584946,dowhy,py-why/dowhy,Python,352,"DoWhy is a Python library for causal inference that supports explicit modeling and testing of causal assumptions. DoWhy is based on a unified language for causal inference, combining causal graphical models and potential outcomes frameworks. ",637,4185,https://avatars.githubusercontent.com/u/101266056?v=4
110688239,PaddleSpeech,PaddlePaddle/PaddleSpeech,Python,259,"Easy-to-use Speech Toolkit including SOTA/Streaming ASR with punctuation, influential TTS with text frontend, Speaker Verification System and End-to-End Speech Simultaneous Translation.",896,4072,https://avatars.githubusercontent.com/u/23534030?v=4
382756807,TechXueXi,TechXueXi/TechXueXi,Python,84,å¼ºå›½é€š ç§‘æŠ€å¼ºå›½ å­¦ä¹ å¼ºå›½ xuexiqiangguo å…¨ç½‘æœ€å¥½ç”¨å¼€æºç½‘é¡µå­¦ä¹ å¼ºå›½åŠ©æ‰‹ï¼šTechXueXi ï¼ˆæ‡’äººåˆ·åˆ†å·¥å…· è‡ªåŠ¨å­¦ä¹ ï¼‰æŠ€æœ¯å¼ºå›½ï¼Œæ”¯æŒç­”é¢˜ï¼Œæ”¯æŒ docker 45åˆ†/å¤©,869,3234,https://avatars.githubusercontent.com/u/63344348?v=4
495587598,imagen-pytorch,lucidrains/imagen-pytorch,Python,1112,"Implementation of Imagen, Google's Text-to-Image Neural Network, in Pytorch",121,2570,https://avatars.githubusercontent.com/u/108653?u=73e119b957102d7cf7c37b915f7dad20f7ecf8fc&v=4
382680786,dalle-mini,borisdayma/dalle-mini,Python,237,DALLÂ·E Mini - Generate images from a text prompt,188,1857,https://avatars.githubusercontent.com/u/715491?v=4
274782881,learn-cantrill-io-labs,acantril/learn-cantrill-io-labs,Python,82,Standard and Advanced Demos for learn.cantrill.io courses,726,1704,https://avatars.githubusercontent.com/u/15226029?u=5b047c423bdd689755f124ed7eaffa6c970dc5cb&v=4
344554014,CustomTkinter,TomSchimansky/CustomTkinter,Python,915,A modern and customizable python UI-library based on Tkinter,107,1513,https://avatars.githubusercontent.com/u/66446067?u=bf968427d91d7464eb6853cfd4878a54274763a0&v=4
