id,name,full_name,language,new stars,description,forks_count,stargazers_count,avatar_url
184456251,PowerToys,microsoft/PowerToys,C#,584,Windows system utilities to maximize productivity,5168,89544,https://avatars.githubusercontent.com/u/6154722?v=4
161012019,jellyfin,jellyfin/jellyfin,C#,124,The Free Software Media System,2016,21608,https://avatars.githubusercontent.com/u/45698031?v=4
262395224,maui,dotnet/maui,C#,60,".NET MAUI is the .NET Multi-platform App UI, a framework for building native device applications spanning mobile, tablet, and desktop.",1275,18769,https://avatars.githubusercontent.com/u/9141961?v=4
120231691,Ryujinx,Ryujinx/Ryujinx,C#,196,Experimental Nintendo Switch Emulator written in C#,1869,17248,https://avatars.githubusercontent.com/u/39036280?v=4
411493648,DevToys,veler/DevToys,C#,151,A Swiss Army knife for developers.,753,14051,https://avatars.githubusercontent.com/u/3747805?u=044bffcd8836f3a15f9f26378a9d7c85c5cffcfe&v=4
75505125,abp,abpframework/abp,C#,57,"Open Source Web Application Framework for ASP.NET Core. Offers an opinionated architecture to build enterprise software solutions with best practices on top of the .NET and the ASP.NET Core platforms. Provides the fundamental infrastructure, production-ready startup templates, application modules, UI themes, tooling, guides and documentation.",2983,9755,https://avatars.githubusercontent.com/u/42068324?v=4
83380995,eShopOnWeb,dotnet-architecture/eShopOnWeb,C#,42,"Sample ASP.NET Core 6.0 reference application, powered by Microsoft, demonstrating a layered application architecture with monolithic deployment model. Download the eBook PDF from docs folder.",4463,8691,https://avatars.githubusercontent.com/u/27453006?v=4
372096057,Bili.Uwp,Richasy/Bili.Uwp,C#,174,适用于新系统UI的哔哩,496,7544,https://avatars.githubusercontent.com/u/27713596?u=9566724713f4741794fb48625c333fdedc5e5f1d&v=4
743436,ET,egametang/ET,C#,31,Unity3D Client And C# Server Framework,2558,6914,https://avatars.githubusercontent.com/u/315758?v=4
245235133,reverse-proxy,microsoft/reverse-proxy,C#,57,A toolkit for developing high-performance HTTP reverse proxy applications.,638,6490,https://avatars.githubusercontent.com/u/6154722?v=4
295200728,EverythingToolbar,srwi/EverythingToolbar,C#,65,Everything integration for the Windows taskbar.,307,5929,https://avatars.githubusercontent.com/u/17520641?u=d934f7be7fd8698502ea6ae49eb2879a974dc2a5&v=4
100711978,btcpayserver,btcpayserver/btcpayserver,C#,42,"Accept Bitcoin payments. Free, open-source & self-hosted, Bitcoin payment processor. ",1099,4587,https://avatars.githubusercontent.com/u/31132886?v=4
389218073,wpfui,lepoco/wpfui,C#,66,"WPF UI provides the Fluent experience in your known and loved WPF framework. Intuitive design, themes, navigation and new immersive controls. All natively and effortlessly.",449,3986,https://avatars.githubusercontent.com/u/87412094?v=4
41150635,MoreLINQ,morelinq/MoreLINQ,C#,53,Extensions to LINQ to Objects,388,3281,https://avatars.githubusercontent.com/u/13901851?v=4
398181340,dotnet-webapi-boilerplate,fullstackhero/dotnet-webapi-boilerplate,C#,163,Clean Architecture Template for .NET 7.0 WebApi built with Multitenancy Support.,903,2900,https://avatars.githubusercontent.com/u/89242069?v=4
252826419,Graphics,Unity-Technologies/Graphics,C#,13,Unity Graphics - Including Scriptable Render Pipeline,688,2052,https://avatars.githubusercontent.com/u/426196?v=4
483682564,UniHacker,tylearymf/UniHacker,C#,56,"Patch all versions of Unity3D and UnityHub for Windows, MacOS, Linux and Docker.",381,1520,https://avatars.githubusercontent.com/u/14980389?u=ab34ef75cb8c61409adc298702c4055d989abd58&v=4
92001425,space-station-14,space-wizards/space-station-14,C#,30,A multiplayer game about paranoia and chaos on a space station. Remake of the cult-classic Space Station 13.,1321,1212,https://avatars.githubusercontent.com/u/10567778?v=4
591430510,CFScanner,MortezaBashsiz/CFScanner,C#,61,Cloud Flare scanner,212,945,https://avatars.githubusercontent.com/u/19620677?u=f3bc760bb042018e21672c84ecdd74886c9b32c9&v=4
599969083,FastScriptReload,handzlikchris/FastScriptReload,C#,135,Hot Reload implementation for Unity. Iterate on code insanely fast without breaking play session. Supports any editor. 1. Play 2. Make change 3. See results,37,599,https://avatars.githubusercontent.com/u/6343986?u=1ecef68109c10977263fecae05d6d882baba1e08&v=4
600246354,g-helper,seerge/g-helper,C#,94,"Lightweight Armoury Crate alternative for Asus laptops. Control tool for ROG Zephyrus G14, G15, Flow X13, Flow X16, TUF, Strix, Scar and other models",31,521,https://avatars.githubusercontent.com/u/5920850?v=4
248977013,ChatdollKit,uezo/ChatdollKit,C#,89,ChatdollKit enables you to make your 3D model into a chatbot,35,399,https://avatars.githubusercontent.com/u/19625242?u=5835aeaf32e5cca70f72fc87cee5c6959afcf844&v=4
620999229,yetAnotherObfuscator,0xb11a1/yetAnotherObfuscator,C#,84,C# obfuscator that bypass windows defender,59,339,https://avatars.githubusercontent.com/u/32736765?u=99f3d5021b162f1ceecdc826ac2117933ca56a3f&v=4
622229882,SallyBot,DeSinc/SallyBot,C#,52,AI Chatbot coded in Discord.net C#,32,203,https://avatars.githubusercontent.com/u/12345584?v=4
616707397,neuro-amongus,VedalAI/neuro-amongus,C#,64,Among Us Plugin for Neuro-sama,26,186,https://avatars.githubusercontent.com/u/123908850?v=4
