id,name,full_name,language,new stars,description,forks_count,stargazers_count,avatar_url
278335273,github-readme-stats,anuraghazra/github-readme-stats,JavaScript,37,:zap: Dynamically generated stats for your github readmes,22281,68055,https://avatars.githubusercontent.com/u/35374649?u=3125539259bebd2d8af05462a37f22a4fba763e4&v=4
455229168,immich,immich-app/immich,TypeScript,221,High performance self-hosted photo and video management solution.,2156,44283,https://avatars.githubusercontent.com/u/109746326?v=4
594155488,Stirling-PDF,Stirling-Tools/Stirling-PDF,Java,139,#1 Locally hosted web application that allows you to perform various operations on PDF files,3175,40324,https://avatars.githubusercontent.com/u/139791695?v=4
37912398,nginx,nginx/nginx,C,452,The official NGINX Open Source repository.,6780,22631,https://avatars.githubusercontent.com/u/1412239?v=4
649170660,anything-llm,Mintplex-Labs/anything-llm,JavaScript,316,The all-in-one Desktop & Docker AI application with full RAG and AI Agent capabilities.,2215,21618,https://avatars.githubusercontent.com/u/134426827?v=4
78243781,super-productivity,johannesjo/super-productivity,TypeScript,98,"Super Productivity is an advanced todo list app with integrated Timeboxing and time tracking capabilities. It also comes with integrations for Jira, Gitlab, GitHub and Open Project.",806,9610,https://avatars.githubusercontent.com/u/1456265?u=791190c3373e688d8cc22f1f81e69e48ebcf9056&v=4
1204412,TrinityCore,TrinityCore/TrinityCore,C++,6,"TrinityCore Open Source MMO Framework (master = 11.0.2.56461, 3.3.5 = 3.3.5a.12340, wotlk_classic = 3.4.3.54261, cata classic =  4.4.0.55262)",6028,9427,https://avatars.githubusercontent.com/u/539602?v=4
726082384,open-saas,wasp-lang/open-saas,TypeScript,44,"A free, open-source SaaS app starter for React & Node.js with superpowers. Full-featured. Community-driven.",684,7294,https://avatars.githubusercontent.com/u/55102317?v=4
144071425,Waybar,Alexays/Waybar,C++,13,Highly customizable Wayland bar for Sway and Wlroots based compositors. :v: :tada:,686,6232,https://avatars.githubusercontent.com/u/13947260?u=8da5ea8627d2c2418d6cb08221e9febb3a95f997&v=4
783512367,Follow,RSSNext/Follow,TypeScript,167,🧡 Next generation information browser,163,4417,https://avatars.githubusercontent.com/u/95456295?v=4
806618581,wealthfolio,afadil/wealthfolio,TypeScript,466,A Beautiful Private and Secure Desktop Investment Tracking Application,96,2439,https://avatars.githubusercontent.com/u/8382496?u=592a29e873466eaf5fd510c4931b3c29a4307a6f&v=4
709147463,Hi.Events,HiEventsDev/Hi.Events,PHP,260,Open-source event management and ticket selling platform 🎟️,120,1650,https://avatars.githubusercontent.com/u/148843671?v=4
800692439,linutil,ChrisTitusTech/linutil,Shell,222,Chris Titus Tech's Linux Toolbox - Linutil is a distro-agnostic toolbox designed to simplify everyday Linux tasks.,151,1514,https://avatars.githubusercontent.com/u/7896101?u=af642f9bbd072e6b21622e77c163298ebed45db1&v=4
296471971,FtcRobotController,FIRST-Tech-Challenge/FtcRobotController,Java,2,,4348,752,https://avatars.githubusercontent.com/u/12613163?v=4
