id,name,full_name,language,new stars,description,forks_count,stargazers_count,avatar_url
21540759,awesome-go,avelino/awesome-go,Go,87,"A curated list of awesome Go frameworks, libraries and software",11750,127354,https://avatars.githubusercontent.com/u/31996?u=5b12d7ad63cadb2b3b523f7ea6d2901dd9b03bcc&v=4
658928958,ollama,ollama/ollama,Go,168,"Get up and running with Llama 3.1, Mistral, Gemma 2, and other large language models.",6640,86004,https://avatars.githubusercontent.com/u/151674099?v=4
738733003,fabric,danielmiessler/fabric,Go,254,fabric is an open-source framework for augmenting humans using AI. It provides a modular framework for solving specific problems using a crowdsourced set of AI prompts that can be used anywhere.,2190,21046,https://avatars.githubusercontent.com/u/50654?u=cb240d3a67938da653614ef5ec97c58c0c173abe&v=4
9524057,node_exporter,prometheus/node_exporter,Go,4,Exporter for machine metrics,2321,10847,https://avatars.githubusercontent.com/u/3380462?v=4
41288708,sourcegraph-public-snapshot,sourcegraph/sourcegraph-public-snapshot,Go,21,Code AI platform with Code Search & Cody,1250,10068,https://avatars.githubusercontent.com/u/3979584?v=4
93444615,terraform-provider-aws,hashicorp/terraform-provider-aws,Go,4,The AWS Provider enables Terraform to manage AWS resources.,9063,9694,https://avatars.githubusercontent.com/u/761456?v=4
306366900,casdoor,casdoor/casdoor,Go,9,"An open-source UI-first Identity and Access Management (IAM) / Single-Sign-On (SSO) platform with web UI supporting OAuth 2.0, OIDC, SAML, CAS, LDAP, SCIM, WebAuthn, TOTP, MFA, Face ID, RADIUS, Google Workspace, Active Directory and Kerberos",1135,9561,https://avatars.githubusercontent.com/u/72992104?v=4
66509131,client-go,kubernetes/client-go,Go,3,Go client for Kubernetes.,2916,8880,https://avatars.githubusercontent.com/u/13629408?v=4
201546443,assets,trustwallet/assets,Go,4,"A comprehensive, up-to-date collection of information about several thousands (!) of crypto tokens.",22415,4505,https://avatars.githubusercontent.com/u/32179889?v=4
