id,name,full_name,language,new stars,description,forks_count,stargazers_count,avatar_url
45717250,tensorflow,tensorflow/tensorflow,C++,929,An Open Source Machine Learning Framework for Everyone,89043,178339,https://avatars.githubusercontent.com/u/15658638?v=4
100060912,terminal,microsoft/terminal,C++,889,"The new Windows Terminal and the original Windows console host, all in the same place!",8080,91061,https://avatars.githubusercontent.com/u/6154722?v=4
15634981,godot,godotengine/godot,C++,3230,Godot Engine – Multi-platform 2D and 3D game engine,15304,76579,https://avatars.githubusercontent.com/u/6318500?v=4
5108051,opencv,opencv/opencv,C++,629,Open Source Computer Vision Library,55672,71798,https://avatars.githubusercontent.com/u/5009934?v=4
44838949,swift,apple/swift,C++,319,The Swift Programming Language,10320,64301,https://avatars.githubusercontent.com/u/10639145?v=4
23357588,protobuf,protocolbuffers/protobuf,C++,888,Protocol Buffers - Google's data interchange format,15285,61633,https://avatars.githubusercontent.com/u/26310541?v=4
22887094,tesseract,tesseract-ocr/tesseract,C++,718,Tesseract Open Source OCR Engine (main repository),8841,54073,https://avatars.githubusercontent.com/u/8401422?v=4
22067521,imgui,ocornut/imgui,C++,799,Dear ImGui: Bloat-free Graphical User interface for C++ with minimal dependencies,9120,51146,https://avatars.githubusercontent.com/u/8225057?u=de42cf0fa1f1970187db446beea30c61b9c1e6d3&v=4
60246359,ClickHouse,ClickHouse/ClickHouse,C++,577,ClickHouse® is a free analytics DBMS for big data,6173,31330,https://avatars.githubusercontent.com/u/54801242?v=4
63477612,C-Plus-Plus,TheAlgorithms/C-Plus-Plus,C++,623,"Collection of various algorithms in mathematics, machine learning, computer science and physics implemented in C++ for educational purposes.",6671,26362,https://avatars.githubusercontent.com/u/20487725?v=4
19374812,tdesktop,telegramdesktop/tdesktop,C++,313,Telegram Desktop messaging app,4702,22860,https://avatars.githubusercontent.com/u/6113871?v=4
138754790,duckdb,duckdb/duckdb,C++,571,DuckDB is an in-process SQL OLAP Database Management System,1169,12495,https://avatars.githubusercontent.com/u/82039556?v=4
76990209,WLED,Aircoookie/WLED,C++,203,Control WS2812B and many more types of digital RGB LEDs with an ESP8266 or ESP32 over WiFi!,2545,12415,https://avatars.githubusercontent.com/u/21045690?u=b6ef8107e15c7fc6c160235afba9c3813117a768&v=4
70127218,arduino-esp32,espressif/arduino-esp32,C++,150,Arduino core for the ESP32,6996,11451,https://avatars.githubusercontent.com/u/9460735?v=4
218686763,subconverter,tindy2013/subconverter,C++,443,Utility to convert between various subscription format,2193,10481,https://avatars.githubusercontent.com/u/49061470?u=22a89312bf2de411e87340e04b5f9d149f7366cc&v=4
5973855,Cataclysm-DDA,CleverRaven/Cataclysm-DDA,C++,226,Cataclysm - Dark Days Ahead. A turn-based survival game set in a post-apocalyptic world.,3891,8980,https://avatars.githubusercontent.com/u/4367009?v=4
263379,libzmq,zeromq/libzmq,C++,108,"ZeroMQ core engine in C++, implements ZMTP/3.1",2322,8849,https://avatars.githubusercontent.com/u/109777?v=4
154201259,hermes,facebook/hermes,C++,422,A JavaScript engine optimized for running React Native.,611,8488,https://avatars.githubusercontent.com/u/69631?v=4
438803890,Sunshine,LizardByte/Sunshine,C++,778,Self-hosted game stream host for Moonlight.,364,7555,https://avatars.githubusercontent.com/u/84790584?v=4
372536760,oceanbase,oceanbase/oceanbase,C++,307,"OceanBase is an enterprise distributed relational database with high availability, high performance, horizontal scalability, and compatibility with SQL standards.",1356,6483,https://avatars.githubusercontent.com/u/82347605?v=4
400501136,mujoco,google-deepmind/mujoco,C++,192,Multi-Joint dynamics with Contact. A general purpose physics simulator.,598,6303,https://avatars.githubusercontent.com/u/8596759?v=4
153097643,openvino,openvinotoolkit/openvino,C++,161,OpenVINO™ is an open-source toolkit for optimizing and deploying AI inference,1779,4820,https://avatars.githubusercontent.com/u/55443902?v=4
395341383,JoltPhysics,jrouwe/JoltPhysics,C++,513,"A multi core friendly rigid body physics and collision detection library, written in C++, suitable for games and VR applications.",254,4239,https://avatars.githubusercontent.com/u/1621693?u=14b293a7095d074e6653d7ad73269a5e785e1399&v=4
410126695,R3nzSkin,R3nzTheCodeGOD/R3nzSkin,C++,357,Skin changer for League of Legends (LOL),515,3257,https://avatars.githubusercontent.com/u/58574988?u=0d26cbf4271a4b820623198423fa4b0266426a3d&v=4
514553345,OrcaSlicer,SoftFever/OrcaSlicer,C++,364,"G-code generator for 3D printers (Bambu, Prusa, Voron, VzBot, RatRig, Creality, etc.)",282,2381,https://avatars.githubusercontent.com/u/103989404?u=b07a80c2bad1dc452303b696bd6cf67d040c398d&v=4
