id,name,full_name,language,new stars,description,forks_count,stargazers_count,avatar_url
83222441,system-design-primer,donnemartin/system-design-primer,Python,2752,Learn how to design large-scale systems. Prep for the system design interview.  Includes Anki flashcards.,40700,231108,https://avatars.githubusercontent.com/u/5458997?u=f1007b583e55e7ccfb6ccf0e200051156112dd9b&v=4
596892,flask,pallets/flask,Python,583,The Python micro framework for building web applications.,15953,64529,https://avatars.githubusercontent.com/u/16748505?v=4
21872392,awesome-machine-learning,josephmisiti/awesome-machine-learning,Python,1058,"A curated list of awesome Machine Learning frameworks, libraries and software.",14281,60951,https://avatars.githubusercontent.com/u/246302?u=9242c80bcb25acbc66683faf0d5d9fb92674689b&v=4
1362490,requests,psf/requests,Python,272,"A simple, yet elegant, HTTP library.",9200,50382,https://avatars.githubusercontent.com/u/50630501?v=4
188660663,Real-Time-Voice-Cloning,CorentinJ/Real-Time-Voice-Cloning,Python,3397,Clone a voice in 5 seconds to generate arbitrary speech in real-time,8227,47864,https://avatars.githubusercontent.com/u/12038136?u=e6c8b4d673fba64e7d29b29605ce9c868094423b&v=4
422274596,ColossalAI,hpcaitech/ColossalAI,Python,2440,"Making large AI models cheaper, faster and more accessible",3970,34823,https://avatars.githubusercontent.com/u/88699314?v=4
125266328,black,psf/black,Python,447,The uncompromising Python code formatter,2233,33844,https://avatars.githubusercontent.com/u/50630501?v=4
91573538,12306,testerSunshine/12306,Python,1551,12306智能刷票，订票,9728,32712,https://avatars.githubusercontent.com/u/20162049?u=e84bd901b23092ebb2411aa370ec688573b2b191&v=4
666299222,open-interpreter,KillianLucas/open-interpreter,Python,19624,"OpenAI's Code Interpreter in your terminal, running locally",2446,28520,https://avatars.githubusercontent.com/u/63927363?u=9a5a30771011c3cfdde19cd51d18d85e7ed6d53f&v=4
265612440,TTS,coqui-ai/TTS,Python,5388,"🐸💬 - a deep learning toolkit for Text-to-Speech, battle-tested in research and production",2248,19967,https://avatars.githubusercontent.com/u/75583352?v=4
596516907,DocsGPT,arc53/DocsGPT,Python,2407,"GPT-powered chat for documentation, chat with your documents",887,9049,https://avatars.githubusercontent.com/u/103419759?v=4
315490189,OpenCore-Legacy-Patcher,dortania/OpenCore-Legacy-Patcher,Python,1075,Experience macOS just like before,864,8608,https://avatars.githubusercontent.com/u/46268266?v=4
599547518,vllm,vllm-project/vllm,Python,1770,A high-throughput and memory-efficient inference and serving engine for LLMs,883,8018,https://avatars.githubusercontent.com/u/136984999?v=4
650657566,nougat,facebookresearch/nougat,Python,3190,Implementation of Nougat Neural Optical Understanding for Academic Documents,372,6226,https://avatars.githubusercontent.com/u/16943930?v=4
679237742,gpt-pilot,Pythagora-io/gpt-pilot,Python,2536,Dev tool that writes scalable apps from scratch while the developer oversees the implementation,434,5468,https://avatars.githubusercontent.com/u/123263103?v=4
662028682,gaussian-splatting,graphdeco-inria/gaussian-splatting,Python,2115,"Original reference implementation of ""3D Gaussian Splatting for Real-Time Radiance Field Rendering""",424,5220,https://avatars.githubusercontent.com/u/107077851?v=4
587050620,dspy,stanfordnlp/dspy,Python,1097,DSPy: The framework for programming with foundation models,187,3422,https://avatars.githubusercontent.com/u/3046006?v=4
660489378,promptflow,microsoft/promptflow,Python,2370,"Build high-quality LLM apps - from prototyping, testing to production deployment and monitoring.",204,2625,https://avatars.githubusercontent.com/u/6154722?v=4
684046942,sd-webui-EasyPhoto,aigc-apps/sd-webui-EasyPhoto,Python,1784,📷 EasyPhoto | Your Smart AI Photo Generator.,166,2386,https://avatars.githubusercontent.com/u/141981933?v=4
685444668,Baichuan2,baichuan-inc/Baichuan2,Python,1689,A series of large language models developed by Baichuan Intelligent Technology,126,2321,https://avatars.githubusercontent.com/u/136167093?v=4
684181388,DiffBIR,XPixelGroup/DiffBIR,Python,1428,,107,1887,https://avatars.githubusercontent.com/u/104772975?v=4
671269505,litellm,BerriAI/litellm,Python,819,"Call all LLM APIs using the OpenAI format. Use Azure, OpenAI, Cohere, Anthropic, Ollama, VLLM, Sagemaker, HuggingFace, Replicate (100+ LLMs)",128,1786,https://avatars.githubusercontent.com/u/121462774?v=4
