id,name,full_name,language,new stars,description,forks_count,stargazers_count,avatar_url
3482588,SecLists,danielmiessler/SecLists,PHP,148,"SecLists is the security tester's companion. It's a collection of multiple types of lists used during security assessments, collected in one place. List types include usernames, passwords, URLs, sensitive data patterns, fuzzing payloads, web shells, and many more.",17264,33207,https://avatars.githubusercontent.com/u/50654?u=136860fa06a1fd6c80912231b565f018a64f2b97&v=4
2253830,PHPMailer,PHPMailer/PHPMailer,PHP,36,The classic email sending library for PHP,8928,17011,https://avatars.githubusercontent.com/u/3959702?v=4
60243197,server,nextcloud/server,PHP,908,"☁️ Nextcloud server, a safe home for all your data",2694,15689,https://avatars.githubusercontent.com/u/19211038?v=4
2889328,WordPress,WordPress/WordPress,PHP,29,"WordPress, Git-ified. This repository is just a mirror of the WordPress subversion repository. Please do not send pull requests. Submit pull requests to https://github.com/WordPress/wordpress-develop and patches to https://core.trac.wordpress.org/ instead.",10157,15383,https://avatars.githubusercontent.com/u/276006?v=4
3431193,yii2,yiisoft/yii2,PHP,13,"Yii 2: The Fast, Secure and Professional PHP Framework",6959,13782,https://avatars.githubusercontent.com/u/993323?v=4
82238168,monica,monicahq/monica,PHP,37,"Personal CRM. Remember everything about your friends, family and business relationships.",1487,13231,https://avatars.githubusercontent.com/u/25832602?v=4
23680678,jwt-auth,tymondesigns/jwt-auth,PHP,13,🔐 JSON Web Token Authentication for Laravel & Lumen,1353,10146,https://avatars.githubusercontent.com/u/1801923?u=15eeeb0c2817253aea520178e9d15def0883b8fe&v=4
14259390,Laravel-Excel,Maatwebsite/Laravel-Excel,PHP,22,🚀 Supercharged Excel exports and imports in Laravel,1607,10130,https://avatars.githubusercontent.com/u/10957910?v=4
2884111,magento2,magento/magento2,PHP,17,"All Submissions you make to Magento Inc. (""Magento"") through GitHub are subject to the following terms and conditions: (1) You grant Magento a perpetual, worldwide, non-exclusive, no charge, royalty free, irrevocable license under your applicable copyrights and patents to reproduce, prepare derivative works of, display, publically perform, sublicense and distribute any feedback, ideas, code, or other information (“Submission"") you submit through GitHub. (2) Your Submission is an original work of authorship and you are the owner or are legally entitled to grant the license stated above. (3) You agree to the Contributor License Agreement found here:  https://github.com/magento/magento2/blob/master/CONTRIBUTOR_LICENSE_AGREEMENT.html",8557,9611,https://avatars.githubusercontent.com/u/168457?v=4
656494,cakephp,cakephp/cakephp,PHP,8,CakePHP: The Rapid Development Framework for PHP - Official Repository,3467,8419,https://avatars.githubusercontent.com/u/23666?v=4
6660366,dompdf,dompdf/dompdf,PHP,22,HTML to PDF converter for PHP,1536,8148,https://avatars.githubusercontent.com/u/2776605?v=4
11467667,typecho,typecho/typecho,PHP,40,A PHP Blogging Platform. Simple and Powerful.,1653,8115,https://avatars.githubusercontent.com/u/2030842?v=4
14716368,invoiceninja,invoiceninja/invoiceninja,PHP,21,"Invoices, Expenses and Tasks built with Laravel and Flutter",1850,6061,https://avatars.githubusercontent.com/u/15712270?v=4
6763587,PrestaShop,PrestaShop/PrestaShop,PHP,11,"PrestaShop is an Open Source e-commerce platform, committed to providing the best shopping cart experience for both merchants and customers.",4169,6043,https://avatars.githubusercontent.com/u/2815696?v=4
12204147,mautic,mautic/mautic,PHP,11,Mautic: Open Source Marketing Automation Software.,1724,4701,https://avatars.githubusercontent.com/u/5257677?v=4
6322699,FreshRSS,FreshRSS/FreshRSS,PHP,23,"A free, self-hostable aggregator…",406,3477,https://avatars.githubusercontent.com/u/9414285?v=4
31425145,raspap-webgui,RaspAP/raspap-webgui,PHP,18,Simple wireless AP setup & management for Debian-based devices,668,3207,https://avatars.githubusercontent.com/u/78154814?v=4
13044600,SuiteCRM,salesagility/SuiteCRM,PHP,9,SuiteCRM - Open source CRM for the world,1502,2644,https://avatars.githubusercontent.com/u/1450870?v=4
1957456,dolibarr,Dolibarr/dolibarr,PHP,18,"Dolibarr ERP CRM is a modern software package to manage your company or foundation activity (contacts, suppliers, invoices, orders, stocks, agenda, accounting, ...). It is open source software written in PHP and designed for small and medium businesses, foundations and freelancers. You can freely install, use and distribute it as a standalone application or as a web application to use it from every internet access and media.",1800,2634,https://avatars.githubusercontent.com/u/877491?v=4
69691727,PocketMine-MP,pmmp/PocketMine-MP,PHP,9,A server software for Minecraft: Bedrock Edition in PHP,1448,2474,https://avatars.githubusercontent.com/u/22548559?v=4
17253775,zabbix,zabbix/zabbix,PHP,15,"Real-time monitoring of IT components and services, such as networks, servers, VMs, applications and the cloud.",538,1726,https://avatars.githubusercontent.com/u/4561226?v=4
311448648,breeze,laravel/breeze,PHP,12,Minimal Laravel authentication scaffolding with Blade and Tailwind.,160,1533,https://avatars.githubusercontent.com/u/958072?v=4
216849756,v2board,v2board/v2board,PHP,14,🚀A multiple protocol manage panel application interface,449,925,https://avatars.githubusercontent.com/u/56885001?v=4
1430051,typo3,TYPO3/typo3,PHP,0,The TYPO3 Core - Enterprise Content Management System. Synchronized mirror of https://review.typo3.org/Packages/TYPO3.CMS,535,792,https://avatars.githubusercontent.com/u/88698?v=4
132122241,search-server,apisearch-io/search-server,PHP,3,:star: Our core search API repository,76,256,https://avatars.githubusercontent.com/u/34106314?v=4
