id,name,full_name,language,new stars,description,forks_count,stargazers_count,avatar_url
2561582,animate.css,animate-css/animate.css,CSS,9,🍿 A cross-browser library of CSS animations. As easy to use as an easy thing.,16249,75918,https://avatars.githubusercontent.com/u/64791939?v=4
27574418,nerd-fonts,ryanoasis/nerd-fonts,CSS,26,"Iconic font aggregator, collection, & patcher. 3,600+ icons, 50+ patched fonts: Hack, Source Code Pro, more. Glyph collections: Font Awesome, Material Design Icons, Octicons, & more",2984,38628,https://avatars.githubusercontent.com/u/8083459?u=1645f43000c842a948268609231bdecb1433c470&v=4
16599031,jekyll-now,barryclark/jekyll-now,CSS,3,"Build a Jekyll blog in minutes, without touching the command line.",34337,7843,https://avatars.githubusercontent.com/u/692762?v=4
49767244,primeng,primefaces/primeng,CSS,3,The Most Complete Angular UI Component Library,3938,7711,https://avatars.githubusercontent.com/u/3494069?v=4
9859154,json-api,json-api/json-api,CSS,1,A specification for building JSON APIs,832,6997,https://avatars.githubusercontent.com/u/4341694?v=4
23981144,Infosec_Reference,rmusser01/Infosec_Reference,CSS,3,An Information Security Reference That Doesn't Suck; https://rmusser.net/git/admin-2/Infosec_Reference for non-MS Git hosted version.,1088,4552,https://avatars.githubusercontent.com/u/1444720?v=4
107962707,advanced-css-course,jonasschmedtmann/advanced-css-course,CSS,4,"Starter files, final projects and FAQ for my Advanced CSS course",4644,3777,https://avatars.githubusercontent.com/u/18718850?u=9e3b84d1871a03690c758df5b5e9b967223a6def&v=4
329751286,youtube,safak/youtube,CSS,8,,3991,3386,https://avatars.githubusercontent.com/u/1486366?u=c367d218a8cf89ad09c3dbfb3c7ad7a929142f20&v=4
160313905,primevue,primefaces/primevue,CSS,2,Next Generation Vue UI Component Library,563,2933,https://avatars.githubusercontent.com/u/3494069?v=4
222361926,javascript-basic-projects,john-smilga/javascript-basic-projects,CSS,2,,2892,2570,https://avatars.githubusercontent.com/u/42133389?u=9d63b6d71fba139347cddf2c840a858c8ff97168&v=4
284284498,v2ray-examples,v2fly/v2ray-examples,CSS,3,v2ray-core 的模板们,596,1507,https://avatars.githubusercontent.com/u/49637375?v=4
167872853,hugo-theme-terminal,panr/hugo-theme-terminal,CSS,1,"A simple, retro theme for Hugo",542,1476,https://avatars.githubusercontent.com/u/1303365?u=a7d962df508f736813b707540bb4f44c59cce120&v=4
292673424,cloudflare-docs,cloudflare/cloudflare-docs,CSS,2,Cloudflare’s documentation,1801,1388,https://avatars.githubusercontent.com/u/314135?v=4
400355716,teledrive,mgilangjanuar/teledrive,CSS,1,The Google Drive/OneDrive/etc alternative using Telegram API,572,1239,https://avatars.githubusercontent.com/u/3146378?u=8bbff1c903be74c739fd55a3e71a16ec89e94fc1&v=4
366437783,responsive-portfolio-website-Alexa,bedimcode/responsive-portfolio-website-Alexa,CSS,1,"Responsive Portfolio Website Using HTML, CSS & JavaScript",1007,1179,https://avatars.githubusercontent.com/u/61248995?u=9aac97bc872b32ebf85288486be6747ba6b7af66&v=4
76339005,evilportals,kleo/evilportals,CSS,1,A collection of captive portals for phishing using a WiFi Pineapple ,134,517,https://avatars.githubusercontent.com/u/13497504?u=218d85df29ff5d45e670d900930668a5b47d4daa&v=4
424353298,BigB-E-learn-Websit-e,The-Shivam-garg/BigB-E-learn-Websit-e,CSS,5,"BigB is a E-learning website built using HTML, CSS, JavaScript and Bootstrap - Hacktoberfest Accepted.  🤞                                          This project is previously accepted in GSSoC 2022 , JWOC 22.",130,89,https://avatars.githubusercontent.com/u/83035995?u=9a8cf1cdc0c822a3735e27a4a7c244adc4e24aed&v=4
411705813,Portfolio-Collection,avinash201199/Portfolio-Collection,CSS,5,This repository contains collection of portfolio's .,51,47,https://avatars.githubusercontent.com/u/61057666?u=6502e1e26cef14025bf6d5674657df27c15c7fca&v=4
540788015,GirlScript-Asansol,gsasansol/GirlScript-Asansol,HTML,2,Github repository for the official website of GirlScript Foundation's Asansol Chapter,40,38,https://avatars.githubusercontent.com/u/104225043?v=4
412755678,Awesome-CSS-Projects,irshadmd/Awesome-CSS-Projects,CSS,9,Awesome CSS Projects,96,31,https://avatars.githubusercontent.com/u/32608381?u=adc6ef0e0b145bad9e437589a0b1eab8f5bdb68a&v=4
543158014,image-resizer-electron,bradtraversy/image-resizer-electron,CSS,4,Electron app to change the dimensions of an image,5,27,https://avatars.githubusercontent.com/u/5550850?u=819e4404506d906d5113cc352b560fcfd242cce3&v=4
527449672,Twitter-Landing-Page,Zack-Dx/Twitter-Landing-Page,CSS,0,A repository to contribute at hacktoberfest 2022. Make sure to share love by giving it a star🌟. Have a great day!,45,24,https://avatars.githubusercontent.com/u/105835098?u=57434d8584a9db2d5e54098f4113027532d4aeb9&v=4
543694437,Hacktoberfest_2022,durgesh2001/Hacktoberfest_2022,CSS,1,This repository is  encourage people to contribute to open source throughout october.  ,57,18,https://avatars.githubusercontent.com/u/56739907?u=b49b0cf1e800f7f723a66330c66db1b3b89d175a&v=4
544934362,Terminal-Portfolio,TechSpiritSS/Terminal-Portfolio,JavaScript,1,Terminal Style Portfolio made with HTML / CSS / JS ,23,16,https://avatars.githubusercontent.com/u/76687985?u=e972aae8ff4e1289fabaf4f6590d8fc606e33125&v=4
544937562,flexible,webAhead1/flexible,CSS,1,,0,1,https://avatars.githubusercontent.com/u/108412667?v=4
