id,name,full_name,language,new stars,description,forks_count,stargazers_count,avatar_url
2325298,linux,torvalds/linux,C,1973,Linux kernel source tree,50519,158208,https://avatars.githubusercontent.com/u/1024025?v=4
1903522,php-src,php/php-src,C,258,The PHP Interpreter,7648,36071,https://avatars.githubusercontent.com/u/25158?v=4
3774328,wrk,wg/wrk,C,379,Modern HTTP benchmarking tool,2857,35416,https://avatars.githubusercontent.com/u/94529?v=4
5101141,jq,jqlang/jq,C,932,Command-line JSON processor,1489,26709,https://avatars.githubusercontent.com/u/104800540?v=4
1357796,emscripten,emscripten-core/emscripten,C,156,Emscripten: An LLVM-to-WebAssembly Compiler,3176,24289,https://avatars.githubusercontent.com/u/46011144?v=4
45821540,openwrt,openwrt/openwrt,C,288,This repository is a mirror of https://git.openwrt.org/openwrt/openwrt.git It is for reference only and is not active for check-ins.  We will continue to accept Pull Requests here. They will be merged via staging trees then into openwrt.git.,9117,16171,https://avatars.githubusercontent.com/u/2528830?v=4
13836499,raylib,raysan5/raylib,C,962,A simple and easy-to-use library to enjoy videogames programming,1692,15416,https://avatars.githubusercontent.com/u/5766837?u=28d52cd1077b2f8b48d3897e82f03280a565e8d6&v=4
927442,postgres,postgres/postgres,C,226,"Mirror of the official PostgreSQL GIT repository. Note that this is just a *mirror* - we don't work with pull requests on github. To contribute, please see https://wiki.postgresql.org/wiki/Submitting_a_Patch",4094,13223,https://avatars.githubusercontent.com/u/177543?v=4
105627846,reactos,reactos/reactos,C,336,A free Windows-compatible Operating System,1650,13163,https://avatars.githubusercontent.com/u/1056157?v=4
179354282,OpenCorePkg,acidanthera/OpenCorePkg,C,142,OpenCore bootloader,2057,12028,https://avatars.githubusercontent.com/u/39672954?v=4
7710647,libsodium,jedisct1/libsodium,C,363,"A modern, portable, easy to use crypto library.",1731,11484,https://avatars.githubusercontent.com/u/124872?v=4
470579591,unleashed-firmware,DarkFlippers/unleashed-firmware,C,566,Flipper Zero Unleashed Firmware,1042,11078,https://avatars.githubusercontent.com/u/115378555?v=4
35780977,ImageMagick,ImageMagick/ImageMagick,C,200,🧙‍♂️ ImageMagick 7,1231,9916,https://avatars.githubusercontent.com/u/12486768?v=4
213916896,blender,blender/blender,C,319,Official mirror of Blender,1588,9574,https://avatars.githubusercontent.com/u/52924476?v=4
284134871,flipperzero-firmware,flipperdevices/flipperzero-firmware,C,308,Flipper Zero firmware source code,2018,8442,https://avatars.githubusercontent.com/u/57576566?v=4
2997204,john,openwall/john,C,151,"John the Ripper jumbo - advanced offline password cracker, which supports hundreds of hash and cipher types, and runs on many operating systems, CPUs, GPUs, and even some FPGAs",1935,8277,https://avatars.githubusercontent.com/u/1579552?v=4
59676171,klipper,Klipper3d/klipper,C,288,Klipper is a 3d-printer firmware,4750,7514,https://avatars.githubusercontent.com/u/90982958?v=4
40504480,xv6-public,mit-pdos/xv6-public,C,135,xv6 OS,3566,6812,https://avatars.githubusercontent.com/u/12404246?v=4
204459250,xv6-riscv,mit-pdos/xv6-riscv,C,386,Xv6 for RISC-V,1813,4674,https://avatars.githubusercontent.com/u/12404246?v=4
579676275,Xtreme-Firmware,Flipper-XFW/Xtreme-Firmware,C,770,"The Dom amongst the Flipper Zero Firmware. Give your Flipper the power and freedom it is really craving. Let it show you its true form. Dont delay, switch to the one and only true Master today!    ",328,4549,https://avatars.githubusercontent.com/u/140006447?v=4
40306512,LuaJIT,LuaJIT/LuaJIT,C,82,Mirror of the LuaJIT git repository,877,4049,https://avatars.githubusercontent.com/u/11773774?v=4
76599439,frr,FRRouting/frr,C,41,The FRRouting Protocol Suite,1126,2730,https://avatars.githubusercontent.com/u/24592672?v=4
23780138,riscv-gnu-toolchain,riscv-collab/riscv-gnu-toolchain,C,87,"GNU toolchain for RISC-V, including GCC",977,2666,https://avatars.githubusercontent.com/u/89536104?v=4
61231339,raygui,raysan5/raygui,C,134,A simple and easy-to-use immediate-mode gui library,228,2448,https://avatars.githubusercontent.com/u/5766837?u=28d52cd1077b2f8b48d3897e82f03280a565e8d6&v=4
616222670,NerdMiner_v2,BitMaker-hub/NerdMiner_v2,C,108,Improved version of first ESP32 NerdMiner,85,505,https://avatars.githubusercontent.com/u/105243563?u=e4a7a4b8e143fe25d2da1f8355c9207bab931d4f&v=4
