id,name,full_name,language,new stars,description,forks_count,stargazers_count,avatar_url
132464395,JavaGuide,Snailclimb/JavaGuide,Java,1131,ã€ŒJavaå­¦ä¹ +é¢è¯•æŒ‡å—ã€ä¸€ä»½æ¶µç›–å¤§éƒ¨åˆ† Java ç¨‹åºå‘˜æ‰€éœ€è¦æŒæ¡çš„æ ¸å¿ƒçŸ¥è¯†ã€‚å‡†å¤‡ Java é¢è¯•ï¼Œé¦–é€‰ JavaGuideï¼,44777,137037,https://avatars.githubusercontent.com/u/29880145?u=d2f8361655b9ebd973f5375acf014500bc0a4197&v=4
6296790,spring-boot,spring-projects/spring-boot,Java,577,Spring Boot,39442,69321,https://avatars.githubusercontent.com/u/317776?v=4
1148753,spring-framework,spring-projects/spring-framework,Java,454,Spring Framework,36872,53119,https://avatars.githubusercontent.com/u/317776?v=4
173228436,ghidra,NationalSecurityAgency/ghidra,Java,941,Ghidra is a software reverse engineering (SRE) framework,5178,42629,https://avatars.githubusercontent.com/u/11298292?v=4
8859474,jadx,skylot/jadx,Java,509,Dex to Java decompiler,4495,36178,https://avatars.githubusercontent.com/u/118523?u=22c9766bcd42e7f4968002bb79141bbfc1e3ce5d&v=4
561730219,hello-algo,krahets/hello-algo,Java,11614,"ã€ŠHello ç®—æ³•ã€‹ï¼šåŠ¨ç”»å›¾è§£ã€ä¸€é”®è¿è¡Œçš„æ•°æ®ç»“æ„ä¸ç®—æ³•æ•™ç¨‹ï¼Œæ”¯æŒ Java, C++, Python, Go, JS, TS, C#, Swift, Rust, Dart, Zig ç­‰è¯­è¨€ã€‚",3011,28233,https://avatars.githubusercontent.com/u/26993056?u=12c6a8ef18768abc773c64a56a56c0fd67241ed2&v=4
7587038,canal,alibaba/canal,Java,538,é˜¿é‡Œå·´å·´ MySQL binlog å¢é‡è®¢é˜…&æ¶ˆè´¹ç»„ä»¶ ,7423,26702,https://avatars.githubusercontent.com/u/1961952?v=4
44804216,termux-app,termux/termux-app,Java,913,Termux - a terminal emulator application for Android OS extendible by variety of packages.,2805,24599,https://avatars.githubusercontent.com/u/8104776?v=4
1103607,jenkins,jenkinsci/jenkins,Java,208,Jenkins automation server,8286,21419,https://avatars.githubusercontent.com/u/107424?v=4
89822531,Mindustry,Anuken/Mindustry,Java,392,The automation tower defense RTS,2622,18980,https://avatars.githubusercontent.com/u/10100000?u=614db4c9ac9d539c72840ca9c2b7e522efe1b0c1&v=4
149121954,jdk,openjdk/jdk,Java,354,JDK main-line development https://openjdk.org/projects/jdk,4856,16860,https://avatars.githubusercontent.com/u/41768318?v=4
482520194,Grasscutter,Grasscutters/Grasscutter,Java,519,A server software reimplementation for a certain anime game.,4322,14217,https://avatars.githubusercontent.com/u/104039209?v=4
391055597,DSA-Bootcamp-Java,kunal-kushwaha/DSA-Bootcamp-Java,Java,451,"This repository consists of the code samples, assignments, and notes for the Java data structures & algorithms + interview preparation bootcamp of WeMakeDevs.",8776,13191,https://avatars.githubusercontent.com/u/42698533?u=49bc72f21fee9f03e15be699ff035c7741d716e4&v=4
139914932,quarkus,quarkusio/quarkus,Java,203,Quarkus: Supersonic Subatomic Java. ,2330,12249,https://avatars.githubusercontent.com/u/47638783?v=4
320785435,LSPosed,LSPosed/LSPosed,Java,549,LSPosed Framework,1632,11785,https://avatars.githubusercontent.com/u/75879071?v=4
156627365,toBeBetterJavaer,itwanger/toBeBetterJavaer,Java,537,ä¸€ä»½é€šä¿—æ˜“æ‡‚ã€é£è¶£å¹½é»˜çš„Javaå­¦ä¹ æŒ‡å—ï¼Œå†…å®¹æ¶µç›–JavaåŸºç¡€ã€Javaå¹¶å‘ç¼–ç¨‹ã€Javaè™šæ‹Ÿæœºã€Javaä¼ä¸šçº§å¼€å‘ã€Javaé¢è¯•ç­‰æ ¸å¿ƒçŸ¥è¯†ç‚¹ã€‚å­¦Javaï¼Œå°±è®¤å‡†äºŒå“¥çš„Javaè¿›é˜¶ä¹‹è·¯ğŸ˜„,1447,9537,https://avatars.githubusercontent.com/u/6011374?u=8f2f87196c41e42de8f357bddaf07534352c00ee&v=4
99919302,doris,apache/doris,Java,424,"Apache Doris is an easy-to-use, high performance and unified analytics database.",2682,9489,https://avatars.githubusercontent.com/u/47359?v=4
12499251,checkstyle,checkstyle/checkstyle,Java,56,"Checkstyle is a development tool to help programmers write Java code that adheres to a coding standard. By default it supports the Google Java Style Guide and Sun Code Conventions, but is highly configurable. It can be invoked with an ANT task and a command line program.",8608,7852,https://avatars.githubusercontent.com/u/5179750?v=4
88024517,jetcache,alibaba/jetcache,Java,289,JetCache is a Java cache framework.,983,4334,https://avatars.githubusercontent.com/u/1961952?v=4
281414496,AutoX,kkevsekk1/AutoX,Java,307,"A UiAutomator on android, does not need root access(å®‰å“å¹³å°ä¸Šçš„JavaScriptè‡ªåŠ¨åŒ–å·¥å…·)",976,3795,https://avatars.githubusercontent.com/u/16631944?v=4
594155488,Stirling-PDF,Frooodle/Stirling-PDF,Java,623,locally hosted web application that allows you to perform various operations on PDF files,131,1931,https://avatars.githubusercontent.com/u/77850077?u=16cf089bcc06e0b434f92f1e342845992f041d5c&v=4
296471971,FtcRobotController,FIRST-Tech-Challenge/FtcRobotController,Java,94,,2716,516,https://avatars.githubusercontent.com/u/12613163?v=4
89221572,dd-trace-java,DataDog/dd-trace-java,Java,12,Datadog APM client for Java,274,478,https://avatars.githubusercontent.com/u/365230?v=4
663458108,campus-imaotai,oddfar/campus-imaotai,Java,215,ièŒ…å°appè‡ªåŠ¨é¢„çº¦ï¼Œæ¯æ—¥è‡ªåŠ¨é¢„çº¦ï¼Œæ”¯æŒdockerä¸€é”®éƒ¨ç½²,115,464,https://avatars.githubusercontent.com/u/76616434?u=80a8c5f1b6984598a8a2c9b111236b8e63f1da2b&v=4
656264456,langchain4j,langchain4j/langchain4j,Java,174,Java version of LangChain,73,435,https://avatars.githubusercontent.com/u/132277850?u=11c4ba654c2502389a4c08aabb1ba7f22c4d61c2&v=4
