id,name,full_name,language,new stars,description,forks_count,stargazers_count,avatar_url
83222441,system-design-primer,donnemartin/system-design-primer,Python,3079,Learn how to design large-scale systems. Prep for the system design interview.  Includes Anki flashcards.,40623,230565,https://avatars.githubusercontent.com/u/5458997?u=f1007b583e55e7ccfb6ccf0e200051156112dd9b&v=4
58028038,HelloGitHub,521xueweihan/HelloGitHub,Python,2613,":octocat: åˆ†äº« GitHub ä¸Šæœ‰è¶£ã€å…¥é—¨çº§çš„å¼€æºé¡¹ç›®ã€‚Share interesting, entry-level open source projects on GitHub.",9323,75828,https://avatars.githubusercontent.com/u/8255800?u=2024c0f3979fd65c8aab945856eae0852f1186f6&v=4
21872392,awesome-machine-learning,josephmisiti/awesome-machine-learning,Python,999,"A curated list of awesome Machine Learning frameworks, libraries and software.",14258,60815,https://avatars.githubusercontent.com/u/246302?u=9242c80bcb25acbc66683faf0d5d9fb92674689b&v=4
32689863,manim,3b1b/manim,Python,945,Animation engine for explanatory math videos,5485,53905,https://avatars.githubusercontent.com/u/11601040?u=ccd223915efaad0958c195ce57bf46ab40d67873&v=4
101138315,d2l-zh,d2l-ai/d2l-zh,Python,2682,ã€ŠåŠ¨æ‰‹å­¦æ·±åº¦å­¦ä¹ ã€‹ï¼šé¢å‘ä¸­æ–‡è¯»è€…ã€èƒ½è¿è¡Œã€å¯è®¨è®ºã€‚ä¸­è‹±æ–‡ç‰ˆè¢«70å¤šä¸ªå›½å®¶çš„500å¤šæ‰€å¤§å­¦ç”¨äºæ•™å­¦ã€‚,9657,48954,https://avatars.githubusercontent.com/u/43974506?v=4
188660663,Real-Time-Voice-Cloning,CorentinJ/Real-Time-Voice-Cloning,Python,3051,Clone a voice in 5 seconds to generate arbitrary speech in real-time,8187,47380,https://avatars.githubusercontent.com/u/12038136?u=e6c8b4d673fba64e7d29b29605ce9c868094423b&v=4
41058054,CppCoreGuidelines,isocpp/CppCoreGuidelines,Python,1063,"The C++ Core Guidelines are a set of tried-and-true guidelines, rules, and best practices about coding in C++",5327,39660,https://avatars.githubusercontent.com/u/13841574?v=4
254832799,hackingtool,Z4nzu/hackingtool,Python,4941,ALL IN ONE Hacking Tool For Hackers,4333,39191,https://avatars.githubusercontent.com/u/25708027?u=43d51529db320284423e8eab65383767c6f52fa7&v=4
422274596,ColossalAI,hpcaitech/ColossalAI,Python,2682,"Making large AI models cheaper, faster and more accessible",3938,34482,https://avatars.githubusercontent.com/u/88699314?v=4
91573538,12306,testerSunshine/12306,Python,1303,12306æ™ºèƒ½åˆ·ç¥¨ï¼Œè®¢ç¥¨,9701,32487,https://avatars.githubusercontent.com/u/20162049?u=e84bd901b23092ebb2411aa370ec688573b2b191&v=4
265612440,TTS,coqui-ai/TTS,Python,5009,"ğŸ¸ğŸ’¬ - a deep learning toolkit for Text-to-Speech, battle-tested in research and production",2195,19340,https://avatars.githubusercontent.com/u/75583352?v=4
179893494,numpy-ml,ddbourgin/numpy-ml,Python,1419,"Machine learning, in numpy",3507,13669,https://avatars.githubusercontent.com/u/4887372?u=99d90201718bfc6ce9891eaf8d424069d2423565&v=4
676676006,Fooocus,lllyasviel/Fooocus,Python,4489,Focus on prompting and generating,913,12705,https://avatars.githubusercontent.com/u/19834515?u=4c7144779a6b13904fec478c4e98e676b91516ee&v=4
333483116,changedetection.io,dgtlmoon/changedetection.io,Python,2509,"The best and simplest free open source website change detection, restock monitor and notification service. Restock Monitor, change detection. Designed for simplicity - Simply monitor which websites had a text change for free. Free Open source web page change detection, Website defacement monitoring, Price change and Price Drop notification",688,12488,https://avatars.githubusercontent.com/u/275001?u=94abd34c8fa06db18e09f1e6ade5a3f4f1202f9f&v=4
682604510,codellama,facebookresearch/codellama,Python,4208,Inference code for CodeLlama models,878,10048,https://avatars.githubusercontent.com/u/16943930?v=4
599547518,vllm,vllm-project/vllm,Python,1732,A high-throughput and memory-efficient inference and serving engine for LLMs,806,7519,https://avatars.githubusercontent.com/u/136984999?v=4
672176742,VALL-E-X,Plachtaa/VALL-E-X,Python,5008,An open source implementation of Microsoft's VALL-E X zero-shot TTS model. Demo is available in https://plachtaa.github.io,487,5523,https://avatars.githubusercontent.com/u/112609742?u=48fbb584e06a79bc1194678bd6baf81df0e855ae&v=4
656099147,embedchain,embedchain/embedchain,Python,1168,"Data platform for LLMs - Load, index, retrieve and sync any unstructured data",960,5278,https://avatars.githubusercontent.com/u/137054526?v=4
662028682,gaussian-splatting,graphdeco-inria/gaussian-splatting,Python,2330,"Original reference implementation of ""3D Gaussian Splatting for Real-Time Radiance Field Rendering""",355,4526,https://avatars.githubusercontent.com/u/107077851?v=4
679237742,gpt-pilot,Pythagora-io/gpt-pilot,Python,3409,Dev tool that writes scalable apps from scratch while the developer oversees the implementation,356,4446,https://avatars.githubusercontent.com/u/123263103?v=4
587050620,dspy,stanfordnlp/dspy,Python,1302,DSPy: The framework for programming with foundation models,169,3065,https://avatars.githubusercontent.com/u/3046006?v=4
253975496,Resume-Matcher,srbhr/Resume-Matcher,Python,1346,"Resume Matcher is an open source, free tool to improve your resume. It works by using language models to compare and rank resumes with job descriptions. ",629,3017,https://avatars.githubusercontent.com/u/54472864?u=05093561f3f8394688e89afaa30542451c3faa23&v=4
671269505,litellm,BerriAI/litellm,Python,617,"Use any LLM as a drop in replacement for GPT. Use Azure, OpenAI, Cohere, Anthropic, Ollama, VLLM, Sagemaker, HuggingFace, Replicate (100+ LLMs)",90,1414,https://avatars.githubusercontent.com/u/121462774?v=4
680173591,graph-of-thoughts,spcl/graph-of-thoughts,Python,696,"Official Implementation of ""Graph of Thoughts: Solving Elaborate Problems with Large Language Models""",75,1384,https://avatars.githubusercontent.com/u/31108244?v=4
681075491,Qwen-VL,QwenLM/Qwen-VL,Python,838,The official repo of Qwen-VL (é€šä¹‰åƒé—®-VL) chat & pretrained large vision language model proposed by Alibaba Cloud.,88,1339,https://avatars.githubusercontent.com/u/141221163?v=4
