id,name,full_name,language,new stars,description,forks_count,stargazers_count,avatar_url
49609581,PowerShell,PowerShell/PowerShell,C#,17,PowerShell for every system!,4680,29695,https://avatars.githubusercontent.com/u/11524380?v=4
17620347,aspnetcore,dotnet/aspnetcore,C#,6,"ASP.NET Core is a cross-platform .NET framework for building modern cloud-based web applications on Windows, Mac, or Linux.",6912,26009,https://avatars.githubusercontent.com/u/9141961?v=4
70104825,eShopOnContainers,dotnet-architecture/eShopOnContainers,C#,11,"Cross-platform .NET sample microservices and container based application that runs on Linux Windows and macOS. Powered by .NET 5, Docker Containers and Azure Kubernetes Services. Supports Visual Studio, VS for Mac and CLI based environments with Docker CLI, dotnet CLI, VS Code or any other code editor.",7964,18843,https://avatars.githubusercontent.com/u/27453006?v=4
164140756,Files,files-community/Files,C#,104,A modern file manager that pushes the boundaries of the platform.,681,12412,https://avatars.githubusercontent.com/u/65931357?v=4
28239455,AspNetCore.Docs,dotnet/AspNetCore.Docs,C#,4,Documentation for ASP.NET Core,22786,9713,https://avatars.githubusercontent.com/u/9141961?v=4
64290739,practical-aspnetcore,dodyg/practical-aspnetcore,C#,7,"Practical samples of ASP.NET Core 2.1, 2.2, 3.1, 5.0 and 6.0 RC1 projects you can use. Readme contains explanations on all projects.",786,5997,https://avatars.githubusercontent.com/u/1761249?u=039d95f84152732f2b07f23e22a0482a2540e837&v=4
50605426,MixedRealityToolkit-Unity,microsoft/MixedRealityToolkit-Unity,C#,3,Mixed Reality Toolkit (MRTK) provides a set of components and features to accelerate cross-platform MR app development in Unity.,1862,4706,https://avatars.githubusercontent.com/u/6154722?v=4
19216825,xamarin-forms-samples,xamarin/xamarin-forms-samples,C#,0,Sample apps built using the Xamarin.Forms framework,6719,3960,https://avatars.githubusercontent.com/u/790012?v=4
243854166,tye,dotnet/tye,C#,1,"Tye is a tool that makes developing, testing, and deploying microservices and distributed applications easier. Project Tye includes a local orchestrator to make developing microservices easier and the ability to deploy microservices to Kubernetes with minimal configuration.",386,3753,https://avatars.githubusercontent.com/u/9141961?v=4
166270225,blazor-workshop,dotnet-presentations/blazor-workshop,C#,3,Blazor workshop,1043,2419,https://avatars.githubusercontent.com/u/31487945?v=4
372096057,Bili.Uwp,Richasy/Bili.Uwp,C#,56,适用于新系统UI的哔哩,126,2050,https://avatars.githubusercontent.com/u/27713596?u=9566724713f4741794fb48625c333fdedc5e5f1d&v=4
342637264,CleanArchitecture,blazorhero/CleanArchitecture,C#,5,Clean Architecture Template for Blazor WebAssembly Built with MudBlazor Components.,313,1954,https://avatars.githubusercontent.com/u/76645960?v=4
142192459,Seatbelt,GhostPack/Seatbelt,C#,1,"Seatbelt is a C# project that performs a number of security oriented host-survey ""safety checks"" relevant from both offensive and defensive security perspectives.",382,1899,https://avatars.githubusercontent.com/u/41304335?v=4
119571446,samples,dotnet/samples,C#,2,Sample code referenced by the .NET documentation,3292,1767,https://avatars.githubusercontent.com/u/9141961?v=4
288428676,MudBlazor,MudBlazor/MudBlazor,C#,7,"Blazor Component Library based on Material design. The goal is to do more with Blazor, utilizing CSS and keeping Javascript to a bare minimum.",335,1677,https://avatars.githubusercontent.com/u/79755064?v=4
381444656,CVE-2021-1675,cube0x0/CVE-2021-1675,C#,2,C# and Impacket implementation of PrintNightmare CVE-2021-1675/CVE-2021-34527,513,1394,https://avatars.githubusercontent.com/u/39370848?u=e4a5e8b9d78ef928570bd33c1133482f6341c919&v=4
158405551,Git-Credential-Manager-Core,microsoft/Git-Credential-Manager-Core,C#,5,"Secure, cross-platform Git credential storage with authentication to GitHub, Azure Repos, and other popular Git hosting services.",243,1285,https://avatars.githubusercontent.com/u/6154722?v=4
282637924,BBDown,nilaoda/BBDown,C#,92,Bilibili Downloader. 一款命令行式哔哩哔哩下载器.,166,1205,https://avatars.githubusercontent.com/u/20772925?u=6332a7ef3fc5f4f6ce844a764e912638fc01b64a&v=4
116210568,ScottPlot,ScottPlot/ScottPlot,C#,2,Interactive Plotting Library for .NET,170,1038,https://avatars.githubusercontent.com/u/76536295?v=4
156150461,MemTestHelper,integralfx/MemTestHelper,C#,6,C# WPF to automate HCI MemTest,95,878,https://avatars.githubusercontent.com/u/16512539?u=40fd6a378f948bd0df2bc7043b0f3cd9980ff03d&v=4
262661480,warp-plus-cloudflare,ALIILAPRO/warp-plus-cloudflare,C#,3,Script for getting unlimited GB on Warp+ ( https://1.1.1.1/ ),308,690,https://avatars.githubusercontent.com/u/27723504?u=ddfc79a712086278d16ebba38bffbd1ef8e185ab&v=4
101895131,dd-trace-dotnet,DataDog/dd-trace-dotnet,C#,0,.NET Tracer for Datadog APM,76,151,https://avatars.githubusercontent.com/u/365230?v=4
406398950,paradox-compress,pornin/paradox-compress,C#,17,Paper and Demo Implementation of Paradoxical Compression with VDF,0,62,https://avatars.githubusercontent.com/u/14964627?v=4
379756931,WrathMods-TabletopTweaks,Vek17/WrathMods-TabletopTweaks,C#,0,Tabletop Tweaks is a mod that seeks to adjust the cRPG rules to more closely follow the tabletop ruleset. Additionally it adds content missing from the base game. ,15,40,https://avatars.githubusercontent.com/u/2959420?v=4
347346029,ToyBox,cabarius/ToyBox,C#,2,"Toy Box is a cute and playful mod with 300+ cheats, tweaks and quality of life improvements for Pathfinder: WoTR. It was created in the spirit of Bag of Tricks & Cheat Menu but with a little different focus . It of a powerful and convenient way to edit the party composition, stats, search and add Feats, Features, Items, etc. to party members.",19,36,https://avatars.githubusercontent.com/u/331144?u=2a66f8cff3b0a0e85a9ef94b8c20cd99aa2157ab&v=4
