id,name,full_name,language,new stars,description,forks_count,stargazers_count,avatar_url
160640094,LeetCodeAnimation,MisterBooo/LeetCodeAnimation,Java,26,Demonstrate all the questions on LeetCode in the form of animation.ï¼ˆç”¨åŠ¨ç”»çš„å½¢å¼å‘ˆç°è§£LeetCodeé¢˜ç›®çš„æ€è·¯ï¼‰,13896,72969,https://avatars.githubusercontent.com/u/15308811?u=de057d7742b3c51c5078e58008323702a941772b&v=4
2990192,Signal-Android,signalapp/Signal-Android,Java,3,A private messenger for Android.,5756,23571,https://avatars.githubusercontent.com/u/702459?v=4
41889031,NewPipe,TeamNewPipe/NewPipe,Java,26,A libre lightweight streaming front-end for Android.,2648,23546,https://avatars.githubusercontent.com/u/22159318?v=4
149001365,leetcode,doocs/leetcode,Java,10,ğŸ˜ LeetCode solutions in any programming language | å¤šç§ç¼–ç¨‹è¯­è¨€å®ç° LeetCodeã€ã€Šå‰‘æŒ‡ Offerï¼ˆç¬¬ 2 ç‰ˆï¼‰ã€‹ã€ã€Šç¨‹åºå‘˜é¢è¯•é‡‘å…¸ï¼ˆç¬¬ 6 ç‰ˆï¼‰ã€‹é¢˜è§£,3942,21930,https://avatars.githubusercontent.com/u/43716716?v=4
44804216,termux-app,termux/termux-app,Java,70,Termux - a terminal emulator application for Android OS extendible by variety of packages.,2525,21276,https://avatars.githubusercontent.com/u/8104776?v=4
89822531,Mindustry,Anuken/Mindustry,Java,8,The automation tower defense RTS,2468,17732,https://avatars.githubusercontent.com/u/10100000?u=68ab9a0372ef750cbb75c4d9aee9f183b5fb92e3&v=4
482520194,Grasscutter,Grasscutters/Grasscutter,Java,7,A server software reimplementation for a certain anime game.,4166,13107,https://avatars.githubusercontent.com/u/104039209?v=4
391055597,DSA-Bootcamp-Java,kunal-kushwaha/DSA-Bootcamp-Java,Java,14,"This repository consists of the code samples, assignments, and notes for the Java Data Structures & Algorithms bootcamp of Community Classroom.",7810,11542,https://avatars.githubusercontent.com/u/42698533?u=0616d4134feefbd4d9078bb8070a097beedb903d&v=4
320785435,LSPosed,LSPosed/LSPosed,Java,17,LSPosed Framework,1439,9735,https://avatars.githubusercontent.com/u/75879071?v=4
50160261,Paper,PaperMC/Paper,Java,2,High performance Spigot fork that aims to fix gameplay and mechanics inconsistencies,1866,7395,https://avatars.githubusercontent.com/u/7608950?v=4
311241324,Ehviewer_CN_SXJ,xiaojieonly/Ehviewer_CN_SXJ,Java,5,ehviewerï¼Œç”¨çˆ±å‘ç”µï¼Œå¿«ä¹å‰è¡Œ,236,6027,https://avatars.githubusercontent.com/u/49278135?u=47f3db69acd9fc29374a82ad91323a3c3a51490a&v=4
37844001,HMCL,huanghongxun/HMCL,Java,5,"A Minecraft Launcher which is multi-functional, cross-platform and popular",561,5132,https://avatars.githubusercontent.com/u/5411982?u=0205537714fe0efd1d55bd2540e0600fb1de2a57&v=4
81467673,gnirehtet,Genymobile/gnirehtet,Java,10,Gnirehtet provides reverse tethering for Android,498,5118,https://avatars.githubusercontent.com/u/3427627?v=4
57461213,runelite,runelite/runelite,Java,2,Open source Old School RuneScape client,4822,4133,https://avatars.githubusercontent.com/u/13814776?v=4
506449138,TVBoxOSC,CatVodTVOfficial/TVBoxOSC,Java,9,çœŸçš„æ²¡æœ‰QQç¾¤ã€QQé¢‘é“ã€è®ºå›ã€‚æ‰“åŒ…åˆ†å‘æ³¨æ„å¼€æºåè®®ï¼Œä¿ç•™å‡ºå¤„ï¼Œä¸å®ˆè§„çŸ©å°±ä¸è¦æã€‚,3404,3979,https://avatars.githubusercontent.com/u/107997140?v=4
220875250,novel,201206030/novel,Java,17,novel æ˜¯ä¸€å¥—åŸºäºæ—¶ä¸‹æœ€æ–° Java æŠ€æœ¯æ ˆ Spring Boot 3 + Vue 3 å¼€å‘çš„å‰åç«¯åˆ†ç¦»å­¦ä¹ å‹å°è¯´é¡¹ç›®ï¼Œé…å¤‡ä¿å§†çº§æ•™ç¨‹æ‰‹æŠŠæ‰‹æ•™ä½ ä»é›¶å¼€å§‹å¼€å‘ä¸Šçº¿ä¸€å¥—ç”Ÿäº§çº§åˆ«çš„ Java ç³»ç»Ÿï¼Œç”±å°è¯´é—¨æˆ·ç³»ç»Ÿã€ä½œå®¶åå°ç®¡ç†ç³»ç»Ÿã€å¹³å°åå°ç®¡ç†ç³»ç»Ÿç­‰å¤šä¸ªå­ç³»ç»Ÿæ„æˆã€‚åŒ…æ‹¬å°è¯´æ¨èã€ä½œå“æ£€ç´¢ã€å°è¯´æ’è¡Œæ¦œã€å°è¯´é˜…è¯»ã€å°è¯´è¯„è®ºã€ä¼šå‘˜ä¸­å¿ƒã€ä½œå®¶ä¸“åŒºã€å……å€¼è®¢é˜…ã€æ–°é—»å‘å¸ƒç­‰åŠŸèƒ½ã€‚,1154,3923,https://avatars.githubusercontent.com/u/12478753?u=c862a26d856134a3733f3f90a2a25e4f7dc09684&v=4
195856796,Geyser,GeyserMC/Geyser,Java,2,A bridge/proxy allowing you to connect to Minecraft: Java Edition servers with Minecraft: Bedrock Edition.,556,3869,https://avatars.githubusercontent.com/u/52673035?v=4
268006778,AppManager,MuntashirAkon/AppManager,Java,2,A full-featured package manager and viewer for Android,190,2658,https://avatars.githubusercontent.com/u/8176128?u=53e3819d7b557737dfca5a2fcbab2d420f29d6f2&v=4
155870299,house,wenbochang888/house,Java,11,æœ‰å®Œæ•´ç‰ˆçš„PDFä¸‹è½½ã€‚,282,2004,https://avatars.githubusercontent.com/u/26178822?u=9b4b8283958b57747049cd4a72562cdbe23370f8&v=4
51639229,limbo,limboemu/limbo,Java,3,"Limbo is a QEMU-based emulator for Android. It currently supports x86, ARM, PowerPC, and Sparc emulation  for Intel x86 and ARM android devices. See wiki https://virtualmachinery.weebly.com for APK download and Instructions.",392,1926,https://avatars.githubusercontent.com/u/17214991?u=3c385d48696ff5fbc5163fb29c01cc299ce580cf&v=4
325134656,PojavLauncher_iOS,PojavLauncherTeam/PojavLauncher_iOS,Java,5,A Minecraft: Java Edition Launcher for Android and iOS based on Boardwalk. This repository contains source code for iOS/iPadOS platform.,232,1360,https://avatars.githubusercontent.com/u/69146964?v=4
298323699,vprofile-project,devopshydclub/vprofile-project,Java,1,,4444,980,https://avatars.githubusercontent.com/u/46835275?v=4
245713683,PowerTunnel-Android,krlvm/PowerTunnel-Android,Java,4,Powerful and extensible proxy server with anti-censorship functionality for Android,77,733,https://avatars.githubusercontent.com/u/51774833?u=4eda0d81edd72b9f0a670424ae9ab6fbc27610c3&v=4
484555616,spring-boot-microservices,SaiUpadhyayula/spring-boot-microservices,Java,1,This repository contains the latest source code of th spring-boot-microservices tutorial,290,314,https://avatars.githubusercontent.com/u/4116717?u=ae977109c802462864f140cb83f73953c1a9c2bd&v=4
558274787,master-spring-and-spring-boot,in28minutes/master-spring-and-spring-boot,Java,2,Spring and Spring Boot Tutorial For Absolute Beginners - 10-in-1 - Spring to Spring Boot to REST API to Full Stack to Containers to Cloud,205,300,https://avatars.githubusercontent.com/u/14139137?u=470646fa3e61c80cf555680d9290c1bb26b2e16a&v=4
