id,name,full_name,language,new stars,description,forks_count,stargazers_count,avatar_url
3482588,SecLists,danielmiessler/SecLists,PHP,20,"SecLists is the security tester's companion. It's a collection of multiple types of lists used during security assessments, collected in one place. List types include usernames, passwords, URLs, sensitive data patterns, fuzzing payloads, web shells, and many more.",22832,45991,https://avatars.githubusercontent.com/u/50654?u=0d35f31485a5db1e88321b477ce5ebc116ae6a32&v=4
7548986,framework,laravel/framework,PHP,5,The Laravel Framework.,9995,29313,https://avatars.githubusercontent.com/u/958072?v=4
1420053,guzzle,guzzle/guzzle,PHP,2,"Guzzle, an extensible PHP HTTP client",2384,22481,https://avatars.githubusercontent.com/u/638632?v=4
2889328,WordPress,WordPress/WordPress,PHP,8,"WordPress, Git-ified. This repository is just a mirror of the WordPress subversion repository. Please do not send pull requests. Submit pull requests to https://github.com/WordPress/wordpress-develop and patches to https://core.trac.wordpress.org/ instead.",12229,17350,https://avatars.githubusercontent.com/u/276006?v=4
47495360,koel,koel/koel,PHP,4,🐦 A personal music streaming server that works.,1847,14592,https://avatars.githubusercontent.com/u/20983373?v=4
22553797,grav,getgrav/grav,PHP,7,"Modern, Crazy Fast, Ridiculously Easy and Amazingly Powerful Flat-File CMS powered by PHP, Markdown, Twig, and Symfony",1379,13752,https://avatars.githubusercontent.com/u/8237355?v=4
21298446,firefly-iii,firefly-iii/firefly-iii,PHP,13,Firefly III: a personal finances manager,1032,10242,https://avatars.githubusercontent.com/u/22821986?v=4
2699935,PHP_CodeSniffer,squizlabs/PHP_CodeSniffer,PHP,3,PHP_CodeSniffer tokenizes PHP files and detects violations of a defined set of coding standards.,1514,10138,https://avatars.githubusercontent.com/u/997547?v=4
11467667,typecho,typecho/typecho,PHP,7,A PHP Blogging Platform. Simple and Powerful.,1905,9922,https://avatars.githubusercontent.com/u/2030842?v=4
2179920,woocommerce,woocommerce/woocommerce,PHP,7,"A customizable, open-source ecommerce platform built on WordPress. Build any commerce solution you can imagine.",10751,8478,https://avatars.githubusercontent.com/u/473596?v=4
14346979,snipe-it,snipe/snipe-it,PHP,4,A free open source IT asset/license management system,2576,7916,https://avatars.githubusercontent.com/u/197404?u=3a3faa7eb52d0ccb5d757cab2633677328bbffb2&v=4
14716368,invoiceninja,invoiceninja/invoiceninja,PHP,6,"Invoices, Expenses and Tasks built with Laravel, Flutter and React",2075,7022,https://avatars.githubusercontent.com/u/15712270?v=4
248372441,filament,filamentphp/filament,PHP,11,"Admin panel, form builder and table builder for Laravel. Built with the TALL stack. Designed for humans.",967,6410,https://avatars.githubusercontent.com/u/64450473?v=4
95011974,akaunting,akaunting/akaunting,PHP,6,Free and Online Accounting Software,2051,6151,https://avatars.githubusercontent.com/u/26357771?v=4
47508644,panel,pterodactyl/panel,PHP,3,"Pterodactyl® is a free, open-source game server management panel built with PHP, React, and Go. Designed with security in mind, Pterodactyl runs all game servers in isolated Docker containers while exposing a beautiful and intuitive UI to end users.",1241,4875,https://avatars.githubusercontent.com/u/16179146?v=4
158374929,laravel-websockets,beyondcode/laravel-websockets,PHP,2,Websockets for Laravel. Done right.,525,4762,https://avatars.githubusercontent.com/u/38242993?v=4
153069455,dockerlabs,collabnix/dockerlabs,PHP,24,Docker  - Beginners | Intermediate | Advanced,1661,3481,https://avatars.githubusercontent.com/u/34368930?u=ff71ff4c8e33ab6410f4594403d82a8f036c0dcb&v=4
69691727,PocketMine-MP,pmmp/PocketMine-MP,PHP,0,A server software for Minecraft: Bedrock Edition in PHP,1682,3036,https://avatars.githubusercontent.com/u/22548559?v=4
143975804,Lychee,LycheeOrg/Lychee,PHP,5," A great looking and easy-to-use photo-management-system you can run on your server, to manage and share photos.",234,2538,https://avatars.githubusercontent.com/u/37916028?v=4
433383766,all-in-one,nextcloud/all-in-one,PHP,1,Nextcloud AIO stands for Nextcloud All In One and provides easy deployment and maintenance with most features included in this one Nextcloud instance.,267,1718,https://avatars.githubusercontent.com/u/19211038?v=4
440577490,lunar,lunarphp/lunar,PHP,65,An open-source package that brings the power of modern headless e-commerce functionality to Laravel.,163,1068,https://avatars.githubusercontent.com/u/112434999?v=4
617662019,subvert,aschmelyun/subvert,PHP,6,"Generate subtitles, summaries, and chapters from videos in seconds",28,465,https://avatars.githubusercontent.com/u/3395980?u=1ef87aef3606642044d5156c9ed08e5651a073af&v=4
625190623,laravel-date-scopes,laracraft-tech/laravel-date-scopes,PHP,38,Some useful date scopes for your Laravel Eloquent models!,10,239,https://avatars.githubusercontent.com/u/114224032?v=4
444386140,livewire-starter-kit,lunarphp/livewire-starter-kit,PHP,4,Demonstration store for Lunar,29,60,https://avatars.githubusercontent.com/u/112434999?v=4
627593973,laramentor,laramentor/laramentor,PHP,1,Laravel Mentorship Platform,11,21,https://avatars.githubusercontent.com/u/130701930?v=4
