id,name,full_name,language,new stars,description,forks_count,stargazers_count,avatar_url
132464395,JavaGuide,Snailclimb/JavaGuide,Java,45,ã€ŒJavaå­¦ä¹ +é¢è¯•æŒ‡å—ã€ä¸€ä»½æ¶µç›–å¤§éƒ¨åˆ† Java ç¨‹åºå‘˜æ‰€éœ€è¦æŒæ¡çš„æ ¸å¿ƒçŸ¥è¯†ã€‚å‡†å¤‡ Java é¢è¯•ï¼Œé¦–é€‰ JavaGuideï¼,44653,136206,https://avatars.githubusercontent.com/u/29880145?u=d2f8361655b9ebd973f5375acf014500bc0a4197&v=4
22790488,java-design-patterns,iluwatar/java-design-patterns,Java,10,Design patterns implemented in Java,25390,83273,https://avatars.githubusercontent.com/u/582346?u=7aecf4c397c8dffaf0b84bd4c9d4198290f00de1&v=4
507775,elasticsearch,elastic/elasticsearch,Java,29,"Free and Open, Distributed, RESTful Search Engine",23455,64803,https://avatars.githubusercontent.com/u/6764390?v=4
20300177,guava,google/guava,Java,9,Google core libraries for Java,10704,48127,https://avatars.githubusercontent.com/u/1342004?v=4
159152904,jeecg-boot,jeecgboot/jeecg-boot,Java,16,ğŸ”¥ã€Œä¼ä¸šçº§ä½ä»£ç å¹³å°ã€å‰åç«¯åˆ†ç¦»æ¶æ„SpringBoot 2.xï¼ŒSpringCloudï¼ŒAnt Design&Vueï¼ŒMybatisï¼ŒShiroï¼ŒJWTã€‚å¼ºå¤§çš„ä»£ç ç”Ÿæˆå™¨è®©å‰åç«¯ä»£ç ä¸€é”®ç”Ÿæˆï¼Œæ— éœ€å†™ä»»ä½•ä»£ç ! å¼•é¢†æ–°çš„å¼€å‘æ¨¡å¼OnlineCoding->ä»£ç ç”Ÿæˆ->æ‰‹å·¥MERGEï¼Œå¸®åŠ©Javaé¡¹ç›®è§£å†³70%é‡å¤å·¥ä½œï¼Œè®©å¼€å‘æ›´å…³æ³¨ä¸šåŠ¡ï¼Œæ—¢èƒ½å¿«é€Ÿæé«˜æ•ˆç‡ï¼Œå¸®åŠ©å…¬å¸èŠ‚çœæˆæœ¬ï¼ŒåŒæ—¶åˆä¸å¤±çµæ´»æ€§ã€‚,13820,35611,https://avatars.githubusercontent.com/u/86360035?v=4
11267509,glide,bumptech/glide,Java,2,An image loading and caching library for Android focused on smooth scrolling,6095,33837,https://avatars.githubusercontent.com/u/423539?v=4
44662669,dbeaver,dbeaver/dbeaver,Java,28,Free universal database tool and SQL client,3007,33377,https://avatars.githubusercontent.com/u/34743864?v=4
120395176,easyexcel,alibaba/easyexcel,Java,17,å¿«é€Ÿã€ç®€æ´ã€è§£å†³å¤§æ–‡ä»¶å†…å­˜æº¢å‡ºçš„javaå¤„ç†Excelå·¥å…·,7183,28761,https://avatars.githubusercontent.com/u/1961952?v=4
47023603,xxl-job,xuxueli/xxl-job,Java,10,A distributed task scheduling framework.ï¼ˆåˆ†å¸ƒå¼ä»»åŠ¡è°ƒåº¦å¹³å°XXL-JOBï¼‰,10328,25003,https://avatars.githubusercontent.com/u/10633817?u=89329d69ca512f24ce0ee669bf679e30c9503243&v=4
128018428,Sentinel,alibaba/Sentinel,Java,3,"A powerful flow control component enabling reliability, resilience and monitoring for microservices. (é¢å‘äº‘åŸç”Ÿå¾®æœåŠ¡çš„é«˜å¯ç”¨æµæ§é˜²æŠ¤ç»„ä»¶)",7748,21305,https://avatars.githubusercontent.com/u/1961952?v=4
20818126,ExoPlayer,google/ExoPlayer,Java,7,An extensible media player for Android,6008,20957,https://avatars.githubusercontent.com/u/1342004?v=4
148496687,SpringBoot-Labs,yudaocode/SpringBoot-Labs,Java,7,ä¸€ä¸ªæ¶µç›–å…­ä¸ªä¸“æ ï¼šSpring Boot 2.Xã€Spring Cloudã€Spring Cloud Alibabaã€Dubboã€åˆ†å¸ƒå¼æ¶ˆæ¯é˜Ÿåˆ—ã€åˆ†å¸ƒå¼äº‹åŠ¡çš„ä»“åº“ã€‚å¸Œæœ›èƒ–å‹å°æ‰‹ä¸€æŠ–ï¼Œå³ä¸Šè§’æ¥ä¸ª Starï¼Œæ„Ÿæ© 1024,5649,17368,https://avatars.githubusercontent.com/u/124941343?v=4
501687,antlr4,antlr/antlr4,Java,15,"ANTLR (ANother Tool for Language Recognition) is a powerful parser generator for reading, processing, executing, or translating structured text or binary files.",3124,15069,https://avatars.githubusercontent.com/u/80584?v=4
23418517,hadoop,apache/hadoop,Java,6,Apache Hadoop,8547,13760,https://avatars.githubusercontent.com/u/47359?v=4
120463532,COLA,alibaba/COLA,Java,15,ğŸ¥¤ COLA: Clean Object-oriented & Layered Architecture,2731,10282,https://avatars.githubusercontent.com/u/1961952?v=4
481412,Java-WebSocket,TooTallNate/Java-WebSocket,Java,3,A barebones WebSocket client and server implementation written in 100% Java.,2558,9919,https://avatars.githubusercontent.com/u/71256?u=d6a9598cd7963ae290923ab12afeff947f542f80&v=4
46398090,datahub,datahub-project/datahub,Java,8,The Metadata Platform for the Modern Data Stack,2379,8148,https://avatars.githubusercontent.com/u/78121374?v=4
140543886,shenyu,apache/shenyu,Java,10,"Apache ShenYu is a Java native API Gateway for service proxy, protocol conversion and API governance.",2799,8005,https://avatars.githubusercontent.com/u/47359?v=4
33816473,testcontainers-java,testcontainers/testcontainers-java,Java,6,"Testcontainers is a Java library that supports JUnit tests, providing lightweight, throwaway instances of common databases, Selenium web browsers, or anything else that can run in a Docker container.",1489,7263,https://avatars.githubusercontent.com/u/13393021?v=4
50904245,beam,apache/beam,Java,8,Apache Beam is a unified programming model for Batch and Streaming data processing.,4014,7070,https://avatars.githubusercontent.com/u/47359?v=4
247659028,PowerJob,PowerJob/PowerJob,Java,4,Enterprise job scheduling middleware with distributed computing ability.,1018,5718,https://avatars.githubusercontent.com/u/69085084?v=4
312830970,wvp-GB28181-pro,648540858/wvp-GB28181-pro,Java,4,WEB VIDEO PLATFORMæ˜¯ä¸€ä¸ªåŸºäºGB28181-2016æ ‡å‡†å®ç°çš„ç½‘ç»œè§†é¢‘å¹³å°ï¼Œæ”¯æŒNATç©¿é€ï¼Œæ”¯æŒæµ·åº·ã€å¤§åã€å®‡è§†ç­‰å“ç‰Œçš„IPCã€NVRã€DVRæ¥å…¥ã€‚æ”¯æŒå›½æ ‡çº§è”ï¼Œæ”¯æŒrtsp/rtmpç­‰è§†é¢‘æµè½¬å‘åˆ°å›½æ ‡å¹³å°ï¼Œæ”¯æŒrtsp/rtmpç­‰æ¨æµè½¬å‘åˆ°å›½æ ‡å¹³å°ã€‚,1136,3564,https://avatars.githubusercontent.com/u/18274453?u=0650a1000adb880f9ce571206435ed61b7410fe2&v=4
218396611,djl,deepjavalibrary/djl,Java,8,An Engine-Agnostic Deep Learning Framework in Java,565,3428,https://avatars.githubusercontent.com/u/82605399?v=4
631993417,midjourney-proxy,novicezk/midjourney-proxy,Java,9,ä»£ç† MidJourney çš„discordé¢‘é“ï¼Œå®ç°apiå½¢å¼è°ƒç”¨AIç»˜å›¾,1454,2669,https://avatars.githubusercontent.com/u/20700387?u=0c9bb78572cc82757982b28984ab32aa7a23ad7c&v=4
605357456,PlayEdu,PlayEdu/PlayEdu,Java,48,PlayEdu æ˜¯ä¸€æ¬¾é€‚ç”¨äºæ­å»ºå†…éƒ¨åŸ¹è®­å¹³å°çš„å¼€æºç³»ç»Ÿï¼Œæ—¨åœ¨ä¸ºä¼ä¸š/æœºæ„æ‰“é€ è‡ªå·±å“ç‰Œçš„å†…éƒ¨åŸ¹è®­å¹³å°ã€‚,263,1672,https://avatars.githubusercontent.com/u/123158174?v=4
