id,name,full_name,language,new stars,description,forks_count,stargazers_count,avatar_url
27574418,nerd-fonts,ryanoasis/nerd-fonts,CSS,20,"Iconic font aggregator, collection, & patcher. 3,600+ icons, 50+ patched fonts: Hack, Source Code Pro, more. Glyph collections: Font Awesome, Material Design Icons, Octicons, & more",3231,42291,https://avatars.githubusercontent.com/u/8083459?u=1645f43000c842a948268609231bdecb1433c470&v=4
313330998,50projects50days,bradtraversy/50projects50days,CSS,26,"50+ mini web projects using HTML, CSS & JS",7174,26762,https://avatars.githubusercontent.com/u/5550850?u=45352e59e108ddd00ead26981cd6a4a53b151b1d&v=4
49767244,primeng,primefaces/primeng,CSS,3,The Most Complete Angular UI Component Library,4107,8020,https://avatars.githubusercontent.com/u/3494069?v=4
19544711,github-markdown-css,sindresorhus/github-markdown-css,CSS,8,The minimal amount of CSS to replicate the GitHub Markdown style,2121,6903,https://avatars.githubusercontent.com/u/170270?u=34acd557a042ac478d273a4621570cadb6b0bd89&v=4
7517918,spring-petclinic,spring-projects/spring-petclinic,CSS,8,A sample Spring-based application,19220,6279,https://avatars.githubusercontent.com/u/317776?v=4
16466496,wysiwyg-editor,froala/wysiwyg-editor,CSS,1,The next generation Javascript WYSIWYG HTML Editor.,660,5056,https://avatars.githubusercontent.com/u/7966884?v=4
204008310,spicetify-themes,spicetify/spicetify-themes,CSS,3,A community-driven collection of themes for customizing Spotify through Spicetify - https://github.com/spicetify/spicetify-cli,1226,4125,https://avatars.githubusercontent.com/u/100136310?v=4
377305568,learn-to-cloud,learntocloud/learn-to-cloud,CSS,3,Learn the fundamentals of cloud computing,728,4040,https://avatars.githubusercontent.com/u/90214606?v=4
76666208,primereact,primefaces/primereact,CSS,5,The Most Complete React UI Component Library,690,3670,https://avatars.githubusercontent.com/u/3494069?v=4
160313905,primevue,primefaces/primevue,CSS,5,Next Generation Vue UI Component Library,669,3442,https://avatars.githubusercontent.com/u/3494069?v=4
299116052,react-projects,john-smilga/react-projects,CSS,6,,3373,3416,https://avatars.githubusercontent.com/u/42133389?u=9d63b6d71fba139347cddf2c840a858c8ff97168&v=4
420352316,project_modern_ui_ux_gpt3,adrianhajdin/project_modern_ui_ux_gpt3,CSS,4,Master the creation of Modern UX/UI Websites,671,2595,https://avatars.githubusercontent.com/u/24898559?u=fd2baba143bcb62cc0f2bc646ec33c2ba9ef013e&v=4
188703944,aprendiendo-react,midudev/aprendiendo-react,CSS,14,Curso para aprender React desde cero,422,2047,https://avatars.githubusercontent.com/u/1561955?u=9ebfec769d2505d88ee746b7389353c23312bca1&v=4
292673424,cloudflare-docs,cloudflare/cloudflare-docs,CSS,1,Cloudflare’s documentation,2071,1683,https://avatars.githubusercontent.com/u/314135?v=4
17098597,msys2.github.io,msys2/msys2.github.io,CSS,2,The MSYS2 homepage,216,1538,https://avatars.githubusercontent.com/u/6759993?v=4
12158395,justdelete.me,justdeleteme/justdelete.me,CSS,0,A directory of direct links to delete your account from web services.,431,1283,https://avatars.githubusercontent.com/u/22072454?v=4
173713559,argon-dashboard-react,creativetimofficial/argon-dashboard-react,CSS,0,React version of Argon Dashboard,411,385,https://avatars.githubusercontent.com/u/20172349?v=4
482952731,intro-to-dotnet-web-dev,dotnet/intro-to-dotnet-web-dev,CSS,2,"Get Started as a Web Developer with .NET, C#, and ASP.NET Core",427,362,https://avatars.githubusercontent.com/u/9141961?v=4
609917101,DescomplicandoArgoCD,badtuxx/DescomplicandoArgoCD,CSS,8,,23,99,https://avatars.githubusercontent.com/u/4606725?u=d21ee43d3eabc6cff5b289f537481eacd6657691&v=4
411733320,adminhub,fajarnurwahid/adminhub,CSS,5,"Website ini merupakan hasil slicing dari Figma ke responsive website menggunakan HTML, CSS, dan JavaScript",61,80,https://avatars.githubusercontent.com/u/64387801?u=17d0ca0236ed821112dbe290df0fbd48e69ad583&v=4
118762778,Login-Signup-form,Mehedi61/Login-Signup-form,CSS,0,Login & signup form using HTML & CSS.,157,55,https://avatars.githubusercontent.com/u/17181344?u=389a9d40c715fe19432798a1126da87a0169dc9a&v=4
321479252,react-hooks-information-flow-code-along,learn-co-curriculum/react-hooks-information-flow-code-along,CSS,0,,2275,11,https://avatars.githubusercontent.com/u/6208017?v=4
554833160,7697016-Front-End.1,OpenClassrooms-Student-Center/7697016-Front-End.1,CSS,0,,154,8,https://avatars.githubusercontent.com/u/20640174?v=4
609550146,kejutan-bunga,voidenterpriseid/kejutan-bunga,CSS,1,,6,8,https://avatars.githubusercontent.com/u/114378311?v=4
7535849,coh-forums-smf-theme,ZMYaro/coh-forums-smf-theme,CSS,0,City Of Heroes SMF Theme,1,0,https://avatars.githubusercontent.com/u/763405?v=4
