id,name,full_name,language,new stars,description,forks_count,stargazers_count,avatar_url
20159867,stb,nothings/stb,C,138,stb single-file public domain libraries for C/C++,7828,24201,https://avatars.githubusercontent.com/u/7525026?u=a23ba3a549fff291e35446cb32c8979bd29be6c9&v=4
15337142,micropython,micropython/micropython,C,50,MicroPython - a lean and efficient Python implementation for microcontrollers and constrained systems,7067,17753,https://avatars.githubusercontent.com/u/6298560?v=4
27737393,qmk_firmware,qmk/qmk_firmware,C,56,Open-source keyboard firmware for Atmel AVR and Arm USB families,35262,16414,https://avatars.githubusercontent.com/u/25358678?v=4
90320494,ish,ish-app/ish,C,58,Linux shell for iOS,837,15401,https://avatars.githubusercontent.com/u/38895825?v=4
60667730,lvgl,lvgl/lvgl,C,82,"Embedded graphics library to create beautiful UIs for any MCU, MPU and display type. It's boosted by a professional yet affordable drag and drop UI editor, called SquareLine Studio.",2830,14069,https://avatars.githubusercontent.com/u/19811762?v=4
470579591,unleashed-firmware,DarkFlippers/unleashed-firmware,C,195,Flipper Zero Unleashed Firmware,1201,13196,https://avatars.githubusercontent.com/u/115378555?v=4
179354282,OpenCorePkg,acidanthera/OpenCorePkg,C,38,OpenCore bootloader,2107,12407,https://avatars.githubusercontent.com/u/39672954?v=4
65899476,esp-idf,espressif/esp-idf,C,57,Espressif IoT Development Framework. Official development framework for Espressif SoCs.,6830,11830,https://avatars.githubusercontent.com/u/9460735?v=4
490465859,Flipper,UberGuidoZ/Flipper,C,172,Playground (and dump) of stuff I make or modify for the Flipper Zero,2781,10944,https://avatars.githubusercontent.com/u/57457139?u=3b283c3083a1fee457b897d7c8fda97b873e9807&v=4
437011,zfs,openzfs/zfs,C,19,OpenZFS on Linux and FreeBSD,1703,9854,https://avatars.githubusercontent.com/u/4510897?v=4
689344,RetroArch,libretro/RetroArch,C,41,"Cross-platform, sophisticated frontend for the libretro API. Licensed GPLv3.",1695,8773,https://avatars.githubusercontent.com/u/1812827?v=4
3791835,darktable,darktable-org/darktable,C,241,darktable is an open source photography workflow application and raw developer,1060,8492,https://avatars.githubusercontent.com/u/1561544?v=4
2328181,freebsd-src,freebsd/freebsd-src,C,25,The FreeBSD src tree publish-only repository. Experimenting with 'simple' pull requests....,2737,7279,https://avatars.githubusercontent.com/u/811839?v=4
8046269,libwebsockets,warmcat/libwebsockets,C,301,canonical libwebsockets.org networking library,1436,4377,https://avatars.githubusercontent.com/u/1497695?v=4
466575180,portal64,lambertjamesd/portal64,C,48,A demake of Portal for the Nintendo 64,69,2982,https://avatars.githubusercontent.com/u/7006901?u=9f5a4aa0f1a95c24a2b14bf38c14f59526b1cc45&v=4
32148604,inav,iNavFlight/inav,C,26,INAV: Navigation-enabled flight control software,1348,2709,https://avatars.githubusercontent.com/u/15979895?v=4
226167620,InfiniTime,InfiniTimeOrg/InfiniTime,C,13,Firmware for Pinetime smartwatch written in C++ and based on FreeRTOS,845,2469,https://avatars.githubusercontent.com/u/91782433?v=4
472575717,Shipwright,HarbourMasters/Shipwright,C,37,,411,2468,https://avatars.githubusercontent.com/u/88675208?v=4
310123680,webui,webui-dev/webui,C,816,"Use any web browser as GUI, with your preferred language in the backend and HTML5 in the frontend, all in a lightweight portable lib.",100,1736,https://avatars.githubusercontent.com/u/133399259?v=4
536896277,flowpilot,flowdriveai/flowpilot,C,189,"flow-pilot is an openpilot based driver assistance system that runs on linux, windows and android powered machines.",180,1314,https://avatars.githubusercontent.com/u/109819718?v=4
616222670,NerdMiner_v2,BitMaker-hub/NerdMiner_v2,C,62,Improved version of first ESP32 NerdMiner,142,842,https://avatars.githubusercontent.com/u/105243563?u=e4a7a4b8e143fe25d2da1f8355c9207bab931d4f&v=4
735781986,EDRSilencer,netero1010/EDRSilencer,C,188,A tool uses Windows Filtering Platform (WFP) to block Endpoint Detection and Response (EDR) agents from reporting security events to the server.,93,646,https://avatars.githubusercontent.com/u/81764307?u=5e8632df19041b88366643af72161227c0604fad&v=4
681338173,PureKFD,PureKFD/PureKFD,C,281,A KFD Focused Package Manager that supports 14.0-16.6.1!,37,555,https://avatars.githubusercontent.com/u/150500347?v=4
727213319,my-tv,lizongying/my-tv,C,106,安卓电视直播软件，内置直播源,63,273,https://avatars.githubusercontent.com/u/16871545?u=8c1965dc6e0c9f6c1e2a688bdc54c05c76019d42&v=4
705089895,hpc-now,zhenrong-wang/hpc-now,C,25,"A Cross-Platform, Multi-Cloud High-Performance Computing Platform",72,141,https://avatars.githubusercontent.com/u/59274212?u=0bcd0802c9aa6f82e363ee8f4da3a9003d22f4fb&v=4
