id,name,full_name,language,new stars,description,forks_count,stargazers_count,avatar_url
8514,rails,rails/rails,Ruby,17,Ruby on Rails,19978,49794,https://avatars.githubusercontent.com/u/4223?v=4
27442967,fastlane,fastlane/fastlane,Ruby,5,🚀 The easiest way to automate building and releasing your iOS and Android apps,5068,33408,https://avatars.githubusercontent.com/u/11098337?v=4
8681349,huginn,huginn/huginn,Ruby,12,Create agents that monitor and act on your behalf.  Your agents are standing by!,3121,32891,https://avatars.githubusercontent.com/u/23225142?v=4
13840241,devdocs,freeCodeCamp/devdocs,Ruby,9,API Documentation Browser,1842,27305,https://avatars.githubusercontent.com/u/9892522?v=4
52281283,mastodon,mastodon/mastodon,Ruby,8,"Your self-hosted, globally interconnected microblogging community",4260,26185,https://avatars.githubusercontent.com/u/24979032?v=4
481872,vagrant,hashicorp/vagrant,Ruby,2,Vagrant is a tool for building and distributing development environments.,4191,23138,https://avatars.githubusercontent.com/u/761456?v=4
2500088,gitlabhq,gitlabhq/gitlabhq,Ruby,2,GitLab CE Mirror | Please open new issues in our issue tracker on GitLab.com,5694,22802,https://avatars.githubusercontent.com/u/1086321?v=4
308770,devise,heartcombo/devise,Ruby,3,Flexible authentication solution for Rails with Warden.,5339,22101,https://avatars.githubusercontent.com/u/59584037?v=4
538746,ruby,ruby/ruby,Ruby,7,The Ruby Programming Language [mirror],5588,18753,https://avatars.githubusercontent.com/u/210414?v=4
2203645,CocoaPods,CocoaPods/CocoaPods,Ruby,0,The Cocoa Dependency Manager.,2496,13523,https://avatars.githubusercontent.com/u/1189714?v=4
138312,capistrano,capistrano/capistrano,Ruby,1,Remote multi-server automation tool,1780,12040,https://avatars.githubusercontent.com/u/58257?v=4
202291859,chatwoot,chatwoot/chatwoot,Ruby,28,"Open-source customer engagement suite, an alternative to Intercom, Zendesk, Salesforce Service Cloud etc. 🔥💬",1358,11634,https://avatars.githubusercontent.com/u/23416667?v=4
3314,spree,spree/spree,Ruby,0,Open Source headless multi-language/multi-currency/multi-store eCommerce platform,4826,11587,https://avatars.githubusercontent.com/u/56702?v=4
106995,sinatra,sinatra/sinatra,Ruby,2,Classy web-development dressed in a DSL (official / canonical repo),2044,11502,https://avatars.githubusercontent.com/u/8312?v=4
3195124,sidekiq,mperham/sidekiq,Ruby,1,"Simple, efficient background processing for Ruby",2042,11463,https://avatars.githubusercontent.com/u/2911?u=9e18eee0dc7fe4564dba7cdc7e22711a47171a8b&v=4
96395,faker,faker-ruby/faker,Ruby,4,"A library for generating fake data such as names, addresses, and phone numbers.",2802,9654,https://avatars.githubusercontent.com/u/47637297?v=4
611921,activeadmin,activeadmin/activeadmin,Ruby,0,The administration framework for Ruby on Rails applications.,3250,9097,https://avatars.githubusercontent.com/u/814570?v=4
47087,carrierwave,carrierwaveuploader/carrierwave,Ruby,1,"Classier solution for file uploads for Rails, Sinatra and other Ruby web frameworks",1614,8673,https://avatars.githubusercontent.com/u/3982589?v=4
108278,chef,chef/chef,Ruby,2,"Chef Infra, a powerful automation platform that transforms infrastructure into code automating how infrastructure is configured, deployed and managed across any environment, at any scale",2552,6773,https://avatars.githubusercontent.com/u/29740?v=4
6899875,openproject,opf/openproject,Ruby,4,OpenProject is the leading open source project management software.,1542,5358,https://avatars.githubusercontent.com/u/1756674?v=4
33739333,administrate,thoughtbot/administrate,Ruby,0,A Rails engine that helps you put together a super-flexible admin dashboard.,969,5253,https://avatars.githubusercontent.com/u/6183?v=4
2889230,active_model_serializers,rails-api/active_model_serializers,Ruby,0,ActiveModel::Serializer implementation and Rails hooks,1382,5157,https://avatars.githubusercontent.com/u/2820360?v=4
1314319,canvas-lms,instructure/canvas-lms,Ruby,0,"The open LMS by Instructure, Inc.",1826,4202,https://avatars.githubusercontent.com/u/515326?v=4
417862,octokit.rb,octokit/octokit.rb,Ruby,1,Ruby toolkit for the GitHub API,1183,3522,https://avatars.githubusercontent.com/u/3430433?v=4
435649432,apple-knowledge,hack-different/apple-knowledge,Ruby,4,A collection of reverse engineered Apple formats,9,46,https://avatars.githubusercontent.com/u/95656057?v=4
