id,name,full_name,language,new stars,description,forks_count,stargazers_count,avatar_url
2561582,animate.css,animate-css/animate.css,CSS,88,🍿 A cross-browser library of CSS animations. As easy to use as an easy thing.,16151,74643,https://avatars.githubusercontent.com/u/64791939?v=4
1700621,normalize.css,necolas/normalize.css,CSS,92,A modern alternative to CSS resets,10722,47662,https://avatars.githubusercontent.com/u/239676?u=bc5384b5b8e480d93c83ea4b99e3ff239f3564fd&v=4
50264296,bulma,jgthms/bulma,CSS,46,Modern CSS framework based on Flexbox,3867,45560,https://avatars.githubusercontent.com/u/1254808?u=1d9df343bac6f57e7bff85f0074aac2de34f5dcc&v=4
13099301,flag-icons,lipis/flag-icons,CSS,16,:flags: A curated collection of all country flags in SVG — plus the CSS for easier integration,1447,8552,https://avatars.githubusercontent.com/u/125676?u=ed6b72344fe5cb2195b3e213b2ee5be905bd2766&v=4
105702631,plex,IBM/plex,CSS,36,"The package of IBM’s typeface, IBM Plex.",499,7747,https://avatars.githubusercontent.com/u/1459110?v=4
49767244,primeng,primefaces/primeng,CSS,16,The Most Complete Angular UI Component Library,3834,7458,https://avatars.githubusercontent.com/u/3494069?v=4
259354262,scaffold-eth,scaffold-eth/scaffold-eth,CSS,91,🏗 forkable Ethereum dev stack focused on fast product iterations ,2286,7060,https://avatars.githubusercontent.com/u/90008925?v=4
669174,DataTables,DataTables/DataTables,CSS,5,Tables plug-in for jQuery,2190,7028,https://avatars.githubusercontent.com/u/278219?v=4
7517918,spring-petclinic,spring-projects/spring-petclinic,CSS,15,A sample Spring-based application,15876,5627,https://avatars.githubusercontent.com/u/317776?v=4
65019435,public-pentesting-reports,juliocesarfort/public-pentesting-reports,CSS,29,Curated list of  public penetration test reports released by several consulting firms and academic security groups,1441,5465,https://avatars.githubusercontent.com/u/47504?u=5615ddfb4162dad0bc21a5a408dcb12889ad1a69&v=4
204008310,spicetify-themes,spicetify/spicetify-themes,CSS,46,A community-driven collection of themes for customizing Spotify through Spicetify - https://github.com/spicetify/spicetify-cli,1134,3572,https://avatars.githubusercontent.com/u/100136310?v=4
141040549,seeker,thewhiteh4t/seeker,CSS,32,Accurately Locate Smartphones using Social Engineering ,1100,3397,https://avatars.githubusercontent.com/u/36354846?u=99d06a9237c301569774dac1c70218d5c032773a&v=4
119437761,SocialFish,UndeadSec/SocialFish,CSS,17,Phishing Tool & Information Collector ,1049,2849,https://avatars.githubusercontent.com/u/29824686?v=4
222361926,javascript-basic-projects,john-smilga/javascript-basic-projects,CSS,35,,2397,2209,https://avatars.githubusercontent.com/u/42133389?u=9d63b6d71fba139347cddf2c840a858c8ff97168&v=4
299116052,react-projects,john-smilga/react-projects,CSS,24,,2329,2139,https://avatars.githubusercontent.com/u/42133389?u=9d63b6d71fba139347cddf2c840a858c8ff97168&v=4
189863872,firefox-gnome-theme,rafaelmardojai/firefox-gnome-theme,CSS,29,A GNOME👣 theme for Firefox🔥,97,1564,https://avatars.githubusercontent.com/u/6210397?u=921731a68081297551e4ca9c96bcd607f9591355&v=4
282550237,obsidian-minimal,kepano/obsidian-minimal,CSS,30,"Meticulously designed to make Obsidian feel native across platforms. You can customize colors, fonts and more with the companion plugin Minimal Theme Settings.",96,1433,https://avatars.githubusercontent.com/u/10565871?u=a1691b5a7c0ac6ce7749742162c3bb3b40001809&v=4
420352316,project_modern_ui_ux_gpt3,adrianhajdin/project_modern_ui_ux_gpt3,CSS,30,Master the creation of Modern UX/UI Websites,329,1277,https://avatars.githubusercontent.com/u/24898559?u=227355c5200ae22f733b39ce05f4dab51db5ec9a&v=4
292673424,cloudflare-docs,cloudflare/cloudflare-docs,CSS,29,Cloudflare’s developer docs.,1424,962,https://avatars.githubusercontent.com/u/314135?v=4
266561292,bearblog,HermanMartinus/bearblog,CSS,31,"Free, no-nonsense, super fast blogging.",33,745,https://avatars.githubusercontent.com/u/26326265?u=afce07fb86baa80caeef39d0f714d2b3faff8377&v=4
492267422,css-buttons,eludadev/css-buttons,CSS,275,"100 Modern CSS Buttons, Free And Royalty Free.",44,557,https://avatars.githubusercontent.com/u/101929811?u=035b56be0cd68028d27cedf1163e9912d32c41a2&v=4
441026348,Obsidian-Homepage,Rainbell129/Obsidian-Homepage,CSS,52,A dashboard for your obsidian vault.,41,290,https://avatars.githubusercontent.com/u/58488160?u=0661da37b656de9862e34382291c139bd0250f80&v=4
395115175,Transform-to-Open-Science,nasa/Transform-to-Open-Science,CSS,21,Transformation to Open Science,23,205,https://avatars.githubusercontent.com/u/848102?v=4
380255365,HTML-builder,EvgeniiMal/HTML-builder,CSS,11,,1615,25,https://avatars.githubusercontent.com/u/60567002?v=4
240361140,friendly-parakeet,coding-boot-camp/friendly-parakeet,CSS,0,,208,10,https://avatars.githubusercontent.com/u/17255114?v=4
