id,name,full_name,language,new stars,description,forks_count,stargazers_count,avatar_url
23096959,go,golang/go,Go,307,The Go programming language,14841,99526,https://avatars.githubusercontent.com/u/4314092?v=4
20904437,gin,gin-gonic/gin,Go,450,"Gin is a HTTP web framework written in Go (Golang). It features a Martini-like API with much better performance -- up to 40 times faster. If you need smashing performance, get yourself some Gin.",6620,59548,https://avatars.githubusercontent.com/u/7894478?v=4
29261473,minio,minio/minio,Go,152,Multi-Cloud Object Storage,3910,33317,https://avatars.githubusercontent.com/u/695951?v=4
17728164,terraform,hashicorp/terraform,Go,128,"Terraform enables you to safely and predictably create, change, and improve infrastructure. It is an open source tool that codifies APIs into declarative configuration files that can be shared amongst team members, treated as code, edited, reviewed, and versioned.",7621,32724,https://avatars.githubusercontent.com/u/761456?v=4
43723161,helm,helm/helm,Go,104,The Kubernetes Package Manager,6215,21845,https://avatars.githubusercontent.com/u/15859888?v=4
18369373,viper,spf13/viper,Go,100,Go configuration with fangs,1662,19340,https://avatars.githubusercontent.com/u/173412?u=4865036ec60149f8354adcae563ff5cba01e0022&v=4
6247705,testify,stretchr/testify,Go,89,A toolkit with common assertions and mocks that plays nicely with the standard library,1241,16443,https://avatars.githubusercontent.com/u/1841476?v=4
27729907,grpc-go,grpc/grpc-go,Go,75,The Go language implementation of gRPC. HTTP/2 based RPC,3569,16065,https://avatars.githubusercontent.com/u/7802525?v=4
52034309,zap,uber-go/zap,Go,88,"Blazing fast, structured, leveled logging in Go.",1143,15891,https://avatars.githubusercontent.com/u/19262598?v=4
46806184,charts,helm/charts,Go,11,âš ï¸(OBSOLETE) Curated applications for Kubernetes,17207,15387,https://avatars.githubusercontent.com/u/15859888?v=4
5179099,redis,go-redis/redis,Go,181,Type-safe Redis client for Golang,1798,14495,https://avatars.githubusercontent.com/u/7314137?v=4
48109239,cilium,cilium/cilium,Go,125,"eBPF-based Networking, Security, and Observability",1589,11994,https://avatars.githubusercontent.com/u/21054566?v=4
277194804,NoiseTorch,noisetorch/NoiseTorch,Go,319,Real-time microphone noise suppression on Linux.,136,6638,https://avatars.githubusercontent.com/u/105936236?v=4
147886080,crossplane,crossplane/crossplane,Go,96,Cloud Native Control Planes,514,5241,https://avatars.githubusercontent.com/u/45158470?v=4
32351944,gopacket,google/gopacket,Go,19,Provides packet processing capabilities for Go,933,4843,https://avatars.githubusercontent.com/u/1342004?v=4
299832860,livekit,livekit/livekit,Go,761,"Scalable, high-performance WebRTC SFU. SDKs in JavaScript, React, React Native, Flutter, Swift, Kotlin, Unity/C#, Go, Ruby and Node.",201,3285,https://avatars.githubusercontent.com/u/69438833?v=4
157402758,portmaster,safing/portmaster,Go,180,ğŸ” Love Freedom - âŒ Block Mass Surveillance,113,3306,https://avatars.githubusercontent.com/u/20678162?v=4
330616364,go-clean-template,evrone/go-clean-template,Go,932,Clean Architecture template for Golang services,175,2634,https://avatars.githubusercontent.com/u/431569?v=4
49970739,datadog-agent,DataDog/datadog-agent,Go,23,Datadog Agent ,836,1644,https://avatars.githubusercontent.com/u/365230?v=4
188836864,erigon,ledgerwatch/erigon,Go,38,Ethereum implementation on the efficiency frontier,336,1351,https://avatars.githubusercontent.com/u/29105044?v=4
480634883,gofound,newpanjing/gofound,Go,193,GoFound GoLang Full text search goè¯­è¨€å…¨æ–‡æ£€ç´¢å¼•æ“ åŸºäºå¹³è¡¡äºŒå‰æ ‘+æ­£æ’ç´¢å¼•ã€å€’æ’ç´¢å¼•å®ç° å¯æ”¯æŒäº¿çº§æ•°æ®ï¼Œæ¯«ç§’çº§æŸ¥è¯¢ã€‚ ä½¿ç”¨ç®€å•ï¼Œä½¿ç”¨httpæ¥å£ï¼Œä»»ä½•ç³»ç»Ÿéƒ½å¯ä»¥ä½¿ç”¨ã€‚,88,792,https://avatars.githubusercontent.com/u/13655483?u=08970485c60f56c92663caaeab6578c2f862aa5e&v=4
434017296,stackrox,stackrox/stackrox,Go,139,"The StackRox Kubernetes Security Platform performs a risk analysis of the container environment, delivers visibility and runtime alerts, and provides recommendations to proactively improve security by hardening the environment.",37,763,https://avatars.githubusercontent.com/u/40638982?v=4
474070793,sneller,SnellerInc/sneller,Go,145,"Vectorized SQL for JSON at scale: fast, simple, schemaless",21,537,https://avatars.githubusercontent.com/u/82009348?v=4
379067204,cql-proxy,datastax/cql-proxy,Go,99,A client-side CQL proxy/sidecar.,67,146,https://avatars.githubusercontent.com/u/573369?v=4
337964429,astra-cli,datastax-labs/astra-cli,Go,91,DataStax Astra automation CLI https://astra.datastax.com,62,137,https://avatars.githubusercontent.com/u/88110092?v=4
