id,name,full_name,language,new stars,description,forks_count,stargazers_count,avatar_url
2325298,linux,torvalds/linux,C,467,Linux kernel source tree,39601,120714,https://avatars.githubusercontent.com/u/1024025?v=4
102578345,lede,coolsnowwolf/lede,C,95,Lean's OpenWrt source,15425,18392,https://avatars.githubusercontent.com/u/31687149?u=caa956c5f80318ea674625f9e9efa49c98335d74&v=4
6201092,mpv,mpv-player/mpv,C,314,🎥 Command line video player,2045,16635,https://avatars.githubusercontent.com/u/2550273?v=4
66150122,nnn,jarun/nnn,C,102,n³ The unorthodox terminal file manager,500,12716,https://avatars.githubusercontent.com/u/5959286?u=2288d112a2d27a09182801b737af71c280a40f61&v=4
179354282,OpenCorePkg,acidanthera/OpenCorePkg,C,70,OpenCore bootloader,1485,8446,https://avatars.githubusercontent.com/u/39672954?v=4
184909163,yabai,koekeishiya/yabai,C,102,A tiling window manager for macOS based on binary space partitioning,322,8418,https://avatars.githubusercontent.com/u/6175959?u=e07b472bc4fa5500439c2c099a4736bcfd636769&v=4
9524997,glfw,glfw/glfw,C,43,"A multi-platform library for OpenGL, OpenGL ES, Vulkan, window and input",3164,8260,https://avatars.githubusercontent.com/u/3905364?v=4
901662,libgit2,libgit2/libgit2,C,16,"A cross-platform, linkable library implementation of Git that you can use in your application.",2150,8121,https://avatars.githubusercontent.com/u/394745?v=4
1856976,libevent,libevent/libevent,C,34,Event notification library,2898,8065,https://avatars.githubusercontent.com/u/833750?v=4
70127218,arduino-esp32,espressif/arduino-esp32,C,40,Arduino core for the ESP32,4744,7526,https://avatars.githubusercontent.com/u/9460735?v=4
18106269,lz4,lz4/lz4,C,32,Extremely Fast Compression algorithm,1015,6459,https://avatars.githubusercontent.com/u/11667224?v=4
105944401,yugabyte-db,yugabyte/yugabyte-db,C,57,"The high-performance distributed SQL database for global, internet-scale apps.",671,5736,https://avatars.githubusercontent.com/u/17074854?v=4
59771425,zephyr,zephyrproject-rtos/zephyr,C,34,"Primary Git Repository for the Zephyr Project. Zephyr is a new generation, scalable, optimized, secure RTOS for multiple hardware architectures.",3239,5107,https://avatars.githubusercontent.com/u/19595895?v=4
241659610,itlwm,OpenIntelWireless/itlwm,C,42,Intel Wi-Fi Drivers for macOS,483,4999,https://avatars.githubusercontent.com/u/67850724?v=4
100979484,arcore-android-sdk,google-ar/arcore-android-sdk,C,12,ARCore SDK for Android Studio,992,4304,https://avatars.githubusercontent.com/u/31216907?v=4
86245815,pygame,pygame/pygame,C,73,"pygame (the library) is a Free and Open Source python programming language library for making multimedia applications like games built on top of the excellent SDL library. C, Python, Native, OpenGL.",1767,4032,https://avatars.githubusercontent.com/u/20628127?v=4
59676171,klipper,Klipper3d/klipper,C,43,Klipper is a 3d-printer firmware,2532,3816,https://avatars.githubusercontent.com/u/90982958?v=4
213916896,blender,blender/blender,C,57,Official mirror of Blender,678,3684,https://avatars.githubusercontent.com/u/52924476?v=4
205810121,CloverBootloader,CloverHackyColor/CloverBootloader,C,19,"Bootloader for macOS, Windows and Linux in UEFI and in legacy mode",482,3182,https://avatars.githubusercontent.com/u/54796405?v=4
130012942,xHook,iqiyi/xHook,C,19,🔥 A PLT hook library for Android native ELF.,571,2908,https://avatars.githubusercontent.com/u/32627384?v=4
45703884,u8g2,olikraus/u8g2,C,18,"U8glib library for monochrome displays, version 2 ",693,2644,https://avatars.githubusercontent.com/u/1084992?v=4
154525111,freeswitch,signalwire/freeswitch,C,25,"FreeSWITCH is a Software Defined Telecom Stack enabling the digital transformation from proprietary telecom switches to a versatile software implementation that runs on any commodity hardware. From a Raspberry PI to a multi-core server, FreeSWITCH can unlock the telecommunications potential of any device.",743,1542,https://avatars.githubusercontent.com/u/34925332?v=4
127023441,cuda-samples,NVIDIA/cuda-samples,C,21,Samples for CUDA Developers which demonstrates features in CUDA Toolkit,511,1430,https://avatars.githubusercontent.com/u/1728152?v=4
394318710,ExplorerPatcher,valinet/ExplorerPatcher,C,300,This project aims to bring back a productive working environment on Windows 11,54,1395,https://avatars.githubusercontent.com/u/6503598?u=25d850b7dcc57d2a488d83646fff7cca48cf7fc7&v=4
391402552,terminal_minecraft,Kameldieb/terminal_minecraft,C,165,,35,273,https://avatars.githubusercontent.com/u/71906094?v=4
