id,name,full_name,language,new stars,description,forks_count,stargazers_count,avatar_url
63476337,Python,TheAlgorithms/Python,Python,257,All Algorithms implemented in Python,45439,192900,https://avatars.githubusercontent.com/u/20487725?v=4
210702427,typst,typst/typst,Rust,180,A new markup-based typesetting system that is powerful and easy to learn.,913,34321,https://avatars.githubusercontent.com/u/67595261?v=4
737898780,maybe,maybe-finance/maybe,Ruby,52,The OS for your personal finances,2327,31421,https://avatars.githubusercontent.com/u/80786585?v=4
13862381,Telegram,DrKLO/Telegram,Java,18,Telegram for Android source,8073,25025,https://avatars.githubusercontent.com/u/69369?v=4
239201565,deepface,serengil/deepface,Python,75,"A Lightweight Face Recognition and Facial Attribute Analysis (Age, Gender, Emotion and Race) Library for Python",2121,13279,https://avatars.githubusercontent.com/u/18491038?u=96b3a9080157652579fae9cabaefd7fdf6ba5513&v=4
488641606,phidata,phidatahq/phidata,Python,255,"Build AI Agents with memory, knowledge, tools and reasoning",1777,12331,https://avatars.githubusercontent.com/u/104874993?v=4
501027541,social-app,bluesky-social/social-app,TypeScript,79,"The Bluesky Social application for Web, iOS, and Android",1167,8953,https://avatars.githubusercontent.com/u/94650532?v=4
759893102,pglite,electric-sql/pglite,TypeScript,37,"Lightweight WASM Postgres with real-time, reactive bindings.",190,8945,https://avatars.githubusercontent.com/u/96433696?v=4
32887098,googleapis,googleapis/googleapis,Starlark,482,Public interface definitions of Google APIs.,2312,7519,https://avatars.githubusercontent.com/u/16785467?v=4
366146447,edge-tts,rany2/edge-tts,Python,33,Use Microsoft Edge's online text-to-speech service from Python WITHOUT needing Microsoft Edge or Windows or an API key,579,5780,https://avatars.githubusercontent.com/u/71077389?v=4
643285887,apihub,hiteshchoudhary/apihub,JavaScript,81,"Your own API Hub to learn and master API interaction. Ideal for frontend, mobile dev and backend developers. ",900,4185,https://avatars.githubusercontent.com/u/11613311?u=eb5b71a918effbaf14260160d8d7dee7caaffe1f&v=4
763774926,mistral.rs,EricLBuehler/mistral.rs,Rust,71,Blazingly fast LLM inference.,279,3964,https://avatars.githubusercontent.com/u/65165915?u=6818e833f286ee8ce53ca89f749e70e0d05c3ee3&v=4
827005317,fragments,e2b-dev/fragments,TypeScript,27,Open-source Next.js template for building apps that are fully generated by AI. By E2B.,403,3134,https://avatars.githubusercontent.com/u/129434473?v=4
509524133,program-examples,solana-developers/program-examples,TypeScript,7,A repository of Solana program examples,234,683,https://avatars.githubusercontent.com/u/93691676?v=4
