id,name,full_name,language,new stars,description,forks_count,stargazers_count,avatar_url
313330998,50projects50days,bradtraversy/50projects50days,CSS,46,"50+ mini web projects using HTML, CSS & JS",5515,20492,https://avatars.githubusercontent.com/u/5550850?u=819e4404506d906d5113cc352b560fcfd242cce3&v=4
17446152,2048,gabrielecirulli/2048,CSS,5,A small clone of 1024 (https://play.google.com/store/apps/details?id=com.veewo.a1024),16098,11359,https://avatars.githubusercontent.com/u/886011?v=4
105702631,plex,IBM/plex,CSS,4,"The package of IBM’s typeface, IBM Plex.",513,7989,https://avatars.githubusercontent.com/u/1459110?v=4
49767244,primeng,primefaces/primeng,CSS,1,The Most Complete Angular UI Component Library,3908,7629,https://avatars.githubusercontent.com/u/3494069?v=4
669174,DataTables,DataTables/DataTables,CSS,4,Tables plug-in for jQuery,2193,7062,https://avatars.githubusercontent.com/u/278219?v=4
7517918,spring-petclinic,spring-projects/spring-petclinic,CSS,3,A sample Spring-based application,16658,5802,https://avatars.githubusercontent.com/u/317776?v=4
23981144,Infosec_Reference,rmusser01/Infosec_Reference,CSS,5,An Information Security Reference That Doesn't Suck; https://rmusser.net/git/admin-2/Infosec_Reference for non-MS Git hosted version.,1070,4497,https://avatars.githubusercontent.com/u/1444720?v=4
233306241,hass-config,matt8707/hass-config,CSS,4,✨ A different take on designing a Lovelace UI (Dashboard),510,3266,https://avatars.githubusercontent.com/u/36163594?v=4
329751286,youtube,safak/youtube,CSS,5,,3776,3171,https://avatars.githubusercontent.com/u/1486366?u=c367d218a8cf89ad09c3dbfb3c7ad7a929142f20&v=4
64450725,online-cv,sharu725/online-cv,CSS,1,A minimal Jekyll Theme to host your resume (CV),4306,2150,https://avatars.githubusercontent.com/u/8033084?u=8c5923a9938f585d86454c68c5d6ef08d4156794&v=4
1317495,pelican-themes,getpelican/pelican-themes,CSS,0,Themes for Pelican,1105,2031,https://avatars.githubusercontent.com/u/2043492?v=4
3939786,minimal,orderedlist/minimal,CSS,1,A Theme for GitHub Pages,686,2006,https://avatars.githubusercontent.com/u/1680?u=9a75517752351bda53e22c25a963c8eaad2c8fc7&v=4
258673347,cli-guidelines,cli-guidelines/cli-guidelines,CSS,6,"A guide to help you write better command-line programs, taking traditional UNIX principles and updating them for the modern day.",67,1904,https://avatars.githubusercontent.com/u/67487790?v=4
346364145,based.cooking,LukeSmithxyz/based.cooking,CSS,0,A simple culinary website.,508,1868,https://avatars.githubusercontent.com/u/29150857?u=b5fa18a3ccbfe9162f7a9fb9cfd3d0b19b476c64&v=4
420352316,project_modern_ui_ux_gpt3,adrianhajdin/project_modern_ui_ux_gpt3,CSS,2,Master the creation of Modern UX/UI Websites,406,1553,https://avatars.githubusercontent.com/u/24898559?u=676a88e76bd79c4b794256e7651c796336d05a3a&v=4
336566063,qq,qq8e/qq,CSS,4,8亿QQ绑定数据泄露查询源码，附送数据。不定期更新下载地址 关注越多送的越多,324,1130,https://avatars.githubusercontent.com/u/78652492?v=4
366437783,responsive-portfolio-website-Alexa,bedimcode/responsive-portfolio-website-Alexa,CSS,1,"Responsive Portfolio Website Using HTML, CSS & JavaScript",952,1086,https://avatars.githubusercontent.com/u/61248995?u=9aac97bc872b32ebf85288486be6747ba6b7af66&v=4
103534406,flexible-jekyll,artemsheludko/flexible-jekyll,CSS,1,Flexible-Jekyll is a simple and clean theme for Jekyll,1614,645,https://avatars.githubusercontent.com/u/22279513?u=d715d604f90e68b1e20bd4f1313747d643698670&v=4
508131663,awesome-english-ebooks,hehonghui/awesome-english-ebooks,CSS,7,"经济学人(含音频)、纽约客、卫报、连线、大西洋月刊等英语杂志免费下载,支持epub、mobi、pdf格式, 每周更新",56,558,https://avatars.githubusercontent.com/u/1683811?u=4fdd12c8f8685ef1ce1b9d798bfbd6f86bd4b397&v=4
263862433,Intro-to-Vue-3,Code-Pop/Intro-to-Vue-3,CSS,0,Code for Vue Mastery's Intro to Vue 3 course:,2287,547,https://avatars.githubusercontent.com/u/22382188?v=4
112527777,SmartHotel360-Website,microsoft/SmartHotel360-Website,CSS,0,SmartHotel360 Webiste,5769,186,https://avatars.githubusercontent.com/u/6154722?v=4
212273128,learning-app-ecommerce,kodekloudhub/learning-app-ecommerce,CSS,0,A sample e-commerce learning app,613,157,https://avatars.githubusercontent.com/u/43662489?v=4
396964151,grid-flexbox-v2,FrontendMasters/grid-flexbox-v2,CSS,0,Version 2 of the Flexbox and Grid course at Frontend Masters.,196,94,https://avatars.githubusercontent.com/u/5613852?v=4
196068260,webpack-from-scratch,ZhangMYihua/webpack-from-scratch,CSS,0,,380,8,https://avatars.githubusercontent.com/u/10578605?u=bb4b6eab34a91bce1c20714f2fcedfd014b17aeb&v=4
332575051,project-chatbot,Technigo/project-chatbot,CSS,0,,226,3,https://avatars.githubusercontent.com/u/30344334?v=4
