id,name,full_name,language,new stars,description,forks_count,stargazers_count,avatar_url
45717250,tensorflow,tensorflow/tensorflow,C++,414,An Open Source Machine Learning Framework for Everyone,86129,161957,https://avatars.githubusercontent.com/u/15658638?v=4
65600975,pytorch,pytorch/pytorch,C++,177,Tensors and Dynamic neural networks in Python with strong GPU acceleration,14646,53233,https://avatars.githubusercontent.com/u/21003710?v=4
23357588,protobuf,protocolbuffers/protobuf,C++,109,Protocol Buffers - Google's data interchange format,13617,52547,https://avatars.githubusercontent.com/u/26310541?v=4
22887094,tesseract,tesseract-ocr/tesseract,C++,151,Tesseract Open Source OCR Engine (main repository),7731,43530,https://avatars.githubusercontent.com/u/8401422?v=4
39840932,googletest,google/googletest,C++,188,GoogleTest - Google Testing and Mocking Framework,8181,24772,https://avatars.githubusercontent.com/u/1342004?v=4
4524181,folly,facebook/folly,C++,260,An open-source C++ library developed and used at Facebook.,4466,21022,https://avatars.githubusercontent.com/u/69631?v=4
197275130,winget-cli,microsoft/winget-cli,C++,103,Windows Package Manager CLI (aka winget),823,16032,https://avatars.githubusercontent.com/u/6154722?v=4
3351871,qBittorrent,qbittorrent/qBittorrent,C++,128,qBittorrent BitTorrent client,2502,14034,https://avatars.githubusercontent.com/u/2131270?v=4
7056202,fmt,fmtlib/fmt,C++,336,A modern formatting library,1578,13242,https://avatars.githubusercontent.com/u/7280830?v=4
3925242,bgfx,bkaradzic/bgfx,C++,112,"Cross-platform, graphics API agnostic, ""Bring Your Own Engine/Framework"" style rendering library.",1565,10711,https://avatars.githubusercontent.com/u/814772?v=4
6520784,rpcs3,RPCS3/rpcs3,C++,93,PS3 emulator/debugger,1589,10514,https://avatars.githubusercontent.com/u/8070735?v=4
33294473,mactype,snowie2000/mactype,C++,107,Better font rendering for Windows.,384,6938,https://avatars.githubusercontent.com/u/11767189?v=4
114128199,multipass,canonical/multipass,C++,174,Multipass orchestrates virtual Ubuntu instances,381,4328,https://avatars.githubusercontent.com/u/53057619?v=4
138754790,duckdb,duckdb/duckdb,C++,48,DuckDB is an in-process SQL OLAP Database Management System,365,4165,https://avatars.githubusercontent.com/u/82039556?v=4
244694174,connectedhomeip,project-chip/connectedhomeip,C++,111,"Matter (formerly Project CHIP) is creating more connections between more objects, simplifying development for manufacturers and increasing compatibility for consumers,  guided by the Connectivity Standards Alliance (formerly Zigbee Alliance).",605,3088,https://avatars.githubusercontent.com/u/61027988?v=4
194269070,skyline,skyline-emu/skyline,C++,136,Run Nintendo Switch homebrew & games on your Android device!,512,2721,https://avatars.githubusercontent.com/u/52578041?v=4
70434365,obs-websocket,obsproject/obs-websocket,C++,27,Remote-control of OBS Studio through WebSocket,466,2488,https://avatars.githubusercontent.com/u/7725691?v=4
83542585,LeetCode,wisdompeak/LeetCode,C++,33,This repository contains the solutions and explanations to the algorithm problems on LeetCode. Only medium or above are included. All are written in C++/Python and implemented by myself. The problems attempted multiple times are labelled with hyperlinks.,568,2114,https://avatars.githubusercontent.com/u/25891014?v=4
402945349,starrocks,StarRocks/starrocks,C++,137,"StarRocks is a next-gen sub-second MPP database for full analysis scenarios, including multi-dimensional analytics, real-time analytics and ad-hoc query.",376,1990,https://avatars.githubusercontent.com/u/88238841?v=4
329265231,safetynet-fix,kdrag0n/safetynet-fix,C++,78,Universal fix for Google SafetyNet on Android devices with hardware attestation and unlocked bootloaders.,122,1948,https://avatars.githubusercontent.com/u/7930239?u=ff09f9ad902b038246cd5cdd689c3068870595d5&v=4
404724835,r3live,hku-mars/r3live,C++,227,"A Robust, Real-time, RGB-colored, LiDAR-Inertial-Visual tightly-coupled state Estimation and mapping package",112,641,https://avatars.githubusercontent.com/u/51474179?v=4
168555392,REFramework,praydog/REFramework,C++,67,"Scripting platform, modding framework and VR support for all RE Engine games",71,542,https://avatars.githubusercontent.com/u/2909949?v=4
436366606,CodeHelp-DSA-Busted-Series,loveBabbar/CodeHelp-DSA-Busted-Series,C++,89,This repo is creating providing students easy access to all the programs taught under Codehelp's DSA Busted Series.,210,359,https://avatars.githubusercontent.com/u/29489915?u=fcf37f59ad74d0389bcb06a49c324a4cab771e4e&v=4
443488412,AVP-SLAM-PLUS,liuguitao/AVP-SLAM-PLUS,C++,74,An implementation of AVP-SLAM and some new contributions,67,186,https://avatars.githubusercontent.com/u/49521527?v=4
379771313,Orbion_Space_Mouse,FaqT0tum/Orbion_Space_Mouse,C++,83,ORBION the OpenSource Space Mouse 3D,28,180,https://avatars.githubusercontent.com/u/69204222?u=cf44bfd5a68ea3d1af364813d9d73c1a1f88d67a&v=4
