id,name,full_name,language,new stars,description,forks_count,stargazers_count,avatar_url
8514,rails,rails/rails,Ruby,45,Ruby on Rails,20508,51152,https://avatars.githubusercontent.com/u/4223?v=4
65252,jekyll,jekyll/jekyll,Ruby,47,:globe_with_meridians: Jekyll is a blog-aware static site generator in Ruby,9837,45055,https://avatars.githubusercontent.com/u/3083652?v=4
7569578,discourse,discourse/discourse,Ruby,40,"A platform for community discussion. Free, open, simple.",7756,36092,https://avatars.githubusercontent.com/u/3220138?v=4
52281283,mastodon,mastodon/mastodon,Ruby,50,"Your self-hosted, globally interconnected microblogging community",4635,29665,https://avatars.githubusercontent.com/u/24979032?v=4
13840241,devdocs,freeCodeCamp/devdocs,Ruby,80,API Documentation Browser,1971,29256,https://avatars.githubusercontent.com/u/9892522?v=4
2293158,metasploit-framework,rapid7/metasploit-framework,Ruby,65,Metasploit Framework,12393,27841,https://avatars.githubusercontent.com/u/1013671?v=4
308770,devise,heartcombo/devise,Ruby,25,Flexible authentication solution for Rails with Warden.,5443,22597,https://avatars.githubusercontent.com/u/59584037?v=4
3195124,sidekiq,mperham/sidekiq,Ruby,17,"Simple, efficient background processing for Ruby",2158,11950,https://avatars.githubusercontent.com/u/2911?u=9e18eee0dc7fe4564dba7cdc7e22711a47171a8b&v=4
4095287,rubocop,rubocop/rubocop,Ruby,12,"A Ruby static code analyzer and formatter, based on the community Ruby style guide.",2895,11906,https://avatars.githubusercontent.com/u/10871348?v=4
96395,faker,faker-ruby/faker,Ruby,119,"A library for generating fake data such as names, addresses, and phone numbers.",2926,10266,https://avatars.githubusercontent.com/u/47637297?v=4
1725199,linguist,github/linguist,Ruby,23,"Language Savant. If your repository's language is being reported incorrectly, send us a pull request!",3649,10076,https://avatars.githubusercontent.com/u/9919?v=4
47087,carrierwave,carrierwaveuploader/carrierwave,Ruby,3,"Classier solution for file uploads for Rails, Sinatra and other Ruby web frameworks",1628,8705,https://avatars.githubusercontent.com/u/3982589?v=4
69193081,how-to-contribute-to-open-source,freeCodeCamp/how-to-contribute-to-open-source,Ruby,22,A guide to contributing to open source,1467,6775,https://avatars.githubusercontent.com/u/9892522?v=4
5160706,dotenv,bkeepers/dotenv,Ruby,7,A Ruby gem to load environment variables from `.env`. ,483,6121,https://avatars.githubusercontent.com/u/173?u=ac9aaace45a2160526833001803d7d659eb7bd1b&v=4
355893,markup,github/markup,Ruby,4,Determines which markup library to use to render a content file (e.g. README) on GitHub,3609,5489,https://avatars.githubusercontent.com/u/9919?v=4
417389,faraday,lostisland/faraday,Ruby,8,"Simple, but flexible HTTP client library, with support for multiple backends.",922,5317,https://avatars.githubusercontent.com/u/2613464?v=4
21333814,devise_token_auth,lynndylanhurley/devise_token_auth,Ruby,2,Token based authentication for Rails JSON APIs. Designed to work with jToker and ng-token-auth.,1082,3343,https://avatars.githubusercontent.com/u/468037?u=463dfbb32fa29779cafc2633fc3c82b1997dc0a0&v=4
14238949,elasticsearch-rails,elastic/elasticsearch-rails,Ruby,2,Elasticsearch integrations for ActiveModel/Record and Ruby on Rails,759,2940,https://avatars.githubusercontent.com/u/6764390?v=4
200302808,view_component,github/view_component,Ruby,17,"A framework for building reusable, testable & encapsulated view components in Ruby on Rails.",312,2557,https://avatars.githubusercontent.com/u/9919?v=4
194554883,OSCP-Exam-Report-Template-Markdown,noraj/OSCP-Exam-Report-Template-Markdown,Ruby,16,":orange_book: Markdown Templates for Offensive Security OSCP, OSWE, OSCE, OSEE, OSWP exam report",580,2424,https://avatars.githubusercontent.com/u/16578570?u=d52818fddd4a64ff2f5bc87f6568f84af792ebff&v=4
375321926,phase-4-deploying-demo-app,learn-co-curriculum/phase-4-deploying-demo-app,Ruby,0,,132,0,https://avatars.githubusercontent.com/u/6208017?v=4
