id,name,full_name,language,new stars,description,forks_count,stargazers_count,avatar_url
7600409,shadowsocks-windows,shadowsocks/shadowsocks-windows,C#,62,A C# port of shadowsocks,16330,54483,https://avatars.githubusercontent.com/u/3006190?v=4
199570071,v2rayN,2dust/v2rayN,C#,235,"A V2Ray client for Windows, support Xray core and v2fly core",6022,29191,https://avatars.githubusercontent.com/u/31833384?v=4
164140756,Files,files-community/Files,C#,159,A modern file manager for Windows,1338,22548,https://avatars.githubusercontent.com/u/65931357?v=4
69662720,WaveFunctionCollapse,mxgmn/WaveFunctionCollapse,C#,192,Bitmap & tilemap generation from a single example with the help of ideas from quantum mechanics,991,18714,https://avatars.githubusercontent.com/u/14931730?u=2a63214b1fe8ce6058b4be7e19ed1199d814f7eb&v=4
262395224,maui,dotnet/maui,C#,126,".NET MAUI is the .NET Multi-platform App UI, a framework for building native device applications spanning mobile, tablet, and desktop.",912,15733,https://avatars.githubusercontent.com/u/9141961?v=4
1613345,Dapper,DapperLib/Dapper,C#,34,Dapper - a simple object mapper for .Net,3522,14963,https://avatars.githubusercontent.com/u/83077457?v=4
30474266,MaterialDesignInXamlToolkit,MaterialDesignInXAML/MaterialDesignInXamlToolkit,C#,31,"Google's Material Design in XAML & WPF, for C# & VB.Net. ",3004,12336,https://avatars.githubusercontent.com/u/16655083?v=4
16157746,efcore,dotnet/efcore,C#,33,"EF Core is a modern object-database mapper for .NET. It supports LINQ queries, change tracking, updates, and schema migrations.",2779,11346,https://avatars.githubusercontent.com/u/9141961?v=4
28239455,AspNetCore.Docs,dotnet/AspNetCore.Docs,C#,36,Documentation for ASP.NET Core,24336,10531,https://avatars.githubusercontent.com/u/9141961?v=4
210716005,runtime,dotnet/runtime,C#,90,".NET is a cross-platform runtime for cloud, mobile, desktop, and IoT apps.",3159,9124,https://avatars.githubusercontent.com/u/9141961?v=4
213460285,CleanArchitecture,jasontaylordev/CleanArchitecture,C#,78,Clean Architecture Solution Template for .NET 6,1996,8742,https://avatars.githubusercontent.com/u/1988321?u=f96f36eed8f5bc57c4aab7213306f960efc072b1&v=4
46652227,IdentityServer4,IdentityServer/IdentityServer4,C#,13,OpenID Connect and OAuth 2.0 Framework for ASP.NET Core,3543,8690,https://avatars.githubusercontent.com/u/10635672?v=4
75505125,abp,abpframework/abp,C#,40,Open Source Web Application Framework for ASP.NET Core,2555,8093,https://avatars.githubusercontent.com/u/42068324?v=4
375939072,FastGithub,dotnetcore/FastGithub,C#,168,github加速神器，解决github打不开、用户头像无法加载、releases无法上传下载、git-clone、git-pull、git-push失败等问题,912,6528,https://avatars.githubusercontent.com/u/19404084?v=4
27251463,Lean,QuantConnect/Lean,C#,33,"Lean Algorithmic Trading Engine by QuantConnect (Python, C#)",2574,6214,https://avatars.githubusercontent.com/u/3912814?v=4
26732453,language-ext,louthy/language-ext,C#,212,C# functional language extensions - a base class library for functional programming,339,4464,https://avatars.githubusercontent.com/u/1991827?u=9ddd1b76138c52afa311b1513e58a85842fa9c43&v=4
187499284,UniTask,Cysharp/UniTask,C#,43,Provides an efficient allocation free async/await integration for Unity.,343,3260,https://avatars.githubusercontent.com/u/44487420?v=4
150572151,AspNetCore.Diagnostics.HealthChecks,Xabaril/AspNetCore.Diagnostics.HealthChecks,C#,18,Enterprise HealthChecks for ASP.NET Core Diagnostics Package,596,2885,https://avatars.githubusercontent.com/u/25212406?v=4
158405551,git-credential-manager,GitCredentialManager/git-credential-manager,C#,63,"Secure, cross-platform Git credential storage with authentication to GitHub, Azure Repos, and other popular Git hosting services.",495,2571,https://avatars.githubusercontent.com/u/64464614?v=4
387542412,ThisIsWin11,builtbybel/ThisIsWin11,C#,59,The real PowerToys for Windows 11,195,2576,https://avatars.githubusercontent.com/u/48735732?v=4
234068197,AZ-204-DevelopingSolutionsforMicrosoftAzure,MicrosoftLearning/AZ-204-DevelopingSolutionsforMicrosoftAzure,C#,11,AZ-204: Developing solutions for Microsoft Azure,1153,1483,https://avatars.githubusercontent.com/u/10467123?v=4
373274891,Maui,CommunityToolkit/Maui,C#,39,"The .NET MAUI Community Toolkit is a community-created library that contains .NET MAUI Extensions, Advanced UI/UX Controls, and Behaviors to help make your life as a .NET MAUI developer easier",81,636,https://avatars.githubusercontent.com/u/41346473?v=4
464654186,dotnet-maui-workshop,dotnet-presentations/dotnet-maui-workshop,C#,44,"A full day workshop (.NET MAUI Workshop in a Box) on how to build apps with .NET MAUI for iOS, Android, macOS, and Windows",111,642,https://avatars.githubusercontent.com/u/31487945?v=4
338261056,cs10dotnet6,markjprice/cs10dotnet6,C#,14,"Repository for the Packt Publishing book titled ""C# 10 and .NET 6 - Modern Cross-Platform Development"" by Mark J. Price",206,435,https://avatars.githubusercontent.com/u/14040265?u=3e180c29fac400063b2e6032f9c00b2f439a4e2d&v=4
417181752,MapAssist,OneXDeveloper/MapAssist,C#,11,D2R MapHack,215,360,https://avatars.githubusercontent.com/u/92535311?v=4
