id,name,full_name,language,new stars,description,forks_count,stargazers_count,avatar_url
184456251,PowerToys,microsoft/PowerToys,C#,1263,Windows system utilities to maximize productivity,6138,104240,https://avatars.githubusercontent.com/u/6154722?v=4
199570071,v2rayN,2dust/v2rayN,C#,1637,"A GUI client for Windows, support Xray core and v2fly core and others",10536,61053,https://avatars.githubusercontent.com/u/31833384?v=4
49609581,PowerShell,PowerShell/PowerShell,C#,375,PowerShell for every system!,7017,43291,https://avatars.githubusercontent.com/u/11524380?v=4
198071756,RevokeMsgPatcher,huiyadanli/RevokeMsgPatcher,C#,575,:trollface: A hex editor for WeChat/QQ/TIM - PCç‰ˆå¾®ä¿¡/QQ/TIMé˜²æ’¤å›è¡¥ä¸ï¼ˆæˆ‘å·²ç»çœ‹åˆ°äº†ï¼Œæ’¤å›ä¹Ÿæ²¡ç”¨äº†ï¼‰,3136,26110,https://avatars.githubusercontent.com/u/15783049?u=86f380636f7c09b86788a977ea96272cb7484a30&v=4
64713769,ScreenToGif,NickeManarin/ScreenToGif,C#,284,"ğŸ¬ ScreenToGif allows you to record a selected area of your screen, edit and save it as a gif or video.",2134,22638,https://avatars.githubusercontent.com/u/14798947?u=3b8eb996aeb9fe617c733a21fd8e067f2c2fcb4f&v=4
262395224,maui,dotnet/maui,C#,248,".NET MAUI is the .NET Multi-platform App UI, a framework for building native device applications spanning mobile, tablet, and desktop.",1595,21537,https://avatars.githubusercontent.com/u/9141961?v=4
1327739,ILSpy,icsharpcode/ILSpy,C#,274,".NET Decompiler with support for PDB generation, ReadyToRun, Metadata (&more) - cross-platform!",3244,20172,https://avatars.githubusercontent.com/u/343434?v=4
607289185,semantic-kernel,microsoft/semantic-kernel,C#,676,Integrate cutting-edge LLM technology quickly and easily into your apps,2652,18086,https://avatars.githubusercontent.com/u/6154722?v=4
30474266,MaterialDesignInXamlToolkit,MaterialDesignInXAML/MaterialDesignInXamlToolkit,C#,129,"Google's Material Design in XAML & WPF, for C# & VB.Net. ",3365,14609,https://avatars.githubusercontent.com/u/16655083?v=4
681372871,garnet,microsoft/garnet,C#,8184,"Garnet is a remote cache-store from Microsoft Research that offers strong performance (throughput and latency), scalability, storage, recovery, cluster sharding, key migration, and replication features. Garnet can work with existing Redis clients.",396,9029,https://avatars.githubusercontent.com/u/6154722?v=4
187499284,UniTask,Cysharp/UniTask,C#,173,Provides an efficient allocation free async/await integration for Unity.,743,7254,https://avatars.githubusercontent.com/u/44487420?v=4
16473585,subtitleedit,SubtitleEdit/subtitleedit,C#,173,the subtitle editor :),825,7093,https://avatars.githubusercontent.com/u/3008853?v=4
26884725,OrchardCore,OrchardCMS/OrchardCore,C#,59,"Orchard Core is an open-source modular and multi-tenant application framework built with ASP.NET Core, and a content management system (CMS) built on top of that framework.",2308,7088,https://avatars.githubusercontent.com/u/1159247?v=4
100711978,btcpayserver,btcpayserver/btcpayserver,C#,217,"Accept Bitcoin payments. Free, open-source & self-hosted, Bitcoin payment processor. ",1551,6021,https://avatars.githubusercontent.com/u/31132886?v=4
116210568,ScottPlot,ScottPlot/ScottPlot,C#,182,Interactive plotting library for .NET,761,4589,https://avatars.githubusercontent.com/u/76536295?v=4
600246354,g-helper,seerge/g-helper,C#,398,"Lightweight Armoury Crate alternative for Asus laptops and ROG Ally. Control tool for ROG Zephyrus G14, G15, G16, M16, Flow X13, Flow X16, TUF, Strix, Scar and other models",185,4570,https://avatars.githubusercontent.com/u/5920850?u=80e9cb264b3e5070554c2ddc3ece67df71804927&v=4
8302181,spine-runtimes,EsotericSoftware/spine-runtimes,C#,35,2D skeletal animation runtimes for Spine.,2844,4141,https://avatars.githubusercontent.com/u/3641958?v=4
275561012,glazewm,glzr-io/glazewm,C#,359,GlazeWM is a tiling window manager for Windows inspired by i3 and Polybar.,106,3368,https://avatars.githubusercontent.com/u/67482629?v=4
597222638,devhome,microsoft/devhome,C#,131,The new Dev Home experience for Windows!,262,3276,https://avatars.githubusercontent.com/u/6154722?v=4
45581062,NuGetForUnity,GlitchEnzo/NuGetForUnity,C#,82,A NuGet Package Manager for Unity,288,2704,https://avatars.githubusercontent.com/u/3473293?u=4c3b3906939f1f38f89487f6744f18f0b73f7b82&v=4
131145697,cognitive-services-speech-sdk,Azure-Samples/cognitive-services-speech-sdk,C#,91,Sample code for the Microsoft Cognitive Services Speech SDK,1740,2521,https://avatars.githubusercontent.com/u/1844662?v=4
639772835,StableSwarmUI,Stability-AI/StableSwarmUI,C#,435,"StableSwarmUI, A Modular Stable Diffusion Web-User-Interface, with an emphasis on making powertools easily accessible, high performance, and extensibility.",205,2478,https://avatars.githubusercontent.com/u/100950301?v=4
181356258,run-aspnetcore-microservices,aspnetrun/run-aspnetcore-microservices,C#,71,"Microservices on .Net platforms which used ASP.NET Web API, Docker, RabbitMQ, MassTransit, Grpc, Yarp API Gateway, PostgreSQL, Redis, SQLite, SqlServer, Marten, Entity Framework Core, CQRS, MediatR, DDD, Vertical and Clean Architecture implementation with using latest features of .NET 8 and C# 12",1319,2406,https://avatars.githubusercontent.com/u/48249907?v=4
723386132,downkyicore,yaobiao131/downkyicore,C#,228,å“”å“©ä¸‹è½½å§¬(è·¨å¹³å°ç‰ˆ)downkyiï¼Œå“”å“©å“”å“©ç½‘ç«™è§†é¢‘ä¸‹è½½å·¥å…·ï¼Œæ”¯æŒæ‰¹é‡ä¸‹è½½ï¼Œæ”¯æŒ8Kã€HDRã€æœæ¯”è§†ç•Œï¼Œæä¾›å·¥å…·ç®±ï¼ˆéŸ³è§†é¢‘æå–ã€å»æ°´å°ç­‰ï¼‰ã€‚,39,629,https://avatars.githubusercontent.com/u/28655758?u=479043061b4c66665b871ba2492be717ce4cac2a&v=4
739471388,megacity-metro,Unity-Technologies/megacity-metro,C#,242,"Megacity-Metro: a thrilling shooter game, using Netcode for Entities for a multiplayer experience supporting 128+ players. Latest DOTS packages and Unity Gaming Services elevate the user experience, demonstrating how to craft engaging multiplayer games.",98,435,https://avatars.githubusercontent.com/u/426196?v=4
