id,name,full_name,language,new stars,description,forks_count,stargazers_count,avatar_url
614765452,AutoGPT,Significant-Gravitas/AutoGPT,JavaScript,2386,"AutoGPT is the vision of accessible AI for everyone, to use and to build on. Our mission is to provide the tools, so that you can focus on what matters.",41499,160333,https://avatars.githubusercontent.com/u/130738209?v=4
85541218,weekly,ascoders/weekly,JavaScript,618,å‰ç«¯ç²¾è¯»å‘¨åˆŠã€‚å¸®ä½ ç†è§£æœ€å‰æ²¿ã€å®ç”¨çš„æŠ€æœ¯ã€‚,3150,27416,https://avatars.githubusercontent.com/u/7970947?u=730a8387e8cd0725e005f4bedb868efdd627c06d&v=4
542284380,bruno,usebruno/bruno,JavaScript,5338,Opensource IDE For Exploring and Testing Api's (lightweight alternative to postman/insomnia),790,17734,https://avatars.githubusercontent.com/u/114530840?v=4
192640529,label-studio,HumanSignal/label-studio,JavaScript,454,Label Studio is a multi-type data labeling and annotation tool with standardized output format,2004,16203,https://avatars.githubusercontent.com/u/48309720?v=4
631254164,one-api,songquanpeng/one-api,JavaScript,1865,"OpenAI æ¥å£ç®¡ç† & åˆ†å‘ç³»ç»Ÿï¼Œæ”¯æŒ Azureã€Anthropic Claudeã€Google PaLM 2 & Geminiã€æ™ºè°± ChatGLMã€ç™¾åº¦æ–‡å¿ƒä¸€è¨€ã€è®¯é£æ˜Ÿç«è®¤çŸ¥ã€é˜¿é‡Œé€šä¹‰åƒé—®ã€360 æ™ºè„‘ä»¥åŠè…¾è®¯æ··å…ƒï¼Œå¯ç”¨äºäºŒæ¬¡åˆ†å‘ç®¡ç† keyï¼Œä»…å•å¯æ‰§è¡Œæ–‡ä»¶ï¼Œå·²æ‰“åŒ…å¥½ Docker é•œåƒï¼Œä¸€é”®éƒ¨ç½²ï¼Œå¼€ç®±å³ç”¨. OpenAI key management & redistribution system, using a single API for all LLMs, and features an English UI.",2922,12302,https://avatars.githubusercontent.com/u/39998050?v=4
649170660,anything-llm,Mintplex-Labs/anything-llm,JavaScript,1459,"A multi-user ChatGPT for any LLMs and vector database. Unlimited documents, messages, and storage in one privacy-focused app. Now available as a desktop application with a built-in LLM!",1075,10049,https://avatars.githubusercontent.com/u/134426827?v=4
601161044,transformers.js,xenova/transformers.js,JavaScript,497,"State-of-the-art Machine Learning for the web. Run ğŸ¤— Transformers directly in your browser, with no need for a server!",373,6559,https://avatars.githubusercontent.com/u/26504141?u=0e82815ed3ab279a77815adccc63b9d73725edde&v=4
650579041,EDtunnel,3Kmfi6HP/EDtunnel,JavaScript,1006,Use Cloudflare pages and worker serverless to implement VLESS protocol,4493,4700,https://avatars.githubusercontent.com/u/58669916?u=310b66a353dc79963bd669f51c23f9e80c65ab2a&v=4
722125767,BlackFriday-GPTs-Prompts,friuns2/BlackFriday-GPTs-Prompts,JavaScript,1269,List of free GPTs that doesn't require plus subscription ,542,3445,https://avatars.githubusercontent.com/u/16543239?u=23d6088f195849fdfe76cfd53e4c9d983f9f01e7&v=4
212159603,tixcraft_bot,max32002/tixcraft_bot,JavaScript,465,Maxæ¶ç¥¨æ©Ÿå™¨äºº(maxbot) help you quickly buy your tickets,264,1738,https://avatars.githubusercontent.com/u/4498233?u=cc6bbc7818a7960f50b1dd9bae5d01b160ebdc0c&v=4
