id,name,full_name,language,new stars,description,forks_count,stargazers_count,avatar_url
121395510,CS-Notes,CyC2018/CS-Notes,Java,79,:books: æŠ€æœ¯é¢è¯•å¿…å¤‡åŸºç¡€çŸ¥è¯†ã€Leetcodeã€è®¡ç®—æœºæ“ä½œç³»ç»Ÿã€è®¡ç®—æœºç½‘ç»œã€ç³»ç»Ÿè®¾è®¡,45541,142736,https://avatars.githubusercontent.com/u/36260787?u=70a8c2cbcaeb2f7dbcf84c1c40eea8c87a6d9bc3&v=4
206462776,GitHub-Chinese-Top-Charts,kon9chunkit/GitHub-Chinese-Top-Charts,Java,66,:cn: GitHubä¸­æ–‡æ’è¡Œæ¦œï¼Œå¸®åŠ©ä½ å‘ç°é«˜åˆ†ä¼˜ç§€ä¸­æ–‡é¡¹ç›®ï¼Œæ— è¯­è¨€éšœç¢åœ°ã€æ›´é«˜æ•ˆåœ°å¸æ”¶å›½äººä¼˜ç§€ç»éªŒæˆæœï¼›æ¦œå•å‘¨æ›´ï¼Œæ•¬è¯·å…³æ³¨ï¼,5804,40941,https://avatars.githubusercontent.com/u/21018904?u=4a36658ac09281fb3a7591b905e494694800583a&v=4
55886798,BaseRecyclerViewAdapterHelper,CymChad/BaseRecyclerViewAdapterHelper,Java,7,BRVAH:Powerful and flexible RecyclerAdapter,4784,22483,https://avatars.githubusercontent.com/u/7698209?u=3d0d15bf6610d0db3f6229795212eec63a6f575d&v=4
13862381,Telegram,DrKLO/Telegram,Java,36,Telegram for Android source,6498,18724,https://avatars.githubusercontent.com/u/69369?v=4
20818126,ExoPlayer,google/ExoPlayer,Java,6,An extensible media player for Android,5450,18581,https://avatars.githubusercontent.com/u/1342004?v=4
20773773,bazel,bazelbuild/bazel,Java,14,"a fast, scalable, multi-language and extensible build system",3185,17715,https://avatars.githubusercontent.com/u/11684617?v=4
44804216,termux-app,termux/termux-app,Java,18,Termux - a terminal emulator application for Android OS extendible by variety of packages.,1427,9911,https://avatars.githubusercontent.com/u/8104776?v=4
139914932,quarkus,quarkusio/quarkus,Java,8,Quarkus: Supersonic Subatomic Java. ,1614,8943,https://avatars.githubusercontent.com/u/47638783?v=4
149001365,leetcode,doocs/leetcode,Java,14,ğŸ˜ LeetCode solutions in any programming language | å¤šç§ç¼–ç¨‹è¯­è¨€å®ç° LeetCodeã€ã€Šå‰‘æŒ‡ Offerï¼ˆç¬¬ 2 ç‰ˆï¼‰ã€‹ã€ã€Šç¨‹åºå‘˜é¢è¯•é‡‘å…¸ï¼ˆç¬¬ 6 ç‰ˆï¼‰ã€‹é¢˜è§£,1646,7766,https://avatars.githubusercontent.com/u/43716716?v=4
206424,cassandra,apache/cassandra,Java,5,Mirror of Apache Cassandra,2979,6989,https://avatars.githubusercontent.com/u/47359?v=4
671825,graylog2-server,Graylog2/graylog2-server,Java,7,Free and open source log management,925,5920,https://avatars.githubusercontent.com/u/474892?v=4
140543886,incubator-shenyu,apache/incubator-shenyu,Java,6,ShenYu is High-Performance Java API Gateway.,1943,5557,https://avatars.githubusercontent.com/u/47359?v=4
33816473,testcontainers-java,testcontainers/testcontainers-java,Java,5,"Testcontainers is a Java library that supports JUnit tests, providing lightweight, throwaway instances of common databases, Selenium web browsers, or anything else that can run in a Docker container.",1073,5441,https://avatars.githubusercontent.com/u/13393021?v=4
50160261,Paper,PaperMC/Paper,Java,21,High performance Spigot fork that aims to fix gameplay and mechanics inconsistencies,1280,4899,https://avatars.githubusercontent.com/u/7608950?v=4
69400326,ksql,confluentinc/ksql,Java,1,The database purpose-built for stream processing applications.,878,4646,https://avatars.githubusercontent.com/u/9439498?v=4
75882172,conductor,Netflix/conductor,Java,8,Conductor is a microservices orchestration engine.,1207,3706,https://avatars.githubusercontent.com/u/913567?v=4
117054584,dubbo-admin,apache/dubbo-admin,Java,2,The ops and reference implementation for Apache Dubbo,1858,3435,https://avatars.githubusercontent.com/u/47359?v=4
248032165,spring-authorization-server,spring-projects/spring-authorization-server,Java,3,The Spring Authorization Server project is focused on delivering OAuth 2.1 Authorization Server support to the Spring community.,573,2949,https://avatars.githubusercontent.com/u/317776?v=4
237553513,sodium-fabric,CaffeineMC/sodium-fabric,Java,11,A Fabric mod designed to improve frame rates and reduce micro-stutter,495,2830,https://avatars.githubusercontent.com/u/78509697?v=4
158256479,iceberg,apache/iceberg,Java,6,Apache Iceberg,847,2198,https://avatars.githubusercontent.com/u/47359?v=4
1201104,dynmap,webbukkit/dynmap,Java,11,A set of Minecraft mods that provide a real time web-based map system for various Minecraft server implementations.,344,1470,https://avatars.githubusercontent.com/u/566729?v=4
2928948,azure-sdk-for-java,Azure/azure-sdk-for-java,Java,2,This repository is for active development of the Azure SDK for Java. For consumers of the SDK we recommend visiting our public developer docs at https://docs.microsoft.com/java/azure/ or our versioned developer docs at https://azure.github.io/azure-sdk-for-java. ,1277,1079,https://avatars.githubusercontent.com/u/6844498?v=4
377354200,dynamic-threadpool,acmenlt/dynamic-threadpool,Java,200,"ğŸ”¥ å¼ºå¤§çš„åŠ¨æ€çº¿ç¨‹æ± ï¼Œé™„å¸¦ç›‘æ§æŠ¥è­¦åŠŸèƒ½ï¼ˆæ²¡æœ‰ä¾èµ–ä¸­é—´ä»¶ï¼‰ï¼Œå®Œå…¨éµå¾ªé˜¿é‡Œå·´å·´ç¼–ç è§„èŒƒã€‚Powerful dynamic thread pool, does not rely on any middleware, with monitoring and alarm function.",149,1008,https://avatars.githubusercontent.com/u/77398366?u=362ab74c104677018318200e72c5e549bc82d681&v=4
432886173,ja-netfilter,ja-netfilter/ja-netfilter,Java,163,A javaagent lib for network filter,128,615,https://avatars.githubusercontent.com/u/95430524?v=4
376431287,ShiroAttack2,SummerSec/ShiroAttack2,Java,36,"shiroååºåˆ—åŒ–æ¼æ´ç»¼åˆåˆ©ç”¨,åŒ…å«ï¼ˆå›æ˜¾æ‰§è¡Œå‘½ä»¤/æ³¨å…¥å†…å­˜é©¬ï¼‰ä¿®å¤åŸç‰ˆä¸­NoCCçš„é—®é¢˜ https://github.com/j1anFen/shiro_attack",42,312,https://avatars.githubusercontent.com/u/47944478?u=733501d21148c2fdde1bfe604110ce36b7c79430&v=4
