id,name,full_name,language,new stars,description,forks_count,stargazers_count,avatar_url
11715753,masscan,robertdavidgraham/masscan,C,381,"TCP port scanner, spews SYN packets asynchronously, scanning entire Internet in under 5 minutes.",2823,20020,https://avatars.githubusercontent.com/u/3814757?v=4
7634677,openssl,openssl/openssl,C,503,TLS/SSL and crypto library,8541,19957,https://avatars.githubusercontent.com/u/3279138?v=4
47409672,hashcat,hashcat/hashcat,C,509,World's fastest and most advanced password recovery utility,2393,15990,https://avatars.githubusercontent.com/u/15949799?v=4
63477515,C,TheAlgorithms/C,C,362,"Collection of various algorithms in mathematics, machine learning, computer science, physics, etc implemented in C for educational purposes.",3808,14886,https://avatars.githubusercontent.com/u/20487725?v=4
27737393,qmk_firmware,qmk/qmk_firmware,C,277,Open-source keyboard firmware for Atmel AVR and Arm USB families,29014,13661,https://avatars.githubusercontent.com/u/25358678?v=4
45821540,openwrt,openwrt/openwrt,C,336,This repository is a mirror of https://git.openwrt.org/openwrt/openwrt.git It is for reference only and is not active for check-ins.  We will continue to accept Pull Requests here. They will be merged via staging trees then into openwrt.git.,7905,13099,https://avatars.githubusercontent.com/u/2528830?v=4
78281075,esp8266_deauther,SpacehuhnTech/esp8266_deauther,C,223,Affordable WiFi hacking platform for testing and learning,2264,10762,https://avatars.githubusercontent.com/u/64325017?v=4
179354282,OpenCorePkg,acidanthera/OpenCorePkg,C,211,OpenCore bootloader,1838,10378,https://avatars.githubusercontent.com/u/39672954?v=4
70127218,arduino-esp32,espressif/arduino-esp32,C,156,Arduino core for the ESP32,6086,9554,https://avatars.githubusercontent.com/u/9460735?v=4
65899476,esp-idf,espressif/esp-idf,C,168,Espressif IoT Development Framework. Official development framework for Espressif SoCs.,5927,9362,https://avatars.githubusercontent.com/u/9460735?v=4
394318710,ExplorerPatcher,valinet/ExplorerPatcher,C,784,This project aims to enhance the working environment on Windows,507,9190,https://avatars.githubusercontent.com/u/6503598?u=25d850b7dcc57d2a488d83646fff7cca48cf7fc7&v=4
4151993,openvpn,OpenVPN/openvpn,C,155,OpenVPN  is  an open source VPN daemon,2554,7723,https://avatars.githubusercontent.com/u/1569141?v=4
30291090,i3,i3/i3,C,96,A tiling window manager,697,7622,https://avatars.githubusercontent.com/u/7904352?v=4
2997204,john,openwall/john,C,148,"John the Ripper jumbo - advanced offline password cracker, which supports hundreds of hash and cipher types, and runs on many operating systems, CPUs, GPUs, and even some FPGAs",1763,6943,https://avatars.githubusercontent.com/u/1579552?v=4
47057247,vlmcsd,Wind4/vlmcsd,C,282,"KMS Emulator in C (currently runs on Linux including Android, FreeBSD, Solaris, Minix, Mac OS, iOS, Windows with or without Cygwin)",1907,6760,https://avatars.githubusercontent.com/u/3997851?v=4
59676171,klipper,Klipper3d/klipper,C,138,Klipper is a 3d-printer firmware,3779,5535,https://avatars.githubusercontent.com/u/90982958?v=4
40556106,wazuh,wazuh/wazuh,C,342,Wazuh - The Open Source Security Platform,891,5147,https://avatars.githubusercontent.com/u/13752566?v=4
293316071,quickjs,bellard/quickjs,C,343,Public repository of the QuickJS Javascript Engine. Pull requests are not accepted. Use the mailing list to submit patches.,513,5127,https://avatars.githubusercontent.com/u/6490144?v=4
21329550,wireshark,wireshark/wireshark,C,125,Read-only mirror of Wireshark's Git repository at https://gitlab.com/wireshark/wireshark. GitHub won't let us disable pull requests. ☞ THEY WILL BE IGNORED HERE ☜ Please upload them at GitLab.,1549,4951,https://avatars.githubusercontent.com/u/6233056?v=4
157590294,Telegram-iOS,TelegramMessenger/Telegram-iOS,C,119,Telegram-iOS,1078,3962,https://avatars.githubusercontent.com/u/22377696?v=4
5410234,suricata,OISF/suricata,C,66,Suricata git repository maintained by the OISF,1147,2814,https://avatars.githubusercontent.com/u/2188963?v=4
127023441,cuda-samples,NVIDIA/cuda-samples,C,138,Samples for CUDA Developers which demonstrates features in CUDA Toolkit,991,2690,https://avatars.githubusercontent.com/u/1728152?v=4
2339555,util-linux,util-linux/util-linux,C,47,,1022,1912,https://avatars.githubusercontent.com/u/93589837?v=4
543276238,libsql,libsql/libsql,C,1419,"libSQL is a fork of SQLite that is both Open Source, and Open Contributions.",43,1768,https://avatars.githubusercontent.com/u/114694406?v=4
470373719,istoreos,istoreos/istoreos,C,163,提供一个人人会用的的路由、NAS系统,64,656,https://avatars.githubusercontent.com/u/107662817?v=4
