id,name,full_name,language,new stars,description,forks_count,stargazers_count,avatar_url
343965132,ML-For-Beginners,microsoft/ML-For-Beginners,Jupyter Notebook,3809,"12 weeks, 26 lessons, 52 quizzes, classic Machine Learning for all",6963,36019,https://avatars.githubusercontent.com/u/6154722?v=4
52281283,mastodon,mastodon/mastodon,Ruby,1726,"Your self-hosted, globally interconnected microblogging community",4553,29174,https://avatars.githubusercontent.com/u/24979032?v=4
169677297,v,vlang/v,V,982,"Simple, fast, safe, compiled language for developing maintainable software. Compiles itself in <1s with zero library dependencies. https://vlang.io",1782,29022,https://avatars.githubusercontent.com/u/46413578?v=4
39840932,googletest,google/googletest,C++,712,GoogleTest - Google Testing and Mocking Framework,8564,26284,https://avatars.githubusercontent.com/u/1342004?v=4
262296122,PaddleOCR,PaddlePaddle/PaddleOCR,Python,1962,"Awesome multilingual OCR toolkits based on PaddlePaddle (practical ultra lightweight OCR system, support 80+ languages recognition, provide data annotation and synthesis tools, support training and deployment among server, mobile, embedded and IoT devices)",4470,21805,https://avatars.githubusercontent.com/u/23534030?v=4
3544424,httpie,httpie/httpie,Python,10441,"As easy as /aitch-tee-tee-pie/ ðŸ¥§ Modern, user-friendly command-line HTTP client for the API era. JSON support, colors, sessions, downloads, plugins & more. https://twitter.com/httpie",3671,21121,https://avatars.githubusercontent.com/u/24454777?v=4
107505869,firecracker,firecracker-microvm/firecracker,Rust,331,Secure and fast microVMs for serverless computing.,1272,18073,https://avatars.githubusercontent.com/u/44477506?v=4
275993885,appsmith,appsmithorg/appsmith,TypeScript,3041,"Low code project to build admin panels, internal tools, and dashboards. Integrates with 15+ databases and any API.",1458,17949,https://avatars.githubusercontent.com/u/67620218?v=4
299354207,rustdesk,rustdesk/rustdesk,Rust,1253,Open source virtual / remote desktop infrastructure for everyone! The open source TeamViewer alternative.,1753,17561,https://avatars.githubusercontent.com/u/71636191?u=2a82300d822331f687ec5f00a250fa9862b34cc5&v=4
479924503,run,The-Run-Philosophy-Organization/run,,8865,æ¶¦å­¦å…¨çƒå®˜æ–¹æŒ‡å®šGITHUBï¼Œæ•´ç†æ¶¦å­¦å®—æ—¨ã€çº²é¢†ã€ç†è®ºå’Œå„ç±»æ¶¦ä¹‹å®žä¾‹ï¼›è§£å†³ä¸ºä»€ä¹ˆæ¶¦ï¼Œæ¶¦åŽ»å“ªé‡Œï¼Œæ€Žä¹ˆæ¶¦ä¸‰å¤§é—®é¢˜ï¼› å¹¶æˆä¸ºæ–°ä¸­å›½äººçš„æ ¸å¿ƒå®—æ•™ï¼Œæ ¸å¿ƒä¿¡å¿µã€‚,1077,14917,https://avatars.githubusercontent.com/u/103482135?v=4
313330998,50projects50days,bradtraversy/50projects50days,CSS,1040,"50+ mini web projects using HTML, CSS & JS",3931,13221,https://avatars.githubusercontent.com/u/5550850?u=819e4404506d906d5113cc352b560fcfd242cce3&v=4
280363952,umami,mikecao/umami,JavaScript,742,"Umami is a simple, fast, privacy-focused alternative to Google Analytics.",1549,11135,https://avatars.githubusercontent.com/u/477975?v=4
355959597,textual,Textualize/textual,Python,1834,Textual is a TUI (Text User Interface) framework for Python inspired by modern web development.,287,10856,https://avatars.githubusercontent.com/u/93378883?v=4
234033679,the-economist-ebooks,hehonghui/the-economist-ebooks,CSS,3907,"ç»æµŽå­¦äºº(å«éŸ³é¢‘)ã€çº½çº¦å®¢ã€è‡ªç„¶ã€æ–°ç§‘å­¦äººã€å«æŠ¥ã€ç§‘å­¦ç¾Žå›½äººã€è¿žçº¿ã€å¤§è¥¿æ´‹æœˆåˆŠã€å›½å®¶åœ°ç†ç­‰è‹±è¯­æ‚å¿—å…è´¹ä¸‹è½½ã€è®¢é˜…(kindleæŽ¨é€),æ”¯æŒepubã€mobiã€pdfæ ¼å¼, æ¯å‘¨æ›´æ–°. The Economist ã€The New Yorker ã€Natureã€The Atlantic ã€New Scientistã€The Guardianã€Scientific Americanã€Wired magazines, free download and subscription for kindle, mobiã€epubã€pdf format. ",1131,9189,https://avatars.githubusercontent.com/u/1683811?u=4fdd12c8f8685ef1ce1b9d798bfbd6f86bd4b397&v=4
217475193,PaddleDetection,PaddlePaddle/PaddleDetection,Python,780,"Object Detection toolkit based on PaddlePaddle. It supports object detection, instance segmentation, multiple object tracking and real-time multi-person keypoint detection.",1937,7643,https://avatars.githubusercontent.com/u/23534030?v=4
3757435,pytube,pytube/pytube,Python,1051,"A lightweight, dependency-free Python library (and command-line utility) for downloading YouTube Videos.",1478,7144,https://avatars.githubusercontent.com/u/16789089?v=4
341714203,DALL-E,openai/DALL-E,Python,756,PyTorch package for the discrete VAE used for DALLÂ·E.,910,5532,https://avatars.githubusercontent.com/u/14957082?v=4
478823173,DALLE2-pytorch,lucidrains/DALLE2-pytorch,Python,3462,"Implementation of DALL-E 2, OpenAI's updated text-to-image synthesis neural network,  in Pytorch",244,4651,https://avatars.githubusercontent.com/u/108653?u=73e119b957102d7cf7c37b915f7dad20f7ecf8fc&v=4
462682958,Geographical-Adventures,SebLague/Geographical-Adventures,C#,1539,,232,2028,https://avatars.githubusercontent.com/u/4266663?u=c76c023f7636ef94b182ee6a444f3517639ccc27&v=4
462597790,aptos-core,aptos-labs/aptos-core,Rust,1551,A layer 1 for everyone!,1086,1929,https://avatars.githubusercontent.com/u/99841612?v=4
463337778,disco-diffusion,alembics/disco-diffusion,Jupyter Notebook,1302,,283,1772,https://avatars.githubusercontent.com/u/100251391?v=4
284134871,flipperzero-firmware,flipperdevices/flipperzero-firmware,C,225,Flipper Zero Firmware,270,1521,https://avatars.githubusercontent.com/u/57576566?v=4
365367120,sunflower-land,sunflower-land/sunflower-land,TypeScript,325,,375,1229,https://avatars.githubusercontent.com/u/92827381?v=4
