id,name,full_name,language,new stars,description,forks_count,stargazers_count,avatar_url
31792824,flutter,flutter/flutter,Dart,2159,Flutter makes it easy and fast to build beautiful apps for mobile and beyond,22227,141083,https://avatars.githubusercontent.com/u/14101776?v=4
311525798,Web-Dev-For-Beginners,microsoft/Web-Dev-For-Beginners,JavaScript,5674,"24 Lessons, 12 Weeks, Get Started as a Web Developer",7561,51785,https://avatars.githubusercontent.com/u/6154722?v=4
196701619,tauri,tauri-apps/tauri,Rust,4579,"Build smaller, faster, and more secure desktop applications with a web frontend.",1020,41505,https://avatars.githubusercontent.com/u/54536011?v=4
33884891,airflow,apache/airflow,Python,523,"Apache Airflow - A platform to programmatically author, schedule, and monitor workflows",10623,26146,https://avatars.githubusercontent.com/u/47359?v=4
168008797,calculator,microsoft/calculator,C++,734,Windows Calculator: A simple yet powerful calculator that ships with Windows,4485,24889,https://avatars.githubusercontent.com/u/6154722?v=4
262296122,PaddleOCR,PaddlePaddle/PaddleOCR,Python,2143,"Awesome multilingual OCR toolkits based on PaddlePaddle (practical ultra lightweight OCR system, support 80+ languages recognition, provide data annotation and synthesis tools, support training and deployment among server, mobile, embedded and IoT devices)",4556,22313,https://avatars.githubusercontent.com/u/23534030?v=4
299354207,rustdesk,rustdesk/rustdesk,Rust,4323,Open source virtual / remote desktop infrastructure for everyone! The open source TeamViewer alternative. Display and control your PC and Android devices.,1904,20777,https://avatars.githubusercontent.com/u/71636191?u=2a82300d822331f687ec5f00a250fa9862b34cc5&v=4
281975310,type-challenges,type-challenges/type-challenges,TypeScript,2052,Collection of TypeScript type challenges with online judge,1627,18527,https://avatars.githubusercontent.com/u/68700335?v=4
275993885,appsmith,appsmithorg/appsmith,TypeScript,2648,"Low code project to build admin panels, internal tools, and dashboards. Integrates with 15+ databases and any API.",1497,18431,https://avatars.githubusercontent.com/u/67620218?v=4
120710644,ddia,Vonng/ddia,Python,1182,《Designing Data-Intensive Application》DDIA中文翻译,3143,14386,https://avatars.githubusercontent.com/u/8587410?u=cf4bf2dc20cda87e09a0feff8b103fe8ec8bbb32&v=4
299628763,30-Days-Of-React,Asabeneh/30-Days-Of-React,JavaScript,1193,"30 Days of  React challenge is a step by step guide to learn React in 30 days. It requires HTML, CSS, and JavaScript knowledge. You should be comfortable with JavaScript before you start to React.  If you are not comfortable with JavaScript check out 30DaysOfJavaScript. This is a continuation of 30 Days Of JS.  This challenge may take more than 100 days, follow your own pace. ",3062,11767,https://avatars.githubusercontent.com/u/9008063?u=ec6ff77196b998a4e6b6e3ca1429c524c169c189&v=4
410749029,spacedrive,spacedriveapp/spacedrive,TypeScript,5322,"Spacedrive is an open source cross-platform file explorer, powered by a virtual distributed filesystem written in Rust.",245,11063,https://avatars.githubusercontent.com/u/101227423?v=4
345368765,NvChad,NvChad/NvChad,Lua,1187,"An attempt to make neovim cli functional like an IDE while being very beautiful, blazing fast startuptime ~ 20ms to 70ms",626,9853,https://avatars.githubusercontent.com/u/88978340?v=4
482520194,Grasscutter,Grasscutters/Grasscutter,Java,4530,A server software reimplementation for a certain anime game.,2697,7440,https://avatars.githubusercontent.com/u/104039209?v=4
301830590,litestream,benbjohnson/litestream,Go,1435,Streaming replication for SQLite.,129,6605,https://avatars.githubusercontent.com/u/118015?u=18cf84d5519b1a422e7a15ebae60679c59e3de86&v=4
478823173,DALLE2-pytorch,lucidrains/DALLE2-pytorch,Python,3426,"Implementation of DALL-E 2, OpenAI's updated text-to-image synthesis neural network,  in Pytorch",306,5399,https://avatars.githubusercontent.com/u/108653?u=73e119b957102d7cf7c37b915f7dad20f7ecf8fc&v=4
486815039,actual,actualbudget/actual,JavaScript,2728,A local-first personal finance system,350,4604,https://avatars.githubusercontent.com/u/37879538?v=4
419661684,data-engineering-zoomcamp,DataTalksClub/data-engineering-zoomcamp,Jupyter Notebook,863,Free Data Engineering course! ,1081,4569,https://avatars.githubusercontent.com/u/72699292?v=4
336274588,PaddleNLP,PaddlePaddle/PaddleNLP,Python,1105,"Easy-to-use and powerful NLP library with Awesome model zoo, supporting wide-range of NLP tasks from research to industrial applications, including Neural Search, Question Answering, Information Extraction and Sentiment Analysis end-to-end system.",1257,4298,https://avatars.githubusercontent.com/u/23534030?v=4
400501136,mujoco,deepmind/mujoco,C,733,Multi-Joint dynamics with Contact. A general purpose physics simulator.,333,4217,https://avatars.githubusercontent.com/u/8596759?v=4
464827989,jsonhero-web,jsonhero-io/jsonhero-web,TypeScript,1546,"JSON Hero is an open-source, beautiful JSON explorer for the web that lets you browse, search and navigate your JSON files at speed. 🚀",100,3170,https://avatars.githubusercontent.com/u/95297378?v=4
462597790,aptos-core,aptos-labs/aptos-core,Rust,1122,A layer 1 for everyone!,1478,2240,https://avatars.githubusercontent.com/u/99841612?v=4
463337778,disco-diffusion,alembics/disco-diffusion,Jupyter Notebook,1119,,363,2318,https://avatars.githubusercontent.com/u/100251391?v=4
482425877,fastjson2,alibaba/fastjson2,Java,963,🚄 FASTJSON2是FASTJSON项目的重要升级，目标是为下一个十年提供一个高性能的JSON库,140,1592,https://avatars.githubusercontent.com/u/1961952?v=4
319466912,GenshinData,Dimbreath/GenshinData,,425,Repository containing the game data for the game Genshin Impact.,437,1209,https://avatars.githubusercontent.com/u/1474840?u=b78046024170f7ad9edcb9525cb1bcf5f91ce0f9&v=4
