id,name,full_name,language,new stars,description,forks_count,stargazers_count,avatar_url
100060912,terminal,microsoft/terminal,C++,976,"The new Windows Terminal and the original Windows console host, all in the same place!",7362,83094,https://avatars.githubusercontent.com/u/6154722?v=4
1181927,bitcoin,bitcoin/bitcoin,C++,877,Bitcoin Core integration/staging tree,32379,64074,https://avatars.githubusercontent.com/u/528860?v=4
5108051,opencv,opencv/opencv,C++,738,Open Source Computer Vision Library,51407,61584,https://avatars.githubusercontent.com/u/5009934?v=4
23357588,protobuf,protocolbuffers/protobuf,C++,693,Protocol Buffers - Google's data interchange format,14074,54504,https://avatars.githubusercontent.com/u/26310541?v=4
11171548,json,nlohmann/json,C++,556,JSON for Modern C++,5173,30118,https://avatars.githubusercontent.com/u/159488?v=4
168008797,calculator,microsoft/calculator,C++,666,Windows Calculator: A simple yet powerful calculator that ships with Windows,4459,24724,https://avatars.githubusercontent.com/u/6154722?v=4
60246359,ClickHouse,ClickHouse/ClickHouse,C++,598,ClickHouseÂ® is a free analytics DBMS for big data,4733,23697,https://avatars.githubusercontent.com/u/54801242?v=4
74660642,taichi,taichi-dev/taichi,C++,359,Productive & portable high-performance programming in Python.,1969,19048,https://avatars.githubusercontent.com/u/33354891?v=4
98771110,TrafficMonitor,zhongyang219/TrafficMonitor,C++,1119,è¿™æ˜¯ä¸€ä¸ªç”¨äºæ˜¾ç¤ºå½“å‰ç½‘é€Ÿã€CPUåŠå†…å­˜åˆ©ç”¨ç‡çš„æ¡Œé¢æ‚¬æµ®çª—è½¯ä»¶ï¼Œå¹¶æ”¯æŒä»»åŠ¡æ æ˜¾ç¤ºï¼Œæ”¯æŒæ›´æ¢çš®è‚¤ã€‚,2057,18342,https://avatars.githubusercontent.com/u/30562462?u=18ad9b9dfa6e784088d28deb7e0dbe830afcc0b7&v=4
1062572,Catch2,catchorg/Catch2,C++,202,"A modern, C++-native, test framework for unit-tests, TDD and BDD - using C++14, C++17 and later (C++11 support is in v2.x branch, and C++03 on the Catch1.x branch)",2563,14941,https://avatars.githubusercontent.com/u/33321405?v=4
14981376,dogecoin,dogecoin/dogecoin,C++,138,very currency,2565,13998,https://avatars.githubusercontent.com/u/6122353?v=4
6520784,rpcs3,RPCS3/rpcs3,C++,235,PS3 emulator/debugger,1655,11179,https://avatars.githubusercontent.com/u/8070735?v=4
18348651,OpenRCT2,OpenRCT2/OpenRCT2,C++,145,An open source re-implementation of RollerCoaster Tycoon 2 ğŸ¢,1249,10522,https://avatars.githubusercontent.com/u/8473908?v=4
51905353,arrow,apache/arrow,C++,165,Apache Arrow is a multi-language toolbox for accelerated data interchange and in-memory processing,2342,9511,https://avatars.githubusercontent.com/u/47359?v=4
35718695,ndk-samples,android/ndk-samples,C++,84,Android NDK samples with Android Studio,3927,8839,https://avatars.githubusercontent.com/u/32689599?v=4
143324737,devilutionX,diasurgical/devilutionX,C++,406,Diablo build for modern operating systems,587,5751,https://avatars.githubusercontent.com/u/40645014?v=4
138754790,duckdb,duckdb/duckdb,C++,345,DuckDB is an in-process SQL OLAP Database Management System,469,5027,https://avatars.githubusercontent.com/u/82039556?v=4
354743391,o3de,o3de/o3de,C++,176,"Open 3D Engine (O3DE) is an Apache 2.0-licensed multi-platform 3D engine that enables developers and content creators to build AAA games, cinema-quality 3D worlds, and high-fidelity simulations without any fees or commercial obligations.",1454,4734,https://avatars.githubusercontent.com/u/68126246?v=4
309512982,redpanda,redpanda-data/redpanda,C++,292,Redpanda is a streaming data platform for developers. Kafka API compatible. 10x faster. No ZooKeeper. No JVM!,261,4087,https://avatars.githubusercontent.com/u/49406389?v=4
81634683,oneflow,Oneflow-Inc/oneflow,C++,219,OneFlow is a performance-centered and open-source deep learning framework.,408,3354,https://avatars.githubusercontent.com/u/24632470?v=4
83542585,LeetCode,wisdompeak/LeetCode,C++,702,This repository contains the solutions and explanations to the algorithm problems on LeetCode. Only medium or above are included. All are written in C++/Python and implemented by myself. The problems attempted multiple times are labelled with hyperlinks.,779,3176,https://avatars.githubusercontent.com/u/25891014?v=4
439448087,PolyMC,PolyMC/PolyMC,C++,223,A custom launcher for Minecraft that allows you to easily manage multiple installations of Minecraft at once (Fork of MultiMC),77,957,https://avatars.githubusercontent.com/u/96310119?v=4
464119098,genshin-cheat,CallowBlack/genshin-cheat,C++,189,Simple cheat for genshin with protection bypass.,102,309,https://avatars.githubusercontent.com/u/37184274?v=4
