id,name,full_name,language,new stars,description,forks_count,stargazers_count,avatar_url
519832,mitmproxy,mitmproxy/mitmproxy,Python,867,An interactive TLS-capable intercepting HTTP proxy for penetration testers and software developers.,3369,27613,https://avatars.githubusercontent.com/u/4652787?v=4
33884891,airflow,apache/airflow,Python,489,"Apache Airflow - A platform to programmatically author, schedule, and monitor workflows",10589,26034,https://avatars.githubusercontent.com/u/47359?v=4
28751632,linux-insides,0xAX/linux-insides,Python,1741,A little bit about a linux kernel,2965,26188,https://avatars.githubusercontent.com/u/2699235?u=6b9135d5c583701b84620f5dd84b3217aa588591&v=4
212639071,devops-exercises,bregman-arie/devops-exercises,Python,2026,"Linux, Jenkins, AWS, SRE, Prometheus, Docker, Python, Ansible, Git, Kubernetes, Terraform, OpenStack, SQL, NoSQL, Azure, GCP, DNS, Elastic, Network, Virtualization. DevOps Interview Questions",5140,24340,https://avatars.githubusercontent.com/u/10349437?u=bb7c3c533587d7cb2e3dd336e0f8a0d40544e5f5&v=4
262296122,PaddleOCR,PaddlePaddle/PaddleOCR,Python,2084,"Awesome multilingual OCR toolkits based on PaddlePaddle (practical ultra lightweight OCR system, support 80+ languages recognition, provide data annotation and synthesis tools, support training and deployment among server, mobile, embedded and IoT devices)",4534,22128,https://avatars.githubusercontent.com/u/23534030?v=4
71932349,ray,ray-project/ray,Python,523,"An open source framework that provides a simple, universal API for building distributed applications. Ray is packaged with RLlib, a scalable reinforcement learning library, and Tune, a scalable hyperparameter tuning library.",3580,20587,https://avatars.githubusercontent.com/u/22125274?v=4
48623558,wttr.in,chubin/wttr.in,Python,940,:partly_sunny: The right way to check the weather,873,18469,https://avatars.githubusercontent.com/u/3875145?u=0c0dbcc7f979c86eaa3bb89b412b04d5db4a1bec&v=4
8162715,saleor,saleor/saleor,Python,349,"A modular, high performance, headless e-commerce platform built with Python, GraphQL, Django, and React.",4549,16067,https://avatars.githubusercontent.com/u/13796165?v=4
120710644,ddia,Vonng/ddia,Python,1445,《Designing Data-Intensive Application》DDIA中文翻译,3125,14312,https://avatars.githubusercontent.com/u/8587410?u=cf4bf2dc20cda87e09a0feff8b103fe8ec8bbb32&v=4
263556058,GitHub520,521xueweihan/GitHub520,Python,908,:kissing_heart: 让你“爱”上 GitHub，解决访问时图裂、加载慢的问题。（无需安装）,1289,11408,https://avatars.githubusercontent.com/u/8255800?u=2024c0f3979fd65c8aab945856eae0852f1186f6&v=4
355959597,textual,Textualize/textual,Python,1870,Textual is a TUI (Text User Interface) framework for Python inspired by modern web development.,293,11239,https://avatars.githubusercontent.com/u/93378883?v=4
222751131,30-Days-Of-Python,Asabeneh/30-Days-Of-Python,Python,827,"30 days of Python programming challenge is a step-by-step guide to learn the Python programming language in 30 days. This challenge may take more than100 days, follow your own pace. ",2448,10227,https://avatars.githubusercontent.com/u/9008063?u=ec6ff77196b998a4e6b6e3ca1429c524c169c189&v=4
52728517,zhao,programthink/zhao,Python,716,【编程随想】整理的《太子党关系网络》，专门揭露赵国的权贵,2509,10005,https://avatars.githubusercontent.com/u/4027957?u=e630bf304844ff741944cfd50ae7420c229f47b1&v=4
192640529,label-studio,heartexlabs/label-studio,Python,706,Label Studio is a multi-type data labeling and annotation tool with standardized output format,1052,8792,https://avatars.githubusercontent.com/u/48309720?v=4
122663163,pyodide,pyodide/pyodide,Python,890,Pyodide is a Python distribution for the browser and Node.js based on WebAssembly,532,8607,https://avatars.githubusercontent.com/u/77002075?v=4
386524895,mvt,mvt-project/mvt,Python,745,MVT (Mobile Verification Toolkit) helps with conducting forensics of mobile devices in order to find signs of a potential compromise.,679,7689,https://avatars.githubusercontent.com/u/87478403?v=4
3757435,pytube,pytube/pytube,Python,620,"A lightweight, dependency-free Python library (and command-line utility) for downloading YouTube Videos.",1480,7242,https://avatars.githubusercontent.com/u/16789089?v=4
54686145,weiboSpider,dataabc/weiboSpider,Python,343,新浪微博爬虫，用python爬取新浪微博数据,1585,5677,https://avatars.githubusercontent.com/u/15182260?u=c041ed7a8bd8ae8a5e5002fa5b16bef319bf58af&v=4
341714203,DALL-E,openai/DALL-E,Python,610,PyTorch package for the discrete VAE used for DALL·E.,940,5701,https://avatars.githubusercontent.com/u/14957082?v=4
478823173,DALLE2-pytorch,lucidrains/DALLE2-pytorch,Python,3382,"Implementation of DALL-E 2, OpenAI's updated text-to-image synthesis neural network,  in Pytorch",281,5079,https://avatars.githubusercontent.com/u/108653?u=73e119b957102d7cf7c37b915f7dad20f7ecf8fc&v=4
253044228,nuclei-templates,projectdiscovery/nuclei-templates,Python,510,Community curated list of templates for the nuclei engine to find security vulnerabilities.,1334,4329,https://avatars.githubusercontent.com/u/50994705?v=4
336274588,PaddleNLP,PaddlePaddle/PaddleNLP,Python,1043,"Easy-to-use and powerful NLP library with Awesome model zoo, supporting wide-range of NLP tasks from research to industrial applications, including Neural Search, Question Answering, Information Extraction and Sentiment Analysis end-to-end system.",1235,4198,https://avatars.githubusercontent.com/u/23534030?v=4
128416969,archinstall,archlinux/archinstall,Python,420,"Arch Linux installer - guided, templates etc.",251,3579,https://avatars.githubusercontent.com/u/4673648?v=4
422274596,ColossalAI,hpcaitech/ColossalAI,Python,1178,Colossal-AI: A Unified Deep Learning System for Big Model Era,382,3555,https://avatars.githubusercontent.com/u/88699314?v=4
330914717,ivy,unifyai/ivy,Python,642,The Unified Machine Learning Framework,597,1862,https://avatars.githubusercontent.com/u/63879146?v=4
