id,name,full_name,language,new stars,description,forks_count,stargazers_count,avatar_url
1700621,normalize.css,necolas/normalize.css,CSS,6,A modern alternative to CSS resets,10684,52200,https://avatars.githubusercontent.com/u/239676?u=4b545d3dd62d217b40a624ebbe987cfc67e73803&v=4
50264296,bulma,jgthms/bulma,CSS,7,Modern CSS framework based on Flexbox,3940,49037,https://avatars.githubusercontent.com/u/1254808?u=1d9df343bac6f57e7bff85f0074aac2de34f5dcc&v=4
41058054,CppCoreGuidelines,isocpp/CppCoreGuidelines,CSS,9,"The C++ Core Guidelines are a set of tried-and-true guidelines, rules, and best practices about coding in C++",5411,42240,https://avatars.githubusercontent.com/u/13841574?v=4
69629434,freecodecamp.cn,FreeCodeCampChina/freecodecamp.cn,CSS,13,FCC China open source codebase and curriculum. Learn to code and help nonprofits.,1369,36879,https://avatars.githubusercontent.com/u/18478284?v=4
49767244,primeng,primefaces/primeng,CSS,5,The Most Complete Angular UI Component Library,4519,9944,https://avatars.githubusercontent.com/u/3494069?v=4
76666208,primereact,primefaces/primereact,CSS,8,The Most Complete React UI Component Library,971,6365,https://avatars.githubusercontent.com/u/3494069?v=4
292673424,cloudflare-docs,cloudflare/cloudflare-docs,CSS,2,Cloudflare’s documentation,2816,2750,https://avatars.githubusercontent.com/u/314135?v=4
6176823,markdown-cv,elipapa/markdown-cv,CSS,1,a simple template to write your CV in a readable markdown file and use CSS to publish/print it.,3229,1308,https://avatars.githubusercontent.com/u/112610?u=79be364aa9002041fd1e797b4046838339f08fb5&v=4
28813404,birthday,ayusharma/birthday,CSS,0,"A Happy Birthday animation design in CSS3, HTML5 ",2888,902,https://avatars.githubusercontent.com/u/6918450?u=e76de8dd892464905091e6610893af0505104f23&v=4
412858397,midnight-discord,refact0r/midnight-discord,CSS,0,"A dark, rounded discord theme.",347,526,https://avatars.githubusercontent.com/u/34758569?u=f463dd0a3d48bd5d85222ed94fbc3e530913abde&v=4
436884632,sakai-ng,primefaces/sakai-ng,CSS,1,Free Angular Admin Template by PrimeNG,507,517,https://avatars.githubusercontent.com/u/3494069?v=4
335394569,moveit2_tutorials,moveit/moveit2_tutorials,CSS,0,A sphinx-based centralized documentation repo for MoveIt 2,188,143,https://avatars.githubusercontent.com/u/4408844?v=4
