id,name,full_name,language,new stars,description,forks_count,stargazers_count,avatar_url
8514,rails,rails/rails,Ruby,70,Ruby on Rails,20186,50290,https://avatars.githubusercontent.com/u/4223?v=4
65252,jekyll,jekyll/jekyll,Ruby,63,:globe_with_meridians: Jekyll is a blog-aware static site generator in Ruby,9729,44235,https://avatars.githubusercontent.com/u/3083652?v=4
27442967,fastlane,fastlane/fastlane,Ruby,62,🚀 The easiest way to automate building and releasing your iOS and Android apps,5141,34202,https://avatars.githubusercontent.com/u/11098337?v=4
21600440,awesome-awesomeness,bayandin/awesome-awesomeness,Ruby,37,A curated list of awesome awesomeness,3487,28614,https://avatars.githubusercontent.com/u/864213?u=bece5170441fbfed6963d934553abf048d0b14e1&v=4
13840241,devdocs,freeCodeCamp/devdocs,Ruby,84,API Documentation Browser,1874,27887,https://avatars.githubusercontent.com/u/9892522?v=4
2293158,metasploit-framework,rapid7/metasploit-framework,Ruby,89,Metasploit Framework,12020,26575,https://avatars.githubusercontent.com/u/1013671?v=4
481872,vagrant,hashicorp/vagrant,Ruby,53,Vagrant is a tool for building and distributing development environments.,4230,23464,https://avatars.githubusercontent.com/u/761456?v=4
37382858,engineering-blogs,kilimchoi/engineering-blogs,Ruby,68,A curated list of engineering blogs,594,20983,https://avatars.githubusercontent.com/u/1356007?u=c1ae28679aee148c3e9984e00497968cf419e284&v=4
538746,ruby,ruby/ruby,Ruby,27,The Ruby Programming Language [mirror],5828,18935,https://avatars.githubusercontent.com/u/210414?v=4
1090311,logstash,elastic/logstash,Ruby,21,"Logstash - transport and process your logs, events, or other data",3285,12713,https://avatars.githubusercontent.com/u/6764390?v=4
4095287,rubocop,rubocop/rubocop,Ruby,15,"A Ruby static code analyzer and formatter, based on the community Ruby style guide.",2836,11700,https://avatars.githubusercontent.com/u/10871348?v=4
3195124,sidekiq,mperham/sidekiq,Ruby,26,"Simple, efficient background processing for Ruby",2097,11639,https://avatars.githubusercontent.com/u/2911?u=9e18eee0dc7fe4564dba7cdc7e22711a47171a8b&v=4
812393,grape,ruby-grape/grape,Ruby,12,An opinionated framework for creating REST-like APIs in Ruby.,1216,9500,https://avatars.githubusercontent.com/u/13624553?v=4
15435,liquid,Shopify/liquid,Ruby,28,"Liquid markup language. Safe, customer facing template language for flexible web apps. ",1235,9383,https://avatars.githubusercontent.com/u/8085?v=4
108278,chef,chef/chef,Ruby,10,"Chef Infra, a powerful automation platform that transforms infrastructure into code automating how infrastructure is configured, deployed and managed across any environment, at any scale",2565,6831,https://avatars.githubusercontent.com/u/29740?v=4
6768710,redmine,redmine/redmine,Ruby,8,Mirror of redmine code source - Official SVN repository is at https://svn.redmine.org/redmine - contact: @jbbarth or jeanbaptiste.barth (at) gmail (dot) com,2166,4333,https://avatars.githubusercontent.com/u/93662?v=4
950915,WhatWeb,urbanadventurer/WhatWeb,Ruby,18,Next generation web scanner,800,3657,https://avatars.githubusercontent.com/u/101783?u=e3d47c1e85f83e392e6ab5e82219353814948583&v=4
614070,rubygems,rubygems/rubygems,Ruby,10,Library packaging and distribution for Ruby.,1525,2977,https://avatars.githubusercontent.com/u/208761?v=4
1175581,styles,citation-style-language/styles,Ruby,8,Official repository for Citation Style Language (CSL) citation styles.,3228,2539,https://avatars.githubusercontent.com/u/526476?v=4
200302808,view_component,github/view_component,Ruby,22,"A framework for building reusable, testable & encapsulated view components in Ruby on Rails.",285,2322,https://avatars.githubusercontent.com/u/9919?v=4
403641521,jsbundling-rails,rails/jsbundling-rails,Ruby,19,"Bundle and transpile JavaScript in Rails with esbuild, rollup.js, or Webpack.",60,459,https://avatars.githubusercontent.com/u/4223?v=4
48370306,ansible-beats,elastic/ansible-beats,Ruby,0,Ansible Beats Role,84,131,https://avatars.githubusercontent.com/u/6764390?v=4
212272090,price-transparency-guide,CMSgov/price-transparency-guide,Ruby,2,The technical implementation guide for the tri-departmental price transparency rule.,56,126,https://avatars.githubusercontent.com/u/3209407?v=4
375363780,project-template-react-rails-api,learn-co-curriculum/project-template-react-rails-api,Ruby,0,,226,14,https://avatars.githubusercontent.com/u/6208017?v=4
387924838,phase-3-sinatra-react-project,learn-co-curriculum/phase-3-sinatra-react-project,Ruby,0,,427,1,https://avatars.githubusercontent.com/u/6208017?v=4
