id,name,full_name,language,new stars,description,forks_count,stargazers_count,avatar_url
45717250,tensorflow,tensorflow/tensorflow,C++,1026,An Open Source Machine Learning Framework for Everyone,85704,160128,https://avatars.githubusercontent.com/u/15658638?v=4
9384267,electron,electron/electron,C++,1825,":electron: Build cross-platform desktop apps with JavaScript, HTML, and CSS",12838,98590,https://avatars.githubusercontent.com/u/13409222?v=4
100060912,terminal,microsoft/terminal,C++,925,"The new Windows Terminal and the original Windows console host, all in the same place!",6965,78188,https://avatars.githubusercontent.com/u/6154722?v=4
1181927,bitcoin,bitcoin/bitcoin,C++,1028,Bitcoin Core integration/staging tree,30292,58108,https://avatars.githubusercontent.com/u/528860?v=4
5108051,opencv,opencv/opencv,C++,689,Open Source Computer Vision Library,48598,57495,https://avatars.githubusercontent.com/u/5009934?v=4
27729880,grpc,grpc/grpc,C++,324,"The C based gRPC (C++, Python, Ruby, Objective-C, PHP, C#)",8446,32218,https://avatars.githubusercontent.com/u/7802525?v=4
39840932,googletest,google/googletest,C++,270,GoogleTest - Google Testing and Mocking Framework,7923,24039,https://avatars.githubusercontent.com/u/1342004?v=4
60273704,DeepSpeech,mozilla/DeepSpeech,C++,225,"DeepSpeech is an open source embedded (offline, on-device) speech-to-text engine which can run in real time on devices ranging from a Raspberry Pi 4 to high power GPU servers.",3316,18352,https://avatars.githubusercontent.com/u/131524?v=4
116167731,yuzu,yuzu-emu/yuzu,C++,360,Nintendo Switch Emulator,1419,16630,https://avatars.githubusercontent.com/u/35075882?v=4
74660642,taichi,taichi-dev/taichi,C++,495,Parallel programming for everyone.,1689,16103,https://avatars.githubusercontent.com/u/33354891?v=4
125098880,Proton,ValveSoftware/Proton,C++,309,Compatibility tool for Steam Play based on Wine and additional components,636,15262,https://avatars.githubusercontent.com/u/3082775?v=4
98771110,TrafficMonitor,zhongyang219/TrafficMonitor,C++,614,è¿™æ˜¯ä¸€ä¸ªç”¨äºæ˜¾ç¤ºå½“å‰ç½‘é€Ÿã€CPUåŠå†…å­˜åˆ©ç”¨ç‡çš„æ¡Œé¢æ‚¬æµ®çª—è½¯ä»¶ï¼Œå¹¶æ”¯æŒä»»åŠ¡æ æ˜¾ç¤ºï¼Œæ”¯æŒæ›´æ¢çš®è‚¤ã€‚,1628,14099,https://avatars.githubusercontent.com/u/30562462?u=18ad9b9dfa6e784088d28deb7e0dbe830afcc0b7&v=4
40892817,solidity,ethereum/solidity,C++,559,"Solidity, the Smart Contract Programming Language",3185,12582,https://avatars.githubusercontent.com/u/6250754?v=4
136780445,pyxel,kitao/pyxel,C++,211,A retro game engine for Python,578,8693,https://avatars.githubusercontent.com/u/678802?u=9d101a9b90e75057b9b0e08d805169c6f7255fec&v=4
7512484,ardupilot,ArduPilot/ardupilot,C++,297,"ArduPlane, ArduCopter, ArduRover, ArduSub source",11687,6452,https://avatars.githubusercontent.com/u/17919847?v=4
88327406,xmrig,xmrig/xmrig,C++,207,"RandomX, CryptoNight, AstroBWT and Argon2 CPU/GPU miner",2668,5756,https://avatars.githubusercontent.com/u/27528955?u=555699fb82e7598ed7dd1f6e47302042b48a10c3&v=4
3386088,nix,NixOS/nix,C++,142,"Nix, the purely functional package manager",789,4895,https://avatars.githubusercontent.com/u/487568?v=4
143324737,devilutionX,diasurgical/devilutionX,C++,120,Diablo build for modern operating systems,506,4828,https://avatars.githubusercontent.com/u/40645014?v=4
124976393,oatpp,oatpp/oatpp,C++,344,ğŸŒ±Light and powerful C++ web framework for highly scalable and resource-efficient web application. It's zero-dependency and easy-portable.,928,4494,https://avatars.githubusercontent.com/u/37167448?v=4
365005377,btop,aristocratos/btop,C++,2238,A monitor of resources,127,4035,https://avatars.githubusercontent.com/u/59659483?u=9755f4fbe3effd729d24dcda375b2916980a2fdf&v=4
189205663,TinyWebServer,qinguoyi/TinyWebServer,C++,554,:fire: Linuxä¸‹C++è½»é‡çº§WebæœåŠ¡å™¨,1254,4020,https://avatars.githubusercontent.com/u/25760295?u=a4474a249cca515146041e4b6bfaf5f448d9a113&v=4
372536760,oceanbase,oceanbase/oceanbase,C++,511,"OceanBase is an enterprise distributed relational database with high availability, high performance, horizontal scalability, and compatibility with SQL standards.",784,3784,https://avatars.githubusercontent.com/u/82347605?v=4
23322663,fritzing-app,fritzing/fritzing-app,C++,62,Fritzing desktop application,592,2691,https://avatars.githubusercontent.com/u/8562144?v=4
313501668,wenet,wenet-e2e/wenet,C++,141,Production First and Production Ready End-to-End Speech Recognition Toolkit,323,1355,https://avatars.githubusercontent.com/u/84374044?v=4
384306145,cpp_new_features,0voice/cpp_new_features,C++,399,2021å¹´æœ€æ–°æ•´ç†ï¼Œ C++ å­¦ä¹ èµ„æ–™ï¼Œå«C++ 11 / 14 / 17 / 20 / 23 æ–°ç‰¹æ€§ã€å…¥é—¨æ•™ç¨‹ã€æ¨èä¹¦ç±ã€ä¼˜è´¨æ–‡ç« ã€å­¦ä¹ ç¬”è®°ã€æ•™å­¦è§†é¢‘ç­‰,161,911,https://avatars.githubusercontent.com/u/43104160?v=4
