id,name,full_name,language,new stars,description,forks_count,stargazers_count,avatar_url
613075789,dalai,cocktailpeanut/dalai,CSS,22,The simplest way to run LLaMA on your local machine,1336,11615,https://avatars.githubusercontent.com/u/121128867?u=c65ef0f450314df1756279bd01ed7f75336960eb&v=4
7517918,spring-petclinic,spring-projects/spring-petclinic,CSS,7,A sample Spring-based application,19765,6476,https://avatars.githubusercontent.com/u/317776?v=4
102095278,awesome-css-frameworks,troxler/awesome-css-frameworks,CSS,6,List of awesome CSS frameworks in 2023,396,6160,https://avatars.githubusercontent.com/u/2767948?v=4
508131663,awesome-english-ebooks,hehonghui/awesome-english-ebooks,CSS,8,"ç»æµå­¦äºº(å«éŸ³é¢‘)ã€çº½çº¦å®¢ã€å«æŠ¥ã€è¿çº¿ã€å¤§è¥¿æ´‹æœˆåˆŠç­‰è‹±è¯­æ‚å¿—å…è´¹ä¸‹è½½,æ”¯æŒepubã€mobiã€pdfæ ¼å¼, æ¯å‘¨æ›´æ–°",468,5568,https://avatars.githubusercontent.com/u/1683811?u=4fdd12c8f8685ef1ce1b9d798bfbd6f86bd4b397&v=4
141040549,seeker,thewhiteh4t/seeker,CSS,6,Accurately Locate Smartphones using Social Engineering ,1399,4903,https://avatars.githubusercontent.com/u/36354846?u=99d06a9237c301569774dac1c70218d5c032773a&v=4
329751286,youtube,safak/youtube,CSS,3,,4917,4243,https://avatars.githubusercontent.com/u/1486366?u=c367d218a8cf89ad09c3dbfb3c7ad7a929142f20&v=4
204008310,spicetify-themes,spicetify/spicetify-themes,CSS,2,A community-driven collection of themes for customizing Spotify through Spicetify - https://github.com/spicetify/spicetify-cli,1236,4241,https://avatars.githubusercontent.com/u/100136310?v=4
107962707,advanced-css-course,jonasschmedtmann/advanced-css-course,CSS,1,"Starter files, final projects and FAQ for my Advanced CSS course",5020,4095,https://avatars.githubusercontent.com/u/18718850?u=9e3b84d1871a03690c758df5b5e9b967223a6def&v=4
299116052,react-projects,john-smilga/react-projects,CSS,1,,3557,3754,https://avatars.githubusercontent.com/u/42133389?u=9d63b6d71fba139347cddf2c840a858c8ff97168&v=4
119437761,SocialFish,UndeadSec/SocialFish,CSS,2,Phishing Tool & Information Collector ,1187,3453,https://avatars.githubusercontent.com/u/29824686?v=4
222361926,javascript-basic-projects,john-smilga/javascript-basic-projects,CSS,2,,3465,3150,https://avatars.githubusercontent.com/u/42133389?u=9d63b6d71fba139347cddf2c840a858c8ff97168&v=4
420352316,project_modern_ui_ux_gpt3,adrianhajdin/project_modern_ui_ux_gpt3,CSS,3,Master the creation of Modern UX/UI Websites,762,2925,https://avatars.githubusercontent.com/u/24898559?u=fd2baba143bcb62cc0f2bc646ec33c2ba9ef013e&v=4
624516901,gpt4all-ui,nomic-ai/gpt4all-ui,CSS,12,gpt4all chatbot ui,271,2011,https://avatars.githubusercontent.com/u/102670180?v=4
292673424,cloudflare-docs,cloudflare/cloudflare-docs,CSS,2,Cloudflareâ€™s documentation,2245,1884,https://avatars.githubusercontent.com/u/314135?v=4
366437783,responsive-portfolio-website-Alexa,bedimcode/responsive-portfolio-website-Alexa,CSS,4,"Responsive Portfolio Website Using HTML, CSS & JavaScript",1240,1486,https://avatars.githubusercontent.com/u/61248995?u=ce8e7f12481e60e88d2480d1215211558ca4b137&v=4
83736661,nomicon,rust-lang/nomicon,CSS,2,The Dark Arts of Advanced and Unsafe Rust Programming,226,1380,https://avatars.githubusercontent.com/u/5430905?v=4
133927297,sakai-react,primefaces/sakai-react,CSS,1,Free React Admin Template ,329,547,https://avatars.githubusercontent.com/u/3494069?v=4
575089397,react-course-v3,john-smilga/react-course-v3,CSS,2,,337,532,https://avatars.githubusercontent.com/u/42133389?u=9d63b6d71fba139347cddf2c840a858c8ff97168&v=4
599517308,gxmods,opera-gaming/gxmods,CSS,1,Documentation for GX mods,1373,492,https://avatars.githubusercontent.com/u/85216833?v=4
616351992,Next.js-Developer-Portfolio-Starter-Code,codebucks27/Next.js-Developer-Portfolio-Starter-Code,CSS,2,"â­Build a stunning portfolio website with Next.js, Tailwind CSS and Framer-motion. If you want to learn to create this you can follow the tutorial link given in the Read me file.",116,188,https://avatars.githubusercontent.com/u/70878044?u=2440c945ab064a31db243cd34cb7b6037fc0bc68&v=4
362178572,zelk,schnensch0/zelk,CSS,0,discord theme inspired by zorin,336,184,https://avatars.githubusercontent.com/u/58988092?u=6351e3d1a7436074488f29caafa12540a49e2e7e&v=4
635718606,ChatGPTAuthHelper,pengzhile/ChatGPTAuthHelper,CSS,11,A simple Chrome extension to help you login ChatGPT.,16,104,https://avatars.githubusercontent.com/u/343491?u=b86e91803d6ebd424b473648ae7b8e738a88d271&v=4
637282984,GameZone,kunjgit/GameZone,CSS,24,This open source repository contains collection of games build on basic tech stacks in web development  . Use your creativity and build your own game and contribute to the repository by making PR ğŸ®,81,66,https://avatars.githubusercontent.com/u/103763618?u=013b8514dc48866a66469e097e74e85586993c31&v=4
637463959,blogzen,DSC-JSS-NOIDA/blogzen,CSS,18,"A collection of resources categorised by tech domains, languages, expertise and much more. Blogzen gives you a quick access to all the resources that you could need at a single place, with a click!",92,43,https://avatars.githubusercontent.com/u/12371578?v=4
642118032,chatgpt-clone-youtube,CodeWithHarry/chatgpt-clone-youtube,CSS,5,CodeWithHarry YouTube video code for ChatGPT Clone,6,29,https://avatars.githubusercontent.com/u/48705673?u=472aded90489332ecedb819278fc2cfbe485e4da&v=4
