id,name,full_name,language,new stars,description,forks_count,stargazers_count,avatar_url
106017343,tailwindcss,tailwindlabs/tailwindcss,HTML,70,A utility-first CSS framework for rapid UI development.,3856,76853,https://avatars.githubusercontent.com/u/67109815?v=4
35658863,gentelella,ColorlibHQ/gentelella,HTML,2,Free Bootstrap 4 Admin Dashboard Template,6862,20934,https://avatars.githubusercontent.com/u/39128121?v=4
61204818,opensource.guide,github/opensource.guide,HTML,6,ğŸ“š Community guides for open source creators,14137,13465,https://avatars.githubusercontent.com/u/9919?v=4
246128823,html-css,gustavoguanabara/html-css,HTML,6,Curso de HTML5 e CSS3,2972,12310,https://avatars.githubusercontent.com/u/8683378?u=01b06a154f04dadaa4e4131497fa2442e6323cbc&v=4
124365799,Modern-CPP-Programming,federico-busato/Modern-CPP-Programming,HTML,10,Modern C++ Programming Course (C++11/14/17/20/23),670,10457,https://avatars.githubusercontent.com/u/55920584?u=fcdb76add5bc8ad6ecd816cbe854bb8b251bfa76&v=4
182849188,delta,delta-io/delta,HTML,2,"An open-source storage framework that enables building a Lakehouse architecture with compute engines including Spark, PrestoDB, Flink, Trino, and Hive and APIs",1533,6743,https://avatars.githubusercontent.com/u/49767398?v=4
53416555,learning-area,mdn/learning-area,HTML,3,GitHub repo for the MDN Learning Area. ,26427,6633,https://avatars.githubusercontent.com/u/7565578?v=4
161886347,system_architect,xxlllq/system_architect,HTML,13,:100:2024å¹´ç³»ç»Ÿæ¶æ„è®¾è®¡å¸ˆï¼ˆè½¯è€ƒé«˜çº§ï¼‰å¤‡è€ƒèµ„æ–™ã€‚,1625,5444,https://avatars.githubusercontent.com/u/24718510?u=f55e6404863cab712f2ef247836b9823fb78f51b&v=4
541798154,unstructured,Unstructured-IO/unstructured,HTML,13,"Open source libraries and APIs to build custom preprocessing pipelines for labeling, training, or production machine learning pipelines. ",368,5142,https://avatars.githubusercontent.com/u/108372208?v=4
51478266,website,kubernetes/website,HTML,2,Kubernetes website and documentation repo: ,13620,4221,https://avatars.githubusercontent.com/u/13629408?v=4
696990839,Sigma-Web-Dev-Course,CodeWithHarry/Sigma-Web-Dev-Course,HTML,23,Source Code for Sigma Web Development Course,1115,3771,https://avatars.githubusercontent.com/u/48705673?u=472aded90489332ecedb819278fc2cfbe485e4da&v=4
561281862,ui,atherosai/ui,HTML,207,Simple UI examples from my social media,699,3451,https://avatars.githubusercontent.com/u/34418705?v=4
118475451,pdf2htmlEX,pdf2htmlEX/pdf2htmlEX,HTML,4,Convert PDF to HTML without losing text or format.,325,3271,https://avatars.githubusercontent.com/u/35697010?v=4
101663032,MeshCentral,Ylianst/MeshCentral,HTML,5,A complete web-based remote monitoring and management web site. Once setup you can install agents and perform remote desktop session to devices on the local network or over the Internet.,469,3194,https://avatars.githubusercontent.com/u/1319013?u=5c5d44cf74695ad411aaf650b565ebb546bec9f8&v=4
167393144,Markdown-Resume,CyC2018/Markdown-Resume,HTML,3,â­ï¸ Markdown ç®€å†æ¨¡ç‰ˆ,1481,2791,https://avatars.githubusercontent.com/u/36260787?u=70a8c2cbcaeb2f7dbcf84c1c40eea8c87a6d9bc3&v=4
699806845,python-web,mouredev/python-web,HTML,14,Curso para aprender desarrollo frontend Web con Python puro desde cero. Elaborado durante las emisiones en directo desde Twitch de MoureDev.,133,2483,https://avatars.githubusercontent.com/u/17043402?u=0fe848503eee627223a1e8af9ff3f08a657e18f4&v=4
10009991,rdkit,rdkit/rdkit,HTML,0,The official sources for the RDKit library,826,2366,https://avatars.githubusercontent.com/u/2018047?v=4
212840200,snakemake,snakemake/snakemake,HTML,3,"This is the development home of the workflow management system Snakemake. For general information, see",500,2066,https://avatars.githubusercontent.com/u/33450111?v=4
723216740,welcome-to-darknet,tarpetra/welcome-to-darknet,HTML,0,A verified list of darknet markets and services with links for educational reference.,11,1481,https://avatars.githubusercontent.com/u/147477991?u=5b31ab2ba5a523b291cd0518cf97309a4b46e574&v=4
521541394,system_architect,xiaomabenten/system_architect,HTML,9,ğŸ’¯2024å¹´ ç³»ç»Ÿæ¶æ„è®¾è®¡å¸ˆï¼ˆè½¯è€ƒé«˜çº§ï¼‰å¤‡è€ƒèµ„æºåº“+é…å¥—å…è´¹åˆ·é¢˜è½¯ä»¶ã€‚PCç‰ˆå…è´¹åˆ·é¢˜è½¯ä»¶ï¼šhttps://ruankaodaren.com,396,907,https://avatars.githubusercontent.com/u/38070593?u=97b21e5356957909952649eefa180777907b30e4&v=4
522137484,AWS-Certified-Cloud-Practitioner-Notes,kananinirav/AWS-Certified-Cloud-Practitioner-Notes,HTML,6,AWS Certified Cloud Practitioner Short Notes And Practice Exams (CLF-C02),217,664,https://avatars.githubusercontent.com/u/30398499?u=76e047714eb73c42c87ae90db62af35b28f164b4&v=4
671759522,Gmeek,Meekdai/Gmeek,HTML,5,Gmeek is a Blog All in Github,53,496,https://avatars.githubusercontent.com/u/11755104?v=4
407316719,BadUI,GoulartNogueira/BadUI,HTML,6,Inspired by r/badUIbattles (a joke subreddit for intentionally bad UI designs). This repository aggregates all best (or worst?) bad-UI designs.,23,463,https://avatars.githubusercontent.com/u/7660643?u=d0b905269b282aa70d99051c59af937fa89b7c00&v=4
133398807,python-sample-vscode-flask-tutorial,microsoft/python-sample-vscode-flask-tutorial,HTML,0,Sample code for the Flask tutorial in the VS Code documentation,4483,321,https://avatars.githubusercontent.com/u/6154722?v=4
615487505,Eaglercraft1.5.2,vidio-boy/Eaglercraft1.5.2,HTML,1,"Eaglercraft javascript runtime. Multiplayer, singleplayer, and LAN worlds available. Customizable profile, skins, capes, and controls. Game modes including creative, survival, peaceful, and more! Villages, mine shafts, dungeons, caves, ravines, many different biomes, and other things can spawn. The Nether and End are also available.",130,19,https://avatars.githubusercontent.com/u/123599065?u=ff840e474702d5778daf429bcd7b18b24ec3e930&v=4
