id,name,full_name,language,new stars,description,forks_count,stargazers_count,avatar_url
21540759,awesome-go,avelino/awesome-go,Go,415,"A curated list of awesome Go frameworks, libraries and software",11537,113929,https://avatars.githubusercontent.com/u/31996?u=7cf01e307d8cb792e10be3cc1af1a0754e941017&v=4
48378947,frp,fatedier/frp,Go,242,A fast reverse proxy to help you expose a local server behind a NAT or firewall to the internet.,12369,75320,https://avatars.githubusercontent.com/u/7346661?u=721c6ac19c725486a09c728572e7aee0460e42c0&v=4
20904437,gin,gin-gonic/gin,Go,157,"Gin is a HTTP web framework written in Go (Golang). It features a Martini-like API with much better performance -- up to 40 times faster. If you need smashing performance, get yourself some Gin.",7808,73298,https://avatars.githubusercontent.com/u/7894478?v=4
14712850,syncthing,syncthing/syncthing,Go,174,Open Source Continuous File Synchronization,4024,57102,https://avatars.githubusercontent.com/u/7628018?v=4
15452919,go-ethereum,ethereum/go-ethereum,Go,92,Official Go implementation of the Ethereum protocol,19505,44366,https://avatars.githubusercontent.com/u/6250754?v=4
24268127,nvm-windows,coreybutler/nvm-windows,Go,146,A node.js version management utility for Windows. Ironically written in Go.,3145,32386,https://avatars.githubusercontent.com/u/770982?u=81e8d113dd0628720745aa8869123f9f28c955eb&v=4
658928958,ollama,jmorganca/ollama,Go,1682,Get up and running with Llama 2 and other large language models locally,1865,28598,https://avatars.githubusercontent.com/u/251292?u=a7465aae734d2cbc12d26b885b07d466d969bf0c&v=4
120227732,fyne,fyne-io/fyne,Go,85,Cross platform GUI toolkit in Go inspired by Material Design,1311,22147,https://avatars.githubusercontent.com/u/36045855?v=4
436297812,memos,usememos/memos,Go,341,"An open source, lightweight note-taking service. Easily capture and share your great thoughts.",1563,21615,https://avatars.githubusercontent.com/u/95764151?v=4
410430370,CasaOS,IceWhaleTech/CasaOS,Go,205,"CasaOS - A simple, easy-to-use, elegant open-source Personal Cloud system.",1042,19090,https://avatars.githubusercontent.com/u/91336243?v=4
252813491,nuclei,projectdiscovery/nuclei,Go,104,Fast and customizable vulnerability scanner based on simple YAML based DSL.,2139,15868,https://avatars.githubusercontent.com/u/50994705?v=4
116576783,bettercap,bettercap/bettercap,Go,73,"The Swiss Army knife for 802.11, BLE, IPv4 and IPv6 networks reconnaissance and MITM attacks.",1406,15066,https://avatars.githubusercontent.com/u/16231217?v=4
77071454,goreleaser,goreleaser/goreleaser,Go,32,Deliver Go binaries as fast and easily as possible,926,12422,https://avatars.githubusercontent.com/u/24697112?v=4
154643390,phoneinfoga,sundowndev/phoneinfoga,Go,165,Information gathering framework for phone numbers,3199,11316,https://avatars.githubusercontent.com/u/16480203?u=736dd20996f73fe51ad2ee2c8dc058d9e89c7a69&v=4
150954997,VictoriaMetrics,VictoriaMetrics/VictoriaMetrics,Go,66,"VictoriaMetrics: fast, cost-effective monitoring solution and time series database",1027,10027,https://avatars.githubusercontent.com/u/43720803?v=4
244694886,nightingale,ccfos/nightingale,Go,73,"An all-in-one observability solution which aims to combine the advantages of Prometheus and Grafana. It manages alert rules and visualizes metrics, logs, traces in a beautiful web UI.",1264,8195,https://avatars.githubusercontent.com/u/96813578?v=4
631254164,one-api,songquanpeng/one-api,Go,403,"OpenAI 接口管理 & 分发系统，支持 Azure、Anthropic Claude、Google PaLM 2 & Gemini、智谱 ChatGLM、百度文心一言、讯飞星火认知、阿里通义千问、360 智脑以及腾讯混元，可用于二次分发管理 key，仅单可执行文件，已打包好 Docker 镜像，一键部署，开箱即用. OpenAI key management & redistribution system, using a single API for all LLMs, and features an English UI.",1978,7734,https://avatars.githubusercontent.com/u/39998050?v=4
357897199,netbird,netbirdio/netbird,Go,65,Connect your devices into a single secure private WireGuard®-based mesh network with SSO/MFA and simple access controls.,294,7283,https://avatars.githubusercontent.com/u/100464677?v=4
267713284,httpx,projectdiscovery/httpx,Go,35,httpx is a fast and multi-purpose HTTP toolkit that allows running multiple probes using the retryablehttp library.,748,6272,https://avatars.githubusercontent.com/u/50994705?v=4
505278571,scan4all,GhostTroops/scan4all,Go,105,"Official repository  vuls Scan: 15000+PoCs; 23 kinds of application password crack; 7000+Web fingerprints; 146 protocols and 90000+ rules Port scanning; Fuzz, HW, awesome BugBounty( ͡° ͜ʖ ͡°)...",576,4707,https://avatars.githubusercontent.com/u/151980876?v=4
552635490,DeepLX,OwO-Network/DeepLX,Go,233,DeepL Free API (No TOKEN required),296,3598,https://avatars.githubusercontent.com/u/82772671?v=4
432717637,lancet,duke-git/lancet,Go,84,"A comprehensive, efficient, and reusable util function library of Go.",363,3311,https://avatars.githubusercontent.com/u/5037603?u=3f6c46718a716f0145b17534555c83c40ada42c8&v=4
242879301,gau,lc/gau,Go,41,"Fetch known URLs from AlienVault's Open Threat Exchange, the Wayback Machine, and Common Crawl.",397,3290,https://avatars.githubusercontent.com/u/19563282?u=ebe4a3b3b7f766eb33b7e854b729e61663a50a5d&v=4
712363932,ssh3,francoismichel/ssh3,Go,327,"SSH3: faster and rich secure shell using HTTP/3, checkout our article here: https://arxiv.org/abs/2312.08396",38,1959,https://avatars.githubusercontent.com/u/11063668?u=57b3d9194168ed0cea448c25165a88a0c7e6e64f&v=4
730764361,Terrapin-Scanner,RUB-NDS/Terrapin-Scanner,Go,206,"This repository contains a simple vulnerability scanner for the Terrapin attack present in the paper ""Terrapin Attack: Breaking SSH Channel Integrity By Sequence Number Manipulation"".",22,373,https://avatars.githubusercontent.com/u/11559003?v=4
