id,name,full_name,language,new stars,description,forks_count,stargazers_count,avatar_url
32484381,free-for-dev,ripienaar/free-for-dev,HTML,69,"A list of SaaS, PaaS and IaaS offerings that have free tiers of interest to devops and infradev",7733,70908,https://avatars.githubusercontent.com/u/82342?v=4
106017343,tailwindcss,tailwindlabs/tailwindcss,HTML,37,A utility-first CSS framework for rapid UI development.,3590,69778,https://avatars.githubusercontent.com/u/67109815?v=4
243950408,HowToCook,Anduin2017/HowToCook,HTML,19,ç¨‹åºå‘˜åœ¨å®¶åšé¥­æ–¹æ³•æŒ‡å—ã€‚Programmer's guide about how to cook at home (Chinese only).,7758,54221,https://avatars.githubusercontent.com/u/19531547?u=9bfa4b5f7256f64a05b280019f26a56319955cd0&v=4
419347358,cs-self-learning,PKUFlyingPig/cs-self-learning,HTML,31,è®¡ç®—æœºè‡ªå­¦æŒ‡å—,4137,30724,https://avatars.githubusercontent.com/u/60659728?u=6d9732dc87e3cf8d6952b25499519c2c3f289680&v=4
109484365,Coursera-ML-AndrewNg-Notes,fengdu78/Coursera-ML-AndrewNg-Notes,HTML,7,å´æ©è¾¾è€å¸ˆçš„æœºå™¨å­¦ä¹ è¯¾ç¨‹ä¸ªäººç¬”è®°,10183,28059,https://avatars.githubusercontent.com/u/26119052?u=64357994632ab7e6be27e8a6549727e5bee3c077&v=4
46342224,skill-map,TeamStuQ/skill-map,HTML,1,ç¨‹åºå‘˜æŠ€èƒ½å›¾è°±,4353,19382,https://avatars.githubusercontent.com/u/15888474?v=4
157813180,ai-edu,microsoft/ai-edu,HTML,8,"AI education materials for Chinese students, teachers and IT professionals.",2778,12265,https://avatars.githubusercontent.com/u/6154722?v=4
1300192,Spoon-Knife,octocat/Spoon-Knife,HTML,3,This repo is for demonstration purposes only.,136575,11751,https://avatars.githubusercontent.com/u/583231?u=a59fef2a493e2b67dd13754231daf220c82ba84d&v=4
246128823,html-css,gustavoguanabara/html-css,HTML,14,Curso de HTML5 e CSS3,2750,10519,https://avatars.githubusercontent.com/u/8683378?u=01b06a154f04dadaa4e4131497fa2442e6323cbc&v=4
55082941,awesome-modern-cpp,rigtorp/awesome-modern-cpp,HTML,7,A collection of resources on modern C++,1050,10416,https://avatars.githubusercontent.com/u/178027?u=b2bed6d2c1d0c9361683e75c37b8e9b18f265764&v=4
281297416,hugo-PaperMod,adityatelange/hugo-PaperMod,HTML,16," A fast, clean, responsive Hugo theme.",1968,6554,https://avatars.githubusercontent.com/u/21258296?u=034e168d85cef8bf4db320794f45bfb6d35ea340&v=4
182849188,delta,delta-io/delta,HTML,5,"An open-source storage framework that enables building a Lakehouse architecture with compute engines including Spark, PrestoDB, Flink, Trino, and Hive and APIs",1363,6106,https://avatars.githubusercontent.com/u/49767398?v=4
178024949,technical-books,doocs/technical-books,HTML,2,ğŸ˜† å›½å†…å¤–äº’è”ç½‘æŠ€æœ¯å¤§ç‰›ä»¬éƒ½å†™äº†å“ªäº›ä¹¦ç±ï¼šè®¡ç®—æœºåŸºç¡€ã€ç½‘ç»œã€å‰ç«¯ã€åç«¯ã€æ•°æ®åº“ã€æ¶æ„ã€å¤§æ•°æ®ã€æ·±åº¦å­¦ä¹ ...,935,5183,https://avatars.githubusercontent.com/u/43716716?v=4
154027884,awesome-prometheus-alerts,samber/awesome-prometheus-alerts,HTML,5,ğŸš¨ Collection of Prometheus alerting rules,842,5146,https://avatars.githubusercontent.com/u/2951285?u=571c795227b4edbd29f027478346834f83a95076&v=4
215689781,RuoYi,yangzongzhuan/RuoYi,HTML,13,:tada: (RuoYi)å®˜æ–¹ä»“åº“ åŸºäºSpringBootçš„æƒé™ç®¡ç†ç³»ç»Ÿ æ˜“è¯»æ˜“æ‡‚ã€ç•Œé¢ç®€æ´ç¾è§‚ã€‚ æ ¸å¿ƒæŠ€æœ¯é‡‡ç”¨Springã€MyBatisã€Shiroæ²¡æœ‰ä»»ä½•å…¶å®ƒé‡åº¦ä¾èµ–ã€‚ç›´æ¥è¿è¡Œå³å¯ç”¨,1376,4211,https://avatars.githubusercontent.com/u/19240310?u=2790505072242292c171c88b18244d00fe9db0f0&v=4
114898943,seldon-core,SeldonIO/seldon-core,HTML,0,"An MLOps framework to package, deploy, monitor and manage thousands of production machine learning models",761,3791,https://avatars.githubusercontent.com/u/10297834?v=4
375081980,osint_stuff_tool_collection,cipher387/osint_stuff_tool_collection,HTML,5,A collection of several hundred online tools for OSINT,402,3516,https://avatars.githubusercontent.com/u/66636466?u=60d5ac99d112126df2c2d3cee4b6991a9713372f&v=4
624236959,GPT-4-LLM,Instruction-Tuning-with-GPT-4/GPT-4-LLM,HTML,11,Instruction Tuning with GPT-4,219,2956,https://avatars.githubusercontent.com/u/129997345?v=4
25990824,ASVS,OWASP/ASVS,HTML,2,Application Security Verification Standard,569,2214,https://avatars.githubusercontent.com/u/155815?v=4
78868967,iOS,duckduckgo/iOS,HTML,2,DuckDuckGo iOS Application,369,1579,https://avatars.githubusercontent.com/u/342708?v=4
456370943,html-css-course-2022,SuperSimpleDev/html-css-course-2022,HTML,1,,790,806,https://avatars.githubusercontent.com/u/70604577?u=fa6af8f7a3d53e5603418a5962152345d3541bf7&v=4
442279104,HTML-CSS-JavaScript-projects-for-beginners,sahandghavidel/HTML-CSS-JavaScript-projects-for-beginners,HTML,6,"This course, ""60 HTML CSS JavaScript Projects,"" was created to share my knowledge and experience with you. In this course, you'll learn how to build simple, responsive websites using HTML, CSS, and JavaScript.",291,577,https://avatars.githubusercontent.com/u/71052435?u=1e11ed8e252953b31429b22d4a66eef7cda21485&v=4
275903211,parcel-project-template,goitacademy/parcel-project-template,HTML,0,,1601,373,https://avatars.githubusercontent.com/u/46345815?v=4
611694749,coding-competitions-archive,google/coding-competitions-archive,HTML,2,Google Coding Competitions problem archive,54,232,https://avatars.githubusercontent.com/u/1342004?v=4
641487831,www-project-top-10-for-large-language-model-applications,OWASP/www-project-top-10-for-large-language-model-applications,HTML,2,OWASP Foundation Web Respository,34,124,https://avatars.githubusercontent.com/u/155815?v=4
