id,name,full_name,language,new stars,description,forks_count,stargazers_count,avatar_url
1863329,laravel,laravel/laravel,PHP,115,"Laravel is a web application framework with expressive, elegant syntax. We’ve already laid the foundation for your next big idea — freeing you to create without sweating the small things.",24266,75860,https://avatars.githubusercontent.com/u/958072?v=4
7548986,framework,laravel/framework,PHP,62,The Laravel Framework.,10553,30898,https://avatars.githubusercontent.com/u/958072?v=4
458058,symfony,symfony/symfony,PHP,38,The Symfony PHP framework,9453,29027,https://avatars.githubusercontent.com/u/143937?v=4
1864363,composer,composer/composer,PHP,29,Dependency Manager for PHP,6850,28062,https://avatars.githubusercontent.com/u/837015?v=4
2579314,Faker,fzaninotto/Faker,PHP,15,Faker is a PHP library that generates fake data for you,3619,26783,https://avatars.githubusercontent.com/u/99944?u=24e77d6928aa3af0d7cb71cf5097fcdb9ed23c53&v=4
60243197,server,nextcloud/server,PHP,129,"☁️ Nextcloud server, a safe home for all your data",3848,24900,https://avatars.githubusercontent.com/u/19211038?v=4
1420053,guzzle,guzzle/guzzle,PHP,18,"Guzzle, an extensible PHP HTTP client",2462,22874,https://avatars.githubusercontent.com/u/638632?v=4
170355508,livewire,livewire/livewire,PHP,54,A full-stack framework for Laravel that takes the pain out of building dynamic UIs.,1403,21376,https://avatars.githubusercontent.com/u/51960834?v=4
1376664,monolog,Seldaek/monolog,PHP,16,"Sends your logs to files, sockets, inboxes, databases and various web services",1900,20685,https://avatars.githubusercontent.com/u/183678?v=4
2889328,WordPress,WordPress/WordPress,PHP,32,"WordPress, Git-ified. This repository is just a mirror of the WordPress subversion repository. Please do not send pull requests. Submit pull requests to https://github.com/WordPress/wordpress-develop and patches to https://core.trac.wordpress.org/ instead.",12588,18438,https://avatars.githubusercontent.com/u/276006?v=4
5724990,Carbon,briannesbitt/Carbon,PHP,14,A simple PHP API extension for DateTime.,1311,16316,https://avatars.githubusercontent.com/u/170745?v=4
41589337,BookStack,BookStackApp/BookStack,PHP,95,A platform to create documentation/wiki content built with PHP & Laravel,1715,13257,https://avatars.githubusercontent.com/u/20912696?v=4
61490598,PhpSpreadsheet,PHPOffice/PhpSpreadsheet,PHP,15,A pure PHP library for reading and writing spreadsheet files,3342,12770,https://avatars.githubusercontent.com/u/1836015?v=4
1305114,sage,roots/sage,PHP,23,"WordPress starter theme with Laravel Blade components and templates, Tailwind CSS, and a modern development workflow",3025,12431,https://avatars.githubusercontent.com/u/4986074?v=4
248372441,filament,filamentphp/filament,PHP,192,"A collection of beautiful full-stack components for Laravel. The perfect starting point for your next app. Using Livewire, Alpine.js and Tailwind CSS.",2001,12314,https://avatars.githubusercontent.com/u/64450473?v=4
2884111,magento2,magento/magento2,PHP,14,"Prior to making any Submission(s), you must sign an Adobe Contributor License Agreement, available here at: https://opensource.adobe.com/cla.html. All Submissions you make to Adobe Inc. and its affiliates, assigns and subsidiaries (collectively “Adobe”) are subject to the terms of the Adobe Contributor License Agreement.",9326,11104,https://avatars.githubusercontent.com/u/168457?v=4
14346979,snipe-it,snipe/snipe-it,PHP,45,A free open source IT asset/license management system,2851,9113,https://avatars.githubusercontent.com/u/197404?u=3a3faa7eb52d0ccb5d757cab2633677328bbffb2&v=4
656494,cakephp,cakephp/cakephp,PHP,5,CakePHP: The Rapid Development Framework for PHP - Official Repository,3525,8685,https://avatars.githubusercontent.com/u/23666?v=4
246674913,pest,pestphp/pest,PHP,51,"Pest is an elegant PHP testing Framework with a focus on simplicity, meticulously designed to bring back the joy of testing in PHP.",273,8446,https://avatars.githubusercontent.com/u/62078253?v=4
97311017,rector,rectorphp/rector,PHP,43,Instant Upgrades and Automated Refactoring of any PHP 5.3+ code,665,7894,https://avatars.githubusercontent.com/u/32097581?v=4
6763587,PrestaShop,PrestaShop/PrestaShop,PHP,11,PrestaShop is the universal open-source software platform to build your e-commerce solution.,4735,7629,https://avatars.githubusercontent.com/u/2815696?v=4
47508644,panel,pterodactyl/panel,PHP,37,"Pterodactyl® is a free, open-source game server management panel built with PHP, React, and Go. Designed with security in mind, Pterodactyl runs all game servers in isolated Docker containers while exposing a beautiful and intuitive UI to end users.",1456,5707,https://avatars.githubusercontent.com/u/16179146?v=4
439861,moodle,moodle/moodle,PHP,20,Moodle - the world's open source learning platform,6293,5212,https://avatars.githubusercontent.com/u/168672?v=4
41463886,CodeIgniter4,codeigniter4/CodeIgniter4,PHP,15,Open Source PHP Framework (originally from EllisLab),1887,5009,https://avatars.githubusercontent.com/u/44521256?v=4
138328462,freescout,freescout-helpdesk/freescout,PHP,21,FreeScout — Free self-hosted help desk & shared mailbox (Zendesk / Help Scout alternative),432,2466,https://avatars.githubusercontent.com/u/40499291?u=3f204a1fd4a18b2a3e8c5ce40e58b4b2c82a93ec&v=4
