id,name,full_name,language,new stars,description,forks_count,stargazers_count,avatar_url
54346799,public-apis,public-apis/public-apis,Python,1487,A collective list of free APIs,31190,277787,https://avatars.githubusercontent.com/u/51121562?v=4
212639071,devops-exercises,bregman-arie/devops-exercises,Python,722,"Linux, Jenkins, AWS, SRE, Prometheus, Docker, Python, Ansible, Git, Kubernetes, Terraform, OpenStack, SQL, NoSQL, Azure, GCP, DNS, Elastic, Network, Virtualization. DevOps Interview Questions",13281,61316,https://avatars.githubusercontent.com/u/10349437?u=bb7c3c533587d7cb2e3dd336e0f8a0d40544e5f5&v=4
81598961,cpython,python/cpython,Python,178,The Python programming language,28805,58120,https://avatars.githubusercontent.com/u/1525981?v=4
125266328,black,psf/black,Python,187,The uncompromising Python code formatter,2376,36069,https://avatars.githubusercontent.com/u/50630501?v=4
349321229,GFPGAN,TencentARC/GFPGAN,Python,308,GFPGAN aims at developing Practical Algorithms for Real-world Face Restoration.,5645,33826,https://avatars.githubusercontent.com/u/83739826?v=4
626805178,dify,langgenius/dify,Python,643,"An Open-Source Assistants API and GPTs alternative. Dify.AI is an LLM application development platform. It integrates the concepts of Backend as a Service and LLMOps, covering the core tech stack required for building generative AI-native applications, including a built-in RAG engine.",1971,14715,https://avatars.githubusercontent.com/u/127165244?v=4
164471183,py12306,pjialin/py12306,Python,571,🚂 12306 购票助手，支持集群，多账号，多任务购票以及 Web 页面管理 ,3367,13263,https://avatars.githubusercontent.com/u/12911871?u=f7c86dc0d3e8c7fcdcb4cd44a42b3054b02dd246&v=4
682604510,codellama,facebookresearch/codellama,Python,595,Inference code for CodeLlama models,1303,12741,https://avatars.githubusercontent.com/u/16943930?v=4
175129788,pyright,microsoft/pyright,Python,56,Static Type Checker for Python,1281,11545,https://avatars.githubusercontent.com/u/6154722?v=4
743230067,GPT-SoVITS,RVC-Boss/GPT-SoVITS,Python,2975,1 min voice data can also be used to train a good TTS model! (few shot voice cloning),812,7906,https://avatars.githubusercontent.com/u/129054828?v=4
498449014,nerfstudio,nerfstudio-project/nerfstudio,Python,118,A collaboration friendly studio for NeRFs,1002,7883,https://avatars.githubusercontent.com/u/106621677?v=4
292374787,ml-engineering,stas00/ml-engineering,Python,998,Machine Learning Engineering Open Book,425,7427,https://avatars.githubusercontent.com/u/10676103?u=8dabbce5199b04f649e1c7cced4c59a2ae173261&v=4
712111618,marker,VikParuchuri/marker,Python,528,Convert PDF to markdown quickly with high accuracy,224,6379,https://avatars.githubusercontent.com/u/913340?v=4
713967573,Yi,01-ai/Yi,Python,400,A series of large language models trained from scratch by developers @01-ai,366,5959,https://avatars.githubusercontent.com/u/139308978?v=4
725839295,mamba,state-spaces/mamba,Python,534,,504,5833,https://avatars.githubusercontent.com/u/146159090?v=4
587050620,dspy,stanfordnlp/dspy,Python,464,DSPy: The framework for programming—not prompting—foundation models,343,5519,https://avatars.githubusercontent.com/u/3046006?v=4
730223430,InstantID,InstantID/InstantID,Python,1885,InstantID : Zero-shot Identity-Preserving Generation in Seconds 🔥,248,4527,https://avatars.githubusercontent.com/u/153270516?v=4
746430967,Depth-Anything,LiheYoung/Depth-Anything,Python,2172,Depth Anything: Unleashing the Power of Large-Scale Unlabeled Data. Foundation Model for Monocular Depth Estimation,224,3844,https://avatars.githubusercontent.com/u/47178369?u=628f3158a8ad8030ed19569902e4681771becb3e&v=4
725266899,Mastering-GitHub-Copilot-for-Paired-Programming,microsoft/Mastering-GitHub-Copilot-for-Paired-Programming,Python,158,A 6 Lesson course teaching everything you need to know about harnessing GitHub Copilot and an AI Paired Programing resource.,404,3778,https://avatars.githubusercontent.com/u/6154722?v=4
738356406,QAnything,netease-youdao/QAnything,Python,789,Question and Answer based on Anything.,292,3583,https://avatars.githubusercontent.com/u/3909232?u=7ce4aa36eb20b8f2076d25a98aead8932d76ef36&v=4
737043169,RAGatouille,bclavie/RAGatouille,Python,528,,85,1336,https://avatars.githubusercontent.com/u/16307635?u=1fc0016582af916cdbd8d9e2799c7d8fcd2bb18f&v=4
745311984,self-rewarding-lm-pytorch,lucidrains/self-rewarding-lm-pytorch,Python,384,"Implementation of the training framework proposed in Self-Rewarding Language Model, from MetaAI",47,1020,https://avatars.githubusercontent.com/u/108653?u=6eee6a799e960ea4687f9a6b99c6466bb7a1105c&v=4
676672661,langgraph,langchain-ai/langgraph,Python,327,,76,908,https://avatars.githubusercontent.com/u/126733545?v=4
746238830,palworld-host-save-fix,xNul/palworld-host-save-fix,Python,493,Fixes the bug which forces a player to create a new character when they already have a save. Useful for migrating maps from co-op to dedicated servers and from one dedicated server to another.,38,684,https://avatars.githubusercontent.com/u/894305?u=44e00f0d99832ffa30b79463c910cd623d7369a5&v=4
707237272,GenerativeAIExamples,NVIDIA/GenerativeAIExamples,Python,211,Generative AI reference workflows optimized for accelerated infrastructure and microservice architecture.,99,671,https://avatars.githubusercontent.com/u/1728152?v=4
