id,name,full_name,language,new stars,description,forks_count,stargazers_count,avatar_url
7548986,framework,laravel/framework,PHP,141,The Laravel Framework.,8939,26323,https://avatars.githubusercontent.com/u/958072?v=4
1376664,monolog,Seldaek/monolog,PHP,21,"Sends your logs to files, sockets, inboxes, databases and various web services",1792,19483,https://avatars.githubusercontent.com/u/183678?u=5c0668a9af3d21ce3153666e4546d881216346bf&v=4
60243197,server,nextcloud/server,PHP,144,"☁️ Nextcloud server, a safe home for all your data",2949,18417,https://avatars.githubusercontent.com/u/19211038?v=4
448045,phpunit,sebastianbergmann/phpunit,PHP,20,The PHP Unit Testing framework.,2068,18255,https://avatars.githubusercontent.com/u/25218?u=01bb70d9be43ded7572eb3862127ff281daa2725&v=4
2253830,PHPMailer,PHPMailer/PHPMailer,PHP,168,The classic email sending library for PHP,9162,17850,https://avatars.githubusercontent.com/u/3959702?v=4
2889328,WordPress,WordPress/WordPress,PHP,39,"WordPress, Git-ified. This repository is just a mirror of the WordPress subversion repository. Please do not send pull requests. Submit pull requests to https://github.com/WordPress/wordpress-develop and patches to https://core.trac.wordpress.org/ instead.",10901,15972,https://avatars.githubusercontent.com/u/276006?v=4
53783664,howto-make-more-money,easychen/howto-make-more-money,PHP,29,"程序员如何优雅的挣零花钱，2.0版，升级为小书了。Most of this not work outside China , so no English translate",1610,15073,https://avatars.githubusercontent.com/u/1294760?u=7f6a30a62cbba932e36f36a2f913db3c7d0ab997&v=4
3431193,yii2,yiisoft/yii2,PHP,23,"Yii 2: The Fast, Secure and Professional PHP Framework",6998,13905,https://avatars.githubusercontent.com/u/993323?v=4
26730195,Cachet,CachetHQ/Cachet,PHP,27,📛 An open source status page system for everyone.,1504,12582,https://avatars.githubusercontent.com/u/9951502?v=4
72069409,voyager,the-control-group/voyager,PHP,18,Voyager - The Missing Laravel Admin,2576,10898,https://avatars.githubusercontent.com/u/5199022?v=4
212659,php-code-coverage,sebastianbergmann/php-code-coverage,PHP,13,"Library that provides collection, processing, and rendering functionality for PHP code coverage information.",345,8177,https://avatars.githubusercontent.com/u/25218?u=01bb70d9be43ded7572eb3862127ff281daa2725&v=4
21298446,firefly-iii,firefly-iii/firefly-iii,PHP,66,Firefly III: a personal finances manager,826,7437,https://avatars.githubusercontent.com/u/22821986?v=4
9193949,wallabag,wallabag/wallabag,PHP,141,wallabag is a self hostable application for saving web pages: Save and classify articles. Read them later. Freely.,652,6692,https://avatars.githubusercontent.com/u/4143872?v=4
4242230,PHPWord,PHPOffice/PHPWord,PHP,24,A pure PHP library for reading and writing word processing documents,2434,6116,https://avatars.githubusercontent.com/u/1836015?v=4
13612575,laravel-cors,fruitcake/laravel-cors,PHP,17,Adds CORS (Cross-Origin Resource Sharing) headers support in your Laravel application,592,6007,https://avatars.githubusercontent.com/u/6661222?v=4
14346979,snipe-it,snipe/snipe-it,PHP,42,A free open source IT asset/license management system,2070,5865,https://avatars.githubusercontent.com/u/197404?u=3a3faa7eb52d0ccb5d757cab2633677328bbffb2&v=4
222873550,crater,crater-invoice/crater,PHP,38,Open Source Invoicing Solution for Individuals & Businesses,1048,5637,https://avatars.githubusercontent.com/u/93989578?v=4
95011974,akaunting,akaunting/akaunting,PHP,33,Free and Online Accounting Software,1732,4799,https://avatars.githubusercontent.com/u/26357771?v=4
60010673,elementor,elementor/elementor,PHP,13,"The most advanced frontend drag & drop page builder. Create high-end, pixel perfect websites at record speeds. Any theme, any page, any design.",1066,4298,https://avatars.githubusercontent.com/u/47606894?v=4
62937181,PrivateBin,PrivateBin/PrivateBin,PHP,29,"A minimalist, open source online pastebin where the server has zero knowledge of pasted data. Data is encrypted/decrypted in the browser using 256 bits AES.",527,3786,https://avatars.githubusercontent.com/u/20367028?v=4
8077402,MISP,MISP/MISP,PHP,25,MISP (core software) - Open Source Threat Intelligence and Sharing Platform,1098,3591,https://avatars.githubusercontent.com/u/4134875?v=4
1740040,pfsense,pfsense/pfsense,PHP,20,Main repository for pfSense,1262,3544,https://avatars.githubusercontent.com/u/3716965?v=4
265782973,Postman-cn,hlmd/Postman-cn,PHP,51,Postman汉化中文版,413,3457,https://avatars.githubusercontent.com/u/45023268?u=d3de2cf3e022dba0959a1c454a5c6b760c4010c5&v=4
27965134,core,opnsense/core,PHP,18,"OPNsense GUI, API and systems backend",522,1915,https://avatars.githubusercontent.com/u/9979117?v=4
453952491,envy,worksome/envy,PHP,97,Keep your .env.example file up to date,14,379,https://avatars.githubusercontent.com/u/29755027?v=4
