id,name,full_name,language,new stars,description,forks_count,stargazers_count,avatar_url
83222441,system-design-primer,donnemartin/system-design-primer,Python,1555,Learn how to design large-scale systems. Prep for the system design interview.  Includes Anki flashcards.,30311,163794,https://avatars.githubusercontent.com/u/5458997?u=f1007b583e55e7ccfb6ccf0e200051156112dd9b&v=4
596892,flask,pallets/flask,Python,136,The Python micro framework for building web applications.,14877,58077,https://avatars.githubusercontent.com/u/16748505?v=4
71220757,PayloadsAllTheThings,swisskyrepo/PayloadsAllTheThings,Python,925,A list of useful payloads and bypass for Web Application Security and Pentest/CTF,9572,35199,https://avatars.githubusercontent.com/u/12152583?u=e368c891b81d41b1ce12825f52049e5eb146d401&v=4
74627617,openpilot,commaai/openpilot,Python,705,openpilot is an open source driver assistance system. openpilot performs the functions of Automated Lane Centering and Adaptive Cruise Control for over 150 supported car makes and models.,6080,33127,https://avatars.githubusercontent.com/u/16128714?v=4
4578002,python-patterns,faif/python-patterns,Python,195,A collection of design patterns/idioms in Python,6198,30446,https://avatars.githubusercontent.com/u/1304661?u=3c1b0dbad33966d8eea133e85724bda354dedc89&v=4
57222302,gym,openai/gym,Python,285,A toolkit for developing and comparing reinforcement learning algorithms.,7625,26691,https://avatars.githubusercontent.com/u/14957082?v=4
319029846,Depix,beurtschipper/Depix,Python,411,Recovers passwords from pixelized screenshots,2594,21745,https://avatars.githubusercontent.com/u/4620457?v=4
4008931,hosts,StevenBlack/hosts,Python,93,"ğŸ”’ Consolidating and extending hosts files from several well-curated sources. Optionally pick extensions for porn, social media, and other categories.",1782,20117,https://avatars.githubusercontent.com/u/80144?u=115ad569cf1e49f64172984ac813e16f45976ed1&v=4
21484781,jumpserver,jumpserver/jumpserver,Python,59,JumpServer æ˜¯å…¨çƒé¦–æ¬¾å¼€æºçš„å ¡å’æœºï¼Œæ˜¯ç¬¦åˆ 4A çš„ä¸“ä¸šè¿ç»´å®‰å…¨å®¡è®¡ç³»ç»Ÿã€‚,4530,17962,https://avatars.githubusercontent.com/u/6006570?v=4
154739597,jax,google/jax,Python,156,"Composable transformations of Python+NumPy programs: differentiate, vectorize, JIT to GPU/TPU, and more",1517,16487,https://avatars.githubusercontent.com/u/1342004?v=4
71056775,kitty,kovidgoyal/kitty,Python,160,"Cross-platform, fast, feature-rich, GPU based terminal",668,13766,https://avatars.githubusercontent.com/u/1308621?u=b3fb9d6c1fe72bbc3d3b3b1192e8e421cad810c9&v=4
7053637,mypy,python/mypy,Python,310,Optional static typing for Python,2067,12607,https://avatars.githubusercontent.com/u/1525981?v=4
140614233,PySimpleGUI,PySimpleGUI/PySimpleGUI,Python,87,"Launched in 2018. It's 2022 and PySimpleGUI is actively developed & supported. Create complex windows simply. Supports tkinter, Qt, WxPython, Remi (in browser). Create GUI applications trivially with a full set of widgets. Multi-Window applications are also simple. 3.4 to 3.11 supported. 325+ Demo programs & Cookbook for rapid start. Extensive documentation.  Examples for Machine Learning(OpenCV Integration,  Chatterbot), Rainmeter-like Desktop Widgets, Matplotlib + Pyplot integration, add GUI to command line scripts, PDF & Image Viewer. For both beginning and advanced programmers. docs -  PySimpleGUI.org GitHub - PySimpleGUI.com. The Minecraft of GUIs - simple to complex... does them all.",1430,9549,https://avatars.githubusercontent.com/u/46163555?u=6cb4187ba9736090c4f9d9d82d4972b826c20245&v=4
273839530,python-mini-projects,Python-World/python-mini-projects,Python,146,A collection of simple python mini projects to enhance your python skills,2618,9278,https://avatars.githubusercontent.com/u/68968126?v=4
323048702,GamestonkTerminal,GamestonkTerminal/GamestonkTerminal,Python,78,Investment Research for Everyone.,1007,9025,https://avatars.githubusercontent.com/u/80064875?v=4
43425480,awesome-quant,wilsonfreitas/awesome-quant,Python,143,"A curated list of insanely awesome libraries, packages and resources for Quants (Quantitative Finance)",1565,8798,https://avatars.githubusercontent.com/u/1583922?u=dfb647bb564331eb2c1dbba35f8bafd8b1abb9e2&v=4
994551,jinja,pallets/jinja,Python,42,A very fast and expressive template engine.,1466,8317,https://avatars.githubusercontent.com/u/16748505?v=4
9312102,instagram-scraper,arc298/instagram-scraper,Python,57,Scrapes an instagram user's photos and videos,1265,5884,https://avatars.githubusercontent.com/u/140931?u=037a7fa5cf74020f0f2c575df80660302784043b&v=4
136332816,jd-assistant,tychxn/jd-assistant,Python,37,äº¬ä¸œæŠ¢è´­åŠ©æ‰‹ï¼šåŒ…å«ç™»å½•ï¼ŒæŸ¥è¯¢å•†å“åº“å­˜/ä»·æ ¼ï¼Œæ·»åŠ /æ¸…ç©ºè´­ç‰©è½¦ï¼ŒæŠ¢è´­å•†å“(ä¸‹å•)ï¼ŒæŸ¥è¯¢è®¢å•ç­‰åŠŸèƒ½,1787,4462,https://avatars.githubusercontent.com/u/29301320?u=64ca230c640c8c05e3a1f573a672cb1137c9b976&v=4
167694194,frigate,blakeblackshear/frigate,Python,56,NVR with realtime local object detection for IP cameras,437,3985,https://avatars.githubusercontent.com/u/569905?u=a454086144f531389a73fbea93a7835eea06f2a1&v=4
253044228,nuclei-templates,projectdiscovery/nuclei-templates,Python,83,Community curated list of templates for the nuclei engine to find security vulnerabilities.,1091,3449,https://avatars.githubusercontent.com/u/50994705?v=4
365098852,ailab,bilibili/ailab,Python,625,,285,2820,https://avatars.githubusercontent.com/u/12002442?v=4
4127088,azure-sdk-for-python,Azure/azure-sdk-for-python,Python,143,This repository is for active development of the Azure SDK for Python. For consumers of the SDK we recommend visiting our public developer docs at https://docs.microsoft.com/python/azure/ or our versioned developer docs at https://azure.github.io/azure-sdk-for-python. ,1676,2527,https://avatars.githubusercontent.com/u/6844498?v=4
274782881,learn-cantrill-io-labs,acantril/learn-cantrill-io-labs,Python,20,Standard and Advanced Demos for learn.cantrill.io courses,564,1354,https://avatars.githubusercontent.com/u/15226029?u=5b047c423bdd689755f124ed7eaffa6c970dc5cb&v=4
433296683,typoraCracker,Mas0nShi/typoraCracker,Python,69,A extract & decryption and pack & encryption tools for typora.,339,993,https://avatars.githubusercontent.com/u/60805843?u=36b3b0c682e6f90fd2dc5b2f269a81186cf66055&v=4
