id,name,full_name,language,new stars,description,forks_count,stargazers_count,avatar_url
33884891,airflow,apache/airflow,Python,14,"Apache Airflow - A platform to programmatically author, schedule, and monitor workflows",11791,28775,https://avatars.githubusercontent.com/u/47359?v=4
178626720,lightning,Lightning-AI/lightning,Python,8,"Build and train PyTorch models and connect them to the ML lifecycle using Lightning App templates, without handling DIY infrastructure, cost management, scaling, and other headaches.",2706,21206,https://avatars.githubusercontent.com/u/58386951?v=4
38696925,python-telegram-bot,python-telegram-bot/python-telegram-bot,Python,13,We have made you a wrapper you can't refuse,4561,20695,https://avatars.githubusercontent.com/u/16178365?v=4
143328315,mindsdb,mindsdb/mindsdb,Python,18,In-Database Machine Learning,1429,12305,https://avatars.githubusercontent.com/u/31035808?v=4
1460385,scipy,scipy/scipy,Python,8,SciPy library main repository,4551,10709,https://avatars.githubusercontent.com/u/288277?v=4
91948540,yfinance,ranaroussi/yfinance,Python,16,Download market data from Yahoo! Finance's API,1777,8493,https://avatars.githubusercontent.com/u/1185458?u=c8e56a556d64a815e5aa68855adaad3f1ed546a0&v=4
66474729,prowler,prowler-cloud/prowler,Python,7,"Prowler is an Open Source Security tool to perform Cloud Security best practices assessments, audits, incident response, continuous monitoring, hardening and forensics readiness. It contains hundreds of controls covering CIS, PCI-DSS, ISO27001, GDPR, HIPAA, FFIEC, SOC2, AWS FTR, ENS and custom security frameworks.",1074,7499,https://avatars.githubusercontent.com/u/97106991?v=4
428292281,lama-cleaner,Sanster/lama-cleaner,Python,241,"Image inpainting tool powered by SOTA AI Model. Remove any unwanted object, defect, people from your pictures or erase and replace(powered by stable diffusion) any thing on your pictures.",553,6709,https://avatars.githubusercontent.com/u/3998421?v=4
72523920,cupy,cupy/cupy,Python,2,NumPy & SciPy for GPU,648,6591,https://avatars.githubusercontent.com/u/23187665?v=4
209120637,metaflow,Netflix/metaflow,Python,5,:rocket: Build and manage real-life data science projects with ease!,597,6291,https://avatars.githubusercontent.com/u/913567?v=4
344554014,CustomTkinter,TomSchimansky/CustomTkinter,Python,18,A modern and customizable python UI-library based on Tkinter,444,5172,https://avatars.githubusercontent.com/u/66446067?u=bf968427d91d7464eb6853cfd4878a54274763a0&v=4
272133018,mmsegmentation,open-mmlab/mmsegmentation,Python,5,OpenMMLab Semantic Segmentation Toolbox and Benchmark.,1865,5038,https://avatars.githubusercontent.com/u/10245193?v=4
203999962,mmediting,open-mmlab/mmediting,Python,13,"OpenMMLab Image and Video Restoration, Editing and Generation Toolbox",712,3942,https://avatars.githubusercontent.com/u/10245193?v=4
147583941,slither,crytic/slither,Python,8,Static Analyzer for Solidity,671,3669,https://avatars.githubusercontent.com/u/48330002?v=4
278003645,mmpose,open-mmlab/mmpose,Python,0,OpenMMLab Pose Estimation Toolbox and Benchmark.,732,2854,https://avatars.githubusercontent.com/u/10245193?v=4
505667511,CodeFormer,sczhou/CodeFormer,Python,291,[NeurIPS 2022] Towards Robust Blind Face Restoration with Codebook Lookup Transformer,428,2652,https://avatars.githubusercontent.com/u/14334509?u=88fa39271f4adfbdae7ff8ad26d8e45ba83d68dc&v=4
535360445,ultralytics,ultralytics/ultralytics,Python,506,YOLOv8 ğŸš€ in PyTorch > ONNX > CoreML > TFLite,236,2140,https://avatars.githubusercontent.com/u/26833451?v=4
137219689,SimpleHTR,githubharald/SimpleHTR,Python,3,Handwritten Text Recognition (HTR) system implemented with TensorFlow.,773,1558,https://avatars.githubusercontent.com/u/15148095?u=cd630d9323535265445199e21a162098a29995b7&v=4
441467833,mmdeploy,open-mmlab/mmdeploy,Python,3,OpenMMLab Model Deployment Framework,382,1543,https://avatars.githubusercontent.com/u/10245193?v=4
218478064,explainerdashboard,oegedijk/explainerdashboard,Python,10,"Quickly build Explainable AI dashboards that show the inner workings of so-called ""blackbox"" machine learning models.",203,1529,https://avatars.githubusercontent.com/u/27999937?u=ffe4638ded33a9fa31dd164bd01852c54e444c8d&v=4
560704231,gpt_index,jerryjliu/gpt_index,Python,145,An index created by GPT to organize external information and answer queries!,86,1508,https://avatars.githubusercontent.com/u/4858925?u=eb0717916ba7f9d8b9402d17a22e6f645d0f97c7&v=4
554807775,encodec,facebookresearch/encodec,Python,33,State-of-the-art deep learning based audio codec supporting both mono 24 kHz audio and stereo 48 kHz audio.,100,1447,https://avatars.githubusercontent.com/u/16943930?v=4
508972059,setfit,huggingface/setfit,Python,8,Efficient few-shot learning with Sentence Transformers,88,960,https://avatars.githubusercontent.com/u/25720743?v=4
528938203,Free-TVUrl-Merge,vpei/Free-TVUrl-Merge,Python,3,å…è´¹TvBoxå½±è§†ç«™èšåˆï¼Œæµ‹è¯•ä¸èƒ½ç”¨é“¾æ¥ã€‚TVBoxã€Pluto Playerã€çŒ«å½±è§†TVç­‰å½±è§†æ’­æ”¾è½¯ä»¶é€šç”¨æ¥å£éƒ½å¯ä½¿ç”¨ã€‚Plutoå…¼å®¹æ€§æœ€å¼ºã€‚,135,587,https://avatars.githubusercontent.com/u/42698055?v=4
538273655,so-vits-svc,innnky/so-vits-svc,Python,37,åŸºäºvitsä¸softvcçš„æ­Œå£°éŸ³è‰²è½¬æ¢æ¨¡å‹,84,492,https://avatars.githubusercontent.com/u/67028263?u=faf0f9c79dc4fe5e59bbf9d3510022dc5662ce7a&v=4
