id,name,full_name,language,new stars,description,forks_count,stargazers_count,avatar_url
50264296,bulma,jgthms/bulma,CSS,10,Modern CSS framework based on Flexbox,3892,45979,https://avatars.githubusercontent.com/u/1254808?u=1d9df343bac6f57e7bff85f0074aac2de34f5dcc&v=4
313330998,50projects50days,bradtraversy/50projects50days,CSS,109,"50+ mini web projects using HTML, CSS & JS",5542,20706,https://avatars.githubusercontent.com/u/5550850?u=819e4404506d906d5113cc352b560fcfd242cce3&v=4
68592809,iCSS,chokcoco/iCSS,CSS,20,不止于 CSS,1425,13316,https://avatars.githubusercontent.com/u/8554143?u=c322501aeb96b3f90f504512d501830b70894eae&v=4
17446152,2048,gabrielecirulli/2048,CSS,2,A small clone of 1024 (https://play.google.com/store/apps/details?id=com.veewo.a1024),16105,11359,https://avatars.githubusercontent.com/u/886011?v=4
105702631,plex,IBM/plex,CSS,4,"The package of IBM’s typeface, IBM Plex.",516,7999,https://avatars.githubusercontent.com/u/1459110?v=4
259354262,scaffold-eth,scaffold-eth/scaffold-eth,CSS,5,🏗 forkable Ethereum dev stack focused on fast product iterations ,2467,7706,https://avatars.githubusercontent.com/u/90008925?v=4
49767244,primeng,primefaces/primeng,CSS,2,The Most Complete Angular UI Component Library,3912,7633,https://avatars.githubusercontent.com/u/3494069?v=4
65019435,public-pentesting-reports,juliocesarfort/public-pentesting-reports,CSS,3,Curated list of  public penetration test reports released by several consulting firms and academic security groups,1559,6241,https://avatars.githubusercontent.com/u/47504?u=5615ddfb4162dad0bc21a5a408dcb12889ad1a69&v=4
7517918,spring-petclinic,spring-projects/spring-petclinic,CSS,1,A sample Spring-based application,16690,5807,https://avatars.githubusercontent.com/u/317776?v=4
229293658,tailwind-starter-kit,creativetimofficial/tailwind-starter-kit,CSS,3,"Tailwind Starter Kit a beautiful extension for TailwindCSS, Free and Open Source",740,4940,https://avatars.githubusercontent.com/u/20172349?v=4
361647128,Firefox-UI-Fix,black7375/Firefox-UI-Fix,CSS,4,🦊 I respect proton UI and aim to improve it.,163,3966,https://avatars.githubusercontent.com/u/25581533?u=f6993f176b7d8c95ca247234efce60bd6076eecb&v=4
141040549,seeker,thewhiteh4t/seeker,CSS,13,Accurately Locate Smartphones using Social Engineering ,1195,3834,https://avatars.githubusercontent.com/u/36354846?u=99d06a9237c301569774dac1c70218d5c032773a&v=4
107962707,advanced-css-course,jonasschmedtmann/advanced-css-course,CSS,1,"Starter files, final projects and FAQ for my Advanced CSS course",4568,3696,https://avatars.githubusercontent.com/u/18718850?u=9e3b84d1871a03690c758df5b5e9b967223a6def&v=4
329751286,youtube,safak/youtube,CSS,11,,3789,3182,https://avatars.githubusercontent.com/u/1486366?u=c367d218a8cf89ad09c3dbfb3c7ad7a929142f20&v=4
76666208,primereact,primefaces/primereact,CSS,8,The Most Complete React UI Component Library,626,3072,https://avatars.githubusercontent.com/u/3494069?v=4
160313905,primevue,primefaces/primevue,CSS,5,Next Generation Vue UI Component Library,534,2740,https://avatars.githubusercontent.com/u/3494069?v=4
222361926,javascript-basic-projects,john-smilga/javascript-basic-projects,CSS,4,,2756,2442,https://avatars.githubusercontent.com/u/42133389?u=9d63b6d71fba139347cddf2c840a858c8ff97168&v=4
420352316,project_modern_ui_ux_gpt3,adrianhajdin/project_modern_ui_ux_gpt3,CSS,5,Master the creation of Modern UX/UI Websites,408,1560,https://avatars.githubusercontent.com/u/24898559?u=676a88e76bd79c4b794256e7651c796336d05a3a&v=4
292673424,cloudflare-docs,cloudflare/cloudflare-docs,CSS,3,Cloudflare’s documentation,1698,1313,https://avatars.githubusercontent.com/u/314135?v=4
479451389,Maple-font,subframe7536/Maple-font,CSS,91,Open source monospace/Nerd Font font with round corner for IDE and command line. 开源圆角的等宽和控制台字体,16,909,https://avatars.githubusercontent.com/u/78338239?u=ab321434c239eb2e1e3f593db412ff00361bc046&v=4
211423942,Animation-Nation,zero-to-mastery/Animation-Nation,CSS,1,A ZTM Challenge for Hacktoberfest 2019,2507,149,https://avatars.githubusercontent.com/u/35373879?v=4
436884632,sakai-ng,primefaces/sakai-ng,CSS,0,Free Angular Admin Template by PrimeNG,115,131,https://avatars.githubusercontent.com/u/3494069?v=4
262626733,DevOps-Projects,Abhinav-26/DevOps-Projects,CSS,3,The repository contains beginner friendly DevOps projects for automating stuffs using DevOps concepts.,159,125,https://avatars.githubusercontent.com/u/48083659?u=3d15d01d5f7f122aad1e75b33ec2b825bb1fecd2&v=4
518571142,transparent-login-form,WebDevSimplified/transparent-login-form,CSS,4,,10,26,https://avatars.githubusercontent.com/u/39717099?u=3dc0cf56be4b09fdcf57e470f83044651959ad70&v=4
527996634,fake-chsi,Soya-xy/fake-chsi,CSS,0,学信认证页面布局样式,1,20,https://avatars.githubusercontent.com/u/56671014?u=abb903a33b168803e81ec1311a78ac65adc4d9d5&v=4
