id,name,full_name,language,new stars,description,forks_count,stargazers_count,avatar_url
184456251,PowerToys,microsoft/PowerToys,C#,31,Windows system utilities to maximize productivity,6786,115224,https://avatars.githubusercontent.com/u/6154722?v=4
199570071,v2rayN,2dust/v2rayN,C#,62,"A GUI client for Windows, Linux and macOS, support Xray and sing-box and others",12282,75814,https://avatars.githubusercontent.com/u/31833384?v=4
161012019,jellyfin,jellyfin/jellyfin,C#,20,The Free Software Media System - Server Backend & API,3369,37561,https://avatars.githubusercontent.com/u/45698031?v=4
201188122,lively,rocksdanister/lively,C#,5,Free and open-source software that allows users to set animated desktop wallpapers and screensavers powered by WinUI 3.,1100,15846,https://avatars.githubusercontent.com/u/17554161?u=cf74918fea11cb80eb185453f55cc66a55586c29&v=4
959908,OpenRA,OpenRA/OpenRA,C#,21,"Open Source real-time strategy game engine for early Westwood games such as Command & Conquer: Red Alert written in C# using SDL and OpenGL. Runs on Windows, Linux, *BSD and Mac OS X.",2721,15265,https://avatars.githubusercontent.com/u/409046?v=4
377163326,UniGetUI,marticliment/UniGetUI,C#,20,UniGetUI: The Graphical Interface for your package managers. Could be terribly described as a package manager manager to manage your package managers,498,14713,https://avatars.githubusercontent.com/u/53119851?u=5f00c577f9a46aabe7fc52d66c511994800e5b18&v=4
64753043,AssetStudio,Perfare/AssetStudio,C#,4,"AssetStudio is a tool for exploring, extracting and exporting assets and assetbundles.",2642,13814,https://avatars.githubusercontent.com/u/12952226?u=36886cb911e51458e6f2fdd041f97a6f7ce64b40&v=4
157858597,YoutubeDownloader,Tyrrrz/YoutubeDownloader,C#,21,Downloads videos and playlists from YouTube,1402,10546,https://avatars.githubusercontent.com/u/1935960?u=40a06549de224471e1a81877536f8e24d4e96f09&v=4
33476566,FileConverter,Tichau/FileConverter,C#,23,File Converter is a very simple tool which allows you to convert and compress files using the context menu in windows explorer.,657,9084,https://avatars.githubusercontent.com/u/3792144?u=79a9d2664dcd4793d3e1b81ec0166e148b166ff3&v=4
257526212,Flow.Launcher,Flow-Launcher/Flow.Launcher,C#,10,:mag: Quick file search & app launcher for Windows with community-made plugins,340,8990,https://avatars.githubusercontent.com/u/62821278?v=4
7377936,ImageGlass,d2phap/ImageGlass,C#,31,"🏞 A lightweight, versatile image viewer",531,8698,https://avatars.githubusercontent.com/u/3154213?u=777381c834959d816279ae18bf49794865b72b9d&v=4
366663429,jynew,jynew/jynew,C#,2,JinYongLegend-like RPG Game Framework with full Modding support and 10+ hours playable samples of game.,1807,8246,https://avatars.githubusercontent.com/u/82129705?v=4
77703410,Il2CppDumper,Perfare/Il2CppDumper,C#,2,Unity il2cpp reverse engineer,1487,7464,https://avatars.githubusercontent.com/u/12952226?u=36886cb911e51458e6f2fdd041f97a6f7ce64b40&v=4
39425864,tModLoader,tModLoader/tModLoader,C#,1,A mod to make and play Terraria mods. Supports Terraria 1.4 (and earlier) installations ,1915,4365,https://avatars.githubusercontent.com/u/36521970?v=4
393538656,dlss-swapper,beeradmoore/dlss-swapper,C#,35,,94,3257,https://avatars.githubusercontent.com/u/904737?u=73462af5f3c3fdf1e09dcd492d232d72a9d28440&v=4
37799274,P,p-org/P,C#,13,The P programming language.,188,3169,https://avatars.githubusercontent.com/u/12985075?v=4
211763756,OpenTabletDriver,OpenTabletDriver/OpenTabletDriver,C#,5,"Open source, cross-platform, user-mode tablet driver",372,2912,https://avatars.githubusercontent.com/u/76072354?v=4
92001425,space-station-14,space-wizards/space-station-14,C#,2,A multiplayer game about paranoia and chaos on a space station. Remake of the cult-classic Space Station 13.,3854,2902,https://avatars.githubusercontent.com/u/10567778?v=4
818118661,SwarmUI,mcmonkeyprojects/SwarmUI,C#,10,"SwarmUI (formerly StableSwarmUI), A Modular Stable Diffusion Web-User-Interface, with an emphasis on making powertools easily accessible, high performance, and extensibility.",160,2077,https://avatars.githubusercontent.com/u/43497670?v=4
875403491,Flyby11,builtbybel/Flyby11,C#,20,Windows 11 Upgrading Assistant,82,1225,https://avatars.githubusercontent.com/u/48735732?v=4
401873120,HunterPie,HunterPie/HunterPie,C#,3,"A clean, modern and robust overlay for Monster Hunter games.",88,755,https://avatars.githubusercontent.com/u/114198780?v=4
689776165,Delta-v,DeltaV-Station/Delta-v,C#,0,"A fork of Space Station 14, embracing a mixture of classic SS13 chaos and experimentation only possible with the new engine",420,86,https://avatars.githubusercontent.com/u/131613340?v=4
