id,name,full_name,language,new stars,description,forks_count,stargazers_count,avatar_url
184456251,PowerToys,microsoft/PowerToys,C#,69,Windows system utilities to maximize productivity,5080,88355,https://avatars.githubusercontent.com/u/6154722?v=4
7600409,shadowsocks-windows,shadowsocks/shadowsocks-windows,C#,18,A C# port of shadowsocks,16420,56044,https://avatars.githubusercontent.com/u/3006190?v=4
199570071,v2rayN,2dust/v2rayN,C#,77,"A V2Ray client for Windows, support Xray core and v2fly core",7539,39389,https://avatars.githubusercontent.com/u/31833384?v=4
49609581,PowerShell,PowerShell/PowerShell,C#,21,PowerShell for every system!,6394,37609,https://avatars.githubusercontent.com/u/11524380?v=4
161012019,jellyfin,jellyfin/jellyfin,C#,24,The Free Software Media System,1970,21156,https://avatars.githubusercontent.com/u/45698031?v=4
120231691,Ryujinx,Ryujinx/Ryujinx,C#,17,Experimental Nintendo Switch Emulator written in C#,1840,16798,https://avatars.githubusercontent.com/u/39036280?v=4
16157746,efcore,dotnet/efcore,C#,3,"EF Core is a modern object-database mapper for .NET. It supports LINQ queries, change tracking, updates, and schema migrations.",2914,12311,https://avatars.githubusercontent.com/u/9141961?v=4
22456440,osu,ppy/osu,C#,7,rhythm is just a *click* away!,1867,11977,https://avatars.githubusercontent.com/u/995763?v=4
324473895,downkyi,leiurayer/downkyi,C#,26,å“”å“©ä¸‹è½½å§¬downkyiï¼Œå“”å“©å“”å“©ç½‘ç«™è§†é¢‘ä¸‹è½½å·¥å…·ï¼Œæ”¯æŒæ‰¹é‡ä¸‹è½½ï¼Œæ”¯æŒ8Kã€HDRã€æœæ¯”è§†ç•Œï¼Œæä¾›å·¥å…·ç®±ï¼ˆéŸ³è§†é¢‘æå–ã€å»æ°´å°ç­‰ï¼‰ã€‚,1457,11658,https://avatars.githubusercontent.com/u/19290097?u=589c798ec2b77363ddf03308123a6f8c718a8426&v=4
1579990,MonoGame,MonoGame/MonoGame,C#,11,One framework for creating powerful cross-platform games.,2680,9310,https://avatars.githubusercontent.com/u/4772066?v=4
45195614,Jackett,Jackett/Jackett,C#,2,API Support for your favorite torrent trackers,1049,8813,https://avatars.githubusercontent.com/u/15383019?v=4
27251463,Lean,QuantConnect/Lean,C#,6,"Lean Algorithmic Trading Engine by QuantConnect (Python, C#)",2780,7232,https://avatars.githubusercontent.com/u/3912814?v=4
282637924,BBDown,nilaoda/BBDown,C#,12,Bilibili Downloader. ä¸€æ¬¾å‘½ä»¤è¡Œå¼å“”å“©å“”å“©ä¸‹è½½å™¨.,551,4948,https://avatars.githubusercontent.com/u/20772925?u=6332a7ef3fc5f4f6ce844a764e912638fc01b64a&v=4
109916954,SteamAchievementManager,gibbed/SteamAchievementManager,C#,1,A manager for game achievements in Steam.,609,3944,https://avatars.githubusercontent.com/u/85170?u=bd14aa5c025961e698eff7018d168cc80357a2cd&v=4
89527614,NETworkManager,BornToBeRoot/NETworkManager,C#,13,A powerful tool for managing networks and troubleshoot network problems!,474,3512,https://avatars.githubusercontent.com/u/16019165?u=c4e7846be886ac5f8590cb5e5c9395e61d713d7d&v=4
21311240,PKHeX,kwsch/PKHeX,C#,6,PokÃ©mon Save File Editor,553,2800,https://avatars.githubusercontent.com/u/6393368?v=4
49533213,OneOf,mcintyre321/OneOf,C#,13,Easy to use F#-like ~discriminated~ unions for C# with exhaustive compile time matching,119,2279,https://avatars.githubusercontent.com/u/275706?v=4
557943202,GoogleTranslateIpCheck,Ponderfly/GoogleTranslateIpCheck,C#,28,,239,2178,https://avatars.githubusercontent.com/u/22912560?v=4
305021589,Prowlarr,Prowlarr/Prowlarr,C#,5,,116,2177,https://avatars.githubusercontent.com/u/73049443?v=4
607289185,semantic-kernel,microsoft/semantic-kernel,C#,613,Integrate cutting-edge LLM technology quickly and easily into your apps,206,2076,https://avatars.githubusercontent.com/u/6154722?v=4
419415576,dotnet,CommunityToolkit/dotnet,C#,2,".NET Community Toolkit is a collection of helpers and APIs that work for all .NET developers and are agnostic of any specific UI platform. The toolkit is maintained and published by Microsoft, and part of the .NET Foundation.",143,1938,https://avatars.githubusercontent.com/u/41346473?v=4
418846673,LenovoLegionToolkit,BartoszCichecki/LenovoLegionToolkit,C#,7,Lightweight replacement of Lenovo Vantage for Lenovo Legion laptops.,121,1925,https://avatars.githubusercontent.com/u/7916915?u=cb6193987a878f0500ea08b59a1c269679d6c2a8&v=4
430330681,p2p,miroslavpejic85/p2p,C#,9,"ğŸ–¥ï¸ P2P Remote Desktop - Portable, No Configuration or Installation Needed.",222,1790,https://avatars.githubusercontent.com/u/70838434?u=e77430c8a5712be79189a9dbfeac4789247d4383&v=4
88008282,Minecraft-Mod-Language-Package,CFPAOrg/Minecraft-Mod-Language-Package,C#,0,A language package for Minecraft Mods.,676,708,https://avatars.githubusercontent.com/u/34183279?v=4
574666627,ChatGPT,wieslawsoltes/ChatGPT,C#,18,"A ChatGPT C# client for MacOS, Windows, Linux, Android, iOS and Browser.",65,422,https://avatars.githubusercontent.com/u/2297442?v=4
