id,name,full_name,language,new stars,description,forks_count,stargazers_count,avatar_url
2579314,Faker,fzaninotto/Faker,PHP,3,Faker is a PHP library that generates fake data for you,3415,26573,https://avatars.githubusercontent.com/u/99944?u=24e77d6928aa3af0d7cb71cf5097fcdb9ed23c53&v=4
448045,phpunit,sebastianbergmann/phpunit,PHP,0,The PHP Unit Testing framework.,2107,18631,https://avatars.githubusercontent.com/u/25218?u=01bb70d9be43ded7572eb3862127ff281daa2725&v=4
2889328,WordPress,WordPress/WordPress,PHP,10,"WordPress, Git-ified. This repository is just a mirror of the WordPress subversion repository. Please do not send pull requests. Submit pull requests to https://github.com/WordPress/wordpress-develop and patches to https://core.trac.wordpress.org/ instead.",11558,16572,https://avatars.githubusercontent.com/u/276006?v=4
7579180,lexer,doctrine/lexer,PHP,0,"Base library for a lexer that can be used in Top-Down, Recursive Descent Parsers.",52,10721,https://avatars.githubusercontent.com/u/209254?v=4
4549925,psysh,bobthecow/psysh,PHP,1,A REPL for PHP,291,9362,https://avatars.githubusercontent.com/u/53660?v=4
1398630,console,symfony/console,PHP,1,The Console component eases the creation of beautiful and testable command line interfaces.,247,9257,https://avatars.githubusercontent.com/u/143937?v=4
677464,dbal,doctrine/dbal,PHP,2,Doctrine Database Abstraction Layer,1216,8798,https://avatars.githubusercontent.com/u/209254?v=4
330275,Twig,twigphp/Twig,PHP,0,"Twig, the flexible, fast, and secure template language for PHP",1183,7596,https://avatars.githubusercontent.com/u/5296178?v=4
44745130,polyfill-mbstring,symfony/polyfill-mbstring,PHP,0,"This component provides a partial, native PHP implementation for the Mbstring extension.",36,7510,https://avatars.githubusercontent.com/u/143937?v=4
14346979,snipe-it,snipe/snipe-it,PHP,4,A free open source IT asset/license management system,2288,6739,https://avatars.githubusercontent.com/u/197404?u=3a3faa7eb52d0ccb5d757cab2633677328bbffb2&v=4
6763587,PrestaShop,PrestaShop/PrestaShop,PHP,1,PrestaShop is the universal open-source software platform to build your e-commerce solution.,4435,6590,https://avatars.githubusercontent.com/u/2815696?v=4
97311017,rector,rectorphp/rector,PHP,8,Instant Upgrades and Automated Refactoring of any PHP 5.3+ code,538,5849,https://avatars.githubusercontent.com/u/32097581?v=4
10883164,laravel-dompdf,barryvdh/laravel-dompdf,PHP,5,A DOMPDF Wrapper for Laravel,857,5441,https://avatars.githubusercontent.com/u/973269?u=5c91f55a44fa388c096c4d77111346dee758bd44&v=4
3817881,swagger-php,zircote/swagger-php,PHP,2,A php swagger annotation and parsing library,881,4539,https://avatars.githubusercontent.com/u/307960?v=4
61802818,laravel-activitylog,spatie/laravel-activitylog,PHP,3,Log activity inside your Laravel app,629,4495,https://avatars.githubusercontent.com/u/7535935?v=4
62087941,laravel-modules,nWidart/laravel-modules,PHP,5,Module Management In Laravel,808,4414,https://avatars.githubusercontent.com/u/882397?u=cdb31d0969c5283251ca913a5db185704b3a95d0&v=4
439861,moodle,moodle/moodle,PHP,1,Moodle - the world's open source learning platform,5617,4284,https://avatars.githubusercontent.com/u/168672?v=4
9077725,libphonenumber-for-php,giggsey/libphonenumber-for-php,PHP,1,PHP version of Google's phone number handling library,431,4146,https://avatars.githubusercontent.com/u/305730?u=2b8bbbf6a30f79f5ecf824d491b6711e07132fda&v=4
117567334,laravel-query-builder,spatie/laravel-query-builder,PHP,7,Easily build Eloquent queries from API requests,319,3349,https://avatars.githubusercontent.com/u/7535935?v=4
17253775,zabbix,zabbix/zabbix,PHP,3,"Real-time monitoring of IT components and services, such as networks, servers, VMs, applications and the cloud.",726,2458,https://avatars.githubusercontent.com/u/4561226?v=4
138328462,freescout,freescout-helpdesk/freescout,PHP,6,FreeScout — Free self-hosted help desk & shared mailbox (Zendesk / Help Scout alternative),300,1609,https://avatars.githubusercontent.com/u/40499291?u=3f204a1fd4a18b2a3e8c5ce40e58b4b2c82a93ec&v=4
75645659,wordpress-develop,WordPress/wordpress-develop,PHP,3,"WordPress Develop, Git-ified. Synced from git://develop.git.wordpress.org/, including branches and tags! This repository is just a mirror of the WordPress subversion repository. Please include a link to a pre-existing ticket on https://core.trac.wordpress.org/ with every pull request.",1372,1589,https://avatars.githubusercontent.com/u/276006?v=4
524886955,log-viewer,opcodesio/log-viewer,PHP,291,Fast and beautiful Log Viewer for Laravel,50,932,https://avatars.githubusercontent.com/u/106914022?v=4
529282966,laravel-dynamic-servers,spatie/laravel-dynamic-servers,PHP,26,Dynamically create and destroy servers,4,72,https://avatars.githubusercontent.com/u/7535935?v=4
423845458,mysqli-safe,annexus254/mysqli-safe,PHP,3,,17,19,https://avatars.githubusercontent.com/u/93447935?u=922049f963a47c7e30ca294491e185e518c954cc&v=4
