id,name,full_name,language,new stars,description,forks_count,stargazers_count,avatar_url
561730219,hello-algo,krahets/hello-algo,Java,1477,"《Hello 算法》：动画图解、一键运行的数据结构与算法教程。支持 Python, Java, C++, C, C#, JS, Go, Swift, Rust, Ruby, Kotlin, TS, Dart 代码。简体版和繁体版同步更新，English version ongoing",12895,102897,https://avatars.githubusercontent.com/u/26993056?u=12c6a8ef18768abc773c64a56a56c0fd67241ed2&v=4
22790488,java-design-patterns,iluwatar/java-design-patterns,Java,112,Design patterns implemented in Java,26690,90250,https://avatars.githubusercontent.com/u/582346?u=7aecf4c397c8dffaf0b84bd4c9d4198290f00de1&v=4
6296790,spring-boot,spring-projects/spring-boot,Java,110,"Spring Boot helps you to create Spring-powered, production-grade applications and services with absolute minimum fuss.",40769,75516,https://avatars.githubusercontent.com/u/317776?v=4
1148753,spring-framework,spring-projects/spring-framework,Java,85,Spring Framework,38207,56869,https://avatars.githubusercontent.com/u/317776?v=4
7613257,selenium,SeleniumHQ/selenium,Java,73,A browser automation framework and ecosystem.,8232,30930,https://avatars.githubusercontent.com/u/983927?v=4
137451403,nacos,alibaba/nacos,Java,50,"an easy-to-use dynamic service discovery, configuration and service management platform for building cloud native applications.",12879,30454,https://avatars.githubusercontent.com/u/1961952?v=4
13862381,Telegram,DrKLO/Telegram,Java,119,Telegram for Android source,8186,25446,https://avatars.githubusercontent.com/u/69369?v=4
11125589,keycloak,keycloak/keycloak,Java,183,Open Source Identity and Access Management For Modern Applications and Services,6868,23987,https://avatars.githubusercontent.com/u/4921466?v=4
15823460,redisson,redisson/redisson,Java,40,"Redisson - Valkey and Redis Java client. Complete Real-Time Data Platform. Sync/Async/RxJava/Reactive API. Over 50 Valkey and Redis based Java objects and services: Set, Multimap, SortedSet, Map, List, Queue, Deque, Semaphore, Lock, AtomicLong, Map Reduce, Bloom filter, Spring, Tomcat, Scheduler, JCache API, Hibernate, RPC, local cache..",5381,23441,https://avatars.githubusercontent.com/u/16851431?v=4
133134007,openapi-generator,OpenAPITools/openapi-generator,Java,109,"OpenAPI Generator allows generation of API client libraries (SDK generation), server stubs, documentation and configuration automatically given an OpenAPI Spec (v2, v3)",6621,22140,https://avatars.githubusercontent.com/u/37325267?v=4
283211901,SmartTube,yuliskov/SmartTube,Java,180,SmartTube - an advanced player for set-top boxes and tvs running Android OS,1093,20343,https://avatars.githubusercontent.com/u/5897464?u=bcb1a508a8fdbf9da441be0db25672e42ad4ec64&v=4
149121954,jdk,openjdk/jdk,Java,60,JDK main-line development https://openjdk.org/projects/jdk,5584,20024,https://avatars.githubusercontent.com/u/41768318?v=4
337054443,xManager,Team-xManager/xManager,Java,115,"Ad-Free, New Features & Freedom",289,10419,https://avatars.githubusercontent.com/u/78732598?v=4
83799439,lawnchair,LawnchairLauncher/lawnchair,Java,46,No clever tagline needed.,1235,9556,https://avatars.githubusercontent.com/u/34144436?v=4
99412308,seatunnel,apache/seatunnel,Java,29,"SeaTunnel is a next-generation super high-performance, distributed, massive data integration tool.",1844,8115,https://avatars.githubusercontent.com/u/47359?v=4
158256479,iceberg,apache/iceberg,Java,64,Apache Iceberg,2271,6603,https://avatars.githubusercontent.com/u/47359?v=4
226096934,JimuReport,jeecgboot/JimuReport,Java,34,「数据可视化工具：报表、大屏、仪表盘」积木报表是一款类Excel操作风格，在线拖拽设计的报表工具和和数据可视化产品。功能涵盖: 报表设计、大屏设计、打印设计、图形报表、仪表盘门户设计等，完全免费！秉承“简单、易用、专业”的产品理念，极大的降低报表开发难度、缩短开发周期、解决各类报表难题。,1667,6551,https://avatars.githubusercontent.com/u/86360035?v=4
282994686,flink-cdc,apache/flink-cdc,Java,54,Flink CDC is a streaming data integration tool,1962,5807,https://avatars.githubusercontent.com/u/47359?v=4
312830970,wvp-GB28181-pro,648540858/wvp-GB28181-pro,Java,311,WEB VIDEO PLATFORM是一个基于GB28181-2016标准实现的网络视频平台，支持NAT穿透，支持海康、大华、宇视等品牌的IPC、NVR、DVR接入。支持国标级联，支持rtsp/rtmp等视频流转发到国标平台，支持rtsp/rtmp等推流转发到国标平台。,1535,5395,https://avatars.githubusercontent.com/u/18274453?u=0650a1000adb880f9ce571206435ed61b7410fe2&v=4
447060287,paimon,apache/paimon,Java,21,Apache Paimon is a lake format that enables building a Realtime Lakehouse Architecture with Flink and Spark for both streaming and batch operations.,978,2494,https://avatars.githubusercontent.com/u/47359?v=4
263442622,rewrite,openrewrite/rewrite,Java,41,Automated mass refactoring of source code.,348,2334,https://avatars.githubusercontent.com/u/61478321?v=4
402527443,media,androidx/media,Java,28,"Jetpack Media3 support libraries for media use cases, including ExoPlayer, an extensible media player for Android",428,1778,https://avatars.githubusercontent.com/u/6955922?v=4
495476220,so-novel,freeok/so-novel,Java,138,小说下载器 | 小说下载工具 | 小说下载神器 | 免费小说 | 网络小说 | 免费下载 | 网文下载,54,883,https://avatars.githubusercontent.com/u/51998152?u=6158ae22d998ef14fbb2cd278b54d311fd18e7c2&v=4
