id,name,full_name,language,new stars,description,forks_count,stargazers_count,avatar_url
102578345,lede,coolsnowwolf/lede,C,94,Lean's LEDE source,18174,23456,https://avatars.githubusercontent.com/u/31687149?u=caa956c5f80318ea674625f9e9efa49c98335d74&v=4
47409672,hashcat,hashcat/hashcat,C,109,World's fastest and most advanced password recovery utility,2384,15884,https://avatars.githubusercontent.com/u/15949799?v=4
34921116,bcc,iovisor/bcc,C,73,"BCC - Tools for BPF-based Linux IO analysis, networking, monitoring, and more",3120,15787,https://avatars.githubusercontent.com/u/12766186?v=4
27737393,qmk_firmware,qmk/qmk_firmware,C,65,Open-source keyboard firmware for Atmel AVR and Arm USB families,28845,13589,https://avatars.githubusercontent.com/u/25358678?v=4
78281075,esp8266_deauther,SpacehuhnTech/esp8266_deauther,C,48,Affordable WiFi hacking platform for testing and learning,2248,10682,https://avatars.githubusercontent.com/u/64325017?v=4
7715820,rofi,davatorium/rofi,C,118,"Rofi: A window switcher, application launcher and dmenu replacement",541,10116,https://avatars.githubusercontent.com/u/48837683?v=4
70127218,arduino-esp32,espressif/arduino-esp32,C,32,Arduino core for the ESP32,6051,9526,https://avatars.githubusercontent.com/u/9460735?v=4
65899476,esp-idf,espressif/esp-idf,C,41,Espressif IoT Development Framework. Official development framework for Espressif SoCs.,5903,9311,https://avatars.githubusercontent.com/u/9460735?v=4
1856976,libevent,libevent/libevent,C,27,Event notification library,3139,9278,https://avatars.githubusercontent.com/u/833750?v=4
39242894,coturn,coturn/coturn,C,28,coturn TURN server project,1711,8354,https://avatars.githubusercontent.com/u/6572098?v=4
91493088,GoodbyeDPI,ValdikSS/GoodbyeDPI,C,53,GoodbyeDPI — Deep Packet Inspection circumvention utility (for Windows),742,7735,https://avatars.githubusercontent.com/u/3054729?u=db712da584cc0d21a860b786b9ab2f2323758598&v=4
689344,RetroArch,libretro/RetroArch,C,34,"Cross-platform, sophisticated frontend for the libretro API. Licensed GPLv3.",1476,7158,https://avatars.githubusercontent.com/u/1812827?v=4
97556265,catboost,catboost/catboost,C,15,"A fast, scalable, high performance Gradient Boosting on Decision Trees library, used for ranking, classification, regression and other machine learning tasks for Python, R, Java, C++. Supports computation on CPU and GPU.",1058,6774,https://avatars.githubusercontent.com/u/29043415?v=4
47057247,vlmcsd,Wind4/vlmcsd,C,110,"KMS Emulator in C (currently runs on Linux including Android, FreeBSD, Solaris, Minix, Mac OS, iOS, Windows with or without Cygwin)",1898,6721,https://avatars.githubusercontent.com/u/3997851?v=4
6376337,poco,pocoproject/poco,C,22,"The POCO C++ Libraries are powerful cross-platform C++ libraries for building network- and internet-based applications that run on desktop, server, mobile, IoT, and embedded systems.",1869,6451,https://avatars.githubusercontent.com/u/201918?v=4
97212490,sokol,floooh/sokol,C,39,minimal cross-platform standalone C headers,316,3977,https://avatars.githubusercontent.com/u/1699414?u=78fddd83a07cf36de9d44ad3dd06bbea3aa773b1&v=4
21977691,seL4,seL4/seL4,C,155,The seL4 microkernel,543,3903,https://avatars.githubusercontent.com/u/6878957?v=4
6687936,mbedtls,Mbed-TLS/mbedtls,C,15,"An open source, portable, easy to use, readable and flexible TLS library, and reference implementation of the PSA Cryptography API.",2112,3796,https://avatars.githubusercontent.com/u/97226525?v=4
284134871,flipperzero-firmware,flipperdevices/flipperzero-firmware,C,186,Flipper Zero firmware source code,1026,3568,https://avatars.githubusercontent.com/u/57576566?v=4
27359183,GmSSL,guanzhi/GmSSL,C,32,支持国密SM2/SM3/SM4/SM9/SSL的密码工具箱,1314,3536,https://avatars.githubusercontent.com/u/1787781?u=c71c577b7da3afe39a461344fdca316d82f91735&v=4
6860771,tinyusb,hathach/tinyusb,C,21,An open source  cross-platform USB stack for embedded system,638,3142,https://avatars.githubusercontent.com/u/249515?u=5cc8dcf0f9bb8ea773f3aeb7e0ad0bed574cf37a&v=4
472575717,Shipwright,HarbourMasters/Shipwright,C,38,,279,1526,https://avatars.githubusercontent.com/u/88675208?v=4
270692521,zmk,zmkfirmware/zmk,C,19,ZMK Firmware Repository,1210,1200,https://avatars.githubusercontent.com/u/66629601?v=4
443355471,Picoclick-C3,makermoekoe/Picoclick-C3,C,44,,65,548,https://avatars.githubusercontent.com/u/24589091?u=f758ff8956b1753aa33110140e4c1a48658875d8&v=4
437001017,francinette,xicodomingues/francinette,C,14,An easy to use testing framework for the 42 projects,11,119,https://avatars.githubusercontent.com/u/1523085?u=e9fcf284e6a2451d898e374f01fc13b35ab7f2e4&v=4
