id,name,full_name,language,new stars,description,forks_count,stargazers_count,avatar_url
33015583,keras,keras-team/keras,Python,55,Deep Learning for humans,19184,56464,https://avatars.githubusercontent.com/u/34455048?v=4
12888993,core,home-assistant/core,Python,137,:house_with_garden: Open source home automation that puts local control and privacy first.,20184,55501,https://avatars.githubusercontent.com/u/13844975?v=4
81598961,cpython,python/cpython,Python,217,The Python programming language,24635,48408,https://avatars.githubusercontent.com/u/1525981?v=4
71220757,PayloadsAllTheThings,swisskyrepo/PayloadsAllTheThings,Python,230,A list of useful payloads and bypass for Web Application Security and Pentest/CTF,11348,42277,https://avatars.githubusercontent.com/u/12152583?u=e368c891b81d41b1ce12825f52049e5eb146d401&v=4
118861276,python-cheatsheet,gto76/python-cheatsheet,Python,121,Comprehensive Python Cheatsheet,5567,30459,https://avatars.githubusercontent.com/u/1396046?u=852f59cf0d778cb9863e623352049d42c2fac10c&v=4
262296122,PaddleOCR,PaddlePaddle/PaddleOCR,Python,567,"Awesome multilingual OCR toolkits based on PaddlePaddle (practical ultra lightweight OCR system, support 80+ languages recognition, provide data annotation and synthesis tools, support training and deployment among server, mobile, embedded and IoT devices)",5324,26132,https://avatars.githubusercontent.com/u/23534030?v=4
154739597,jax,google/jax,Python,102,"Composable transformations of Python+NumPy programs: differentiate, vectorize, JIT to GPU/TPU, and more",1923,20717,https://avatars.githubusercontent.com/u/1342004?v=4
355959597,textual,Textualize/textual,Python,782,Textual is a TUI (Text User Interface) framework for Python inspired by modern web development.,415,14985,https://avatars.githubusercontent.com/u/93378883?v=4
73328905,vision,pytorch/vision,Python,60,"Datasets, Transforms and Models specific to Computer Vision",6303,12651,https://avatars.githubusercontent.com/u/21003710?v=4
172227885,full-stack-fastapi-postgresql,tiangolo/full-stack-fastapi-postgresql,Python,89,"Full stack, modern web application generator. Using FastAPI, PostgreSQL as database, Docker, automatic HTTPS and more.",1839,10197,https://avatars.githubusercontent.com/u/1326112?u=740f11212a731f56798f558ceddb0bd07642afa7&v=4
217475193,PaddleDetection,PaddlePaddle/PaddleDetection,Python,164,"Object Detection toolkit based on PaddlePaddle. It supports object detection, instance segmentation, multiple object tracking and real-time multi-person keypoint detection.",2253,8895,https://avatars.githubusercontent.com/u/23534030?v=4
70746484,tvm,apache/tvm,Python,27,"Open deep learning compiler stack for cpu, gpu and specialized accelerators",2761,8692,https://avatars.githubusercontent.com/u/47359?v=4
390896426,fluentui-emoji,microsoft/fluentui-emoji,Python,360,"A collection of familiar, friendly, and modern emoji from Microsoft",334,6523,https://avatars.githubusercontent.com/u/6154722?v=4
19130362,ansible-for-devops,geerlingguy/ansible-for-devops,Python,59,Ansible for DevOps examples.,2624,6312,https://avatars.githubusercontent.com/u/481677?u=81535aed4594f0b05f65becc0add71b7367a5f2c&v=4
336274588,PaddleNLP,PaddlePaddle/PaddleNLP,Python,130,"Easy-to-use and powerful NLP library with Awesome model zoo, supporting wide-range of NLP tasks from research to industrial applications, including Neural Search, Question Answering, Information Extraction and Sentiment Analysis end-to-end system.",1718,5981,https://avatars.githubusercontent.com/u/23534030?v=4
286500101,rembg,danielgatis/rembg,Python,357,Rembg is a tool to remove images background.,843,5701,https://avatars.githubusercontent.com/u/7380?u=11bfe344ea77d1e8ba6c14611cdf40beb11bc249&v=4
178976529,BentoML,bentoml/BentoML,Python,61,Unified Model Serving Framework 🍱,479,4143,https://avatars.githubusercontent.com/u/49176046?v=4
315490189,OpenCore-Legacy-Patcher,dortania/OpenCore-Legacy-Patcher,Python,263,Experience macOS just like before,411,3661,https://avatars.githubusercontent.com/u/46268266?v=4
79848747,jwt_tool,ticarpi/jwt_tool,Python,241,":snake: A toolkit for testing, tweaking and cracking JSON Web Tokens",481,3473,https://avatars.githubusercontent.com/u/19988419?v=4
278003645,mmpose,open-mmlab/mmpose,Python,40,OpenMMLab Pose Estimation Toolbox and Benchmark.,651,2576,https://avatars.githubusercontent.com/u/10245193?v=4
281519510,FedML,FedML-AI/FedML,Python,123,"FedML - The federated learning and analytics library enabling secure and collaborative machine learning on decentralized data anywhere at any scale. Supporting large-scale cross-silo federated learning, cross-device federated learning on smartphones/IoTs, and research simulation. MLOps and App Marketplace are also enabled (https://open.fedml.ai).",526,2195,https://avatars.githubusercontent.com/u/69099025?v=4
428292281,lama-cleaner,Sanster/lama-cleaner,Python,116,Image inpainting tool powered by SOTA AI Model,175,1618,https://avatars.githubusercontent.com/u/3998421?v=4
229250747,DeepDanbooru,KichangKim/DeepDanbooru,Python,89,"AI based multi-label girl image classification system, implemented by using TensorFlow.",149,1229,https://avatars.githubusercontent.com/u/2926674?u=e0aa46164566c9994c782fe49a72239599898cb3&v=4
539389184,fast-stable-diffusion,TheLastBen/fast-stable-diffusion,Python,296,"fast-stable-diffusion, +25-50% speed increase + memory efficient + DreamBooth",108,1214,https://avatars.githubusercontent.com/u/110583491?u=71504a155c5e6e76547c196e041910b2087470ad&v=4
520318640,Poisson_flow,Newbeeer/Poisson_flow,Python,163,"Code for NeurIPS 2022 Paper, ""Poisson Flow Generative Models""",26,416,https://avatars.githubusercontent.com/u/33647781?v=4
