id,name,full_name,language,new stars,description,forks_count,stargazers_count,avatar_url
589831718,ComfyUI,comfyanonymous/ComfyUI,Python,163,"The most powerful and modular diffusion model GUI, api and backend with a graph/nodes interface.",4968,47060,https://avatars.githubusercontent.com/u/121283862?u=00e0967075548ed41bd53ed0eacd34ac42d8cef0&v=4
38696925,python-telegram-bot,python-telegram-bot/python-telegram-bot,Python,15,We have made you a wrapper you can't refuse,5206,25652,https://avatars.githubusercontent.com/u/16178365?v=4
760231710,Open-Sora,hpcaitech/Open-Sora,Python,13,Open-Sora: Democratizing Efficient Video Production for All,2032,21261,https://avatars.githubusercontent.com/u/88699314?v=4
16479108,wagtail,wagtail/wagtail,Python,10,A Django content management system focused on flexibility and user experience,3754,17759,https://avatars.githubusercontent.com/u/23708009?v=4
778431525,graphrag,microsoft/graphrag,Python,298,A modular graph-based Retrieval-Augmented Generation (RAG) system,1391,15224,https://avatars.githubusercontent.com/u/6154722?v=4
283046497,airbyte,airbytehq/airbyte,Python,12,"The leading data integration platform for ETL / ELT data pipelines from APIs, databases & files to data warehouses, data lakes & data lakehouses. Both self-hosted and Cloud-hosted.",3910,15187,https://avatars.githubusercontent.com/u/59758427?v=4
730534580,ragflow,infiniflow/ragflow,Python,171,RAGFlow is an open-source RAG (Retrieval-Augmented Generation) engine based on deep document understanding.,1466,14445,https://avatars.githubusercontent.com/u/69962740?v=4
780737106,SWE-agent,princeton-nlp/SWE-agent,Python,112,"SWE-agent takes a GitHub issue and tries to automatically fix it, using GPT-4, or your LM of choice. It solves 12.47% of bugs in the SWE-bench evaluation set and takes just 1 minute to run.",1241,12441,https://avatars.githubusercontent.com/u/44678448?v=4
122663163,pyodide,pyodide/pyodide,Python,8,Pyodide is a Python distribution for the browser and Node.js based on WebAssembly,804,11872,https://avatars.githubusercontent.com/u/77002075?v=4
182067506,kedro,kedro-org/kedro,Python,123,"Kedro is a toolbox for production-ready data science. It uses software engineering best practices to help you create data engineering and data science pipelines that are reproducible, maintainable, and modular.",884,9752,https://avatars.githubusercontent.com/u/93382166?v=4
230885748,authentik,goauthentik/authentik,Python,326,The authentication glue you need.,673,8921,https://avatars.githubusercontent.com/u/82976448?v=4
231109256,IntelOwl,intelowlproject/IntelOwl,Python,48,IntelOwl: manage your Threat Intelligence at scale,416,3594,https://avatars.githubusercontent.com/u/65157868?v=4
662724864,ai-toolkit,ostris/ai-toolkit,Python,143,Various AI scripts. Mostly Stable Diffusion stuff.,120,1292,https://avatars.githubusercontent.com/u/33983539?v=4
761150311,unstract,Zipstack/unstract,Python,25,No-code LLM Platform to launch APIs and ETL Pipelines to structure unstructured documents,50,851,https://avatars.githubusercontent.com/u/89070934?v=4
554107151,labelU,opendatalab/labelU,Python,34,"Data annotation toolbox supports image, audio and video data.",56,613,https://avatars.githubusercontent.com/u/97503431?v=4
