id,name,full_name,language,new stars,description,forks_count,stargazers_count,avatar_url
9384267,electron,electron/electron,C++,172,":electron: Build cross-platform desktop apps with JavaScript, HTML, and CSS",14228,105358,https://avatars.githubusercontent.com/u/13409222?v=4
100060912,terminal,microsoft/terminal,C++,228,"The new Windows Terminal and the original Windows console host, all in the same place!",7640,87015,https://avatars.githubusercontent.com/u/6154722?v=4
23357588,protobuf,protocolbuffers/protobuf,C++,172,Protocol Buffers - Google's data interchange format,14707,57735,https://avatars.githubusercontent.com/u/26310541?v=4
27729880,grpc,grpc/grpc,C++,87,"The C based gRPC (C++, Python, Ruby, Objective-C, PHP, C#)",9656,36736,https://avatars.githubusercontent.com/u/7802525?v=4
39840932,googletest,google/googletest,C++,85,GoogleTest - Google Testing and Mocking Framework,9016,28771,https://avatars.githubusercontent.com/u/1342004?v=4
60246359,ClickHouse,ClickHouse/ClickHouse,C++,109,ClickHouse® is a free analytics DBMS for big data,5376,26702,https://avatars.githubusercontent.com/u/54801242?v=4
196813750,CPlusPlusThings,Light-City/CPlusPlusThings,C++,131,C++那些事,6590,26688,https://avatars.githubusercontent.com/u/25699850?u=ae1ceddf2cd1d69488bc3132d29b5ca3bb57ee26&v=4
311683390,ImHex,WerWolv/ImHex,C++,472,"🔍 A Hex Editor for Reverse Engineers, Programmers and people who value their retinas when working at 3 AM.",1059,23496,https://avatars.githubusercontent.com/u/10835354?u=df34a21c99e8b5470fb39a106d328372e7abc115&v=4
23129458,aseprite,aseprite/aseprite,C++,110,"Animated sprite editor & pixel art tool (Windows, macOS, Linux)",1844,19829,https://avatars.githubusercontent.com/u/3853896?v=4
40892817,solidity,ethereum/solidity,C++,74,"Solidity, the Smart Contract Programming Language",4596,19220,https://avatars.githubusercontent.com/u/6250754?v=4
81227005,faiss,facebookresearch/faiss,C++,83,A library for efficient similarity search and clustering of dense vectors.,2774,18842,https://avatars.githubusercontent.com/u/16943930?v=4
197275130,winget-cli,microsoft/winget-cli,C++,51,Windows Package Manager CLI (aka winget),1103,18533,https://avatars.githubusercontent.com/u/6154722?v=4
437245741,dragonfly,dragonflydb/dragonfly,C++,79,A modern replacement for Redis and Memcached,548,16583,https://avatars.githubusercontent.com/u/104819355?v=4
102343794,brpc,apache/brpc,C++,40,"brpc is an Industrial-grade RPC framework using C++ Language, which is often used in high performance system such as Search, Storage, Machine learning, Advertisement, Recommendation etc. ""brpc"" means ""better RPC"".",3588,14265,https://avatars.githubusercontent.com/u/47359?v=4
138754790,duckdb,duckdb/duckdb,C++,112,DuckDB is an in-process SQL OLAP Database Management System,747,7945,https://avatars.githubusercontent.com/u/82039556?v=4
15379620,pcsx2,PCSX2/pcsx2,C++,59,PCSX2 - The Playstation 2 Emulator,1255,7750,https://avatars.githubusercontent.com/u/6278711?v=4
23086893,re2,google/re2,C++,20,"RE2 is a fast, safe, thread-friendly alternative to backtracking regular expression engines like those used in PCRE, Perl, and Python. It is a C++ library.",1070,7489,https://avatars.githubusercontent.com/u/1342004?v=4
470730648,Hyprland,hyprwm/Hyprland,C++,219,Hyprland is a dynamic tiling Wayland compositor that doesn't sacrifice on its looks.,174,4880,https://avatars.githubusercontent.com/u/107882187?v=4
477407390,BetterNCM,MicroCBer/BetterNCM,C++,229,PC版网易云客户端插件管理器,174,2548,https://avatars.githubusercontent.com/u/66859419?u=71de879af166aed3daf150d57429ff1a2ad1e6ef&v=4
388946490,velox,facebookincubator/velox,C++,42,A C++ vectorized database acceleration library aimed to optimizing query engines and data processing systems.,454,1969,https://avatars.githubusercontent.com/u/19538647?v=4
308137876,openedr,ComodoSecurity/openedr,C++,17,Open EDR public repository,335,1674,https://avatars.githubusercontent.com/u/73608125?v=4
450854006,Ender3V2S1,mriscoc/Ender3V2S1,C++,52,This is optimized firmware for Ender3 V2/S1 3D printers.,153,1039,https://avatars.githubusercontent.com/u/2745567?u=e4675e8ca14b7092efdefeefa22fe0968d67e8cf&v=4
388966721,MathAnimation,ambrosiogabe/MathAnimation,C++,315,A simple C++/OpenGL application to create quick and dirty mathematically accurate animations,28,683,https://avatars.githubusercontent.com/u/24964392?v=4
506984830,OpenDTU,tbnobody/OpenDTU,C++,21,Software for ESP32 to talk to Hoymiles Inverters,90,480,https://avatars.githubusercontent.com/u/1753222?u=90d970a618fd5f1020a7da8e71768be4d646e08a&v=4
103838610,Dwarf-Therapist,Dwarf-Therapist/Dwarf-Therapist,C++,42,Dwarf management tool for Dwarf Fortress,48,428,https://avatars.githubusercontent.com/u/32037848?v=4
