id,name,full_name,language,new stars,description,forks_count,stargazers_count,avatar_url
54346799,public-apis,public-apis/public-apis,Python,1555,A collective list of free APIs,19626,170531,https://avatars.githubusercontent.com/u/51121562?v=4
83222441,system-design-primer,donnemartin/system-design-primer,Python,1414,Learn how to design large-scale systems. Prep for the system design interview.  Includes Anki flashcards.,28338,153438,https://avatars.githubusercontent.com/u/5458997?u=f1007b583e55e7ccfb6ccf0e200051156112dd9b&v=4
21872392,awesome-machine-learning,josephmisiti/awesome-machine-learning,Python,100,"A curated list of awesome Machine Learning frameworks, libraries and software.",12894,52057,https://avatars.githubusercontent.com/u/246302?u=9242c80bcb25acbc66683faf0d5d9fb92674689b&v=4
58028038,HelloGitHub,521xueweihan/HelloGitHub,Python,317,":octocat: åˆ†äº« GitHub ä¸Šæœ‰è¶£ã€å…¥é—¨çº§çš„å¼€æºé¡¹ç›®ã€‚Share interesting, entry-level open source projects on GitHub.",7130,49356,https://avatars.githubusercontent.com/u/8255800?u=2024c0f3979fd65c8aab945856eae0852f1186f6&v=4
843222,scikit-learn,scikit-learn/scikit-learn,Python,99,scikit-learn: machine learning in Python,22370,48213,https://avatars.githubusercontent.com/u/365630?v=4
264818686,yolov5,ultralytics/yolov5,Python,305,YOLOv5 ğŸš€ in PyTorch > ONNX > CoreML > TFLite,6806,19479,https://avatars.githubusercontent.com/u/26833451?v=4
262296122,PaddleOCR,PaddlePaddle/PaddleOCR,Python,187,"Awesome multilingual OCR toolkits based on PaddlePaddle (practical ultra lightweight OCR system, support 80+ languages recognition, provide data annotation and synthesis tools, support training and deployment among server, mobile, embedded and IoT devices)",3613,17870,https://avatars.githubusercontent.com/u/23534030?v=4
145670234,mmdetection,open-mmlab/mmdetection,Python,115,OpenMMLab Detection Toolbox and Benchmark,6261,17512,https://avatars.githubusercontent.com/u/10245193?v=4
43160685,zulip,zulip/zulip,Python,91,Zulip server and web appâ€”powerful open source team chat,4936,14730,https://avatars.githubusercontent.com/u/4921959?v=4
45680749,OSX-KVM,kholia/OSX-KVM,Python,404,Run macOS on QEMU/KVM. With OpenCore + Big Sur + Monterey support now! Only commercial (paid) support is available now to avoid spammy issues.,1266,12804,https://avatars.githubusercontent.com/u/79528?u=9817ec6a86b5c4cf292fa037b7c303e943febf4d&v=4
387326890,Real-ESRGAN,xinntao/Real-ESRGAN,Python,601,Real-ESRGAN aims at developing Practical Algorithms for General Image Restoration.,657,7351,https://avatars.githubusercontent.com/u/17445847?u=dc0cf716873f6809f46f105917500699ae1aafd3&v=4
349321229,GFPGAN,TencentARC/GFPGAN,Python,896,GFPGAN aims at developing Practical Algorithms for Real-world Face Restoration.,651,4727,https://avatars.githubusercontent.com/u/83739826?v=4
259842566,PythonPark,Jack-Cherish/PythonPark,Python,354,Python å¼€æºé¡¹ç›®ä¹‹ã€Œè‡ªå­¦ç¼–ç¨‹ä¹‹è·¯ã€ï¼Œä¿å§†çº§æ•™ç¨‹ï¼šAIå®éªŒå®¤ã€å®è—è§†é¢‘ã€æ•°æ®ç»“æ„ã€å­¦ä¹ æŒ‡å—ã€æœºå™¨å­¦ä¹ å®æˆ˜ã€æ·±åº¦å­¦ä¹ å®æˆ˜ã€ç½‘ç»œçˆ¬è™«ã€å¤§å‚é¢ç»ã€ç¨‹åºäººç”Ÿã€èµ„æºåˆ†äº«ã€‚,732,3914,https://avatars.githubusercontent.com/u/16872370?u=ab7b3cc8c6d97e9eb02da3bb577c1305930e8ca9&v=4
31820613,RsaCtfTool,Ganapati/RsaCtfTool,Python,31,RSA attack tool (mainly for ctf) - retreive private key from weak public key and/or uncipher data,625,3152,https://avatars.githubusercontent.com/u/2084795?v=4
122677553,aiortc,aiortc/aiortc,Python,19,WebRTC and ORTC implementation for Python using asyncio,501,2690,https://avatars.githubusercontent.com/u/47147108?v=4
149554797,consensus-specs,ethereum/consensus-specs,Python,94,Ethereum Proof-of-Stake Consensus Specifications,542,2276,https://avatars.githubusercontent.com/u/6250754?v=4
291213368,mmtracking,open-mmlab/mmtracking,Python,274,"OpenMMLab Video Perception Toolbox. It supports Video Object Detection (VID), Multiple Object Tracking (MOT), Single Object Tracking (SOT), Video Instance Segmentation (VIS) with a unified framework.",263,1890,https://avatars.githubusercontent.com/u/10245193?v=4
427625642,MAE-pytorch,pengzhiliang/MAE-pytorch,Python,315,Unofficial PyTorch implementation of Masked Autoencoders Are Scalable Vision Learners,177,1444,https://avatars.githubusercontent.com/u/26346329?u=e9cd44302c27d87eb818e7070a9526e7d214e4a7&v=4
327662446,red-python-scripts,davidbombal/red-python-scripts,Python,60,,933,1115,https://avatars.githubusercontent.com/u/22679022?u=cd8054d71772b5eb90a66362b09654425f560123&v=4
400837389,pycord,Pycord-Development/pycord,Python,229,"Pycord, a maintained fork of discord.py, is a python wrapper for the Discord API",205,1115,https://avatars.githubusercontent.com/u/89700626?v=4
165224631,py_regular_expressions,learnbyexample/py_regular_expressions,Python,76,Learn Python Regular Expressions step by step from beginner to advanced levels,143,1097,https://avatars.githubusercontent.com/u/17766317?u=c025bf059f2a1f012e7c327eea99e3544d7f361f&v=4
250117402,RedTeam-OffensiveSecurity,bigb0sss/RedTeam-OffensiveSecurity,Python,72,Tools & Interesting Things for RedTeam Ops,118,750,https://avatars.githubusercontent.com/u/49355913?u=fe5c2ea074eaf9b86f45adbe711b7047502bc24f&v=4
225604199,TeleGram-Scraper,th3unkn0n/TeleGram-Scraper,Python,19,telegram group scraper tool. fetch all information about group members,461,674,https://avatars.githubusercontent.com/u/40244622?u=8a18e71e2bab50199e631f621fa20761a3e4438e&v=4
416947996,bombcrypto-bot,mpcabete/bombcrypto-bot,Python,146,"This is a python bot that automatically logs in, clicks the new button, and sends heroes to work in the bombcrypto game. It is fully open source and free.",180,305,https://avatars.githubusercontent.com/u/69962256?v=4
391729680,mtkclient,bkerler/mtkclient,Python,23,Inofficial MTK reverse engineering and flash tool,80,242,https://avatars.githubusercontent.com/u/6317772?u=85c0ccf80471bbbb0739bf3882a6207766c497b7&v=4
