id,name,full_name,language,new stars,description,forks_count,stargazers_count,avatar_url
6838921,prometheus,prometheus/prometheus,Go,113,The Prometheus monitoring system and time series database.,6734,40528,https://avatars.githubusercontent.com/u/3380462?v=4
11225014,etcd,etcd-io/etcd,Go,101,Distributed reliable key-value store for the most critical data of a distributed system,8282,38550,https://avatars.githubusercontent.com/u/41972792?v=4
74175805,istio,istio/istio,Go,126,"Connect, secure, control, and observe services.",6023,29290,https://avatars.githubusercontent.com/u/23534644?v=4
15045751,compose,docker/compose,Go,108,Define and run multi-container applications with Docker,4163,24750,https://avatars.githubusercontent.com/u/5429470?v=4
56353740,minikube,kubernetes/minikube,Go,111,Run Kubernetes locally,3897,22971,https://avatars.githubusercontent.com/u/13629408?v=4
37448451,mattermost-server,mattermost/mattermost-server,Go,49,Mattermost is an open source platform for secure collaboration across the entire software development lifecycle.,5292,21746,https://avatars.githubusercontent.com/u/9828093?v=4
163883279,act,nektos/act,Go,205,Run your GitHub Actions locally ğŸš€,543,20572,https://avatars.githubusercontent.com/u/3813618?v=4
165041732,kratos,go-kratos/kratos,Go,145,A modular-designed and easy-to-use microservices framework in Go.,3243,16240,https://avatars.githubusercontent.com/u/62791634?v=4
129717717,loki,grafana/loki,Go,81,"Like Prometheus, but for logs.",1769,14713,https://avatars.githubusercontent.com/u/7195757?v=4
72891330,ingress-nginx,kubernetes/ingress-nginx,Go,64,NGINX Ingress Controller for Kubernetes,6016,11944,https://avatars.githubusercontent.com/u/13629408?v=4
134012064,webrtc,pion/webrtc,Go,71,Pure Go implementation of the WebRTC API,1105,8601,https://avatars.githubusercontent.com/u/38192892?v=4
120896210,argo-cd,argoproj/argo-cd,Go,74,Declarative continuous deployment for Kubernetes.,2016,8124,https://avatars.githubusercontent.com/u/30269780?v=4
118105436,migrate,golang-migrate/migrate,Go,43,Database migrations. CLI and Golang library.,846,7899,https://avatars.githubusercontent.com/u/35595841?v=4
28366058,distribution,distribution/distribution,Go,25,"The toolkit to pack, ship, store, and deliver container content",2049,6513,https://avatars.githubusercontent.com/u/78096003?v=4
21306961,fsnotify,fsnotify/fsnotify,Go,67,Cross-platform file system notifications for Go.,701,6423,https://avatars.githubusercontent.com/u/8013877?v=4
156681830,ffuf,ffuf/ffuf,Go,59,Fast web fuzzer written in Go,682,5870,https://avatars.githubusercontent.com/u/42502069?v=4
434218673,zinc,prabhatsharma/zinc,Go,610,"Zinc Search engine. A lightweight alternative to elasticsearch that requires minimal resources, written in Go.",229,5298,https://avatars.githubusercontent.com/u/4242188?u=d1625af21f66dff25e35af4b5dea40e7da18821c&v=4
135321861,kratos,ory/kratos,Go,83,"Next-gen identity server (think Auth0, Okta, Firebase) with Ory-hardened authentication, MFA, FIDO2, profile management, identity schemas, social sign in, registration, account recovery, and IoT auth. Golang, headless, API-only - without templating or theming headaches.",480,4887,https://avatars.githubusercontent.com/u/25334553?v=4
281765424,CBL-Mariner,microsoft/CBL-Mariner,Go,37,Linux OS for Azure 1P services and edge appliances,271,3095,https://avatars.githubusercontent.com/u/6154722?v=4
258469100,flux2,fluxcd/flux2,Go,64,Open and extensible continuous delivery solution for Kubernetes. Powered by GitOps Toolkit.,290,2669,https://avatars.githubusercontent.com/u/52158677?v=4
441903012,90DaysOfDevOps,MichaelCade/90DaysOfDevOps,Go,641,This repository is my documenting repository for learning the world of DevOps. I started this journey on the 1st January 2022 and I plan to run to March 31st for a complete 90-day romp on spending an hour a day including weekends to get a foundational knowledge across a lot of different areas that make up DevOps. ,123,1522,https://avatars.githubusercontent.com/u/11822323?u=1e4b4747522c1ef1b716dd07ab47703dba1658c9&v=4
403020531,colima,abiosoft/colima,Go,196,Container runtimes on macOS (and Linux) with minimal setup,43,1348,https://avatars.githubusercontent.com/u/240448?u=fc9f61a446e9c11dbd1b888f109cf807903f89cf&v=4
411212454,evmos,tharsis/evmos,Go,46,Evmos is the Ethereum Virtual Machine (EVM) Hub on the Cosmos Network. It is the flagship implementation of the Ethermint library that prioritizes interoperability and novel economics.,186,1035,https://avatars.githubusercontent.com/u/74357377?v=4
444831620,Yasso,sairson/Yasso,Go,286,å¼ºå¤§çš„å†…ç½‘æ¸—é€è¾…åŠ©å·¥å…·é›†-è®©Yassoåƒé£ä¸€æ · æ”¯æŒrdpï¼Œsshï¼Œredisï¼Œpostgresï¼Œmongodbï¼Œmssqlï¼Œmysqlï¼Œwinrmç­‰æœåŠ¡çˆ†ç ´ï¼Œå¿«é€Ÿçš„ç«¯å£æ‰«æï¼Œå¼ºå¤§çš„webæŒ‡çº¹è¯†åˆ«ï¼Œå„ç§å†…ç½®æœåŠ¡çš„ä¸€é”®åˆ©ç”¨ï¼ˆåŒ…æ‹¬sshå®Œå…¨äº¤äº’å¼ç™»é™†ï¼Œmssqlææƒï¼Œredisä¸€é”®åˆ©ç”¨ï¼Œmysqlæ•°æ®åº“æŸ¥è¯¢ï¼Œwinrmæ¨ªå‘åˆ©ç”¨ï¼Œå¤šç§æœåŠ¡åˆ©ç”¨æ”¯æŒsocks5ä»£ç†æ‰§è¡Œï¼‰,136,753,https://avatars.githubusercontent.com/u/74412075?u=402e19b9e6ab2a296f55b3fd46bad3794d9c5487&v=4
445585163,autosaved,nikochiko/autosaved,Go,115,Never worry about losing your code. Written in Go,15,305,https://avatars.githubusercontent.com/u/37668193?u=d82557c244492c497a6ffb25a9d77d0afa8d01cd&v=4
