id,name,full_name,language,new stars,description,forks_count,stargazers_count,avatar_url
112507086,30-seconds-of-code,30-seconds/30-seconds-of-code,JavaScript,36,Short JavaScript code snippets for all your development needs,10124,95611,https://avatars.githubusercontent.com/u/43479428?v=4
110446844,marktext,marktext/marktext,JavaScript,37,"📝A simple and elegant markdown editor, available for Linux, macOS and Windows.",2355,31868,https://avatars.githubusercontent.com/u/36623013?v=4
2055965,swagger-ui,swagger-api/swagger-ui,JavaScript,9,"Swagger UI is a collection of HTML, JavaScript, and CSS assets that dynamically generate beautiful documentation from a Swagger-compliant API.",8321,22058,https://avatars.githubusercontent.com/u/7658037?v=4
30794868,plyr,sampotts/plyr,JavaScript,11,"A simple HTML5, YouTube and Vimeo player",2641,22024,https://avatars.githubusercontent.com/u/719092?u=73816ad6d46f33c01c7863a7cafeede2fc704d3d&v=4
229764465,30-Days-Of-JavaScript,Asabeneh/30-Days-Of-JavaScript,JavaScript,117,"30 days of JavaScript programming challenge is a step-by-step guide to learn JavaScript programming language in 30 days. This challenge may take more than 100 days,  please just follow your own pace. ",4564,21229,https://avatars.githubusercontent.com/u/9008063?u=ec6ff77196b998a4e6b6e3ca1429c524c169c189&v=4
15225670,jitsi-meet,jitsi/jitsi-meet,JavaScript,6,"Jitsi Meet - Secure, Simple and Scalable Video Conferences that you use as a standalone app or embed in your web application.",5762,18079,https://avatars.githubusercontent.com/u/3671647?v=4
7363211,knex,knex/knex,JavaScript,9,"A query builder for PostgreSQL, MySQL, CockroachDB, SQL Server, SQLite3 and Oracle, designed to be flexible, portable, and fun to use.",1893,15796,https://avatars.githubusercontent.com/u/10490573?v=4
56352157,reactotron,infinitered/reactotron,JavaScript,6,"A desktop app for inspecting your React JS and React Native projects. macOS, Linux, and Windows.",881,13557,https://avatars.githubusercontent.com/u/3902527?v=4
190729906,budibase,Budibase/budibase,JavaScript,30,"Budibase is a low-code platform for creating internal apps, workflows, and admin panels in minutes. Supports PostgreSQL, MySQL, MSSQL, MongoDB, Rest API, Docker, K8s, and more 🚀 ",704,13181,https://avatars.githubusercontent.com/u/45009727?v=4
189621607,docs,github/docs,JavaScript,34,The open-source repo for docs.github.com,52834,9976,https://avatars.githubusercontent.com/u/9919?v=4
70566966,react-native-snap-carousel,meliorence/react-native-snap-carousel,JavaScript,5,"Swiper/carousel component for React Native featuring previews, multiple layouts, parallax images, performant handling of huge numbers of items, and more. Compatible with Android & iOS.",1872,9467,https://avatars.githubusercontent.com/u/50283007?v=4
4723248,openlayers,openlayers/openlayers,JavaScript,8,OpenLayers,2742,9000,https://avatars.githubusercontent.com/u/240579?v=4
304344049,kit,sveltejs/kit,JavaScript,13,The fastest way to build Svelte apps,746,8392,https://avatars.githubusercontent.com/u/23617963?v=4
301421364,WantWords,thunlp/WantWords,JavaScript,59,An open-source online reverse dictionary.,486,5159,https://avatars.githubusercontent.com/u/18389035?v=4
440958215,project_web3.0,adrianhajdin/project_web3.0,JavaScript,14,"This is a code repository for the corresponding video tutorial. In this video, we're going to build a Web 3.0 React Solidity Blockchain Application",579,2301,https://avatars.githubusercontent.com/u/24898559?u=227355c5200ae22f733b39ce05f4dab51db5ec9a&v=4
42580311,tasks,rolling-scopes-school/tasks,JavaScript,8,,3599,1693,https://avatars.githubusercontent.com/u/11501370?v=4
338102540,node-express-course,john-smilga/node-express-course,JavaScript,5,,1417,1472,https://avatars.githubusercontent.com/u/42133389?u=9d63b6d71fba139347cddf2c840a858c8ff97168&v=4
482621452,bud,livebud/bud,JavaScript,125,The Full-Stack Web Framework for Go,31,1228,https://avatars.githubusercontent.com/u/93525642?v=4
399739023,musicn,zonemeen/musicn,JavaScript,100,🎵 一个下载高品质音乐的命令行工具,51,592,https://avatars.githubusercontent.com/u/44596995?u=7f72ffd779799676ac96874fbfb33d82c080c02f&v=4
231208785,setup-ruby,ruby/setup-ruby,JavaScript,1,An action to download a prebuilt Ruby and add it to the PATH in 5 seconds,153,516,https://avatars.githubusercontent.com/u/210414?v=4
482179289,id-server,NotFound403/id-server,JavaScript,19,"An OAuth2 Authorization Server,Based on Spring Authorization Server",40,185,https://avatars.githubusercontent.com/u/22664375?u=e339f59ef458689a4659391334c8d06e8a08f75d&v=4
488200095,DeathNote,leafTheFish/DeathNote,JavaScript,11,,126,171,https://avatars.githubusercontent.com/u/103831852?v=4
491040699,leak-inspector,leaky-forms/leak-inspector,JavaScript,9,LeakInspector: an add-on that warns and protects against personal data exfiltration,5,64,https://avatars.githubusercontent.com/u/100139995?v=4
470335041,react_redux_toolkit,gitdagray/react_redux_toolkit,JavaScript,3,,31,41,https://avatars.githubusercontent.com/u/31679671?u=822d302ec163033201e81fa85c63142a7554f32b&v=4
463371423,Self-driving-car,gniziemazity/Self-driving-car,JavaScript,13,,45,130,https://avatars.githubusercontent.com/u/17139277?u=5d690e74be645d8dd05246bdc288454f8b9c5c17&v=4
