id,name,full_name,language,new stars,description,forks_count,stargazers_count,avatar_url
13491895,free-programming-books,EbookFoundation/free-programming-books,,826,:books: Freely available programming books,61089,333219,https://avatars.githubusercontent.com/u/14127308?v=4
63477660,Java,TheAlgorithms/Java,Java,274,All Algorithms implemented in Java,18939,58488,https://avatars.githubusercontent.com/u/20487725?v=4
162998479,sherlock,sherlock-project/sherlock,Python,1906,Hunt down social media accounts by username across social networks,6657,57444,https://avatars.githubusercontent.com/u/48293496?v=4
377496562,AppFlowy,AppFlowy-IO/AppFlowy,Dart,3064,"Bring projects, wikis, and teams together with AI. AppFlowy is an AI collaborative workspace where you achieve more without losing control of your data. The best open source alternative to Notion.",3583,54693,https://avatars.githubusercontent.com/u/86002201?v=4
114747226,faceswap,deepfakes/faceswap,Python,160,Deepfakes Software For All,13061,50479,https://avatars.githubusercontent.com/u/34667098?u=694bb8572af60931d10ae4d2e600b989cffd0ff0&v=4
254832799,hackingtool,Z4nzu/hackingtool,Python,2319,ALL IN ONE Hacking Tool For Hackers,5224,48418,https://avatars.githubusercontent.com/u/25708027?u=43d51529db320284423e8eab65383767c6f52fa7&v=4
108761645,nocodb,nocodb/nocodb,TypeScript,2181,🔥 🔥 🔥 Open Source Airtable Alternative,3185,46782,https://avatars.githubusercontent.com/u/50206778?v=4
269336148,Docker-OSX,sickcodes/Docker-OSX,Shell,4289,Run macOS VM in a Docker! Run near native OSX-KVM in Docker! X11 Forwarding! CI/CD for OS X Security Research! Docker mac Containers.,2333,44887,https://avatars.githubusercontent.com/u/65906298?u=7b8ae9f1fb347ca4f74404d0b379b9779fad3419&v=4
332880689,coolify,coollabsio/coolify,PHP,2175,An open-source & self-hostable Heroku / Netlify / Vercel alternative.,1566,30926,https://avatars.githubusercontent.com/u/60715044?v=4
10567197,dokku,dokku/dokku,Shell,1332,A docker-powered PaaS that helps you build and manage the lifecycle of applications,1888,28342,https://avatars.githubusercontent.com/u/13455795?v=4
1864233,erpnext,frappe/erpnext,Python,1479,Free and Open Source Enterprise Resource Planning (ERP),7000,19689,https://avatars.githubusercontent.com/u/836974?v=4
787076358,firecrawl,mendableai/firecrawl,TypeScript,3071,"🔥 Turn entire websites into LLM-ready markdown or structured data. Scrape, crawl and extract with a single API.",911,12898,https://avatars.githubusercontent.com/u/135057108?v=4
596377730,openobserve,openobserve/openobserve,Rust,867,"🚀 10x easier, 🚀 140x lower storage cost, 🚀 high performance,  🚀 petabyte scale - Elasticsearch/Splunk/Datadog alternative for 🚀 (logs, metrics, traces, RUM, Error tracking, Session replay).",422,11763,https://avatars.githubusercontent.com/u/95867656?v=4
777111718,kotaemon,Cinnamon/kotaemon,Python,8448,An open-source RAG-based tool for chatting with your documents.,715,10323,https://avatars.githubusercontent.com/u/3265185?v=4
762304524,composio,ComposioHQ/composio,Python,1445,Composio equip's your AI agents & LLMs with 100+ high-quality integrations via function calling,2242,7090,https://avatars.githubusercontent.com/u/128464815?v=4
678973052,anthropic-cookbook,anthropics/anthropic-cookbook,Jupyter Notebook,129,A collection of notebooks/recipes showcasing some fun and effective ways of using Claude.,494,4352,https://avatars.githubusercontent.com/u/76263028?v=4
808207942,courses,anthropics/courses,Jupyter Notebook,1470,Anthropic's educational courses,282,3655,https://avatars.githubusercontent.com/u/76263028?v=4
