id,name,full_name,language,new stars,description,forks_count,stargazers_count,avatar_url
29028775,react-native,facebook/react-native,C++,281,A framework for building native applications using React,24188,118082,https://avatars.githubusercontent.com/u/69631?v=4
1181927,bitcoin,bitcoin/bitcoin,C++,389,Bitcoin Core integration/staging tree,36175,78217,https://avatars.githubusercontent.com/u/528860?v=4
196813750,CPlusPlusThings,Light-City/CPlusPlusThings,C++,123,C++é‚£äº›äº‹,8446,38741,https://avatars.githubusercontent.com/u/25699850?u=ae1ceddf2cd1d69488bc3132d29b5ca3bb57ee26&v=4
120887835,interview,huihut/interview,C++,109,"ğŸ“š C/C++ æŠ€æœ¯é¢è¯•åŸºç¡€çŸ¥è¯†æ€»ç»“ï¼ŒåŒ…æ‹¬è¯­è¨€ã€ç¨‹åºåº“ã€æ•°æ®ç»“æ„ã€ç®—æ³•ã€ç³»ç»Ÿã€ç½‘ç»œã€é“¾æ¥è£…è½½åº“ç­‰çŸ¥è¯†åŠé¢è¯•ç»éªŒã€æ‹›è˜ã€å†…æ¨ç­‰ä¿¡æ¯ã€‚This repository is a summary of the basic knowledge of recruiting job seekers and beginners in the direction of C/C++ technology, including language, program library, data structure, algorithm, system, network, link loading library, interview experience, recruitment, recommendation, etc.",7934,34372,https://avatars.githubusercontent.com/u/23519480?u=26a7af910c0edb7be47b9a2f4241b22bb26e3607&v=4
4524181,folly,facebook/folly,C++,65,An open-source C++ library developed and used at Facebook.,5526,28055,https://avatars.githubusercontent.com/u/69631?v=4
191820100,mediapipe,google-ai-edge/mediapipe,C++,84,"Cross-platform, customizable ML solutions for live and streaming media.",5075,26715,https://avatars.githubusercontent.com/u/150697620?v=4
65214191,envoy,envoyproxy/envoy,C++,134,Cloud-native high-performance edge/middle/service proxy,4746,24675,https://avatars.githubusercontent.com/u/30125649?v=4
26038648,spdlog,gabime/spdlog,C++,133,Fast C++ logging library.,4469,23818,https://avatars.githubusercontent.com/u/6052198?u=a5aaa778f219603fd3a6e221c79370ac5f0fa182&v=4
420580521,smartknob,scottbez1/smartknob,C++,52,Haptic input knob with software-defined endstops and virtual detents,1094,19005,https://avatars.githubusercontent.com/u/414890?u=589508b11b9260a496d1735579ab79c77b49558e&v=4
1062572,Catch2,catchorg/Catch2,C++,40,"A modern, C++-native, test framework for unit-tests, TDD and BDD - using C++14, C++17 and later (C++11 support is in v2.x branch, and C++03 on the Catch1.x branch)",3022,18457,https://avatars.githubusercontent.com/u/33321405?v=4
47690142,Sourcetrail,CoatiSoftware/Sourcetrail,C++,150,Sourcetrail - free and open-source interactive source explorer,1373,14735,https://avatars.githubusercontent.com/u/16224233?v=4
384520418,MaaAssistantArknights,MaaAssistantArknights/MaaAssistantArknights,C++,165,"ã€Šæ˜æ—¥æ–¹èˆŸã€‹å°åŠ©æ‰‹ï¼Œå…¨æ—¥å¸¸ä¸€é”®é•¿è‰ï¼| A one-click tool for the daily tasks of Arknights, supporting all clients.",1791,13547,https://avatars.githubusercontent.com/u/97677443?v=4
106558568,dxvk,doitsujin/dxvk,C++,105,"Vulkan-based implementation of D3D8, 9, 10 and 11 for Linux / Wine",817,12726,https://avatars.githubusercontent.com/u/25567304?u=e753c1eafb0e81504b6ab74883303565cdfa66b2&v=4
4454793,MuseScore,musescore/MuseScore,C++,35,"MuseScore is an open source and free music notation software. For support, contribution, bug reports, visit MuseScore.org. Fork and make pull requests!",2601,12065,https://avatars.githubusercontent.com/u/380563?v=4
40556106,wazuh,wazuh/wazuh,C++,105,Wazuh - The Open Source Security Platform. Unified XDR and SIEM protection for endpoints and cloud workloads.,1586,10346,https://avatars.githubusercontent.com/u/13752566?v=4
61980658,azerothcore-wotlk,azerothcore/azerothcore-wotlk,C++,25,Complete Open Source and Modular solution for MMO,2552,6396,https://avatars.githubusercontent.com/u/20147732?v=4
251396732,RTranslator,niedev/RTranslator,C++,93,Open source real-time translation app for Android that runs locally,475,6267,https://avatars.githubusercontent.com/u/32955129?v=4
437505831,Floorp,Floorp-Projects/Floorp,C++,110,"All of source code of version 10 or later of Floorp Browser, the most Advanced and Fastest Firefox derivative ğŸ¦Š",159,5608,https://avatars.githubusercontent.com/u/94953125?v=4
89033556,firebase-ios-sdk,firebase/firebase-ios-sdk,C++,12,Firebase SDK for Apple App Development,1443,5537,https://avatars.githubusercontent.com/u/1335026?v=4
287706896,puerts,Tencent/puerts,C++,35,PUER(æ™®æ´±) Typescript. Let's write your game in UE or Unity with TypeScript.,693,4951,https://avatars.githubusercontent.com/u/18461506?v=4
538979582,WeChatFerry,lich0821/WeChatFerry,C++,107,å¾®ä¿¡æœºå™¨äººåº•å±‚æ¡†æ¶ï¼Œå¯æ¥å…¥Geminiã€ChatGPTã€ChatGLMã€è®¯é£æ˜Ÿç«ã€Tigerbotç­‰å¤§æ¨¡å‹ã€‚WeChat Robot Hook.,649,3616,https://avatars.githubusercontent.com/u/87742696?u=6d1e2829e0a96a0eebce49089ff3f7e0a788e76f&v=4
340219494,libjxl,libjxl/libjxl,C++,42,JPEG XL image format reference implementation,248,2561,https://avatars.githubusercontent.com/u/77789960?v=4
628678571,WirelessAndroidAutoDongle,nisargjhaveri/WirelessAndroidAutoDongle,C++,62,Use Wireless Android Auto with a car that supports only wired Android Auto using a Raspberry Pi.,63,573,https://avatars.githubusercontent.com/u/6381721?u=d0e6e679ccfa0f0987b31aea1e970bc15d4d5abd&v=4
