id,name,full_name,language,new stars,description,forks_count,stargazers_count,avatar_url
21540759,awesome-go,avelino/awesome-go,Go,483,"A curated list of awesome Go frameworks, libraries and software",11549,119964,https://avatars.githubusercontent.com/u/31996?u=7cf01e307d8cb792e10be3cc1af1a0754e941017&v=4
23096959,go,golang/go,Go,215,The Go programming language,17139,119222,https://avatars.githubusercontent.com/u/4314092?v=4
20580498,kubernetes,kubernetes/kubernetes,Go,209,Production-Grade Container Scheduling and Management,38310,106437,https://avatars.githubusercontent.com/u/13629408?v=4
14712850,syncthing,syncthing/syncthing,Go,147,Open Source Continuous File Synchronization,3995,59181,https://avatars.githubusercontent.com/u/7628018?v=4
510607652,pocketbase,pocketbase/pocketbase,Go,177,Open Source realtime backend in 1 file,1450,32799,https://avatars.githubusercontent.com/u/101000011?v=4
3577919,beego,beego/beego,Go,60,"beego is an open-source, high-performance web framework for the Go programming language.",5580,30842,https://avatars.githubusercontent.com/u/3884041?v=4
410430370,CasaOS,IceWhaleTech/CasaOS,Go,216,"CasaOS - A simple, easy-to-use, elegant open-source Personal Cloud system.",1157,21413,https://avatars.githubusercontent.com/u/91336243?v=4
27729907,grpc-go,grpc/grpc-go,Go,39,The Go language implementation of gRPC. HTTP/2 based RPC,4188,19782,https://avatars.githubusercontent.com/u/7802525?v=4
679421146,opentofu,opentofu/opentofu,Go,254,OpenTofu lets you declaratively manage your cloud infrastructure.,687,19456,https://avatars.githubusercontent.com/u/142061836?v=4
273871859,headscale,juanfont/headscale,Go,159,"An open source, self-hosted implementation of the Tailscale control server",1056,19262,https://avatars.githubusercontent.com/u/181059?u=56e87e3bf1145a99035e3ef576bc8c099214ac70&v=4
31311037,chisel,jpillora/chisel,Go,874,A fast TCP/UDP tunnel over HTTP,1283,11862,https://avatars.githubusercontent.com/u/633843?v=4
26661222,chat,tinode/chat,Go,58,"Instant messaging platform. Backend in Go. Clients: Swift iOS, Java Android, JS webapp, scriptable command line; chatbots",1805,11457,https://avatars.githubusercontent.com/u/9325720?v=4
14508450,gophish,gophish/gophish,Go,153,Open-Source Phishing Toolkit,1945,10568,https://avatars.githubusercontent.com/u/16602581?v=4
140412864,evilginx2,kgretzky/evilginx2,Go,80,"Standalone man-in-the-middle attack framework used for phishing login credentials along with session cookies, allowing for the bypass of 2-factor authentication",1792,9796,https://avatars.githubusercontent.com/u/19260967?u=220f620ddd124b2532e92444d41c47cb8c58283b&v=4
40916314,dex,dexidp/dex,Go,36,OpenID Connect (OIDC) identity and OAuth 2.0 provider with pluggable connectors,1622,8969,https://avatars.githubusercontent.com/u/42422344?v=4
244694886,nightingale,ccfos/nightingale,Go,159,"An all-in-one observability solution which aims to combine the advantages of Prometheus and Grafana. It manages alert rules and visualizes metrics, logs, traces in a beautiful web UI.",1299,8704,https://avatars.githubusercontent.com/u/96813578?v=4
247714750,zitadel,zitadel/zitadel,Go,160,"ZITADEL - Identity infrastructure, simplified for you.",402,6896,https://avatars.githubusercontent.com/u/70011121?v=4
220588935,nezha,naiba/nezha,Go,62,":trollface: Self-hosted, lightweight server and website monitoring and O&M tool",1134,6142,https://avatars.githubusercontent.com/u/29243953?u=9881a6f1a488312e0e597c065a1de318148743ea&v=4
11931032,btcd,btcsuite/btcd,Go,348,An alternative full node bitcoin implementation written in Go (golang),2323,6041,https://avatars.githubusercontent.com/u/10235229?v=4
586427117,go-backend-clean-architecture,amitshekhariitbhu/go-backend-clean-architecture,Go,90,"A Go (Golang) Backend Clean Architecture project with Gin, MongoDB, JWT Authentication Middleware, Test, and Docker.",344,3596,https://avatars.githubusercontent.com/u/9877145?u=3827ad395dfc458321f9b65944406cfdd26055dd&v=4
780459560,xzbot,amlweems/xzbot,Go,1840,"notes, honeypot, and exploit demo for the xz backdoor (CVE-2024-3094)",215,3282,https://avatars.githubusercontent.com/u/117625?u=518dae0485e1e6c677cddda7aa9d2369435e1ce5&v=4
473137633,tetragon,cilium/tetragon,Go,28,eBPF-based Security Observability and Runtime Enforcement,307,3246,https://avatars.githubusercontent.com/u/21054566?v=4
363910063,bun,uptrace/bun,Go,171,SQL-first Golang ORM,185,3086,https://avatars.githubusercontent.com/u/64948717?v=4
669486760,incus,lxc/incus,Go,58,Powerful system container and virtual machine manager ,124,1915,https://avatars.githubusercontent.com/u/2301756?v=4
648967412,nunu,go-nunu/nunu,Go,61,A CLI tool for building Go applications.,110,1598,https://avatars.githubusercontent.com/u/135428577?v=4
