id,name,full_name,language,new stars,description,forks_count,stargazers_count,avatar_url
21289110,awesome-python,vinta/awesome-python,Python,785,"A curated list of awesome Python frameworks, libraries, software and resources",23381,171804,https://avatars.githubusercontent.com/u/652070?u=95b472a9a11b64ee0f74512ad918d762d42c213c&v=4
552661142,langchain,hwchase17/langchain,Python,2066,⚡ Building applications with LLMs through composability ⚡,6146,49672,https://avatars.githubusercontent.com/u/11986836?u=f4c4f21a82b2af6c9f91e1f1d99ea40062f7a101&v=4
634224458,gpt-engineer,AntonOsika/gpt-engineer,Python,23230,"Specify what you want it to build, the AI asks for clarification, and then builds it.",4672,29597,https://avatars.githubusercontent.com/u/4467025?u=c2388ec6b40a2c362b274741158ccafed41ce4c4&v=4
235860204,DeepSpeed,microsoft/DeepSpeed,Python,467,"DeepSpeed is a deep learning optimization library that makes distributed training and inference easy, efficient, and effective.",3159,26263,https://avatars.githubusercontent.com/u/6154722?v=4
204086862,streamlit,streamlit/streamlit,Python,202,Streamlit — A faster way to build and share data apps.,2254,25498,https://avatars.githubusercontent.com/u/45109972?v=4
247266215,EasyOCR,JaidedAI/EasyOCR,Python,225,"Ready-to-use OCR with 80+ supported languages and all popular writing scripts including Latin, Chinese, Arabic, Devanagari, Cyrillic and etc.",2625,18556,https://avatars.githubusercontent.com/u/61448029?v=4
566576114,ml-stable-diffusion,apple/ml-stable-diffusion,Python,752,Stable Diffusion with Core ML on Apple Silicon,653,13237,https://avatars.githubusercontent.com/u/10639145?v=4
330914717,ivy,unifyai/ivy,Python,147,Unified AI,4362,11320,https://avatars.githubusercontent.com/u/63879146?v=4
621799276,langchain-ChatGLM,imClumsyPanda/langchain-ChatGLM,Python,791,"langchain-ChatGLM, local knowledge based ChatGLM with langchain ｜ 基于本地知识库的 ChatGLM 问答",1436,9881,https://avatars.githubusercontent.com/u/5668498?v=4
650945129,audiocraft,facebookresearch/audiocraft,Python,1539,"Audiocraft is a library for audio processing and generation with deep learning. It features the state-of-the-art EnCodec audio compressor / tokenizer, along with MusicGen, a simple and controllable music generation LM with textual and melodic conditioning.",669,7713,https://avatars.githubusercontent.com/u/16943930?v=4
619825247,LMFlow,OptimalScale/LMFlow,Python,350,An Extensible Toolkit for Finetuning and Inference of Large Foundation Models. Large Model for All.,935,6074,https://avatars.githubusercontent.com/u/128913633?v=4
203999962,mmagic,open-mmlab/mmagic,Python,395,"OpenMMLab Multimodal Advanced, Generative, and Intelligent Creation Toolbox. Unlock the magic 🪄: Generative-AI (AIGC), easy-to-use APIs, awsome model zoo, diffusion models, for text-to-image generation, image/video restoration/enhancement, etc.",889,5272,https://avatars.githubusercontent.com/u/10245193?v=4
326038947,DefaultCreds-cheat-sheet,ihebski/DefaultCreds-cheat-sheet,Python,330,One place for all the default credentials to assist the Blue/Red teamers activities on finding devices with default password 🛡️,589,4389,https://avatars.githubusercontent.com/u/13177580?u=2d419724390b97cc7ce7ea6a76207b039bbedb85&v=4
629749002,OpenLLM,bentoml/OpenLLM,Python,2803,"An open platform for operating large language models (LLMs) in production. Fine-tune, serve, deploy, and monitor any LLMs with ease.",207,3608,https://avatars.githubusercontent.com/u/49176046?v=4
631580207,WizardLM,nlpxucan/WizardLM,Python,845,"Family of instruction-following LLMs powered by Evol-Instruct: WizardLM, WizardCoder",231,3165,https://avatars.githubusercontent.com/u/12636990?u=72c8357874bc1abed76e09d111025f9cde0c1806&v=4
618613272,h2ogpt,h2oai/h2ogpt,Python,640,"Join us at H2O.ai to make the world's best open-source GPT with document and image Q&A, 100% private chat, no data leaks, Apache 2.0 https://arxiv.org/pdf/2306.08161.pdf",245,2832,https://avatars.githubusercontent.com/u/1402695?v=4
652668626,ijepa,facebookresearch/ijepa,Python,1120,"Official codebase for I-JEPA, the Image-based Joint-Embedding Predictive Architecture. First outlined in the CVPR paper, ""Self-supervised learning from images with a joint-embedding predictive architecture.""",315,1820,https://avatars.githubusercontent.com/u/16943930?v=4
629142696,h2o-llmstudio,h2oai/h2o-llmstudio,Python,121,H2O LLM Studio - a framework and no-code GUI for fine-tuning LLMs,161,1794,https://avatars.githubusercontent.com/u/1402695?v=4
636372163,lit-gpt,Lightning-AI/lit-gpt,Python,251,"Implementation of Falcon, StableLM, Pythia, INCITE language models based on nanoGPT. Supports flash attention, Int8 and GPTQ 4bit quantization, LoRA and LLaMA-Adapter fine-tuning, pre-training. Apache 2.0-licensed.",100,1275,https://avatars.githubusercontent.com/u/58386951?v=4
637237273,simpleaichat,minimaxir/simpleaichat,Python,418,"Python package for easily interfacing with chat apps, with robust features and minimal code complexity.",37,975,https://avatars.githubusercontent.com/u/2179708?u=fa33a847bd260bee190d2994538a1ca32d467445&v=4
644280681,Macaw-LLM,lyuchenyang/Macaw-LLM,Python,355,"Macaw-LLM: Multi-Modal Language Modeling with Image, Video, Audio, and Text Integration",66,969,https://avatars.githubusercontent.com/u/73568459?u=460e3657a38ddce9300c77b6b1e4e17f7dabc584&v=4
646410686,LLaMA-Efficient-Tuning,hiyouga/LLaMA-Efficient-Tuning,Python,635,Fine-tuning LLaMA with PEFT (PT+SFT+RLHF with QLoRA),445,844,https://avatars.githubusercontent.com/u/16256802?u=9622ad4c25aa0a0bfc6dfac3db6bd0d7732c0f1e&v=4
652523482,LongMem,Victorwz/LongMem,Python,323,"Official implementation of our ArXiv paper ""Augmenting Language Models with Long-Term Memory"". ",98,518,https://avatars.githubusercontent.com/u/32738514?u=d4676e8feadaed2dc77390f2824d340303edc3af&v=4
643193835,sd-webui-stablesr,pkuliyi2015/sd-webui-stablesr,Python,159,StableSR for Stable Diffusion WebUI - Ultra High-quality Image Upscaler,22,469,https://avatars.githubusercontent.com/u/59076257?u=71402ca813fdb26834bc9a322020e7baf9c6133b&v=4
642830548,ask-multiple-pdfs,alejandro-ao/ask-multiple-pdfs,Python,167,A Langchain app that allows you to chat with multiple PDFs,145,349,https://avatars.githubusercontent.com/u/18406448?v=4
