id,name,full_name,language,new stars,description,forks_count,stargazers_count,avatar_url
2325298,linux,torvalds/linux,C,461,Linux kernel source tree,51024,160730,https://avatars.githubusercontent.com/u/1024025?v=4
13233158,obs-studio,obsproject/obs-studio,C,567,OBS Studio - Free and open source software for live streaming and screen recording,7342,52079,https://avatars.githubusercontent.com/u/7725691?v=4
612354784,llama.cpp,ggerganov/llama.cpp,C,469,Port of Facebook's LLaMA model in C/C++,6247,43979,https://avatars.githubusercontent.com/u/1991296?u=28314d364d7c28f8ec232fadb767970d3ad74e7b&v=4
14812739,libuv,libuv/libuv,C,48,Cross-platform asynchronous I/O,3497,22426,https://avatars.githubusercontent.com/u/4030929?v=4
184909163,yabai,koekeishiya/yabai,C,147,A tiling window manager for macOS based on binary space partitioning,595,18754,https://avatars.githubusercontent.com/u/6175959?u=e07b472bc4fa5500439c2c099a4736bcfd636769&v=4
45821540,openwrt,openwrt/openwrt,C,132,This repository is a mirror of https://git.openwrt.org/openwrt/openwrt.git It is for reference only and is not active for check-ins.  We will continue to accept Pull Requests here. They will be merged via staging trees then into openwrt.git.,9265,16681,https://avatars.githubusercontent.com/u/2528830?v=4
394318710,ExplorerPatcher,valinet/ExplorerPatcher,C,128,This project aims to enhance the working environment on Windows,794,16640,https://avatars.githubusercontent.com/u/6503598?u=25d850b7dcc57d2a488d83646fff7cca48cf7fc7&v=4
27737393,qmk_firmware,qmk/qmk_firmware,C,50,Open-source keyboard firmware for Atmel AVR and Arm USB families,34427,16149,https://avatars.githubusercontent.com/u/25358678?v=4
105627846,reactos,reactos/reactos,C,72,A free Windows-compatible Operating System,1669,13416,https://avatars.githubusercontent.com/u/1056157?v=4
32873313,systemd,systemd/systemd,C,65,The systemd System and Service Manager ,3490,11713,https://avatars.githubusercontent.com/u/1918868?v=4
3319040,DOOM,id-Software/DOOM,C,48,DOOM Open Source Release,1940,11253,https://avatars.githubusercontent.com/u/1395534?v=4
32921736,audacity,audacity/audacity,C,43,Audio Editor                                     ,2119,10426,https://avatars.githubusercontent.com/u/11648186?v=4
490465859,Flipper,UberGuidoZ/Flipper,C,128,Playground (and dump) of stuff I make or modify for the Flipper Zero,2527,9925,https://avatars.githubusercontent.com/u/57457139?u=3b283c3083a1fee457b897d7c8fda97b873e9807&v=4
284134871,flipperzero-firmware,flipperdevices/flipperzero-firmware,C,93,Flipper Zero firmware source code,2124,8951,https://avatars.githubusercontent.com/u/57576566?v=4
192805335,mimalloc,microsoft/mimalloc,C,33,mimalloc is a compact general purpose allocator with excellent performance.,702,8741,https://avatars.githubusercontent.com/u/6154722?v=4
88327406,xmrig,xmrig/xmrig,C,46,"RandomX, KawPow, CryptoNight and GhostRider unified CPU/GPU miner and RandomX benchmark",3498,7875,https://avatars.githubusercontent.com/u/27528955?u=555699fb82e7598ed7dd1f6e47302042b48a10c3&v=4
59676171,klipper,Klipper3d/klipper,C,34,Klipper is a 3d-printer firmware,4803,7756,https://avatars.githubusercontent.com/u/90982958?v=4
31791482,Windows-driver-samples,microsoft/Windows-driver-samples,C,19,This repo contains driver samples prepared for use with Microsoft Visual Studio and the Windows Driver Kit (WDK). It contains both Universal Windows Driver and desktop-only driver samples.,4865,6350,https://avatars.githubusercontent.com/u/6154722?v=4
579676275,Xtreme-Firmware,Flipper-XFW/Xtreme-Firmware,C,226,"The Dom amongst the Flipper Zero Firmware. Give your Flipper the power and freedom it is really craving. Let it show you its true form. Dont delay, switch to the one and only true Master today!    ",427,6082,https://avatars.githubusercontent.com/u/140006447?v=4
711090094,smallchat,antirez/smallchat,C,1058,A minimal programming example for a chat server,562,5529,https://avatars.githubusercontent.com/u/65632?v=4
440436833,dperf,baidu/dperf,C,66,dperf is a 100Gbps network load tester.,417,3831,https://avatars.githubusercontent.com/u/13245940?v=4
64324413,pcileech,ufrisk/pcileech,C,171,Direct Memory Access (DMA) Attack Software,600,3734,https://avatars.githubusercontent.com/u/18221464?u=ba42d975258d59bcdaf9efd329491bd9b818c1c2&v=4
472575717,Shipwright,HarbourMasters/Shipwright,C,19,,373,2241,https://avatars.githubusercontent.com/u/88675208?v=4
457124582,z03mmc,devbis/z03mmc,C,80,Xiaomi LYWSD03MMC Zigbee Firmware,18,358,https://avatars.githubusercontent.com/u/12081127?v=4
695650801,uv-k5-firmware-custom,egzumer/uv-k5-firmware-custom,C,29,A merge between https://github.com/OneOfEleven/uv-k5-firmware-custom and https://github.com/fagci/uv-k5-firmware-fagci-mod,26,135,https://avatars.githubusercontent.com/u/14902414?u=fff0620c7e61b9f71a2735684f1e2efadfda8a4a&v=4
