id,name,full_name,language,new stars,description,forks_count,stargazers_count,avatar_url
13491895,free-programming-books,EbookFoundation/free-programming-books,,5109,:books: Freely available programming books,59607,311000,https://avatars.githubusercontent.com/u/14127308?v=4
231283452,excalidraw,excalidraw/excalidraw,TypeScript,5658,Virtual whiteboard for sketching hand-drawn like diagrams,5988,67420,https://avatars.githubusercontent.com/u/59452120?v=4
585146387,ui,shadcn-ui/ui,TypeScript,7135,Beautifully designed components that you can copy and paste into your apps. Accessible. Customizable. Open Source.,2437,47665,https://avatars.githubusercontent.com/u/139895814?v=4
193215554,n8n,n8n-io/n8n,TypeScript,1571,Free and source-available fair-code licensed workflow automation tool. Easily automate tasks across different services.,4526,38171,https://avatars.githubusercontent.com/u/45487711?v=4
91573538,12306,testerSunshine/12306,Python,331,12306智能刷票，订票,9834,33326,https://avatars.githubusercontent.com/u/20162049?u=e84bd901b23092ebb2411aa370ec688573b2b191&v=4
255378816,htmx,bigskysoftware/htmx,JavaScript,3225,</> htmx - high power tools for HTML,1045,29314,https://avatars.githubusercontent.com/u/48798027?v=4
65750241,expo,expo/expo,TypeScript,1162,"An open-source platform for making universal native apps with React. Expo runs on Android, iOS, and the web.",4561,26728,https://avatars.githubusercontent.com/u/12504344?v=4
612640604,chatbot-ui,mckaywrigley/chatbot-ui,TypeScript,4267,The open-source AI chat app for everyone.,6548,24252,https://avatars.githubusercontent.com/u/29221284?u=98e2a4c4c09bdf1ddd625ea8e4417907ea29122a&v=4
436297812,memos,usememos/memos,Go,1855,"An open source, lightweight note-taking service. Easily capture and share your great thoughts.",1761,23991,https://avatars.githubusercontent.com/u/95764151?v=4
655099582,llm-course,mlabonne/llm-course,Jupyter Notebook,10292,Course to get into Large Language Models (LLMs) with roadmaps and Colab notebooks.,2245,23163,https://avatars.githubusercontent.com/u/81252890?u=f9898d723658a498328f14f717e1eeccb42ca675&v=4
338719962,spotube,KRTirtho/spotube,Dart,11151,🎧 Open source Spotify client that doesn't require Premium nor uses Electron! Available for both desktop & mobile!,821,21355,https://avatars.githubusercontent.com/u/61944859?u=912270e4ade246b3f8555e7a8db6a58efe6f4587&v=4
331293626,refine,refinedev/refine,TypeScript,3540,"A React Framework for building  internal tools, admin panels, dashboards & B2B apps with unmatched flexibility.",1584,21229,https://avatars.githubusercontent.com/u/104967037?v=4
419661684,data-engineering-zoomcamp,DataTalksClub/data-engineering-zoomcamp,Jupyter Notebook,4263,Free Data Engineering course! ,4393,20707,https://avatars.githubusercontent.com/u/72699292?v=4
175856326,everyone-can-use-english,xiaolai/everyone-can-use-english,TypeScript,6463,人人都能用英语,2888,17305,https://avatars.githubusercontent.com/u/152970?u=8b2fcedd53d6e46faf809b001cecf3f1981692fe&v=4
528313152,homepage,gethomepage/homepage,JavaScript,1530,A highly customizable homepage (or startpage / application dashboard) with Docker and service API integrations.,738,13529,https://avatars.githubusercontent.com/u/122929872?v=4
679506386,jan,janhq/jan,TypeScript,6116,Jan is an open source alternative to ChatGPT that runs 100% offline on your computer,461,8945,https://avatars.githubusercontent.com/u/102363196?v=4
716007267,copilot-gpt4-service,aaamoon/copilot-gpt4-service,Go,7642,Convert Github Copilot to ChatGPT,726,8144,https://avatars.githubusercontent.com/u/25700476?u=7839f8b06e7d7caa432795385690daafae110824&v=4
656099147,embedchain,embedchain/embedchain,Python,1018,The Open Source RAG framework,1293,7551,https://avatars.githubusercontent.com/u/137054526?v=4
600596928,LibreChat,danny-avila/LibreChat,TypeScript,3477,"Enhanced ChatGPT Clone: Features OpenAI, GPT-4 Vision, Mistral, Bing, Anthropic, OpenRouter, Google Gemini, AI model switching, message search, langchain, DALL-E-3, ChatGPT Plugins, OpenAI Functions, Secure Multi-User System, Presets, completely open-source for self-hosting. More features in development",1324,7548,https://avatars.githubusercontent.com/u/110412045?u=14f0d4fe10f128fae5985f573c7221cd13929e2e&v=4
710601088,crewAI,joaomdmoura/crewAI,Python,5361,"Framework for orchestrating role-playing, autonomous AI agents. By fostering collaborative intelligence, CrewAI empowers agents to work together seamlessly, tackling complex tasks.",730,6889,https://avatars.githubusercontent.com/u/667063?u=c0ea6956bba58ee8baabb6568f0374263ed96f1d&v=4
658364446,web-check,Lissy93/web-check,TypeScript,316,🕵️‍♂️ All-in-one OSINT tool for analysing any website,531,6697,https://avatars.githubusercontent.com/u/1862727?u=49343bef1ca0552bc411b2dc7c34591efdf433d1&v=4
165670309,router,TanStack/router,TypeScript,698,"🤖 Fully typesafe Router for React (and friends) w/ built-in caching, 1st class search-param APIs, client-side cache integration and isomorphic rendering.",385,6336,https://avatars.githubusercontent.com/u/72518640?v=4
587050620,dspy,stanfordnlp/dspy,Python,1341,DSPy: The framework for programming—not prompting—foundation models,379,5932,https://avatars.githubusercontent.com/u/3046006?v=4
673596675,FlagEmbedding,FlagOpen/FlagEmbedding,Python,940,Dense Retrieval and Retrieval-augmented LLMs,212,3366,https://avatars.githubusercontent.com/u/114467038?v=4
736572328,1brc,gunnarmorling/1brc,Java,2412,1️⃣🐝🏎️ The One Billion Row Challenge -- A fun exploration of how quickly 1B rows from a text file can be aggregated with Java,1086,3088,https://avatars.githubusercontent.com/u/28612?u=004bb13831ab044d93c3124af75dc4f36224809b&v=4
