id,name,full_name,language,new stars,description,forks_count,stargazers_count,avatar_url
2325298,linux,torvalds/linux,C,2226,Linux kernel source tree,52151,165440,https://avatars.githubusercontent.com/u/1024025?v=4
156018,redis,redis/redis,C,497,"Redis is an in-memory database that persists on disk. The data model is key-value, but many different kind of values are supported: Strings, Lists, Sets, Sorted Sets, Hashes, Streams, HyperLogLogs, Bitmaps.",23238,63290,https://avatars.githubusercontent.com/u/1529926?v=4
569041,curl,curl/curl,C,488,"A command line tool and library for transferring data with URL syntax, supporting DICT, FILE, FTP, FTPS, GOPHER, GOPHERS, HTTP, HTTPS, IMAP, IMAPS, LDAP, LDAPS, MQTT, POP3, POP3S, RTMP, RTMPS, RTSP, SCP, SFTP, SMB, SMBS, SMTP, SMTPS, TELNET, TFTP, WS and WSS. libcurl offers a myriad of powerful features",6220,33198,https://avatars.githubusercontent.com/u/16928085?v=4
36836475,tmux,tmux/tmux,C,450,tmux source code,2047,31918,https://avatars.githubusercontent.com/u/12054114?v=4
2810292,rufus,pbatard/rufus,C,484,The Reliable USB Formatting Utility,2496,26090,https://avatars.githubusercontent.com/u/1206968?u=ed1be5451352656cffecc840d661bb793c3bad05&v=4
214011414,WindTerm,kingToolbox/WindTerm,C,945,A professional cross-platform SSH/Sftp/Shell/Telnet/Serial terminal.,1511,19208,https://avatars.githubusercontent.com/u/51009775?v=4
15337142,micropython,micropython/micropython,C,210,MicroPython - a lean and efficient Python implementation for microcontrollers and constrained systems,7149,17920,https://avatars.githubusercontent.com/u/6298560?v=4
470579591,unleashed-firmware,DarkFlippers/unleashed-firmware,C,883,Flipper Zero Unleashed Firmware,1254,13966,https://avatars.githubusercontent.com/u/115378555?v=4
727213319,my-tv,lizongying/my-tv,C,13359,我的电视 电视直播软件，安装即可使用,1311,13619,https://avatars.githubusercontent.com/u/16871545?u=8c1965dc6e0c9f6c1e2a688bdc54c05c76019d42&v=4
5254557,skynet,cloudwu/skynet,C,164,A lightweight online game framework,4103,12571,https://avatars.githubusercontent.com/u/729648?v=4
1979797,FreeRDP,FreeRDP/FreeRDP,C,240,FreeRDP is a free remote desktop protocol library and clients,25046,9780,https://avatars.githubusercontent.com/u/663376?v=4
40504480,xv6-public,mit-pdos/xv6-public,C,95,xv6 OS,3685,7166,https://avatars.githubusercontent.com/u/12404246?v=4
288082909,htop,htop-dev/htop,C,123,htop - an interactive process viewer,376,5695,https://avatars.githubusercontent.com/u/69567116?v=4
157590294,Telegram-iOS,TelegramMessenger/Telegram-iOS,C,86,Telegram-iOS,1427,5113,https://avatars.githubusercontent.com/u/22377696?v=4
2359378,zlib,madler/zlib,C,179,A massively spiffy yet delicately unobtrusive compression library.,2346,5108,https://avatars.githubusercontent.com/u/240717?v=4
27788471,mgba,mgba-emu/mgba,C,116,mGBA Game Boy Advance Emulator,697,5073,https://avatars.githubusercontent.com/u/10085927?v=4
6687936,mbedtls,Mbed-TLS/mbedtls,C,79,"An open source, portable, easy to use, readable and flexible TLS library, and reference implementation of the PSA Cryptography API. Releases are on a varying cadence, typically around 3 - 6 months between releases.",2435,4747,https://avatars.githubusercontent.com/u/97226525?v=4
28058713,memreduct,henrypp/memreduct,C,403,Lightweight real-time memory management application to monitor and clean system memory on your computer.,402,4603,https://avatars.githubusercontent.com/u/3902025?u=b0ece819da48142eab03300731168783d7a2307b&v=4
189044704,AFLplusplus,AFLplusplus/AFLplusplus,C,222,"The fuzzer afl++ is afl with community patches, qemu 5.1 upgrade, collision-free coverage, enhanced laf-intel & redqueen, AFLfast++ power schedules, MOpt mutators, unicorn_mode, and a lot more!",918,4429,https://avatars.githubusercontent.com/u/62360046?v=4
203759896,immortalwrt,immortalwrt/immortalwrt,C,421,An opensource OpenWrt variant for mainland China users.,1351,3889,https://avatars.githubusercontent.com/u/53193414?v=4
395684015,SketchyBar,FelixKratz/SketchyBar,C,293,A highly customizable macOS status bar replacement,66,3864,https://avatars.githubusercontent.com/u/22680421?u=5bb6fea6f702578f0c024bfedf696558672e2add&v=4
26537135,u-boot,u-boot/u-boot,C,116,"""Das U-Boot"" Source Tree",3389,3426,https://avatars.githubusercontent.com/u/9681997?v=4
270692521,zmk,zmkfirmware/zmk,C,77,ZMK Firmware Repository,2237,2144,https://avatars.githubusercontent.com/u/66629601?v=4
31673071,can-utils,linux-can/can-utils,C,40,Linux-CAN / SocketCAN user space applications,680,2135,https://avatars.githubusercontent.com/u/11317980?v=4
694486730,m5stick-nemo,n0xa/m5stick-nemo,C,127,M5 Stick C firmware for high-tech pranks,57,325,https://avatars.githubusercontent.com/u/23286114?u=159b06a225436b696bf553288041d1670435ca4c&v=4
