id,name,full_name,language,new stars,description,forks_count,stargazers_count,avatar_url
54346799,public-apis,public-apis/public-apis,Python,5007,A collective list of free APIs,31368,279407,https://avatars.githubusercontent.com/u/51121562?v=4
83222441,system-design-primer,donnemartin/system-design-primer,Python,4540,Learn how to design large-scale systems. Prep for the system design interview.  Includes Anki flashcards.,42760,246568,https://avatars.githubusercontent.com/u/5458997?u=f1007b583e55e7ccfb6ccf0e200051156112dd9b&v=4
12888993,core,home-assistant/core,Python,1852,:house_with_garden: Open source home automation that puts local control and privacy first.,27377,67326,https://avatars.githubusercontent.com/u/13844975?v=4
212639071,devops-exercises,bregman-arie/devops-exercises,Python,1516,"Linux, Jenkins, AWS, SRE, Prometheus, Docker, Python, Ansible, Git, Kubernetes, Terraform, OpenStack, SQL, NoSQL, Azure, GCP, DNS, Elastic, Network, Virtualization. DevOps Interview Questions",13410,61811,https://avatars.githubusercontent.com/u/10349437?u=bb7c3c533587d7cb2e3dd336e0f8a0d40544e5f5&v=4
125266328,black,psf/black,Python,525,The uncompromising Python code formatter,2399,36303,https://avatars.githubusercontent.com/u/50630501?v=4
237791077,diagrams,mingrammer/diagrams,Python,1751,:art: Diagram as Code for prototyping cloud system architectures,2221,34025,https://avatars.githubusercontent.com/u/6178510?u=f9940c5492bc7ede04a9f2ea7df3aae973e45165&v=4
349321229,GFPGAN,TencentARC/GFPGAN,Python,637,GFPGAN aims at developing Practical Algorithms for Real-world Face Restoration.,5732,33983,https://avatars.githubusercontent.com/u/83739826?v=4
91573538,12306,testerSunshine/12306,Python,453,12306智能刷票，订票,9857,33475,https://avatars.githubusercontent.com/u/20162049?u=e84bd901b23092ebb2411aa370ec688573b2b191&v=4
626805178,dify,langgenius/dify,Python,1840,"An Open-Source Assistants API and GPTs alternative. Dify.AI is an LLM application development platform. It integrates the concepts of Backend as a Service and LLMOps, covering the core tech stack required for building generative AI-native applications, including a built-in RAG engine.",2073,15552,https://avatars.githubusercontent.com/u/127165244?v=4
52796596,netbox,netbox-community/netbox,Python,718,The premier source of truth powering network automation. Open source under Apache 2. Public demo: https://demo.netbox.dev,2402,14442,https://avatars.githubusercontent.com/u/44905828?v=4
629102662,LLaVA,haotian-liu/LLaVA,Python,1444,[NeurIPS'23 Oral] Visual Instruction Tuning (LLaVA) built towards GPT-4V level capabilities and beyond.,1472,13825,https://avatars.githubusercontent.com/u/6631389?u=0eaf5d6e8b2d067f89ef93f4b1c4e3ae049dc461&v=4
682604510,codellama,facebookresearch/codellama,Python,1455,Inference code for CodeLlama models,1397,13400,https://avatars.githubusercontent.com/u/16943930?v=4
743230067,GPT-SoVITS,RVC-Boss/GPT-SoVITS,Python,10903,1 min voice data can also be used to train a good TTS model! (few shot voice cloning),1133,10900,https://avatars.githubusercontent.com/u/129054828?v=4
292374787,ml-engineering,stas00/ml-engineering,Python,3972,Machine Learning Engineering Open Book,522,8336,https://avatars.githubusercontent.com/u/10676103?u=8dabbce5199b04f649e1c7cced4c59a2ae173261&v=4
498449014,nerfstudio,nerfstudio-project/nerfstudio,Python,573,A collaboration friendly studio for NeRFs,1032,8008,https://avatars.githubusercontent.com/u/106621677?v=4
710601088,crewAI,joaomdmoura/crewAI,Python,2991,"Framework for orchestrating role-playing, autonomous AI agents. By fostering collaborative intelligence, CrewAI empowers agents to work together seamlessly, tackling complex tasks.",800,7473,https://avatars.githubusercontent.com/u/667063?u=c0ea6956bba58ee8baabb6568f0374263ed96f1d&v=4
587050620,dspy,stanfordnlp/dspy,Python,1651,DSPy: The framework for programming—not prompting—foundation models,412,6392,https://avatars.githubusercontent.com/u/3046006?v=4
640317662,vanna,vanna-ai/vanna,Python,4687,🤖 Chat with your SQL database 📊. Accurate Text-to-SQL Generation via LLMs using RAG 🔄.,302,5252,https://avatars.githubusercontent.com/u/132533812?v=4
599293758,azure-search-openai-demo,Azure-Samples/azure-search-openai-demo,Python,240,"A sample app for the Retrieval-Augmented Generation pattern running in Azure, using Azure AI Search for retrieval and Azure OpenAI large language models  to power ChatGPT-style and Q&A experiences.",2919,4771,https://avatars.githubusercontent.com/u/1844662?v=4
738356406,QAnything,netease-youdao/QAnything,Python,3466,Question and Answer based on Anything.,331,4067,https://avatars.githubusercontent.com/u/3909232?u=7ce4aa36eb20b8f2076d25a98aead8932d76ef36&v=4
673596675,FlagEmbedding,FlagOpen/FlagEmbedding,Python,880,Dense Retrieval and Retrieval-augmented LLMs,224,3477,https://avatars.githubusercontent.com/u/114467038?v=4
676672661,langgraph,langchain-ai/langgraph,Python,899,,121,1270,https://avatars.githubusercontent.com/u/126733545?v=4
692694122,V2ray-Configs,barry-far/V2ray-Configs,Python,576,"🛰️✨ Free V2ray Configs , Updating Every 10 minutes.",82,802,https://avatars.githubusercontent.com/u/143993892?u=ca3c39c843658828074cf4a9e9dc42394c85a636&v=4
675859069,Applio,IAHispano/Applio,Python,301,"Ultimate voice cloning tool, meticulously optimized for unrivaled power, modularity, and user-friendly experience.",100,672,https://avatars.githubusercontent.com/u/133545040?v=4
733465661,crewAI-examples,joaomdmoura/crewAI-examples,Python,429,,187,658,https://avatars.githubusercontent.com/u/667063?u=c0ea6956bba58ee8baabb6568f0374263ed96f1d&v=4
