id,name,full_name,language,new stars,description,forks_count,stargazers_count,avatar_url
2325298,linux,torvalds/linux,C,574,Linux kernel source tree,38958,118427,https://avatars.githubusercontent.com/u/1024025?v=4
246335987,Ventoy,ventoy/Ventoy,C,801,A new bootable USB solution.,1952,26744,https://avatars.githubusercontent.com/u/59477474?u=16f38c14b69580f87f4717b71c0e5e85e9559cb1&v=4
36836475,tmux,tmux/tmux,C,122,tmux source code,1571,22584,https://avatars.githubusercontent.com/u/12054114?v=4
62156403,zju-icicles,QSCTech/zju-icicles,C,67,æµ™æ±Ÿå¤§å­¦è¯¾ç¨‹æ”»ç•¥å…±äº«è®¡åˆ’,6729,22423,https://avatars.githubusercontent.com/u/4727983?v=4
1357796,emscripten,emscripten-core/emscripten,C,32,Emscripten: An LLVM-to-WebAssembly Compiler,2654,21150,https://avatars.githubusercontent.com/u/46011144?v=4
20159867,stb,nothings/stb,C,57,stb single-file public domain libraries for C/C++,5832,16687,https://avatars.githubusercontent.com/u/7525026?u=a23ba3a549fff291e35446cb32c8979bd29be6c9&v=4
27737393,qmk_firmware,qmk/qmk_firmware,C,61,Open-source keyboard firmware for Atmel AVR and Arm USB families,21742,10540,https://avatars.githubusercontent.com/u/25358678?v=4
63477515,C,TheAlgorithms/C,C,211,"Collection of various algorithms in mathematics, machine learning, computer science, physics, etc implemented in C for educational purposes.",2758,10383,https://avatars.githubusercontent.com/u/20487725?v=4
32873313,systemd,systemd/systemd,C,30,The systemd System and Service Manager ,2691,8470,https://avatars.githubusercontent.com/u/1918868?v=4
21294600,redis-3.0-annotated,huangz1990/redis-3.0-annotated,C,133,å¸¦æœ‰è¯¦ç»†æ³¨é‡Šçš„ Redis 3.0 ä»£ç ï¼ˆannotated Redis 3.0 source codeï¼‰ã€‚,3617,7983,https://avatars.githubusercontent.com/u/536854?u=df287a77d09ee45be97a50dc809106dfb567877e&v=4
65899476,esp-idf,espressif/esp-idf,C,50,Espressif IoT Development Framework. Official development framework for ESP32.,4533,7100,https://avatars.githubusercontent.com/u/9460735?v=4
16734696,janus-gateway,meetecho/janus-gateway,C,12,Janus WebRTC Server,1965,5872,https://avatars.githubusercontent.com/u/4520545?v=4
689344,RetroArch,libretro/RetroArch,C,42,"Cross-platform, sophisticated frontend for the libretro API. Licensed GPLv3.",1298,5823,https://avatars.githubusercontent.com/u/1812827?v=4
2359378,zlib,madler/zlib,C,17,A massively spiffy yet delicately unobtrusive compression library.,1690,3094,https://avatars.githubusercontent.com/u/240717?v=4
131710328,hekate,CTCaer/hekate,C,87,hekate - A GUI based Nintendo Switch Bootloader,347,2958,https://avatars.githubusercontent.com/u/3665130?v=4
146397768,libhv,ithewei/libhv,C,101,ğŸ”¥ æ¯”libeventã€libuvæ›´æ˜“ç”¨çš„å›½äº§ç½‘ç»œåº“ã€‚A c/c++ network library for developing TCP/UDP/SSL/HTTP/WebSocket client/server.,505,2854,https://avatars.githubusercontent.com/u/26049660?u=2252b64651629ba953139d461c0fd4658ed1706e&v=4
130012942,xHook,iqiyi/xHook,C,52,ğŸ”¥ A PLT hook library for Android native ELF.,543,2752,https://avatars.githubusercontent.com/u/32627384?v=4
34807561,nanopb,nanopb/nanopb,C,16,Protocol Buffers with small code size,564,2556,https://avatars.githubusercontent.com/u/12173937?v=4
198869255,AFL,google/AFL,C,27,american fuzzy lop - a security-oriented fuzzer,373,2211,https://avatars.githubusercontent.com/u/1342004?v=4
117704656,ostep-projects,remzi-arpacidusseau/ostep-projects,C,25,Projects for an undergraduate OS course,555,1787,https://avatars.githubusercontent.com/u/13019127?u=55c39f686682915111b1675a26f7dbffd7e8d6a3&v=4
207354223,FreeRTOS-Kernel,FreeRTOS/FreeRTOS-Kernel,C,13,"FreeRTOS kernel files only, submoduled into https://github.com/FreeRTOS/FreeRTOS and various other repos.",417,725,https://avatars.githubusercontent.com/u/54647343?v=4
403204180,OpenHeat,peng-zhihui/OpenHeat,C,39,,23,250,https://avatars.githubusercontent.com/u/12994887?u=6bfec84cb512892557cfed7fd7c52b0b0f41f95b&v=4
51990771,CMSIS_5,ARM-software/CMSIS_5,C,15,CMSIS Version 5 Development Repository,816,192,https://avatars.githubusercontent.com/u/5690313?v=4
384554015,redpill-lkm,RedPill-TTG/redpill-lkm,C,16,Linux kernel module for RedPill,37,133,https://avatars.githubusercontent.com/u/87200368?v=4
383940088,FNF-PsychEngine,ShadowMario/FNF-PsychEngine,C,12,Engine originally used on Mind Games mod,45,57,https://avatars.githubusercontent.com/u/44785097?u=d1dbdd299c562c87f6328009758bb8d901ee96c7&v=4
