id,name,full_name,language,new stars,description,forks_count,stargazers_count,avatar_url
28457823,freeCodeCamp,freeCodeCamp/freeCodeCamp,JavaScript,1407,freeCodeCamp.org's open-source codebase and curriculum. Learn to code for free.,26621,331042,https://avatars.githubusercontent.com/u/9892522?v=4
126577260,javascript-algorithms,trekhleb/javascript-algorithms,JavaScript,1480,📝 Algorithms and data structures implemented in JavaScript with explanations and links to further readings,19744,120235,https://avatars.githubusercontent.com/u/3000285?u=1e62782f227030b78b7aa78cbbcab5f8a24e658a&v=4
112507086,30-seconds-of-code,30-seconds/30-seconds-of-code,JavaScript,1630,Short JavaScript code snippets for all your development needs,9065,85670,https://avatars.githubusercontent.com/u/43479428?v=4
576201,three.js,mrdoob/three.js,JavaScript,195,JavaScript 3D Library.,29147,74387,https://avatars.githubusercontent.com/u/97088?u=f8156684506d77fd89ba332dc677b07352a0b790&v=4
23083156,material-ui,mui-org/material-ui,JavaScript,618,"Material-UI is a simple and customizable component library to build faster, beautiful, and more accessible React applications. Follow your own design system, or start with Material Design.",24068,71559,https://avatars.githubusercontent.com/u/33663932?v=4
62607227,tech-interview-handbook,yangshun/tech-interview-handbook,JavaScript,665,💯 Curated interview preparation materials for busy engineers,8159,58808,https://avatars.githubusercontent.com/u/1315101?u=33af1f8b8cccdf79419fc299df51635c6b4c93d1&v=4
46629305,hacker-scripts,NARKOZ/hacker-scripts,JavaScript,120,Based on a true story,6508,42076,https://avatars.githubusercontent.com/u/253398?u=6a7aa5de8f27806c50f18e50e6cd203066bfa528&v=4
157616880,iptv,iptv-org/iptv,JavaScript,620,Collection of publicly available IPTV channels from all over the world,3349,40020,https://avatars.githubusercontent.com/u/55937028?v=4
71995937,nuxt.js,nuxt/nuxt.js,JavaScript,183,The Intuitive Vue Framework,3083,37987,https://avatars.githubusercontent.com/u/23360933?v=4
110058856,awesome-cheatsheets,LeCoupa/awesome-cheatsheets,JavaScript,1322,"👩‍💻👨‍💻 Awesome cheatsheets for popular programming languages, frameworks and development tools. They include everything you should know in one single file.",3797,23181,https://avatars.githubusercontent.com/u/1658644?u=215b66e32216cb43bfd94a690eb8a0f96518bbd7&v=4
92443980,drawio-desktop,jgraph/drawio-desktop,JavaScript,466,Official electron build of diagrams.net,2384,21777,https://avatars.githubusercontent.com/u/1769238?v=4
712530,fabric.js,fabricjs/fabric.js,JavaScript,140,"Javascript Canvas Library, SVG-to-Canvas (& canvas-to-SVG) Parser",2848,19864,https://avatars.githubusercontent.com/u/24580162?v=4
56899284,insomnia,Kong/insomnia,JavaScript,120,"The open-source, cross-platform API client for GraphQL, REST, and gRPC.",1107,17806,https://avatars.githubusercontent.com/u/962416?v=4
44150497,remote-jobs,remoteintech/remote-jobs,JavaScript,51,A list of semi to fully remote-friendly companies in tech.,1774,17325,https://avatars.githubusercontent.com/u/31714327?v=4
3422939,dropzone,dropzone/dropzone,JavaScript,29,Dropzone is an easy to use drag'n'drop library. It supports image previews and shows nice progress bars.,3264,15921,https://avatars.githubusercontent.com/u/2369529?v=4
71487058,react-table,tannerlinsley/react-table,JavaScript,134,⚛️ Hooks for building fast and extendable tables and datagrids for React,2073,15079,https://avatars.githubusercontent.com/u/5580297?u=698226e4ff99a96ceb9e8d78eb797733b6aaf03b&v=4
306977633,AI-Expert-Roadmap,AMAI-GmbH/AI-Expert-Roadmap,JavaScript,752,Roadmap to becoming an Artificial Intelligence Expert in 2021,1267,14730,https://avatars.githubusercontent.com/u/54247845?v=4
352933140,ToolJet,ToolJet/ToolJet,JavaScript,209,An open-source no-code platform for building and deploying internal tools 🚀,182,3497,https://avatars.githubusercontent.com/u/82193554?v=4
252325835,youtube-dl-gui,jely2002/youtube-dl-gui,JavaScript,257,A cross-platform GUI for youtube-dl made in Electron and node.js,119,2314,https://avatars.githubusercontent.com/u/20154900?u=a788d92db1064b1e370d5b29de1fe650c614c849&v=4
393666962,my-room-in-3d,brunosimon/my-room-in-3d,JavaScript,311,,76,1063,https://avatars.githubusercontent.com/u/5439991?u=d7f9a046776f0960769c8d90ca8ced4d896c8e6a&v=4
186841818,evobot,eritislami/evobot,JavaScript,335,🤖 EvoBot is a Discord Music Bot built with discord.js & uses Command Handler from discordjs.guide,1358,975,https://avatars.githubusercontent.com/u/22680785?u=889b52ff43b3dd6569785b0a04ebc78434f42832&v=4
268786553,Discord-MusicBot,SudhanPlayz/Discord-MusicBot,JavaScript,323,"An advanced discord music bot, supports Spotify, Soundcloud, YouTube with Shuffling, Volume Control and Web Dashboard with Slash Commands support!",947,862,https://avatars.githubusercontent.com/u/55418697?u=447f16938e54ab55afd5b3fa649d26bd913fbfe9&v=4
403928729,react-native-universal-monorepo,mmazzarolo/react-native-universal-monorepo,JavaScript,113,"React Native boilerplate supporting multiple platforms: Android, iOS, macOS, Windows, web, browser extensions, Electron.",26,562,https://avatars.githubusercontent.com/u/9536354?u=70d06bb078c7c50b0f291d1cf308d29429d56faa&v=4
398323382,discord-music-bot,Androz2091/discord-music-bot,JavaScript,98,The perfect music bot for your Discord server! 🤘,94,147,https://avatars.githubusercontent.com/u/42497995?u=f14f5c85893c91a5e1c5c98ba9addb4404a16c93&v=4
395282232,frontend_base_dapp,HashLips/frontend_base_dapp,JavaScript,16,Base project for a dapp,36,48,https://avatars.githubusercontent.com/u/88177839?u=b7a7758dd9e420a52c3083fcf6f1456132e42fc2&v=4
