id,name,full_name,language,new stars,description,forks_count,stargazers_count,avatar_url
10270250,react,facebook/react,JavaScript,558,"A declarative, efficient, and flexible JavaScript library for building user interfaces.",42477,204135,https://avatars.githubusercontent.com/u/69631?v=4
112507086,30-seconds-of-code,30-seconds/30-seconds-of-code,JavaScript,385,Short JavaScript code snippets for all your development needs,11241,108818,https://avatars.githubusercontent.com/u/43479428?v=4
943149,d3,d3/d3,JavaScript,129,"Bring data to life with SVG, Canvas and HTML. :bar_chart::chart_with_upwards_trend::tada:",23298,104736,https://avatars.githubusercontent.com/u/1562726?v=4
27193779,node,nodejs/node,JavaScript,193,Node.js JavaScript runtime :sparkles::turtle::rocket::sparkles:,25502,94018,https://avatars.githubusercontent.com/u/9950313?v=4
157616880,iptv,iptv-org/iptv,JavaScript,440,Collection of publicly available IPTV channels from all over the world,82,63128,https://avatars.githubusercontent.com/u/55937028?v=4
67186968,chinese-poetry,chinese-poetry/chinese-poetry,JavaScript,146,"The most comprehensive database of Chinese poetry ğŸ§¶æœ€å…¨ä¸­åå¤è¯—è¯æ•°æ®åº“,  å”å®‹ä¸¤æœè¿‘ä¸€ä¸‡å››åƒå¤è¯—äºº,  æ¥è¿‘5.5ä¸‡é¦–å”è¯—åŠ 26ä¸‡å®‹è¯—.  ä¸¤å®‹æ—¶æœŸ1564ä½è¯äººï¼Œ21050é¦–è¯ã€‚",8029,39074,https://avatars.githubusercontent.com/u/30764933?v=4
7530570,appium,appium/appium,JavaScript,50,Cross-platform automation framework for all kinds of your apps built on top of W3C WebDriver protocol,5822,16102,https://avatars.githubusercontent.com/u/3221291?v=4
42009758,metamask-extension,MetaMask/metamask-extension,JavaScript,57,:globe_with_meridians: :electric_plug: The MetaMask browser extension enables browsing Ethereum blockchain enabled websites,3753,9513,https://avatars.githubusercontent.com/u/11744586?v=4
105963253,react.dev,reactjs/react.dev,TypeScript,115,The React documentation website,6963,8860,https://avatars.githubusercontent.com/u/6412038?v=4
359379971,Clash-for-Windows_Chinese,ender-zhao/Clash-for-Windows_Chinese,JavaScript,225,"clash for windowsæ±‰åŒ–ç‰ˆ. æä¾›clash for windowsçš„æ±‰åŒ–ç‰ˆ, æ±‰åŒ–è¡¥ä¸åŠæ±‰åŒ–ç‰ˆå®‰è£…ç¨‹åº",542,6241,https://avatars.githubusercontent.com/u/77391690?v=4
235468657,pipedream,PipedreamHQ/pipedream,JavaScript,60,"Connect APIs, remarkably fast.  Free for developers.",4318,5761,https://avatars.githubusercontent.com/u/43791938?v=4
405139301,LinkFree,EddieHubCommunity/LinkFree,JavaScript,87,"Connect to your audience with a single link. Showcase the content you create and your projects in one place. Make it easier for people to find, follow and subscribe.",2409,3131,https://avatars.githubusercontent.com/u/66388388?v=4
431334391,postcat,Postcatlab/postcat,JavaScript,919,Postcat æ˜¯ä¸€ä¸ªå¯æ‰©å±•çš„ API å·¥å…·å¹³å°ã€‚é›†åˆåŸºç¡€çš„ API ç®¡ç†å’Œæµ‹è¯•åŠŸèƒ½ï¼Œå¹¶ä¸”å¯ä»¥é€šè¿‡æ’ä»¶ç®€åŒ–ä½ çš„ API å¼€å‘å·¥ä½œï¼Œè®©ä½ å¯ä»¥æ›´å¿«æ›´å¥½åœ°åˆ›å»º APIã€‚An extensible API tool.,420,2721,https://avatars.githubusercontent.com/u/124772769?v=4
609002853,ChatGPT-Telegram-Workers,TBXark/ChatGPT-Telegram-Workers,JavaScript,297,Deploy your own Telegram ChatGPT bot on Cloudflare Workers with ease.,435,1978,https://avatars.githubusercontent.com/u/9513891?u=e20143a9b6ed4953ba63a7bc994a03a90bcb8651&v=4
609073815,ChatGPTAPIFree,ayaka14732/ChatGPTAPIFree,JavaScript,1044,A simple and open-source proxy API that allows you to access OpenAI's ChatGPT API for free!,176,1322,https://avatars.githubusercontent.com/u/68557794?u=5145e0cf1341a52f8a22b1a5c58c50e93c764f80&v=4
607730203,project_3D_developer_portfolio,adrianhajdin/project_3D_developer_portfolio,JavaScript,338,,267,1156,https://avatars.githubusercontent.com/u/24898559?u=fd2baba143bcb62cc0f2bc646ec33c2ba9ef013e&v=4
575042276,vscode-chatgpt,gencay/vscode-chatgpt,TypeScript,231,Your best AI pair programmer - open source only,189,1115,https://avatars.githubusercontent.com/u/1168485?u=b60750d321be66e1e513258619672f27e91ed84e&v=4
610110374,openai-scf-proxy,Ice-Hazymoon/openai-scf-proxy,JavaScript,258,ä½¿ç”¨è…¾è®¯äº‘å‡½æ•°ä¸€åˆ†é’Ÿæ­å»º OpenAI å…ç¿»å¢™ä»£ç†,113,1049,https://avatars.githubusercontent.com/u/25239977?u=75fefa69c71902644b2658b0b137d8c303627747&v=4
576869790,ChatGPT-ToolBox,bigemon/ChatGPT-ToolBox,JavaScript,141,ç”±ChatGPTè´Ÿè´£ç¼–å†™çš„ChatGPTå·¥å…·ç®±ã€‚ ,65,893,https://avatars.githubusercontent.com/u/3683548?v=4
602478874,chatgpt,dirk1983/chatgpt,JavaScript,223,GPT-4å·²å‘å¸ƒï¼Œæ¥å£å¼€æ”¾åæœ¬é¡¹ç›®å°†ç¬¬ä¸€æ—¶é—´é€‚é…å¹¶å¼€æºã€‚æƒ³åšç‚¹äº‹æƒ…çš„åˆ›ä¸šè€…æ¬¢è¿åŠ ç¾¤å‚ä¸è®¨è®ºï¼æœ¬é¡¹ç›®æ˜¯æœ€æ˜“éƒ¨ç½²çš„ChatGPTç¯å¢ƒã€‚PHPç‰ˆè°ƒç”¨OpenAIæœ€æ–°æ¥å£å’Œæ¨¡å‹gpt-3.5-turboè¿›è¡Œé—®ç­”çš„Demoï¼Œé‡‡ç”¨Streamæµæ¨¡å¼é€šä¿¡ï¼Œä¸€è¾¹ç”Ÿæˆä¸€è¾¹è¾“å‡ºï¼Œå“åº”é€Ÿåº¦è¶…è¿‡å®˜ç½‘ã€‚å‰ç«¯é‡‡ç”¨JSçš„EventSourceï¼Œæ”¯æŒMarkdownæ ¼å¼è§£æï¼Œä»£ç æœ‰ç€è‰²å¤„ç†ã€‚é¡µé¢UIç®€æ´ï¼Œæ”¯æŒä¸Šä¸‹æ–‡è¿ç»­ä¼šè¯ã€‚æºç åªæœ‰ä¸¤ä¸‰ä¸ªæ–‡ä»¶ï¼Œæ²¡ç”¨ä»»ä½•æ¡†æ¶ï¼Œæ”¯æŒæ‰€æœ‰PHPç‰ˆæœ¬ã€‚åªéœ€è¦ä¿®æ”¹stream.phpä¸­çš„API_KEYå³å¯ä½¿ç”¨ï¼Œä¹Ÿå¯è®©æµè§ˆè€…ä½¿ç”¨è‡ªå®šä¹‰API_KEYã€‚,169,609,https://avatars.githubusercontent.com/u/5563148?u=493c3395dce05bcc19f52e86a139d6f2dcdd9e8a&v=4
607438804,textSQL,caesarHQ/textSQL,JavaScript,252,,60,572,https://avatars.githubusercontent.com/u/118403961?v=4
609508868,chatgpt-mirror,yuezk/chatgpt-mirror,JavaScript,114,A mirror of ChatGPT based on the gpt-3.5-turbo model.,138,537,https://avatars.githubusercontent.com/u/3297602?u=360d8b44ac5874419b7111a08146ec1145948888&v=4
599735720,3x-ui,MHSanaei/3x-ui,JavaScript,86,Xray panel supporting multi-protocol multi-user expire day & traffic & ip limit (Vmess & Vless & Trojan),71,280,https://avatars.githubusercontent.com/u/33454419?v=4
580600129,TavernAI,TavernAI/TavernAI,JavaScript,61,"Atmospheric adventure chat for AI language models (KoboldAI, NovelAI, Pygmalion, OpenAI chatgpt)",60,272,https://avatars.githubusercontent.com/u/121140100?u=d33337d4e28e6c4820e0773c2ab79f82e073ecc3&v=4
602198195,posex,hnmr293/posex,JavaScript,50,Posex - Estimated Image Generator for Pose2Image,23,223,https://avatars.githubusercontent.com/u/120772120?v=4
