id,name,full_name,language,new stars,description,forks_count,stargazers_count,avatar_url
527591471,stable-diffusion-webui,AUTOMATIC1111/stable-diffusion-webui,Python,3016,Stable Diffusion web UI,8764,47376,https://avatars.githubusercontent.com/u/20920490?u=8bdc7c9401f507e51b55e558baa8184d4ed30c7d&v=4
71220757,PayloadsAllTheThings,swisskyrepo/PayloadsAllTheThings,Python,360,A list of useful payloads and bypass for Web Application Security and Pentest/CTF,12208,46081,https://avatars.githubusercontent.com/u/12152583?u=e368c891b81d41b1ce12825f52049e5eb146d401&v=4
237791077,diagrams,mingrammer/diagrams,Python,349,:art: Diagram as Code for prototyping cloud system architectures,1728,28311,https://avatars.githubusercontent.com/u/6178510?u=f9940c5492bc7ede04a9f2ea7df3aae973e45165&v=4
222751131,30-Days-Of-Python,Asabeneh/30-Days-Of-Python,Python,712,"30 days of Python programming challenge is a step-by-step guide to learn the Python programming language in 30 days. This challenge may take more than100 days, follow your own pace. ",4716,22252,https://avatars.githubusercontent.com/u/9008063?u=ec6ff77196b998a4e6b6e3ca1429c524c169c189&v=4
569927055,stablediffusion,Stability-AI/stablediffusion,Python,604,High-Resolution Image Synthesis with Latent Diffusion Models,1557,13668,https://avatars.githubusercontent.com/u/100950301?v=4
552661142,langchain,hwchase17/langchain,Python,1444,âš¡ Building applications with LLMs through composability âš¡,973,10910,https://avatars.githubusercontent.com/u/11986836?u=f4c4f21a82b2af6c9f91e1f1d99ea40062f7a101&v=4
305144746,tinygrad,geohot/tinygrad,Python,369,You like pytorch? You like micrograd? You love tinygrad! â¤ï¸ ,983,10828,https://avatars.githubusercontent.com/u/72895?u=64c16e3f87c708f1f3920331f1f6285f6529960e&v=4
601538369,llama,facebookresearch/llama,Python,2670,Inference code for LLaMA models,1574,10493,https://avatars.githubusercontent.com/u/16943930?v=4
235860204,DeepSpeed,microsoft/DeepSpeed,Python,184,"DeepSpeed is a deep learning optimization library that makes distributed training and inference easy, efficient, and effective.",1128,9409,https://avatars.githubusercontent.com/u/6154722?v=4
560704231,llama_index,jerryjliu/llama_index,Python,1053,LlamaIndex (GPT Index) is a project that provides a central interface to connect your LLM's with external data.,593,6553,https://avatars.githubusercontent.com/u/4858925?u=eb0717916ba7f9d8b9402d17a22e6f645d0f97c7&v=4
458588993,nebullvm,nebuly-ai/nebullvm,Python,751,Plug and play modules to optimize the performances of your AI systems ğŸš€,464,6446,https://avatars.githubusercontent.com/u/83510798?u=abef9f381a183a7a9c55c593d98c3eb89b8dc335&v=4
539389184,fast-stable-diffusion,TheLastBen/fast-stable-diffusion,Python,379,fast-stable-diffusion + DreamBooth,727,4600,https://avatars.githubusercontent.com/u/110583491?u=71504a155c5e6e76547c196e041910b2087470ad&v=4
608419025,bilingual_book_maker,yihong0618/bilingual_book_maker,Python,1426,Make bilingual epub books Using AI translate,512,4041,https://avatars.githubusercontent.com/u/15976103?u=9a784422ed716bd783f231b1e080656363de9b7b&v=4
609445326,awesome-chatgpt-api,reorx/awesome-chatgpt-api,Python,1580,"Curated list of apps and tools that not only use the new ChatGPT API, but also allow users to configure their own API keys, enabling free and on-demand usage of their own quota.",154,3104,https://avatars.githubusercontent.com/u/405972?u=99935e550f58a6e0ddcb966309a5c1cf748fe657&v=4
580642043,text-generation-webui,oobabooga/text-generation-webui,Python,1749,"A gradio web UI for running Large Language Models like GPT-J 6B, OPT, GALACTICA, LLaMA, and Pygmalion.",213,2584,https://avatars.githubusercontent.com/u/112222186?u=b632bfe07653fcd5b3a4345703d06877e5005805&v=4
574506496,chatgpt-mirai-qq-bot,lss233/chatgpt-mirai-qq-bot,Python,555,ğŸš€ ä¸€é”®éƒ¨ç½²ï¼çœŸæ­£çš„ ChatGPT QQ èŠå¤©æœºå™¨äººï¼æ”¯æŒChatGPT APIã€ ChatGPT Plusã€æ–°ç‰ˆ Bingï¼Œå¤šè´¦å·è´Ÿè½½å‡è¡¡ï¼Œäººè®¾è°ƒæ•™ï¼Œæ•æ„Ÿè¯æ£€æµ‹ï¼Œè™šæ‹Ÿå¥³ä»†ã€å¯¹è¯ä¸Šä¸‹æ–‡ï¼Œå›¾ç‰‡æ¸²æŸ“ï¼Œä»£ç†åŠ é€Ÿ (å†…æœ‰è§†é¢‘æ•™ç¨‹ï¼‰,263,2484,https://avatars.githubusercontent.com/u/8984680?u=e4d7e61d39e149291469ba6d5f09532595ad84e3&v=4
509850056,Book4_Power-of-Matrix,Visualize-ML/Book4_Power-of-Matrix,Python,81,Book_4_ã€ŠçŸ©é˜µåŠ›é‡ã€‹ |   é¸¢å°¾èŠ±ä¹¦ï¼šä»åŠ å‡ä¹˜é™¤åˆ°æœºå™¨å­¦ä¹ ï¼›æœ¬å†Œæœ‰ï¼Œ584å¹…å›¾ï¼Œ81ä¸ªä»£ç æ–‡ä»¶ï¼Œå…¶ä¸­18ä¸ªStreamlit Appï¼›çŠ¶æ€ï¼šæ¸…åç¤¾äº”å®¡äº”æ ¡ä¸­ï¼›Githubç¨¿ä»¶åŸºæœ¬ç¨³å®šï¼Œæ¬¢è¿ææ„è§ï¼Œä¼šåŠæ—¶ä¿®æ”¹,292,2287,https://avatars.githubusercontent.com/u/105787223?u=b35ad4405d5bbcd61f0a2b1cf00911d3f9fd1683&v=4
365250183,nicegui,zauberzeug/nicegui,Python,627,Create web-based UI with Python. The nice way.,85,2037,https://avatars.githubusercontent.com/u/2843826?v=4
250510075,trl,lvwerra/trl,Python,172,Train transformer language models with reinforcement learning.,223,2036,https://avatars.githubusercontent.com/u/8264887?u=81065ca57ec465e92071cc36d88d933de376b73c&v=4
608660982,ChuanhuChatGPT,GaiZhenbiao/ChuanhuChatGPT,Python,1204,GUI for ChatGPT API,246,1976,https://avatars.githubusercontent.com/u/51039745?u=accb33fa417f386eaf9fc9b2ed07ec74fb36ada3&v=4
574278577,chatgpt_telegram_bot,karfly/chatgpt_telegram_bot,Python,382,,429,1686,https://avatars.githubusercontent.com/u/7571844?u=45a19adf6b861b5dfcf77f0091f2c6acfaa73701&v=4
602366280,xiaogpt,yihong0618/xiaogpt,Python,363,Play ChatGPT with xiaomi ai speaker,157,1575,https://avatars.githubusercontent.com/u/15976103?u=9a784422ed716bd783f231b1e080656363de9b7b&v=4
559584476,kohya_ss,bmaltais/kohya_ss,Python,312,,153,1385,https://avatars.githubusercontent.com/u/7474674?u=9080e36bd542746d6ecd104f11b22ce8c5305b0f&v=4
373674258,bitsandbytes,TimDettmers/bitsandbytes,Python,140,8-bit CUDA functions for PyTorch,100,1071,https://avatars.githubusercontent.com/u/5260050?v=4
599687030,bot-on-anything,zhayujie/bot-on-anything,Python,212," Connect AI models (like ChatGPT-3.5, GPT-3.0) to apps (like Wechat, public account, DingTalk, Telegram,  QQ).  å°† ChatGPT ç­‰ç®—æ³•æ¨¡å‹åº”ç”¨äºå„ç±»å¹³å°ï¼Œç›®å‰å·²å®Œæˆå‘½ä»¤è¡Œã€ä¸ªäººå¾®ä¿¡ã€å…¬ä¼—å·ã€QQã€Telegramã€Gmailé‚®ç®±ã€Slackã€Webï¼Œè®¡åˆ’ç»§ç»­æ¥å…¥ä¼ä¸šå¾®ä¿¡ã€é’‰é’‰ç­‰ã€‚",110,707,https://avatars.githubusercontent.com/u/26161723?u=a2d51ccd0b85cc5561f42dfe9219a11577dd6c26&v=4
