id,name,full_name,language,new stars,description,forks_count,stargazers_count,avatar_url
28457823,freeCodeCamp,freeCodeCamp/freeCodeCamp,TypeScript,75,freeCodeCamp.org's open-source codebase and curriculum. Learn to code for free.,28771,347452,https://avatars.githubusercontent.com/u/9892522?v=4
63476337,Python,TheAlgorithms/Python,Python,451,All Algorithms implemented in Python,35863,138146,https://avatars.githubusercontent.com/u/20487725?v=4
1148753,spring-framework,spring-projects/spring-framework,Java,21,Spring Framework,33950,48064,https://avatars.githubusercontent.com/u/317776?v=4
12256376,ionic-framework,ionic-team/ionic-framework,TypeScript,9,"A powerful cross-platform UI toolkit for building native-quality iOS, Android, and Progressive Web Apps with HTML, CSS, and JavaScript.",13653,47430,https://avatars.githubusercontent.com/u/3171503?v=4
75104123,prettier,prettier/prettier,JavaScript,15,Prettier is an opinionated code formatter.,3351,42899,https://avatars.githubusercontent.com/u/25822731?v=4
482152820,HowToLiveLonger,geekan/HowToLiveLonger,,251,ç¨‹åºå‘˜å»¶å¯¿æŒ‡å— | A programmer's guide to live longer,1128,17954,https://avatars.githubusercontent.com/u/2707039?u=463185951e02a6ba817bf59f549e917b7690348c&v=4
109162639,thanos,thanos-io/thanos,Go,4,Highly available Prometheus setup with long term storage capabilities. A CNCF Incubating project.,1598,10507,https://avatars.githubusercontent.com/u/49725059?v=4
71323749,react-native-paper,callstack/react-native-paper,TypeScript,11,Material Design for React Native (Android & iOS),1659,9246,https://avatars.githubusercontent.com/u/42239399?v=4
8629417,mapbox-gl-js,mapbox/mapbox-gl-js,JavaScript,5,"Interactive, thoroughly customizable maps in the browser, powered by vector tiles and WebGL",1957,8673,https://avatars.githubusercontent.com/u/600935?v=4
50824485,systeminformer,winsiderss/systeminformer,C,44,"A free, powerful, multi-purpose tool that helps you monitor system resources, debug software and detect malware. Brought to you by Winsider Seminars & Solutions, Inc. @ http://www.windows-internals.com",1060,7461,https://avatars.githubusercontent.com/u/105516054?v=4
375939072,FastGithub,dotnetcore/FastGithub,C#,69,githubåŠ é€Ÿç¥å™¨ï¼Œè§£å†³githubæ‰“ä¸å¼€ã€ç”¨æˆ·å¤´åƒæ— æ³•åŠ è½½ã€releasesæ— æ³•ä¸Šä¼ ä¸‹è½½ã€git-cloneã€git-pullã€git-pushå¤±è´¥ç­‰é—®é¢˜,947,6839,https://avatars.githubusercontent.com/u/19404084?v=4
190416463,virtual-environments,actions/virtual-environments,PowerShell,16,GitHub Actions virtual environments,2154,6019,https://avatars.githubusercontent.com/u/44036562?v=4
14128006,raft,hashicorp/raft,Go,3,Golang implementation of the Raft consensus protocol,802,5985,https://avatars.githubusercontent.com/u/761456?v=4
50128165,go-plugin,hashicorp/go-plugin,Go,5,Golang plugin system over RPC.,292,3582,https://avatars.githubusercontent.com/u/761456?v=4
330980599,coder-kung-fu,yanfeizhang/coder-kung-fu,C,26,å¼€å‘å†…åŠŸä¿®ç‚¼,573,3124,https://avatars.githubusercontent.com/u/6801783?u=f48017dcdf757b5f5e8a3776c7d69b26d574ac58&v=4
83085579,microsoft-authentication-library-for-js,AzureAD/microsoft-authentication-library-for-js,TypeScript,1,Microsoft Authentication Library (MSAL) for JS,1994,2410,https://avatars.githubusercontent.com/u/2966316?v=4
365263843,fresh,lucacasonato/fresh,TypeScript,241,"Preact, but super edgy",60,1537,https://avatars.githubusercontent.com/u/7829205?u=5a9294123bdf7301054aacbc88fda275f72ad4cb&v=4
498831802,dns.toys,knadh/dns.toys,Go,123,"A DNS server that offers useful utilities and services over the DNS protocol. Weather, world time, unit conversion etc.",50,1470,https://avatars.githubusercontent.com/u/547147?u=b2b2d466d5344d6a5154edf7ddf5d077774aa413&v=4
331361562,pokete,lxgr-linux/pokete,Python,74,A terminal based Pokemon like game,65,1514,https://avatars.githubusercontent.com/u/64218491?u=aa4438185097ebebd4db7d39ea68fee35ed25fdd&v=4
502424220,svg-spinners,n3r4zzurr0/svg-spinners,SVG,273,A collection of 24 x 24 dp SVG spinners!,92,1465,https://avatars.githubusercontent.com/u/15423974?u=9a8eee1e7dfe8518bf882cfd52bc0cd2fe4a6f0d&v=4
475869888,BEVFormer,zhiqi-li/BEVFormer,Python,23,"This is the official implementation of BEVFormer, a camera-only framework for autonomous driving perception, e.g., 3D object detection and semantic map segmentation.",47,565,https://avatars.githubusercontent.com/u/27915819?u=52ed64819e11ff69815fdb7585f38f7dae18bdea&v=4
496505424,ceresdb,CeresDB/ceresdb,Rust,91,"CeresDB is a high-performance, distributed, schema-less, cloud native time-series database that can handle both time-series and analytics workloads.",44,479,https://avatars.githubusercontent.com/u/77516929?v=4
502349596,pingu,sheepla/pingu,Go,413,ğŸ§ping command but with pingu,26,1187,https://avatars.githubusercontent.com/u/62412884?u=fc38ecd8a10ffe0838edf129d5049ea9e81167e2&v=4
94652781,t3,still-scene/t3,C#,52,A new tooll implementation with Dear ImGUI,8,279,https://avatars.githubusercontent.com/u/68075353?v=4
500793338,tomcat-jmxproxy-rce-exp,4ra1n/tomcat-jmxproxy-rce-exp,Go,29,Apache Tomcat JMXProxy RCE,30,161,https://avatars.githubusercontent.com/u/34726933?u=0dc792d4dd16cd235eca00fb1937cb656a412ba8&v=4
