id,name,full_name,language,new stars,description,forks_count,stargazers_count,avatar_url
54346799,public-apis,public-apis/public-apis,Python,2844,A collective list of free APIs,18542,163434,https://avatars.githubusercontent.com/u/51121562?v=4
83222441,system-design-primer,donnemartin/system-design-primer,Python,622,Learn how to design large-scale systems. Prep for the system design interview.  Includes Anki flashcards.,27028,146263,https://avatars.githubusercontent.com/u/5458997?u=f1007b583e55e7ccfb6ccf0e200051156112dd9b&v=4
63476337,Python,TheAlgorithms/Python,Python,1143,All Algorithms implemented in Python,32151,120070,https://avatars.githubusercontent.com/u/20487725?v=4
3638964,ansible,ansible/ansible,Python,236,"Ansible is a radically simple IT automation platform that makes your applications and systems easier to deploy and maintain. Automate everything from code deployment to network configuration to cloud management, in a language that approaches plain English, using SSH, with no agents to install on remote systems. https://docs.ansible.com.",21166,50221,https://avatars.githubusercontent.com/u/1507452?v=4
12888993,core,home-assistant/core,Python,681,:house_with_garden: Open source home automation that puts local control and privacy first.,15281,46449,https://avatars.githubusercontent.com/u/13844975?v=4
529502,scrapy,scrapy/scrapy,Python,107,"Scrapy, a fast high-level web crawling & scraping framework for Python.",9354,41802,https://avatars.githubusercontent.com/u/733635?v=4
160919119,fastapi,tiangolo/fastapi,Python,491,"FastAPI framework, high performance, easy to learn, fast to code, ready for production",2681,36763,https://avatars.githubusercontent.com/u/1326112?u=5cad72c846b7aba2e960546af490edc7375dafc4&v=4
118861276,python-cheatsheet,gto76/python-cheatsheet,Python,84,Comprehensive Python Cheatsheet,4654,25311,https://avatars.githubusercontent.com/u/1396046?u=852f59cf0d778cb9863e623352049d42c2fac10c&v=4
19745004,odoo,odoo/odoo,JavaScript,258,Odoo. Open Source Apps To Grow Your Business.,15079,22842,https://avatars.githubusercontent.com/u/6368483?v=4
204086862,streamlit,streamlit/streamlit,Python,89,Streamlit — The fastest way to build data apps in Python,1419,16137,https://avatars.githubusercontent.com/u/45109972?v=4
139199684,prefect,PrefectHQ/prefect,Python,517,The easiest way to automate your data,701,7441,https://avatars.githubusercontent.com/u/39270919?v=4
355959597,textual,willmcgugan/textual,Python,398,Textual is a TUI (Text User Interface) framework for Python inspired by modern web development.,114,5735,https://avatars.githubusercontent.com/u/554369?u=8015a7d742d8bd7ee9d1efe30c138737d6098cd3&v=4
103071520,great_expectations,great-expectations/great_expectations,Python,135,Always know what to expect from your data.,714,5489,https://avatars.githubusercontent.com/u/31670619?v=4
224386599,checkov,bridgecrewio/checkov,Python,42,"Prevent cloud misconfigurations during build-time for Terraform, Cloudformation, Kubernetes, Serverless framework and other infrastructure-as-code-languages with Checkov by Bridgecrew.",437,3305,https://avatars.githubusercontent.com/u/48174253?v=4
31820613,RsaCtfTool,Ganapati/RsaCtfTool,Python,129,RSA attack tool (mainly for ctf) - retreive private key from weak public key and/or uncipher data,590,2938,https://avatars.githubusercontent.com/u/2084795?v=4
167694194,frigate,blakeblackshear/frigate,Python,213,NVR with realtime local object detection for IP cameras,311,2849,https://avatars.githubusercontent.com/u/569905?u=a454086144f531389a73fbea93a7835eea06f2a1&v=4
253044228,nuclei-templates,projectdiscovery/nuclei-templates,Python,131,Community curated list of templates for the nuclei engine to find security vulnerabilities.,782,2466,https://avatars.githubusercontent.com/u/50994705?v=4
155790228,sqlfluff,sqlfluff/sqlfluff,Python,413,A SQL linter and auto-formatter for Humans,173,2409,https://avatars.githubusercontent.com/u/71874918?v=4
128416969,archinstall,archlinux/archinstall,Python,42,"Arch Linux installer - guided, templates etc.",133,2259,https://avatars.githubusercontent.com/u/4673648?v=4
409822805,MagInkCal,speedyg0nz/MagInkCal,Python,1662,E-Ink Magic Calendar that automatically syncs to Google Calendar and runs off a battery powered Raspberry Pi Zero,45,2068,https://avatars.githubusercontent.com/u/5581989?v=4
216628419,flyte,flyteorg/flyte,Python,21,"Kubernetes-native workflow automation platform for complex, mission-critical data and ML processes at scale. It has been battle-tested at Lyft, Spotify, Freenome, and others and is truly open-source.",145,1699,https://avatars.githubusercontent.com/u/35380635?v=4
404068695,porth,tsoding/porth,Python,116,It's like Forth but in Python,45,477,https://avatars.githubusercontent.com/u/18597647?v=4
333486966,EnragedRabbitProject,EtteGit/EnragedRabbitProject,Python,67,,63,450,https://avatars.githubusercontent.com/u/35068611?v=4
329913731,QuadrupedRobot,mangdangroboticsclub/QuadrupedRobot,Python,38,"Open-Source,ROS Robot Dog Kit",37,283,https://avatars.githubusercontent.com/u/76767015?u=497ef56e4f5316682f3c9ba788edae84fbd2c4b1&v=4
391729680,mtkclient,bkerler/mtkclient,Python,36,Inofficial MTK reverse engineering and flash tool,38,148,https://avatars.githubusercontent.com/u/6317772?u=85c0ccf80471bbbb0739bf3882a6207766c497b7&v=4
