id,name,full_name,language,new stars,description,forks_count,stargazers_count,avatar_url
45717250,tensorflow,tensorflow/tensorflow,C++,215,An Open Source Machine Learning Framework for Everyone,86593,164054,https://avatars.githubusercontent.com/u/15658638?v=4
9384267,electron,electron/electron,C++,198,":electron: Build cross-platform desktop apps with JavaScript, HTML, and CSS",13374,101169,https://avatars.githubusercontent.com/u/13409222?v=4
23357588,protobuf,protocolbuffers/protobuf,C++,120,Protocol Buffers - Google's data interchange format,13951,53719,https://avatars.githubusercontent.com/u/26310541?v=4
27729880,grpc,grpc/grpc,C++,97,"The C based gRPC (C++, Python, Ruby, Objective-C, PHP, C#)",8948,33854,https://avatars.githubusercontent.com/u/7802525?v=4
39840932,googletest,google/googletest,C++,75,GoogleTest - Google Testing and Mocking Framework,8435,25541,https://avatars.githubusercontent.com/u/1342004?v=4
60246359,ClickHouse,ClickHouse/ClickHouse,C++,151,ClickHouseÂ® is a free analytics DBMS for big data,4571,22979,https://avatars.githubusercontent.com/u/54801242?v=4
96246170,apollo,ApolloAuto/apollo,C++,57,An open autonomous driving platform,8295,20452,https://avatars.githubusercontent.com/u/28768304?v=4
160083795,serenity,SerenityOS/serenity,C++,316,The Serenity Operating System ğŸ,2052,18842,https://avatars.githubusercontent.com/u/50811782?v=4
98771110,TrafficMonitor,zhongyang219/TrafficMonitor,C++,140,è¿™æ˜¯ä¸€ä¸ªç”¨äºæ˜¾ç¤ºå½“å‰ç½‘é€Ÿã€CPUåŠå†…å­˜åˆ©ç”¨ç‡çš„æ¡Œé¢æ‚¬æµ®çª—è½¯ä»¶ï¼Œå¹¶æ”¯æŒä»»åŠ¡æ æ˜¾ç¤ºï¼Œæ”¯æŒæ›´æ¢çš®è‚¤ã€‚,1960,17056,https://avatars.githubusercontent.com/u/30562462?u=18ad9b9dfa6e784088d28deb7e0dbe830afcc0b7&v=4
191820100,mediapipe,google/mediapipe,C++,116,"Cross-platform, customizable ML solutions for live and streaming media.",3508,16794,https://avatars.githubusercontent.com/u/1342004?v=4
7056202,fmt,fmtlib/fmt,C++,69,A modern formatting library,1665,13887,https://avatars.githubusercontent.com/u/7280830?v=4
14981376,dogecoin,dogecoin/dogecoin,C++,35,very currency,2511,13875,https://avatars.githubusercontent.com/u/6122353?v=4
2310495,ceph,ceph/ceph,C++,38,"Ceph is a distributed object, block, and file storage platform ",4867,10352,https://avatars.githubusercontent.com/u/1015767?v=4
283410102,workflow,sogou/workflow,C++,98,C++ Parallel Computing and Asynchronous Networking Engine,1499,7663,https://avatars.githubusercontent.com/u/15903299?v=4
2168780,minetest,minetest/minetest,C++,60,Minetest is an open source voxel game engine with easy modding and game creation,1513,6956,https://avatars.githubusercontent.com/u/2624745?v=4
15122806,benchmark,google/benchmark,C++,43,A microbenchmark support library,1256,6328,https://avatars.githubusercontent.com/u/1342004?v=4
89067146,ethminer,ethereum-mining/ethminer,C++,16,"Ethereum miner with OpenCL, CUDA and stratum support",2249,5834,https://avatars.githubusercontent.com/u/27890133?v=4
420580521,smartknob,scottbez1/smartknob,C++,2564,Haptic input knob with software-defined endstops and virtual detents,297,5433,https://avatars.githubusercontent.com/u/414890?u=589508b11b9260a496d1735579ab79c77b49558e&v=4
309512982,redpanda,redpanda-data/redpanda,C++,57,Redpanda is a streaming data platform for developers. Kafka API compatible. 10x faster. No ZooKeeper. No JVM!,230,3725,https://avatars.githubusercontent.com/u/49406389?v=4
248058818,tracy,wolfpld/tracy,C++,68,C++ frame profiler,252,3612,https://avatars.githubusercontent.com/u/600573?u=d1ac7f58bc1671dd2a99ada35ddd21fa936a0f88&v=4
271154586,SDRPlusPlus,AlexandreRouma/SDRPlusPlus,C++,51,Cross-Platform SDR Software,209,1563,https://avatars.githubusercontent.com/u/17126412?u=933e304b8e892fb2ec7f70007efe2a43668a175a&v=4
170738310,wallet-core,trustwallet/wallet-core,C++,29,"Cross-platform, cross-blockchain wallet library.",975,1445,https://avatars.githubusercontent.com/u/32179889?v=4
446669267,huatuo,focus-creative-games/huatuo,C++,208,"é›¶æˆæœ¬ã€é«˜æ€§èƒ½çš„unity c#çš„çƒ­æ›´æ–°æ–¹æ¡ˆã€‚ Zero-cost, high-performance unity c# hot update solution",147,832,https://avatars.githubusercontent.com/u/71439677?v=4
167499157,tiflash,pingcap/tiflash,C++,568,The analytical engine for TiDB,274,603,https://avatars.githubusercontent.com/u/11855343?v=4
340219494,libjxl,libjxl/libjxl,C++,13,JPEG XL image format reference implementation,83,468,https://avatars.githubusercontent.com/u/77789960?v=4
