id,name,full_name,language,new stars,description,forks_count,stargazers_count,avatar_url
8514,rails,rails/rails,Ruby,64,Ruby on Rails,20252,50483,https://avatars.githubusercontent.com/u/4223?v=4
65252,jekyll,jekyll/jekyll,Ruby,58,:globe_with_meridians: Jekyll is a blog-aware static site generator in Ruby,9765,44425,https://avatars.githubusercontent.com/u/3083652?v=4
13840241,devdocs,freeCodeCamp/devdocs,Ruby,70,API Documentation Browser,1900,28166,https://avatars.githubusercontent.com/u/9892522?v=4
52281283,mastodon,mastodon/mastodon,Ruby,310,"Your self-hosted, globally interconnected microblogging community",4412,27427,https://avatars.githubusercontent.com/u/24979032?v=4
481872,vagrant,hashicorp/vagrant,Ruby,40,Vagrant is a tool for building and distributing development environments.,4243,23602,https://avatars.githubusercontent.com/u/761456?v=4
308770,devise,heartcombo/devise,Ruby,15,Flexible authentication solution for Rails with Warden.,5387,22346,https://avatars.githubusercontent.com/u/59584037?v=4
18486300,setup,lewagon/setup,Ruby,49,Setup instructions for Le Wagon's students on their first day of Web Development Bootcamp,1124,12234,https://avatars.githubusercontent.com/u/5470001?v=4
96395,faker,faker-ruby/faker,Ruby,12,"A library for generating fake data such as names, addresses, and phone numbers.",2859,9969,https://avatars.githubusercontent.com/u/47637297?v=4
15435,liquid,Shopify/liquid,Ruby,14,"Liquid markup language. Safe, customer facing template language for flexible web apps. ",1246,9442,https://avatars.githubusercontent.com/u/8085?v=4
1333863,kaminari,kaminari/kaminari,Ruby,7,"⚡ A Scope & Engine based, clean, powerful, customizable and sophisticated paginator for Ruby webapps",1069,8156,https://avatars.githubusercontent.com/u/5637951?v=4
6529205,pundit,varvet/pundit,Ruby,8,Minimal authorization through OO design and pure Ruby classes,586,7593,https://avatars.githubusercontent.com/u/3612746?v=4
2441517,puma,puma/puma,Ruby,8,A Ruby/Rack web server built for parallelism,1302,7020,https://avatars.githubusercontent.com/u/1264292?v=4
1314319,canvas-lms,instructure/canvas-lms,Ruby,15,"The open LMS by Instructure, Inc.",1908,4335,https://avatars.githubusercontent.com/u/515326?v=4
30985840,solidus,solidusio/solidus,Ruby,11,"🛒Solidus, Rails eCommerce System",1171,4136,https://avatars.githubusercontent.com/u/11045486?v=4
52316423,react-native-config,luggit/react-native-config,Ruby,15,Bring some 12 factor love to your mobile apps!,599,4089,https://avatars.githubusercontent.com/u/10248925?v=4
138776049,sorbet,sorbet/sorbet,Ruby,10,"A fast, powerful type checker designed for Ruby",374,3122,https://avatars.githubusercontent.com/u/46383129?v=4
103766152,explore,github/explore,Ruby,26,Community-curated topic and collection pages on GitHub,10394,3072,https://avatars.githubusercontent.com/u/9919?v=4
11426474,choosealicense.com,github/choosealicense.com,Ruby,7,A site to provide non-judgmental guidance on choosing a license for your open source project,1258,2798,https://avatars.githubusercontent.com/u/9919?v=4
189010173,evil-winrm,Hackplayers/evil-winrm,Ruby,24,The ultimate WinRM shell for hacking/pentesting,443,2500,https://avatars.githubusercontent.com/u/9460052?v=4
3698608,sidekiq-scheduler,moove-it/sidekiq-scheduler,Ruby,8,Lightweight job scheduler extension for Sidekiq,197,1433,https://avatars.githubusercontent.com/u/488520?v=4
79618507,fluentd-kubernetes-daemonset,fluent/fluentd-kubernetes-daemonset,Ruby,5,Fluentd daemonset for Kubernetes and it Docker image,880,1033,https://avatars.githubusercontent.com/u/859518?v=4
10504669,plots2,publiclab/plots2,Ruby,12,a collaborative knowledge-exchange platform in Rails; we welcome first-time contributors! :balloon:,1732,811,https://avatars.githubusercontent.com/u/4621650?v=4
467296689,bullet_train,bullet-train-co/bullet_train,Ruby,23,The Open Source Ruby on Rails SaaS Framework,54,377,https://avatars.githubusercontent.com/u/5976880?v=4
66497320,dd-trace-rb,DataDog/dd-trace-rb,Ruby,1,Datadog Tracing Ruby Client,258,165,https://avatars.githubusercontent.com/u/365230?v=4
212272090,price-transparency-guide,CMSgov/price-transparency-guide,Ruby,4,The technical implementation guide for the tri-departmental price transparency rule.,62,138,https://avatars.githubusercontent.com/u/3209407?v=4
