id,name,full_name,language,new stars,description,forks_count,stargazers_count,avatar_url
507775,elasticsearch,elastic/elasticsearch,Java,14,"Free and Open, Distributed, RESTful Search Engine",23900,66034,https://avatars.githubusercontent.com/u/6764390?v=4
41889031,NewPipe,TeamNewPipe/NewPipe,Java,40,A libre lightweight streaming front-end for Android.,2875,26542,https://avatars.githubusercontent.com/u/22159318?v=4
89822531,Mindustry,Anuken/Mindustry,Java,8,The automation tower defense RTS,2717,19674,https://avatars.githubusercontent.com/u/10100000?u=614db4c9ac9d539c72840ca9c2b7e522efe1b0c1&v=4
391055597,DSA-Bootcamp-Java,kunal-kushwaha/DSA-Bootcamp-Java,Java,11,"This repository consists of the code samples, assignments, and notes for the Java data structures & algorithms + interview preparation bootcamp of WeMakeDevs.",9345,14086,https://avatars.githubusercontent.com/u/42698533?u=260b1d69b75771f2c126106abd607301d6f780da&v=4
50160261,Paper,PaperMC/Paper,Java,6,"The most widely used, high performance Minecraft server that aims to fix gameplay and mechanics inconsistencies",2027,8166,https://avatars.githubusercontent.com/u/7608950?v=4
3301400,MinecraftForge,MinecraftForge/MinecraftForge,Java,0,Modifications to the Minecraft base files to assist in compatibility between mods. New Discord: https://discord.minecraftforge.net/,2661,6462,https://avatars.githubusercontent.com/u/1390178?v=4
37844001,HMCL,huanghongxun/HMCL,Java,3,"A Minecraft Launcher which is multi-functional, cross-platform and popular",602,5773,https://avatars.githubusercontent.com/u/5411982?u=0205537714fe0efd1d55bd2540e0600fb1de2a57&v=4
5244445,AntennaPod,AntennaPod/AntennaPod,Java,4,A podcast manager for Android,1283,5354,https://avatars.githubusercontent.com/u/10713470?v=4
594155488,Stirling-PDF,Frooodle/Stirling-PDF,Java,49,locally hosted web application that allows you to perform various operations on PDF files,379,4864,https://avatars.githubusercontent.com/u/77850077?u=6a9b596bb97f3ddfcf8c50a9294c8d15a69d43bd&v=4
343535217,LSPatch,LSPosed/LSPatch,Java,16,LSPatch: A non-root Xposed framework extending from LSPosed,378,4751,https://avatars.githubusercontent.com/u/75879071?v=4
57461213,runelite,runelite/runelite,Java,1,Open source Old School RuneScape client,5025,4361,https://avatars.githubusercontent.com/u/13814776?v=4
195856796,Geyser,GeyserMC/Geyser,Java,4,A bridge/proxy allowing you to connect to Minecraft: Java Edition servers with Minecraft: Bedrock Edition.,604,4245,https://avatars.githubusercontent.com/u/52673035?v=4
426287111,esProc,SPLWare/esProc,Java,45,"esProc SPL is a scripting language for data processing, with well-designed rich library functions and powerful syntax, which can be executed in a Java program through JDBC interface and computing independently.",276,3864,https://avatars.githubusercontent.com/u/85984666?u=ac3c82fec7017f66b1229b26f631fbd84a6b9c21&v=4
142456757,Infinity-For-Reddit,Docile-Alligator/Infinity-For-Reddit,Java,2,A Reddit client for Android,411,3672,https://avatars.githubusercontent.com/u/25734209?v=4
3886965,bitcoin-wallet,bitcoin-wallet/bitcoin-wallet,Java,4,"Bitcoin Wallet app for your Android device. Standalone Bitcoin node, no centralized backend required.",2042,3380,https://avatars.githubusercontent.com/u/12846910?v=4
691911176,spring-reading,xuchengsheng/spring-reading,Java,343,æ¶µç›–äº† Spring æ¡†æ¶çš„æ ¸å¿ƒæ¦‚å¿µå’Œå…³é”®åŠŸèƒ½ï¼ŒåŒ…æ‹¬æ§åˆ¶åè½¬ï¼ˆIOCï¼‰å®¹å™¨çš„ä½¿ç”¨ï¼Œé¢å‘åˆ‡é¢ç¼–ç¨‹ï¼ˆAOPï¼‰çš„åŸç†ä¸å®è·µï¼Œäº‹åŠ¡ç®¡ç†çš„æ–¹å¼ä¸å®ç°ï¼ŒSpring MVC çš„æµç¨‹ä¸æ§åˆ¶å™¨å·¥ä½œæœºåˆ¶ï¼Œä»¥åŠ Spring ä¸­æ•°æ®è®¿é—®ã€å®‰å…¨ã€Boot è‡ªåŠ¨é…ç½®ç­‰æ–¹é¢çš„æ·±å…¥ç ”ç©¶ã€‚æ­¤å¤–ï¼Œå®ƒè¿˜åŒ…å«äº† Spring äº‹ä»¶æœºåˆ¶çš„åº”ç”¨ã€é«˜çº§ä¸»é¢˜å¦‚ç¼“å­˜æŠ½è±¡å’Œå“åº”å¼ç¼–ç¨‹ï¼Œä»¥åŠå¯¹ Spring æºç çš„ç¼–ç¨‹é£æ ¼ä¸è®¾è®¡æ¨¡å¼çš„æ·±å…¥æ¢è®¨ã€‚,515,3364,https://avatars.githubusercontent.com/u/30015049?u=2d5bd8a510c63e6b5e8eda5a817176e9f159cfd2&v=4
944926,WorldEdit,EngineHub/WorldEdit,Java,1,ğŸ—ºï¸ Minecraft map editor and mod,806,2914,https://avatars.githubusercontent.com/u/3753025?v=4
309730396,meteor-client,MeteorDevelopment/meteor-client,Java,0,Based Minecraft utility mod.,642,1651,https://avatars.githubusercontent.com/u/73897938?v=4
142085119,Velocity,PaperMC/Velocity,Java,1,"The modern, next-generation Minecraft server proxy.",482,1489,https://avatars.githubusercontent.com/u/7608950?v=4
583335116,spring-boot-3-jwt-security,ali-bouali/spring-boot-3-jwt-security,Java,4,Sample project on how to implement JWT security based using Spring boot 3 and Spring security 6,615,1222,https://avatars.githubusercontent.com/u/16446014?u=7e2b07b64619cf009869d7fbcb77b81fcc160283&v=4
40026499,Unexpected-Keyboard,Julow/Unexpected-Keyboard,Java,5,A lightweight virtual keyboard for developers.,125,841,https://avatars.githubusercontent.com/u/2310568?v=4
562389618,alist-tvbox,power721/alist-tvbox,Java,10,"AList proxy server for TvBox, support playlist and search. ",174,688,https://avatars.githubusercontent.com/u/2384040?u=7f9ed033e75b57ae540d78cfa1d402e1ecbfb07d&v=4
663996831,NeoForge,neoforged/NeoForge,Java,3,"Neo Modding API for Minecraft, based on Forge",88,684,https://avatars.githubusercontent.com/u/138629134?v=4
258724004,waynboot-mall,wayn111/waynboot-mall,Java,67,è¿™æ˜¯ä¸€å¥—å…¨éƒ¨å¼€æºçš„å¾®å•†åŸé¡¹ç›®ï¼ŒåŒ…å«ä¸€ä¸ªè¿è¥åå°ã€H5å•†åŸå‰å°å’ŒæœåŠ¡ç«¯æ¥å£ã€‚ å®ç°äº†å•†åŸæ‰€éœ€çš„é¦–é¡µå±•ç¤ºã€å•†å“åˆ†ç±»ã€å•†å“è¯¦æƒ…ã€skuè¯¦æƒ…ã€å•†å“æœç´¢ã€è´­ç‰©è½¦ã€ç»“ç®—ä¸‹å•ã€çº¿ä¸Šæ”¯ä»˜ï¼Œå•†å“è¯„è®ºç­‰ä¸€ç³»åˆ—åŠŸèƒ½ã€‚ æŠ€æœ¯ä¸ŠåŸºäºæœ€æ–°å¾—Springboot3.0ã€jdk17ï¼Œæ•´åˆäº†MySqlã€Redisã€RabbitMQã€ElasticSearchç­‰å¸¸ç”¨ä¸­é—´ä»¶ï¼Œå¯¹äºåˆå­¦è€…è€Œè¨€æ ¹æ®readmeä¸­çš„æœ¬åœ°å¼€å‘æŒ‡å—å°±èƒ½æˆåŠŸå¯åŠ¨é¡¹ç›®ã€‚è¿˜æä¾› docker-compose ä¸€é”®éƒ¨ç½²è„šæœ¬ï¼Œåªéœ€è¦åå¤šåˆ†é’Ÿå°±èƒ½å¯åŠ¨å•†åŸå‰åå°æ‰€æœ‰æœåŠ¡ã€‚,158,587,https://avatars.githubusercontent.com/u/34181171?u=90c740158d0bfeb8069f9b2869aa633229697765&v=4
724963961,devpilot-intellij,openpilot-hub/devpilot-intellij,Java,24,"Your new coding buddy, designed exclusively for IntelliJ IDEA.",56,462,https://avatars.githubusercontent.com/u/151610907?v=4
