id,name,full_name,language,new stars,description,forks_count,stargazers_count,avatar_url
3482588,SecLists,danielmiessler/SecLists,PHP,253,"SecLists is the security tester's companion. It's a collection of multiple types of lists used during security assessments, collected in one place. List types include usernames, passwords, URLs, sensitive data patterns, fuzzing payloads, web shells, and many more.",20565,40644,https://avatars.githubusercontent.com/u/50654?u=d5b77e639134c95d79f922589cde11239d8e0c2c&v=4
458058,symfony,symfony/symfony,PHP,150,The Symfony PHP framework,8782,27293,https://avatars.githubusercontent.com/u/143937?v=4
60243197,server,nextcloud/server,PHP,47,"☁️ Nextcloud server, a safe home for all your data",3143,19660,https://avatars.githubusercontent.com/u/19211038?v=4
2253830,PHPMailer,PHPMailer/PHPMailer,PHP,31,The classic email sending library for PHP,9333,18505,https://avatars.githubusercontent.com/u/3959702?v=4
5724990,Carbon,briannesbitt/Carbon,PHP,19,A simple PHP API extension for DateTime.,1220,15853,https://avatars.githubusercontent.com/u/170745?v=4
3431193,yii2,yiisoft/yii2,PHP,11,"Yii 2: The Fast, Secure and Professional PHP Framework",7005,13976,https://avatars.githubusercontent.com/u/993323?v=4
7704544,image,Intervention/image,PHP,24,PHP Image Manipulation,1422,12730,https://avatars.githubusercontent.com/u/3258272?v=4
13899674,flysystem,thephpleague/flysystem,PHP,20,Abstraction for local and remote filesystems,751,12557,https://avatars.githubusercontent.com/u/527621?v=4
23680678,jwt-auth,tymondesigns/jwt-auth,PHP,19,🔐 JSON Web Token Authentication for Laravel & Lumen,1513,10587,https://avatars.githubusercontent.com/u/1801923?u=15eeeb0c2817253aea520178e9d15def0883b8fe&v=4
137515,mockery,mockery/mockery,PHP,10,"Mockery is a simple yet flexible PHP mock object framework for use in unit testing with PHPUnit, PHPSpec or any other testing framework. Its core goal is to offer a test double framework with a succinct API capable of clearly defining all possible object operations and interactions using a human readable Domain Specific Language (DSL).",445,10228,https://avatars.githubusercontent.com/u/19197437?v=4
2699935,PHP_CodeSniffer,squizlabs/PHP_CodeSniffer,PHP,19,PHP_CodeSniffer tokenizes PHP files and detects violations of a defined set of coding standards.,1456,9574,https://avatars.githubusercontent.com/u/997547?v=4
11340559,deployer,deployphp/deployer,PHP,51,A deployment tool written in PHP with support for popular frameworks out of the box,1403,9392,https://avatars.githubusercontent.com/u/8088857?v=4
212659,php-code-coverage,sebastianbergmann/php-code-coverage,PHP,7,"Library that provides collection, processing, and rendering functionality for PHP code coverage information.",358,8336,https://avatars.githubusercontent.com/u/25218?u=01bb70d9be43ded7572eb3862127ff281daa2725&v=4
2179920,woocommerce,woocommerce/woocommerce,PHP,22,"A customizable, open-source eCommerce platform built on WordPress. Build any commerce solution you can imagine.",10323,8081,https://avatars.githubusercontent.com/u/473596?v=4
97311017,rector,rectorphp/rector,PHP,83,Instant Upgrades and Automated Refactoring of any PHP 5.3+ code,522,5657,https://avatars.githubusercontent.com/u/32097581?v=4
6269013,aws-sdk-php,aws/aws-sdk-php,PHP,11,Official repository of the AWS SDK for PHP (@awsforphp),1111,5597,https://avatars.githubusercontent.com/u/2232217?v=4
12204147,mautic,mautic/mautic,PHP,65,Mautic: Open Source Marketing Automation Software.,1968,5307,https://avatars.githubusercontent.com/u/5257677?v=4
62087941,laravel-modules,nWidart/laravel-modules,PHP,71,Module Management In Laravel,793,4365,https://avatars.githubusercontent.com/u/882397?u=cdb31d0969c5283251ca913a5db185704b3a95d0&v=4
248372441,filament,filamentphp/filament,PHP,76,"Admin panel, form builder and table builder for Laravel. Built with the TALL stack. Designed for humans.",535,4098,https://avatars.githubusercontent.com/u/64450473?v=4
69691727,PocketMine-MP,pmmp/PocketMine-MP,PHP,16,A server software for Minecraft: Bedrock Edition in PHP,1610,2860,https://avatars.githubusercontent.com/u/22548559?v=4
153069455,dockerlabs,collabnix/dockerlabs,PHP,38,Docker  - Beginners | Intermediate | Advanced,1397,2742,https://avatars.githubusercontent.com/u/34368930?u=ff71ff4c8e33ab6410f4594403d82a8f036c0dcb&v=4
232599652,sanctum,laravel/sanctum,PHP,9,Laravel Sanctum provides a featherweight authentication system for SPAs and simple APIs.,222,2341,https://avatars.githubusercontent.com/u/958072?v=4
74026995,php-ddd-example,CodelyTV/php-ddd-example,PHP,20,🐘🎯 Hexagonal Architecture + DDD + CQRS in PHP using Symfony 6,843,2294,https://avatars.githubusercontent.com/u/14278228?v=4
216849756,v2board,v2board/v2board,PHP,17,🚀A multiple proxy protocol manage panel application interface,717,1546,https://avatars.githubusercontent.com/u/56885001?v=4
29745084,leantime,Leantime/leantime,PHP,25,Leantime is a lean project management system for innovators. Designed to help you manage your projects from ideation to delivery.,290,1308,https://avatars.githubusercontent.com/u/11252321?v=4
