id,name,full_name,language,new stars,description,forks_count,stargazers_count,avatar_url
8681349,huginn,huginn/huginn,Ruby,128,Create agents that monitor and act on your behalf.  Your agents are standing by!,3379,37782,https://avatars.githubusercontent.com/u/23225142?v=4
27442967,fastlane,fastlane/fastlane,Ruby,87,🚀 The easiest way to automate building and releasing your iOS and Android apps,5433,36686,https://avatars.githubusercontent.com/u/11098337?v=4
53238813,brew,Homebrew/brew,Ruby,116,🍺 The missing package manager for macOS (or Linux),8601,35226,https://avatars.githubusercontent.com/u/1503512?v=4
2293158,metasploit-framework,rapid7/metasploit-framework,Ruby,66,Metasploit Framework,12957,29631,https://avatars.githubusercontent.com/u/1013671?v=4
202291859,chatwoot,chatwoot/chatwoot,Ruby,53,"Open-source customer engagement suite, an alternative to Intercom, Zendesk, Salesforce Service Cloud etc. 🔥💬",2046,14653,https://avatars.githubusercontent.com/u/23416667?v=4
4095287,rubocop,rubocop/rubocop,Ruby,14,"A Ruby static code analyzer and formatter, based on the community Ruby style guide.",2999,12163,https://avatars.githubusercontent.com/u/10871348?v=4
1725199,linguist,github/linguist,Ruby,31,"Language Savant. If your repository's language is being reported incorrectly, send us a pull request!",3966,10763,https://avatars.githubusercontent.com/u/9919?v=4
611921,activeadmin,activeadmin/activeadmin,Ruby,9,The administration framework for Ruby on Rails applications.,3315,9321,https://avatars.githubusercontent.com/u/814570?v=4
451035,simple_form,heartcombo/simple_form,Ruby,7,"Forms made easy for Rails! It's tied to a simple DSL, with no opinion on markup.",1318,8084,https://avatars.githubusercontent.com/u/59584037?v=4
6529205,pundit,varvet/pundit,Ruby,7,Minimal authorization through OO design and pure Ruby classes,604,7880,https://avatars.githubusercontent.com/u/3612746?v=4
447184,rspec-rails,rspec/rspec-rails,Ruby,5,RSpec for Rails 5+,991,4941,https://avatars.githubusercontent.com/u/22388?v=4
115859973,pagy,ddnexus/pagy,Ruby,11,🏆 The Best Pagination Ruby Gem 🥇,350,3993,https://avatars.githubusercontent.com/u/100721?v=4
103766152,explore,github/explore,Ruby,18,Community-curated topic and collection pages on GitHub,12232,3664,https://avatars.githubusercontent.com/u/9919?v=4
1172597,shoulda-matchers,thoughtbot/shoulda-matchers,Ruby,4,Simple one-liner tests for common Rails functionality,909,3376,https://avatars.githubusercontent.com/u/6183?v=4
11426474,choosealicense.com,github/choosealicense.com,Ruby,17,A site to provide non-judgmental guidance on choosing a license for your open source project,1424,3168,https://avatars.githubusercontent.com/u/9919?v=4
586265895,mrsk,mrsked/mrsk,Ruby,2052,Deploy web apps anywhere.,87,2970,https://avatars.githubusercontent.com/u/124560041?v=4
238986,rspec-expectations,rspec/rspec-expectations,Ruby,0,Provides a readable API to express expected outcomes of a code example,384,1208,https://avatars.githubusercontent.com/u/22388?v=4
238983,rspec-mocks,rspec/rspec-mocks,Ruby,0,"RSpec's 'test double' framework, with support for stubbing and mocking",342,1106,https://avatars.githubusercontent.com/u/22388?v=4
9735707,stripe-ruby-mock,stripe-ruby-mock/stripe-ruby-mock,Ruby,1,A mocking library for testing stripe ruby,676,918,https://avatars.githubusercontent.com/u/59454286?v=4
284824224,ruby-openai,alexrudall/ruby-openai,Ruby,150,OpenAI API + Ruby! 🤖❤️ Now with ChatGPT and Whisper...,56,748,https://avatars.githubusercontent.com/u/7175262?u=490f7c8986e8f4a73a759d442785fe7fb70a98ad&v=4
70830890,greenlight,bigbluebutton/greenlight,Ruby,0,A really simple end-user interface for your BigBlueButton server.,3837,713,https://avatars.githubusercontent.com/u/230228?v=4
463648726,ruby-lsp,Shopify/ruby-lsp,Ruby,40,An opinionated language server for Ruby,23,625,https://avatars.githubusercontent.com/u/8085?v=4
66497320,dd-trace-rb,DataDog/dd-trace-rb,Ruby,3,Datadog Tracing Ruby Client,326,227,https://avatars.githubusercontent.com/u/365230?v=4
279271772,datadog-api-client-ruby,DataDog/datadog-api-client-ruby,Ruby,0,,15,15,https://avatars.githubusercontent.com/u/365230?v=4
605516669,my-todos-sinatra,otsembo/my-todos-sinatra,Ruby,1,My-Todos is a basic API built with ruby's Sinatra DSL.,30,1,https://avatars.githubusercontent.com/u/38042565?u=404abc65359cc727a840bb9dc5d8ce1188101447&v=4
