id,name,full_name,language,new stars,description,forks_count,stargazers_count,avatar_url
15634981,godot,godotengine/godot,C++,39,Godot Engine – Multi-platform 2D and 3D game engine,21101,90620,https://avatars.githubusercontent.com/u/6318500?v=4
1181927,bitcoin,bitcoin/bitcoin,C++,17,Bitcoin Core integration/staging tree,36291,79093,https://avatars.githubusercontent.com/u/528860?v=4
67702184,Magisk,topjohnwu/Magisk,C++,30,The Magic Mask for Android,12278,48181,https://avatars.githubusercontent.com/u/7337301?v=4
168008797,calculator,microsoft/calculator,C++,8,Windows Calculator: A simple yet powerful calculator that ships with Windows,5376,29682,https://avatars.githubusercontent.com/u/6154722?v=4
3351871,qBittorrent,qbittorrent/qBittorrent,C++,26,qBittorrent BitTorrent client,3949,27962,https://avatars.githubusercontent.com/u/2131270?v=4
34777562,srs,ossrs/srs,C++,5,"SRS is a simple, high-efficiency, real-time media server supporting RTMP, WebRTC, HLS, HTTP-FLV, HTTP-TS, SRT, MPEG-DASH, and GB28181.",5375,25634,https://avatars.githubusercontent.com/u/12165287?v=4
24420506,v8,v8/v8,C++,5,The official mirror of the V8 Git repository,3978,23368,https://avatars.githubusercontent.com/u/113781?v=4
470730648,Hyprland,hyprwm/Hyprland,C++,21,"Hyprland is an independent, highly customizable, dynamic tiling Wayland compositor that doesn't sacrifice on its looks.",895,21241,https://avatars.githubusercontent.com/u/107882187?v=4
384520418,MaaAssistantArknights,MaaAssistantArknights/MaaAssistantArknights,C++,18,"《明日方舟》小助手，全日常一键长草！| A one-click tool for the daily tasks of Arknights, supporting all clients.",1886,13968,https://avatars.githubusercontent.com/u/97677443?v=4
70127218,arduino-esp32,espressif/arduino-esp32,C++,6,Arduino core for the ESP32,7394,13551,https://avatars.githubusercontent.com/u/9460735?v=4
106558568,dxvk,doitsujin/dxvk,C++,7,"Vulkan-based implementation of D3D8, 9, 10 and 11 for Linux / Wine",846,13137,https://avatars.githubusercontent.com/u/25567304?u=e753c1eafb0e81504b6ab74883303565cdfa66b2&v=4
86337343,entt,skypjack/entt,C++,4,Gaming meets modern C++ - a fast and reliable entity component system (ECS) and much more,889,10168,https://avatars.githubusercontent.com/u/1812216?v=4
5298790,PX4-Autopilot,PX4/PX4-Autopilot,C++,11,PX4 Autopilot Software,13483,8436,https://avatars.githubusercontent.com/u/2096014?v=4
207245092,duckstation,stenzek/duckstation,C++,6,Fast PlayStation 1 emulator for x86-64/AArch32/AArch64/RV64,720,7589,https://avatars.githubusercontent.com/u/11288319?v=4
514553345,OrcaSlicer,SoftFever/OrcaSlicer,C++,10,"G-code generator for 3D printers (Bambu, Prusa, Voron, VzBot, RatRig, Creality, etc.)",833,7071,https://avatars.githubusercontent.com/u/103989404?u=5ce996a351ee08333a2e41329d5f7a09823b3724&v=4
67768325,meshoptimizer,zeux/meshoptimizer,C++,8,Mesh optimization library that makes meshes smaller and faster to render,482,5654,https://avatars.githubusercontent.com/u/1106629?u=620ee97d58fc4c0e915bc36c992c86e94bd76efe&v=4
315035371,amnezia-client,amnezia-vpn/amnezia-client,C++,10,Amnezia VPN Client (Desktop+Mobile),335,5337,https://avatars.githubusercontent.com/u/74861536?v=4
237647258,firmware,meshtastic/firmware,C++,5,Meshtastic device firmware,859,3470,https://avatars.githubusercontent.com/u/61627050?v=4
206946371,ton,ton-blockchain/ton,C++,4,Main TON monorepo,934,3011,https://avatars.githubusercontent.com/u/55018343?v=4
53142971,wayfire,WayfireWM/wayfire,C++,1,A modular and extensible wayland compositor,179,2393,https://avatars.githubusercontent.com/u/42376392?v=4
269668754,src.next,kiwibrowser/src.next,C++,6,"Source-code for Kiwi Next, a Kiwi Browser auto-rebased with latest Chromium",292,2283,https://avatars.githubusercontent.com/u/40272275?u=45142cb70052a26d939d47817c62f551a22298b3&v=4
596483114,magic_overlayfs,HuskyDG/magic_overlayfs,C++,2,Make system partition become read-write (it is also possible without Magisk),189,759,https://avatars.githubusercontent.com/u/84650617?u=063f4142db4622408b886b369b1987ee0ff58e3a&v=4
223460751,SilentPatch,CookiePLMonster/SilentPatch,C++,45,"SilentPatch for GTA III, Vice City, and San Andreas",10,257,https://avatars.githubusercontent.com/u/7947461?u=1d3536824770fb188d9a453113a6fe9b5527221a&v=4
