id,name,full_name,language,new stars,description,forks_count,stargazers_count,avatar_url
199570071,v2rayN,2dust/v2rayN,C#,121,"A GUI client for Windows, support Xray core and v2fly core and others",7913,41836,https://avatars.githubusercontent.com/u/31833384?v=4
161012019,jellyfin,jellyfin/jellyfin,C#,34,The Free Software Media System,2029,21809,https://avatars.githubusercontent.com/u/45698031?v=4
14964475,Avalonia,AvaloniaUI/Avalonia,C#,15,A cross-platform UI framework for .NET,1533,17703,https://avatars.githubusercontent.com/u/14075148?v=4
193681686,netch,netchx/netch,C#,11,A simple proxy client,2351,14128,https://avatars.githubusercontent.com/u/52199683?v=4
324473895,downkyi,leiurayer/downkyi,C#,24,å“”å“©ä¸‹è½½å§¬downkyiï¼Œå“”å“©å“”å“©ç½‘ç«™è§†é¢‘ä¸‹è½½å·¥å…·ï¼Œæ”¯æŒæ‰¹é‡ä¸‹è½½ï¼Œæ”¯æŒ8Kã€HDRã€æœæ¯”è§†ç•Œï¼Œæä¾›å·¥å…·ç®±ï¼ˆéŸ³è§†é¢‘æå–ã€å»æ°´å°ç­‰ï¼‰ã€‚https://t.me/+7zeNbdkP0TEzODll,1542,12323,https://avatars.githubusercontent.com/u/19290097?u=589c798ec2b77363ddf03308123a6f8c718a8426&v=4
375939072,FastGithub,dotnetcore/FastGithub,C#,11,githubåŠ é€Ÿç¥å™¨ï¼Œè§£å†³githubæ‰“ä¸å¼€ã€ç”¨æˆ·å¤´åƒæ— æ³•åŠ è½½ã€releasesæ— æ³•ä¸Šä¼ ä¸‹è½½ã€git-cloneã€git-pullã€git-pushå¤±è´¥ç­‰é—®é¢˜,1686,12296,https://avatars.githubusercontent.com/u/19404084?v=4
22456440,osu,ppy/osu,C#,9,rhythm is just a *click* away!,1899,12167,https://avatars.githubusercontent.com/u/995763?v=4
135050219,CMWTAT_Digital_Edition,TGSAN/CMWTAT_Digital_Edition,C#,11,"CloudMoe Windows 10/11 Activation Toolkit get digital license, the best open source Win 10/11 activator in GitHub. GitHub ä¸Šæœ€æ£’çš„å¼€æº Win10/Win11 æ•°å­—æƒåˆ©ï¼ˆæ•°å­—è®¸å¯è¯ï¼‰æ¿€æ´»å·¥å…·ï¼",1605,11099,https://avatars.githubusercontent.com/u/7440847?u=9a04b599cc7d75db6aa271e76d4a7d5ac722661b&v=4
201188122,lively,rocksdanister/lively,C#,8,Free and open-source software that allows users to set animated desktop wallpapers and screensavers powered by WinUI 3.,843,10546,https://avatars.githubusercontent.com/u/17554161?u=65f51a36d9c0072b244c13d215fc743e464f5cce&v=4
77323220,Radarr,Radarr/Radarr,C#,6,A fork of Sonarr to work with movies Ã  la Couchpotato.,839,7449,https://avatars.githubusercontent.com/u/25025331?v=4
27251463,Lean,QuantConnect/Lean,C#,7,"Lean Algorithmic Trading Engine by QuantConnect (Python, C#)",2811,7379,https://avatars.githubusercontent.com/u/3912814?v=4
304230333,ContextMenuManager,BluePointLilac/ContextMenuManager,C#,49,ğŸ–±ï¸ çº¯ç²¹çš„Windowså³é”®èœå•ç®¡ç†ç¨‹åº,420,7263,https://avatars.githubusercontent.com/u/55010935?u=0d397c663162486f6bdadf6850df6d017791b566&v=4
130160795,ShadowsocksR-Windows,HMBSbige/ShadowsocksR-Windows,C#,3,Ship of Theseus,1111,6464,https://avatars.githubusercontent.com/u/19153265?u=199dd8df485fb1fec5c9558de3361f164c18f748&v=4
125612271,EntityComponentSystemSamples,Unity-Technologies/EntityComponentSystemSamples,C#,5,,1282,5425,https://avatars.githubusercontent.com/u/426196?v=4
100711978,btcpayserver,btcpayserver/btcpayserver,C#,40,"Accept Bitcoin payments. Free, open-source & self-hosted, Bitcoin payment processor. ",1107,4667,https://avatars.githubusercontent.com/u/31132886?v=4
57452143,mobile,bitwarden/mobile,C#,6,The mobile app vault (iOS and Android).,623,4602,https://avatars.githubusercontent.com/u/15990069?v=4
389218073,wpfui,lepoco/wpfui,C#,13,"WPF UI provides the Fluent experience in your known and loved WPF framework. Intuitive design, themes, navigation and new immersive controls. All natively and effortlessly.",461,4127,https://avatars.githubusercontent.com/u/87412094?v=4
121067132,BepInEx,BepInEx/BepInEx,C#,8,Unity / XNA game patcher and plugin framework,433,3072,https://avatars.githubusercontent.com/u/39589027?v=4
142192459,Seatbelt,GhostPack/Seatbelt,C#,4,"Seatbelt is a C# project that performs a number of security oriented host-survey ""safety checks"" relevant from both offensive and defensive security perspectives.",564,2883,https://avatars.githubusercontent.com/u/41304335?v=4
432730711,openai,betalgo/openai,C#,21,"OpenAI ChatGPT, Whisper, GPT-3 , GPT-4, Azure OpenAI and DALL-E dotnet SDK",300,1725,https://avatars.githubusercontent.com/u/7516303?v=4
256651878,MelonLoader,LavaGang/MelonLoader,C#,5,The World's First Universal Mod Loader for Unity Games compatible with both Il2Cpp and Mono,358,1497,https://avatars.githubusercontent.com/u/70487270?v=4
95391644,Nitrox,SubnauticaNitrox/Nitrox,C#,3,"An open-source, multiplayer modification for the game Subnautica.",950,1472,https://avatars.githubusercontent.com/u/31598129?v=4
474724520,Rectify11Installer,MishaProductions/Rectify11Installer,C#,4,A Windows 11 modification to make Windows more consistent.,70,557,https://avatars.githubusercontent.com/u/106913236?u=f256dde6009db0487c5d4dc4061b932b1a5c7a72&v=4
520583586,bloxstrap,pizzaboxer/bloxstrap,C#,7,"An open-source, feature-packed alternative bootstrapper for Roblox.",10,185,https://avatars.githubusercontent.com/u/41478239?u=43e7b9399f7319396b38279b0f3318f0e2a168f4&v=4
608220629,solid-bad-designs,daohainam/solid-bad-designs,C#,8,,11,42,https://avatars.githubusercontent.com/u/11513104?v=4
