id,name,full_name,language,new stars,description,forks_count,stargazers_count,avatar_url
184456251,PowerToys,microsoft/PowerToys,C#,2108,Windows system utilities to maximize productivity,3780,67145,https://avatars.githubusercontent.com/u/6154722?v=4
199570071,v2rayN,2dust/v2rayN,C#,885,,5368,25392,https://avatars.githubusercontent.com/u/31833384?v=4
38380854,dnSpy,dnSpy/dnSpy,C#,279,.NET debugger and assembly editor,3803,19932,https://avatars.githubusercontent.com/u/67931932?v=4
164140756,Files,files-community/Files,C#,3636,A modern file manager that pushes the boundaries of the platform.,1021,18797,https://avatars.githubusercontent.com/u/65931357?v=4
161012019,jellyfin,jellyfin/jellyfin,C#,461,The Free Software Media System,1357,13135,https://avatars.githubusercontent.com/u/45698031?v=4
198071756,RevokeMsgPatcher,huiyadanli/RevokeMsgPatcher,C#,438,:trollface: A hex editor for WeChat/QQ/TIM - PCç‰ˆå¾®ä¿¡/QQ/TIMé˜²æ’¤å›è¡¥ä¸ï¼ˆæˆ‘å·²ç»çœ‹åˆ°äº†ï¼Œæ’¤å›ä¹Ÿæ²¡ç”¨äº†ï¼‰,1800,12944,https://avatars.githubusercontent.com/u/15783049?u=86f380636f7c09b86788a977ea96272cb7484a30&v=4
46755185,server,bitwarden/server,C#,249,"The core infrastructure backend (API, database, Docker, etc).",769,9033,https://avatars.githubusercontent.com/u/15990069?v=4
165548191,PEASS-ng,carlospolop/PEASS-ng,C#,336,PEASS - Privilege Escalation Awesome Scripts SUITE (with colors),1887,7500,https://avatars.githubusercontent.com/u/17181413?u=7bab6cb28b2c583ee1f5f6ce8b3e0195601b6dde&v=4
64753043,AssetStudio,Perfare/AssetStudio,C#,230,"AssetStudio is a tool for exploring, extracting and exporting assets and assetbundles.",1391,7438,https://avatars.githubusercontent.com/u/12952226?u=36886cb911e51458e6f2fdd041f97a6f7ce64b40&v=4
2465723,Sonarr,Sonarr/Sonarr,C#,153,Smart PVR for newsgroup and bittorrent users.,999,7015,https://avatars.githubusercontent.com/u/1082903?v=4
45195614,Jackett,Jackett/Jackett,C#,273,API Support for your favorite torrent trackers,887,6954,https://avatars.githubusercontent.com/u/15383019?v=4
201188122,lively,rocksdanister/lively,C#,309,Free and open-source software that allows users to set animated desktop wallpapers and screensavers.,512,6022,https://avatars.githubusercontent.com/u/17554161?u=8e8419fd0693513282e55e212a0ef21e58310687&v=4
77323220,Radarr,Radarr/Radarr,C#,189,A fork of Sonarr to work with movies Ã  la Couchpotato.,735,5897,https://avatars.githubusercontent.com/u/25025331?v=4
27251463,Lean,QuantConnect/Lean,C#,129,"Lean Algorithmic Trading Engine by QuantConnect (Python, C#)",2449,5807,https://avatars.githubusercontent.com/u/3912814?v=4
2419727,de4dot,de4dot/de4dot,C#,93,.NET deobfuscator and unpacker.,2135,5550,https://avatars.githubusercontent.com/u/67931943?v=4
743436,ET,egametang/ET,C#,196,Unity3D Client And C# Server Framework,2025,5334,https://avatars.githubusercontent.com/u/315758?v=4
321682465,SteamTools,BeyondDimension/SteamTools,C#,548,ğŸ› ã€ŒSteam++ã€æ˜¯ä¸€ä¸ªå¼€æºè·¨å¹³å°çš„å¤šåŠŸèƒ½Steamå·¥å…·ç®±ã€‚,321,5002,https://avatars.githubusercontent.com/u/79355691?v=4
375939072,FastGithub,dotnetcore/FastGithub,C#,766,githubåŠ é€Ÿç¥å™¨ï¼Œè§£å†³githubæ‰“ä¸å¼€ã€ç”¨æˆ·å¤´åƒæ— æ³•åŠ è½½ã€releasesæ— æ³•ä¸Šä¼ ä¸‹è½½ã€git-cloneã€git-pullã€git-pushå¤±è´¥ç­‰é—®é¢˜,538,4241,https://avatars.githubusercontent.com/u/19404084?v=4
57049212,Unity3DTraining,XINCGer/Unity3DTraining,C#,378,Unityçš„ç»ƒä¹ é¡¹ç›®,1107,3427,https://avatars.githubusercontent.com/u/10908565?u=eb064bd4f0b79950849a2c06ec9aa30a69fde2b8&v=4
2928944,azure-sdk-for-net,Azure/azure-sdk-for-net,C#,166,This repository is for active development of the Azure SDK for .NET. For consumers of the SDK we recommend visiting our public developer docs at https://docs.microsoft.com/dotnet/azure/ or our versioned developer docs at https://azure.github.io/azure-sdk-for-net. ,3190,3231,https://avatars.githubusercontent.com/u/6844498?v=4
288428676,MudBlazor,MudBlazor/MudBlazor,C#,206,"Blazor Component Library based on Material design. The goal is to do more with Blazor, utilizing CSS and keeping Javascript to a bare minimum.",457,2283,https://avatars.githubusercontent.com/u/79755064?v=4
182637681,ModAssistant,Assistant/ModAssistant,C#,66,Simple Beat Saber Mod Installer,325,1573,https://avatars.githubusercontent.com/u/2748721?u=01412ce5c7b86420c5cdfe1b88a0348b4ea5dc5e&v=4
389218073,wpfui,lepoco/wpfui,C#,462,"A simple way to make your application written in WPF keep up with modern design trends. Library changes the base elements like Page, ToggleButton or List, and also includes additional controls like Navigation, NumberBox, Dialog or Snackbar.",42,1067,https://avatars.githubusercontent.com/u/87412094?v=4
211763756,OpenTabletDriver,OpenTabletDriver/OpenTabletDriver,C#,115,"Open source, cross-platform, user-mode tablet driver",161,1035,https://avatars.githubusercontent.com/u/76072354?v=4
425766154,SilentCryptoMiner,UnamSanctam/SilentCryptoMiner,C#,99,"A Silent (Hidden) Free Crypto Miner Builder - Supports ETH, ETC, XMR and many more.",51,168,https://avatars.githubusercontent.com/u/10323655?u=11bfd775759310968b7128312061276208b332d9&v=4
