id,name,full_name,language,new stars,description,forks_count,stargazers_count,avatar_url
83222441,system-design-primer,donnemartin/system-design-primer,Python,4764,Learn how to design large-scale systems. Prep for the system design interview.  Includes Anki flashcards.,29133,157769,https://avatars.githubusercontent.com/u/5458997?u=f1007b583e55e7ccfb6ccf0e200051156112dd9b&v=4
1039520,youtube-dl,ytdl-org/youtube-dl,Python,1714,Command-line program to download videos from YouTube.com and other video sites,6724,104433,https://avatars.githubusercontent.com/u/48381040?v=4
33614304,thefuck,nvbn/thefuck,Python,1080,Magnificent app which corrects your previous console command.,3039,65985,https://avatars.githubusercontent.com/u/1114542?v=4
4164482,django,django/django,Python,713,The Web framework for perfectionists with deadlines.,26322,61659,https://avatars.githubusercontent.com/u/27804?v=4
58028038,HelloGitHub,521xueweihan/HelloGitHub,Python,1588,":octocat: 分享 GitHub 上有趣、入门级的开源项目。Share interesting, entry-level open source projects on GitHub.",7326,50817,https://avatars.githubusercontent.com/u/8255800?u=2024c0f3979fd65c8aab945856eae0852f1186f6&v=4
12888993,core,home-assistant/core,Python,839,:house_with_garden: Open source home automation that puts local control and privacy first.,16589,48762,https://avatars.githubusercontent.com/u/13844975?v=4
91573538,12306,testerSunshine/12306,Python,147,12306智能刷票，订票,9439,30401,https://avatars.githubusercontent.com/u/20162049?u=e84bd901b23092ebb2411aa370ec688573b2b191&v=4
118861276,python-cheatsheet,gto76/python-cheatsheet,Python,1275,Comprehensive Python Cheatsheet,4947,27086,https://avatars.githubusercontent.com/u/1396046?u=852f59cf0d778cb9863e623352049d42c2fac10c&v=4
4008931,hosts,StevenBlack/hosts,Python,420,"🔒 Consolidating and extending hosts files from several well-curated sources. Optionally pick extensions for porn, social media, and other categories.",1753,19677,https://avatars.githubusercontent.com/u/80144?u=115ad569cf1e49f64172984ac813e16f45976ed1&v=4
262296122,PaddleOCR,PaddlePaddle/PaddleOCR,Python,664,"Awesome multilingual OCR toolkits based on PaddlePaddle (practical ultra lightweight OCR system, support 80+ languages recognition, provide data annotation and synthesis tools, support training and deployment among server, mobile, embedded and IoT devices)",3796,18507,https://avatars.githubusercontent.com/u/23534030?v=4
31522041,vnpy,vnpy/vnpy,Python,367,基于Python的开源量化交易平台开发框架,6951,17308,https://avatars.githubusercontent.com/u/11263900?u=7c76ce5e04cb90f40d1001834a171e5a0b6ada11&v=4
349321229,GFPGAN,TencentARC/GFPGAN,Python,11744,GFPGAN aims at developing Practical Algorithms for Real-world Face Restoration.,2401,16373,https://avatars.githubusercontent.com/u/83739826?v=4
307260205,yt-dlp,yt-dlp/yt-dlp,Python,3695,A youtube-dl fork with additional features and fixes,1102,15965,https://avatars.githubusercontent.com/u/79589310?v=4
1049095,kivy,kivy/kivy,Python,500,"Open source UI framework written in Python, running on Windows, Linux, macOS, Android and iOS",2842,14147,https://avatars.githubusercontent.com/u/1266152?v=4
152166877,d2l-en,d2l-ai/d2l-en,Python,415,"Interactive deep learning book with multi-framework code, math, and discussions. Adopted at 300 universities from 55 countries including Stanford, MIT, Harvard, and Cambridge.",2792,12086,https://avatars.githubusercontent.com/u/43974506?v=4
120710644,ddia,Vonng/ddia,Python,1265,《Designing Data-Intensive Application》DDIA中文翻译,2563,11537,https://avatars.githubusercontent.com/u/8587410?u=cf4bf2dc20cda87e09a0feff8b103fe8ec8bbb32&v=4
10332822,calibre,kovidgoyal/calibre,Python,281,The official source code repository for the calibre ebook manager,1617,11400,https://avatars.githubusercontent.com/u/1308621?u=b3fb9d6c1fe72bbc3d3b3b1192e8e421cad810c9&v=4
274594200,Bringing-Old-Photos-Back-to-Life,microsoft/Bringing-Old-Photos-Back-to-Life,Python,327,Bringing Old Photo Back to Life (CVPR 2020 oral),1169,9764,https://avatars.githubusercontent.com/u/6154722?v=4
387326890,Real-ESRGAN,xinntao/Real-ESRGAN,Python,1274,Real-ESRGAN aims at developing Practical Algorithms for General Image Restoration.,829,8582,https://avatars.githubusercontent.com/u/17445847?u=dc0cf716873f6809f46f105917500699ae1aafd3&v=4
300996055,vit-pytorch,lucidrains/vit-pytorch,Python,1111,"Implementation of Vision Transformer, a simple way to achieve SOTA in vision classification with only a single transformer encoder, in Pytorch",1246,8067,https://avatars.githubusercontent.com/u/108653?u=3a5a0a10e79f22d5b98e6de9a6e0df8b11dc2bc5&v=4
386524895,mvt,mvt-project/mvt,Python,267,MVT (Mobile Verification Toolkit) helps conducting forensics of mobile devices in order to find signs of a potential compromise.,553,6522,https://avatars.githubusercontent.com/u/87478403?v=4
386811486,YOLOX,Megvii-BaseDetection/YOLOX,Python,413,"YOLOX is a high-performance anchor-free YOLO, exceeding yolov3~v5 with MegEngine, ONNX, TensorRT, ncnn, and OpenVINO supported. Documentation: https://yolox.readthedocs.io/",1117,5382,https://avatars.githubusercontent.com/u/67775453?v=4
305316768,nanodet,RangiLyu/nanodet,Python,350,NanoDet-Plus⚡Super fast and lightweight anchor-free object detection model. 🔥Only 980 KB(int8) / 1.8MB (fp16) and run 97FPS on cellphone🔥,723,3927,https://avatars.githubusercontent.com/u/12907710?u=88b49437cb224464d055a5658b583b7c24e4d38c&v=4
422005902,YT-Spammer-Purge,ThioJoe/YT-Spammer-Purge,Python,381,Allows you easily scan for and delete scam comments using several methods.,135,867,https://avatars.githubusercontent.com/u/12518330?u=d8a5d7a0522b20c5750d0b54613eb648f9185c8c&v=4
416947996,bombcrypto-bot,mpcabete/bombcrypto-bot,Python,428,"This is a python bot that automatically logs in, clicks the new button, and sends heroes to work in the bombcrypto game. It is fully open source and free.",436,711,https://avatars.githubusercontent.com/u/69962256?v=4
