id,name,full_name,language,new stars,description,forks_count,stargazers_count,avatar_url
589831718,ComfyUI,comfyanonymous/ComfyUI,Python,1289,"The most powerful and modular diffusion model GUI, api and backend with a graph/nodes interface.",4923,46561,https://avatars.githubusercontent.com/u/121283862?u=00e0967075548ed41bd53ed0eacd34ac42d8cef0&v=4
280567579,EasySpider,NaiboWang/EasySpider,JavaScript,1407,A visual no-code/code-free web crawler/spider易采集：一个可视化浏览器自动化测试/数据采集/爬虫软件，可以无代码图形化的设计和执行爬虫任务。别名：ServiceWrapper面向Web应用的智能化服务封装系统。,3940,32672,https://avatars.githubusercontent.com/u/30287768?u=430d71312cd7b74533c807b08d7211a6e25d4edd&v=4
48769241,penpot,penpot/penpot,Clojure,1380,Penpot: The open-source design tool for design and code collaboration,1538,31242,https://avatars.githubusercontent.com/u/30179644?v=4
3390243,servo,servo/servo,Rust,271,"Servo, the embeddable, independent, memory-safe, modular, parallel web rendering engine",2968,27408,https://avatars.githubusercontent.com/u/2566135?v=4
695864515,Deep-Live-Cam,hacksider/Deep-Live-Cam,Python,21751,real time face swap and one-click video deepfake with only a single image,3066,23005,https://avatars.githubusercontent.com/u/1267200?v=4
167694194,frigate,blakeblackshear/frigate,Python,444,NVR with realtime local object detection for IP cameras,1587,17099,https://avatars.githubusercontent.com/u/569905?u=a454086144f531389a73fbea93a7835eea06f2a1&v=4
521655652,infisical,Infisical/infisical,TypeScript,626,"♾ Infisical is the open-source secret management platform: Sync secrets across your team/infrastructure, prevent secret leaks, and manage internal PKI",766,14239,https://avatars.githubusercontent.com/u/107880645?v=4
749647889,MiniCPM-V,OpenBMB/MiniCPM-V,Python,1455,"MiniCPM-V 2.6: A GPT-4V Level MLLM for Single Image, Multi Image and Video on Your Phone",735,10471,https://avatars.githubusercontent.com/u/89920203?v=4
599735720,3x-ui,MHSanaei/3x-ui,JavaScript,357,Xray panel supporting multi-protocol multi-user expire day & traffic & ip limit (Vmess & Vless & Trojan &  ShadowSocks & Wireguard) ,2270,10319,https://avatars.githubusercontent.com/u/33454419?v=4
560299175,teable,teableio/teable,TypeScript,1897,✨ The Next Gen Airtable Alternative: No-Code Postgres,439,9932,https://avatars.githubusercontent.com/u/113977713?v=4
231958668,ZLUDA,vosen/ZLUDA,Rust,148,CUDA on ??? GPUs,568,8760,https://avatars.githubusercontent.com/u/1206376?v=4
743116659,stable-diffusion-webui-forge,lllyasviel/stable-diffusion-webui-forge,Python,437,,614,6148,https://avatars.githubusercontent.com/u/19834515?u=4c7144779a6b13904fec478c4e98e676b91516ee&v=4
672002598,Verba,weaviate/Verba,Python,464,Retrieval Augmented Generation (RAG) chatbot powered by Weaviate,592,5659,https://avatars.githubusercontent.com/u/37794290?v=4
497512032,CogVideo,THUDM/CogVideo,Python,763,Text-to-video generation: CogVideoX (2024) and CogVideo (ICLR 2023),508,5585,https://avatars.githubusercontent.com/u/48590610?v=4
331380723,pico-sdk,raspberrypi/pico-sdk,C,218,,877,3517,https://avatars.githubusercontent.com/u/1294177?v=4
441833482,SpoofDPI,xvzc/SpoofDPI,Go,636,A simple and fast anti-censorship tool written in Go,204,2523,https://avatars.githubusercontent.com/u/45588457?u=16d2ea7a2149740ce214e24b9354ab8879d7c590&v=4
769149672,LLaVA-NeXT,LLaVA-VL/LLaVA-NeXT,Python,373,,114,1861,https://avatars.githubusercontent.com/u/131001649?v=4
646537482,SimpleTuner,bghira/SimpleTuner,Python,321,A general fine-tuning kit geared toward diffusion models.,86,1122,https://avatars.githubusercontent.com/u/59658056?u=5d202cf86984c328e9d8ab8cf745af986a0ca8ca&v=4
