id,name,full_name,language,new stars,description,forks_count,stargazers_count,avatar_url
111583593,scrcpy,Genymobile/scrcpy,C,587,Display and control your Android device,10779,112948,https://avatars.githubusercontent.com/u/3427627?v=4
13233158,obs-studio,obsproject/obs-studio,C,162,OBS Studio - Free and open source software for live streaming and screen recording,8009,60554,https://avatars.githubusercontent.com/u/7725691?v=4
1903522,php-src,php/php-src,C,70,The PHP Interpreter,7758,38291,https://avatars.githubusercontent.com/u/25158?v=4
37912398,nginx,nginx/nginx,C,107,The official NGINX Open Source repository.,7004,25300,https://avatars.githubusercontent.com/u/1412239?v=4
29759715,zstd,facebook/zstd,C,72,Zstandard - Fast real-time compression algorithm,2112,23825,https://avatars.githubusercontent.com/u/69631?v=4
214011414,WindTerm,kingToolbox/WindTerm,C,177,A professional cross-platform SSH/Sftp/Shell/Telnet/Serial terminal.,1811,23679,https://avatars.githubusercontent.com/u/51009775?v=4
13836499,raylib,raysan5/raylib,C,238,A simple and easy-to-use library to enjoy videogames programming,2289,22930,https://avatars.githubusercontent.com/u/5766837?u=28d52cd1077b2f8b48d3897e82f03280a565e8d6&v=4
45821540,openwrt,openwrt/openwrt,C,123,This repository is a mirror of https://git.openwrt.org/openwrt/openwrt.git It is for reference only and is not active for check-ins.  We will continue to accept Pull Requests here. They will be merged via staging trees then into openwrt.git.,10552,20483,https://avatars.githubusercontent.com/u/2528830?v=4
470579591,unleashed-firmware,DarkFlippers/unleashed-firmware,C,84,Flipper Zero Unleashed Firmware,1463,17664,https://avatars.githubusercontent.com/u/115378555?v=4
60667730,lvgl,lvgl/lvgl,C,393,"Embedded graphics library to create beautiful UIs for any MCU, MPU and display type. ",3291,17476,https://avatars.githubusercontent.com/u/19811762?v=4
179354282,OpenCorePkg,acidanthera/OpenCorePkg,C,43,OpenCore bootloader,2118,13477,https://avatars.githubusercontent.com/u/39672954?v=4
330008801,SDL,libsdl-org/SDL,C,134,Simple Directmedia Layer,1858,10182,https://avatars.githubusercontent.com/u/77683370?v=4
224151065,Nuklear,Immediate-Mode-UI/Nuklear,C,34,A single-header ANSI C immediate mode cross-platform GUI library,571,9345,https://avatars.githubusercontent.com/u/58210959?v=4
88327406,xmrig,xmrig/xmrig,C,77,"RandomX, KawPow, CryptoNight and GhostRider unified CPU/GPU miner and RandomX benchmark",3466,8808,https://avatars.githubusercontent.com/u/27528955?u=555699fb82e7598ed7dd1f6e47302042b48a10c3&v=4
3681392,hackrf,greatscottgadgets/hackrf,C,31,low cost software radio platform,1537,6635,https://avatars.githubusercontent.com/u/5904722?v=4
1286805,OpenBLAS,OpenMathLib/OpenBLAS,C,21,OpenBLAS is an optimized BLAS library based on GotoBLAS2 1.13 BSD version. ,1508,6420,https://avatars.githubusercontent.com/u/9943298?v=4
470373719,istoreos,istoreos/istoreos,C,55,提供一个人人会用的的路由、NAS系统 （目前活跃的分支是 istoreos-22.03）,536,5120,https://avatars.githubusercontent.com/u/107662817?v=4
144465372,proxmark3,RfidResearchGroup/proxmark3,C,32,Iceman Fork - Proxmark3,1068,4061,https://avatars.githubusercontent.com/u/40314039?v=4
331380723,pico-sdk,raspberrypi/pico-sdk,C,17,,950,3777,https://avatars.githubusercontent.com/u/1294177?v=4
61231339,raygui,raysan5/raygui,C,39,A simple and easy-to-use immediate-mode gui library,304,3604,https://avatars.githubusercontent.com/u/5766837?u=28d52cd1077b2f8b48d3897e82f03280a565e8d6&v=4
53432472,sonic-buildimage,sonic-net/sonic-buildimage,C,2,Scripts which perform an installable binary image build for SONiC,1434,741,https://avatars.githubusercontent.com/u/102750714?v=4
