id,name,full_name,language,new stars,description,forks_count,stargazers_count,avatar_url
10270250,react,facebook/react,JavaScript,408,"A declarative, efficient, and flexible JavaScript library for building user interfaces.",40278,194855,https://avatars.githubusercontent.com/u/69631?v=4
36633370,awesome-selfhosted,awesome-selfhosted/awesome-selfhosted,JavaScript,922,A list of Free Software network services and web applications which can be hosted on your own servers,6416,102966,https://avatars.githubusercontent.com/u/24270415?v=4
112507086,30-seconds-of-code,30-seconds/30-seconds-of-code,JavaScript,491,Short JavaScript code snippets for all your development needs,10713,102911,https://avatars.githubusercontent.com/u/43479428?v=4
943149,d3,d3/d3,JavaScript,177,"Bring data to life with SVG, Canvas and HTML. :bar_chart::chart_with_upwards_trend::tada:",23174,102796,https://avatars.githubusercontent.com/u/1562726?v=4
70107786,next.js,vercel/next.js,JavaScript,406,The React Framework,20224,92690,https://avatars.githubusercontent.com/u/14985020?v=4
576201,three.js,mrdoob/three.js,JavaScript,211,JavaScript 3D Library.,32857,85337,https://avatars.githubusercontent.com/u/97088?u=95046da3776175b5f3d1ad2137704cd123e04d9e&v=4
311525798,Web-Dev-For-Beginners,microsoft/Web-Dev-For-Beginners,JavaScript,385,"24 Lessons, 12 Weeks, Get Started as a Web Developer",8662,57324,https://avatars.githubusercontent.com/u/6154722?v=4
157616880,iptv,iptv-org/iptv,JavaScript,296,Collection of publicly available IPTV channels from all over the world,9647,55661,https://avatars.githubusercontent.com/u/55937028?v=4
42283287,preact,preactjs/preact,JavaScript,83,⚛️ Fast 3kB React alternative with the same modern API. Components & Virtual DOM.,1821,32872,https://avatars.githubusercontent.com/u/26872990?v=4
19745004,odoo,odoo/odoo,JavaScript,82,Odoo. Open Source Apps To Grow Your Business.,16946,26201,https://avatars.githubusercontent.com/u/6368483?v=4
91253698,ccxt,ccxt/ccxt,JavaScript,75,A JavaScript / Python / PHP cryptocurrency trading API with support for more than 100 bitcoin/altcoin exchanges,6291,25680,https://avatars.githubusercontent.com/u/31901609?v=4
180190854,appwrite,appwrite/appwrite,JavaScript,411,"Secure Backend Server for Web, Mobile & Flutter Developers 🚀 AKA the 100% open-source Firebase alternative.",1949,25001,https://avatars.githubusercontent.com/u/25003669?v=4
135614069,reactjs-interview-questions,sudheerj/reactjs-interview-questions,JavaScript,193,List of top 500 ReactJS Interview Questions & Answers....Coding exercise questions are coming soon!!,5875,23802,https://avatars.githubusercontent.com/u/3127317?u=0ae9c57bd70b06b2e2293323841ebf59cf3dca90&v=4
85541218,weekly,ascoders/weekly,JavaScript,367,前端精读周刊。帮你理解最前沿、实用的技术。,2576,21520,https://avatars.githubusercontent.com/u/7970947?u=730a8387e8cd0725e005f4bedb868efdd627c06d&v=4
382496361,uptime-kuma,louislam/uptime-kuma,JavaScript,269,A fancy self-hosted monitoring tool,1732,21265,https://avatars.githubusercontent.com/u/1336778?u=5f96cafa12ed95d786d4b84bcf284e8fb2bedd89&v=4
10114077,Inquirer.js,SBoudrias/Inquirer.js,JavaScript,46,A collection of common interactive command line user interfaces.,1170,16820,https://avatars.githubusercontent.com/u/923865?u=9b8363e8a37caedaf0c542245e76b181e70f2f13&v=4
61204547,Detox,wix/Detox,JavaScript,30,Gray box end-to-end testing and automation framework for mobile apps,1880,9869,https://avatars.githubusercontent.com/u/686511?v=4
68287594,academicpages.github.io,academicpages/academicpages.github.io,JavaScript,198,"Github Pages template for academic personal websites, forked from mmistakes/minimal-mistakes",22346,6395,https://avatars.githubusercontent.com/u/22107085?v=4
235468657,pipedream,PipedreamHQ/pipedream,JavaScript,73,"Connect APIs, remarkably fast.  Free for developers.",2953,4426,https://avatars.githubusercontent.com/u/43791938?v=4
353775942,notesnook,streetwriters/notesnook,JavaScript,663,A fully open source & end-to-end encrypted note taking alternative to Evernote.,183,3503,https://avatars.githubusercontent.com/u/63662537?v=4
528313152,homepage,benphelps/homepage,JavaScript,666,A highly customizable homepage (or startpage / application dashboard) with Docker and service API integrations.,57,1095,https://avatars.githubusercontent.com/u/82196?u=039174a447ce8bbe3acdfe8698baef6c9cdba99f&v=4
342605092,nextjs-course-code,mschwarzmueller/nextjs-course-code,JavaScript,17,Source code for my NextJS course (https://acad.link/nextjs),1414,659,https://avatars.githubusercontent.com/u/16095164?v=4
332548472,devops-step-by-step,MohamedRadwan-DevOps/devops-step-by-step,JavaScript,59,Learn DevOps Step-by-step,118,514,https://avatars.githubusercontent.com/u/14263956?u=6c283d3d38d6a695cbfaa1e1d6f6c0bbaf0f414a&v=4
532935306,ShowHiddenChannelsReturns,NotCapengeR/ShowHiddenChannelsReturns,JavaScript,53,"Displays all hidden Channels, which can't be accessed due to Role Restrictions, this won't allow you to read them (impossible) ",51,176,https://avatars.githubusercontent.com/u/90960831?u=ae42787c702b5bcad1b9b30db79932e1e6495420&v=4
362246260,binary-upload-boom,100devs/binary-upload-boom,JavaScript,58,The 100Devs Social Network,667,136,https://avatars.githubusercontent.com/u/78974944?v=4
