id,name,full_name,language,new stars,description,forks_count,stargazers_count,avatar_url
8514,rails,rails/rails,Ruby,82,Ruby on Rails,21649,55970,https://avatars.githubusercontent.com/u/4223?v=4
65252,jekyll,jekyll/jekyll,Ruby,60,:globe_with_meridians: Jekyll is a blog-aware static site generator in Ruby,9972,49154,https://avatars.githubusercontent.com/u/3083652?v=4
52281283,mastodon,mastodon/mastodon,Ruby,62,"Your self-hosted, globally interconnected microblogging community",6959,47019,https://avatars.githubusercontent.com/u/24979032?v=4
27442967,fastlane,fastlane/fastlane,Ruby,54,🚀 The easiest way to automate building and releasing your iOS and Android apps,5706,39578,https://avatars.githubusercontent.com/u/11098337?v=4
13840241,devdocs,freeCodeCamp/devdocs,Ruby,44,API Documentation Browser,2350,35210,https://avatars.githubusercontent.com/u/9892522?v=4
2293158,metasploit-framework,rapid7/metasploit-framework,Ruby,73,Metasploit Framework,13949,34072,https://avatars.githubusercontent.com/u/1013671?v=4
737898780,maybe,maybe-finance/maybe,Ruby,585,The OS for your personal finances,2346,31866,https://avatars.githubusercontent.com/u/80786585?v=4
37382858,engineering-blogs,kilimchoi/engineering-blogs,Ruby,122,A curated list of engineering blogs,1620,31604,https://avatars.githubusercontent.com/u/1356007?u=c1ae28679aee148c3e9984e00497968cf419e284&v=4
202291859,chatwoot,chatwoot/chatwoot,Ruby,71,"Open-source live-chat, email support, omni-channel desk. An alternative to Intercom, Zendesk, Salesforce Service Cloud etc. 🔥💬",3509,20981,https://avatars.githubusercontent.com/u/23416667?v=4
3195124,sidekiq,sidekiq/sidekiq,Ruby,6,"Simple, efficient background processing for Ruby",2420,13155,https://avatars.githubusercontent.com/u/124714131?v=4
3314,spree,spree/spree,Ruby,113,An open source eCommerce platform giving you full control and customizability. Modular and API-first. Build any eCommerce solution that your business requires. Developed by @vendo-dev,4945,13038,https://avatars.githubusercontent.com/u/56702?v=4
1918677,fluentd,fluent/fluentd,Ruby,19,Fluentd: Unified Logging Layer (project under CNCF),1341,12890,https://avatars.githubusercontent.com/u/859518?v=4
4095287,rubocop,rubocop/rubocop,Ruby,15,"A Ruby static code analyzer and formatter, based on the community Ruby style guide.",3059,12636,https://avatars.githubusercontent.com/u/10871348?v=4
1725199,linguist,github-linguist/linguist,Ruby,21,"Language Savant. If your repository's language is being reported incorrectly, send us a pull request!",4247,12267,https://avatars.githubusercontent.com/u/20014732?v=4
96395,faker,faker-ruby/faker,Ruby,13,"A library for generating fake data such as names, addresses, and phone numbers.",3181,11258,https://avatars.githubusercontent.com/u/47637297?v=4
15435,liquid,Shopify/liquid,Ruby,15,"Liquid markup language. Safe, customer facing template language for flexible web apps. ",1386,11086,https://avatars.githubusercontent.com/u/8085?v=4
361310,capybara,teamcapybara/capybara,Ruby,9,Acceptance test framework for web applications,1452,10026,https://avatars.githubusercontent.com/u/23465623?v=4
22059578,pghero,ankane/pghero,Ruby,61,A performance dashboard for Postgres,452,8142,https://avatars.githubusercontent.com/u/220358?u=ba13f3240d7992dc4124a33a4fc65bf4924e5375&v=4
16549503,scientist,github/scientist,Ruby,6,:microscope: A Ruby library for carefully refactoring critical paths.,438,7461,https://avatars.githubusercontent.com/u/9919?v=4
211588,paper_trail,paper-trail-gem/paper_trail,Ruby,10,Track changes to your rails models,895,6778,https://avatars.githubusercontent.com/u/38986600?v=4
30985840,solidus,solidusio/solidus,Ruby,11,"🛒 Solidus, the open-source eCommerce framework for industry trailblazers.",1289,5007,https://avatars.githubusercontent.com/u/11045486?v=4
11426474,choosealicense.com,github/choosealicense.com,Ruby,9,A site to provide non-judgmental guidance on choosing a license for your open source project,1336,3684,https://avatars.githubusercontent.com/u/9919?v=4
567248876,solid_cache,rails/solid_cache,Ruby,9,A database-backed ActiveSupport::Cache::Store,60,864,https://avatars.githubusercontent.com/u/4223?v=4
66497320,dd-trace-rb,DataDog/dd-trace-rb,Ruby,1,Datadog Tracing Ruby Client,374,308,https://avatars.githubusercontent.com/u/365230?v=4
