id,name,full_name,language,new stars,description,forks_count,stargazers_count,avatar_url
1863329,laravel,laravel/laravel,PHP,9,"Laravel is a web application framework with expressive, elegant syntax. Weâ€™ve already laid the foundation for your next big idea â€” freeing you to create without sweating the small things.",23870,74183,https://avatars.githubusercontent.com/u/958072?v=4
458058,symfony,symfony/symfony,PHP,4,The Symfony PHP framework,9160,28556,https://avatars.githubusercontent.com/u/143937?v=4
60243197,server,nextcloud/server,PHP,10,"â˜ï¸ Nextcloud server, a safe home for all your data",3649,23476,https://avatars.githubusercontent.com/u/19211038?v=4
448045,phpunit,sebastianbergmann/phpunit,PHP,2,The PHP Unit Testing framework.,2191,19250,https://avatars.githubusercontent.com/u/25218?u=01bb70d9be43ded7572eb3862127ff281daa2725&v=4
1548202,matomo,matomo-org/matomo,PHP,7,Liberating Web Analytics. Star us on Github? +1. Matomo is the leading open alternative to Google Analytics that gives you full control over your data. Matomo lets you easily collect data from websites & apps and visualise this data and extract insights. Privacy is built-in. We love Pull Requests! ,2526,18016,https://avatars.githubusercontent.com/u/698038?v=4
12615154,laravel-debugbar,barryvdh/laravel-debugbar,PHP,4,Debugbar for Laravel (Integrates PHP Debug Bar),1491,15389,https://avatars.githubusercontent.com/u/973269?u=5c91f55a44fa388c096c4d77111346dee758bd44&v=4
9193949,wallabag,wallabag/wallabag,PHP,12,wallabag is a self hostable application for saving web pages: Save and classify articles. Read them later. Freely.,723,8678,https://avatars.githubusercontent.com/u/4143872?v=4
14346979,snipe-it,snipe/snipe-it,PHP,3,A free open source IT asset/license management system,2687,8420,https://avatars.githubusercontent.com/u/197404?u=3a3faa7eb52d0ccb5d757cab2633677328bbffb2&v=4
9791525,DVWA,digininja/DVWA,PHP,5,Damn Vulnerable Web Application (DVWA),2786,7881,https://avatars.githubusercontent.com/u/117081?u=cee7912aa7d3832b009472e54c3d6f5aaacd9c61&v=4
129852395,dujiaoka,assimon/dujiaoka,PHP,7,ðŸ¦„ç‹¬è§’æ•°å¡(è‡ªåŠ¨å”®è´§ç³»ç»Ÿ)-å¼€æºç«™é•¿è‡ªåŠ¨åŒ–å”®è´§è§£å†³æ–¹æ¡ˆã€é«˜æ•ˆã€ç¨³å®šã€å¿«é€Ÿï¼ðŸš€ðŸš€ðŸŽ‰ðŸŽ‰,1630,5905,https://avatars.githubusercontent.com/u/35057561?u=8c3289ad741dbe5cd3d62d0a98e26664f06b137a&v=4
129829848,pixelfed,pixelfed/pixelfed,PHP,4,Photo Sharing. For Everyone.,598,4984,https://avatars.githubusercontent.com/u/38410642?v=4
351298555,wave,thedevdojo/wave,PHP,1,"Wave - The Software as a Service Starter Kit, designed to help you build the SAAS of your dreams ðŸš€ ðŸ’° ",611,4542,https://avatars.githubusercontent.com/u/3056664?v=4
6495081,mediawiki,wikimedia/mediawiki,PHP,3,ðŸŒ» The collaborative editing software that runs Wikipedia. MirrorÂ fromÂ https://gerrit.wikimedia.org/g/mediawiki/core. SeeÂ https://mediawiki.org/wiki/Developer_access forÂ contributing.,1316,3543,https://avatars.githubusercontent.com/u/56668?v=4
216849756,v2board,v2board/v2board,PHP,7,ðŸš€A multiple proxy protocol manage panel application interface,1063,3236,https://avatars.githubusercontent.com/u/56885001?v=4
359687154,readme-typing-svg,DenverCoder1/readme-typing-svg,PHP,12,"âš¡ Dynamically generated, customizable SVG that gives the appearance of typing and deleting text for use on your profile page, repositories, or website.",528,3182,https://avatars.githubusercontent.com/u/20955511?u=5bbdbfe0199b05d6ca913fb799236c8beedcd192&v=4
69691727,PocketMine-MP,pmmp/PocketMine-MP,PHP,1,A server software for Minecraft: Bedrock Edition in PHP,1716,3102,https://avatars.githubusercontent.com/u/22548559?v=4
93982796,RED_HAWK,Tuhinshubhra/RED_HAWK,PHP,2,"All in one tool for Information Gathering, Vulnerability Scanning and Crawling. A must have tool for all penetration testers",830,2552,https://avatars.githubusercontent.com/u/28696468?v=4
433383766,all-in-one,nextcloud/all-in-one,PHP,5,Nextcloud AIO stands for Nextcloud All-in-One and provides easy deployment and maintenance with most features included in this one Nextcloud instance.,322,2240,https://avatars.githubusercontent.com/u/19211038?v=4
345315720,Rafel-Rat,swagkarna/Rafel-Rat,PHP,0,-------> RAFEL<------  Android Rat  Written in Java With WebPanel For Controlling Victims...Hack Android Devices,362,947,https://avatars.githubusercontent.com/u/46685308?u=09915a5b311804afc20fd9c9a88d9810c8948440&v=4
499717126,btcloud,flucont/btcloud,PHP,2,PHPå¼€å‘çš„å®å¡”é¢æ¿ç¬¬ä¸‰æ–¹äº‘ç«¯,406,823,https://avatars.githubusercontent.com/u/106855675?v=4
623126190,level-up,cjmellor/level-up,PHP,27,"Level-Up is a Laravel package introducing gamification into your applications. Users earn experience points (XP) and levels through interactions, while also unlocking achievements. It promotes engagement, competition, and fun through its dynamic leaderboard feature. Customisable to fit your specific needs",7,230,https://avatars.githubusercontent.com/u/1848476?v=4
625678832,electron,NativePHP/electron,PHP,5,Electron backend for NativePHP,31,191,https://avatars.githubusercontent.com/u/130286900?v=4
616344324,prompts,laravel/prompts,PHP,18,,7,58,https://avatars.githubusercontent.com/u/958072?v=4
651002237,FallingSkies-CVE-2023-35885,datackmy/FallingSkies-CVE-2023-35885,PHP,4,Cloudpanel 0-day Exploit,8,37,https://avatars.githubusercontent.com/u/135962799?v=4
