id,name,full_name,language,new stars,description,forks_count,stargazers_count,avatar_url
8514,rails,rails/rails,Ruby,260,Ruby on Rails,21120,52862,https://avatars.githubusercontent.com/u/4223?v=4
52281283,mastodon,mastodon/mastodon,Ruby,530,"Your self-hosted, globally interconnected microblogging community",6195,41666,https://avatars.githubusercontent.com/u/24979032?v=4
7569578,discourse,discourse/discourse,Ruby,219,"A platform for community discussion. Free, open, simple.",7992,37907,https://avatars.githubusercontent.com/u/3220138?v=4
27442967,fastlane,fastlane/fastlane,Ruby,254,🚀 The easiest way to automate building and releasing your iOS and Android apps,5525,37071,https://avatars.githubusercontent.com/u/11098337?v=4
53238813,brew,Homebrew/brew,Ruby,368,🍺 The missing package manager for macOS (or Linux),8834,36037,https://avatars.githubusercontent.com/u/1503512?v=4
2293158,metasploit-framework,rapid7/metasploit-framework,Ruby,267,Metasploit Framework,13193,30259,https://avatars.githubusercontent.com/u/1013671?v=4
481872,vagrant,hashicorp/vagrant,Ruby,117,Vagrant is a tool for building and distributing development environments.,4380,25198,https://avatars.githubusercontent.com/u/761456?v=4
2500088,gitlabhq,gitlabhq/gitlabhq,Ruby,51,GitLab CE Mirror | Please open new issues in our issue tracker on GitLab.com,5733,23257,https://avatars.githubusercontent.com/u/1086321?v=4
73648678,forem,forem/forem,Ruby,153,For empowering community 🌱,3712,20604,https://avatars.githubusercontent.com/u/65030610?v=4
538746,ruby,ruby/ruby,Ruby,170,The Ruby Programming Language,5324,20357,https://avatars.githubusercontent.com/u/210414?v=4
202291859,chatwoot,chatwoot/chatwoot,Ruby,252,"Open-source customer engagement suite, an alternative to Intercom, Zendesk, Salesforce Service Cloud etc. 🔥💬",2194,15233,https://avatars.githubusercontent.com/u/23416667?v=4
88740103,postal,postalserver/postal,Ruby,115,✉️ A fully featured open source mail delivery platform for incoming & outgoing e-mail,916,12690,https://avatars.githubusercontent.com/u/58169103?v=4
3195124,sidekiq,sidekiq/sidekiq,Ruby,56,"Simple, efficient background processing for Ruby",2319,12479,https://avatars.githubusercontent.com/u/124714131?v=4
52855516,homebrew-core,Homebrew/homebrew-core,Ruby,120,🍻 Default formulae for the missing package manager for macOS (or Linux),11473,12446,https://avatars.githubusercontent.com/u/1503512?v=4
1157388,tmuxinator,tmuxinator/tmuxinator,Ruby,61,Manage complex tmux sessions easily,630,11933,https://avatars.githubusercontent.com/u/6574276?v=4
1725199,linguist,github-linguist/linguist,Ruby,119,"Language Savant. If your repository's language is being reported incorrectly, send us a pull request!",4081,11022,https://avatars.githubusercontent.com/u/20014732?v=4
361310,capybara,teamcapybara/capybara,Ruby,12,Acceptance test framework for web applications,1442,9824,https://avatars.githubusercontent.com/u/23465623?v=4
6899875,openproject,opf/openproject,Ruby,124,OpenProject is the leading open source project management software.,1865,6874,https://avatars.githubusercontent.com/u/1756674?v=4
1314319,canvas-lms,instructure/canvas-lms,Ruby,52,"The open LMS by Instructure, Inc.",2173,4831,https://avatars.githubusercontent.com/u/515326?v=4
1952825,homebrew-bundle,Homebrew/homebrew-bundle,Ruby,50,"📦 Bundler for non-Ruby dependencies from Homebrew, Homebrew Cask and the Mac App Store.",288,4495,https://avatars.githubusercontent.com/u/1503512?v=4
103766152,explore,github/explore,Ruby,63,Community-curated topic and collection pages on GitHub,12782,3805,https://avatars.githubusercontent.com/u/9919?v=4
1404127,ruby-jwt,jwt/ruby-jwt,Ruby,12,A ruby implementation of the RFC 7519 OAuth JSON Web Token (JWT) standard.,376,3461,https://avatars.githubusercontent.com/u/10998651?v=4
93163073,dependabot-core,dependabot/dependabot-core,Ruby,71,🤖 Dependabot's core logic for creating update PR's.,803,3381,https://avatars.githubusercontent.com/u/27347476?v=4
11426474,choosealicense.com,github/choosealicense.com,Ruby,42,A site to provide non-judgmental guidance on choosing a license for your open source project,1456,3262,https://avatars.githubusercontent.com/u/9919?v=4
467296689,bullet_train,bullet-train-co/bullet_train,Ruby,368,The Open Source Ruby on Rails SaaS Template,178,1247,https://avatars.githubusercontent.com/u/5976880?v=4
