id,name,full_name,language,new stars,description,forks_count,stargazers_count,avatar_url
6201092,mpv,mpv-player/mpv,C,20,🎥 Command line video player,2950,29184,https://avatars.githubusercontent.com/u/2550273?v=4
20159867,stb,nothings/stb,C,13,stb single-file public domain libraries for C/C++,7739,27478,https://avatars.githubusercontent.com/u/7525026?u=a23ba3a549fff291e35446cb32c8979bd29be6c9&v=4
14812739,libuv,libuv/libuv,C,9,Cross-platform asynchronous I/O,3623,24591,https://avatars.githubusercontent.com/u/4030929?v=4
45821540,openwrt,openwrt/openwrt,C,20,This repository is a mirror of https://git.openwrt.org/openwrt/openwrt.git It is for reference only and is not active for check-ins.  We will continue to accept Pull Requests here. They will be merged via staging trees then into openwrt.git.,10726,21085,https://avatars.githubusercontent.com/u/2528830?v=4
272457606,cosmopolitan,jart/cosmopolitan,C,10,build-once run-anywhere c library,650,18650,https://avatars.githubusercontent.com/u/49262?u=ac68933ab61c639ab59ae693a41ae89cd874c16e&v=4
490465859,Flipper,UberGuidoZ/Flipper,C,11,Playground (and dump) of stuff I make or modify for the Flipper Zero,3333,14389,https://avatars.githubusercontent.com/u/57457139?u=3b283c3083a1fee457b897d7c8fda97b873e9807&v=4
65899476,esp-idf,espressif/esp-idf,C,11,Espressif IoT Development Framework. Official development framework for Espressif SoCs.,7386,14168,https://avatars.githubusercontent.com/u/9460735?v=4
543276238,libsql,tursodatabase/libsql,C,27,"libSQL is a fork of SQLite that is both Open Source, and Open Contributions.",329,13251,https://avatars.githubusercontent.com/u/139391156?v=4
15583310,SoftEtherVPN,SoftEtherVPN/SoftEtherVPN,C,38,Cross-platform multi-protocol VPN software. Pull requests are welcome. The stable version is available at https://github.com/SoftEtherVPN/SoftEtherVPN_Stable.,2615,11867,https://avatars.githubusercontent.com/u/6303100?v=4
330008801,SDL,libsdl-org/SDL,C,13,Simple Directmedia Layer,1921,10739,https://avatars.githubusercontent.com/u/77683370?v=4
2328181,freebsd-src,freebsd/freebsd-src,C,6,The FreeBSD src tree publish-only repository. Experimenting with 'simple' pull requests....,2907,8049,https://avatars.githubusercontent.com/u/811839?v=4
68082730,IronOS,Ralim/IronOS,C,5,Open Source Soldering Iron firmware,735,7388,https://avatars.githubusercontent.com/u/5425387?v=4
470373719,istoreos,istoreos/istoreos,C,9,提供一个人人会用的的路由、NAS系统 （目前活跃的分支是 istoreos-22.03）,559,5379,https://avatars.githubusercontent.com/u/107662817?v=4
61231339,raygui,raysan5/raygui,C,6,A simple and easy-to-use immediate-mode gui library,312,3716,https://avatars.githubusercontent.com/u/5766837?u=28d52cd1077b2f8b48d3897e82f03280a565e8d6&v=4
23780138,riscv-gnu-toolchain,riscv-collab/riscv-gnu-toolchain,C,2,"GNU toolchain for RISC-V, including GCC",1192,3659,https://avatars.githubusercontent.com/u/89536104?v=4
19881421,dosbox-x,joncampbell123/dosbox-x,C,2,DOSBox-X fork of the DOSBox project,394,2881,https://avatars.githubusercontent.com/u/6245486?u=af4426463edef2eb241f2c8c7e59a801efa67472&v=4
43677244,pokeemerald,pret/pokeemerald,C,3,Decompilation of Pokémon Emerald,2724,2340,https://avatars.githubusercontent.com/u/10761592?v=4
342120988,arduino-pico,earlephilhower/arduino-pico,C,3,"Raspberry Pi Pico Arduino core, for all RP2040 and RP2350 boards",448,2154,https://avatars.githubusercontent.com/u/11875?u=fefb7f1675bab97530a8c6a77f07dde76662cd80&v=4
157359627,esp32-camera,espressif/esp32-camera,C,2,,651,2001,https://avatars.githubusercontent.com/u/9460735?v=4
454138964,OpenBK7231T_App,openshwprojects/OpenBK7231T_App,C,5,"Open source firmware (Tasmota/Esphome replacement) for BK7231T, BK7231N, BL2028N, T34, XR809, W800/W801, W600/W601, BL602 and LN882H",297,1557,https://avatars.githubusercontent.com/u/85486843?v=4
713058315,quickjs,quickjs-ng/quickjs,C,20,"QuickJS, the Next Generation: a mighty JavaScript engine",114,1247,https://avatars.githubusercontent.com/u/149480552?v=4
850267588,xiaozhi-esp32,78/xiaozhi-esp32,C,137,Build your own AI friend,243,1154,https://avatars.githubusercontent.com/u/4488133?u=c0ce6cda2559f8b3b48d2e29eb917af44fb3c0b3&v=4
127242283,Aegisub,TypesettingTools/Aegisub,C,11,Cross-platform advanced subtitle editor,511,527,https://avatars.githubusercontent.com/u/8305036?v=4
