id,name,full_name,language,new stars,description,forks_count,stargazers_count,avatar_url
2325298,linux,torvalds/linux,C,517,Linux kernel source tree,42303,129664,https://avatars.githubusercontent.com/u/1024025?v=4
156018,redis,redis/redis,C,146,"Redis is an in-memory database that persists on disk. The data model is key-value, but many different kind of values are supported: Strings, Lists, Sets, Sorted Sets, Hashes, Streams, HyperLogLogs, Bitmaps.",21012,54215,https://avatars.githubusercontent.com/u/1529926?v=4
246335987,Ventoy,ventoy/Ventoy,C,349,A new bootable USB solution.,2477,33090,https://avatars.githubusercontent.com/u/59477474?u=16f38c14b69580f87f4717b71c0e5e85e9559cb1&v=4
7634677,openssl,openssl/openssl,C,68,TLS/SSL and crypto library,7877,18032,https://avatars.githubusercontent.com/u/3279138?v=4
47409672,hashcat,hashcat/hashcat,C,236,World's fastest and most advanced password recovery utility,2045,12197,https://avatars.githubusercontent.com/u/15949799?v=4
184909163,yabai,koekeishiya/yabai,C,116,A tiling window manager for macOS based on binary space partitioning,391,10893,https://avatars.githubusercontent.com/u/6175959?u=e07b472bc4fa5500439c2c099a4736bcfd636769&v=4
13836499,raylib,raysan5/raylib,C,242,A simple and easy-to-use library to enjoy videogames programming,1107,9138,https://avatars.githubusercontent.com/u/5766837?u=28d52cd1077b2f8b48d3897e82f03280a565e8d6&v=4
39242894,coturn,coturn/coturn,C,41,coturn TURN server project,1564,7616,https://avatars.githubusercontent.com/u/6572098?v=4
18106269,lz4,lz4/lz4,C,54,Extremely Fast Compression algorithm,1076,6907,https://avatars.githubusercontent.com/u/11667224?v=4
105944401,yugabyte-db,yugabyte/yugabyte-db,C,45,"The high-performance distributed SQL database for global, internet-scale apps.",755,6242,https://avatars.githubusercontent.com/u/17074854?v=4
5870069,librdkafka,edenhill/librdkafka,C,23,The Apache Kafka C/C++ library,2641,5869,https://avatars.githubusercontent.com/u/524990?v=4
40504480,xv6-public,mit-pdos/xv6-public,C,30,xv6 OS,2929,5371,https://avatars.githubusercontent.com/u/12404246?v=4
200321698,chibicc,rui314/chibicc,C,584,A small C compiler,386,4407,https://avatars.githubusercontent.com/u/47400?v=4
29933948,fluent-bit,fluent/fluent-bit,C,26,"Fast and Lightweight Logs and Metrics processor for Linux, BSD, OSX and Windows",1011,3471,https://avatars.githubusercontent.com/u/859518?v=4
2359378,zlib,madler/zlib,C,52,A massively spiffy yet delicately unobtrusive compression library.,1800,3439,https://avatars.githubusercontent.com/u/240717?v=4
198869255,AFL,google/AFL,C,29,american fuzzy lop - a security-oriented fuzzer,455,2625,https://avatars.githubusercontent.com/u/1342004?v=4
469303019,ecapture,ehids/ecapture,C,1382,capture SSL/TLS text content without CA cert by eBPF.,262,2473,https://avatars.githubusercontent.com/u/95527736?v=4
51868010,bubblewrap,containers/bubblewrap,C,228,Unprivileged sandboxing tool,158,2232,https://avatars.githubusercontent.com/u/5874934?v=4
176278485,sqlite,sqlite/sqlite,C,41,Official Git mirror of the SQLite source tree,385,2150,https://avatars.githubusercontent.com/u/48680494?u=4ab40856ccfa4616130de822486cc01350b34e09&v=4
15991457,openssh-portable,openssh/openssh-portable,C,15,Portable OpenSSH,1287,1821,https://avatars.githubusercontent.com/u/2387206?v=4
329707886,m1n1,AsahiLinux/m1n1,C,152,A bootloader and experimentation playground for Apple Silicon,79,1675,https://avatars.githubusercontent.com/u/76157212?v=4
226167620,InfiniTime,InfiniTimeOrg/InfiniTime,C,30,Firmware for Pinetime smartwatch written in C/C++ and based on FreeRTOS,505,1447,https://avatars.githubusercontent.com/u/91782433?v=4
472575717,Shipwright,HarbourMasters/Shipwright,C,139,,110,702,https://avatars.githubusercontent.com/u/88675208?v=4
53432472,sonic-buildimage,Azure/sonic-buildimage,C,4,Scripts which perform an installable binary image build for SONiC,913,392,https://avatars.githubusercontent.com/u/6844498?v=4
473467406,DirtyPipe-Android,polygraphene/DirtyPipe-Android,C,121,Dirty Pipe root exploit for Android (Pixel 6),62,328,https://avatars.githubusercontent.com/u/2751376?v=4
