id,name,full_name,language,new stars,description,forks_count,stargazers_count,avatar_url
21289110,awesome-python,vinta/awesome-python,Python,132,"A curated list of awesome Python frameworks, libraries, software and resources",22365,151694,https://avatars.githubusercontent.com/u/652070?u=95b472a9a11b64ee0f74512ad918d762d42c213c&v=4
71583602,cs-video-courses,Developer-Y/cs-video-courses,,126,List of Computer Science courses with video lectures.,6964,48458,https://avatars.githubusercontent.com/u/22699926?v=4
22067521,imgui,ocornut/imgui,C++,67,Dear ImGui: Bloat-free Graphical User interface for C++ with minimal dependencies,7789,44267,https://avatars.githubusercontent.com/u/8225057?u=de42cf0fa1f1970187db446beea30c61b9c1e6d3&v=4
62367558,hyper,vercel/hyper,TypeScript,23,A terminal built on web technologies,3335,39929,https://avatars.githubusercontent.com/u/14985020?v=4
79162682,joplin,laurent22/joplin,TypeScript,37,"Joplin - an open source note taking and to-do application with synchronisation capabilities for Windows, macOS, Linux, Android and iOS.",3764,33705,https://avatars.githubusercontent.com/u/1285584?v=4
180328715,zustand,pmndrs/zustand,TypeScript,18,🐻 Bear necessities for state management in React,750,25102,https://avatars.githubusercontent.com/u/45790596?v=4
254832799,hackingtool,Z4nzu/hackingtool,Python,406,ALL IN ONE Hacking Tool For Hackers,2945,24192,https://avatars.githubusercontent.com/u/25708027?u=43d51529db320284423e8eab65383767c6f52fa7&v=4
323048702,OpenBBTerminal,OpenBB-finance/OpenBBTerminal,Python,40,"Investment Research for Everyone, Anywhere.",1932,18562,https://avatars.githubusercontent.com/u/80064875?v=4
186733095,v2rayNG,2dust/v2rayNG,Kotlin,36,"A V2Ray client for Android, support Xray core and v2fly core",3042,18284,https://avatars.githubusercontent.com/u/31833384?v=4
350360184,cal.com,calcom/cal.com,TypeScript,77,Scheduling infrastructure for absolutely everyone.,1822,14966,https://avatars.githubusercontent.com/u/79145102?v=4
323965659,alist,alist-org/alist,Go,122,"🗂️A file list program that supports multiple storage, powered by Gin and Solidjs. / 一个支持多存储的文件列表程序，使用 Gin 和 Solidjs。",2093,14595,https://avatars.githubusercontent.com/u/97389433?v=4
189621607,docs,github/docs,JavaScript,24,The open-source repo for docs.github.com,58194,12501,https://avatars.githubusercontent.com/u/9919?v=4
263727855,polars,pola-rs/polars,Rust,167,"Fast multi-threaded, hybrid-streaming DataFrame library in Rust | Python | Node.js",577,11182,https://avatars.githubusercontent.com/u/83768144?v=4
37346186,termux-packages,termux/termux-packages,Shell,17,A build system and primary set of packages for Termux.,2540,9549,https://avatars.githubusercontent.com/u/8104776?v=4
19897878,docker-minecraft-server,itzg/docker-minecraft-server,Shell,23,Docker image that provides a Minecraft Server that will automatically download selected version at startup,1161,5796,https://avatars.githubusercontent.com/u/988985?v=4
166658783,sre-interview-prep-guide,mxssl/sre-interview-prep-guide,,56,Site Reliability Engineer Interview Preparation Guide,1107,4143,https://avatars.githubusercontent.com/u/14476356?u=70e8c4a181f24e6635dbdda883071b577884512b&v=4
325456028,GCPSketchnote,priyankavergadia/GCPSketchnote,,39,"If you are looking to become a Google Cloud Engineer , then you are at the right place. GCPSketchnote is series where I share Google Cloud concepts in quick and easy to learn format.",534,3667,https://avatars.githubusercontent.com/u/1310366?u=25081ac05fda8f5297741341162024e0db40ed99&v=4
565629124,osv-scanner,google/osv-scanner,Go,148,Vulnerability scanner written in Go which uses the data provided by https://osv.dev,169,3648,https://avatars.githubusercontent.com/u/1342004?v=4
570011726,zlib-searcher,zlib-searcher/zlib-searcher,TypeScript,155,search zlib/libgen index to get ipfs_cid.,225,3264,https://avatars.githubusercontent.com/u/119907818?v=4
577603990,Open-Assistant,LAION-AI/Open-Assistant,Jupyter Notebook,353,"OpenAssistant is a chat-based assistant that understands tasks, can interact with third-party systems, and retrieve information dynamically to do so.",232,2785,https://avatars.githubusercontent.com/u/92627801?v=4
178120741,exploitation-course,ashemery/exploitation-course,Python,94,Offensive Software Exploitation Course,276,1377,https://avatars.githubusercontent.com/u/3056337?u=7ca52cad90f6507784fee7fa9caaf43cd92d8ef5&v=4
582822129,nanoGPT,karpathy/nanoGPT,Python,351,"The simplest, fastest repository for training/finetuning medium-sized GPTs.",53,1134,https://avatars.githubusercontent.com/u/241138?u=05376db54475c3d23b3a409f4c47d14c4855dc28&v=4
367480581,Swiftfin,jellyfin/Swiftfin,Swift,15,Native Jellyfin Client for iOS and tvOS ,90,992,https://avatars.githubusercontent.com/u/45698031?v=4
560704231,gpt_index,jerryjliu/gpt_index,Python,50,An index created by GPT to organize external information and answer queries!,43,641,https://avatars.githubusercontent.com/u/4858925?u=eb0717916ba7f9d8b9402d17a22e6f645d0f97c7&v=4
583450891,crux-top-lists,zakird/crux-top-lists,Python,59,Downloadable snapshots of the Chrome Top Million Websites pulled from public CrUX data in BigQuery.,14,364,https://avatars.githubusercontent.com/u/201296?u=0fecbb138d60dca37f1a8ed7c238679a5a7f978f&v=4
