id,name,full_name,language,new stars,description,forks_count,stargazers_count,avatar_url
100060912,terminal,microsoft/terminal,C++,665,"The new Windows Terminal and the original Windows console host, all in the same place!",7846,89253,https://avatars.githubusercontent.com/u/6154722?v=4
1181927,bitcoin,bitcoin/bitcoin,C++,619,Bitcoin Core integration/staging tree,34552,70024,https://avatars.githubusercontent.com/u/528860?v=4
44838949,swift,apple/swift,C++,641,The Swift Programming Language,10122,63309,https://avatars.githubusercontent.com/u/10639145?v=4
22887094,tesseract,tesseract-ocr/tesseract,C++,683,Tesseract Open Source OCR Engine (main repository),8624,51665,https://avatars.githubusercontent.com/u/8401422?v=4
27729880,grpc,grpc/grpc,C++,347,"The C based gRPC (C++, Python, Ruby, Objective-C, PHP, C#)",10168,38221,https://avatars.githubusercontent.com/u/7802525?v=4
11171548,json,nlohmann/json,C++,451,JSON for Modern C++,6089,35320,https://avatars.githubusercontent.com/u/159488?v=4
116167731,yuzu,yuzu-emu/yuzu,C++,1748,Nintendo Switch Emulator,2546,29200,https://avatars.githubusercontent.com/u/35075882?v=4
160083795,serenity,SerenityOS/serenity,C++,389,The Serenity Operating System 🐞,2738,25175,https://avatars.githubusercontent.com/u/50811782?v=4
3351871,qBittorrent,qbittorrent/qBittorrent,C++,544,qBittorrent BitTorrent client,3423,20768,https://avatars.githubusercontent.com/u/2131270?v=4
26038648,spdlog,gabime/spdlog,C++,604,Fast C++ logging library.,3836,18835,https://avatars.githubusercontent.com/u/6052198?u=a5aaa778f219603fd3a6e221c79370ac5f0fa182&v=4
648343,muduo,chenshuo/muduo,C++,158,Event-driven network library for multi-threaded Linux server in C++11,4997,13207,https://avatars.githubusercontent.com/u/231074?v=4
38581626,pybind11,pybind/pybind11,C++,333,Seamless operability between C++11 and Python,1856,13005,https://avatars.githubusercontent.com/u/17565521?v=4
6520784,rpcs3,RPCS3/rpcs3,C++,164,PS3 emulator/debugger,1767,12757,https://avatars.githubusercontent.com/u/8070735?v=4
104231541,abseil-cpp,abseil/abseil-cpp,C++,289,Abseil Common Libraries (C++),2323,12353,https://avatars.githubusercontent.com/u/26718316?v=4
283410102,workflow,sogou/workflow,C++,240,C++ Parallel Computing and Asynchronous Networking Engine,2105,10886,https://avatars.githubusercontent.com/u/15903299?v=4
138754790,duckdb,duckdb/duckdb,C++,520,DuckDB is an in-process SQL OLAP Database Management System,995,10696,https://avatars.githubusercontent.com/u/82039556?v=4
11577304,dolphin,dolphin-emu/dolphin,C++,710,"Dolphin is a GameCube / Wii emulator, allowing you to play games for these two platforms on PC with improvements.",2334,10614,https://avatars.githubusercontent.com/u/5050316?v=4
28449431,scylladb,scylladb/scylladb,C++,334,"NoSQL data store using the seastar framework, compatible with Apache Cassandra",1033,10365,https://avatars.githubusercontent.com/u/14364730?v=4
156939672,onnxruntime,microsoft/onnxruntime,C++,386,"ONNX Runtime: cross-platform, high performance ML inferencing and training accelerator",2184,9614,https://avatars.githubusercontent.com/u/6154722?v=4
61980658,azerothcore-wotlk,azerothcore/azerothcore-wotlk,C++,438,Complete Open Source and Modular solution for MMO,1810,4046,https://avatars.githubusercontent.com/u/20147732?v=4
354138793,FasterTransformer,NVIDIA/FasterTransformer,C++,412,"Transformer related optimization, including BERT, GPT",630,3733,https://avatars.githubusercontent.com/u/1728152?v=4
586310592,Whisper,Const-me/Whisper,C++,1016,High-performance GPGPU inference of OpenAI's Whisper automatic speech recognition (ASR) model,346,3668,https://avatars.githubusercontent.com/u/925112?v=4
553135896,PrismLauncher,PrismLauncher/PrismLauncher,C++,179,A custom launcher for Minecraft that allows you to easily manage multiple installations of Minecraft at once (Fork of MultiMC),337,3572,https://avatars.githubusercontent.com/u/116031705?v=4
1596580,LibreCAD,LibreCAD/LibreCAD,C++,78,"LibreCAD is a cross-platform 2D CAD program written in C++14 using the Qt framework. It can read DXF and DWG files and can write DXF, PDF and SVG files. The user interface is highly customizable, and has dozens of translations.",903,3492,https://avatars.githubusercontent.com/u/721219?v=4
638661163,strato,strato-emu/strato,C++,405,Run Nintendo Switch homebrew & games on your Android device!,91,984,https://avatars.githubusercontent.com/u/133053931?v=4
