id,name,full_name,language,new stars,description,forks_count,stargazers_count,avatar_url
8514,rails,rails/rails,Ruby,251,Ruby on Rails,21187,53043,https://avatars.githubusercontent.com/u/4223?v=4
65252,jekyll,jekyll/jekyll,Ruby,242,:globe_with_meridians: Jekyll is a blog-aware static site generator in Ruby,10118,46849,https://avatars.githubusercontent.com/u/3083652?v=4
52281283,mastodon,mastodon/mastodon,Ruby,547,"Your self-hosted, globally interconnected microblogging community",6243,42135,https://avatars.githubusercontent.com/u/24979032?v=4
8681349,huginn,huginn/huginn,Ruby,285,Create agents that monitor and act on your behalf.  Your agents are standing by!,3470,38628,https://avatars.githubusercontent.com/u/23225142?v=4
7569578,discourse,discourse/discourse,Ruby,274,"A platform for community discussion. Free, open, simple.",8015,38142,https://avatars.githubusercontent.com/u/3220138?v=4
27442967,fastlane,fastlane/fastlane,Ruby,248,🚀 The easiest way to automate building and releasing your iOS and Android apps,5552,37263,https://avatars.githubusercontent.com/u/11098337?v=4
53238813,brew,Homebrew/brew,Ruby,364,🍺 The missing package manager for macOS (or Linux),8927,36354,https://avatars.githubusercontent.com/u/1503512?v=4
2293158,metasploit-framework,rapid7/metasploit-framework,Ruby,289,Metasploit Framework,13293,30518,https://avatars.githubusercontent.com/u/1013671?v=4
481872,vagrant,hashicorp/vagrant,Ruby,148,Vagrant is a tool for building and distributing development environments.,4396,25251,https://avatars.githubusercontent.com/u/761456?v=4
3623050,homebrew-cask,Homebrew/homebrew-cask,Ruby,101,🍻 A CLI workflow for the administration of macOS applications distributed as binaries,10287,20038,https://avatars.githubusercontent.com/u/1503512?v=4
202291859,chatwoot,chatwoot/chatwoot,Ruby,252,"Open-source customer engagement suite, an alternative to Intercom, Zendesk, Salesforce Service Cloud etc. 🔥💬",2255,15467,https://avatars.githubusercontent.com/u/23416667?v=4
11423758,quine-relay,mame/quine-relay,Ruby,109,An uroboros program with 100+ programming languages,570,13208,https://avatars.githubusercontent.com/u/21557?v=4
88740103,postal,postalserver/postal,Ruby,128,✉️ A fully featured open source mail delivery platform for incoming & outgoing e-mail,925,12803,https://avatars.githubusercontent.com/u/58169103?v=4
52855516,homebrew-core,Homebrew/homebrew-core,Ruby,119,🍻 Default formulae for the missing package manager for macOS (or Linux),11568,12548,https://avatars.githubusercontent.com/u/1503512?v=4
4095287,rubocop,rubocop/rubocop,Ruby,60,"A Ruby static code analyzer and formatter, based on the community Ruby style guide.",3032,12296,https://avatars.githubusercontent.com/u/10871348?v=4
1725199,linguist,github-linguist/linguist,Ruby,101,"Language Savant. If your repository's language is being reported incorrectly, send us a pull request!",4123,11102,https://avatars.githubusercontent.com/u/20014732?v=4
96395,faker,faker-ruby/faker,Ruby,71,"A library for generating fake data such as names, addresses, and phone numbers.",3126,10806,https://avatars.githubusercontent.com/u/47637297?v=4
4994614,wpscan,wpscanteam/wpscan,Ruby,85,WPScan WordPress security scanner. Written for security professionals and blog maintainers to test the security of their WordPress websites. Contact us via contact@wpscan.com,1216,7629,https://avatars.githubusercontent.com/u/1872249?v=4
108278,chef,chef/chef,Ruby,35,"Chef Infra, a powerful automation platform that transforms infrastructure into code automating how infrastructure is configured, deployed and managed across any environment, at any scale",2577,7246,https://avatars.githubusercontent.com/u/29740?v=4
6899875,openproject,opf/openproject,Ruby,143,OpenProject is the leading open source project management software.,1892,7016,https://avatars.githubusercontent.com/u/1756674?v=4
93163073,dependabot-core,dependabot/dependabot-core,Ruby,61,🤖 Dependabot's core logic for creating update PR's.,815,3435,https://avatars.githubusercontent.com/u/27347476?v=4
11426474,choosealicense.com,github/choosealicense.com,Ruby,39,A site to provide non-judgmental guidance on choosing a license for your open source project,1483,3296,https://avatars.githubusercontent.com/u/9919?v=4
502760,danbooru,danbooru/danbooru,Ruby,46,A taggable image board written in Rails.,398,1858,https://avatars.githubusercontent.com/u/57931572?v=4
629651008,langchainrb,andreibondarev/langchainrb,Ruby,214,Build LLM-backed Ruby applications,40,327,https://avatars.githubusercontent.com/u/541665?u=0f6d7d1fff889d549391d5814e837a05d6d00e32&v=4
387924838,phase-3-sinatra-react-project,learn-co-curriculum/phase-3-sinatra-react-project,Ruby,0,,2225,12,https://avatars.githubusercontent.com/u/6208017?v=4
