id,name,full_name,language,new stars,description,forks_count,stargazers_count,avatar_url
15204860,papers-we-love,papers-we-love/papers-we-love,Shell,2048,Papers from the computer science community to read and discuss.,5046,68304,https://avatars.githubusercontent.com/u/6187757?v=4
311525798,Web-Dev-For-Beginners,microsoft/Web-Dev-For-Beginners,JavaScript,3497,"24 Lessons, 12 Weeks, Get Started as a Web Developer",10041,64435,https://avatars.githubusercontent.com/u/6154722?v=4
254832799,hackingtool,Z4nzu/hackingtool,Python,3495,ALL IN ONE Hacking Tool For Hackers,3136,26777,https://avatars.githubusercontent.com/u/25708027?u=43d51529db320284423e8eab65383767c6f52fa7&v=4
510607652,pocketbase,pocketbase/pocketbase,Go,2640,Open Source realtime backend in 1 file,745,19791,https://avatars.githubusercontent.com/u/101000011?v=4
574523116,awesome-chatgpt-prompts,f/awesome-chatgpt-prompts,HTML,8353,This repo includes ChatGPT prompt curation to use ChatGPT better.,1245,15428,https://avatars.githubusercontent.com/u/196477?u=22fbf9ad92cb9f014b0332238284cabf5ab2b00e&v=4
288108533,minGPT,karpathy/minGPT,Python,3110,A minimal PyTorch re-implementation of the OpenAI GPT (Generative Pretrained Transformer) training,1300,11931,https://avatars.githubusercontent.com/u/241138?u=05376db54475c3d23b3a409f4c47d14c4855dc28&v=4
249995750,Reactive-Resume,AmruthPillai/Reactive-Resume,TypeScript,2139,"A one-of-a-kind resume builder that keeps your privacy in mind. Completely secure, customizable, portable, open-source and free forever. Try it out today!",1193,10233,https://avatars.githubusercontent.com/u/1134738?u=0f8751f3a01c2790e7204392a7fb70bcefc56c1c&v=4
4454793,MuseScore,musescore/MuseScore,C++,1196,"MuseScore is an open source and free music notation software. For support, contribution, bug reports, visit MuseScore.org. Fork and make pull requests!",2102,8970,https://avatars.githubusercontent.com/u/380563?v=4
154643390,phoneinfoga,sundowndev/phoneinfoga,Go,852,Information gathering framework for phone numbers,2533,8845,https://avatars.githubusercontent.com/u/16480203?u=736dd20996f73fe51ad2ee2c8dc058d9e89c7a69&v=4
468576060,openai-cookbook,openai/openai-cookbook,Python,7166,Examples and guides for using the OpenAI API,782,8268,https://avatars.githubusercontent.com/u/14957082?v=4
419661684,data-engineering-zoomcamp,DataTalksClub/data-engineering-zoomcamp,Jupyter Notebook,1150,Free Data Engineering course! ,1919,8215,https://avatars.githubusercontent.com/u/72699292?v=4
313197356,vue-pure-admin,xiaoxian521/vue-pure-admin,Vue,1940,ğŸ”¥ âœ¨âœ¨ âœ¨ Vue3+Vite4+Element-Plus+TypeScriptç¼–å†™çš„ä¸€æ¬¾åå°ç®¡ç†ç³»ç»Ÿï¼ˆå…¼å®¹ç§»åŠ¨ç«¯ï¼‰,1259,6307,https://avatars.githubusercontent.com/u/44761321?u=30907819abd29bb3779bc247910873e7c7f7c12f&v=4
561730219,hello-algo,krahets/hello-algo,C#,5004,"ã€ŠHello ç®—æ³•ã€‹ä¸€æœ¬åŠ¨ç”»å›¾è§£ã€èƒ½è¿è¡Œã€å¯æé—®çš„æ•°æ®ç»“æ„ä¸ç®—æ³•å…¥é—¨ä¹¦ã€‚æä¾› Java, C++, Python, Go, JS, TS, C# æºä»£ç ã€‚",678,6088,https://avatars.githubusercontent.com/u/26993056?u=4c717880131ed4230bb6b250e1afc6b740d7c56e&v=4
534330590,dream-textures,carson-katri/dream-textures,Python,1892,Stable Diffusion built-in to Blender,267,5520,https://avatars.githubusercontent.com/u/13581484?u=f6562c8bd8769cb30ce88ae2dfdddc647f3a94f3&v=4
470579591,unleashed-firmware,DarkFlippers/unleashed-firmware,C,1575,Flipper Zero Unleashed Firmware,413,4686,https://avatars.githubusercontent.com/u/115378555?v=4
565629124,osv-scanner,google/osv-scanner,Go,3461,Vulnerability scanner written in Go which uses the data provided by https://osv.dev,192,4168,https://avatars.githubusercontent.com/u/1342004?v=4
508131663,awesome-english-ebooks,hehonghui/awesome-english-ebooks,CSS,1570,"ç»æµå­¦äºº(å«éŸ³é¢‘)ã€çº½çº¦å®¢ã€å«æŠ¥ã€è¿çº¿ã€å¤§è¥¿æ´‹æœˆåˆŠç­‰è‹±è¯­æ‚å¿—å…è´¹ä¸‹è½½,æ”¯æŒepubã€mobiã€pdfæ ¼å¼, æ¯å‘¨æ›´æ–°",326,4129,https://avatars.githubusercontent.com/u/1683811?u=4fdd12c8f8685ef1ce1b9d798bfbd6f86bd4b397&v=4
561183031,blink,jart/blink,C,2388,tiniest x86-64-linux emulator,115,3852,https://avatars.githubusercontent.com/u/49262?u=ac68933ab61c639ab59ae693a41ae89cd874c16e&v=4
452939314,tortoise-tts,neonbjb/tortoise-tts,Python,1508,A multi-voice TTS system trained with an emphasis on quality,334,3382,https://avatars.githubusercontent.com/u/833082?u=e2593902f231007b4d4fb77678f3e32d29b6553d&v=4
514304222,JdBuyer,zas023/JdBuyer,Python,2121,äº¬ä¸œæŠ¢è´­è‡ªåŠ¨ä¸‹å•åŠ©æ‰‹ï¼ŒGUI æ”¯æŒ Windows å’Œ macOS,580,2895,https://avatars.githubusercontent.com/u/16275016?u=b4c61cca9a26f0a27a391d49eba595f22725fe5a&v=4
307213173,openai-python,openai/openai-python,Python,788,,440,2060,https://avatars.githubusercontent.com/u/14957082?v=4
573538566,whatsapp-gpt,danielgross/whatsapp-gpt,Go,852,,260,1851,https://avatars.githubusercontent.com/u/279531?v=4
560704231,gpt_index,jerryjliu/gpt_index,Python,1230,An index created by GPT to organize external information and answer queries!,93,1624,https://avatars.githubusercontent.com/u/4858925?u=eb0717916ba7f9d8b9402d17a22e6f645d0f97c7&v=4
574162425,chatgpt-chrome-extension,gragland/chatgpt-chrome-extension,JavaScript,801,A ChatGPT Chrome extension. Integrates ChatGPT into every text box on the internet.,174,1519,https://avatars.githubusercontent.com/u/1481077?u=b1cedd6e4ce7fceda2ad50a0932c264a7171ec09&v=4
577135082,init.lua,ThePrimeagen/init.lua,Lua,715,,132,816,https://avatars.githubusercontent.com/u/4458174?u=f59d4f5b38134faff67b8a231591f1288ba51a8e&v=4
