id,name,full_name,language,new stars,description,forks_count,stargazers_count,avatar_url
32484381,free-for-dev,ripienaar/free-for-dev,HTML,1634,"A list of SaaS, PaaS and IaaS offerings that have free tiers of interest to devops and infradev",7064,64868,https://avatars.githubusercontent.com/u/82342?v=4
243950408,HowToCook,Anduin2017/HowToCook,HTML,895,程序员在家做饭方法指南。Programmer's guide about how to cook at home (Chinese only).,7406,49834,https://avatars.githubusercontent.com/u/19531547?u=9bfa4b5f7256f64a05b280019f26a56319955cd0&v=4
179613976,REKCARC-TSC-UHT,PKUanonym/REKCARC-TSC-UHT,HTML,445,"清华大学计算机系课程攻略 Guidance for courses in Department of Computer Science and Technology, Tsinghua University",7029,27284,https://avatars.githubusercontent.com/u/49298122?u=a30d1a325003dea6b0fbfa61ba350c010bc3ec45&v=4
152327866,awesome-piracy,Igglybuff/awesome-piracy,HTML,586,A curated list of awesome warez and piracy links,1910,21415,https://avatars.githubusercontent.com/u/8899226?u=aff883aaa194b45852ac86c8dbb164bb32b05915&v=4
240215314,awesome-compose,docker/awesome-compose,HTML,737,Awesome Docker Compose samples,3480,20567,https://avatars.githubusercontent.com/u/5429470?v=4
26291683,twemoji,twitter/twemoji,HTML,213,Emoji for everyone. https://twemoji.twitter.com/,1752,15137,https://avatars.githubusercontent.com/u/50278?v=4
574523116,awesome-chatgpt-prompts,f/awesome-chatgpt-prompts,HTML,11161,This repo includes ChatGPT prompt curation to use ChatGPT better.,1135,14707,https://avatars.githubusercontent.com/u/196477?u=22fbf9ad92cb9f014b0332238284cabf5ab2b00e&v=4
162405963,gradio,gradio-app/gradio,HTML,638,Create UIs for your machine learning model in Python in 3 minutes,765,11778,https://avatars.githubusercontent.com/u/51063788?v=4
61204818,opensource.guide,github/opensource.guide,HTML,157,📚 Community guides for open source creators,15713,11642,https://avatars.githubusercontent.com/u/9919?v=4
1300192,Spoon-Knife,octocat/Spoon-Knife,HTML,87,This repo is for demonstration purposes only.,132042,11459,https://avatars.githubusercontent.com/u/583231?u=a59fef2a493e2b67dd13754231daf220c82ba84d&v=4
10267810,minimal-mistakes,mmistakes/minimal-mistakes,HTML,154,":triangular_ruler: Jekyll theme for building a personal site, blog, project documentation, or portfolio.",21424,10515,https://avatars.githubusercontent.com/u/1376749?v=4
246128823,html-css,gustavoguanabara/html-css,HTML,295,Curso de HTML5 e CSS3,2367,8872,https://avatars.githubusercontent.com/u/8683378?u=01b06a154f04dadaa4e4131497fa2442e6323cbc&v=4
181746158,hyperblog,freddier/hyperblog,HTML,173,Un blog increíble para el curso de Git y Github de Platzi,11556,7796,https://avatars.githubusercontent.com/u/824191?u=b6489963b9bdf24377e1c4dacdf983426c2aaaeb&v=4
223953992,zphisher,htr-tech/zphisher,HTML,216,An automated phishing tool with 30+ templates. This Tool is made for educational purpose only ! Author will not be responsible for any misuse of this toolkit !,2469,6759,https://avatars.githubusercontent.com/u/56682134?u=4b040ff952c05558a8c97e2fbfe028b93036a183&v=4
53416555,learning-area,mdn/learning-area,HTML,116,Github repo for the MDN Learning Area. ,23803,5582,https://avatars.githubusercontent.com/u/7565578?v=4
281297416,hugo-PaperMod,adityatelange/hugo-PaperMod,HTML,262," A fast, clean, responsive Hugo theme.",1664,5252,https://avatars.githubusercontent.com/u/21258296?u=a66c03831373c2c0e4f7227177650a57bd3f4c7a&v=4
165360641,jekyll-theme-chirpy,cotes2020/jekyll-theme-chirpy,HTML,177,"A minimal, responsive, and powerful Jekyll theme for presenting professional writing.",3189,3403,https://avatars.githubusercontent.com/u/11371340?u=082cc1c5d921b18f2ba2308237741a494146ea2f&v=4
28312955,home-assistant.io,home-assistant/home-assistant.io,HTML,91,:blue_book: Home Assistant User documentation,6229,3387,https://avatars.githubusercontent.com/u/13844975?v=4
254869409,CamPhish,techchipnet/CamPhish,HTML,69,Grab cam shots from target's phone front camera or PC webcam just sending a link.,567,1875,https://avatars.githubusercontent.com/u/42796435?v=4
154540224,TinDog-Start,londonappbrewery/TinDog-Start,HTML,47,,1705,1253,https://avatars.githubusercontent.com/u/6323616?v=4
363593219,CiLocks,tegal1337/CiLocks,HTML,94,"Crack Interface lockscreen, Metasploit and More Android/IOS Hacking",255,1208,https://avatars.githubusercontent.com/u/58784189?v=4
475505735,Data-Science-ML-Full-Stack,hemansnation/Data-Science-ML-Full-Stack,HTML,145,Everything you need to know for data science.,187,579,https://avatars.githubusercontent.com/u/37770869?u=53a78c26e51896deea57df9228a7025da7cae011&v=4
456370943,html-css-course-2022,SuperSimpleDev/html-css-course-2022,HTML,53,,524,480,https://avatars.githubusercontent.com/u/70604577?u=fa6af8f7a3d53e5603418a5962152345d3541bf7&v=4
573722098,ChatGPT_Extension,kazuki-sf/ChatGPT_Extension,HTML,113,ChatGPT Extension is a really simple Chrome Extension (manifest v3) that you can access OpenAI's ChatGPT from anywhere on the web.,40,284,https://avatars.githubusercontent.com/u/41554777?u=0a74df4ff0fc4cb6e19798657ce7287339705e42&v=4
522612085,Blooket-Cheats,Minesraft2/Blooket-Cheats,HTML,37,The actual Best Blooket Hacks made by someone who actually knows what they're doing,181,106,https://avatars.githubusercontent.com/u/49218878?u=d7ebd70bbebfe12593d08765fbcb7d727bae8cf5&v=4
