id,name,full_name,language,new stars,description,forks_count,stargazers_count,avatar_url
32484381,free-for-dev,ripienaar/free-for-dev,HTML,1946,"A list of SaaS, PaaS and IaaS offerings that have free tiers of interest to devops and infradev",7100,65261,https://avatars.githubusercontent.com/u/82342?v=4
106017343,tailwindcss,tailwindlabs/tailwindcss,HTML,1078,A utility-first CSS framework for rapid UI development.,3271,64081,https://avatars.githubusercontent.com/u/67109815?v=4
243950408,HowToCook,Anduin2017/HowToCook,HTML,881,程序员在家做饭方法指南。Programmer's guide about how to cook at home (Chinese only).,7414,49912,https://avatars.githubusercontent.com/u/19531547?u=9bfa4b5f7256f64a05b280019f26a56319955cd0&v=4
62156403,zju-icicles,QSCTech/zju-icicles,HTML,476,浙江大学课程攻略共享计划,8573,30762,https://avatars.githubusercontent.com/u/4727983?v=4
179613976,REKCARC-TSC-UHT,PKUanonym/REKCARC-TSC-UHT,HTML,449,"清华大学计算机系课程攻略 Guidance for courses in Department of Computer Science and Technology, Tsinghua University",7035,27320,https://avatars.githubusercontent.com/u/49298122?u=a30d1a325003dea6b0fbfa61ba350c010bc3ec45&v=4
152327866,awesome-piracy,Igglybuff/awesome-piracy,HTML,584,A curated list of awesome warez and piracy links,1910,21445,https://avatars.githubusercontent.com/u/8899226?u=aff883aaa194b45852ac86c8dbb164bb32b05915&v=4
574523116,awesome-chatgpt-prompts,f/awesome-chatgpt-prompts,HTML,8223,This repo includes ChatGPT prompt curation to use ChatGPT better.,1255,15488,https://avatars.githubusercontent.com/u/196477?u=22fbf9ad92cb9f014b0332238284cabf5ab2b00e&v=4
26291683,twemoji,twitter/twemoji,HTML,227,Emoji for everyone. https://twemoji.twitter.com/,1757,15173,https://avatars.githubusercontent.com/u/50278?v=4
162405963,gradio,gradio-app/gradio,HTML,615,Create UIs for your machine learning model in Python in 3 minutes,771,11840,https://avatars.githubusercontent.com/u/51063788?v=4
61204818,opensource.guide,github/opensource.guide,HTML,167,📚 Community guides for open source creators,15721,11662,https://avatars.githubusercontent.com/u/9919?v=4
1300192,Spoon-Knife,octocat/Spoon-Knife,HTML,83,This repo is for demonstration purposes only.,132102,11461,https://avatars.githubusercontent.com/u/583231?u=a59fef2a493e2b67dd13754231daf220c82ba84d&v=4
10267810,minimal-mistakes,mmistakes/minimal-mistakes,HTML,148,":triangular_ruler: Jekyll theme for building a personal site, blog, project documentation, or portfolio.",21471,10528,https://avatars.githubusercontent.com/u/1376749?v=4
246128823,html-css,gustavoguanabara/html-css,HTML,283,Curso de HTML5 e CSS3,2377,8889,https://avatars.githubusercontent.com/u/8683378?u=01b06a154f04dadaa4e4131497fa2442e6323cbc&v=4
181746158,hyperblog,freddier/hyperblog,HTML,174,Un blog increíble para el curso de Git y Github de Platzi,11583,7819,https://avatars.githubusercontent.com/u/824191?u=b6489963b9bdf24377e1c4dacdf983426c2aaaeb&v=4
53416555,learning-area,mdn/learning-area,HTML,113,Github repo for the MDN Learning Area. ,23863,5591,https://avatars.githubusercontent.com/u/7565578?v=4
281297416,hugo-PaperMod,adityatelange/hugo-PaperMod,HTML,251," A fast, clean, responsive Hugo theme.",1668,5269,https://avatars.githubusercontent.com/u/21258296?u=a66c03831373c2c0e4f7227177650a57bd3f4c7a&v=4
60024365,al-folio,alshedivat/al-folio,HTML,231,"A beautiful, simple, clean, and responsive Jekyll theme for academics",7027,4728,https://avatars.githubusercontent.com/u/2126561?u=b434cef91a8c7021cfdcb1e8d918597b78b28036&v=4
165360641,jekyll-theme-chirpy,cotes2020/jekyll-theme-chirpy,HTML,173,"A minimal, responsive, and powerful Jekyll theme for presenting professional writing.",3202,3418,https://avatars.githubusercontent.com/u/11371340?u=082cc1c5d921b18f2ba2308237741a494146ea2f&v=4
28312955,home-assistant.io,home-assistant/home-assistant.io,HTML,86,:blue_book: Home Assistant User documentation,6238,3394,https://avatars.githubusercontent.com/u/13844975?v=4
254869409,CamPhish,techchipnet/CamPhish,HTML,65,Grab cam shots from target's phone front camera or PC webcam just sending a link.,566,1880,https://avatars.githubusercontent.com/u/42796435?v=4
154540224,TinDog-Start,londonappbrewery/TinDog-Start,HTML,48,,1713,1256,https://avatars.githubusercontent.com/u/6323616?v=4
363593219,CiLocks,tegal1337/CiLocks,HTML,92,"Crack Interface lockscreen, Metasploit and More Android/IOS Hacking",259,1213,https://avatars.githubusercontent.com/u/58784189?v=4
280401119,awesome-github-profiles,EddieHubCommunity/awesome-github-profiles,HTML,56,"List of GitHub profiles that have awesome customisation, that you can use for inspiration",764,1112,https://avatars.githubusercontent.com/u/66388388?v=4
397384430,css-exercises,TheOdinProject/css-exercises,HTML,51,,34580,838,https://avatars.githubusercontent.com/u/4441966?v=4
475505735,Data-Science-ML-Full-Stack,hemansnation/Data-Science-ML-Full-Stack,HTML,156,Everything you need to know for data science.,192,591,https://avatars.githubusercontent.com/u/37770869?u=53a78c26e51896deea57df9228a7025da7cae011&v=4
