id,name,full_name,language,new stars,description,forks_count,stargazers_count,avatar_url
1039520,youtube-dl,ytdl-org/youtube-dl,Python,93,Command-line program to download videos from YouTube.com and other video sites,8635,117635,https://avatars.githubusercontent.com/u/48381040?v=4
307260205,yt-dlp,yt-dlp/yt-dlp,Python,235,A youtube-dl fork with additional features and fixes,3341,40123,https://avatars.githubusercontent.com/u/79589310?v=4
527591471,stable-diffusion-webui,AUTOMATIC1111/stable-diffusion-webui,Python,593,Stable Diffusion web UI,6762,35853,https://avatars.githubusercontent.com/u/20920490?u=8bdc7c9401f507e51b55e558baa8184d4ed30c7d&v=4
349321229,GFPGAN,TencentARC/GFPGAN,Python,37,GFPGAN aims at developing Practical Algorithms for Real-world Face Restoration.,4086,26521,https://avatars.githubusercontent.com/u/83739826?v=4
422274596,ColossalAI,hpcaitech/ColossalAI,Python,339,"Making big AI models cheaper, easier, and more scalable",1477,14178,https://avatars.githubusercontent.com/u/88699314?v=4
569927055,stablediffusion,Stability-AI/stablediffusion,Python,88,High-Resolution Image Synthesis with Latent Diffusion Models,1258,11654,https://avatars.githubusercontent.com/u/100950301?v=4
259991778,jukebox,openai/jukebox,Python,15,"Code for the paper ""Jukebox: A Generative Model for Music""",1089,6282,https://avatars.githubusercontent.com/u/14957082?v=4
505667511,CodeFormer,sczhou/CodeFormer,Python,93,[NeurIPS 2022] Towards Robust Blind Face Restoration with Codebook Lookup Transformer,1006,5343,https://avatars.githubusercontent.com/u/14334509?u=88fa39271f4adfbdae7ff8ad26d8e45ba83d68dc&v=4
595893961,ControlNet,lllyasviel/ControlNet,Python,467,Let us control diffusion models,382,5060,https://avatars.githubusercontent.com/u/19834515?u=4c7144779a6b13904fec478c4e98e676b91516ee&v=4
496680191,RedditVideoMakerBot,elebumm/RedditVideoMakerBot,Python,6,Create Reddit Videos with just✨ one command ✨,1304,4723,https://avatars.githubusercontent.com/u/6053155?u=722385b62072f58a3e5cb06e1896e963743f6eb2&v=4
325873493,videos,3b1b/videos,Python,10,Code for the manim-generated scenes used in 3blue1brown videos,1442,4223,https://avatars.githubusercontent.com/u/11601040?u=ccd223915efaad0958c195ce57bf46ab40d67873&v=4
390536799,open_clip,mlfoundations/open_clip,Python,14,An open source implementation of CLIP.,355,3313,https://avatars.githubusercontent.com/u/87461581?v=4
600798098,sd-webui-controlnet,Mikubill/sd-webui-controlnet,Python,259,WebUI extension for ControlNet,185,1831,https://avatars.githubusercontent.com/u/31246794?u=4e178acd856f9cf98182fc5edad4013f107250c8&v=4
182211614,hackerone-reports,reddelexc/hackerone-reports,Python,14,Top disclosed reports from HackerOne,373,1492,https://avatars.githubusercontent.com/u/17967617?u=d9d2679e5f5a9894ef50e538b9e03201b2362157&v=4
357492304,IPTV,Free-TV/IPTV,Python,87,M3U Playlist for free TV channels,368,1203,https://avatars.githubusercontent.com/u/82442715?v=4
591782276,picoGPT,jaymody/picoGPT,Python,146,An unnecessarily tiny implementation of GPT-2 in NumPy.,114,1098,https://avatars.githubusercontent.com/u/26451316?u=61f4fd77155fa9beee39febeab8023ae4dd603d4&v=4
596424141,mm-cot,amazon-science/mm-cot,Python,38,"Official implementation for ""Multimodal Chain-of-Thought Reasoning in Language Models"" (stay tuned and more will be updated)",65,860,https://avatars.githubusercontent.com/u/70298811?v=4
601479334,mario-gpt,shyamsn97/mario-gpt,Python,90,"Generating Mario Levels with GPT2. Code for the paper ""MarioGPT: Open-Ended Text2Level Generation through Large Language Models"" https://arxiv.org/abs/2302.05981",45,541,https://avatars.githubusercontent.com/u/18158178?u=ea673c5c911d89adb1af8f41ad36caf7e09e240b&v=4
559584476,kohya_ss,bmaltais/kohya_ss,Python,20,,61,533,https://avatars.githubusercontent.com/u/7474674?u=9080e36bd542746d6ecd104f11b22ce8c5305b0f&v=4
602115048,T2I-Adapter,TencentARC/T2I-Adapter,Python,109,T2I-Adapter,21,419,https://avatars.githubusercontent.com/u/83739826?v=4
543479324,V2RayAggregator,mahdibland/V2RayAggregator,Python,9,"Collect Lots of Shadowsocks, ShadowsocksR, Trojan, Vmess from Public Sources & Filter Best Nodes By Speed",54,401,https://avatars.githubusercontent.com/u/42766108?u=f7d07520746ae90e0a930929b80d69eb67d0eaff&v=4
598277623,pix2pix3D,dunbar12138/pix2pix3D,Python,144,pix2pix3D: Generating 3D Objects from 2D User Inputs,21,373,https://avatars.githubusercontent.com/u/28395429?v=4
579557127,sd-scripts,kohya-ss/sd-scripts,Python,25,,85,357,https://avatars.githubusercontent.com/u/52813779?v=4
451306223,EnergonAI,hpcaitech/EnergonAI,Python,59,Large-scale model inference.,47,346,https://avatars.githubusercontent.com/u/88699314?v=4
582577011,sd-webui-additional-networks,kohya-ss/sd-webui-additional-networks,Python,13,,42,301,https://avatars.githubusercontent.com/u/52813779?v=4
