id,name,full_name,language,new stars,description,forks_count,stargazers_count,avatar_url
199570071,v2rayN,2dust/v2rayN,C#,1396,"A GUI client for Windows, support Xray core and v2fly core and others",11401,68525,https://avatars.githubusercontent.com/u/31833384?v=4
198071756,RevokeMsgPatcher,huiyadanli/RevokeMsgPatcher,C#,680,:trollface: A hex editor for WeChat/QQ/TIM - PCç‰ˆå¾®ä¿¡/QQ/TIMé˜²æ’¤å›è¡¥ä¸ï¼ˆæˆ‘å·²ç»çœ‹åˆ°äº†ï¼Œæ’¤å›ä¹Ÿæ²¡ç”¨äº†ï¼‰,3396,29397,https://avatars.githubusercontent.com/u/15783049?u=86f380636f7c09b86788a977ea96272cb7484a30&v=4
262395224,maui,dotnet/maui,C#,187,".NET MAUI is the .NET Multi-platform App UI, a framework for building native device applications spanning mobile, tablet, and desktop.",1738,22136,https://avatars.githubusercontent.com/u/9141961?v=4
46755185,server,bitwarden/server,C#,294,"Bitwarden infrastructure/backend (API, database, Docker, etc).",1305,15482,https://avatars.githubusercontent.com/u/15990069?v=4
22456440,osu,ppy/osu,C#,210,rhythm is just a *click* away!,2273,15284,https://avatars.githubusercontent.com/u/995763?v=4
210716005,runtime,dotnet/runtime,C#,213,".NET is a cross-platform runtime for cloud, mobile, desktop, and IoT apps.",4718,15170,https://avatars.githubusercontent.com/u/9141961?v=4
326826023,QuestPDF,QuestPDF/QuestPDF,C#,254,"QuestPDF is a modern open-source .NET library for PDF document generation. Offering comprehensive layout engine powered by concise and discoverable C# Fluent API. Easily generate PDF reports, invoices, exports, etc.",627,11871,https://avatars.githubusercontent.com/u/73763469?v=4
77323220,Radarr,Radarr/Radarr,C#,241,Movie organizer/manager for usenet and torrent users.,986,10107,https://avatars.githubusercontent.com/u/25025331?v=4
27251463,Lean,QuantConnect/Lean,C#,258,"Lean Algorithmic Trading Engine by QuantConnect (Python, C#)",3259,9760,https://avatars.githubusercontent.com/u/3912814?v=4
64290739,practical-aspnetcore,dodyg/practical-aspnetcore,C#,301,"Practical samples of ASP.NET Core 9 RC2, 8.0, 7.0, 6.0, 5.0, 3.1, 2.2, and 2.1,projects you can use. Readme contains explanations on all projects.",1258,9463,https://avatars.githubusercontent.com/u/1761249?u=f7dc27a3a145b0b544bcc26e5fc0b6b5862ce628&v=4
132453438,uno,unoplatform/uno,C#,130,"Open-source platform for building cross-platform native Mobile, Web, Desktop and Embedded apps quickly.  Create rich, C#/XAML, single-codebase apps from any IDE. Hot Reload included! 90m+ NuGet Downloads!!",720,8887,https://avatars.githubusercontent.com/u/52228309?v=4
7377936,ImageGlass,d2phap/ImageGlass,C#,212,"ğŸ A lightweight, versatile image viewer",499,7703,https://avatars.githubusercontent.com/u/3154213?u=777381c834959d816279ae18bf49794865b72b9d&v=4
136570231,stride,stride3d/stride,C#,122,"Stride (formerly Xenko), a free and open-source cross-platform C# game engine.",950,6579,https://avatars.githubusercontent.com/u/33477741?v=4
151148482,elsa-core,elsa-workflows/elsa-core,C#,97,A .NET workflows library,1170,6343,https://avatars.githubusercontent.com/u/51759159?v=4
706944893,eShop,dotnet/eShop,C#,472,A reference .NET application implementing an eCommerce site,1774,6084,https://avatars.githubusercontent.com/u/9141961?v=4
2928944,azure-sdk-for-net,Azure/azure-sdk-for-net,C#,132,This repository is for active development of the Azure SDK for .NET. For consumers of the SDK we recommend visiting our public developer docs at https://learn.microsoft.com/dotnet/azure/ or our versioned developer docs at https://azure.github.io/azure-sdk-for-net. ,4789,5373,https://avatars.githubusercontent.com/u/6844498?v=4
10601208,Umbraco-CMS,umbraco/Umbraco-CMS,C#,47,Umbraco is a free and open source .NET content management system helping you deliver delightful digital experiences.,2683,4458,https://avatars.githubusercontent.com/u/1419552?v=4
348132133,fluentui-blazor,microsoft/fluentui-blazor,C#,128,Microsoft Fluent UI Blazor components library. For use with ASP.NET Core Blazor applications,364,3791,https://avatars.githubusercontent.com/u/6154722?v=4
666300276,Bili.Copilot,Richasy/Bili.Copilot,C#,624,Bç«™ç¬¬ä¸‰æ–¹ Windows æ¡Œé¢å®¢æˆ·ç«¯ï¼Œä½¿ç”¨ Windows App SDK æ„å»ºçš„åŸç”Ÿåº”ç”¨,76,3165,https://avatars.githubusercontent.com/u/27713596?u=ef9e25b1458621b8ca6e86c34a26e1f43016946f&v=4
65284422,YoutubeExplode,Tyrrrz/YoutubeExplode,C#,64,Abstraction layer over YouTube's internal API,491,2930,https://avatars.githubusercontent.com/u/1935960?u=40a06549de224471e1a81877536f8e24d4e96f09&v=4
194985543,WinMemoryCleaner,IgorMundstein/WinMemoryCleaner,C#,267,"This free RAM cleaner uses native Windows features to optimize memory areas. It's a compact, portable, and smart application.",174,2482,https://avatars.githubusercontent.com/u/3512138?u=0fcaad00c4e38ada3175c1006bbe9f948bd3b790&v=4
520583586,bloxstrap,bloxstraplabs/bloxstrap,C#,151,An alternative bootstrapper for Roblox with a bunch of extra features.,309,1790,https://avatars.githubusercontent.com/u/147950331?v=4
792072603,openai-dotnet,openai/openai-dotnet,C#,313,The official .NET library for the OpenAI API,132,1384,https://avatars.githubusercontent.com/u/14957082?v=4
