id,name,full_name,language,new stars,description,forks_count,stargazers_count,avatar_url
27574418,nerd-fonts,ryanoasis/nerd-fonts,CSS,620,"Iconic font aggregator, collection, & patcher. 3,600+ icons, 50+ patched fonts: Hack, Source Code Pro, more. Glyph collections: Font Awesome, Material Design Icons, Octicons, & more",3636,54089,https://avatars.githubusercontent.com/u/8083459?u=1645f43000c842a948268609231bdecb1433c470&v=4
1700621,normalize.css,necolas/normalize.css,CSS,190,A modern alternative to CSS resets,10659,52394,https://avatars.githubusercontent.com/u/239676?u=4b545d3dd62d217b40a624ebbe987cfc67e73803&v=4
41058054,CppCoreGuidelines,isocpp/CppCoreGuidelines,CSS,264,"The C++ Core Guidelines are a set of tried-and-true guidelines, rules, and best practices about coding in C++",5430,42569,https://avatars.githubusercontent.com/u/13841574?v=4
313330998,50projects50days,bradtraversy/50projects50days,CSS,735,"50+ mini web projects using HTML, CSS & JS",9092,36991,https://avatars.githubusercontent.com/u/5550850?u=45352e59e108ddd00ead26981cd6a4a53b151b1d&v=4
221892711,pico,picocss/pico,CSS,370,Minimal CSS Framework for semantic HTML,390,13488,https://avatars.githubusercontent.com/u/57780293?v=4
17446152,2048,gabrielecirulli/2048,CSS,64,The source code for 2048 ,16957,12159,https://avatars.githubusercontent.com/u/886011?v=4
49767244,primeng,primefaces/primeng,CSS,250,The Most Complete Angular UI Component Library,4559,10277,https://avatars.githubusercontent.com/u/3494069?v=4
141040549,seeker,thewhiteh4t/seeker,CSS,149,Accurately Locate Smartphones using Social Engineering ,1673,6989,https://avatars.githubusercontent.com/u/36354846?u=99d06a9237c301569774dac1c70218d5c032773a&v=4
15400220,progit2,progit/progit2,CSS,59,Pro Git 2nd Edition,1922,5822,https://avatars.githubusercontent.com/u/95588?v=4
204008310,spicetify-themes,spicetify/spicetify-themes,CSS,91,A community-driven collection of themes for customizing Spotify through Spicetify - https://github.com/spicetify/cli,1272,4999,https://avatars.githubusercontent.com/u/100136310?v=4
5169716,Anthias,Screenly/Anthias,CSS,59,The world's most popular open source digital signage project.,615,2462,https://avatars.githubusercontent.com/u/20972724?v=4
622588116,misaka,straight-tamago/misaka,CSS,124, iOS & tvOS customisation tool for KFD & MDC,102,2427,https://avatars.githubusercontent.com/u/121408851?u=3fbe45f69a5a767cff58a0590fc00d5ef57c8d4c&v=4
28813404,birthday,ayusharma/birthday,CSS,23,"A Happy Birthday animation design in CSS3, HTML5 ",2940,934,https://avatars.githubusercontent.com/u/6918450?u=e76de8dd892464905091e6610893af0505104f23&v=4
812155284,system24,refact0r/system24,CSS,737,a tui-style discord theme,31,928,https://avatars.githubusercontent.com/u/34758569?u=f463dd0a3d48bd5d85222ed94fbc3e530913abde&v=4
384492447,mingw-w64.github.io,mingw-w64/mingw-w64.github.io,CSS,21,mingw-w64.net web page contents (The new web page),1237,586,https://avatars.githubusercontent.com/u/12658362?v=4
691973341,Source,TryGhost/Source,CSS,4,The default theme for Ghost,117,59,https://avatars.githubusercontent.com/u/2178663?v=4
