id,name,full_name,language,new stars,description,forks_count,stargazers_count,avatar_url
1863329,laravel,laravel/laravel,PHP,480,"Laravel is a web application framework with expressive, elegant syntax. We’ve already laid the foundation for your next big idea — freeing you to create without sweating the small things.",24003,78437,https://avatars.githubusercontent.com/u/958072?v=4
3482588,SecLists,danielmiessler/SecLists,PHP,682,"SecLists is the security tester's companion. It's a collection of multiple types of lists used during security assessments, collected in one place. List types include usernames, passwords, URLs, sensitive data patterns, fuzzing payloads, web shells, and many more.",23799,57343,https://avatars.githubusercontent.com/u/50654?u=cb240d3a67938da653614ef5ec97c58c0c173abe&v=4
7548986,framework,laravel/framework,PHP,259,The Laravel Framework.,10947,32298,https://avatars.githubusercontent.com/u/958072?v=4
458058,symfony,symfony/symfony,PHP,157,The Symfony PHP framework,9437,29695,https://avatars.githubusercontent.com/u/143937?v=4
1864363,composer,composer/composer,PHP,141,Dependency Manager for PHP,4541,28572,https://avatars.githubusercontent.com/u/837015?v=4
60243197,server,nextcloud/server,PHP,375,"☁️ Nextcloud server, a safe home for all your data",4016,26936,https://avatars.githubusercontent.com/u/19211038?v=4
170355508,livewire,livewire/livewire,PHP,168,A full-stack framework for Laravel that takes the pain out of building dynamic UIs.,1553,22297,https://avatars.githubusercontent.com/u/51960834?v=4
2253830,PHPMailer,PHPMailer/PHPMailer,PHP,113,The classic email sending library for PHP,9727,20982,https://avatars.githubusercontent.com/u/3959702?v=4
248372441,filament,filamentphp/filament,PHP,843,"A collection of beautiful full-stack components for Laravel. The perfect starting point for your next app. Using Livewire, Alpine.js and Tailwind CSS.",2855,18299,https://avatars.githubusercontent.com/u/64450473?v=4
12615154,laravel-debugbar,barryvdh/laravel-debugbar,PHP,231,Debugbar for Laravel (Integrates PHP Debug Bar),1548,17178,https://avatars.githubusercontent.com/u/973269?u=5c91f55a44fa388c096c4d77111346dee758bd44&v=4
2884111,magento2,magento/magento2,PHP,59,"Prior to making any Submission(s), you must sign an Adobe Contributor License Agreement, available here at: https://opensource.adobe.com/cla.html. All Submissions you make to Adobe Inc. and its affiliates, assigns and subsidiaries (collectively “Adobe”) are subject to the terms of the Adobe Contributor License Agreement.",9307,11493,https://avatars.githubusercontent.com/u/168457?v=4
6322699,FreshRSS,FreshRSS/FreshRSS,PHP,307,"A free, self-hostable news aggregator…",821,9609,https://avatars.githubusercontent.com/u/9414285?v=4
246674913,pest,pestphp/pest,PHP,183,"Pest is an elegant PHP testing Framework with a focus on simplicity, meticulously designed to bring back the joy of testing in PHP.",344,9501,https://avatars.githubusercontent.com/u/62078253?v=4
2179920,woocommerce,woocommerce/woocommerce,PHP,94,"A customizable, open-source ecommerce platform built on WordPress. Build any commerce solution you can imagine.",10761,9371,https://avatars.githubusercontent.com/u/473596?v=4
1957456,dolibarr,Dolibarr/dolibarr,PHP,100,"Dolibarr ERP CRM is a modern software package to manage your company or foundation's activity (contacts, suppliers, invoices, orders, stocks, agenda, accounting, ...). it's an open source Web application (written in PHP) designed for businesses of any sizes, foundations and freelancers.",2756,5326,https://avatars.githubusercontent.com/u/877491?v=4
433383766,all-in-one,nextcloud/all-in-one,PHP,249,📦 The official Nextcloud installation method. Provides easy deployment and maintenance with most features included in this one Nextcloud instance.,616,5316,https://avatars.githubusercontent.com/u/19211038?v=4
111562942,cms,statamic/cms,PHP,231,The core Laravel CMS Composer package,521,3904,https://avatars.githubusercontent.com/u/1669353?v=4
13914116,librenms,librenms/librenms,PHP,115,Community-based GPL-licensed network monitoring system,2279,3820,https://avatars.githubusercontent.com/u/5791783?v=4
14724954,opensourcepos,opensourcepos/opensourcepos,PHP,53,Open Source Point of Sale is a web based point of sale application written in PHP using CodeIgniter framework. It uses MySQL as the data back end and has a Bootstrap 3 based user interface.,2171,3421,https://avatars.githubusercontent.com/u/31845758?v=4
701017456,Wallos,ellite/Wallos,PHP,288,Wallos: Open-Source Personal Subscription Tracker,123,2748,https://avatars.githubusercontent.com/u/3831180?v=4
75645659,wordpress-develop,WordPress/wordpress-develop,PHP,58,"WordPress Develop, Git-ified. Synced from git://develop.git.wordpress.org/, including branches and tags! This repository is just a mirror of the WordPress subversion repository. Please include a link to a pre-existing ticket on https://core.trac.wordpress.org/ with every pull request.",2561,2505,https://avatars.githubusercontent.com/u/276006?v=4
661276382,vito,vitodeploy/vito,PHP,288,The Ultimate Server Management Tool,166,1079,https://avatars.githubusercontent.com/u/130656052?v=4
