id,name,full_name,language,new stars,description,forks_count,stargazers_count,avatar_url
173228436,ghidra,NationalSecurityAgency/ghidra,Java,43,Ghidra is a software reverse engineering (SRE) framework,5535,47579,https://avatars.githubusercontent.com/u/11298292?v=4
8859474,jadx,skylot/jadx,Java,24,Dex to Java decompiler,4628,39039,https://avatars.githubusercontent.com/u/118523?u=22c9766bcd42e7f4968002bb79141bbfc1e3ce5d&v=4
44662669,dbeaver,dbeaver/dbeaver,Java,26,Free universal database tool and SQL client,3235,37358,https://avatars.githubusercontent.com/u/34743864?v=4
41889031,NewPipe,TeamNewPipe/NewPipe,Java,18,A libre lightweight streaming front-end for Android.,2892,28577,https://avatars.githubusercontent.com/u/22159318?v=4
283211901,SmartTube,yuliskov/SmartTube,Java,13,SmartTube - an advanced player for set-top boxes and tvs running Android OS,902,16058,https://avatars.githubusercontent.com/u/5897464?u=bcb1a508a8fdbf9da441be0db25672e42ad4ec64&v=4
320785435,LSPosed,LSPosed/LSPosed,Java,11,LSPosed Framework,2356,15629,https://avatars.githubusercontent.com/u/75879071?v=4
311241324,Ehviewer_CN_SXJ,xiaojieonly/Ehviewer_CN_SXJ,Java,25,ehviewer，用爱发电，快乐前行,351,11060,https://avatars.githubusercontent.com/u/49278135?u=47f3db69acd9fc29374a82ad91323a3c3a51490a&v=4
50160261,Paper,PaperMC/Paper,Java,3,"The most widely used, high performance Minecraft server that aims to fix gameplay and mechanics inconsistencies",2127,8802,https://avatars.githubusercontent.com/u/7608950?v=4
83799439,lawnchair,LawnchairLauncher/lawnchair,Java,7,No clever tagline needed.,1129,8474,https://avatars.githubusercontent.com/u/34144436?v=4
19082715,GmsCore,microg/GmsCore,Java,9,Free implementation of Play Services,1526,7003,https://avatars.githubusercontent.com/u/2758598?v=4
5244445,AntennaPod,AntennaPod/AntennaPod,Java,4,A podcast manager for Android,1325,5753,https://avatars.githubusercontent.com/u/10713470?v=4
961036,hibernate-orm,hibernate/hibernate-orm,Java,1,Hibernate's core Object/Relational Mapping functionality,3445,5742,https://avatars.githubusercontent.com/u/348262?v=4
246464565,PojavLauncher,PojavLauncherTeam/PojavLauncher,Java,7,A Minecraft: Java Edition Launcher for Android and iOS based on Boardwalk. This repository contains source code for Android platform.,1160,5712,https://avatars.githubusercontent.com/u/69146964?v=4
736572328,1brc,gunnarmorling/1brc,Java,10,1️⃣🐝🏎️ The One Billion Row Challenge -- A fun exploration of how quickly 1B rows from a text file can be aggregated with Java,1568,5068,https://avatars.githubusercontent.com/u/28612?u=004bb13831ab044d93c3124af75dc4f36224809b&v=4
14514251,bitcoinj,bitcoinj/bitcoinj,Java,2,A library for working with Bitcoin,2433,4871,https://avatars.githubusercontent.com/u/5951625?v=4
57461213,runelite,runelite/runelite,Java,3,Open source Old School RuneScape client,5124,4574,https://avatars.githubusercontent.com/u/13814776?v=4
195856796,Geyser,GeyserMC/Geyser,Java,3,A bridge/proxy allowing you to connect to Minecraft: Java Edition servers with Minecraft: Bedrock Edition.,640,4430,https://avatars.githubusercontent.com/u/52673035?v=4
268006778,AppManager,MuntashirAkon/AppManager,Java,13,A full-featured package manager and viewer for Android,243,4143,https://avatars.githubusercontent.com/u/8176128?u=53e3819d7b557737dfca5a2fcbab2d420f29d6f2&v=4
197545351,Create,Creators-of-Create/Create,Java,3,[Forge Mod] Building Tools and Aesthetic Technology,852,2584,https://avatars.githubusercontent.com/u/57542873?v=4
703022577,LunarCore,Melledy/LunarCore,Java,2,A game server reimplementation for a certain turn-based anime game,233,1030,https://avatars.githubusercontent.com/u/121644117?u=6baad13298a242056ee230fa73c730591ee27ea6&v=4
474904289,LSPosed_mod,mywalkb/LSPosed_mod,Java,30,My changes to LSPosed,47,1014,https://avatars.githubusercontent.com/u/66966897?v=4
328887217,Shizuku-API,RikkaApps/Shizuku-API,Java,4,The API and the developer guide for Shizuku and Sui.,170,755,https://avatars.githubusercontent.com/u/31959043?v=4
602041947,CodeGPT,carlrobertoh/CodeGPT,Java,5,"JetBrains extension providing access to state-of-the-art LLMs, such as GPT-4, Claude 3, Code Llama, and others, all for free",149,682,https://avatars.githubusercontent.com/u/15891408?u=c88c11a429b5665289d229672bbe44810f950c85&v=4
664021819,ReTerraForged,racoonman2/ReTerraForged,Java,3,a 1.19+ port of https://github.com/TerraForged/TerraForged,36,204,https://avatars.githubusercontent.com/u/81602236?u=fa7a4624691f654b7c85aae82168c268db949a26&v=4
700304345,Concurrency-Tester,InterviewReady/Concurrency-Tester,Java,4,A tester that checks for correctness of code in distributed systems.,4,22,https://avatars.githubusercontent.com/u/84011411?v=4
