id,name,full_name,language,new stars,description,forks_count,stargazers_count,avatar_url
2325298,linux,torvalds/linux,C,438,Linux kernel source tree,48111,151173,https://avatars.githubusercontent.com/u/1024025?v=4
10744183,netdata,netdata/netdata,C,264,"Real-time performance monitoring, done right! https://www.netdata.cloud",5516,63016,https://avatars.githubusercontent.com/u/43390781?v=4
13233158,obs-studio,obsproject/obs-studio,C,186,OBS Studio - Free and open source software for live streaming and screen recording,6855,47562,https://avatars.githubusercontent.com/u/7725691?v=4
36836475,tmux,tmux/tmux,C,136,tmux source code,1903,28900,https://avatars.githubusercontent.com/u/12054114?v=4
5101141,jq,stedolan/jq,C,54,Command-line JSON processor,1437,24869,https://avatars.githubusercontent.com/u/79765?v=4
2810292,rufus,pbatard/rufus,C,120,The Reliable USB Formatting Utility,2270,23034,https://avatars.githubusercontent.com/u/1206968?u=ed1be5451352656cffecc840d661bb793c3bad05&v=4
196353673,TDengine,taosdata/TDengine,C,107,"TDengine is an open source, high-performance, cloud native time-series database optimized for Internet of Things (IoT), Connected Cars, Industrial IoT and DevOps.",4654,21322,https://avatars.githubusercontent.com/u/48876650?v=4
47409672,hashcat,hashcat/hashcat,C,71,World's fastest and most advanced password recovery utility,2545,17254,https://avatars.githubusercontent.com/u/15949799?v=4
184909163,yabai,koekeishiya/yabai,C,139,A tiling window manager for macOS based on binary space partitioning,542,16351,https://avatars.githubusercontent.com/u/6175959?u=e07b472bc4fa5500439c2c099a4736bcfd636769&v=4
105627846,reactos,reactos/reactos,C,33,A free Windows-compatible Operating System,1548,12324,https://avatars.githubusercontent.com/u/1056157?v=4
179354282,OpenCorePkg,acidanthera/OpenCorePkg,C,46,OpenCore bootloader,1994,11375,https://avatars.githubusercontent.com/u/39672954?v=4
70127218,arduino-esp32,espressif/arduino-esp32,C,33,Arduino core for the ESP32,6796,10694,https://avatars.githubusercontent.com/u/9460735?v=4
16734696,janus-gateway,meetecho/janus-gateway,C,30,Janus WebRTC Server,2318,7157,https://avatars.githubusercontent.com/u/4520545?v=4
6376337,poco,pocoproject/poco,C,30,"The POCO C++ Libraries are powerful cross-platform C++ libraries for building network- and internet-based applications that run on desktop, server, mobile, IoT, and embedded systems.",1961,7033,https://avatars.githubusercontent.com/u/201918?v=4
490465859,Flipper,UberGuidoZ/Flipper,C,189,Playground (and dump) of stuff I make or modify for the Flipper Zero,1692,6792,https://avatars.githubusercontent.com/u/57457139?u=3b283c3083a1fee457b897d7c8fda97b873e9807&v=4
131710328,hekate,CTCaer/hekate,C,92,hekate - A GUI based Nintendo Switch Bootloader,482,5037,https://avatars.githubusercontent.com/u/3665130?v=4
537803484,palera1n,palera1n/palera1n,C,51,iOS 15.0-16.4.1 semi-tethered checkm8 jailbreak,422,3309,https://avatars.githubusercontent.com/u/114239186?v=4
359952601,pgvector,pgvector/pgvector,C,189,Open-source vector similarity search for Postgres,110,3201,https://avatars.githubusercontent.com/u/98363230?v=4
5128084,clamav,Cisco-Talos/clamav,C,19,ClamAV - Documentation is here: https://docs.clamav.net,598,2937,https://avatars.githubusercontent.com/u/28057349?v=4
440436833,dperf,baidu/dperf,C,173,dperf is a DPDK based 100Gbps network performance and load testing software.,291,2674,https://avatars.githubusercontent.com/u/13245940?v=4
276293034,age,apache/age,C,28,Graph database optimized for fast analysis and real-time data processing. It is provided as an extension to PostgreSQL.,219,1731,https://avatars.githubusercontent.com/u/47359?v=4
270692521,zmk,zmkfirmware/zmk,C,20,ZMK Firmware Repository,1675,1600,https://avatars.githubusercontent.com/u/66629601?v=4
586904864,SBEMU,crazii/SBEMU,C,37,legacy sound blaster emulation for DOS,11,330,https://avatars.githubusercontent.com/u/6263096?u=7899486909e846a9e0481f22077dd6f5c7f770f5&v=4
633375058,StarRail-ACE-B,Z4ee/StarRail-ACE-B,C,40,"This repository provides code for bypassing the anti-cheat system in Honkai Star Rail game, allowing players to open Cheat Engine. For informational purposes only. Use at your own risk.",75,211,https://avatars.githubusercontent.com/u/113752393?v=4
616222670,NerdMiner_v2,BitMaker-hub/NerdMiner_v2,C,38,Improved version of first ESP32 NerdMiner,17,174,https://avatars.githubusercontent.com/u/105243563?u=e4a7a4b8e143fe25d2da1f8355c9207bab931d4f&v=4
