id,name,full_name,language,new stars,description,forks_count,stargazers_count,avatar_url
20580498,kubernetes,kubernetes/kubernetes,Go,242,Production-Grade Container Scheduling and Management,33840,92263,https://avatars.githubusercontent.com/u/13629408?v=4
20904437,gin,gin-gonic/gin,Go,213,"Gin is a HTTP web framework written in Go (Golang). It features a Martini-like API with much better performance -- up to 40 times faster. If you need smashing performance, get yourself some Gin.",6932,63021,https://avatars.githubusercontent.com/u/7894478?v=4
11180687,hugo,gohugoio/hugo,Go,669,The world’s fastest framework for building websites.,6792,62487,https://avatars.githubusercontent.com/u/29385237?v=4
15452919,go-ethereum,ethereum/go-ethereum,Go,208,Official Go implementation of the Ethereum protocol,14987,39436,https://avatars.githubusercontent.com/u/6250754?v=4
17728164,terraform,hashicorp/terraform,Go,99,"Terraform enables you to safely and predictably create, change, and improve infrastructure. It is an open source tool that codifies APIs into declarative configuration files that can be shared amongst team members, treated as code, edited, reviewed, and versioned.",7936,34242,https://avatars.githubusercontent.com/u/761456?v=4
59239347,portainer,portainer/portainer,Go,107,Making Docker and Kubernetes management easy.,2038,23040,https://avatars.githubusercontent.com/u/22225832?v=4
21827146,seaweedfs,seaweedfs/seaweedfs,Go,113,"SeaweedFS is a fast distributed storage system for blobs, objects, files, and data lake, for billions of files! Blob store has O(1) disk seek, cloud tiering. Filer supports Cloud Drive, cross-DC active-active replication, Kubernetes, POSIX FUSE mount, S3 API, S3 Gateway, Hadoop, WebDAV, encryption, Erasure Coding.",1858,15407,https://avatars.githubusercontent.com/u/11985425?v=4
153099672,learngo,inancgumus/learngo,Go,77,"1000+ Hand-Crafted Go Examples, Exercises, and Quizzes",1957,14326,https://avatars.githubusercontent.com/u/621232?u=4825c5449290026dd31c681af1e04f2b3ed9944d&v=4
510607652,pocketbase,pocketbase/pocketbase,Go,1536,Open Source realtime backend in 1 file,454,13846,https://avatars.githubusercontent.com/u/101000011?v=4
208728772,milvus,milvus-io/milvus,Go,865,Vector database for scalable similarity search and AI applications.,1747,13178,https://avatars.githubusercontent.com/u/51735404?v=4
31558937,teleport,gravitational/teleport,Go,63,"The easiest, most secure way to access infrastructure.",1279,12655,https://avatars.githubusercontent.com/u/10781132?v=4
120896210,argo-cd,argoproj/argo-cd,Go,80,Declarative continuous deployment for Kubernetes.,2875,10643,https://avatars.githubusercontent.com/u/30269780?v=4
370977430,Open-IM-Server,OpenIMSDK/Open-IM-Server,Go,135,即时通讯IM,1540,9303,https://avatars.githubusercontent.com/u/84842645?v=4
323965659,alist,alist-org/alist,Go,646,"🗂️A file list program that supports multiple storage, powered by Gin and Solidjs. / 一个支持多存储的文件列表程序，使用 Gin 和 Solidjs。",1492,9295,https://avatars.githubusercontent.com/u/97389433?v=4
23664475,toxiproxy,Shopify/toxiproxy,Go,45,:alarm_clock: :fire: A TCP proxy to simulate network and system conditions for chaos and resiliency testing,400,8529,https://avatars.githubusercontent.com/u/8085?v=4
135321861,kratos,ory/kratos,Go,60,"Next-gen identity server (think Auth0, Okta, Firebase) with Ory-hardened authentication, MFA, FIDO2, TOTP, WebAuthn, profile management, identity schemas, social sign in, registration, account recovery, passwordless. Golang, headless, API-only - without templating or theming headaches. Available as a cloud service.",645,7561,https://avatars.githubusercontent.com/u/25334553?v=4
154643390,phoneinfoga,sundowndev/phoneinfoga,Go,49,Information gathering & OSINT framework for phone numbers,2305,7547,https://avatars.githubusercontent.com/u/16480203?u=736dd20996f73fe51ad2ee2c8dc058d9e89c7a69&v=4
221849341,asynq,hibiken/asynq,Go,124,"Simple, reliable, and efficient distributed task queue in Go",307,4209,https://avatars.githubusercontent.com/u/10953044?u=8a795841e6979ef992316dea37c7d2ac807aad04&v=4
93446042,terraform-provider-azurerm,hashicorp/terraform-provider-azurerm,Go,18,Terraform provider for Azure Resource Manager,3642,3595,https://avatars.githubusercontent.com/u/761456?v=4
117156031,prysm,prysmaticlabs/prysm,Go,49,Go implementation of Ethereum proof of stake,666,2773,https://avatars.githubusercontent.com/u/35349758?v=4
330405184,steampipe,turbot/steampipe,Go,100,"Use SQL to instantly query your cloud services (AWS, Azure, GCP and more). Open source CLI. No DB required. ",99,2419,https://avatars.githubusercontent.com/u/38865304?v=4
188836864,erigon,ledgerwatch/erigon,Go,28,Ethereum implementation on the efficiency frontier,495,1778,https://avatars.githubusercontent.com/u/29105044?v=4
280658081,domain-list-community,v2fly/domain-list-community,Go,70,Community managed domain list. Generate geosite.dat for V2Ray.,343,1446,https://avatars.githubusercontent.com/u/49637375?v=4
534023067,cloudfox,BishopFox/cloudfox,Go,305,Automating situational awareness for cloud penetration tests.,55,681,https://avatars.githubusercontent.com/u/4523757?v=4
307882563,apple-store-helper,hteen/apple-store-helper,Go,79,Apple Store iPhone预约助手,97,652,https://avatars.githubusercontent.com/u/8476546?u=7f0ad284d78cfe5dbc2b69a31f2a999ed5d5be49&v=4
