id,name,full_name,language,new stars,description,forks_count,stargazers_count,avatar_url
168008797,calculator,microsoft/calculator,C++,455,Windows Calculator: A simple yet powerful calculator that ships with Windows,4457,24703,https://avatars.githubusercontent.com/u/6154722?v=4
6934395,rocksdb,facebook/rocksdb,C++,65,"A library that provides an embeddable, persistent key-value store for fast storage.",5162,22549,https://avatars.githubusercontent.com/u/69631?v=4
98771110,TrafficMonitor,zhongyang219/TrafficMonitor,C++,663,这是一个用于显示当前网速、CPU及内存利用率的桌面悬浮窗软件，并支持任务栏显示，支持更换皮肤。,2053,18266,https://avatars.githubusercontent.com/u/30562462?u=18ad9b9dfa6e784088d28deb7e0dbe830afcc0b7&v=4
34777562,srs,ossrs/srs,C++,73,"SRS is a simple, high efficiency and realtime video server, supports RTMP, WebRTC, HLS, HTTP-FLV and SRT.",4516,18073,https://avatars.githubusercontent.com/u/12165287?v=4
149111813,MMKV,Tencent/MMKV,C++,36,"An efficient, small mobile key-value storage framework developed by WeChat. Works on Android, iOS, macOS, Windows, and POSIX.",1622,14451,https://avatars.githubusercontent.com/u/18461506?v=4
161292091,matrix,Tencent/matrix,C++,37,"Matrix is a plugin style, non-invasive APM system developed by WeChat.",1561,9865,https://avatars.githubusercontent.com/u/18461506?v=4
35718695,ndk-samples,android/ndk-samples,C++,25,Android NDK samples with Android Studio,3926,8837,https://avatars.githubusercontent.com/u/32689599?v=4
11577304,dolphin,dolphin-emu/dolphin,C++,178,"Dolphin is a GameCube / Wii emulator, allowing you to play games for these two platforms on PC with improvements.",1976,8604,https://avatars.githubusercontent.com/u/5050316?v=4
108102826,carla,carla-simulator/carla,C++,39,Open-source simulator for autonomous driving research.,2329,7726,https://avatars.githubusercontent.com/u/33029185?v=4
194269070,skyline,skyline-emu/skyline,C++,415,Run Nintendo Switch homebrew & games on your Android device!,1062,7213,https://avatars.githubusercontent.com/u/52578041?v=4
156939672,onnxruntime,microsoft/onnxruntime,C++,40,"ONNX Runtime: cross-platform, high performance ML inferencing and training accelerator",1572,6710,https://avatars.githubusercontent.com/u/6154722?v=4
26255337,concurrentqueue,cameron314/concurrentqueue,C++,25,"A fast multi-producer, multi-consumer lock-free concurrent queue for C++11",1351,6713,https://avatars.githubusercontent.com/u/116235?v=4
189205663,TinyWebServer,qinguoyi/TinyWebServer,C++,111,:fire: Linux下C++轻量级Web服务器,2001,6695,https://avatars.githubusercontent.com/u/25760295?u=a4474a249cca515146041e4b6bfaf5f448d9a113&v=4
15122806,benchmark,google/benchmark,C++,28,A microbenchmark support library,1281,6457,https://avatars.githubusercontent.com/u/1342004?v=4
86897963,ZLMediaKit,ZLMediaKit/ZLMediaKit,C++,78,WebRTC/RTSP/RTMP/HTTP/HLS/HTTP-FLV/WebSocket-FLV/HTTP-TS/HTTP-fMP4/WebSocket-TS/WebSocket-fMP4/GB28181 server and client framework based on C++11,1797,6428,https://avatars.githubusercontent.com/u/84565724?v=4
15773229,skia,google/skia,C++,26,"Skia is a complete 2D graphic library for drawing Text, Geometries, and Images.",1161,6343,https://avatars.githubusercontent.com/u/1342004?v=4
39211337,engine,flutter/engine,C++,46,The Flutter engine,4414,5730,https://avatars.githubusercontent.com/u/14101776?v=4
90506918,cudf,rapidsai/cudf,C++,54,cuDF - GPU DataFrame Library ,610,4737,https://avatars.githubusercontent.com/u/43887749?v=4
6148317,gdal,OSGeo/gdal,C++,21,GDAL is an open source X/MIT licensed translator library for raster and vector geospatial data formats.,1746,3105,https://avatars.githubusercontent.com/u/1058467?v=4
147106288,olcPixelGameEngine,OneLoneCoder/olcPixelGameEngine,C++,23,"The official distribution of olcPixelGameEngine, a tool used in javidx9's YouTube videos and projects",850,2994,https://avatars.githubusercontent.com/u/25419386?u=ae6e8825ede13269c7b08b857b16cedfd22cc85f&v=4
328893373,LANDrop,LANDrop/LANDrop,C++,68,Drop any files to any devices on your LAN.,253,2604,https://avatars.githubusercontent.com/u/77804208?v=4
257596449,implot,epezent/implot,C++,39,Immediate Mode Plotting,227,2377,https://avatars.githubusercontent.com/u/29577475?u=4079213ac898e1596748cd5b6554aeaae8926184&v=4
202483348,incubator-kvrocks,apache/incubator-kvrocks,C++,31,Kvrocks is a distributed key value NoSQL database that uses RocksDB as storage engine and is compatible with Redis protocol.,176,1468,https://avatars.githubusercontent.com/u/47359?v=4
92912604,opendbc,commaai/opendbc,C++,19,democratize access to car decoder rings,828,1077,https://avatars.githubusercontent.com/u/16128714?v=4
