id,name,full_name,language,new stars,description,forks_count,stargazers_count,avatar_url
111583593,scrcpy,Genymobile/scrcpy,C,346,Display and control your Android device,6999,64993,https://avatars.githubusercontent.com/u/3427627?v=4
1357796,emscripten,emscripten-core/emscripten,C,49,Emscripten: An LLVM-to-WebAssembly Compiler,2819,22223,https://avatars.githubusercontent.com/u/46011144?v=4
102578345,lede,coolsnowwolf/lede,C,133,Lean's OpenWrt source,17227,21134,https://avatars.githubusercontent.com/u/31687149?u=caa956c5f80318ea674625f9e9efa49c98335d74&v=4
7634677,openssl,openssl/openssl,C,71,TLS/SSL and crypto library,8012,18352,https://avatars.githubusercontent.com/u/3279138?v=4
80286288,Tasmota,arendst/Tasmota,C,106,"Alternative firmware for ESP8266 with easy configuration using webUI, OTA updates, automation using timers or rules, expandability and entirely local control over MQTT, HTTP, Serial or KNX. Full documentation at",3907,17575,https://avatars.githubusercontent.com/u/11044339?u=b54c71859c551426b6738921138b740804ca1d62&v=4
34921116,bcc,iovisor/bcc,C,62,"BCC - Tools for BPF-based Linux IO analysis, networking, monitoring, and more",2823,14437,https://avatars.githubusercontent.com/u/12766186?v=4
60667730,lvgl,lvgl/lvgl,C,98,"Powerful and easy-to-use embedded GUI library with many widgets, advanced visual effects (opacity, antialiasing, animations) and low memory requirements (16K RAM, 64K Flash).",1889,9387,https://avatars.githubusercontent.com/u/19811762?v=4
7715820,rofi,davatorium/rofi,C,52,"Rofi: A window switcher, application launcher and dmenu replacement",492,9099,https://avatars.githubusercontent.com/u/48837683?v=4
3299208,vlc,videolan/vlc,C,55,"VLC media player - All pull requests are ignored, please follow https://wiki.videolan.org/Sending_Patches_VLC/",3058,8953,https://avatars.githubusercontent.com/u/1389585?v=4
70127218,arduino-esp32,espressif/arduino-esp32,C,48,Arduino core for the ESP32,5479,8587,https://avatars.githubusercontent.com/u/9460735?v=4
6041301,sumatrapdf,sumatrapdfreader/sumatrapdf,C,62,SumatraPDF reader,1409,8182,https://avatars.githubusercontent.com/u/9777518?v=4
18106269,lz4,lz4/lz4,C,51,Extremely Fast Compression algorithm,1097,7082,https://avatars.githubusercontent.com/u/11667224?v=4
35780977,ImageMagick,ImageMagick/ImageMagick,C,40,🧙‍♂️ ImageMagick 7,1002,7048,https://avatars.githubusercontent.com/u/12486768?v=4
105944401,yugabyte-db,yugabyte/yugabyte-db,C,32,"The high-performance distributed SQL database for global, internet-scale apps.",774,6393,https://avatars.githubusercontent.com/u/17074854?v=4
1979797,FreeRDP,FreeRDP/FreeRDP,C,53,FreeRDP is a free remote desktop protocol library and clients,16163,6345,https://avatars.githubusercontent.com/u/663376?v=4
59771425,zephyr,zephyrproject-rtos/zephyr,C,59,"Primary Git Repository for the Zephyr Project. Zephyr is a new generation, scalable, optimized, secure RTOS for multiple hardware architectures.",3760,5981,https://avatars.githubusercontent.com/u/19595895?v=4
236648333,MangoHud,flightlessmango/MangoHud,C,53,"A Vulkan and OpenGL overlay for monitoring FPS, temperatures, CPU/GPU load and more. Discord: https://discordapp.com/invite/Gj5YmBb",144,3627,https://avatars.githubusercontent.com/u/42713625?u=339ce9ed66185e7341280d54133f8c123dd0c8e4&v=4
10513590,tor,torproject/tor,C,33,unofficial git repo -- report bugs/issues/pull requests on https://gitlab.torproject.org/ --,817,3092,https://avatars.githubusercontent.com/u/4099049?v=4
34807561,nanopb,nanopb/nanopb,C,15,Protocol Buffers with small code size,644,2890,https://avatars.githubusercontent.com/u/12173937?v=4
5128084,clamav,Cisco-Talos/clamav,C,24,ClamAV - Documentation is here: https://docs.clamav.net,499,1962,https://avatars.githubusercontent.com/u/28057349?v=4
284134871,flipperzero-firmware,flipperdevices/flipperzero-firmware,C,40,Flipper Zero Firmware,246,1448,https://avatars.githubusercontent.com/u/57576566?v=4
283149635,ffmpeg-kit,tanersener/ffmpeg-kit,C,31,"FFmpeg Kit for applications. Supports Android, Flutter, iOS, macOS, React Native and tvOS. Supersedes MobileFFmpeg, flutter_ffmpeg and react-native-ffmpeg.",203,1289,https://avatars.githubusercontent.com/u/10158439?u=03d430397b7b3b3ed3d81798edc74e906b12e580&v=4
25676773,circle,rsta2/circle,C,112,A C++ bare metal environment for Raspberry Pi with USB (32 and 64 bit),177,1267,https://avatars.githubusercontent.com/u/9377920?u=0a760394e2c18cfaa79822d6308ca23d0c30d7ea&v=4
487242715,NTLMRelay2Self,med0x2e/NTLMRelay2Self,C,43,"An other No-Fix LPE, NTLMRelay2Self over HTTP (Webdav).",29,234,https://avatars.githubusercontent.com/u/3585128?u=f6cd28c909619550be36eb6453aeeade1b86215d&v=4
