id,name,full_name,language,new stars,description,forks_count,stargazers_count,avatar_url
111583593,scrcpy,Genymobile/scrcpy,C,334,Display and control your Android device,6991,64881,https://avatars.githubusercontent.com/u/3427627?v=4
246335987,Ventoy,ventoy/Ventoy,C,424,A new bootable USB solution.,2564,34344,https://avatars.githubusercontent.com/u/59477474?u=16f38c14b69580f87f4717b71c0e5e85e9559cb1&v=4
1357796,emscripten,emscripten-core/emscripten,C,47,Emscripten: An LLVM-to-WebAssembly Compiler,2813,22214,https://avatars.githubusercontent.com/u/46011144?v=4
102578345,lede,coolsnowwolf/lede,C,135,Lean's OpenWrt source,17198,21097,https://avatars.githubusercontent.com/u/31687149?u=caa956c5f80318ea674625f9e9efa49c98335d74&v=4
7634677,openssl,openssl/openssl,C,79,TLS/SSL and crypto library,7999,18336,https://avatars.githubusercontent.com/u/3279138?v=4
34921116,bcc,iovisor/bcc,C,57,"BCC - Tools for BPF-based Linux IO analysis, networking, monitoring, and more",2822,14411,https://avatars.githubusercontent.com/u/12766186?v=4
47409672,hashcat,hashcat/hashcat,C,408,World's fastest and most advanced password recovery utility,2187,14241,https://avatars.githubusercontent.com/u/15949799?v=4
63477515,C,TheAlgorithms/C,C,125,"Collection of various algorithms in mathematics, machine learning, computer science, physics, etc implemented in C for educational purposes.",3442,13400,https://avatars.githubusercontent.com/u/20487725?v=4
27737393,qmk_firmware,qmk/qmk_firmware,C,60,Open-source keyboard firmware for Atmel AVR and Arm USB families,26037,12236,https://avatars.githubusercontent.com/u/25358678?v=4
13836499,raylib,raysan5/raylib,C,60,A simple and easy-to-use library to enjoy videogames programming,1148,9539,https://avatars.githubusercontent.com/u/5766837?u=28d52cd1077b2f8b48d3897e82f03280a565e8d6&v=4
60667730,lvgl,lvgl/lvgl,C,92,"Powerful and easy-to-use embedded GUI library with many widgets, advanced visual effects (opacity, antialiasing, animations) and low memory requirements (16K RAM, 64K Flash).",1884,9359,https://avatars.githubusercontent.com/u/19811762?v=4
70127218,arduino-esp32,espressif/arduino-esp32,C,60,Arduino core for the ESP32,5475,8573,https://avatars.githubusercontent.com/u/9460735?v=4
105944401,yugabyte-db,yugabyte/yugabyte-db,C,33,"The high-performance distributed SQL database for global, internet-scale apps.",773,6385,https://avatars.githubusercontent.com/u/17074854?v=4
19330466,xxHash,Cyan4973/xxHash,C,40,Extremely fast non-cryptographic hash algorithm,599,6175,https://avatars.githubusercontent.com/u/750081?v=4
59771425,zephyr,zephyrproject-rtos/zephyr,C,48,"Primary Git Repository for the Zephyr Project. Zephyr is a new generation, scalable, optimized, secure RTOS for multiple hardware architectures.",3752,5964,https://avatars.githubusercontent.com/u/19595895?v=4
200321698,chibicc,rui314/chibicc,C,69,A small C compiler,453,4978,https://avatars.githubusercontent.com/u/47400?v=4
214011414,WindTerm,kingToolbox/WindTerm,C,102,A professional cross-platform SSH/Sftp/Shell/Telnet/Serial terminal.,349,4709,https://avatars.githubusercontent.com/u/51009775?v=4
288082909,htop,htop-dev/htop,C,32,htop - an interactive process viewer,245,3614,https://avatars.githubusercontent.com/u/69567116?v=4
204459250,xv6-riscv,mit-pdos/xv6-riscv,C,35,Xv6 for RISC-V,810,2464,https://avatars.githubusercontent.com/u/12404246?v=4
481977,libmodbus,stephane/libmodbus,C,25,"A Modbus library for Linux, Mac OS, FreeBSD and Windows",1375,2240,https://avatars.githubusercontent.com/u/1815?u=5ba41e06415bb6c84df4ddbd902466fb59d8948b&v=4
266800505,edk2-sdm845,edk2-porting/edk2-sdm845,C,13,Broken edk2 port for sdm845 xD,234,1598,https://avatars.githubusercontent.com/u/63859504?v=4
284134871,flipperzero-firmware,flipperdevices/flipperzero-firmware,C,43,Flipper Zero Firmware,242,1440,https://avatars.githubusercontent.com/u/57576566?v=4
169170146,inform,ganelson/inform,C,90,The core software distribution for the Inform 7 programming language.,43,700,https://avatars.githubusercontent.com/u/44782727?u=f5da331011d3c41f136d43c98cf81e83bd3fa2fc&v=4
387449953,chadwm,siduck/chadwm,C,33,Making dwm as beautiful as possible! ,78,686,https://avatars.githubusercontent.com/u/59060246?u=19636012195f0b5e641cff888f471cf173591373&v=4
378529353,neuron,emqx/neuron,C,189,Open Source Industrial IoT Connectivity Server,41,276,https://avatars.githubusercontent.com/u/25221711?v=4
