id,name,full_name,language,new stars,description,forks_count,stargazers_count,avatar_url
11180687,hugo,gohugoio/hugo,Go,28,The worldâ€™s fastest framework for building websites.,6900,63796,https://avatars.githubusercontent.com/u/29385237?v=4
41912791,v2ray-core,v2ray/v2ray-core,Go,11,A platform for building proxies to bypass network restrictions.,8507,40932,https://avatars.githubusercontent.com/u/14110142?v=4
17803236,rclone,rclone/rclone,Go,17,"""rsync for cloud storage"" - Google Drive, S3, Dropbox, Backblaze B2, One Drive, Swift, Hubic, Wasabi, Google Cloud Storage, Yandex Files",3255,35630,https://avatars.githubusercontent.com/u/24937341?v=4
136815833,clash,Dreamacro/clash,Go,37,A rule-based tunnel in Go.,4519,33391,https://avatars.githubusercontent.com/u/8615343?u=327152a798c877f098eaa24ec15448e9e21df323&v=4
97533102,LeetCode-Go,halfrost/LeetCode-Go,Go,16,"âœ… Solutions to LeetCode by Go, 100% test coverage, runtime beats 100% / LeetCode é¢˜è§£",5137,28315,https://avatars.githubusercontent.com/u/10825609?u=03334ecb4f5215e795ed600b655acd597945d4f9&v=4
15045751,compose,docker/compose,Go,11,Define and run multi-container applications with Docker,4625,27783,https://avatars.githubusercontent.com/u/5429470?v=4
56353740,minikube,kubernetes/minikube,Go,13,Run Kubernetes locally,4351,25161,https://avatars.githubusercontent.com/u/13629408?v=4
37448451,mattermost-server,mattermost/mattermost-server,Go,8,Mattermost is an open source platform for secure collaboration across the entire software development lifecycle.,5829,24328,https://avatars.githubusercontent.com/u/9828093?v=4
181461073,v2ray-core,v2fly/v2ray-core,Go,36,A platform for building proxies to bypass network restrictions.,3178,19291,https://avatars.githubusercontent.com/u/49637375?v=4
54400687,k6,grafana/k6,Go,12,"A modern load testing tool, using Go and JavaScript - https://k6.io",972,18632,https://avatars.githubusercontent.com/u/7195757?v=4
510607652,pocketbase,pocketbase/pocketbase,Go,26,Open Source realtime backend in 1 file,587,16570,https://avatars.githubusercontent.com/u/101000011?v=4
109145553,podman,containers/podman,Go,15,Podman: A tool for managing OCI containers and pods.,1705,15963,https://avatars.githubusercontent.com/u/5874934?v=4
323965659,alist,alist-org/alist,Go,55,"ğŸ—‚ï¸A file list program that supports multiple storage, powered by Gin and Solidjs. / ä¸€ä¸ªæ”¯æŒå¤šå­˜å‚¨çš„æ–‡ä»¶åˆ—è¡¨ç¨‹åºï¼Œä½¿ç”¨ Gin å’Œ Solidjsã€‚",1851,12541,https://avatars.githubusercontent.com/u/97389433?v=4
66156850,Go,TheAlgorithms/Go,Go,14,"Algorithms implemented in Go for beginners, following best practices.",2004,11457,https://avatars.githubusercontent.com/u/20487725?v=4
247032621,go-admin,go-admin-team/go-admin,Go,17,åŸºäºGin + Vue + Element UI &  Arco Design & Ant Design çš„å‰åç«¯åˆ†ç¦»æƒé™ç®¡ç†ç³»ç»Ÿè„šæ‰‹æ¶ï¼ˆåŒ…å«äº†ï¼šå¤šç§Ÿæˆ·çš„æ”¯æŒï¼ŒåŸºç¡€ç”¨æˆ·ç®¡ç†åŠŸèƒ½ï¼Œjwté‰´æƒï¼Œä»£ç ç”Ÿæˆå™¨ï¼ŒRBACèµ„æºæ§åˆ¶ï¼Œè¡¨å•æ„å»ºï¼Œå®šæ—¶ä»»åŠ¡ç­‰ï¼‰3åˆ†é’Ÿæ„å»ºè‡ªå·±çš„ä¸­åå°é¡¹ç›®ï¼›é¡¹ç›®æ–‡æ¡£ã€‹ï¼šhttps://www.go-admin.pro   V2 Demoï¼š https://vue2.go-admin.dev V3 Demoï¼š https://vue3.go-admin.dev Antd è®¢é˜…ç‰ˆï¼šhttps://antd.go-admin.pro,1714,7845,https://avatars.githubusercontent.com/u/70429007?v=4
410430370,CasaOS,IceWhaleTech/CasaOS,Go,18,"CasaOS - A simple, easy-to-use, elegant open-source Home Cloud system.",481,7321,https://avatars.githubusercontent.com/u/91336243?v=4
49765480,lnd,lightningnetwork/lnd,Go,3,Lightning Network Daemon âš¡ï¸,1825,6545,https://avatars.githubusercontent.com/u/13424735?v=4
111364256,v2,miniflux/v2,Go,14,Minimalist and opinionated feed reader,472,4277,https://avatars.githubusercontent.com/u/10584991?v=4
156946744,osmedeus,j3ssie/osmedeus,Go,8,A Workflow Engine for Offensive Security,791,4133,https://avatars.githubusercontent.com/u/23289085?u=7c4022bc6f9ddcea4df7fc279831cf60d2da59db&v=4
192178626,docker-development-youtube-series,marcel-dempers/docker-development-youtube-series,Go,8,,2926,3624,https://avatars.githubusercontent.com/u/34320559?u=8b1daab2937d0174c953379c3fd05bb2f89bab2c&v=4
45356931,discordgo,bwmarrin/discordgo,Go,2, (Golang) Go bindings for Discord,752,3519,https://avatars.githubusercontent.com/u/7683654?u=e4dc29e0f9aaf1753827bbfd47ebbd002593fc4a&v=4
429588481,unlocker,DrDonk/unlocker,Go,6,VMware macOS utilities,166,1194,https://avatars.githubusercontent.com/u/869796?v=4
299054922,mosint,alpkeskin/mosint,Go,33,An automated e-mail OSINT tool,189,1183,https://avatars.githubusercontent.com/u/49457057?u=5966502646e98a3f7c70ccac34ad001233659b3e&v=4
565713957,go_proxy_pool,pingc0y/go_proxy_pool,Go,54,æ— ç¯å¢ƒä¾èµ–å¼€ç®±å³ç”¨çš„ä»£ç†IPæ± ,33,313,https://avatars.githubusercontent.com/u/106963235?u=98ec687dc0fb651472b82a3ca508c605f40d8d2f&v=4
567807444,builder,flashbots/builder,Go,26,Flashbots mev-boost block builder,27,172,https://avatars.githubusercontent.com/u/71380475?v=4
