id,name,full_name,language,new stars,description,forks_count,stargazers_count,avatar_url
2325298,linux,torvalds/linux,C,1892,Linux kernel source tree,39717,121124,https://avatars.githubusercontent.com/u/1024025?v=4
13233158,obs-studio,obsproject/obs-studio,C,1066,OBS Studio - Free and open source software for live streaming and screen recording,5288,32580,https://avatars.githubusercontent.com/u/7725691?v=4
1903522,php-src,php/php-src,C,979,The PHP Interpreter,6895,32366,https://avatars.githubusercontent.com/u/25158?v=4
1614410,FFmpeg,FFmpeg/FFmpeg,C,459,Mirror of https://git.ffmpeg.org/ffmpeg.git,8893,26849,https://avatars.githubusercontent.com/u/729418?v=4
62156403,zju-icicles,QSCTech/zju-icicles,C,613,浙江大学课程攻略共享计划,6915,23274,https://avatars.githubusercontent.com/u/4727983?v=4
102578345,lede,coolsnowwolf/lede,C,450,Lean's OpenWrt source,15502,18522,https://avatars.githubusercontent.com/u/31687149?u=caa956c5f80318ea674625f9e9efa49c98335d74&v=4
196353673,TDengine,taosdata/TDengine,C,996,An open-source big data platform designed and optimized for the Internet of Things (IoT).,4121,17020,https://avatars.githubusercontent.com/u/48876650?v=4
6201092,mpv,mpv-player/mpv,C,650,🎥 Command line video player,2057,16725,https://avatars.githubusercontent.com/u/2550273?v=4
80286288,Tasmota,arendst/Tasmota,C,194,"Alternative firmware for ESP8266 with easy configuration using webUI, OTA updates, automation using timers or rules, expandability and entirely local control over MQTT, HTTP, Serial or KNX. Full documentation at",3599,16406,https://avatars.githubusercontent.com/u/11044339?u=b54c71859c551426b6738921138b740804ca1d62&v=4
95879426,ncnn,Tencent/ncnn,C,299,ncnn is a high-performance neural network inference framework optimized for the mobile platform,3148,13122,https://avatars.githubusercontent.com/u/18461506?v=4
66150122,nnn,jarun/nnn,C,470,n³ The unorthodox terminal file manager,504,12836,https://avatars.githubusercontent.com/u/5959286?u=2288d112a2d27a09182801b737af71c280a40f61&v=4
179354282,OpenCorePkg,acidanthera/OpenCorePkg,C,317,OpenCore bootloader,1492,8504,https://avatars.githubusercontent.com/u/39672954?v=4
1856976,libevent,libevent/libevent,C,130,Event notification library,2902,8088,https://avatars.githubusercontent.com/u/833750?v=4
13836499,raylib,raysan5/raylib,C,515,A simple and easy-to-use library to enjoy videogames programming,917,7806,https://avatars.githubusercontent.com/u/5766837?u=28d52cd1077b2f8b48d3897e82f03280a565e8d6&v=4
70127218,arduino-esp32,espressif/arduino-esp32,C,177,Arduino core for the ESP32,4775,7573,https://avatars.githubusercontent.com/u/9460735?v=4
50824485,processhacker,processhacker/processhacker,C,933,"A free, powerful, multi-purpose tool that helps you monitor system resources, debug software and detect malware.",884,6136,https://avatars.githubusercontent.com/u/16999957?v=4
192805335,mimalloc,microsoft/mimalloc,C,219,mimalloc is a compact general purpose allocator with excellent performance.,441,6043,https://avatars.githubusercontent.com/u/6154722?v=4
105944401,yugabyte-db,yugabyte/yugabyte-db,C,152,"The high-performance distributed SQL database for global, internet-scale apps.",674,5767,https://avatars.githubusercontent.com/u/17074854?v=4
187922067,WSL2-Linux-Kernel,microsoft/WSL2-Linux-Kernel,C,111,The source for the Linux kernel used in Windows Subsystem for Linux 2 (WSL2),540,5268,https://avatars.githubusercontent.com/u/6154722?v=4
59771425,zephyr,zephyrproject-rtos/zephyr,C,152,"Primary Git Repository for the Zephyr Project. Zephyr is a new generation, scalable, optimized, secure RTOS for multiple hardware architectures.",3257,5141,https://avatars.githubusercontent.com/u/19595895?v=4
414577657,Dummy-Robot,peng-zhihui/Dummy-Robot,C,1427,我的超迷你机械臂机器人项目。,771,4934,https://avatars.githubusercontent.com/u/12994887?u=6bfec84cb512892557cfed7fd7c52b0b0f41f95b&v=4
100979484,arcore-android-sdk,google-ar/arcore-android-sdk,C,48,ARCore SDK for Android Studio,995,4308,https://avatars.githubusercontent.com/u/31216907?v=4
59676171,klipper,Klipper3d/klipper,C,150,Klipper is a 3d-printer firmware,2557,3852,https://avatars.githubusercontent.com/u/90982958?v=4
394318710,ExplorerPatcher,valinet/ExplorerPatcher,C,1002,This project aims to bring back a productive working environment on Windows 11,61,1560,https://avatars.githubusercontent.com/u/6503598?u=25d850b7dcc57d2a488d83646fff7cca48cf7fc7&v=4
383940088,FNF-PsychEngine,ShadowMario/FNF-PsychEngine,C,70,Engine originally used on Mind Games mod,164,159,https://avatars.githubusercontent.com/u/44785097?u=d1dbdd299c562c87f6328009758bb8d901ee96c7&v=4
