id,name,full_name,language,new stars,description,forks_count,stargazers_count,avatar_url
2325298,linux,torvalds/linux,C,1863,Linux kernel source tree,39844,121505,https://avatars.githubusercontent.com/u/1024025?v=4
111583593,scrcpy,Genymobile/scrcpy,C,1917,Display and control your Android device,5990,57703,https://avatars.githubusercontent.com/u/3427627?v=4
36502,git,git/git,C,454,Git Source Code Mirror - This is a publish-only repository but pull requests can be turned into patches to the mailing list via GitGitGadget (https://gitgitgadget.github.io/). Please follow Documentation/SubmittingPatches procedure for any of your improvements.,22507,40150,https://avatars.githubusercontent.com/u/18133?v=4
13233158,obs-studio,obsproject/obs-studio,C,1558,OBS Studio - Free and open source software for live streaming and screen recording,5325,33182,https://avatars.githubusercontent.com/u/7725691?v=4
1903522,php-src,php/php-src,C,992,The PHP Interpreter,6906,32444,https://avatars.githubusercontent.com/u/25158?v=4
1614410,FFmpeg,FFmpeg/FFmpeg,C,475,Mirror of https://git.ffmpeg.org/ffmpeg.git,8906,26962,https://avatars.githubusercontent.com/u/729418?v=4
102578345,lede,coolsnowwolf/lede,C,474,Lean's OpenWrt source,15571,18634,https://avatars.githubusercontent.com/u/31687149?u=caa956c5f80318ea674625f9e9efa49c98335d74&v=4
196353673,TDengine,taosdata/TDengine,C,911,An open-source big data platform designed and optimized for the Internet of Things (IoT).,4134,17216,https://avatars.githubusercontent.com/u/48876650?v=4
6201092,mpv,mpv-player/mpv,C,597,🎥 Command line video player,2067,16787,https://avatars.githubusercontent.com/u/2550273?v=4
95879426,ncnn,Tencent/ncnn,C,287,ncnn is a high-performance neural network inference framework optimized for the mobile platform,3173,13172,https://avatars.githubusercontent.com/u/18461506?v=4
66150122,nnn,jarun/nnn,C,514,n³ The unorthodox terminal file manager,505,12932,https://avatars.githubusercontent.com/u/5959286?u=2288d112a2d27a09182801b737af71c280a40f61&v=4
5254557,skynet,cloudwu/skynet,C,118,A lightweight online game framework,3731,10713,https://avatars.githubusercontent.com/u/729648?v=4
184909163,yabai,koekeishiya/yabai,C,1079,A tiling window manager for macOS based on binary space partitioning,338,9226,https://avatars.githubusercontent.com/u/6175959?u=e07b472bc4fa5500439c2c099a4736bcfd636769&v=4
179354282,OpenCorePkg,acidanthera/OpenCorePkg,C,323,OpenCore bootloader,1500,8559,https://avatars.githubusercontent.com/u/39672954?v=4
13836499,raylib,raysan5/raylib,C,615,A simple and easy-to-use library to enjoy videogames programming,935,7944,https://avatars.githubusercontent.com/u/5766837?u=28d52cd1077b2f8b48d3897e82f03280a565e8d6&v=4
70127218,arduino-esp32,espressif/arduino-esp32,C,179,Arduino core for the ESP32,4800,7609,https://avatars.githubusercontent.com/u/9460735?v=4
18106269,lz4,lz4/lz4,C,109,Extremely Fast Compression algorithm,1021,6505,https://avatars.githubusercontent.com/u/11667224?v=4
187922067,WSL2-Linux-Kernel,microsoft/WSL2-Linux-Kernel,C,125,The source for the Linux kernel used in Windows Subsystem for Linux 2 (WSL2),546,5301,https://avatars.githubusercontent.com/u/6154722?v=4
59771425,zephyr,zephyrproject-rtos/zephyr,C,168,"Primary Git Repository for the Zephyr Project. Zephyr is a new generation, scalable, optimized, secure RTOS for multiple hardware architectures.",3282,5195,https://avatars.githubusercontent.com/u/19595895?v=4
394318710,ExplorerPatcher,valinet/ExplorerPatcher,C,965,This project aims to bring back a productive working environment on Windows 11,76,1783,https://avatars.githubusercontent.com/u/6503598?u=25d850b7dcc57d2a488d83646fff7cca48cf7fc7&v=4
127023441,cuda-samples,NVIDIA/cuda-samples,C,83,Samples for CUDA Developers which demonstrates features in CUDA Toolkit,525,1470,https://avatars.githubusercontent.com/u/1728152?v=4
238539562,pongoOS,checkra1n/pongoOS,C,79,pongoOS,212,1449,https://avatars.githubusercontent.com/u/56771417?v=4
16648618,secp256k1,bitcoin-core/secp256k1,C,68,Optimized C library for EC operations on curve secp256k1,759,1327,https://avatars.githubusercontent.com/u/13464320?v=4
356098390,cpuminer-gr-avx2,WyvernTKC/cpuminer-gr-avx2,C,236,Optimised Version of GR miner for RTM,124,287,https://avatars.githubusercontent.com/u/78566127?v=4
383940088,FNF-PsychEngine,ShadowMario/FNF-PsychEngine,C,61,Engine originally used on Mind Games mod,180,168,https://avatars.githubusercontent.com/u/44785097?u=d1dbdd299c562c87f6328009758bb8d901ee96c7&v=4
