id,name,full_name,language,new stars,description,forks_count,stargazers_count,avatar_url
63476337,Python,TheAlgorithms/Python,Python,3590,All Algorithms implemented in Python,33012,123363,https://avatars.githubusercontent.com/u/20487725?v=4
21289110,awesome-python,vinta/awesome-python,Python,3322,"A curated list of awesome Python frameworks, libraries, software and resources",20197,106697,https://avatars.githubusercontent.com/u/652070?u=95b472a9a11b64ee0f74512ad918d762d42c213c&v=4
1039520,youtube-dl,ytdl-org/youtube-dl,Python,1326,Command-line program to download videos from YouTube.com and other video sites,6306,102196,https://avatars.githubusercontent.com/u/48381040?v=4
155220641,transformers,huggingface/transformers,Python,1654,"ğŸ¤— Transformers: State-of-the-art Natural Language Processing for Pytorch, TensorFlow, and JAX.",12758,53882,https://avatars.githubusercontent.com/u/25720743?v=4
114747226,faceswap,deepfakes/faceswap,Python,974,Deepfakes Software For All,11330,39514,https://avatars.githubusercontent.com/u/34667098?u=694bb8572af60931d10ae4d2e600b989cffd0ff0&v=4
32689863,manim,3b1b/manim,Python,1245,Animation engine for explanatory math videos,4444,38924,https://avatars.githubusercontent.com/u/11601040?u=ccd223915efaad0958c195ce57bf46ab40d67873&v=4
101138315,d2l-zh,d2l-ai/d2l-zh,Python,1446,ã€ŠåŠ¨æ‰‹å­¦æ·±åº¦å­¦ä¹ ã€‹ï¼šé¢å‘ä¸­æ–‡è¯»è€…ã€èƒ½è¿è¡Œã€å¯è®¨è®ºã€‚ä¸­è‹±æ–‡ç‰ˆè¢«å…¨çƒ200æ‰€å¤§å­¦é‡‡ç”¨æ•™å­¦ã€‚,6506,27400,https://avatars.githubusercontent.com/u/43974506?v=4
33884891,airflow,apache/airflow,Python,379,"Apache Airflow - A platform to programmatically author, schedule, and monitor workflows",9569,23687,https://avatars.githubusercontent.com/u/47359?v=4
206660580,detectron2,facebookresearch/detectron2,Python,582,"Detectron2 is FAIR's next-generation platform for object detection, segmentation and other visual recognition tasks.",4999,18779,https://avatars.githubusercontent.com/u/16943930?v=4
196284711,cascadia-code,microsoft/cascadia-code,Python,379,"This is a fun, new monospaced font that includes programming ligatures and is designed to enhance the modern look and feel of the Windows Terminal.",602,18337,https://avatars.githubusercontent.com/u/6154722?v=4
264818686,yolov5,ultralytics/yolov5,Python,1368,YOLOv5 ğŸš€ in PyTorch > ONNX > CoreML > TFLite,6372,18314,https://avatars.githubusercontent.com/u/26833451?v=4
1385122,matplotlib,matplotlib/matplotlib,Python,188,matplotlib: plotting with Python,6148,14506,https://avatars.githubusercontent.com/u/215947?v=4
168799526,pytorch-image-models,rwightman/pytorch-image-models,Python,930,"PyTorch image models, scripts, pretrained weights -- ResNet, ResNeXT, EfficientNet, EfficientNetV2, NFNet, Vision Transformer, MixNet, MobileNet-V3/V2, RegNet, DPN, CSPNet, and more",2275,14369,https://avatars.githubusercontent.com/u/5702664?u=df4f0a66cd454d176039c595bb197c7fcecfd8ba&v=4
45680749,OSX-KVM,kholia/OSX-KVM,Python,360,Run macOS on QEMU/KVM. With OpenCore + Big Sur + Monterey support now! Only commercial (paid) support is available now to avoid spammy issues.,1222,12096,https://avatars.githubusercontent.com/u/79528?u=9817ec6a86b5c4cf292fa037b7c303e943febf4d&v=4
136202695,mlflow,mlflow/mlflow,Python,275,Open source platform for the machine learning lifecycle,2354,10603,https://avatars.githubusercontent.com/u/39938107?v=4
351432397,Swin-Transformer,microsoft/Swin-Transformer,Python,1158,"This is an official implementation for ""Swin Transformer: Hierarchical Vision Transformer using Shifted Windows"".",760,5717,https://avatars.githubusercontent.com/u/6154722?v=4
179163124,hummingbot,CoinAlpha/hummingbot,Python,835,Hummingbot: a client for crypto market making,1071,3184,https://avatars.githubusercontent.com/u/30281683?v=4
246183538,Practical-Ethical-Hacking-Resources,TCM-Course-Resources/Practical-Ethical-Hacking-Resources,Python,397,Compilation of Resources from TCM's Practical Ethical Hacking Udemy Course ,678,3023,https://avatars.githubusercontent.com/u/74793658?v=4
414545335,stylegan3,NVlabs/stylegan3,Python,2945,Official PyTorch implementation of StyleGAN3,285,2931,https://avatars.githubusercontent.com/u/2695301?v=4
253044228,nuclei-templates,projectdiscovery/nuclei-templates,Python,288,Community curated list of templates for the nuclei engine to find security vulnerabilities.,871,2747,https://avatars.githubusercontent.com/u/50994705?v=4
122809300,Lenia,Chakazul/Lenia,Python,1183,Lenia - Mathematical Life Forms,162,2743,https://avatars.githubusercontent.com/u/36795411?u=f7d241de4564c3711ef90d80971df42335b0cb0b&v=4
325873493,videos,3b1b/videos,Python,586,Code for the manim-generated scenes used in 3blue1brown videos,203,1489,https://avatars.githubusercontent.com/u/11601040?u=ccd223915efaad0958c195ce57bf46ab40d67873&v=4
382756807,TechXueXi,TechXueXi/TechXueXi,Python,949,å¼ºå›½é€š ç§‘æŠ€å¼ºå›½ å­¦ä¹ å¼ºå›½ xuexiqiangguo å…¨ç½‘æœ€å¥½ç”¨å¼€æºç½‘é¡µå­¦ä¹ å¼ºå›½åŠ©æ‰‹ï¼šTechXueXi ï¼ˆæ‡’äººåˆ·åˆ†å·¥å…· è‡ªåŠ¨å­¦ä¹ ï¼‰æŠ€æœ¯å¼ºå›½ï¼Œæ”¯æŒç­”é¢˜ï¼Œæ”¯æŒ docker 45åˆ†/å¤©,353,1397,https://avatars.githubusercontent.com/u/63344348?v=4
315490189,OpenCore-Legacy-Patcher,dortania/OpenCore-Legacy-Patcher,Python,372,Experience macOS just like before,110,1057,https://avatars.githubusercontent.com/u/46268266?v=4
386017669,NostalgiaForInfinity,iterativv/NostalgiaForInfinity,Python,205,Trading strategy for the Freqtrade crypto bot,149,589,https://avatars.githubusercontent.com/u/87440918?v=4
