id,name,full_name,language,new stars,description,forks_count,stargazers_count,avatar_url
138547797,mkcert,FiloSottile/mkcert,Go,428,A simple zero-config tool to make locally trusted development certificates with any names you'd like.,2457,47390,https://avatars.githubusercontent.com/u/1225294?u=f9186107b90a6f746f8e7192ee7b1d5a68f4ab07&v=4
15452919,go-ethereum,ethereum/go-ethereum,Go,106,Go implementation of the Ethereum protocol,19745,46781,https://avatars.githubusercontent.com/u/6250754?v=4
17803236,rclone,rclone/rclone,Go,127,"""rsync for cloud storage"" - Google Drive, S3, Dropbox, Backblaze B2, One Drive, Swift, Hubic, Wasabi, Google Cloud Storage, Azure Blob, Azure Files, Yandex Files",4042,45183,https://avatars.githubusercontent.com/u/24937341?v=4
43723161,helm,helm/helm,Go,149,The Kubernetes Package Manager,7015,26479,https://avatars.githubusercontent.com/u/15859888?v=4
27729907,grpc-go,grpc/grpc-go,Go,285,The Go language implementation of gRPC. HTTP/2 based RPC,4292,20539,https://avatars.githubusercontent.com/u/7802525?v=4
5179099,go-redis,redis/go-redis,Go,44,Redis Go client,2322,19651,https://avatars.githubusercontent.com/u/1529926?v=4
509091576,sing-box,SagerNet/sing-box,Go,394,The universal proxy platform,2012,16413,https://avatars.githubusercontent.com/u/83217677?v=4
71297170,chaosmonkey,Netflix/chaosmonkey,Go,43,Chaos Monkey is a resiliency tool that helps applications tolerate random instance failures.,1123,14788,https://avatars.githubusercontent.com/u/913567?v=4
119419195,kaniko,GoogleContainerTools/kaniko,Go,43,Build Container Images In Kubernetes,1401,14317,https://avatars.githubusercontent.com/u/38444003?v=4
257434373,hysteria,apernet/hysteria,Go,100,"Hysteria is a powerful, lightning fast and censorship resistant proxy.",1571,13968,https://avatars.githubusercontent.com/u/79422552?v=4
542931741,incubator-answer,apache/incubator-answer,Go,96,"A Q&A platform software for teams at any scales. Whether it's a community forum, help center, or knowledge management platform, you can always count on Apache Answer.",886,12099,https://avatars.githubusercontent.com/u/47359?v=4
150954997,VictoriaMetrics,VictoriaMetrics/VictoriaMetrics,Go,84,"VictoriaMetrics: fast, cost-effective monitoring solution and time series database",1138,11454,https://avatars.githubusercontent.com/u/43720803?v=4
222824662,dagger,dagger/dagger,Go,56,An engine to run your pipelines in containers,565,10644,https://avatars.githubusercontent.com/u/78824383?v=4
290437899,ddns-go,jeessy2/ddns-go,Go,112,"Simple and easy to use DDNS. Support Aliyun, Tencent Cloud, Dnspod, Cloudflare, Callback, Huawei Cloud, Baidu Cloud, Porkbun, GoDaddy, Namecheap, NameSilo...",1217,10574,https://avatars.githubusercontent.com/u/6205259?u=0668f056159f7ab885b1749c10400aa50893da5b&v=4
709538270,plandex,plandex-ai/plandex,Go,117,"AI driven development in your terminal. Designed for large, real-world tasks.",703,9986,https://avatars.githubusercontent.com/u/148917357?v=4
9120526,pgx,jackc/pgx,Go,68,PostgreSQL driver and toolkit for Go,808,9940,https://avatars.githubusercontent.com/u/94130?v=4
212465715,buf,bufbuild/buf,Go,109,The best way of working with Protocol Buffers.,256,8637,https://avatars.githubusercontent.com/u/54191850?v=4
109451092,talos,siderolabs/talos,Go,138,Talos Linux is a modern Linux distribution built for Kubernetes.,471,5899,https://avatars.githubusercontent.com/u/13804887?v=4
43465675,go-libp2p,libp2p/go-libp2p,Go,32,libp2p implementation in Go,1043,5873,https://avatars.githubusercontent.com/u/14838238?v=4
238797860,optimism,ethereum-optimism/optimism,Go,219,"Optimism is Ethereum, scaled.",3038,5458,https://avatars.githubusercontent.com/u/58791460?v=4
272663924,simplebank,techschool/simplebank,Go,650,Backend master class: build a simple bank service in Go,906,4959,https://avatars.githubusercontent.com/u/58562849?u=2196b0f937f04c468b3422cfad75cb4a156dd462&v=4
463027648,afrog,zan8in/afrog,Go,75,"A Security Tool for Bug Bounty, Pentest and Red Teaming.",364,3188,https://avatars.githubusercontent.com/u/4088460?u=5bf62831907dc85b2050698b72ad38851b5aeee2&v=4
102390943,cel-spec,google/cel-spec,Go,63,Common Expression Language -- specification and binary representation,216,2657,https://avatars.githubusercontent.com/u/1342004?v=4
