id,name,full_name,language,new stars,description,forks_count,stargazers_count,avatar_url
9384267,electron,electron/electron,C++,22,":electron: Build cross-platform desktop apps with JavaScript, HTML, and CSS",14713,107673,https://avatars.githubusercontent.com/u/13409222?v=4
5108051,opencv,opencv/opencv,C++,24,Open Source Computer Vision Library,55354,69292,https://avatars.githubusercontent.com/u/5009934?v=4
15634981,godot,godotengine/godot,C++,25,Godot Engine – Multi-platform 2D and 3D game engine,11789,61832,https://avatars.githubusercontent.com/u/6318500?v=4
619959033,gpt4all,nomic-ai/gpt4all,C++,194,"gpt4all: an ecosystem of open-source chatbots trained on a massive collections of clean assistant data including code, stories and dialogue",4848,45591,https://avatars.githubusercontent.com/u/102670180?v=4
11171548,json,nlohmann/json,C++,14,JSON for Modern C++,6058,35170,https://avatars.githubusercontent.com/u/159488?v=4
259463685,carbon-lang,carbon-language/carbon-lang,C++,8,"Carbon Language's main repository: documents, design, implementation, and related tools. (NOTE: Carbon Language is experimental; see README)",1379,30561,https://avatars.githubusercontent.com/u/63681715?v=4
39840932,googletest,google/googletest,C++,13,GoogleTest - Google Testing and Mocking Framework,9383,29814,https://avatars.githubusercontent.com/u/1342004?v=4
108110,mongo,mongodb/mongo,C++,8,The MongoDB Database,5535,23864,https://avatars.githubusercontent.com/u/45120?v=4
22394357,osquery,osquery/osquery,C++,2,"SQL powered operating system instrumentation, monitoring, and analytics.",2432,20357,https://avatars.githubusercontent.com/u/8315868?v=4
26038648,spdlog,gabime/spdlog,C++,17,Fast C++ logging library.,3803,18700,https://avatars.githubusercontent.com/u/6052198?u=a5aaa778f219603fd3a6e221c79370ac5f0fa182&v=4
1062572,Catch2,catchorg/Catch2,C++,5,"A modern, C++-native, test framework for unit-tests, TDD and BDD - using C++14, C++17 and later (C++11 support is in v2.x branch, and C++03 on the Catch1.x branch)",2865,16678,https://avatars.githubusercontent.com/u/33321405?v=4
648343,muduo,chenshuo/muduo,C++,6,Event-driven network library for multi-threaded Linux server in C++11,4986,13159,https://avatars.githubusercontent.com/u/231074?v=4
299510783,mold,rui314/mold,C++,37,Mold: A Modern Linker 🦠,382,10957,https://avatars.githubusercontent.com/u/47400?v=4
138754790,duckdb,duckdb/duckdb,C++,20,DuckDB is an in-process SQL OLAP Database Management System,967,10505,https://avatars.githubusercontent.com/u/82039556?v=4
204593825,STL,microsoft/STL,C++,6,MSVC's implementation of the C++ Standard Library.,1314,8921,https://avatars.githubusercontent.com/u/6154722?v=4
49986046,falco,falcosecurity/falco,C++,6,Cloud Native Runtime Security,791,5937,https://avatars.githubusercontent.com/u/42391047?v=4
280608729,ORB_SLAM3,UZ-SLAMLab/ORB_SLAM3,C++,5,"ORB-SLAM3: An Accurate Open-Source Library for Visual, Visual-Inertial and Multi-Map SLAM",2069,4909,https://avatars.githubusercontent.com/u/25055183?v=4
243394576,pixie,pixie-io/pixie,C++,9,Instant Kubernetes-Native Application Observability,350,4643,https://avatars.githubusercontent.com/u/82631609?v=4
58168143,USD,PixarAnimationStudios/USD,C++,7,Universal Scene Description,994,4368,https://avatars.githubusercontent.com/u/1672744?v=4
47440536,cocos-engine,cocos/cocos-engine,C++,0,"Cocos Engine is an open-source framework for building 2D & 3D real-time rendering and interactive contents, especially video games, which can be deployed to mobile, desktop and web. It is inherited from the legacy Cocos2d-x with a redesigned modern architecture. To run this engine, please download Cocos Creator.",1404,3858,https://avatars.githubusercontent.com/u/6937061?v=4
388946490,velox,facebookincubator/velox,C++,8,A C++ vectorized database acceleration library aimed to optimizing query engines and data processing systems.,618,2445,https://avatars.githubusercontent.com/u/19538647?v=4
208145128,iree,openxla/iree,C++,3,A retargetable MLIR-based machine learning compiler and runtime toolkit.,425,1870,https://avatars.githubusercontent.com/u/107584881?v=4
135363400,navigation2,ros-planning/navigation2,C++,3,ROS2 Navigation Framework and System,924,1509,https://avatars.githubusercontent.com/u/2328631?v=4
266676410,Kisak-Strike,SwagSoftware/Kisak-Strike,C++,22,100% Open Source CSGO,78,819,https://avatars.githubusercontent.com/u/9426950?v=4
649783849,Terminator,ZeroMemoryEx/Terminator,C++,82,Reproducing Spyboy technique to terminate all EDR/XDR/AVs processes,57,292,https://avatars.githubusercontent.com/u/60795188?u=fced03c66f5d1a3e2b8e0614661e63c1d6c226cf&v=4
