id,name,full_name,language,new stars,description,forks_count,stargazers_count,avatar_url
29028775,react-native,facebook/react-native,JavaScript,215,A framework for building native applications using React,21737,101060,https://avatars.githubusercontent.com/u/69631?v=4
70107786,next.js,vercel/next.js,JavaScript,465,The React Framework,16674,81194,https://avatars.githubusercontent.com/u/14985020?v=4
23083156,material-ui,mui/material-ui,JavaScript,374,"MUI Core (formerly Material UI) is the React UI library you always wanted. Follow your own design system, or start with Material Design.",25991,75459,https://avatars.githubusercontent.com/u/33663932?v=4
103633984,nodebestpractices,goldbergyoni/nodebestpractices,JavaScript,577,:white_check_mark:  The Node.js best practices list (January 2022),7660,74914,https://avatars.githubusercontent.com/u/8571500?u=03817cbb5afcffb9d822eb7a7c33b0254a1666b8&v=4
311525798,Web-Dev-For-Beginners,microsoft/Web-Dev-For-Beginners,JavaScript,288,"24 Lessons, 12 Weeks, Get Started as a Web Developer",5924,40589,https://avatars.githubusercontent.com/u/6154722?v=4
33263118,uBlock,gorhill/uBlock,JavaScript,329,uBlock Origin - An efficient blocker for Chromium and Firefox. Fast and lean.,2314,28747,https://avatars.githubusercontent.com/u/585534?v=4
85031442,hiring-without-whiteboards,poteto/hiring-without-whiteboards,JavaScript,315,⭐️  Companies that don't have a broken hiring process,2355,27031,https://avatars.githubusercontent.com/u/1390709?u=45549fb0ee4a83cf3e054ccb1a72aa6b7750b437&v=4
17372733,OpenAPI-Specification,OAI/OpenAPI-Specification,JavaScript,75,The OpenAPI Specification Repository,8069,22987,https://avatars.githubusercontent.com/u/16343502?v=4
40484398,discord.js,discordjs/discord.js,JavaScript,130,A powerful JavaScript library for interacting with the Discord API,3217,17422,https://avatars.githubusercontent.com/u/26492485?v=4
229764465,30-Days-Of-JavaScript,Asabeneh/30-Days-Of-JavaScript,JavaScript,1274,"30 days of JavaScript programming challenge is a step-by-step guide to learn JavaScript programming language in 30 days. This challenge may take more than 100 days,  please just follow your own pace. ",3332,16458,https://avatars.githubusercontent.com/u/9008063?u=ec6ff77196b998a4e6b6e3ca1429c524c169c189&v=4
306977633,AI-Expert-Roadmap,AMAI-GmbH/AI-Expert-Roadmap,JavaScript,377,Roadmap to becoming an Artificial Intelligence Expert in 2022,1440,16190,https://avatars.githubusercontent.com/u/54247845?v=4
64700934,openzeppelin-contracts,OpenZeppelin/openzeppelin-contracts,JavaScript,271,OpenZeppelin Contracts is a library for secure smart contract development.,7950,15875,https://avatars.githubusercontent.com/u/20820676?v=4
92111509,trilium,zadam/trilium,JavaScript,475,Build your personal knowledge base with Trilium Notes,816,13786,https://avatars.githubusercontent.com/u/617641?v=4
39315600,Iosevka,be5invis/Iosevka,JavaScript,53,"Versatile typeface for code, from code.",443,13468,https://avatars.githubusercontent.com/u/240091?u=c96c3142cd1ca26a5f86e962068054e12f3af7e7&v=4
110178895,brave-browser,brave/brave-browser,JavaScript,96,"Next generation Brave browser for Android, Linux, macOS, Windows.",1350,12065,https://avatars.githubusercontent.com/u/12301619?v=4
190729906,budibase,Budibase/budibase,JavaScript,1195,"Budibase is an open-source low-code platform for creating internal apps in minutes. Supports PostgreSQL, MySQL, MSSQL, MongoDB, Rest API, Docker, K8s 🚀 ",521,10128,https://avatars.githubusercontent.com/u/45009727?v=4
299628763,30-Days-Of-React,Asabeneh/30-Days-Of-React,JavaScript,168,"30 Days of  React challenge is a step by step guide to learn React in 30 days. It requires HTML, CSS, and JavaScript knowledge. You should be comfortable with JavaScript before you start to React.  If you are not comfortable with JavaScript check out 30DaysOfJavaScript. This is a continuation of 30 Days Of JS.  This challenge may take more than 100 days, follow your own pace. ",2364,9196,https://avatars.githubusercontent.com/u/9008063?u=ec6ff77196b998a4e6b6e3ca1429c524c169c189&v=4
234739976,medusa,medusajs/medusa,JavaScript,1304,The open-source Shopify alternative ⚡️,391,7651,https://avatars.githubusercontent.com/u/62591822?v=4
80862584,gutenberg,WordPress/gutenberg,JavaScript,39,The Block Editor project for WordPress and beyond. Plugin is available from the official repository.,2761,7535,https://avatars.githubusercontent.com/u/276006?v=4
352933140,ToolJet,ToolJet/ToolJet,JavaScript,463,Open-source low-code framework for building React-based web applications and internal tools 🚀,438,5430,https://avatars.githubusercontent.com/u/82193554?v=4
133092972,undici,nodejs/undici,JavaScript,90,"An HTTP/1.1 client, written from scratch for Node.js",181,3184,https://avatars.githubusercontent.com/u/9950313?v=4
429851205,Cider,ciderapp/Cider,JavaScript,244,Project Cider. A new look into listening and enjoying Apple Music in style and performance. 🚀,97,1226,https://avatars.githubusercontent.com/u/87914859?v=4
408234804,blooket-hack,glixzzy/blooket-hack,JavaScript,26,The Blooket Hack,1383,413,https://avatars.githubusercontent.com/u/73669084?u=40919c98515fdd8af7a51b24e27297abdb84fa6c&v=4
433989147,breeze-next,laravel/breeze-next,JavaScript,65,An application / authentication starter kit frontend in Next.js for Laravel Breeze.,42,269,https://avatars.githubusercontent.com/u/958072?v=4
437977440,Prep-Course,soyHenry/Prep-Course,JavaScript,23,,2468,88,https://avatars.githubusercontent.com/u/57154655?v=4
