id,name,full_name,language,new stars,description,forks_count,stargazers_count,avatar_url
83222441,system-design-primer,donnemartin/system-design-primer,Python,1033,Learn how to design large-scale systems. Prep for the system design interview.  Includes Anki flashcards.,29865,161442,https://avatars.githubusercontent.com/u/5458997?u=f1007b583e55e7ccfb6ccf0e200051156112dd9b&v=4
21289110,awesome-python,vinta/awesome-python,Python,983,"A curated list of awesome Python frameworks, libraries, software and resources",20661,115887,https://avatars.githubusercontent.com/u/652070?u=95b472a9a11b64ee0f74512ad918d762d42c213c&v=4
21872392,awesome-machine-learning,josephmisiti/awesome-machine-learning,Python,268,"A curated list of awesome Machine Learning frameworks, libraries and software.",13054,53091,https://avatars.githubusercontent.com/u/246302?u=9242c80bcb25acbc66683faf0d5d9fb92674689b&v=4
125266328,black,psf/black,Python,613,The uncompromising Python code formatter,1604,25286,https://avatars.githubusercontent.com/u/50630501?v=4
307260205,yt-dlp,yt-dlp/yt-dlp,Python,742,A youtube-dl fork with additional features and fixes,1353,18943,https://avatars.githubusercontent.com/u/79589310?v=4
91594105,awx,ansible/awx,Python,42,AWX Project,2715,10612,https://avatars.githubusercontent.com/u/1507452?v=4
197153676,chia-blockchain,Chia-Network/chia-blockchain,Python,394,"Chia blockchain python implementation (full node, farmer, harvester, timelord, and wallet)",1807,10334,https://avatars.githubusercontent.com/u/34047804?v=4
52796596,netbox,netbox-community/netbox,Python,212,Infrastructure resource modeling for network automation. Open source under Apache 2. Public demo: https://demo.netbox.dev,1757,9796,https://avatars.githubusercontent.com/u/44905828?v=4
420459569,copilot-docs,github/copilot-docs,Python,579,Documentation for GitHub Copilot,848,8961,https://avatars.githubusercontent.com/u/9919?v=4
254832799,hackingtool,Z4nzu/hackingtool,Python,255,ALL IN ONE Hacking Tool For Hackers,1271,8068,https://avatars.githubusercontent.com/u/25708027?u=43d51529db320284423e8eab65383767c6f52fa7&v=4
355959597,textual,Textualize/textual,Python,530,Textual is a TUI (Text User Interface) framework for Python inspired by modern web development.,195,8023,https://avatars.githubusercontent.com/u/93378883?v=4
62743585,spotify-downloader,spotDL/spotify-downloader,Python,92,Download your Spotify playlists and songs along with album art and metadata (from YouTube if a match is found).,938,7418,https://avatars.githubusercontent.com/u/71949218?v=4
68402336,streamlink,streamlink/streamlink,Python,39,Streamlink is a CLI utility which pipes video streams from various services into a video player,797,7085,https://avatars.githubusercontent.com/u/22243823?v=4
21800813,english-words,dwyl/english-words,Python,153,:memo: A text file containing 479k English words for all your dictionary/word-based projects e.g: auto-completion / autosuggestion,1300,6445,https://avatars.githubusercontent.com/u/11708465?v=4
5746963,pip-tools,jazzband/pip-tools,Python,125,A set of tools to keep your pinned Python dependencies fresh.,492,5628,https://avatars.githubusercontent.com/u/15129049?v=4
3757435,pytube,pytube/pytube,Python,119,"A lightweight, dependency-free Python library (and command-line utility) for downloading YouTube Videos.",1301,5453,https://avatars.githubusercontent.com/u/16789089?v=4
143328315,mindsdb,mindsdb/mindsdb,Python,489,In-Database Machine Learning,591,5028,https://avatars.githubusercontent.com/u/31035808?v=4
428202741,awesome-oss-alternatives,RunaCapital/awesome-oss-alternatives,Python,1112,Awesome list of open-source startup alternatives to well-known SaaS products 🚀,205,4572,https://avatars.githubusercontent.com/u/16305757?v=4
422005902,YT-Spammer-Purge,ThioJoe/YT-Spammer-Purge,Python,1953,Allows you easily scan for and delete scam comments using several methods.,290,2915,https://avatars.githubusercontent.com/u/12518330?u=d8a5d7a0522b20c5750d0b54613eb648f9185c8c&v=4
128755707,Tidal-Media-Downloader,yaronzz/Tidal-Media-Downloader,Python,48,Download 'TIDAL' Music On Windows/Linux/MacOs (PYTHON/C#),313,1755,https://avatars.githubusercontent.com/u/15530958?u=722cf1c58dfe1bcf89e663a986429038cb29d180&v=4
400837389,pycord,Pycord-Development/pycord,Python,108,"Pycord, a maintained fork of discord.py, is a python wrapper for the Discord API",293,1652,https://avatars.githubusercontent.com/u/89700626?v=4
270504039,plane-notify,Jxck-S/plane-notify,Python,938,"Notify If a selected plane has taken off or landed using OpenSky or ADS-B Exchange data. Compares older data to newer data to determine if a landing or takeoff has occurred. As well as nav modes, emergency squawk and resolution advisory notifications. Can output to Twitter, Discord, and Pushbullet ",246,1242,https://avatars.githubusercontent.com/u/20673070?u=e9df3549923d0f2bb2cbd28092492d149484ddf6&v=4
386017669,NostalgiaForInfinity,iterativv/NostalgiaForInfinity,Python,24,Trading strategy for the Freqtrade crypto bot,242,1012,https://avatars.githubusercontent.com/u/87440918?v=4
444267396,tstock,Gbox4/tstock,Python,67,📈A command line tool to view stock charts in the terminal.,27,346,https://avatars.githubusercontent.com/u/48675187?u=8bfb28757c02a0109a54e5f40c464f1838b9e7bc&v=4
422175049,community-templates,zabbix/community-templates,Python,35,Zabbix Community Templates repository,108,183,https://avatars.githubusercontent.com/u/4561226?v=4
