id,name,full_name,language,new stars,description,forks_count,stargazers_count,avatar_url
17620347,aspnetcore,dotnet/aspnetcore,C#,56,"ASP.NET Core is a cross-platform .NET framework for building modern cloud-based web applications on Windows, Mac, or Linux.",9913,35111,https://avatars.githubusercontent.com/u/9141961?v=4
120231691,Ryujinx,Ryujinx/Ryujinx,C#,117,Experimental Nintendo Switch Emulator written in C#,3922,34290,https://avatars.githubusercontent.com/u/39036280?v=4
198071756,RevokeMsgPatcher,huiyadanli/RevokeMsgPatcher,C#,195,:trollface: A hex editor for WeChat/QQ/TIM - PCç‰ˆå¾®ä¿¡/QQ/TIMé˜²æ’¤å›è¡¥ä¸ï¼ˆæˆ‘å·²ç»çœ‹åˆ°äº†ï¼Œæ’¤å›ä¹Ÿæ²¡ç”¨äº†ï¼‰,3319,28412,https://avatars.githubusercontent.com/u/15783049?u=86f380636f7c09b86788a977ea96272cb7484a30&v=4
607289185,semantic-kernel,microsoft/semantic-kernel,C#,104,Integrate cutting-edge LLM technology quickly and easily into your apps,3106,21174,https://avatars.githubusercontent.com/u/6154722?v=4
1327739,ILSpy,icsharpcode/ILSpy,C#,50,".NET Decompiler with support for PDB generation, ReadyToRun, Metadata (&more) - cross-platform!",3318,21142,https://avatars.githubusercontent.com/u/343434?v=4
54086969,awesome-dotnet-core,thangchung/awesome-dotnet-core,C#,27,":honeybee: A collection of awesome .NET core libraries, tools, frameworks and software",2873,19738,https://avatars.githubusercontent.com/u/422341?u=b24af4c3b730fe4554fac2408390b646294facdc&v=4
321682465,SteamTools,BeyondDimension/SteamTools,C#,122,ğŸ› ã€ŒWatt Toolkitã€æ˜¯ä¸€ä¸ªå¼€æºè·¨å¹³å°çš„å¤šåŠŸèƒ½ Steam å·¥å…·ç®±ã€‚,1241,19435,https://avatars.githubusercontent.com/u/79355691?v=4
30474266,MaterialDesignInXamlToolkit,MaterialDesignInXAML/MaterialDesignInXamlToolkit,C#,29,"Google's Material Design in XAML & WPF, for C# & VB.Net. ",3411,15004,https://avatars.githubusercontent.com/u/16655083?v=4
103370157,optimizer,hellzerg/optimizer,C#,139,The finest Windows Optimizer,917,13646,https://avatars.githubusercontent.com/u/3146835?u=012a457ae34fc7f8a0e55e66f7e3f1702a6e7a47&v=4
16157746,efcore,dotnet/efcore,C#,19,"EF Core is a modern object-database mapper for .NET. It supports LINQ queries, change tracking, updates, and schema migrations.",3144,13607,https://avatars.githubusercontent.com/u/9141961?v=4
791611,mono,mono/mono,C#,58,"Mono open source ECMA CLI, C# and .NET implementation.",3811,11047,https://avatars.githubusercontent.com/u/53395?v=4
22636263,duplicati,duplicati/duplicati,C#,52,Store securely encrypted backups in the cloud!,891,10801,https://avatars.githubusercontent.com/u/8270231?v=4
681372871,garnet,microsoft/garnet,C#,69,"Garnet is a remote cache-store from Microsoft Research that offers strong performance (throughput and latency), scalability, storage, recovery, cluster sharding, key migration, and replication features. Garnet can work with existing Redis clients.",486,10050,https://avatars.githubusercontent.com/u/6154722?v=4
187499284,UniTask,Cysharp/UniTask,C#,71,Provides an efficient allocation free async/await integration for Unity.,814,7935,https://avatars.githubusercontent.com/u/44487420?v=4
153711945,wpf,dotnet/wpf,C#,16,WPF is a .NET Core UI framework for building Windows desktop applications.,1160,7005,https://avatars.githubusercontent.com/u/9141961?v=4
151148482,elsa-core,elsa-workflows/elsa-core,C#,37,A .NET workflows library,1130,6213,https://avatars.githubusercontent.com/u/51759159?v=4
2928944,azure-sdk-for-net,Azure/azure-sdk-for-net,C#,7,This repository is for active development of the Azure SDK for .NET. For consumers of the SDK we recommend visiting our public developer docs at https://learn.microsoft.com/dotnet/azure/ or our versioned developer docs at https://azure.github.io/azure-sdk-for-net. ,4579,5230,https://avatars.githubusercontent.com/u/6844498?v=4
59467988,Unigram,UnigramDev/Unigram,C#,24,Telegram for Windows,441,3774,https://avatars.githubusercontent.com/u/22216198?v=4
385118073,AssetRipper,AssetRipper/AssetRipper,C#,47,"GUI Application to work with engine assets, asset bundles, and serialized files",511,3763,https://avatars.githubusercontent.com/u/96150378?v=4
419415576,dotnet,CommunityToolkit/dotnet,C#,36,".NET Community Toolkit is a collection of helpers and APIs that work for all .NET developers and are agnostic of any specific UI platform. The toolkit is maintained and published by Microsoft, and part of the .NET Foundation.",288,2912,https://avatars.githubusercontent.com/u/41346473?v=4
562007145,parsec-vdd,nomi-san/parsec-vdd,C#,87,âœ¨ Perfect 4K@240Hz Virtual Display,113,2180,https://avatars.githubusercontent.com/u/38210249?u=80457fb16e7b8db4c7c4751370bb0b20339f2315&v=4
728573769,R3,Cysharp/R3,C#,37,The new future of dotnet/reactive and UniRx.,87,1923,https://avatars.githubusercontent.com/u/44487420?v=4
174013231,FModel,4sval/FModel,C#,44,Unreal Engine Archives Explorer,240,1499,https://avatars.githubusercontent.com/u/26126862?u=fce7cc1607a0ee909fca8a8aea92f65fbf140e01&v=4
128596963,PDFQFZ,flytkgl/PDFQFZ,C#,324,PDFåŠ ç›–éª‘ç¼ç« çš„å°å·¥å…·,153,1132,https://avatars.githubusercontent.com/u/3757930?v=4
425837195,sourcegit,sourcegit-scm/sourcegit,C#,48,Windows/macOS/Linux GUI client for GIT users,90,863,https://avatars.githubusercontent.com/u/85621660?u=29acc609f775d7c2ff74a39ec7476fe3be4ec801&v=4
