id,name,full_name,language,new stars,description,forks_count,stargazers_count,avatar_url
8514,rails,rails/rails,Ruby,55,Ruby on Rails,21491,55509,https://avatars.githubusercontent.com/u/4223?v=4
65252,jekyll,jekyll/jekyll,Ruby,64,:globe_with_meridians: Jekyll is a blog-aware static site generator in Ruby,9944,48855,https://avatars.githubusercontent.com/u/3083652?v=4
52281283,mastodon,mastodon/mastodon,Ruby,79,"Your self-hosted, globally interconnected microblogging community",6870,46616,https://avatars.githubusercontent.com/u/24979032?v=4
7569578,discourse,discourse/discourse,Ruby,84,"A platform for community discussion. Free, open, simple.",8252,41579,https://avatars.githubusercontent.com/u/3220138?v=4
53238813,brew,Homebrew/brew,Ruby,90,🍺 The missing package manager for macOS (or Linux),9522,40615,https://avatars.githubusercontent.com/u/1503512?v=4
2293158,metasploit-framework,rapid7/metasploit-framework,Ruby,71,Metasploit Framework,13865,33654,https://avatars.githubusercontent.com/u/1013671?v=4
37382858,engineering-blogs,kilimchoi/engineering-blogs,Ruby,237,A curated list of engineering blogs,1567,30990,https://avatars.githubusercontent.com/u/1356007?u=c1ae28679aee148c3e9984e00497968cf419e284&v=4
737898780,maybe,maybe-finance/maybe,Ruby,116,The OS for your personal finances,2226,29290,https://avatars.githubusercontent.com/u/80786585?v=4
481872,vagrant,hashicorp/vagrant,Ruby,27,Vagrant is a tool for building and distributing development environments.,4426,26130,https://avatars.githubusercontent.com/u/761456?v=4
308770,devise,heartcombo/devise,Ruby,19,Flexible authentication solution for Rails with Warden.,5535,23877,https://avatars.githubusercontent.com/u/59584037?v=4
538746,ruby,ruby/ruby,Ruby,31,The Ruby Programming Language,5306,21872,https://avatars.githubusercontent.com/u/210414?v=4
202291859,chatwoot,chatwoot/chatwoot,Ruby,71,"Open-source live-chat, email support, omni-channel desk. An alternative to Intercom, Zendesk, Salesforce Service Cloud etc. 🔥💬",3259,20145,https://avatars.githubusercontent.com/u/23416667?v=4
52855516,homebrew-core,Homebrew/homebrew-core,Ruby,31,🍻 Default formulae for the missing package manager for macOS (or Linux),12288,13541,https://avatars.githubusercontent.com/u/1503512?v=4
3195124,sidekiq,sidekiq/sidekiq,Ruby,9,"Simple, efficient background processing for Ruby",2403,13098,https://avatars.githubusercontent.com/u/124714131?v=4
1918677,fluentd,fluent/fluentd,Ruby,16,Fluentd: Unified Logging Layer (project under CNCF),1335,12787,https://avatars.githubusercontent.com/u/859518?v=4
1725199,linguist,github-linguist/linguist,Ruby,25,"Language Savant. If your repository's language is being reported incorrectly, send us a pull request!",4179,12056,https://avatars.githubusercontent.com/u/20014732?v=4
586265895,kamal,basecamp/kamal,Ruby,39,Deploy web apps anywhere.,369,9531,https://avatars.githubusercontent.com/u/13131?v=4
4994614,wpscan,wpscanteam/wpscan,Ruby,20,WPScan WordPress security scanner. Written for security professionals and blog maintainers to test the security of their WordPress websites. Contact us via contact@wpscan.com,1254,8470,https://avatars.githubusercontent.com/u/1872249?v=4
211588,paper_trail,paper-trail-gem/paper_trail,Ruby,3,Track changes to your rails models,888,6749,https://avatars.githubusercontent.com/u/38986600?v=4
137805,redis-rb,redis/redis-rb,Ruby,3,A Ruby client library for Redis,1026,3962,https://avatars.githubusercontent.com/u/1529926?v=4
3064003,PasswordPusher,pglombardo/PasswordPusher,Ruby,32,"🔐   Securely share sensitive information with automatic expiration & deletion after a set number of views or duration.  Track who, what and when with full audit logs.",339,1936,https://avatars.githubusercontent.com/u/395132?u=64c086579c151edc896e3f24f9ce143f5e257f0f&v=4
463648726,ruby-lsp,Shopify/ruby-lsp,Ruby,13,An opinionated language server for Ruby,140,1491,https://avatars.githubusercontent.com/u/8085?v=4
66497320,dd-trace-rb,DataDog/dd-trace-rb,Ruby,1,Datadog Tracing Ruby Client,369,305,https://avatars.githubusercontent.com/u/365230?v=4
279271772,datadog-api-client-ruby,DataDog/datadog-api-client-ruby,Ruby,0,Ruby client for the Datadog API,18,35,https://avatars.githubusercontent.com/u/365230?v=4
77154536,mobile-dependencies_whitelist,mercadolibre/mobile-dependencies_whitelist,Ruby,0,Whitelist dependencies files for mobile teams,598,22,https://avatars.githubusercontent.com/u/245516?v=4
