id,name,full_name,language,new stars,description,forks_count,stargazers_count,avatar_url
85077558,developer-roadmap,kamranahmedse/developer-roadmap,TypeScript,1601,Roadmap to becoming a developer in 2022,29239,205450,https://avatars.githubusercontent.com/u/4921183?u=9a67bfd198f1a73f262d08b53eeb6ad2befc572f&v=4
123458551,Python-100-Days,jackfrued/Python-100-Days,Python,667,Python - 100天从新手到大师,46252,121989,https://avatars.githubusercontent.com/u/7474657?u=902200c2389c203cf2139888e10314845edd2a2a&v=4
184456251,PowerToys,microsoft/PowerToys,C#,781,Windows system utilities to maximize productivity,4325,76231,https://avatars.githubusercontent.com/u/6154722?v=4
119811010,tabler,tabler/tabler,HTML,956,Tabler is free and open-source HTML Dashboard UI Kit built on Bootstrap,3195,30253,https://avatars.githubusercontent.com/u/35471246?v=4
229764465,30-Days-Of-JavaScript,Asabeneh/30-Days-Of-JavaScript,JavaScript,923,"30 days of JavaScript programming challenge is a step-by-step guide to learn JavaScript programming language in 30 days. This challenge may take more than 100 days,  please just follow your own pace. ",5800,26445,https://avatars.githubusercontent.com/u/9008063?u=ec6ff77196b998a4e6b6e3ca1429c524c169c189&v=4
4307108,nsq,nsqio/nsq,Go,519,A realtime distributed messaging platform,2770,22528,https://avatars.githubusercontent.com/u/8295919?v=4
349321229,GFPGAN,TencentARC/GFPGAN,Python,651,GFPGAN aims at developing Practical Algorithms for Real-world Face Restoration.,3172,20991,https://avatars.githubusercontent.com/u/83739826?v=4
311683390,ImHex,WerWolv/ImHex,C++,1526,"🔍 A Hex Editor for Reverse Engineers, Programmers and people who value their retinas when working at 3 AM.",881,19776,https://avatars.githubusercontent.com/u/10835354?u=df34a21c99e8b5470fb39a106d328372e7abc115&v=4
157166750,lens,lensapp/lens,TypeScript,126,Lens - The way the world runs Kubernetes,1045,19184,https://avatars.githubusercontent.com/u/62133242?v=4
355959597,textual,Textualize/textual,Python,605,Textual is a TUI (Text User Interface) framework for Python inspired by modern web development.,332,12802,https://avatars.githubusercontent.com/u/93378883?v=4
468515960,CodeEdit,CodeEditApp/CodeEdit,Swift,857,"CodeEdit App for macOS – Elevate your code editing experience. Open source, free forever.",539,12111,https://avatars.githubusercontent.com/u/101493338?v=4
301793434,focalboard,mattermost/focalboard,TypeScript,185,"Focalboard is an open source, self-hosted alternative to Trello, Notion, and Asana.",935,11964,https://avatars.githubusercontent.com/u/9828093?v=4
266417772,Summer2023-Internships,pittcsc/Summer2023-Internships,Python,424,Collection of Summer 2023 tech internships!,1157,11340,https://avatars.githubusercontent.com/u/7276234?v=4
502193049,gum,charmbracelet/gum,Go,2289,A tool for glamorous shell scripts 🎀,137,8862,https://avatars.githubusercontent.com/u/57376114?v=4
2168780,minetest,minetest/minetest,C++,238,Minetest is an open source voxel game engine with easy modding and game creation,1599,7796,https://avatars.githubusercontent.com/u/2624745?v=4
140543886,shenyu,apache/shenyu,Java,188,"Apache ShenYu is a Java native API Gateway for service proxy, protocol conversion and API governance.",2355,6826,https://avatars.githubusercontent.com/u/47359?v=4
482621452,bud,livebud/bud,JavaScript,416,The Full-Stack Web Framework for Go,130,4312,https://avatars.githubusercontent.com/u/93525642?v=4
425845325,react-native-skia,Shopify/react-native-skia,TypeScript,310,High-performance React Native Graphics using Skia,191,3797,https://avatars.githubusercontent.com/u/8085?v=4
247288642,Baileys,adiwajshing/Baileys,JavaScript,139,Lightweight full-featured WhatsApp Web + Multi-Device API,1065,3465,https://avatars.githubusercontent.com/u/8328864?v=4
281229404,ultimatevocalremovergui,Anjok07/ultimatevocalremovergui,Python,630, GUI for a Vocal Remover that uses Deep Neural Networks.,187,2670,https://avatars.githubusercontent.com/u/68268275?u=19a742f0478d0de533088031ca85fdebfdf9d238&v=4
505278571,scan4all,hktalent/scan4all,Go,527,"vuls Scan: 15000+PoCs; 23 kinds of application password crack; 7000+Web fingerprints; 146 protocols and 90000+ rules Port scanning; Fuzz, HW, awesome BugBounty( ͡° ͜ʖ ͡°)...",278,2518,https://avatars.githubusercontent.com/u/18223385?u=5ba29c1a9447ae88a6a0433f44038f47471e11c1&v=4
517520796,lotion,Dashibase/lotion,Vue,275,An open-source Notion UI built with Vue 3 ,70,2100,https://avatars.githubusercontent.com/u/104201305?v=4
426075845,sui,MystenLabs/sui,Rust,224," Sui, a next-generation smart contract platform with high throughput, low latency, and an asset-oriented programming model powered by the Move programming language",4018,1324,https://avatars.githubusercontent.com/u/88845815?v=4
508745959,revanced-builder,reisxd/revanced-builder,JavaScript,193,A NodeJS ReVanced builder,51,708,https://avatars.githubusercontent.com/u/29177546?v=4
476381845,containers,bitnami/containers,Shell,47,Bitnami container images,34,137,https://avatars.githubusercontent.com/u/5446553?v=4
