id,name,full_name,language,new stars,description,forks_count,stargazers_count,avatar_url
63476337,Python,TheAlgorithms/Python,Python,896,All Algorithms implemented in Python,36414,141887,https://avatars.githubusercontent.com/u/20487725?v=4
123458551,Python-100-Days,jackfrued/Python-100-Days,Python,513,Python - 100å¤©ä»æ–°æ‰‹åˆ°å¤§å¸ˆ,46311,122256,https://avatars.githubusercontent.com/u/7474657?u=902200c2389c203cf2139888e10314845edd2a2a&v=4
155220641,transformers,huggingface/transformers,Python,439,"ğŸ¤— Transformers: State-of-the-art Machine Learning for Pytorch, TensorFlow, and JAX.",15820,68339,https://avatars.githubusercontent.com/u/25720743?v=4
21872392,awesome-machine-learning,josephmisiti/awesome-machine-learning,Python,407,"A curated list of awesome Machine Learning frameworks, libraries and software.",13477,55509,https://avatars.githubusercontent.com/u/246302?u=9242c80bcb25acbc66683faf0d5d9fb92674689b&v=4
355959597,textual,Textualize/textual,Python,196,Textual is a TUI (Text User Interface) framework for Python inspired by modern web development.,339,12919,https://avatars.githubusercontent.com/u/93378883?v=4
139199684,prefect,PrefectHQ/prefect,Python,72,The easiest way to automate your data,974,9777,https://avatars.githubusercontent.com/u/39270919?v=4
287463830,qlib,microsoft/qlib,Python,157,"Qlib is an AI-oriented quantitative investment platform, which aims to realize the potential, empower the research, and create the value of AI technologies in quantitative investment. With Qlib, you can easily try your ideas to create better Quant investment strategies. An increasing number of  SOTA Quant research works/papers are released in Qlib.",1665,9374,https://avatars.githubusercontent.com/u/6154722?v=4
89266735,ParlAI,facebookresearch/ParlAI,Python,327,A framework for training and evaluating AI models on a variety of openly available dialogue datasets.,1903,9352,https://avatars.githubusercontent.com/u/16943930?v=4
303802588,MHDDoS,MatrixTM/MHDDoS,Python,937,"Best DDoS Attack Script  Python3, (Cyber / DDos) Attack With 56 Methods",1287,5934,https://avatars.githubusercontent.com/u/102809114?v=4
167694194,frigate,blakeblackshear/frigate,Python,62,NVR with realtime local object detection for IP cameras,553,5263,https://avatars.githubusercontent.com/u/569905?u=a454086144f531389a73fbea93a7835eea06f2a1&v=4
190823163,Osintgram,Datalux/Osintgram,Python,199,Osintgram is a OSINT tool on Instagram. It offers an interactive shell to perform analysis on Instagram account of any users by its nickname,978,4795,https://avatars.githubusercontent.com/u/26717218?u=560d1ce8e49270894d0b31f11d9dd92a8e98e031&v=4
520708737,fauxpilot,moyix/fauxpilot,Python,2171,FauxPilot - an open-source GitHub Copilot server,148,4733,https://avatars.githubusercontent.com/u/34380?v=4
495587598,imagen-pytorch,lucidrains/imagen-pytorch,Python,303,"Implementation of Imagen, Google's Text-to-Image Neural Network, in Pytorch",351,4687,https://avatars.githubusercontent.com/u/108653?u=73e119b957102d7cf7c37b915f7dad20f7ecf8fc&v=4
509153572,discoart,jina-ai/discoart,Python,1014,Create Disco Diffusion artworks in one line,115,2409,https://avatars.githubusercontent.com/u/60539444?v=4
390700079,TopFreeProxies,alanbobs999/TopFreeProxies,Python,75,é«˜è´¨é‡å…è´¹èŠ‚ç‚¹åˆ†äº«ï¼Œä»¥åŠè®¢é˜…é“¾æ¥æ”¶é›†ã€‚,421,1875,https://avatars.githubusercontent.com/u/73283555?u=d6f7f8c1e4700f374175e2f128a651ca94d22912&v=4
329620403,EasyMocap,zju3dv/EasyMocap,Python,238,Make human motion capture easier. ,222,1640,https://avatars.githubusercontent.com/u/48914724?v=4
489384246,blackbird,p1ngul1n0/blackbird,Python,165,An OSINT tool to search for accounts by username in social networks.,117,841,https://avatars.githubusercontent.com/u/57546870?u=d34bb993b7dfde65c291077fd44a95291b2a53f1&v=4
370055539,AutoMihoyoBBS,Womsxd/AutoMihoyoBBS,Python,89,ç±³æ¸¸ç¤¾è‡ªåŠ¨ç­¾åˆ°ï¼Œæ”¯æŒï¼šå´©åäºŒã€å´©åä¸‰ã€åŸç¥ã€æœªå®šäº‹ä»¶ç°¿ï¼Œç±³æ¸¸å¸è‡ªåŠ¨è·å–,255,839,https://avatars.githubusercontent.com/u/45663319?u=07fe79adf9f0a0926eac1ae8d88da12b0b360f04&v=4
515495663,dnsReaper,punk-security/dnsReaper,Python,558,"dnsReaper - subdomain takeover tool for attackers, bug bounty hunters and the blue team!",51,739,https://avatars.githubusercontent.com/u/80768008?v=4
516904877,multinerf,google-research/multinerf,Python,224,"A Code Release for Mip-NeRF 360, Ref-NeRF, and RawNeRF",39,630,https://avatars.githubusercontent.com/u/43830688?v=4
518064189,kaolin-wisp,NVIDIAGameWorks/kaolin-wisp,Python,213,"NVIDIA Kaolin Wisp is a PyTorch library powered by NVIDIA Kaolin Core to work with neural fields (including NeRFs, NGLOD, instant-ngp and VQAD).",43,618,https://avatars.githubusercontent.com/u/7717624?v=4
490304872,paranoid_crypto,google/paranoid_crypto,Python,131,,20,458,https://avatars.githubusercontent.com/u/1342004?v=4
515792028,donut,clovaai/donut,Python,78,"Official Implementation of OCR-free Document Understanding Transformer (Donut) and Synthetic Document Generator (SynthDoG), ECCV 2022",24,342,https://avatars.githubusercontent.com/u/48815312?v=4
515485093,anti-ip-attribution,lwd-temp/anti-ip-attribution,Python,127,é’ˆå¯¹éƒ¨åˆ†ç½‘ç«™æ˜¾ç¤ºIPå½’å±åœ°çš„æµé‡åˆ†æµè§„åˆ™,27,327,https://avatars.githubusercontent.com/u/26019675?u=170c1a101c54ae27a5fca0d0bcf3adb756669646&v=4
521422856,Windows-WiFi-Extractor,hmaverickadams/Windows-WiFi-Extractor,Python,76,Extract Windows Wi-Fi Passwords to Remote URL,34,151,https://avatars.githubusercontent.com/u/37809113?u=7fb94a3d71fcec61843f5ce379750d7229bdd10f&v=4
