id,name,full_name,language,new stars,description,forks_count,stargazers_count,avatar_url
8514,rails,rails/rails,Ruby,73,Ruby on Rails,21218,54522,https://avatars.githubusercontent.com/u/4223?v=4
65252,jekyll,jekyll/jekyll,Ruby,53,:globe_with_meridians: Jekyll is a blog-aware static site generator in Ruby,9831,47990,https://avatars.githubusercontent.com/u/3083652?v=4
27442967,fastlane,fastlane/fastlane,Ruby,38,🚀 The easiest way to automate building and releasing your iOS and Android apps,5588,38455,https://avatars.githubusercontent.com/u/11098337?v=4
2293158,metasploit-framework,rapid7/metasploit-framework,Ruby,68,Metasploit Framework,13562,32405,https://avatars.githubusercontent.com/u/1013671?v=4
21696302,awesome-swift,matteocrippa/awesome-swift,Ruby,44,A collaborative list of awesome Swift libraries and resources. Feel free to contribute!,3064,24116,https://avatars.githubusercontent.com/u/475463?u=ba860f7ff503a83aeb273a3c16a07d338ff31ba0&v=4
202291859,chatwoot,chatwoot/chatwoot,Ruby,112,"Open-source live-chat, email support, omni-channel desk. An alternative to Intercom, Zendesk, Salesforce Service Cloud etc. 🔥💬",2818,18037,https://avatars.githubusercontent.com/u/23416667?v=4
1725199,linguist,github-linguist/linguist,Ruby,27,"Language Savant. If your repository's language is being reported incorrectly, send us a pull request!",3998,11632,https://avatars.githubusercontent.com/u/20014732?v=4
15435,liquid,Shopify/liquid,Ruby,23,"Liquid markup language. Safe, customer facing template language for flexible web apps. ",1349,10705,https://avatars.githubusercontent.com/u/8085?v=4
611921,activeadmin,activeadmin/activeadmin,Ruby,2,The administration framework for Ruby on Rails applications.,3287,9416,https://avatars.githubusercontent.com/u/814570?v=4
6899875,openproject,opf/openproject,Ruby,38,OpenProject is the leading open source project management software.,2072,8010,https://avatars.githubusercontent.com/u/1756674?v=4
22059578,pghero,ankane/pghero,Ruby,16,A performance dashboard for Postgres,428,7498,https://avatars.githubusercontent.com/u/220358?u=ba13f3240d7992dc4124a33a4fc65bf4924e5375&v=4
211588,paper_trail,paper-trail-gem/paper_trail,Ruby,6,Track changes to your rails models,877,6669,https://avatars.githubusercontent.com/u/38986600?v=4
2889230,active_model_serializers,rails-api/active_model_serializers,Ruby,2,ActiveModel::Serializer implementation and Rails hooks,1393,5309,https://avatars.githubusercontent.com/u/2820360?v=4
30985840,solidus,solidusio/solidus,Ruby,5,"🛒 Solidus, the open-source eCommerce framework for industry trailblazers.",1269,4863,https://avatars.githubusercontent.com/u/11045486?v=4
96071,rack,rack/rack,Ruby,2,A modular Ruby web server interface.,1616,4803,https://avatars.githubusercontent.com/u/42379?v=4
115859973,pagy,ddnexus/pagy,Ruby,18,🏆 The Best Pagination Ruby Gem 🥇,367,4355,https://avatars.githubusercontent.com/u/100721?v=4
229006,wicked_pdf,mileszs/wicked_pdf,Ruby,3,PDF generator (from HTML) plugin for Ruby on Rails,638,3508,https://avatars.githubusercontent.com/u/2425?v=4
1175581,styles,citation-style-language/styles,Ruby,8,Official repository for Citation Style Language (CSL) citation styles.,3667,3131,https://avatars.githubusercontent.com/u/526476?v=4
9500075,oxidized,ytti/oxidized,Ruby,14,Oxidized is a network device configuration backup tool. It's a RANCID replacement!,885,2557,https://avatars.githubusercontent.com/u/200527?v=4
242765280,good_job,bensheldon/good_job,Ruby,16,"Multithreaded, Postgres-based, Active Job backend for Ruby on Rails.",177,2381,https://avatars.githubusercontent.com/u/47554?u=7f919feee43d319ec01c7b135f4d1868a31bddc3&v=4
3662248,git-scm.com,git/git-scm.com,Ruby,5,The git-scm.com website. Note that this repository is only for the website; issues with git itself should go to https://git-scm.com/community.,1181,2123,https://avatars.githubusercontent.com/u/18133?v=4
188828946,endoflife.date,endoflife-date/endoflife.date,Ruby,19,Informative site with EoL dates of everything,592,2085,https://avatars.githubusercontent.com/u/62706925?v=4
641512,openstreetmap-website,openstreetmap/openstreetmap-website,Ruby,5,The Rails application that powers OpenStreetMap,881,1988,https://avatars.githubusercontent.com/u/261431?v=4
588508856,solid_queue,basecamp/solid_queue,Ruby,23,Database-backed Active Job backend,57,1237,https://avatars.githubusercontent.com/u/13131?v=4
279271772,datadog-api-client-ruby,DataDog/datadog-api-client-ruby,Ruby,0,,17,30,https://avatars.githubusercontent.com/u/365230?v=4
