id,name,full_name,language,new stars,description,forks_count,stargazers_count,avatar_url
2325298,linux,torvalds/linux,C,692,Linux kernel source tree,45809,142670,https://avatars.githubusercontent.com/u/1024025?v=4
10744183,netdata,netdata/netdata,C,94,"Real-time performance monitoring, done right! https://www.netdata.cloud",5410,61389,https://avatars.githubusercontent.com/u/43390781?v=4
246335987,Ventoy,ventoy/Ventoy,C,431,A new bootable USB solution.,3056,42384,https://avatars.githubusercontent.com/u/59477474?u=16f38c14b69580f87f4717b71c0e5e85e9559cb1&v=4
1614410,FFmpeg,FFmpeg/FFmpeg,C,162,Mirror of https://git.ffmpeg.org/ffmpeg.git,10355,33090,https://avatars.githubusercontent.com/u/729418?v=4
102578345,lede,coolsnowwolf/lede,C,144,Lean's LEDE source,18412,24092,https://avatars.githubusercontent.com/u/31687149?u=caa956c5f80318ea674625f9e9efa49c98335d74&v=4
80286288,Tasmota,arendst/Tasmota,C,59,"Alternative firmware for ESP8266 with easy configuration using webUI, OTA updates, automation using timers or rules, expandability and entirely local control over MQTT, HTTP, Serial or KNX. Full documentation at",4194,18773,https://avatars.githubusercontent.com/u/11044339?u=b54c71859c551426b6738921138b740804ca1d62&v=4
18496166,mimikatz,gentilkiwi/mimikatz,C,48,A little tool to play with Windows security,3193,16452,https://avatars.githubusercontent.com/u/2307945?v=4
45821540,openwrt,openwrt/openwrt,C,70,This repository is a mirror of https://git.openwrt.org/openwrt/openwrt.git It is for reference only and is not active for check-ins.  We will continue to accept Pull Requests here. They will be merged via staging trees then into openwrt.git.,8047,13363,https://avatars.githubusercontent.com/u/2528830?v=4
70127218,arduino-esp32,espressif/arduino-esp32,C,53,Arduino core for the ESP32,6193,9748,https://avatars.githubusercontent.com/u/9460735?v=4
437011,zfs,openzfs/zfs,C,182,OpenZFS on Linux and FreeBSD,1543,8527,https://avatars.githubusercontent.com/u/4510897?v=4
215973962,acwj,DoctorWkt/acwj,C,97,A Compiler Writing Journey,704,7464,https://avatars.githubusercontent.com/u/817898?u=0af29670f30ff566382155876132a0368cb6bb21&v=4
19112091,thc-hydra,vanhauser-thc/thc-hydra,C,72,hydra,1622,6976,https://avatars.githubusercontent.com/u/7396244?u=952127371f345a18656cb9c91a67cde499fbfdc6&v=4
2328181,freebsd-src,freebsd/freebsd-src,C,26,FreeBSD src tree (read-only mirror),2483,6665,https://avatars.githubusercontent.com/u/811839?v=4
5870069,librdkafka,edenhill/librdkafka,C,28,The Apache Kafka C/C++ library,2889,6369,https://avatars.githubusercontent.com/u/524990?v=4
59676171,klipper,Klipper3d/klipper,C,90,Klipper is a 3d-printer firmware,3906,5757,https://avatars.githubusercontent.com/u/90982958?v=4
400501136,mujoco,deepmind/mujoco,C,36,Multi-Joint dynamics with Contact. A general purpose physics simulator.,451,5092,https://avatars.githubusercontent.com/u/8596759?v=4
327491895,HoloCubic,peng-zhihui/HoloCubic,C,24,带网络功能的伪全息透明显示桌面站,1014,4856,https://avatars.githubusercontent.com/u/12994887?u=6bfec84cb512892557cfed7fd7c52b0b0f41f95b&v=4
284134871,flipperzero-firmware,flipperdevices/flipperzero-firmware,C,107,Flipper Zero firmware source code,1005,4241,https://avatars.githubusercontent.com/u/57576566?v=4
48296177,libfuse,libfuse/libfuse,C,20,The reference implementation of the Linux FUSE (Filesystem in Userspace) interface,957,4195,https://avatars.githubusercontent.com/u/16281578?v=4
541269386,whisper.cpp,ggerganov/whisper.cpp,C,856,Port of OpenAI's Whisper model in C/C++,199,2930,https://avatars.githubusercontent.com/u/1991296?u=28314d364d7c28f8ec232fadb767970d3ad74e7b&v=4
470579591,unleashed-firmware,DarkFlippers/unleashed-firmware,C,306,Flipper Zero Unleashed Firmware,274,2895,https://avatars.githubusercontent.com/u/115378555?v=4
117704656,ostep-projects,remzi-arpacidusseau/ostep-projects,C,14,Projects for an undergraduate OS course,833,2721,https://avatars.githubusercontent.com/u/13019127?u=55c39f686682915111b1675a26f7dbffd7e8d6a3&v=4
331380723,pico-sdk,raspberrypi/pico-sdk,C,30,,472,1860,https://avatars.githubusercontent.com/u/1294177?v=4
505613691,Onion,OnionUI/Onion,C,21,Stock OS overhaul for Miyoo Mini ,24,587,https://avatars.githubusercontent.com/u/109221246?v=4
511278970,vkquake-rt,sultim-t/vkquake-rt,C,23,,10,227,https://avatars.githubusercontent.com/u/31703959?v=4
