id,name,full_name,language,new stars,description,forks_count,stargazers_count,avatar_url
184456251,PowerToys,microsoft/PowerToys,C#,612,Windows system utilities to maximize productivity,4564,79916,https://avatars.githubusercontent.com/u/6154722?v=4
199570071,v2rayN,2dust/v2rayN,C#,217,"A V2Ray client for Windows, support Xray core and v2fly core",6509,32646,https://avatars.githubusercontent.com/u/31833384?v=4
164140756,Files,files-community/Files,C#,154,Building the best File Manager for Windows,1546,24613,https://avatars.githubusercontent.com/u/65931357?v=4
193681686,netch,netchx/netch,C#,59,A simple proxy client,2066,12447,https://avatars.githubusercontent.com/u/52199683?v=4
22456440,osu,ppy/osu,C#,72,rhythm is just a *click* away!,1745,10909,https://avatars.githubusercontent.com/u/995763?v=4
75990888,csharplang,dotnet/csharplang,C#,37,The official repo for the design of the C# programming language,947,9253,https://avatars.githubusercontent.com/u/9141961?v=4
375939072,FastGithub,dotnetcore/FastGithub,C#,152,github加速神器，解决github打不开、用户头像无法加载、releases无法上传下载、git-clone、git-pull、git-push失败等问题,1203,8857,https://avatars.githubusercontent.com/u/19404084?v=4
374228,RestSharp,restsharp/RestSharp,C#,32,Simple REST and HTTP API Client for .NET,2249,8655,https://avatars.githubusercontent.com/u/1057779?v=4
372096057,Bili.Uwp,Richasy/Bili.Uwp,C#,70,适用于新系统UI的哔哩,436,6518,https://avatars.githubusercontent.com/u/27713596?u=9566724713f4741794fb48625c333fdedc5e5f1d&v=4
125612271,EntityComponentSystemSamples,Unity-Technologies/EntityComponentSystemSamples,C#,45,,1114,4673,https://avatars.githubusercontent.com/u/426196?v=4
158025849,Windows-Auto-Night-Mode,AutoDarkMode/Windows-Auto-Night-Mode,C#,42,Automatically switches between the dark and light theme of Windows 10 and Windows 11,197,4612,https://avatars.githubusercontent.com/u/89929298?v=4
187499284,UniTask,Cysharp/UniTask,C#,52,Provides an efficient allocation free async/await integration for Unity.,432,4160,https://avatars.githubusercontent.com/u/44487420?v=4
245033131,ProxySU,proxysu/ProxySU,C#,88,"Xray,V2ray，Trojan，NaiveProxy, Trojan-Go, ShadowsocksR(SSR),Shadowsocks-libev及相关插件,MTProto+TLS 一键安装工具，windows下用（一键科学上网）",1369,4089,https://avatars.githubusercontent.com/u/61810006?u=c4001a94fbecdda67bfd1b29c7e1ee17fe9d5f11&v=4
151148482,elsa-core,elsa-workflows/elsa-core,C#,28,A .NET Standard 2.0 Workflows Library,743,3792,https://avatars.githubusercontent.com/u/51759159?v=4
184286875,runner,actions/runner,C#,23,The Runner for GitHub Actions :rocket:,716,3196,https://avatars.githubusercontent.com/u/44036562?v=4
103370157,optimizer,hellzerg/optimizer,C#,155,The finest Windows Optimizer,317,3148,https://avatars.githubusercontent.com/u/3146835?u=012a457ae34fc7f8a0e55e66f7e3f1702a6e7a47&v=4
116210568,ScottPlot,ScottPlot/ScottPlot,C#,27,Interactive Plotting Library for .NET,423,2576,https://avatars.githubusercontent.com/u/76536295?v=4
90608506,querybuilder,sqlkata/querybuilder,C#,61,"SQL query builder, written in c#, helps you build complex queries easily, supports SqlServer, MySql, PostgreSql, Oracle, Sqlite and Firebird",418,2451,https://avatars.githubusercontent.com/u/28526760?v=4
436286849,BiliBiliToolPro,RayWangQvQ/BiliBiliToolPro,C#,59,B 站（bilibili）自动任务工具，支持docker、青龙、腾讯云函数等多种部署方式。敏感肌也能用。,1158,1623,https://avatars.githubusercontent.com/u/31154238?u=74d35e10b4f27895bcc029931bc23ca1391ec009&v=4
437636034,MicaForEveryone,MicaForEveryone/MicaForEveryone,C#,52,a tool to enable backdrop effect on titlebar of win32 apps on Windows 11,37,1036,https://avatars.githubusercontent.com/u/103479527?v=4
373274891,Maui,CommunityToolkit/Maui,C#,27,"The .NET MAUI Community Toolkit is a community-created library that contains .NET MAUI Extensions, Advanced UI/UX Controls, and Behaviors to help make your life as a .NET MAUI developer easier",126,983,https://avatars.githubusercontent.com/u/41346473?v=4
307848141,com.unity.multiplayer.samples.coop,Unity-Technologies/com.unity.multiplayer.samples.coop,C#,25,"A small-scale cooperative game sample built on the new, Unity networking framework to teach developers about creating a similar multiplayer game.",281,972,https://avatars.githubusercontent.com/u/426196?v=4
167568377,XMusicDownloader,jadepeng/XMusicDownloader,C#,94,一款 支持从百度、网易、qq、酷狗、咪咕等音乐网站搜索并下载歌曲的程序，支持下载无损音乐,160,894,https://avatars.githubusercontent.com/u/4680005?u=543db941292a2b6a9a01e4365fda57618f2e18a8&v=4
418846673,LenovoLegionToolkit,BartoszCichecki/LenovoLegionToolkit,C#,333,Lightweight replacement of Lenovo Vantage for Lenovo Legion laptops.,40,628,https://avatars.githubusercontent.com/u/7916915?u=dc826d818eda71bec6ce2db9b8cb496b48eac9f5&v=4
525406711,pocket_core_autoupdate_net,mattpannella/pocket_core_autoupdate_net,C#,18,Analogue Pocket Updater Utility,6,115,https://avatars.githubusercontent.com/u/4806679?u=7cbdab06c915533744a526afe890ce570ddd8fe0&v=4
