id,name,full_name,language,new stars,description,forks_count,stargazers_count,avatar_url
27729880,grpc,grpc/grpc,C++,118,"The C based gRPC (C++, Python, Ruby, Objective-C, PHP, C#)",9439,35864,https://avatars.githubusercontent.com/u/7802525?v=4
39840932,googletest,google/googletest,C++,177,GoogleTest - Google Testing and Mocking Framework,8871,28059,https://avatars.githubusercontent.com/u/1342004?v=4
1116542,aria2,aria2/aria2,C++,81,"aria2 is a lightweight multi-protocol & multi-source, cross platform download utility operated in command-line. It supports HTTP/HTTPS, FTP, SFTP, BitTorrent and Metalink.",3092,27692,https://avatars.githubusercontent.com/u/13545224?v=4
98771110,TrafficMonitor,zhongyang219/TrafficMonitor,C++,294,这是一个用于显示当前网速、CPU及内存利用率的桌面悬浮窗软件，并支持任务栏显示，支持更换皮肤。,2458,22809,https://avatars.githubusercontent.com/u/30562462?u=18ad9b9dfa6e784088d28deb7e0dbe830afcc0b7&v=4
63477612,C-Plus-Plus,TheAlgorithms/C-Plus-Plus,C++,496,"Collection of various algorithms in mathematics, machine learning, computer science and physics implemented in C++ for educational purposes.",5766,21728,https://avatars.githubusercontent.com/u/20487725?v=4
107794782,trojan,trojan-gfw/trojan,C++,68,An unidentifiable mechanism that helps you bypass GFW.,2855,16508,https://avatars.githubusercontent.com/u/33605505?v=4
126412363,simdjson,simdjson/simdjson,C++,35,Parsing gigabytes of JSON per second ,874,16127,https://avatars.githubusercontent.com/u/62337925?v=4
192025001,Qv2ray,Qv2ray/Qv2ray,C++,60,:star: Linux / Windows / macOS 跨平台 V2Ray 客户端 | 支持 VMess / VLESS / SSR / Trojan / Trojan-Go / NaiveProxy / HTTP / HTTPS / SOCKS5 | 使用 C++ / Qt 开发 | 可拓展插件式设计 :star:,3006,14200,https://avatars.githubusercontent.com/u/60087221?v=4
2200856,Marlin,MarlinFirmware/Marlin,C++,33,Marlin is an optimized firmware for RepRap 3D printers based on the Arduino platform. | Many commercial 3D printers come with Marlin installed. Check with your vendor if you need source code for your specific machine.,17270,13840,https://avatars.githubusercontent.com/u/10418365?v=4
103749180,cosmos,OpenGenus/cosmos,C++,44,"Hacktoberfest 2022 | World's largest Contributor driven code dataset | Used in Quark Search Engine, @OpenGenus IQ, OpenGenus Visual Project",3562,13203,https://avatars.githubusercontent.com/u/18506046?v=4
104231541,abseil-cpp,abseil/abseil-cpp,C++,51,Abseil Common Libraries (C++),2075,11052,https://avatars.githubusercontent.com/u/26718316?v=4
76990209,WLED,Aircoookie/WLED,C++,43,Control WS2812B and many more types of digital RGB LEDs with an ESP8266 or ESP32 over WiFi!,1936,9609,https://avatars.githubusercontent.com/u/21045690?u=b6ef8107e15c7fc6c160235afba9c3813117a768&v=4
35129809,transmission,transmission/transmission,C++,458,Official Transmission BitTorrent client repository,975,7753,https://avatars.githubusercontent.com/u/223312?v=4
1204412,TrinityCore,TrinityCore/TrinityCore,C++,20,"TrinityCore Open Source MMO Framework (master = 9.2.7.45745, 3.3.5 = 3.3.5a.12340)",5472,7567,https://avatars.githubusercontent.com/u/539602?v=4
138754790,duckdb,duckdb/duckdb,C++,103,DuckDB is an in-process SQL OLAP Database Management System,634,6761,https://avatars.githubusercontent.com/u/82039556?v=4
202078170,The-Open-Book,joeycastillo/The-Open-Book,C++,75,,199,6497,https://avatars.githubusercontent.com/u/1765152?v=4
128479644,esphome,esphome/esphome,C++,34,ESPHome is a system to control your ESP8266/ESP32 by simple yet powerful configuration files and control them remotely through Home Automation systems.,1831,5308,https://avatars.githubusercontent.com/u/45919759?v=4
244694174,connectedhomeip,project-chip/connectedhomeip,C++,254,"Matter (formerly Project CHIP) creates more connections between more objects, simplifying development for manufacturers and increasing compatibility for consumers, guided by the Connectivity Standards Alliance.",1037,4699,https://avatars.githubusercontent.com/u/61027988?v=4
384520418,MaaAssistantArknights,MaaAssistantArknights/MaaAssistantArknights,C++,177,"《明日方舟》小助手，全日常一键长草！| An Arknights assistant compatible with EN, JP, KR, ZH_TW clients",469,4174,https://avatars.githubusercontent.com/u/97677443?v=4
18719856,stellarium,Stellarium/stellarium,C++,224,"Stellarium is a free GPL software which renders realistic skies in real time with OpenGL. It is available for Linux/Unix, Windows and macOS. With Stellarium, you really see what you can see with your eyes, binoculars or a small telescope.",601,4092,https://avatars.githubusercontent.com/u/7320160?v=4
224468265,NotepadNext,dail8859/NotepadNext,C++,669,"A cross-platform, reimplementation of Notepad++",211,3493,https://avatars.githubusercontent.com/u/3694843?v=4
436366606,CodeHelp-DSA-Busted-Series,loveBabbar/CodeHelp-DSA-Busted-Series,C++,38,This repo is creating providing students easy access to all the programs taught under Codehelp's DSA Busted Series.,1050,1362,https://avatars.githubusercontent.com/u/29489915?u=fcf37f59ad74d0389bcb06a49c324a4cab771e4e&v=4
353251675,gaggiuino,Zer0-bit/gaggiuino,C++,37,A Gaggia Classic control project using microcontrollers.,73,622,https://avatars.githubusercontent.com/u/42692077?u=205ebd0fdb75e88781f3fba33d394ee088f73d5a&v=4
539599710,JuicyPotatoNG,antonioCoco/JuicyPotatoNG,C++,136,Another Windows Local Privilege Escalation from Service Account to System ,57,435,https://avatars.githubusercontent.com/u/19797064?u=4801f17015645ef9f687dafabf2aed39992e613e&v=4
488177011,nekoray,MatsuriDayo/nekoray,C++,33,基于 Qt/C++ 的跨平台代理配置管理器 Qt/C++ based cross-platform proxy configuration manager,38,405,https://avatars.githubusercontent.com/u/95122236?v=4
