id,name,full_name,language,new stars,description,forks_count,stargazers_count,avatar_url
54346799,public-apis,public-apis/public-apis,Python,314,A collective list of free APIs,19578,170043,https://avatars.githubusercontent.com/u/51121562?v=4
83222441,system-design-primer,donnemartin/system-design-primer,Python,407,Learn how to design large-scale systems. Prep for the system design interview.  Includes Anki flashcards.,28300,153222,https://avatars.githubusercontent.com/u/5458997?u=f1007b583e55e7ccfb6ccf0e200051156112dd9b&v=4
188660663,Real-Time-Voice-Cloning,CorentinJ/Real-Time-Voice-Cloning,Python,33,Clone a voice in 5 seconds to generate arbitrary speech in real-time,5786,31588,https://avatars.githubusercontent.com/u/12038136?u=e0d5f0bfc12ddca91c3b657d2f984a011554fe12&v=4
74627617,openpilot,commaai/openpilot,Python,15,openpilot is an open source driver assistance system. openpilot performs the functions of Automated Lane Centering and Adaptive Cruise Control for over 150 supported car makes and models.,5802,31406,https://avatars.githubusercontent.com/u/16128714?v=4
264818686,yolov5,ultralytics/yolov5,Python,54,YOLOv5 ğŸš€ in PyTorch > ONNX > CoreML > TFLite,6794,19425,https://avatars.githubusercontent.com/u/26833451?v=4
262296122,PaddleOCR,PaddlePaddle/PaddleOCR,Python,26,"Awesome multilingual OCR toolkits based on PaddlePaddle (practical ultra lightweight OCR system, support 80+ languages recognition, provide data annotation and synthesis tools, support training and deployment among server, mobile, embedded and IoT devices)",3609,17838,https://avatars.githubusercontent.com/u/23534030?v=4
101782647,fairseq,pytorch/fairseq,Python,19,Facebook AI Research Sequence-to-Sequence Toolkit written in Python.,3842,14765,https://avatars.githubusercontent.com/u/21003710?v=4
74762106,proxy_pool,jhao104/proxy_pool,Python,14,Pythonçˆ¬è™«ä»£ç†IPæ± (proxy pool),3767,13865,https://avatars.githubusercontent.com/u/15058920?u=a06740e9086144ed4b9624ed783677c9ecf118f3&v=4
106024057,pytorch_geometric,pyg-team/pytorch_geometric,Python,13,Graph Neural Network Library for PyTorch,2268,13260,https://avatars.githubusercontent.com/u/89995122?v=4
247266215,EasyOCR,JaidedAI/EasyOCR,Python,13,"Ready-to-use OCR with 80+ supported languages and all popular writing scripts including Latin, Chinese, Arabic, Devanagari, Cyrillic and etc.",1722,13258,https://avatars.githubusercontent.com/u/61448029?v=4
120246942,chinese-xinhua,pwxcoo/chinese-xinhua,Python,53,:orange_book: ä¸­åæ–°åå­—å…¸æ•°æ®åº“ã€‚åŒ…æ‹¬æ­‡åè¯­ï¼Œæˆè¯­ï¼Œè¯è¯­ï¼Œæ±‰å­—ã€‚,1982,8392,https://avatars.githubusercontent.com/u/21194448?u=a81f79a07ce8d7784dc8ed11e2314fb3681cbd50&v=4
196613241,binance-trade-bot,edeng23/binance-trade-bot,Python,15,Automated cryptocurrency trading bot,1538,5870,https://avatars.githubusercontent.com/u/14821747?u=817ea585f2d470ce269a93091e75236e55fb3e31&v=4
386811486,YOLOX,Megvii-BaseDetection/YOLOX,Python,10,"YOLOX is a high-performance anchor-free YOLO, exceeding yolov3~v5 with MegEngine, ONNX, TensorRT, ncnn, and OpenVINO supported. Documentation: https://yolox.readthedocs.io/",987,4961,https://avatars.githubusercontent.com/u/67775453?v=4
349321229,GFPGAN,TencentARC/GFPGAN,Python,107,GFPGAN aims at developing Practical Algorithms for Real-world Face Restoration.,637,4589,https://avatars.githubusercontent.com/u/83739826?v=4
259842566,PythonPark,Jack-Cherish/PythonPark,Python,69,Python å¼€æºé¡¹ç›®ä¹‹ã€Œè‡ªå­¦ç¼–ç¨‹ä¹‹è·¯ã€ï¼Œä¿å§†çº§æ•™ç¨‹ï¼šAIå®éªŒå®¤ã€å®è—è§†é¢‘ã€æ•°æ®ç»“æ„ã€å­¦ä¹ æŒ‡å—ã€æœºå™¨å­¦ä¹ å®æˆ˜ã€æ·±åº¦å­¦ä¹ å®æˆ˜ã€ç½‘ç»œçˆ¬è™«ã€å¤§å‚é¢ç»ã€ç¨‹åºäººç”Ÿã€èµ„æºåˆ†äº«ã€‚,722,3804,https://avatars.githubusercontent.com/u/16872370?u=ab7b3cc8c6d97e9eb02da3bb577c1305930e8ca9&v=4
1864194,frappe,frappe/frappe,Python,8,"Low code web framework for real world applications, in Python and Javascript",1877,3303,https://avatars.githubusercontent.com/u/836974?v=4
404991544,genshin_auto_fish,7eu7d7/genshin_auto_fish,Python,29,åŸºäºæ·±åº¦å¼ºåŒ–å­¦ä¹ çš„åŸç¥è‡ªåŠ¨é’“é±¼AI,447,2733,https://avatars.githubusercontent.com/u/31194890?u=ff39233339886dcb75e0b681a864866bc954e254&v=4
291213368,mmtracking,open-mmlab/mmtracking,Python,12,"OpenMMLab Video Perception Toolbox. It supports Video Object Detection (VID), Multiple Object Tracking (MOT), Single Object Tracking (SOT), Video Instance Segmentation (VIS) with a unified framework.",260,1833,https://avatars.githubusercontent.com/u/10245193?v=4
427625642,MAE-pytorch,pengzhiliang/MAE-pytorch,Python,51,Unofficial PyTorch implementation of Masked Autoencoders Are Scalable Vision Learners,174,1401,https://avatars.githubusercontent.com/u/26346329?u=e9cd44302c27d87eb818e7070a9526e7d214e4a7&v=4
400837389,pycord,Pycord-Development/pycord,Python,11,"Pycord, a maintained fork of discord.py, is a python wrapper for the Discord API",200,1059,https://avatars.githubusercontent.com/u/89700626?v=4
384885506,DouZero_For_HappyDouDiZhu,tianqiraf/DouZero_For_HappyDouDiZhu,Python,2,åŸºäºDouZeroå®šåˆ¶AIå®æˆ˜æ¬¢ä¹æ–—åœ°ä¸»,148,681,https://avatars.githubusercontent.com/u/37201145?u=20cbc2ed047ff1e965269df56945063cd0b4f24e&v=4
431546588,Mask2Former,facebookresearch/Mask2Former,Python,60,"Code release for ""Masked-attention Mask Transformer for Universal Image Segmentation""",19,390,https://avatars.githubusercontent.com/u/16943930?v=4
44510495,Timeline,jasonreisman/Timeline,Python,36,A tool for creating SVG timelines from simple JSON input.,41,333,https://avatars.githubusercontent.com/u/3207371?u=88090d4b72ff0bf70e09ca43169459f44ae5e01d&v=4
312735078,yinglish,RimoChan/yinglish,Python,41,ã€yinglishã€‘æ·«è¯­ç¿»è¯‘æœºï¼,22,287,https://avatars.githubusercontent.com/u/20064807?u=6bb9868f98835568a9e586ee2deee8c983401fa4&v=4
414959886,SAFA,Qiulin-W/SAFA,Python,10,Official Pytorch Implementation of 3DV2021 paper: SAFA: Structure Aware Face Animation.,11,93,https://avatars.githubusercontent.com/u/37483535?u=75eb9d69f7e10956b3a573bc9b6ee6e925e9ed1c&v=4
