id,name,full_name,language,new stars,description,forks_count,stargazers_count,avatar_url
8514,rails,rails/rails,Ruby,10,Ruby on Rails,21345,55021,https://avatars.githubusercontent.com/u/4223?v=4
52281283,mastodon,mastodon/mastodon,Ruby,13,"Your self-hosted, globally interconnected microblogging community",6750,46158,https://avatars.githubusercontent.com/u/24979032?v=4
8681349,huginn,huginn/huginn,Ruby,12,Create agents that monitor and act on your behalf.  Your agents are standing by!,3681,41884,https://avatars.githubusercontent.com/u/23225142?v=4
53238813,brew,Homebrew/brew,Ruby,16,🍺 The missing package manager for macOS (or Linux),9316,39727,https://avatars.githubusercontent.com/u/1503512?v=4
27442967,fastlane,fastlane/fastlane,Ruby,6,🚀 The easiest way to automate building and releasing your iOS and Android apps,5622,38721,https://avatars.githubusercontent.com/u/11098337?v=4
37382858,engineering-blogs,kilimchoi/engineering-blogs,Ruby,19,A curated list of engineering blogs,1423,29521,https://avatars.githubusercontent.com/u/1356007?u=c1ae28679aee148c3e9984e00497968cf419e284&v=4
308770,devise,heartcombo/devise,Ruby,1,Flexible authentication solution for Rails with Warden.,5532,23773,https://avatars.githubusercontent.com/u/59584037?v=4
18486300,setup,lewagon/setup,Ruby,20,Setup instructions for Le Wagon's students on their first day of Web Development Bootcamp,1604,18033,https://avatars.githubusercontent.com/u/5470001?v=4
2203645,CocoaPods,CocoaPods/CocoaPods,Ruby,1,The Cocoa Dependency Manager.,2616,14451,https://avatars.githubusercontent.com/u/1189714?v=4
88740103,postal,postalserver/postal,Ruby,6,📮 A fully featured open source mail delivery platform for incoming & outgoing e-mail,1003,14272,https://avatars.githubusercontent.com/u/58169103?v=4
812393,grape,ruby-grape/grape,Ruby,0,An opinionated framework for creating REST-like APIs in Ruby.,1214,9836,https://avatars.githubusercontent.com/u/13624553?v=4
611921,activeadmin,activeadmin/activeadmin,Ruby,0,The administration framework for Ruby on Rails applications.,3292,9454,https://avatars.githubusercontent.com/u/814570?v=4
47087,carrierwave,carrierwaveuploader/carrierwave,Ruby,0,"Classier solution for file uploads for Rails, Sinatra and other Ruby web frameworks",1651,8768,https://avatars.githubusercontent.com/u/3982589?v=4
16994115,cancancan,CanCanCommunity/cancancan,Ruby,0,The authorization Gem for Ruby on Rails.,629,5514,https://avatars.githubusercontent.com/u/6765080?v=4
661850205,docuseal,docusealco/docuseal,Ruby,12,"Open source DocuSign alternative. Create, fill, and sign digital documents ✍️",335,5355,https://avatars.githubusercontent.com/u/138379721?v=4
2889230,active_model_serializers,rails-api/active_model_serializers,Ruby,1,ActiveModel::Serializer implementation and Rails hooks,1392,5318,https://avatars.githubusercontent.com/u/2820360?v=4
447184,rspec-rails,rspec/rspec-rails,Ruby,0,RSpec for Rails 6+,1023,5122,https://avatars.githubusercontent.com/u/22388?v=4
39706711,wayback-machine-downloader,hartator/wayback-machine-downloader,Ruby,1,Download an entire website from the Wayback Machine.,665,5095,https://avatars.githubusercontent.com/u/307597?u=3469b04ac384ac6a9d02e7b7925ba70285fda723&v=4
1404127,ruby-jwt,jwt/ruby-jwt,Ruby,0,A ruby implementation of the RFC 7519 OAuth JSON Web Token (JWT) standard.,372,3559,https://avatars.githubusercontent.com/u/10998651?v=4
21333814,devise_token_auth,lynndylanhurley/devise_token_auth,Ruby,1,Token based authentication for Rails JSON APIs. Designed to work with jToker and ng-token-auth.,1135,3510,https://avatars.githubusercontent.com/u/468037?u=463dfbb32fa29779cafc2633fc3c82b1997dc0a0&v=4
590158156,ubicloud,ubicloud/ubicloud,Ruby,12,"Open, free, and portable cloud. Elastic compute, block storage (non replicated), virtual networking, managed Postgres, and IAM services in public beta.",85,3100,https://avatars.githubusercontent.com/u/121406468?v=4
8154497,ruby-advisory-db,rubysec/ruby-advisory-db,Ruby,0,A database of vulnerable Ruby Gems,216,991,https://avatars.githubusercontent.com/u/3538974?v=4
36527291,haproxy-boshrelease,cloudfoundry/haproxy-boshrelease,Ruby,0,A BOSH release for haproxy (based on cf-release's haproxy job),82,37,https://avatars.githubusercontent.com/u/621746?v=4
87049040,homebrew-brew,wix-incubator/homebrew-brew,Ruby,0,Homebrew tap for formulae for software developed by Wix,17,10,https://avatars.githubusercontent.com/u/37068588?v=4
805513377,snowy-voice-1828,turingschool-examples/snowy-voice-1828,Ruby,0,,11,0,https://avatars.githubusercontent.com/u/8518346?v=4
