id,name,full_name,language,new stars,description,forks_count,stargazers_count,avatar_url
29028775,react-native,facebook/react-native,Java,27,A framework for building native applications using React,23505,110458,https://avatars.githubusercontent.com/u/69631?v=4
1148753,spring-framework,spring-projects/spring-framework,Java,22,Spring Framework,36375,52320,https://avatars.githubusercontent.com/u/317776?v=4
892275,retrofit,square/retrofit,Java,3,A type-safe HTTP client for Android and the JVM,7294,41729,https://avatars.githubusercontent.com/u/82592?v=4
146633589,arthas,alibaba/arthas,Java,26,Alibaba Java Diagnostic Tool Arthas/Alibaba Java诊断利器Arthas,7082,32758,https://avatars.githubusercontent.com/u/1961952?v=4
1064563,netty,netty/netty,Java,9,Netty project - an event-driven asynchronous network application framework,15429,31441,https://avatars.githubusercontent.com/u/473791?v=4
120395176,easyexcel,alibaba/easyexcel,Java,26,快速、简洁、解决大文件内存溢出的java处理Excel工具,7117,28287,https://avatars.githubusercontent.com/u/1961952?v=4
7587038,canal,alibaba/canal,Java,9,阿里巴巴 MySQL binlog 增量订阅&消费组件 ,7293,25978,https://avatars.githubusercontent.com/u/1961952?v=4
45721011,skywalking,apache/skywalking,Java,9,"APM, Application Performance Monitoring System",6247,22057,https://avatars.githubusercontent.com/u/47359?v=4
20818126,ExoPlayer,google/ExoPlayer,Java,5,An extensible media player for Android,5986,20833,https://avatars.githubusercontent.com/u/1342004?v=4
13404515,HikariCP,brettwooldridge/HikariCP,Java,11,"光 HikariCP・A solid, high-performance, JDBC connection pool at last.",2775,18399,https://avatars.githubusercontent.com/u/1538661?u=283f28d238d11dbbb471c07c76a29543acbd77a1&v=4
11125589,keycloak,keycloak/keycloak,Java,18,Open Source Identity and Access Management For Modern Applications and Services,5534,16678,https://avatars.githubusercontent.com/u/4921466?v=4
5349565,presto,prestodb/presto,Java,3,The official home of the Presto distributed SQL query engine for big data,5051,14851,https://avatars.githubusercontent.com/u/6882181?v=4
75277003,thingsboard,thingsboard/thingsboard,Java,10,"Open-source IoT Platform - Device management, data collection, processing and visualization.",4407,13963,https://avatars.githubusercontent.com/u/24291394?v=4
62117812,pulsar,apache/pulsar,Java,5,Apache Pulsar - distributed pub-sub messaging system,3327,12870,https://avatars.githubusercontent.com/u/47359?v=4
19257422,questdb,questdb/questdb,Java,139,An open source time-series database for fast ingest and SQL queries,953,12212,https://avatars.githubusercontent.com/u/52297642?v=4
66023605,aws-doc-sdk-examples,awsdocs/aws-doc-sdk-examples,Java,5,"Welcome to the AWS Code Examples Repository.  This repo contains code examples used in the AWS documentation, AWS SDK Developer Guides, and more. For more information, see the Readme.md file below.",5162,7824,https://avatars.githubusercontent.com/u/8661631?v=4
49820627,react-native-svg,software-mansion/react-native-svg,Java,2,"SVG library for React Native, React Native Web, and plain React web projects.",1055,6828,https://avatars.githubusercontent.com/u/56880679?v=4
224230574,kafka-ui,provectus/kafka-ui,Java,14,Open-Source Web UI for Apache Kafka Management,778,6212,https://avatars.githubusercontent.com/u/1528944?v=4
2544305,wiremock,wiremock/wiremock,Java,3,A tool for mocking HTTP services,1338,5627,https://avatars.githubusercontent.com/u/21368587?v=4
1625986,jOOQ,jOOQ/jOOQ,Java,6,jOOQ is the best way to write SQL in Java,1160,5522,https://avatars.githubusercontent.com/u/1666512?v=4
27911088,nifi,apache/nifi,Java,4,Apache NiFi,2485,3861,https://avatars.githubusercontent.com/u/47359?v=4
605357456,PlayEdu,PlayEdu/PlayEdu,Java,11,PlayEdu 是一款适用于搭建内部培训平台的开源系统，旨在为企业/机构打造自己品牌的内部培训平台。,146,1012,https://avatars.githubusercontent.com/u/123158174?v=4
502971260,openjob,open-job/openjob,Java,9,Distributed high performance task scheduling framework,47,415,https://avatars.githubusercontent.com/u/97515909?v=4
278213783,capacitor-plugins,ionic-team/capacitor-plugins,Java,1,Official plugins for Capacitor ⚡️,405,376,https://avatars.githubusercontent.com/u/3171503?v=4
649877339,Java,sksalahuddin2828/Java,Java,5,Explore something new,35,42,https://avatars.githubusercontent.com/u/127140921?u=745d5e1c661fb2312ea830b08eb5ccb109f6d8d8&v=4
