id,name,full_name,language,new stars,description,forks_count,stargazers_count,avatar_url
15634981,godot,godotengine/godot,C++,487,Godot Engine â€“ Multi-platform 2D and 3D game engine,7530,41646,https://avatars.githubusercontent.com/u/6318500?v=4
22067521,imgui,ocornut/imgui,C++,384,Dear ImGui: Bloat-free Graphical User interface for C++ with minimal dependencies,5318,31541,https://avatars.githubusercontent.com/u/8225057?u=01bf929efb697d8ff49effc3b08ea180b54f5564&v=4
74627617,openpilot,commaai/openpilot,C++,898,openpilot is an open source driver assistance system. openpilot performs the functions of Automated Lane Centering and Adaptive Cruise Control for over 100 supported car makes and models.,5456,29546,https://avatars.githubusercontent.com/u/16128714?v=4
1116542,aria2,aria2/aria2,C++,310,"aria2 is a lightweight multi-protocol & multi-source, cross platform download utility operated in command-line. It supports HTTP/HTTPS, FTP, SFTP, BitTorrent and Metalink.",2782,23984,https://avatars.githubusercontent.com/u/13545224?v=4
4524181,folly,facebook/folly,C++,420,An open-source C++ library developed and used at Facebook.,4239,19536,https://avatars.githubusercontent.com/u/69631?v=4
60246359,ClickHouse,ClickHouse/ClickHouse,C++,339,ClickHouseÂ® is a free analytics DBMS for big data,3669,18839,https://avatars.githubusercontent.com/u/54801242?v=4
31522041,vnpy,vnpy/vnpy,C++,56,åŸºäºPythonçš„å¼€æºé‡åŒ–äº¤æ˜“å¹³å°å¼€å‘æ¡†æ¶,6547,15800,https://avatars.githubusercontent.com/u/11263900?u=7c76ce5e04cb90f40d1001834a171e5a0b6ada11&v=4
160083795,serenity,SerenityOS/serenity,C++,347,The Serenity Operating System ğŸ,1540,15188,https://avatars.githubusercontent.com/u/50811782?v=4
63477612,C-Plus-Plus,TheAlgorithms/C-Plus-Plus,C++,103,"Collection of various algorithms in mathematics, machine learning, computer science and physics implemented in C++ for educational purposes.",3951,13882,https://avatars.githubusercontent.com/u/20487725?v=4
126412363,simdjson,simdjson/simdjson,C++,73,Parsing gigabytes of JSON per second ,713,13724,https://avatars.githubusercontent.com/u/62337925?v=4
14981376,dogecoin,dogecoin/dogecoin,C++,231,very currency,2270,12816,https://avatars.githubusercontent.com/u/6122353?v=4
40892817,solidity,ethereum/solidity,C++,81,"Solidity, the Smart Contract Programming Language",3002,11684,https://avatars.githubusercontent.com/u/6250754?v=4
9746477,sonic-pi,sonic-pi-net/sonic-pi,C++,331,Code. Music. Live.,775,8427,https://avatars.githubusercontent.com/u/67760337?v=4
243487250,chineseocr_lite,DayBreak-u/chineseocr_lite,C++,97,"è¶…è½»é‡çº§ä¸­æ–‡ocrï¼Œæ”¯æŒç«–æ’æ–‡å­—è¯†åˆ«, æ”¯æŒncnnã€mnnã€tnnæ¨ç† ( dbnet(1.8M) + crnn(2.5M) + anglenet(378KB)) æ€»æ¨¡å‹ä»…4.7M ",1520,7202,https://avatars.githubusercontent.com/u/42023607?u=0aca31a8f19272c25b300963e583877599105b86&v=4
28449431,scylla,scylladb/scylla,C++,58,"NoSQL data store using the seastar framework, compatible with Apache Cassandra",831,7104,https://avatars.githubusercontent.com/u/14364730?v=4
88327406,xmrig,xmrig/xmrig,C++,99,"RandomX, CryptoNight, AstroBWT and Argon2 CPU/GPU miner",2528,5450,https://avatars.githubusercontent.com/u/27528955?u=555699fb82e7598ed7dd1f6e47302042b48a10c3&v=4
75413130,Open3D,isl-org/Open3D,C++,377,Open3D: A Modern Library for 3D Data Processing,1340,5347,https://avatars.githubusercontent.com/u/23507030?v=4
193305104,QtScrcpy,barry-ran/QtScrcpy,C++,139,Android real-time display control software,938,5300,https://avatars.githubusercontent.com/u/18702692?u=f25ec5f42e12c0a02e518f4d11fe01bc9c3cb1a2&v=4
283410102,workflow,sogou/workflow,C++,99,C++ Parallel Computing and Asynchronous Networking Engine,992,5300,https://avatars.githubusercontent.com/u/15903299?v=4
6083843,ThreadPool,progschj/ThreadPool,C++,52,A simple C++11 Thread Pool implementation,1542,4627,https://avatars.githubusercontent.com/u/1257680?v=4
178613040,magic_enum,Neargye/magic_enum,C++,31,"Static reflection for enums (to string, from string, iteration) for modern C++, work with any enum type without any macro or boilerplate code",176,2095,https://avatars.githubusercontent.com/u/7997966?u=cc5d3a577c3b615ae5bad0c0c293363acf00acfe&v=4
23038334,crawl,crawl/crawl,C++,12,Dungeon Crawl: Stone Soup official repository,697,1540,https://avatars.githubusercontent.com/u/8470194?v=4
313501668,wenet,wenet-e2e/wenet,C++,38,Production First and Production Ready End-to-End Speech Recognition Toolkit,264,1132,https://avatars.githubusercontent.com/u/84374044?v=4
170738310,wallet-core,trustwallet/wallet-core,C++,18,"Cross-platform, cross-blockchain wallet library.",707,939,https://avatars.githubusercontent.com/u/32179889?v=4
357538373,detours_r5,Mauler125/detours_r5,C++,26,,35,114,https://avatars.githubusercontent.com/u/48657826?u=d0493200842d53ac4f4aea8981faee92a1a4248b&v=4
