id,name,full_name,language,new stars,description,forks_count,stargazers_count,avatar_url
49609581,PowerShell,PowerShell/PowerShell,C#,74,PowerShell for every system!,7001,43110,https://avatars.githubusercontent.com/u/11524380?v=4
262395224,maui,dotnet/maui,C#,41,".NET MAUI is the .NET Multi-platform App UI, a framework for building native device applications spanning mobile, tablet, and desktop.",1550,21394,https://avatars.githubusercontent.com/u/9141961?v=4
607289185,semantic-kernel,microsoft/semantic-kernel,C#,149,Integrate cutting-edge LLM technology quickly and easily into your apps,2577,17728,https://avatars.githubusercontent.com/u/6154722?v=4
30474266,MaterialDesignInXamlToolkit,MaterialDesignInXAML/MaterialDesignInXamlToolkit,C#,32,"Google's Material Design in XAML & WPF, for C# & VB.Net. ",3356,14543,https://avatars.githubusercontent.com/u/16655083?v=4
103370157,optimizer,hellzerg/optimizer,C#,132,The finest Windows Optimizer,821,11769,https://avatars.githubusercontent.com/u/3146835?u=012a457ae34fc7f8a0e55e66f7e3f1702a6e7a47&v=4
681372871,garnet,microsoft/garnet,C#,1145,"Garnet is a remote cache-store from Microsoft Research that offers strong performance (throughput and latency), scalability, storage, recovery, cluster sharding, key migration, and replication features. Garnet can work with existing Redis clients.",339,8215,https://avatars.githubusercontent.com/u/6154722?v=4
245235133,reverse-proxy,microsoft/reverse-proxy,C#,187,A toolkit for developing high-performance HTTP reverse proxy applications.,780,7948,https://avatars.githubusercontent.com/u/6154722?v=4
187499284,UniTask,Cysharp/UniTask,C#,44,Provides an efficient allocation free async/await integration for Unity.,736,7173,https://avatars.githubusercontent.com/u/44487420?v=4
26884725,OrchardCore,OrchardCMS/OrchardCore,C#,9,"Orchard Core is an open-source modular and multi-tenant application framework built with ASP.NET Core, and a content management system (CMS) built on top of that framework.",2298,7068,https://avatars.githubusercontent.com/u/1159247?v=4
389218073,wpfui,lepoco/wpfui,C#,61,"WPF UI provides the Fluent experience in your known and loved WPF framework. Intuitive design, themes, navigation and new immersive controls. All natively and effortlessly.",595,6365,https://avatars.githubusercontent.com/u/87412094?v=4
100711978,btcpayserver,btcpayserver/btcpayserver,C#,145,"Accept Bitcoin payments. Free, open-source & self-hosted, Bitcoin payment processor. ",1531,5972,https://avatars.githubusercontent.com/u/31132886?v=4
151148482,elsa-core,elsa-workflows/elsa-core,C#,59,A .NET workflows library,1036,5728,https://avatars.githubusercontent.com/u/51759159?v=4
158405551,git-credential-manager,git-ecosystem/git-credential-manager,C#,33,"Secure, cross-platform Git credential storage with authentication to GitHub, Azure Repos, and other popular Git hosting services.",1515,5598,https://avatars.githubusercontent.com/u/64464614?v=4
116210568,ScottPlot,ScottPlot/ScottPlot,C#,47,Interactive plotting library for .NET,746,4503,https://avatars.githubusercontent.com/u/76536295?v=4
600246354,g-helper,seerge/g-helper,C#,96,"Lightweight Armoury Crate alternative for Asus laptops and ROG Ally. Control tool for ROG Zephyrus G14, G15, G16, M16, Flow X13, Flow X16, TUF, Strix, Scar and other models",183,4363,https://avatars.githubusercontent.com/u/5920850?u=80e9cb264b3e5070554c2ddc3ece67df71804927&v=4
706944893,eShop,dotnet/eShop,C#,118,A reference .NET application implementing an eCommerce site,922,3642,https://avatars.githubusercontent.com/u/9141961?v=4
482734649,Snap.Hutao,DGP-Studio/Snap.Hutao,C#,188,实用的开源多功能原神工具箱 🧰 / Multifunctional Open-source Genshin Impact Toolkit 🧰,162,3302,https://avatars.githubusercontent.com/u/49308723?v=4
597222638,devhome,microsoft/devhome,C#,34,The new Dev Home experience for Windows!,247,3236,https://avatars.githubusercontent.com/u/6154722?v=4
247198136,1Remote,1Remote/1Remote,C#,91,One Remote Access Manager to Rule Them All,294,2941,https://avatars.githubusercontent.com/u/105551232?v=4
181356258,run-aspnetcore-microservices,aspnetrun/run-aspnetcore-microservices,C#,15,"Microservices on .Net platforms which used ASP.NET Web API, Docker, RabbitMQ, MassTransit, Grpc, Yarp API Gateway, PostgreSQL, Redis, SQLite, SqlServer, Marten, Entity Framework Core, CQRS, MediatR, DDD, Vertical and Clean Architecture implementation with using latest features of .NET 8 and C# 12",1298,2367,https://avatars.githubusercontent.com/u/48249907?v=4
639772835,StableSwarmUI,Stability-AI/StableSwarmUI,C#,149,"StableSwarmUI, A Modular Stable Diffusion Web-User-Interface, with an emphasis on making powertools easily accessible, high performance, and extensibility.",193,2359,https://avatars.githubusercontent.com/u/100950301?v=4
464713272,YooAsset,tuyoogame/YooAsset,C#,18,unity3d resources management  system,419,2037,https://avatars.githubusercontent.com/u/98369769?v=4
52967821,SMAPI,Pathoschild/SMAPI,C#,43,The modding API for Stardew Valley.,249,1505,https://avatars.githubusercontent.com/u/230581?u=e668de27b9e0cd2d92b0ea16c4729bc73ce5ad6f&v=4
739471388,megacity-metro,Unity-Technologies/megacity-metro,C#,114,"Megacity-Metro: a thrilling shooter game, using Netcode for Entities for a multiplayer experience supporting 128+ players. Latest DOTS packages and Unity Gaming Services elevate the user experience, demonstrating how to craft engaging multiplayer games.",81,398,https://avatars.githubusercontent.com/u/426196?v=4
425837195,sourcegit,sourcegit-scm/sourcegit,C#,101,Windows/macOS/Linux GUI client for GIT users,31,298,https://avatars.githubusercontent.com/u/85621660?v=4
