id,name,full_name,language,new stars,description,forks_count,stargazers_count,avatar_url
2126244,bootstrap,twbs/bootstrap,JavaScript,32,"The most popular HTML, CSS, and JavaScript framework for developing responsive, mobile first projects on the web.",78305,166958,https://avatars.githubusercontent.com/u/2918581?v=4
70107786,next.js,vercel/next.js,JavaScript,61,The React Framework,25364,118709,https://avatars.githubusercontent.com/u/14985020?v=4
23088740,axios,axios/axios,JavaScript,27,Promise based HTTP client for the browser and node.js,10708,103523,https://avatars.githubusercontent.com/u/32372333?v=4
576201,three.js,mrdoob/three.js,JavaScript,56,JavaScript 3D Library.,34954,97765,https://avatars.githubusercontent.com/u/97088?u=95046da3776175b5f3d1ad2137704cd123e04d9e&v=4
74791366,clean-code-javascript,ryanmcdermott/clean-code-javascript,JavaScript,43,:bathtub: Clean Code concepts adapted for JavaScript,11888,88605,https://avatars.githubusercontent.com/u/5114666?u=f50567b5fcc139f59e60505dd847463c91350a34&v=4
31629751,cypress,cypress-io/cypress,JavaScript,6,"Fast, easy and reliable testing for anything that runs in a browser.",3056,45867,https://avatars.githubusercontent.com/u/8908513?v=4
140687430,uni-app,dcloudio/uni-app,JavaScript,9,A cross-platform framework using Vue.js,3545,39152,https://avatars.githubusercontent.com/u/5485517?v=4
135614069,reactjs-interview-questions,sudheerj/reactjs-interview-questions,JavaScript,42,List of top 500 ReactJS Interview Questions & Answers....Coding exercise questions are coming soon!!,8569,35721,https://avatars.githubusercontent.com/u/3127317?u=0ae9c57bd70b06b2e2293323841ebf59cf3dca90&v=4
166535974,Daily-Interview-Question,Advanced-Frontend/Daily-Interview-Question,JavaScript,7,我是依扬（木易杨），公众号「高级前端进阶」作者，每天搞定一道前端大厂面试题，祝大家天天进步，一年后会看到不一样的自己。,3299,27207,https://avatars.githubusercontent.com/u/18049346?v=4
64700934,openzeppelin-contracts,OpenZeppelin/openzeppelin-contracts,JavaScript,4,OpenZeppelin Contracts is a library for secure smart contract development.,11508,23715,https://avatars.githubusercontent.com/u/20820676?v=4
245049028,koodo-reader,koodo-reader/koodo-reader,JavaScript,55,"A modern ebook manager and reader with sync and backup capacities for Windows, macOS, Linux and Web",1144,14832,https://avatars.githubusercontent.com/u/149913075?v=4
542284380,bruno,usebruno/bruno,JavaScript,45,Opensource IDE For Exploring and Testing Api's (lightweight alternative to postman/insomnia),542,12514,https://avatars.githubusercontent.com/u/114530840?v=4
235468657,pipedream,PipedreamHQ/pipedream,JavaScript,10,"Connect APIs, remarkably fast.  Free for developers.",5256,8063,https://avatars.githubusercontent.com/u/43791938?v=4
28964450,ckeditor5,ckeditor/ckeditor5,JavaScript,7,"Powerful rich text editor framework with a modular architecture, modern integrations, and features like collaborative editing.",3541,7991,https://avatars.githubusercontent.com/u/825710?v=4
84835535,carbon,carbon-design-system/carbon,JavaScript,3,A design system built by IBM,1721,7384,https://avatars.githubusercontent.com/u/25179978?v=4
162200234,opencti,OpenCTI-Platform/opencti,JavaScript,12,Open Cyber Threat Intelligence Platform,737,4411,https://avatars.githubusercontent.com/u/51881218?v=4
698944,rack-cors,cyu/rack-cors,JavaScript,0,"Rack Middleware for handling Cross-Origin Resource Sharing (CORS), which makes cross-origin AJAX possible.",254,3238,https://avatars.githubusercontent.com/u/2431?v=4
746606940,Mario-Kart-3.js,Lunakepio/Mario-Kart-3.js,JavaScript,226,,679,2864,https://avatars.githubusercontent.com/u/42719638?u=1ea23543674a411417d4339ae0b3dd95b0afe8ad&v=4
563632060,vue-office,501351981/vue-office,JavaScript,8,"支持word(.docx)、excel(.xlsx)、pdf等各类型office文件预览的vue组件集合，提供一站式office文件预览方案，支持vue2和3，也支持React等非Vue框架。Web-based pdf, excel, word preview library",351,2798,https://avatars.githubusercontent.com/u/14229082?u=940b47cf5083b6279b54052c6eceacdf8d897e3f&v=4
691567688,react-complete-guide-course-resources,academind/react-complete-guide-course-resources,JavaScript,12,"React - The Complete Guide Course Resources (Code, Attachments, Slides)",713,923,https://avatars.githubusercontent.com/u/28806202?v=4
696550253,GaussianSplats3D,mkkellogg/GaussianSplats3D,JavaScript,2,Three.js-based implementation of 3D Gaussian splatting,80,758,https://avatars.githubusercontent.com/u/6249005?v=4
585712715,Interstellar,InterstellarNetwork/Interstellar,JavaScript,8,One of the most popular modern web proxies with blazing fast speeds and a variety of games.,6120,501,https://avatars.githubusercontent.com/u/103917385?v=4
762719221,polyfill-library,polyfillpolyfill/polyfill-library,JavaScript,28,NodeJS module to create polyfill bundles tailored to individual user-agents.,26,142,https://avatars.githubusercontent.com/u/160504350?v=4
762710560,fetch,polyfillpolyfill/fetch,JavaScript,24,A window.fetch JavaScript polyfill.,25,129,https://avatars.githubusercontent.com/u/160504350?v=4
764013245,emote-portrait-alive,HumanAIGC/emote-portrait-alive,JavaScript,17,,4,53,https://avatars.githubusercontent.com/u/151895533?v=4
