id,name,full_name,language,new stars,description,forks_count,stargazers_count,avatar_url
111583593,scrcpy,Genymobile/scrcpy,C,939,Display and control your Android device,10807,113454,https://avatars.githubusercontent.com/u/3427627?v=4
13233158,obs-studio,obsproject/obs-studio,C,150,OBS Studio - Free and open source software for live streaming and screen recording,8020,60637,https://avatars.githubusercontent.com/u/7725691?v=4
1903522,php-src,php/php-src,C,53,The PHP Interpreter,7763,38324,https://avatars.githubusercontent.com/u/25158?v=4
7634677,openssl,openssl/openssl,C,68,TLS/SSL and crypto library,10167,26037,https://avatars.githubusercontent.com/u/3279138?v=4
29759715,zstd,facebook/zstd,C,59,Zstandard - Fast real-time compression algorithm,2114,23858,https://avatars.githubusercontent.com/u/69631?v=4
13836499,raylib,raysan5/raylib,C,157,A simple and easy-to-use library to enjoy videogames programming,2300,23043,https://avatars.githubusercontent.com/u/5766837?u=28d52cd1077b2f8b48d3897e82f03280a565e8d6&v=4
45821540,openwrt,openwrt/openwrt,C,121,This repository is a mirror of https://git.openwrt.org/openwrt/openwrt.git It is for reference only and is not active for check-ins.  We will continue to accept Pull Requests here. They will be merged via staging trees then into openwrt.git.,10566,20566,https://avatars.githubusercontent.com/u/2528830?v=4
775743011,valkey,valkey-io/valkey,C,294,A flexible distributed key-value datastore that is optimized for caching and other realtime workloads.,668,17681,https://avatars.githubusercontent.com/u/164458127?v=4
284134871,flipperzero-firmware,flipperdevices/flipperzero-firmware,C,63,Flipper Zero firmware source code,2748,13014,https://avatars.githubusercontent.com/u/57576566?v=4
59771425,zephyr,zephyrproject-rtos/zephyr,C,54,"Primary Git Repository for the Zephyr Project. Zephyr is a new generation, scalable, optimized, secure RTOS for multiple hardware architectures.",6686,10983,https://avatars.githubusercontent.com/u/19595895?v=4
88327406,xmrig,xmrig/xmrig,C,61,"RandomX, KawPow, CryptoNight and GhostRider unified CPU/GPU miner and RandomX benchmark",3472,8828,https://avatars.githubusercontent.com/u/27528955?u=555699fb82e7598ed7dd1f6e47302042b48a10c3&v=4
29933948,fluent-bit,fluent/fluent-bit,C,23,"Fast and Lightweight Logs and Metrics processor for Linux, BSD, OSX and Windows",1591,5899,https://avatars.githubusercontent.com/u/859518?v=4
2359378,zlib,madler/zlib,C,27,A massively spiffy yet delicately unobtrusive compression library.,2477,5790,https://avatars.githubusercontent.com/u/240717?v=4
83160811,littlefs,littlefs-project/littlefs,C,29,A little fail-safe filesystem designed for microcontrollers,804,5249,https://avatars.githubusercontent.com/u/60944974?v=4
45703884,u8g2,olikraus/u8g2,C,24,"U8glib library for monochrome displays, version 2 ",1057,5200,https://avatars.githubusercontent.com/u/1084992?v=4
331380723,pico-sdk,raspberrypi/pico-sdk,C,24,,953,3798,https://avatars.githubusercontent.com/u/1294177?v=4
198869255,AFL,google/AFL,C,40,american fuzzy lop - a security-oriented fuzzer,644,3738,https://avatars.githubusercontent.com/u/1342004?v=4
32148604,inav,iNavFlight/inav,C,17,INAV: Navigation-enabled flight control software,1495,3219,https://avatars.githubusercontent.com/u/15979895?v=4
793985221,kyanos,hengyoush/kyanos,C,1188,"Visualize the time packets spend in the kernel, watch & analyze in command line. ",54,2289,https://avatars.githubusercontent.com/u/32724602?u=8f7887217451a515a946ca9f13c2879f11355513&v=4
616222670,NerdMiner_v2,BitMaker-hub/NerdMiner_v2,C,20,Improved version of first ESP32 NerdMiner,308,1647,https://avatars.githubusercontent.com/u/105243563?u=e4a7a4b8e143fe25d2da1f8355c9207bab931d4f&v=4
795166961,Bruce,pr3y/Bruce,C,63,Predatory ESP32 Firmware,121,1008,https://avatars.githubusercontent.com/u/67231282?v=4
644742603,cloudberry,apache/cloudberry,C,202,One advanced and mature open-source MPP (Massively Parallel Processing) database. Open source alternative to Greenplum Database.,112,648,https://avatars.githubusercontent.com/u/47359?v=4
