id,name,full_name,language,new stars,description,forks_count,stargazers_count,avatar_url
70107786,next.js,vercel/next.js,JavaScript,270,The React Framework,27045,127526,https://avatars.githubusercontent.com/u/14985020?v=4
576201,three.js,mrdoob/three.js,JavaScript,156,JavaScript 3D Library.,35410,103074,https://avatars.githubusercontent.com/u/97088?u=95046da3776175b5f3d1ad2137704cd123e04d9e&v=4
3470471,Font-Awesome,FortAwesome/Font-Awesome,JavaScript,115,"The iconic SVG, font, and CSS toolkit",12207,74372,https://avatars.githubusercontent.com/u/1505683?v=4
92443980,drawio-desktop,jgraph/drawio-desktop,JavaScript,173,Official electron build of draw.io,5044,51106,https://avatars.githubusercontent.com/u/1769238?v=4
31629751,cypress,cypress-io/cypress,JavaScript,440,"Fast, easy and reliable testing for anything that runs in a browser.",3203,47533,https://avatars.githubusercontent.com/u/8908513?v=4
599320067,langflow,langflow-ai/langflow,JavaScript,1260,"Langflow is a low-code app builder for RAG and multi-agent AI applications. It’s Python-based and agnostic to any model, API, or database.",4318,36890,https://avatars.githubusercontent.com/u/85702467?v=4
44150497,remote-jobs,remoteintech/remote-jobs,JavaScript,103,A list of semi to fully remote-friendly companies (jobs) in tech.,3172,30141,https://avatars.githubusercontent.com/u/31714327?v=4
542284380,bruno,usebruno/bruno,JavaScript,295,Opensource IDE For Exploring and Testing Api's (lightweight alternative to postman/insomnia),1302,28068,https://avatars.githubusercontent.com/u/114530840?v=4
6720403,simple-icons,simple-icons/simple-icons,JavaScript,100,SVG icons for popular brands,2677,21231,https://avatars.githubusercontent.com/u/29872746?v=4
245049028,koodo-reader,koodo-reader/koodo-reader,JavaScript,300,"A modern ebook manager and reader with sync and backup capacities for Windows, macOS, Linux and Web",1507,19575,https://avatars.githubusercontent.com/u/149913075?v=4
128636610,zigbee2mqtt,Koenkk/zigbee2mqtt,JavaScript,145,"Zigbee 🐝 to MQTT bridge 🌉, get rid of your proprietary Zigbee bridges 🔨",1691,12351,https://avatars.githubusercontent.com/u/2892853?u=bba54d718dc6d81a73d463bb3f35e403c719b06f&v=4
320850140,edgetunnel,zizifn/edgetunnel,JavaScript,123,Running V2ray inside edge/serverless runtime,26745,7316,https://avatars.githubusercontent.com/u/1803942?v=4
696990839,Sigma-Web-Dev-Course,CodeWithHarry/Sigma-Web-Dev-Course,JavaScript,85,Source Code for Sigma Web Development Course,1972,6407,https://avatars.githubusercontent.com/u/48705673?u=472aded90489332ecedb819278fc2cfbe485e4da&v=4
133092972,undici,nodejs/undici,JavaScript,72,"An HTTP/1.1 client, written from scratch for Node.js",555,6330,https://avatars.githubusercontent.com/u/9950313?v=4
321785127,mediacms,mediacms-io/mediacms,JavaScript,70,"MediaCMS is a modern, fully featured open source video and media CMS, written in Python/Django and React, featuring a REST API.",544,2954,https://avatars.githubusercontent.com/u/54712209?v=4
685484384,materialYouNewTab,XengShi/materialYouNewTab,JavaScript,89,A Simple New Tab ( browsers's home page ) inspired with Google's 'Material You' design ,164,1525,https://avatars.githubusercontent.com/u/48722764?u=4b3706597aed9231511b0b8da8a15409fca13afb&v=4
