id,name,full_name,language,new stars,description,forks_count,stargazers_count,avatar_url
52855516,homebrew-core,Homebrew/homebrew-core,Ruby,31,🍻 Default formulae for the missing package manager for macOS (or Linux),12480,13818,https://avatars.githubusercontent.com/u/1503512?v=4
1725199,linguist,github-linguist/linguist,Ruby,16,"Language Savant. If your repository's language is being reported incorrectly, send us a pull request!",4292,12369,https://avatars.githubusercontent.com/u/20014732?v=4
6899875,openproject,opf/openproject,Ruby,34,OpenProject is the leading open source project management software.,2379,9523,https://avatars.githubusercontent.com/u/1756674?v=4
2889230,active_model_serializers,rails-api/active_model_serializers,Ruby,3,ActiveModel::Serializer implementation and Rails hooks,1391,5331,https://avatars.githubusercontent.com/u/2820360?v=4
30985840,solidus,solidusio/solidus,Ruby,11,"🛒 Solidus, the open-source eCommerce framework for industry trailblazers.",1298,5046,https://avatars.githubusercontent.com/u/11045486?v=4
66497320,dd-trace-rb,DataDog/dd-trace-rb,Ruby,0,Datadog Tracing Ruby Client,375,310,https://avatars.githubusercontent.com/u/365230?v=4
