id,name,full_name,language,new stars,description,forks_count,stargazers_count,avatar_url
9384267,electron,electron/electron,C++,25,":electron: Build cross-platform desktop apps with JavaScript, HTML, and CSS",14663,110769,https://avatars.githubusercontent.com/u/13409222?v=4
5108051,opencv,opencv/opencv,C++,52,Open Source Computer Vision Library,55541,74371,https://avatars.githubusercontent.com/u/5009934?v=4
1181927,bitcoin,bitcoin/bitcoin,C++,54,Bitcoin Core integration/staging tree,34728,74335,https://avatars.githubusercontent.com/u/528860?v=4
23357588,protobuf,protocolbuffers/protobuf,C++,19,Protocol Buffers - Google's data interchange format,15184,63046,https://avatars.githubusercontent.com/u/26310541?v=4
612354784,llama.cpp,ggerganov/llama.cpp,C++,144,LLM inference in C/C++,7307,52062,https://avatars.githubusercontent.com/u/1991296?u=28314d364d7c28f8ec232fadb767970d3ad74e7b&v=4
27729880,grpc,grpc/grpc,C++,12,"The C based gRPC (C++, Python, Ruby, Objective-C, PHP, C#)",10284,40307,https://avatars.githubusercontent.com/u/7802525?v=4
11171548,json,nlohmann/json,C++,30,JSON for Modern C++,6361,39298,https://avatars.githubusercontent.com/u/159488?u=7d63c3efe48fc8c84dd1219413787f2acc8aab63&v=4
116167731,yuzu,yuzu-emu/yuzu,C++,2559,Nintendo Switch emulator,3871,38157,https://avatars.githubusercontent.com/u/35075882?v=4
60246359,ClickHouse,ClickHouse/ClickHouse,C++,28,ClickHouse® is a free analytics DBMS for big data,6338,33305,https://avatars.githubusercontent.com/u/54801242?v=4
81227005,faiss,facebookresearch/faiss,C++,27,A library for efficient similarity search and clustering of dense vectors.,3309,27102,https://avatars.githubusercontent.com/u/16943930?v=4
19953044,flatbuffers,google/flatbuffers,C++,10,FlatBuffers: Memory Efficient Serialization Library,3136,21820,https://avatars.githubusercontent.com/u/1342004?v=4
1062572,Catch2,catchorg/Catch2,C++,7,"A modern, C++-native, test framework for unit-tests, TDD and BDD - using C++14, C++17 and later (C++11 support is in v2.x branch, and C++03 on the Catch1.x branch)",2968,17798,https://avatars.githubusercontent.com/u/33321405?v=4
14981376,dogecoin,dogecoin/dogecoin,C++,3,very currency,2734,14278,https://avatars.githubusercontent.com/u/6122353?v=4
8162615,pcl,PointCloudLibrary/pcl,C++,6,Point Cloud Library (PCL),4555,9284,https://avatars.githubusercontent.com/u/2059451?v=4
626896474,SafeLine,chaitin/SafeLine,C++,26,一款足够简单、足够好用、足够强的免费 WAF。基于业界领先的语义引擎检测技术，作为反向代理接入，保护你的网站不受黑客攻击。,486,8124,https://avatars.githubusercontent.com/u/7302766?v=4
5298790,PX4-Autopilot,PX4/PX4-Autopilot,C++,3,PX4 Autopilot Software,13014,7391,https://avatars.githubusercontent.com/u/2096014?v=4
31197250,glog,google/glog,C++,1,C++ implementation of the Google logging module,2021,6729,https://avatars.githubusercontent.com/u/1342004?v=4
325036684,pineapple-src,pineappleEA/pineapple-src,C++,97,yuzu Early Access source code,304,4068,https://avatars.githubusercontent.com/u/67879877?u=7376b3a05a54da81e1a1319651192349051020ff&v=4
196111891,yuzu-mainline,yuzu-emu/yuzu-mainline,C++,132,,393,2723,https://avatars.githubusercontent.com/u/35075882?v=4
205404938,fheroes2,ihhub/fheroes2,C++,14,fheroes2 is a recreation of Heroes of Might and Magic II game engine.,343,2470,https://avatars.githubusercontent.com/u/19829520?v=4
208145128,iree,openxla/iree,C++,4,A retargetable MLIR-based machine learning compiler and runtime toolkit.,506,2282,https://avatars.githubusercontent.com/u/107584881?v=4
648517310,yuzu-android,yuzu-emu/yuzu-android,C++,252,,201,2063,https://avatars.githubusercontent.com/u/35075882?v=4
340219494,libjxl,libjxl/libjxl,C++,15,JPEG XL image format reference implementation,197,1520,https://avatars.githubusercontent.com/u/77789960?v=4
68405620,vsomeip,COVESA/vsomeip,C++,1,An implementation of Scalable service-Oriented MiddlewarE over IP,621,958,https://avatars.githubusercontent.com/u/90009755?v=4
429651616,autoware.universe,autowarefoundation/autoware.universe,C++,2,,470,742,https://avatars.githubusercontent.com/u/48420599?v=4
