id,name,full_name,language,new stars,description,forks_count,stargazers_count,avatar_url
184456251,PowerToys,microsoft/PowerToys,C#,489,Windows system utilities to maximize productivity,3866,68719,https://avatars.githubusercontent.com/u/6154722?v=4
17620347,aspnetcore,dotnet/aspnetcore,C#,87,"ASP.NET Core is a cross-platform .NET framework for building modern cloud-based web applications on Windows, Mac, or Linux.",7417,27258,https://avatars.githubusercontent.com/u/9141961?v=4
161012019,jellyfin,jellyfin/jellyfin,C#,87,The Free Software Media System,1382,13391,https://avatars.githubusercontent.com/u/45698031?v=4
198071756,RevokeMsgPatcher,huiyadanli/RevokeMsgPatcher,C#,202,:trollface: A hex editor for WeChat/QQ/TIM - PC版微信/QQ/TIM防撤回补丁（我已经看到了，撤回也没用了）,1864,13345,https://avatars.githubusercontent.com/u/15783049?u=86f380636f7c09b86788a977ea96272cb7484a30&v=4
14964475,Avalonia,AvaloniaUI/Avalonia,C#,86,A cross platform UI framework for .NET,1169,13014,https://avatars.githubusercontent.com/u/14075148?v=4
120231691,Ryujinx,Ryujinx/Ryujinx,C#,93,Experimental Nintendo Switch Emulator written in C#,1369,11280,https://avatars.githubusercontent.com/u/39036280?v=4
69673033,CleanArchitecture,ardalis/CleanArchitecture,C#,77,Clean Architecture Solution Template: A starting point for Clean Architecture with ASP.NET Core,1740,9493,https://avatars.githubusercontent.com/u/782127?u=75698de8f7b1cc3fda730cd742d8d8d59bd7a15c&v=4
75990888,csharplang,dotnet/csharplang,C#,43,The official repo for the design of the C# programming language,878,8401,https://avatars.githubusercontent.com/u/9141961?v=4
210716005,runtime,dotnet/runtime,C#,90,".NET is a cross-platform runtime for cloud, mobile, desktop, and IoT apps.",2772,8179,https://avatars.githubusercontent.com/u/9141961?v=4
213460285,CleanArchitecture,jasontaylordev/CleanArchitecture,C#,77,Clean Architecture Solution Template for .NET 6,1778,7741,https://avatars.githubusercontent.com/u/1988321?u=f96f36eed8f5bc57c4aab7213306f960efc072b1&v=4
165548191,PEASS-ng,carlospolop/PEASS-ng,C#,82,PEASS - Privilege Escalation Awesome Scripts SUITE (with colors),1924,7728,https://avatars.githubusercontent.com/u/17181413?u=7bab6cb28b2c583ee1f5f6ce8b3e0195601b6dde&v=4
72174164,ImageSharp,SixLabors/ImageSharp,C#,61,":camera: A modern, cross-platform, 2D Graphics library for .NET",687,5378,https://avatars.githubusercontent.com/u/25224152?v=4
334515155,basic-computer-games,coding-horror/basic-computer-games,C#,384,"An updated version of the classic ""Basic Computer Games"" book, with well-written examples in a variety of common programming languages",642,4782,https://avatars.githubusercontent.com/u/1522517?v=4
97034042,DiscordChatExporter,Tyrrrz/DiscordChatExporter,C#,33,Exports Discord chat logs to a file,372,3414,https://avatars.githubusercontent.com/u/1935960?u=a540f871d0efbeeb3416b4eec9a14956704a9045&v=4
89527614,NETworkManager,BornToBeRoot/NETworkManager,C#,101,A powerful tool for managing networks and troubleshoot network problems!,366,2642,https://avatars.githubusercontent.com/u/16019165?u=c4e7846be886ac5f8590cb5e5c9395e61d713d7d&v=4
184286875,runner,actions/runner,C#,32,The Runner for GitHub Actions :rocket:,534,2466,https://avatars.githubusercontent.com/u/44036562?v=4
21311240,PKHeX,kwsch/PKHeX,C#,20,Pokémon Save File Editor,437,1899,https://avatars.githubusercontent.com/u/6393368?v=4
121067132,BepInEx,BepInEx/BepInEx,C#,27,Unity / XNA game patcher and plugin framework,268,1767,https://avatars.githubusercontent.com/u/39589027?v=4
185478059,opentelemetry-dotnet,open-telemetry/opentelemetry-dotnet,C#,17,The OpenTelemetry .NET Client,406,1619,https://avatars.githubusercontent.com/u/49998002?v=4
398181340,dotnet-webapi-boilerplate,fullstackhero/dotnet-webapi-boilerplate,C#,43,Clean Architecture Template for .NET 6.0 WebApi built with Multitenancy Support.,193,1321,https://avatars.githubusercontent.com/u/89242069?v=4
331187187,Snap.Genshin,DGP-Studio/Snap.Genshin,C#,90,就是 Snap Genshin,76,876,https://avatars.githubusercontent.com/u/49308723?v=4
315537152,RetroBar,dremin/RetroBar,C#,17,"Classic Windows 95, 98, Me, 2000, XP taskbar for modern versions of Windows",68,684,https://avatars.githubusercontent.com/u/7373633?u=be7935385d35927b2698750d317ef7c3482648a4&v=4
280840278,Tidal-Media-Downloader-PRO,yaronzz/Tidal-Media-Downloader-PRO,C#,17,Download 'TIDAL' Music On Windows/Linux/MacOs (PYTHON/C#),73,475,https://avatars.githubusercontent.com/u/15530958?u=722cf1c58dfe1bcf89e663a986429038cb29d180&v=4
454228800,EvilSelenium,mrd0x/EvilSelenium,C#,28,EvilSelenium is a tool that weaponizes Selenium to attack Chrome.,38,312,https://avatars.githubusercontent.com/u/28691727?u=96c559a920ec545454975f48de2d160cca55d9c0&v=4
101895131,dd-trace-dotnet,DataDog/dd-trace-dotnet,C#,1,.NET Tracer for Datadog APM,85,174,https://avatars.githubusercontent.com/u/365230?v=4
