id,name,full_name,language,new stars,description,forks_count,stargazers_count,avatar_url
112507086,30-seconds-of-code,30-seconds/30-seconds-of-code,JavaScript,367,Short JavaScript code snippets for all your development needs,10209,96656,https://avatars.githubusercontent.com/u/43479428?v=4
70107786,next.js,vercel/next.js,JavaScript,369,The React Framework,18795,88064,https://avatars.githubusercontent.com/u/14985020?v=4
3228505,atom,atom/atom,JavaScript,603,:atom: The hackable text editor,17416,58165,https://avatars.githubusercontent.com/u/1089146?v=4
106017343,tailwindcss,tailwindlabs/tailwindcss,JavaScript,302,A utility-first CSS framework for rapid UI development.,2891,57826,https://avatars.githubusercontent.com/u/67109815?v=4
157616880,iptv,iptv-org/iptv,JavaScript,543,Collection of publicly available IPTV channels from all over the world,9082,52248,https://avatars.githubusercontent.com/u/55937028?v=4
31629751,cypress,cypress-io/cypress,JavaScript,152,"Fast, easy and reliable testing for anything that runs in a browser.",2386,38907,https://avatars.githubusercontent.com/u/8908513?v=4
67508428,drawio,jgraph/drawio,JavaScript,251,Source to app.diagrams.net,6063,29906,https://avatars.githubusercontent.com/u/1769238?v=4
53370988,lighthouse,GoogleChrome/lighthouse,JavaScript,49,"Automated auditing, performance metrics, and best practices for the web.",8621,24742,https://avatars.githubusercontent.com/u/1778935?v=4
69495170,fastify,fastify/fastify,JavaScript,395,"Fast and low overhead web framework, for Node.js",1739,23750,https://avatars.githubusercontent.com/u/24939410?v=4
45431898,react-virtualized,bvaughn/react-virtualized,JavaScript,84,React components for efficiently rendering large lists and tabular data,3002,23782,https://avatars.githubusercontent.com/u/29597?u=5d3ae6f071abe5d90743052ab73a080bad488a1b&v=4
135614069,reactjs-interview-questions,sudheerj/reactjs-interview-questions,JavaScript,393,List of top 500 ReactJS Interview Questions & Answers....Coding exercise questions are coming soon!!,5248,21634,https://avatars.githubusercontent.com/u/3127317?u=0ae9c57bd70b06b2e2293323841ebf59cf3dca90&v=4
116392709,nginxconfig.io,digitalocean/nginxconfig.io,JavaScript,2481,⚙️ NGINX config generator on steroids 💉,1437,20950,https://avatars.githubusercontent.com/u/4650108?v=4
13753636,generator-jhipster,jhipster/generator-jhipster,JavaScript,62,"JHipster is a development platform to quickly generate, develop, & deploy modern web applications & microservice architectures.",3829,19642,https://avatars.githubusercontent.com/u/6059488?v=4
234739976,medusa,medusajs/medusa,JavaScript,499,The open-source Shopify alternative ⚡️,662,12379,https://avatars.githubusercontent.com/u/62591822?v=4
241215865,blitz,blitz-js/blitz,JavaScript,58,⚡️The Fullstack React Framework — built on Next.js,666,11453,https://avatars.githubusercontent.com/u/61243378?v=4
108708339,javascript-interview-questions,sudheerj/javascript-interview-questions,JavaScript,167,List of 1000 JavaScript Interview Questions,3051,10440,https://avatars.githubusercontent.com/u/3127317?u=0ae9c57bd70b06b2e2293323841ebf59cf3dca90&v=4
27786663,exceljs,exceljs/exceljs,JavaScript,69,Excel Workbook Manager,1239,9553,https://avatars.githubusercontent.com/u/46546912?v=4
75890962,vue2-happyfri,bailicangdu/vue2-happyfri,JavaScript,191,vue2 + vue-router + vuex  入门项目,2765,9411,https://avatars.githubusercontent.com/u/20297227?u=e242a737826e2e0d44245a9bb1129a0948334004&v=4
171072967,whatsapp-web.js,pedroslopez/whatsapp-web.js,JavaScript,298,A WhatsApp client library for NodeJS that connects through the WhatsApp Web browser app,1489,6835,https://avatars.githubusercontent.com/u/4368928?u=cbe1262c53382c8b14aad065ffd9ff85d07ee153&v=4
139910229,cli,npm/cli,JavaScript,50,the package manager for JavaScript,1801,5997,https://avatars.githubusercontent.com/u/6078720?v=4
59187489,listen1_desktop,listen1/listen1_desktop,JavaScript,68,"one for all free music in china (Windows, Mac, Linux desktop)",1098,5789,https://avatars.githubusercontent.com/u/18599108?u=e960ae3ba07b4afa36a9b6a342b8a2a62fa8d8cc&v=4
322608016,proposal-type-annotations,tc39/proposal-type-annotations,JavaScript,72,ECMAScript proposal for type syntax that is erased - Stage 1,31,2670,https://avatars.githubusercontent.com/u/1725583?v=4
405929837,dalle-playground,saharmor/dalle-playground,JavaScript,1130,A playground to generate images from any text prompt using DALL-E Mini and based on OpenAI's DALL-E https://openai.com/blog/dall-e/,343,1546,https://avatars.githubusercontent.com/u/6180201?u=34c1473a40b9eb2f5327a2c91e738830ff015b73&v=4
482544775,horizon-ui-chakra,horizon-ui/horizon-ui-chakra,JavaScript,98,The most trendiest & innovative Open Source Admin Template for Chakra UI & React!,60,797,https://avatars.githubusercontent.com/u/103844468?v=4
360253449,basecamp-javascript,stebsnusch/basecamp-javascript,JavaScript,44,O basecampt de Javascript é uma iniciativa da Digital Innovation One para ensinar os pilares da linguagem e seus conceitos mais básicos.,452,529,https://avatars.githubusercontent.com/u/7193438?u=31596841b89a6909f42db395f852f85520a09743&v=4
