id,name,full_name,language,new stars,description,forks_count,stargazers_count,avatar_url
2325298,linux,torvalds/linux,C,410,Linux kernel source tree,38407,116433,https://avatars.githubusercontent.com/u/1024025?v=4
10744183,netdata,netdata/netdata,C,94,"Real-time performance monitoring, done right! https://www.netdata.cloud",4993,55590,https://avatars.githubusercontent.com/u/43390781?v=4
102578345,lede,coolsnowwolf/lede,C,118,Lean's OpenWrt source,14822,17408,https://avatars.githubusercontent.com/u/31687149?u=caa956c5f80318ea674625f9e9efa49c98335d74&v=4
19994257,delve,go-delve/delve,C,56,Delve is a debugger for the Go programming language.,1698,16783,https://avatars.githubusercontent.com/u/19232073?v=4
80286288,Tasmota,arendst/Tasmota,C,198,"Alternative firmware for ESP8266 with easy configuration using webUI, OTA updates, automation using timers or rules, expandability and entirely local control over MQTT, HTTP, Serial or KNX. Full documentation at",3464,15969,https://avatars.githubusercontent.com/u/11044339?u=b54c71859c551426b6738921138b740804ca1d62&v=4
11715753,masscan,robertdavidgraham/masscan,C,53,"TCP port scanner, spews SYN packets asynchronously, scanning entire Internet in under 5 minutes.",2471,15690,https://avatars.githubusercontent.com/u/3814757?v=4
6201092,mpv,mpv-player/mpv,C,76,🎥 Command line video player,1980,15680,https://avatars.githubusercontent.com/u/2550273?v=4
18496166,mimikatz,gentilkiwi/mimikatz,C,113,A little tool to play with Windows security,2747,13899,https://avatars.githubusercontent.com/u/2307945?v=4
105627846,reactos,reactos/reactos,C,48,A free Windows-compatible Operating System,1154,9743,https://avatars.githubusercontent.com/u/1056157?v=4
45821540,openwrt,openwrt/openwrt,C,47,This repository is a mirror of https://git.openwrt.org/openwrt/openwrt.git It is for reference only and is not active for check-ins or for reporting issues.  We will continue to accept Pull Requests here. They will be merged via staging trees then into openwrt.git. All issues should be reported at: https://bugs.openwrt.org,6086,9250,https://avatars.githubusercontent.com/u/2528830?v=4
179354282,OpenCorePkg,acidanthera/OpenCorePkg,C,58,OpenCore bootloader,1380,7819,https://avatars.githubusercontent.com/u/39672954?v=4
75811015,xLua,Tencent/xLua,C,24,"xLua is a lua programming solution for  C# ( Unity, .Net, Mono) , it supports android, ios, windows, linux, osx, etc.",2060,6895,https://avatars.githubusercontent.com/u/18461506?v=4
3318027,Quake-III-Arena,id-Software/Quake-III-Arena,C,24,Quake III Arena GPL Source Release,1574,5553,https://avatars.githubusercontent.com/u/1395534?v=4
254327261,Sandboxie,sandboxie-plus/Sandboxie,C,55,Sandboxie - Open Source,549,4998,https://avatars.githubusercontent.com/u/63755826?v=4
59771425,zephyr,zephyrproject-rtos/zephyr,C,24,"Primary Git Repository for the Zephyr Project. Zephyr is a new generation, scalable, optimized, secure RTOS for multiple hardware architectures.",3037,4814,https://avatars.githubusercontent.com/u/19595895?v=4
241659610,itlwm,OpenIntelWireless/itlwm,C,59,Intel Wi-Fi Drivers for macOS,460,4717,https://avatars.githubusercontent.com/u/67850724?v=4
59676171,klipper,KevinOConnor/klipper,C,36,Klipper is a 3d-printer firmware,2253,3424,https://avatars.githubusercontent.com/u/3004890?v=4
115765590,Tengine,OAID/Tengine,C,132,"Tengine is a lite, high performance, modular inference engine for embedded device ",777,3281,https://avatars.githubusercontent.com/u/29125077?v=4
257113637,minecraft-weekend,jdah/minecraft-weekend,C,43,"Minecraft, but I made it in 48 hours.",192,1923,https://avatars.githubusercontent.com/u/20308439?u=8e2b119cf048b01bd2fc2cbcf620cb1b8aebed74&v=4
287706896,puerts,Tencent/puerts,C,34,Write your game with TypeScript in UE4 or Unity. Puerts can be pronounced as pu-erh TS（普洱TS）,261,1769,https://avatars.githubusercontent.com/u/18461506?v=4
330008801,SDL,libsdl-org/SDL,C,47,Simple Directmedia Layer,273,1664,https://avatars.githubusercontent.com/u/77683370?v=4
194269070,skyline,skyline-emu/skyline,C,38,Run Nintendo Switch homebrew & games on your Android device!,241,1085,https://avatars.githubusercontent.com/u/52578041?v=4
385515329,byeintegrity8-uac,AzAgarampur/byeintegrity8-uac,C,108,"Bypass UAC at any level by abusing the Program Compatibility Assistant with RPC, WDI, and more Windows components",22,150,https://avatars.githubusercontent.com/u/42058942?u=732d2529b591604f49a72ae83ba1fb1c1f7e3699&v=4
325609012,rtw89,lwfinger/rtw89,C,30,"Driver for Realtek 8852AE, an 802.11ax device",14,141,https://avatars.githubusercontent.com/u/4006501?v=4
368040108,PSXFunkin,cuckydev/PSXFunkin,C,14,Friday Night Funkin' on the original PlayStation,7,87,https://avatars.githubusercontent.com/u/44537737?u=01b28cdf11c5f794b51232b97dbb9ece0babe088&v=4
