id,name,full_name,language,new stars,description,forks_count,stargazers_count,avatar_url
21737465,awesome,sindresorhus/awesome,,8928,ğŸ˜ Awesome lists about all kinds of interesting topics,27531,319821,https://avatars.githubusercontent.com/u/170270?u=34acd557a042ac478d273a4621570cadb6b0bd89&v=4
85077558,developer-roadmap,kamranahmedse/developer-roadmap,TypeScript,5116,"Interactive roadmaps, guides and other educational content to help developers grow in their careers.",38203,287793,https://avatars.githubusercontent.com/u/4921183?u=d6ed3573fc67b699e0c3bc2c7e1fb82c98c40dec&v=4
589831718,ComfyUI,comfyanonymous/ComfyUI,Python,4739,"The most powerful and modular diffusion model GUI, api and backend with a graph/nodes interface.",4978,47188,https://avatars.githubusercontent.com/u/121283862?u=00e0967075548ed41bd53ed0eacd34ac42d8cef0&v=4
269336148,Docker-OSX,sickcodes/Docker-OSX,Shell,3933,Run macOS VM in a Docker! Run near native OSX-KVM in Docker! X11 Forwarding! CI/CD for OS X Security Research! Docker mac Containers.,1925,40040,https://avatars.githubusercontent.com/u/65906298?u=7b8ae9f1fb347ca4f74404d0b379b9779fad3419&v=4
159152904,JeecgBoot,jeecgboot/JeecgBoot,Java,1172,ğŸ”¥ã€Œä¼ä¸šçº§ä½ä»£ç å¹³å°ã€å‰åç«¯åˆ†ç¦»æ¶æ„SpringBoot 2.x/3.xï¼ŒSpringCloudï¼ŒAnt Design&Vue3ï¼ŒMybatisï¼ŒShiroï¼ŒJWTã€‚å¼ºå¤§çš„ä»£ç ç”Ÿæˆå™¨è®©å‰åç«¯ä»£ç ä¸€é”®ç”Ÿæˆï¼Œæ— éœ€å†™ä»»ä½•ä»£ç ! å¼•é¢†æ–°çš„å¼€å‘æ¨¡å¼OnlineCoding->ä»£ç ç”Ÿæˆ->æ‰‹å·¥MERGEï¼Œå¸®åŠ©Javaé¡¹ç›®è§£å†³70%é‡å¤å·¥ä½œï¼Œè®©å¼€å‘æ›´å…³æ³¨ä¸šåŠ¡ï¼Œæ—¢èƒ½å¿«é€Ÿæé«˜æ•ˆç‡ï¼Œå¸®åŠ©å…¬å¸èŠ‚çœæˆæœ¬ï¼ŒåŒæ—¶åˆä¸å¤±çµæ´»æ€§ã€‚,14624,39743,https://avatars.githubusercontent.com/u/86360035?v=4
594155488,Stirling-PDF,Stirling-Tools/Stirling-PDF,Java,8269,#1 Locally hosted web application that allows you to perform various operations on PDF files,2870,38340,https://avatars.githubusercontent.com/u/139791695?v=4
237791077,diagrams,mingrammer/diagrams,Python,911,:art: Diagram as Code for prototyping cloud system architectures,2371,36560,https://avatars.githubusercontent.com/u/6178510?u=f9940c5492bc7ede04a9f2ea7df3aae973e45165&v=4
656099147,mem0,mem0ai/mem0,Python,10355,The memory layer for Personalized AI,1855,19736,https://avatars.githubusercontent.com/u/137054526?v=4
667110339,drawdb,drawdb-io/drawdb,JavaScript,6894,"Free, simple, and intuitive online database design tool and SQL generator.",1321,19058,https://avatars.githubusercontent.com/u/139706923?v=4
167694194,frigate,blakeblackshear/frigate,Python,1048,NVR with realtime local object detection for IP cameras,1595,17205,https://avatars.githubusercontent.com/u/569905?u=a454086144f531389a73fbea93a7835eea06f2a1&v=4
77726177,trufflehog,trufflesecurity/trufflehog,Go,809,"Find, verify, and analyze leaked credentials",1607,15275,https://avatars.githubusercontent.com/u/79229934?v=4
521655652,infisical,Infisical/infisical,TypeScript,1387,"â™¾ Infisical is the open-source secret management platform: Sync secrets across your team/infrastructure, prevent secret leaks, and manage internal PKI",790,14464,https://avatars.githubusercontent.com/u/107880645?v=4
560299175,teable,teableio/teable,TypeScript,2519,âœ¨ The Next Gen Airtable Alternative: No-Code Postgres,450,10246,https://avatars.githubusercontent.com/u/113977713?v=4
765083837,MinerU,opendatalab/MinerU,Python,7593,"A one-stop, open-source, high-quality data extraction tool, supports PDF/webpage/e-book extraction.ä¸€ç«™å¼å¼€æºé«˜è´¨é‡æ•°æ®æå–å·¥å…·ï¼Œæ”¯æŒPDF/ç½‘é¡µ/å¤šæ ¼å¼ç”µå­ä¹¦æå–ã€‚",621,8381,https://avatars.githubusercontent.com/u/97503431?v=4
270910423,FlareSolverr,FlareSolverr/FlareSolverr,Python,596,Proxy server to bypass Cloudflare protection,607,7018,https://avatars.githubusercontent.com/u/75936191?v=4
743116659,stable-diffusion-webui-forge,lllyasviel/stable-diffusion-webui-forge,Python,966,,630,6359,https://avatars.githubusercontent.com/u/19834515?u=4c7144779a6b13904fec478c4e98e676b91516ee&v=4
678716433,FlClash,chen08209/FlClash,Dart,3727,"A multi-platform proxy client based on ClashMeta,simple and easy to use, open-source and ad-free.",338,5866,https://avatars.githubusercontent.com/u/66918471?v=4
733283939,metahuman-stream,lipku/metahuman-stream,Python,2010,Real time interactive streaming digital human,423,2997,https://avatars.githubusercontent.com/u/5893340?v=4
