id,name,full_name,language,new stars,description,forks_count,stargazers_count,avatar_url
29028775,react-native,facebook/react-native,C++,709,A framework for building native applications using React,24135,117442,https://avatars.githubusercontent.com/u/69631?v=4
15634981,godot,godotengine/godot,C++,1398,Godot Engine â€“ Multi-platform 2D and 3D game engine,19683,87479,https://avatars.githubusercontent.com/u/6318500?v=4
1181927,bitcoin,bitcoin/bitcoin,C++,733,Bitcoin Core integration/staging tree,35905,77656,https://avatars.githubusercontent.com/u/528860?v=4
619959033,gpt4all,nomic-ai/gpt4all,C++,2328,GPT4All: Chat with Local LLMs on Any Device,7486,68247,https://avatars.githubusercontent.com/u/102670180?v=4
67702184,Magisk,topjohnwu/Magisk,C++,779,The Magic Mask for Android,11621,46087,https://avatars.githubusercontent.com/u/7337301?v=4
23129458,aseprite,aseprite/aseprite,C++,537,"Animated sprite editor & pixel art tool (Windows, macOS, Linux)",5290,28023,https://avatars.githubusercontent.com/u/3853896?v=4
4524181,folly,facebook/folly,C++,369,An open-source C++ library developed and used at Facebook.,5506,27784,https://avatars.githubusercontent.com/u/69631?v=4
437245741,dragonfly,dragonflydb/dragonfly,C++,442,A modern replacement for Redis and Memcached,897,24875,https://avatars.githubusercontent.com/u/104819355?v=4
26038648,spdlog,gabime/spdlog,C++,512,Fast C++ logging library.,4419,23420,https://avatars.githubusercontent.com/u/6052198?u=a5aaa778f219603fd3a6e221c79370ac5f0fa182&v=4
65711522,Paddle,PaddlePaddle/Paddle,C++,190,PArallel Distributed Deep LEarning: Machine Learning Framework from Industrial Practice ï¼ˆã€é£æ¡¨ã€æ ¸å¿ƒæ¡†æ¶ï¼Œæ·±åº¦å­¦ä¹ &æœºå™¨å­¦ä¹ é«˜æ€§èƒ½å•æœºã€åˆ†å¸ƒå¼è®­ç»ƒå’Œè·¨å¹³å°éƒ¨ç½²ï¼‰,5520,21948,https://avatars.githubusercontent.com/u/23534030?v=4
79317191,typesense,typesense/typesense,C++,942,"Open Source alternative to Algolia + Pinecone and an Easier-to-Use alternative to ElasticSearch âš¡ ğŸ” âœ¨ Fast, typo tolerant, in-memory fuzzy Search Engine for building delightful search experiences",607,19567,https://avatars.githubusercontent.com/u/19822348?v=4
689773665,llamafile,Mozilla-Ocho/llamafile,C++,1313,Distribute and run LLMs with a single file.,908,18059,https://avatars.githubusercontent.com/u/117940224?v=4
102343794,brpc,apache/brpc,C++,245,"brpc is an Industrial-grade RPC framework using C++ Language, which is often used in high performance system such as Search, Storage, Machine learning, Advertisement, Recommendation etc. ""brpc"" means ""better RPC"".",3945,16253,https://avatars.githubusercontent.com/u/47359?v=4
384520418,MaaAssistantArknights,MaaAssistantArknights/MaaAssistantArknights,C++,510,"ã€Šæ˜æ—¥æ–¹èˆŸã€‹å°åŠ©æ‰‹ï¼Œå…¨æ—¥å¸¸ä¸€é”®é•¿è‰ï¼| A one-click tool for the daily tasks of Arknights, supporting all clients.",1722,12993,https://avatars.githubusercontent.com/u/97677443?v=4
106558568,dxvk,doitsujin/dxvk,C++,225,"Vulkan-based implementation of D3D8, 9, 10 and 11 for Linux / Wine",801,12456,https://avatars.githubusercontent.com/u/25567304?u=e753c1eafb0e81504b6ab74883303565cdfa66b2&v=4
488177011,nekoray,MatsuriDayo/nekoray,C++,445,Qt based cross-platform GUI proxy configuration manager (backend: sing-box),1139,11627,https://avatars.githubusercontent.com/u/95122236?v=4
15379620,pcsx2,PCSX2/pcsx2,C++,509,PCSX2 - The Playstation 2 Emulator,1561,11098,https://avatars.githubusercontent.com/u/6278711?v=4
25135037,synergy-core,symless/synergy-core,C++,86,"Open source core of Synergy, the cross-platform keyboard and mouse sharing tool (Windows, macOS, Linux)",3622,10174,https://avatars.githubusercontent.com/u/313412?v=4
372536760,oceanbase,oceanbase/oceanbase,C++,372,"OceanBase is an enterprise distributed relational database with high availability, high performance, horizontal scalability, and compatibility with SQL standards.",1630,8118,https://avatars.githubusercontent.com/u/82347605?v=4
5298790,PX4-Autopilot,PX4/PX4-Autopilot,C++,196,PX4 Autopilot Software,13294,8021,https://avatars.githubusercontent.com/u/2096014?v=4
33157169,cpr,libcpr/cpr,C++,103,"C++ Requests: Curl for People, a spiritual port of Python Requests.",913,6382,https://avatars.githubusercontent.com/u/55407394?v=4
503592660,notepad--,cxasm/notepad--,C++,483,ä¸€ä¸ªæ”¯æŒwindows/linux/macçš„æ–‡æœ¬ç¼–è¾‘å™¨ï¼Œç›®æ ‡æ˜¯åšä¸­å›½äººè‡ªå·±çš„ç¼–è¾‘å™¨ï¼Œæ¥è‡ªä¸­å›½ã€‚,213,5363,https://avatars.githubusercontent.com/u/42246867?u=0700abe85b4febda53e6b473581c029884c54ca0&v=4
112542515,cutlass,NVIDIA/cutlass,C++,213,CUDA Templates for Linear Algebra Subroutines,860,5030,https://avatars.githubusercontent.com/u/1728152?v=4
324569839,YimMenu,YimMenu/YimMenu,C++,113,"YimMenu, a GTA V menu protecting against a wide ranges of the public crashes and improving the overall experience.",1084,1311,https://avatars.githubusercontent.com/u/106739674?v=4
