id,name,full_name,language,new stars,description,forks_count,stargazers_count,avatar_url
1039520,youtube-dl,ytdl-org/youtube-dl,Python,905,Command-line program to download videos from YouTube.com and other video sites,9859,130590,https://avatars.githubusercontent.com/u/48381040?v=4
589831718,ComfyUI,comfyanonymous/ComfyUI,Python,3977,"The most powerful and modular diffusion model GUI, api and backend with a graph/nodes interface.",4830,45487,https://avatars.githubusercontent.com/u/121283862?u=00e0967075548ed41bd53ed0eacd34ac42d8cef0&v=4
262296122,PaddleOCR,PaddlePaddle/PaddleOCR,Python,1419,"Awesome multilingual OCR toolkits based on PaddlePaddle (practical ultra lightweight OCR system, support 80+ languages recognition, provide data annotation and synthesis tools, support training and deployment among server, mobile, embedded and IoT devices)",7583,41644,https://avatars.githubusercontent.com/u/23534030?v=4
91629816,freqtrade,freqtrade/freqtrade,Python,1136,"Free, open source crypto trading bot",5891,27390,https://avatars.githubusercontent.com/u/37536846?v=4
656099147,mem0,mem0ai/mem0,Python,10526,The memory layer for Personalized AI,1818,19311,https://avatars.githubusercontent.com/u/137054526?v=4
638629097,aider,paul-gauthier/aider,Python,2786,aider is AI pair programming in your terminal,1479,15733,https://avatars.githubusercontent.com/u/69695708?u=1b1a608998950cb407854549123a52c964a202ec&v=4
778431525,graphrag,microsoft/graphrag,Python,5876,A modular graph-based Retrieval-Augmented Generation (RAG) system,1279,14410,https://avatars.githubusercontent.com/u/6154722?v=4
3757435,pytube,pytube/pytube,Python,1238,"A lightweight, dependency-free Python library (and command-line utility) for downloading YouTube Videos.",2475,11825,https://avatars.githubusercontent.com/u/16789089?v=4
776854298,storm,stanford-oval/storm,Python,4487,An LLM-powered knowledge curation system that researches a topic and generates a full-length report with citations.,863,9321,https://avatars.githubusercontent.com/u/13667124?v=4
270910423,FlareSolverr,FlareSolverr/FlareSolverr,Python,418,Proxy server to bypass Cloudflare protection,595,6721,https://avatars.githubusercontent.com/u/75936191?v=4
224896494,metube,alexta69/metube,Python,1667,Self-hosted YouTube downloader (web UI for youtube-dl / yt-dlp),341,5672,https://avatars.githubusercontent.com/u/7450369?v=4
762304524,composio,ComposioHQ/composio,Python,3442,Composio equips agents with well-crafted tools empowering them to tackle complex tasks,1055,4656,https://avatars.githubusercontent.com/u/128464815?v=4
741365632,crawlee-python,apify/crawlee-python,Python,3312,"Crawlee—A web scraping and browser automation library for Python to build reliable crawlers. Extract data for AI, LLMs, RAG, or GPTs. Download HTML, PDF, JPG, PNG, and other files from websites. Works with BeautifulSoup, Playwright, and raw HTTP. Both headful and headless mode. With proxy rotation.",242,3529,https://avatars.githubusercontent.com/u/24586296?v=4
733283939,metahuman-stream,lipku/metahuman-stream,Python,1770,Real time interactive streaming digital human,390,2722,https://avatars.githubusercontent.com/u/5893340?v=4
