id,name,full_name,language,new stars,description,forks_count,stargazers_count,avatar_url
619959033,gpt4all,nomic-ai/gpt4all,C++,415,gpt4all: open-source LLM chatbots that you can run anywhere,5926,54122,https://avatars.githubusercontent.com/u/102670180?v=4
39840932,googletest,google/googletest,C++,147,GoogleTest - Google Testing and Mocking Framework,9926,31334,https://avatars.githubusercontent.com/u/1342004?v=4
160083795,serenity,SerenityOS/serenity,C++,79,The Serenity Operating System 🐞,2872,26353,https://avatars.githubusercontent.com/u/50811782?v=4
96246170,apollo,ApolloAuto/apollo,C++,52,An open autonomous driving platform,9425,23559,https://avatars.githubusercontent.com/u/28768304?v=4
19374812,tdesktop,telegramdesktop/tdesktop,C++,245,Telegram Desktop messaging app,4738,23125,https://avatars.githubusercontent.com/u/6113871?v=4
40892817,solidity,ethereum/solidity,C++,58,"Solidity, the Smart Contract Programming Language",5520,21121,https://avatars.githubusercontent.com/u/6250754?v=4
251383553,CnC_Remastered_Collection,electronicarts/CnC_Remastered_Collection,C++,224,,4449,17002,https://avatars.githubusercontent.com/u/1637638?v=4
420580521,smartknob,scottbez1/smartknob,C++,213,Haptic input knob with software-defined endstops and virtual detents,922,15956,https://avatars.githubusercontent.com/u/414890?u=589508b11b9260a496d1735579ab79c77b49558e&v=4
38581626,pybind11,pybind/pybind11,C++,42,Seamless operability between C++11 and Python,1955,13736,https://avatars.githubusercontent.com/u/17565521?v=4
67031040,upx,upx/upx,C++,83,UPX - the Ultimate Packer for eXecutables,1242,12384,https://avatars.githubusercontent.com/u/21360319?v=4
28449431,scylladb,scylladb/scylladb,C++,101,"NoSQL data store using the seastar framework, compatible with Apache Cassandra",1115,11444,https://avatars.githubusercontent.com/u/14364730?v=4
86897963,ZLMediaKit,ZLMediaKit/ZLMediaKit,C++,64,WebRTC/RTSP/RTMP/HTTP/HLS/HTTP-FLV/WebSocket-FLV/HTTP-TS/HTTP-fMP4/WebSocket-TS/WebSocket-fMP4/GB28181/SRT server and client framework based on C++11,2826,10964,https://avatars.githubusercontent.com/u/84565724?v=4
4454793,MuseScore,musescore/MuseScore,C++,203,"MuseScore is an open source and free music notation software. For support, contribution, bug reports, visit MuseScore.org. Fork and make pull requests!",2338,10442,https://avatars.githubusercontent.com/u/380563?v=4
5298790,PX4-Autopilot,PX4/PX4-Autopilot,C++,32,PX4 Autopilot Software,12781,6967,https://avatars.githubusercontent.com/u/2096014?v=4
52882701,PrusaSlicer,prusa3d/PrusaSlicer,C++,35,"G-code generator for 3D printers (RepRap, Makerbot, Ultimaker etc.)",1741,6795,https://avatars.githubusercontent.com/u/14859759?v=4
244694174,connectedhomeip,project-chip/connectedhomeip,C++,37,"Matter (formerly Project CHIP) creates more connections between more objects, simplifying development for manufacturers and increasing compatibility for consumers, guided by the Connectivity Standards Alliance.",1695,6500,https://avatars.githubusercontent.com/u/61027988?v=4
12849977,recastnavigation,recastnavigation/recastnavigation,C++,20,Navigation-mesh Toolset for Games,1517,5841,https://avatars.githubusercontent.com/u/16167685?v=4
586310592,Whisper,Const-me/Whisper,C++,111,High-performance GPGPU inference of OpenAI's Whisper automatic speech recognition (ASR) model,505,5448,https://avatars.githubusercontent.com/u/925112?v=4
488177011,nekoray,MatsuriDayo/nekoray,C++,242,Qt based cross-platform GUI proxy configuration manager (backend: v2ray / sing-box),445,4956,https://avatars.githubusercontent.com/u/95122236?v=4
47440536,cocos-engine,cocos/cocos-engine,C++,27,"Cocos simplifies game creation and distribution with Cocos Creator, a free, open-source, cross-platform game engine. Empowering millions of developers to create high-performance, engaging 2D/3D games and instant web entertainment.",1492,4756,https://avatars.githubusercontent.com/u/6937061?v=4
8243074,rpi-rgb-led-matrix,hzeller/rpi-rgb-led-matrix,C++,15,"Controlling up to three chains of 64x64, 32x32, 16x32 or similar RGB LED displays using Raspberry Pi GPIO",1071,3294,https://avatars.githubusercontent.com/u/140937?v=4
208325027,ESP32Marauder,justcallmekoko/ESP32Marauder,C++,40,A suite of WiFi/Bluetooth offensive and defensive tools for the ESP32,349,3208,https://avatars.githubusercontent.com/u/25190487?u=0638c9868fd6a3c8cc142598e2c2dabbf3ca29cc&v=4
207663235,bustub,cmu-db/bustub,C++,28,The BusTub Relational Database Management System (Educational),1548,3093,https://avatars.githubusercontent.com/u/6220241?v=4
564623890,intel-extension-for-transformers,intel/intel-extension-for-transformers,C++,111,⚡ Build your chatbot within minutes on your favorite device; offer SOTA compression techniques for LLMs; run LLMs efficiently on Intel Platforms⚡,78,591,https://avatars.githubusercontent.com/u/17888862?v=4
709393513,MGSResolutionPatch,Sergeanur/MGSResolutionPatch,C++,34,,0,130,https://avatars.githubusercontent.com/u/4450430?v=4
