id,name,full_name,language,new stars,description,forks_count,stargazers_count,avatar_url
10744183,netdata,netdata/netdata,C,13,"Real-time performance monitoring, done right! https://www.netdata.cloud",5092,56566,https://avatars.githubusercontent.com/u/43390781?v=4
156018,redis,redis/redis,C,20,"Redis is an in-memory database that persists on disk. The data model is key-value, but many different kind of values are supported: Strings, Lists, Sets, Sorted Sets, Hashes, Streams, HyperLogLogs, Bitmaps.",20226,51672,https://avatars.githubusercontent.com/u/1529926?v=4
36836475,tmux,tmux/tmux,C,6,tmux source code,1614,22981,https://avatars.githubusercontent.com/u/12054114?v=4
5101141,jq,stedolan/jq,C,8,Command-line JSON processor,1222,20576,https://avatars.githubusercontent.com/u/79765?v=4
14812739,libuv,libuv/libuv,C,9,Cross-platform asynchronous I/O,2959,18360,https://avatars.githubusercontent.com/u/4030929?v=4
6201092,mpv,mpv-player/mpv,C,10,🎥 Command line video player,2045,16617,https://avatars.githubusercontent.com/u/2550273?v=4
34921116,bcc,iovisor/bcc,C,7,"BCC - Tools for BPF-based Linux IO analysis, networking, monitoring, and more",2468,12886,https://avatars.githubusercontent.com/u/12766186?v=4
613829,lua-nginx-module,openresty/lua-nginx-module,C,2,Embed the Power of Lua into NGINX HTTP servers,1892,9619,https://avatars.githubusercontent.com/u/7390180?v=4
65899476,esp-idf,espressif/esp-idf,C,10,Espressif IoT Development Framework. Official development framework for ESP32.,4692,7358,https://avatars.githubusercontent.com/u/9460735?v=4
13310527,jemalloc,jemalloc/jemalloc,C,10,,1130,6482,https://avatars.githubusercontent.com/u/5606968?v=4
54280778,cJSON,DaveGamble/cJSON,C,7,Ultralightweight JSON parser in ANSI C,2380,6468,https://avatars.githubusercontent.com/u/118247?v=4
105944401,yugabyte-db,yugabyte/yugabyte-db,C,13,"The high-performance distributed SQL database for global, internet-scale apps.",670,5730,https://avatars.githubusercontent.com/u/17074854?v=4
31791482,Windows-driver-samples,microsoft/Windows-driver-samples,C,4,This repo contains driver samples prepared for use with Microsoft Visual Studio and the Windows Driver Kit (WDK). It contains both Universal Windows Driver and desktop-only driver samples.,4105,4702,https://avatars.githubusercontent.com/u/6154722?v=4
1259258,toaruos,klange/toaruos,C,25,"A completely-from-scratch hobby operating system: bootloader, kernel, drivers, C library, and userspace including a composited graphical UI, dynamic linker, syntax-highlighting text editor, network stack, etc.",390,4354,https://avatars.githubusercontent.com/u/223546?u=6961379fa9dcea4ca7738341d20792f6499d0f73&v=4
86245815,pygame,pygame/pygame,C,6,"pygame (the library) is a Free and Open Source python programming language library for making multimedia applications like games built on top of the excellent SDL library. C, Python, Native, OpenGL.",1764,4027,https://avatars.githubusercontent.com/u/20628127?v=4
17183871,iperf,esnet/iperf,C,7,"iperf3:  A TCP, UDP, and SCTP network bandwidth measurement tool",929,3983,https://avatars.githubusercontent.com/u/1566018?v=4
2359378,zlib,madler/zlib,C,4,A massively spiffy yet delicately unobtrusive compression library.,1720,3150,https://avatars.githubusercontent.com/u/240717?v=4
114948816,h3,uber/h3,C,4,Hexagonal hierarchical geospatial indexing system,291,3086,https://avatars.githubusercontent.com/u/538264?v=4
39760454,libjpeg-turbo,libjpeg-turbo/libjpeg-turbo,C,1,Main libjpeg-turbo repository,732,2640,https://avatars.githubusercontent.com/u/13406820?v=4
287706896,puerts,Tencent/puerts,C,8,Write your game with TypeScript in UE4 or Unity. Puerts can be pronounced as pu-erh TS（普洱TS）,311,2037,https://avatars.githubusercontent.com/u/18461506?v=4
207354223,FreeRTOS-Kernel,FreeRTOS/FreeRTOS-Kernel,C,2,"FreeRTOS kernel files only, submoduled into https://github.com/FreeRTOS/FreeRTOS and various other repos.",446,781,https://avatars.githubusercontent.com/u/54647343?v=4
121516035,sdk-nrf,nrfconnect/sdk-nrf,C,0,nRF Connect SDK main repository,639,354,https://avatars.githubusercontent.com/u/40860733?v=4
53432472,sonic-buildimage,Azure/sonic-buildimage,C,0,Scripts which perform an installable binary image build for SONiC,823,347,https://avatars.githubusercontent.com/u/6844498?v=4
391402552,terminal_minecraft,Kameldieb/terminal_minecraft,C,19,,33,243,https://avatars.githubusercontent.com/u/71906094?v=4
422751904,zinit,zdharma-continuum/zinit,C,17,Zinit is a flexible and fast Zshell plugin manager,37,137,https://avatars.githubusercontent.com/u/93413036?v=4
