id,name,full_name,language,new stars,description,forks_count,stargazers_count,avatar_url
6498492,javascript,airbnb/javascript,JavaScript,661,JavaScript Style Guide,25601,134346,https://avatars.githubusercontent.com/u/698437?v=4
576201,three.js,mrdoob/three.js,JavaScript,303,JavaScript 3D Library.,34700,91927,https://avatars.githubusercontent.com/u/97088?u=95046da3776175b5f3d1ad2137704cd123e04d9e&v=4
74791366,clean-code-javascript,ryanmcdermott/clean-code-javascript,JavaScript,192,:bathtub: Clean Code concepts adapted for JavaScript,11149,82241,https://avatars.githubusercontent.com/u/5114666?u=d4baaf527cea161717905513840329c424bb6800&v=4
36040894,gatsby,gatsbyjs/gatsby,JavaScript,61,The fastest frontend for the headless web. Build modern websites with React.,10539,54467,https://avatars.githubusercontent.com/u/12551863?v=4
382496361,uptime-kuma,louislam/uptime-kuma,JavaScript,288,A fancy self-hosted monitoring tool,2890,33548,https://avatars.githubusercontent.com/u/1336778?u=5f96cafa12ed95d786d4b84bcf284e8fb2bedd89&v=4
135614069,reactjs-interview-questions,sudheerj/reactjs-interview-questions,JavaScript,223,List of top 500 ReactJS Interview Questions & Answers....Coding exercise questions are coming soon!!,7254,29357,https://avatars.githubusercontent.com/u/3127317?u=0ae9c57bd70b06b2e2293323841ebf59cf3dca90&v=4
19745004,odoo,odoo/odoo,JavaScript,98,Odoo. Open Source Apps To Grow Your Business.,18653,29180,https://avatars.githubusercontent.com/u/6368483?v=4
44150497,remote-jobs,remoteintech/remote-jobs,JavaScript,130,A list of semi to fully remote-friendly companies (jobs) in tech.,2616,24590,https://avatars.githubusercontent.com/u/31714327?v=4
352933140,ToolJet,ToolJet/ToolJet,JavaScript,88,"Extensible low-code framework for building business applications. Connect to databases, cloud storages, GraphQL, API endpoints, Airtable, etc and build apps using drag and drop application builder. Built using JavaScript/TypeScript. ğŸš€",1752,19047,https://avatars.githubusercontent.com/u/82193554?v=4
285092252,sst,serverless-stack/sst,JavaScript,269,ğŸ’¥ SST makes it easy to build full-stack serverless apps.,1289,14718,https://avatars.githubusercontent.com/u/66570915?v=4
4644745,chrome-extensions-samples,GoogleChrome/chrome-extensions-samples,JavaScript,50,Chrome Extensions Samples,7268,12286,https://avatars.githubusercontent.com/u/1778935?v=4
171072967,whatsapp-web.js,pedroslopez/whatsapp-web.js,JavaScript,83,A WhatsApp client library for NodeJS that connects through the WhatsApp Web browser app,2390,10120,https://avatars.githubusercontent.com/u/4368928?u=cbe1262c53382c8b14aad065ffd9ff85d07ee153&v=4
42009758,metamask-extension,MetaMask/metamask-extension,JavaScript,88,:globe_with_meridians: :electric_plug: The MetaMask browser extension enables browsing Ethereum blockchain enabled websites,3988,9942,https://avatars.githubusercontent.com/u/11744586?v=4
235468657,pipedream,PipedreamHQ/pipedream,JavaScript,111,"Connect APIs, remarkably fast.  Free for developers.",4749,6409,https://avatars.githubusercontent.com/u/43791938?v=4
31771754,WebGoat,WebGoat/WebGoat,JavaScript,28,WebGoat is a deliberately insecure application,3931,5709,https://avatars.githubusercontent.com/u/7718244?v=4
625187946,ChatALL,sunner/ChatALL,JavaScript,4445," Concurrently chat with ChatGPT, Bing Chat, bard, Alpaca, Vincuna, Claude, ChatGLM, MOSS, iFlytek Spark, ERNIE and more, discover the best answers",581,4813,https://avatars.githubusercontent.com/u/255413?v=4
621803253,Flowise,FlowiseAI/Flowise,JavaScript,1009,Drag & drop UI to build your customized LLM flow using LangchainJS,922,4572,https://avatars.githubusercontent.com/u/128289781?v=4
488804911,windmill,windmill-labs/windmill,JavaScript,1007,Open-source developer platform to turn scripts into workflows and UIs. Open-source alternative to Airplane and Retool.,124,4516,https://avatars.githubusercontent.com/u/98025271?v=4
599735720,3x-ui,MHSanaei/3x-ui,JavaScript,197,Xray panel supporting multi-protocol multi-user expire day & traffic & ip limit (Vmess & Vless & Trojan &  ShadowSocks),257,1332,https://avatars.githubusercontent.com/u/33454419?v=4
611745583,free-chatgpt-client-pub,akl7777777/free-chatgpt-client-pub,JavaScript,261,"**A free chatgpt client, now Supported online search.no need for a key, no need to log in.Multi-node automatic speed measurement switch,Long text translation with no word limit, AI graphics.å…è´¹çš„chatgptå®¢æˆ·ç«¯ï¼Œå·²æ”¯æŒè”ç½‘æœç´¢,æ— éœ€å¯†é’¥ï¼Œæ— éœ€ç™»å½•,å¤šèŠ‚ç‚¹è‡ªåŠ¨æµ‹é€Ÿåˆ‡æ¢,é•¿æ–‡ç¿»è¯‘ä¸é™å­—æ•°,AIå‡ºå›¾**",117,1066,https://avatars.githubusercontent.com/u/84266551?u=488479a1c25cd337f5d1671f574c204d886b0f5d&v=4
83777918,savegame-editors,marcrobledo/savegame-editors,JavaScript,114,A compilation of console savegame editors made with HTML5 technologies.,166,670,https://avatars.githubusercontent.com/u/14358263?v=4
600596928,chatgpt-clone,danny-avila/chatgpt-clone,JavaScript,174,"Clone of ChatGPT, uses official model, Bing, PaLM 2, reverse-engineered UI, with AI model switching, message search, ChatGPT Plugins, Multi-User System, & Prompt Templates (WIP)",164,631,https://avatars.githubusercontent.com/u/110412045?u=14f0d4fe10f128fae5985f573c7221cd13929e2e&v=4
636179770,project_next_13_ai_prompt_sharing,adrianhajdin/project_next_13_ai_prompt_sharing,JavaScript,190,"Next.js recently became the official React framework as outlined in React docs. In this course, you'll learn the most important Next.js concepts and how they fit into the React ecosystem. Finally, you'll put your skills to the test by building a modern full-stack Next 13 application.",90,600,https://avatars.githubusercontent.com/u/24898559?u=fd2baba143bcb62cc0f2bc646ec33c2ba9ef013e&v=4
599524116,SillyTavern,Cohee1207/SillyTavern,JavaScript,115,TavernAI for nerds,133,554,https://avatars.githubusercontent.com/u/18619528?u=82f5959c2729b60429a6294e2f592c3b7c7e6953&v=4
631621388,NewBingGoGo-Web,jianjianai/NewBingGoGo-Web,JavaScript,89,ä¸€ä¸ªåŸºäºå¾®è½¯OpenAI ChatGPT GPT4çš„New Bingæ¥å£çš„WebæœåŠ¡ã€‚ æä¾›äº†å¥½çœ‹çš„å¯¹è¯é¡µé¢ã€‚ å®ç°äº†å¾®è½¯New Bingçš„å¤§å¤šæ•°åŠŸèƒ½ï¼Œè¿˜æ·»åŠ äº†ä¸€äº›è‡ªå·±çš„ç‰¹è‰²åŠŸèƒ½ã€‚ å¼€æºå…è´¹ã€‚,125,252,https://avatars.githubusercontent.com/u/59829816?u=e730e8549d99e68f665074e814923d0542c316a7&v=4
