id,name,full_name,language,new stars,description,forks_count,stargazers_count,avatar_url
21737465,awesome,sindresorhus/awesome,,188,ğŸ˜ Awesome lists about all kinds of interesting topics,24440,225600,https://avatars.githubusercontent.com/u/170270?u=34acd557a042ac478d273a4621570cadb6b0bd89&v=4
63476337,Python,TheAlgorithms/Python,Python,88,All Algorithms implemented in Python,38187,148199,https://avatars.githubusercontent.com/u/20487725?v=4
123458551,Python-100-Days,jackfrued/Python-100-Days,Python,80,Python - 100å¤©ä»æ–°æ‰‹åˆ°å¤§å¸ˆ,47413,127369,https://avatars.githubusercontent.com/u/7474657?u=902200c2389c203cf2139888e10314845edd2a2a&v=4
22067521,imgui,ocornut/imgui,C++,56,Dear ImGui: Bloat-free Graphical User interface for C++ with minimal dependencies,7562,43227,https://avatars.githubusercontent.com/u/8225057?u=de42cf0fa1f1970187db446beea30c61b9c1e6d3&v=4
281975310,type-challenges,type-challenges/type-challenges,TypeScript,242,Collection of TypeScript type challenges with online judge,2663,27357,https://avatars.githubusercontent.com/u/68700335?v=4
349321229,GFPGAN,TencentARC/GFPGAN,Python,107,GFPGAN aims at developing Practical Algorithms for Real-world Face Restoration.,3661,24540,https://avatars.githubusercontent.com/u/83739826?v=4
527591471,stable-diffusion-webui,AUTOMATIC1111/stable-diffusion-webui,Python,168,Stable Diffusion web UI,3726,20829,https://avatars.githubusercontent.com/u/20920490?u=8bdc7c9401f507e51b55e558baa8184d4ed30c7d&v=4
6201092,mpv,mpv-player/mpv,C,70,ğŸ¥ Command line video player,2459,20600,https://avatars.githubusercontent.com/u/2550273?v=4
234798675,bevy,bevyengine/bevy,Rust,192,A refreshingly simple data-driven game engine built in Rust,1985,20075,https://avatars.githubusercontent.com/u/60047606?v=4
120231691,Ryujinx,Ryujinx/Ryujinx,C#,205,Experimental Nintendo Switch Emulator written in C#,1647,13721,https://avatars.githubusercontent.com/u/39036280?v=4
23247808,rqlite,rqlite/rqlite,Go,77,"The lightweight, distributed relational database built on SQLite",582,12053,https://avatars.githubusercontent.com/u/18683023?v=4
37346186,termux-packages,termux/termux-packages,Shell,59,A build system and primary set of packages for Termux.,2481,9196,https://avatars.githubusercontent.com/u/8104776?v=4
335164964,dataease,dataease/dataease,Java,35,äººäººå¯ç”¨çš„å¼€æºæ•°æ®å¯è§†åŒ–åˆ†æå·¥å…·ã€‚,1596,8041,https://avatars.githubusercontent.com/u/75054108?v=4
320785435,LSPosed,LSPosed/LSPosed,Java,24,LSPosed Framework,1139,7450,https://avatars.githubusercontent.com/u/75879071?v=4
200321698,chibicc,rui314/chibicc,C,106,A small C compiler,619,6716,https://avatars.githubusercontent.com/u/47400?v=4
282443202,latexify_py,google/latexify_py,Python,208,Generates LaTeX math description from Python functions.,265,4521,https://avatars.githubusercontent.com/u/1342004?v=4
540917299,reference,jaywcjlove/reference,CSS,431,ä¸ºå¼€å‘äººå‘˜åˆ†äº«å¿«é€Ÿå‚è€ƒå¤‡å¿˜æ¸…å•(é€ŸæŸ¥è¡¨),200,1670,https://avatars.githubusercontent.com/u/1680273?u=4471b74deb9973096418a93960c664c5ea3bd159&v=4
564975433,wa-tunnel,aleixrodriala/wa-tunnel,JavaScript,239,Tunneling Internet traffic over Whatsapp,46,1171,https://avatars.githubusercontent.com/u/11310358?u=370980b47bd08fa435985410462b717145ec4e38&v=4
564058707,twitter-archive-parser,timhutton/twitter-archive-parser,Python,217,Python code to parse a Twitter archive and output in various ways,43,1112,https://avatars.githubusercontent.com/u/647092?u=891dc826e22b8b42a74a0df108134c692b282cd1&v=4
537803484,palera1n,palera1n/palera1n,Shell,93,"iOS 15.0-15.7.1 (semi-)tethered checkm8 ""jailbreak""",82,826,https://avatars.githubusercontent.com/u/114239186?v=4
559279408,sonic,go-sonic/sonic,Go,80,Sonic is a blogging platform developed by Go. Simple and powerful,36,596,https://avatars.githubusercontent.com/u/115915690?v=4
360427259,KeepAliveE5,vcheckzen/KeepAliveE5,Shell,11,,190,502,https://avatars.githubusercontent.com/u/18008498?v=4
274139745,dotfiles,ChristianLempa/dotfiles,Shell,33,"This contain my personal config files. Here you'll find configs, customizations, themes, and whatever I need to personalize my Linux and mac OS experience.",198,394,https://avatars.githubusercontent.com/u/28359525?u=0ebed3ab713fbe032d3bfe0223bf002498bb3138&v=4
563942703,RedditWritesCode,RedditWritesCode/RedditWritesCode,Python,19,"The mirror of the series ""The most upvoted comment picks the next line of code"" on Reddit by https://www.reddit.com/user/AggravatingCorner133/",16,188,https://avatars.githubusercontent.com/u/117850315?v=4
565013029,GiveMeBadge,AlexFlipnote/GiveMeBadge,Python,49,Pretty simple Discord bot to get the active developer badge,47,174,https://avatars.githubusercontent.com/u/19587382?u=5c3e26891cc14ea17392fcde9b7b74e611e96679&v=4
