id,name,full_name,language,new stars,description,forks_count,stargazers_count,avatar_url
49609581,PowerShell,PowerShell/PowerShell,C#,26,PowerShell for every system!,6003,35615,https://avatars.githubusercontent.com/u/11524380?v=4
17620347,aspnetcore,dotnet/aspnetcore,C#,18,"ASP.NET Core is a cross-platform .NET framework for building modern cloud-based web applications on Windows, Mac, or Linux.",8398,29954,https://avatars.githubusercontent.com/u/9141961?v=4
38380854,dnSpy,dnSpy/dnSpy,C#,12,.NET debugger and assembly editor,4294,21959,https://avatars.githubusercontent.com/u/67931932?v=4
69662720,WaveFunctionCollapse,mxgmn/WaveFunctionCollapse,C#,10,Bitmap & tilemap generation from a single example with the help of ideas from quantum mechanics,1069,20100,https://avatars.githubusercontent.com/u/14931730?u=2a63214b1fe8ce6058b4be7e19ed1199d814f7eb&v=4
262395224,maui,dotnet/maui,C#,11,".NET MAUI is the .NET Multi-platform App UI, a framework for building native device applications spanning mobile, tablet, and desktop.",1092,17323,https://avatars.githubusercontent.com/u/9141961?v=4
29078997,roslyn,dotnet/roslyn,C#,9,The Roslyn .NET compiler provides C# and Visual Basic languages with rich code analysis APIs.,3738,16546,https://avatars.githubusercontent.com/u/9141961?v=4
102904613,ml-agents,Unity-Technologies/ml-agents,C#,5,The Unity Machine Learning Agents Toolkit (ML-Agents) is an open-source project that enables games and simulations to serve as environments for training intelligent agents using deep reinforcement learning and imitation learning.,3588,13515,https://avatars.githubusercontent.com/u/426196?v=4
30474266,MaterialDesignInXamlToolkit,MaterialDesignInXAML/MaterialDesignInXamlToolkit,C#,6,"Google's Material Design in XAML & WPF, for C# & VB.Net. ",3118,12846,https://avatars.githubusercontent.com/u/16655083?v=4
16157746,efcore,dotnet/efcore,C#,4,"EF Core is a modern object-database mapper for .NET. It supports LINQ queries, change tracking, updates, and schema migrations.",2834,11834,https://avatars.githubusercontent.com/u/9141961?v=4
28239455,AspNetCore.Docs,dotnet/AspNetCore.Docs,C#,3,Documentation for ASP.NET Core,24884,11020,https://avatars.githubusercontent.com/u/9141961?v=4
75990888,csharplang,dotnet/csharplang,C#,5,The official repo for the design of the C# programming language,957,9304,https://avatars.githubusercontent.com/u/9141961?v=4
135050219,CMWTAT_Digital_Edition,TGSAN/CMWTAT_Digital_Edition,C#,32,"CloudMoe Windows 10/11 Activation Toolkit get digital license, the best open source Win 10/11 activator in GitHub. GitHub 上最棒的开源 Win10/Win11 数字权利（数字许可证）激活工具！",1420,9068,https://avatars.githubusercontent.com/u/7440847?u=9a04b599cc7d75db6aa271e76d4a7d5ac722661b&v=4
46652227,IdentityServer4,IdentityServer/IdentityServer4,C#,0,OpenID Connect and OAuth 2.0 Framework for ASP.NET Core,3682,8875,https://avatars.githubusercontent.com/u/10635672?v=4
1579990,MonoGame,MonoGame/MonoGame,C#,8,One framework for creating powerful cross-platform games.,2646,8865,https://avatars.githubusercontent.com/u/4772066?v=4
743436,ET,egametang/ET,C#,1,Unity3D Client And C# Server Framework,2380,6318,https://avatars.githubusercontent.com/u/315758?v=4
26884725,OrchardCore,OrchardCMS/OrchardCore,C#,3,"Orchard Core is an open-source modular and multi-tenant application framework built with ASP.NET Core, and a content management system (CMS) built on top of that framework.",2060,6166,https://avatars.githubusercontent.com/u/1159247?v=4
778828,MassTransit,MassTransit/MassTransit,C#,3,Distributed Application Framework for .NET,1389,4881,https://avatars.githubusercontent.com/u/317796?v=4
32304121,Swashbuckle.AspNetCore,domaindrivendev/Swashbuckle.AspNetCore,C#,4,Swagger tools for documenting API's built on ASP.NET Core,1157,4575,https://avatars.githubusercontent.com/u/1434343?v=4
16473585,subtitleedit,SubtitleEdit/subtitleedit,C#,8,the subtitle editor :),644,4366,https://avatars.githubusercontent.com/u/3008853?v=4
85242321,MQTTnet,dotnet/MQTTnet,C#,4,MQTTnet is a high performance .NET library for MQTT based communication. It provides a MQTT client and a MQTT server (broker). The implementation is based on the documentation from http://mqtt.org/.,820,3133,https://avatars.githubusercontent.com/u/9141961?v=4
80280403,EventSourcing.NetCore,oskardudycz/EventSourcing.NetCore,C#,14,Examples and Tutorials of Event Sourcing in .NET,385,2523,https://avatars.githubusercontent.com/u/5562528?u=decd12aa824a26a72a9685b64ba5612823d0d0c1&v=4
170988906,testcontainers-dotnet,testcontainers/testcontainers-dotnet,C#,10,🐋 A library to support tests with throwaway instances of Docker containers for all compatible .NET Standard versions.,116,2175,https://avatars.githubusercontent.com/u/13393021?v=4
255952484,maui-samples,dotnet/maui-samples,C#,4,Samples for .NET Multi-Platform App UI (.NET MAUI),471,1670,https://avatars.githubusercontent.com/u/9141961?v=4
173170791,SqlClient,dotnet/SqlClient,C#,0,Microsoft.Data.SqlClient provides database connectivity to SQL Server for .NET applications.,191,650,https://avatars.githubusercontent.com/u/9141961?v=4
63505193,EdBPrepareCarefully,edbmods/EdBPrepareCarefully,C#,1,"EdB Prepare Carefully, a RimWorld mod",73,183,https://avatars.githubusercontent.com/u/20495331?v=4
