id,name,full_name,language,new stars,description,forks_count,stargazers_count,avatar_url
15452919,go-ethereum,ethereum/go-ethereum,Go,21,Official Go implementation of the Ethereum protocol,15239,39890,https://avatars.githubusercontent.com/u/6250754?v=4
13855476,gorm,go-gorm/gorm,Go,13,"The fantastic ORM library for Golang, aims to be developer friendly",3359,30092,https://avatars.githubusercontent.com/u/15127678?v=4
12574344,cobra,spf13/cobra,Go,21,A Commander for modern Go CLI interactions,2529,29177,https://avatars.githubusercontent.com/u/173412?u=4865036ec60149f8354adcae563ff5cba01e0022&v=4
97533102,LeetCode-Go,halfrost/LeetCode-Go,Go,171,"✅ Solutions to LeetCode by Go, 100% test coverage, runtime beats 100% / LeetCode 题解",5029,27472,https://avatars.githubusercontent.com/u/10825609?u=03334ecb4f5215e795ed600b655acd597945d4f9&v=4
6247705,testify,stretchr/testify,Go,19,A toolkit with common assertions and mocks that plays nicely with the standard library,1349,17955,https://avatars.githubusercontent.com/u/1841476?v=4
5179099,redis,go-redis/redis,Go,13,Type-safe Redis client for Golang,1905,15687,https://avatars.githubusercontent.com/u/7314137?v=4
180687624,trivy,aquasecurity/trivy,Go,22,"Find vulnerabilities, misconfigurations, secrets, SBOM in containers, Kubernetes, code repositories, clouds and more",1385,14374,https://avatars.githubusercontent.com/u/12783832?v=4
434218673,zinc,zinclabs/zinc,Go,12,"ZincSearch. A lightweight alternative to elasticsearch that requires minimal resources, written in Go.",531,12548,https://avatars.githubusercontent.com/u/95867656?v=4
311315731,Xray-core,XTLS/Xray-core,Go,27,"Xray, Penetrates Everything. Also the best v2ray-core, with XTLS support. Fully compatible configuration.",1702,10172,https://avatars.githubusercontent.com/u/71564206?v=4
367284699,lima,lima-vm/lima,Go,16,"Linux virtual machines, typically on macOS, for running containerd",366,9564,https://avatars.githubusercontent.com/u/88128539?v=4
48714685,opa,open-policy-agent/opa,Go,6,"An open source, general-purpose policy engine.",1005,7281,https://avatars.githubusercontent.com/u/16468693?v=4
12332444,ginkgo,onsi/ginkgo,Go,8,A Modern Testing Framework for Go,578,6480,https://avatars.githubusercontent.com/u/558230?v=4
273132277,HackBrowserData,moonD4rk/HackBrowserData,Go,88,Decrypt passwords/cookies/history/bookmarks from the browser. 一款可全平台运行的浏览器数据导出解密工具。,1074,6327,https://avatars.githubusercontent.com/u/24284231?u=df5b9751ca9d5fabe3a2119f10dbb6e3acef3ced&v=4
281694167,go-cqhttp,Mrs4s/go-cqhttp,Go,8,cqhttp的golang实现，轻量、原生跨平台.,1109,6132,https://avatars.githubusercontent.com/u/12137562?u=addd9d7564252ea47f8a8bef317a72a908cbe0c6&v=4
248025303,trojan-go,p4gefau1t/trojan-go,Go,14,Go实现的Trojan代理，支持多路复用/路由功能/CDN中转/Shadowsocks混淆插件，多平台，无依赖。A Trojan proxy written in Go. An unidentifiable mechanism that helps you bypass GFW. https://p4gefau1t.github.io/trojan-go/,1255,5323,https://avatars.githubusercontent.com/u/61629127?u=6200458a3275c3aa43ea98015cd059d018a68ebb&v=4
173785481,tfsec,aquasecurity/tfsec,Go,9,Security scanner for your Terraform code,456,5250,https://avatars.githubusercontent.com/u/12783832?v=4
206649463,ebpf,cilium/ebpf,Go,6,"ebpf-go is a pure-Go library to read, modify and load eBPF programs and attach them to various hooks in the Linux kernel.",383,3488,https://avatars.githubusercontent.com/u/21054566?v=4
103084166,terrascan,tenable/terrascan,Go,44,Detect compliance and security violations across Infrastructure as Code to mitigate risk before provisioning cloud native infrastructure.,408,3424,https://avatars.githubusercontent.com/u/2379954?v=4
187086161,opentelemetry-go,open-telemetry/opentelemetry-go,Go,3,OpenTelemetry Go API and SDK,724,3202,https://avatars.githubusercontent.com/u/49998002?v=4
209313689,tracee,aquasecurity/tracee,Go,8,Linux Runtime Security and Forensics using eBPF,275,2228,https://avatars.githubusercontent.com/u/12783832?v=4
96004375,aws-sdk-go-v2,aws/aws-sdk-go-v2,Go,1,AWS SDK for the Go programming language. ,445,1654,https://avatars.githubusercontent.com/u/2232217?v=4
80669528,ddev,drud/ddev,Go,3,DDEV: a local web development environment system for PHP,403,1498,https://avatars.githubusercontent.com/u/8115114?v=4
27382506,pp,k0kubun/pp,Go,20,Colored pretty printer for Go language,89,1468,https://avatars.githubusercontent.com/u/3138447?u=70c28d335d4ccc04ea99fb5fce207cf3f0960c79&v=4
98185104,retry-go,avast/retry-go,Go,27,Simple golang library for retry mechanism,106,1145,https://avatars.githubusercontent.com/u/3996079?v=4
502127166,guac,guacsec/guac,Go,60,,30,345,https://avatars.githubusercontent.com/u/111393891?v=4
