id,name,full_name,language,new stars,description,forks_count,stargazers_count,avatar_url
88011908,project-based-learning,practical-tutorials/project-based-learning,,19960,Curated list of project-based tutorials,20131,149188,https://avatars.githubusercontent.com/u/89421154?v=4
585146387,ui,shadcn-ui/ui,TypeScript,6151,Beautifully designed components that you can copy and paste into your apps. Accessible. Customizable. Open Source.,2187,42801,https://avatars.githubusercontent.com/u/139895814?v=4
152870372,weekly,ruanyf/weekly,,1772,ç§‘æŠ€çˆ±å¥½è€…å‘¨åˆŠï¼Œæ¯å‘¨äº”å‘å¸ƒ,2637,39210,https://avatars.githubusercontent.com/u/905434?v=4
658928958,ollama,jmorganca/ollama,Go,9574,"Get up and running with Llama 2, Mistral, and other large language models locally.",2028,30720,https://avatars.githubusercontent.com/u/251292?u=a7465aae734d2cbc12d26b885b07d466d969bf0c&v=4
612640604,chatbot-ui,mckaywrigley/chatbot-ui,TypeScript,2701,The open-source AI chat app for everyone.,6092,21842,https://avatars.githubusercontent.com/u/29221284?u=98e2a4c4c09bdf1ddd625ea8e4417907ea29122a&v=4
679237742,gpt-pilot,Pythagora-io/gpt-pilot,Python,5368,Dev tool that writes scalable apps from scratch while the developer oversees the implementation,1744,20381,https://avatars.githubusercontent.com/u/123263103?v=4
643445235,lobe-chat,lobehub/lobe-chat,TypeScript,12104,"ğŸ¤– Lobe Chat - an open-source, high-performance chatbot framework that supports speech synthesis, multimodal, and extensible Function Call plugin system. Supports one-click free deployment of your private ChatGPT/LLM web application.",3084,16245,https://avatars.githubusercontent.com/u/131470832?v=4
594155488,Stirling-PDF,Stirling-Tools/Stirling-PDF,Java,10853,locally hosted web application that allows you to perform various operations on PDF files,1042,15649,https://avatars.githubusercontent.com/u/139791695?v=4
717413801,deploy,pandora-next/deploy,PHP,4718,"Pandora Cloud + Pandora Server + Shared Chat + BackendAPI Proxy + Chat2API + Signup Free = PandoraNext. New GPTs(Gizmo) UI, All in one!",1825,9442,https://avatars.githubusercontent.com/u/150411794?v=4
631254164,one-api,songquanpeng/one-api,JavaScript,1883,"OpenAI æ¥å£ç®¡ç† & åˆ†å‘ç³»ç»Ÿï¼Œæ”¯æŒ Azureã€Anthropic Claudeã€Google PaLM 2 & Geminiã€æ™ºè°± ChatGLMã€ç™¾åº¦æ–‡å¿ƒä¸€è¨€ã€è®¯é£æ˜Ÿç«è®¤çŸ¥ã€é˜¿é‡Œé€šä¹‰åƒé—®ã€360 æ™ºè„‘ä»¥åŠè…¾è®¯æ··å…ƒï¼Œå¯ç”¨äºäºŒæ¬¡åˆ†å‘ç®¡ç† keyï¼Œä»…å•å¯æ‰§è¡Œæ–‡ä»¶ï¼Œå·²æ‰“åŒ…å¥½ Docker é•œåƒï¼Œä¸€é”®éƒ¨ç½²ï¼Œå¼€ç®±å³ç”¨. OpenAI key management & redistribution system, using a single API for all LLMs, and features an English UI.",2196,8632,https://avatars.githubusercontent.com/u/39998050?v=4
649170660,anything-llm,Mintplex-Labs/anything-llm,JavaScript,4093,"Open-source ChatGPT experience for LLMs, embedders, and vector databases. Unlimited documents, messages, and concurrent users with permission management in one app.",776,7298,https://avatars.githubusercontent.com/u/134426827?v=4
576303915,KernelSU,tiann/KernelSU,Kotlin,755,A Kernel based root solution for Android,1455,6161,https://avatars.githubusercontent.com/u/4233744?u=bed71e3bdd9bd03bc2220ad89b7284c37dea3a86&v=4
633262635,danswer,danswer-ai/danswer,Python,1338,"Ask Questions in natural language and get Answers backed by private sources. Connects to tools like Slack, GitHub, Confluence, etc.",615,6141,https://avatars.githubusercontent.com/u/131946000?v=4
686267501,TinyLlama,jzhang38/TinyLlama,Python,1671,The TinyLlama project is an open endeavor to pretrain a 1.1B Llama model on 3 trillion tokens.,257,5192,https://avatars.githubusercontent.com/u/42993249?v=4
720798474,clone-voice,jianchang512/clone-voice,Python,3271,"A sound cloning tool with a web interface, using your voice or any sound to record audio / ä¸€ä¸ªå¸¦webç•Œé¢çš„å£°éŸ³å…‹éš†å·¥å…·ï¼Œä½¿ç”¨ä½ çš„éŸ³è‰²æˆ–ä»»æ„å£°éŸ³æ¥å½•åˆ¶éŸ³é¢‘",406,4813,https://avatars.githubusercontent.com/u/3378335?u=adc6504fe417784164e64a857edd4256b56dd84d&v=4
636693030,generative-ai,GoogleCloudPlatform/generative-ai,Jupyter Notebook,1340,Sample code and notebooks for Generative AI on Google Cloud,872,3959,https://avatars.githubusercontent.com/u/2810941?v=4
701547123,ollama-webui,ollama-webui/ollama-webui,Svelte,1944,ChatGPT-Style Web UI Client for Ollama ğŸ¦™,306,3343,https://avatars.githubusercontent.com/u/147204191?v=4
663667786,Rope,Hillobar/Rope,Python,1358,GUI-focused roop,285,2043,https://avatars.githubusercontent.com/u/63615199?v=4
726894177,assignments,100xdevs-cohort-2/assignments,JavaScript,625,,2721,1388,https://avatars.githubusercontent.com/u/152806972?v=4
