id,name,full_name,language,new stars,description,forks_count,stargazers_count,avatar_url
574523116,awesome-chatgpt-prompts,f/awesome-chatgpt-prompts,HTML,3776,This repo includes ChatGPT prompt curation to use ChatGPT and other LLM tools better.,16171,120089,https://avatars.githubusercontent.com/u/196477?u=771bf9010ad2c32fe13ff71ceaad5563fc2824d3&v=4
119811010,tabler,tabler/tabler,HTML,351,Tabler is free and open-source HTML Dashboard UI Kit built on Bootstrap,4058,38641,https://avatars.githubusercontent.com/u/35471246?v=4
109484365,Coursera-ML-AndrewNg-Notes,fengdu78/Coursera-ML-AndrewNg-Notes,HTML,322,吴恩达老师的机器学习课程个人笔记,10728,32799,https://avatars.githubusercontent.com/u/26119052?u=64357994632ab7e6be27e8a6549727e5bee3c077&v=4
75867720,JavaScript30,wesbos/JavaScript30,HTML,148,30 Day Vanilla JS Challenge,38718,28024,https://avatars.githubusercontent.com/u/176013?u=1d436e62dc32dbbf1bfefb4d658cd67553154c42&v=4
113552697,deeplearning_ai_books,fengdu78/deeplearning_ai_books,HTML,162,deeplearning.ai（吴恩达老师的深度学习课程笔记及资源）,5946,18517,https://avatars.githubusercontent.com/u/26119052?u=64357994632ab7e6be27e8a6549727e5bee3c077&v=4
246128823,html-css,gustavoguanabara/html-css,HTML,243,Curso de HTML5 e CSS3,3449,14367,https://avatars.githubusercontent.com/u/8683378?u=01b06a154f04dadaa4e4131497fa2442e6323cbc&v=4
10267810,minimal-mistakes,mmistakes/minimal-mistakes,HTML,128,":triangular_ruler: Jekyll theme for building a personal site, blog, project documentation, or portfolio.",26072,12684,https://avatars.githubusercontent.com/u/1376749?u=57b84c6b694342dbc9aad20579ebc31de309126f&v=4
7590028,boost,boostorg/boost,HTML,87,Super-project for modularized Boost,1790,7400,https://avatars.githubusercontent.com/u/3170529?v=4
125241352,tidytuesday,rfordatascience/tidytuesday,HTML,96,Official repo for the #tidytuesday project,2428,7118,https://avatars.githubusercontent.com/u/31736571?v=4
832452447,midscene,web-infra-dev/midscene,HTML,3332,Let AI be your browser operator.,319,5958,https://avatars.githubusercontent.com/u/87694465?v=4
56346088,Chicago95,grassmunk/Chicago95,HTML,77,A rendition of everyone's favorite 1995 Microsoft operating system for Linux. ,162,4714,https://avatars.githubusercontent.com/u/3452173?u=0786a3813b099a94ddbce1a67fe4d3cb3a5919fb&v=4
31028375,django-DefectDojo,DefectDojo/django-DefectDojo,HTML,62," DevSecOps, ASPM, Vulnerability Management. All on one platform.",1601,3861,https://avatars.githubusercontent.com/u/35606478?v=4
560236194,zoraxy,tobychui/zoraxy,HTML,389,A general purpose HTTP reverse proxy and forwarding tool. Now written in Go!,201,3668,https://avatars.githubusercontent.com/u/24617523?u=0c296d98ddbab7f6224d14246fbdf60b2612fdb9&v=4
752840454,ollama-docker,valiantlynx/ollama-docker,HTML,141,"Welcome to the Ollama Docker Compose Setup! This project simplifies the deployment of Ollama using Docker Compose, making it easy to run Ollama with all its dependencies in a containerized environment",174,848,https://avatars.githubusercontent.com/u/86688436?u=5b26af092e7c31cd5623c8e2278eddd8037550e0&v=4
734739273,Evil-M5Project,7h30th3r0n3/Evil-M5Project,HTML,148,"Evil-M5Project is an innovative tool developed for ethical testing and exploration of WiFi networks. It's compatible with Cardputer, Atoms3, Fire, core2. You can scan, monitor, and interact with WiFi networks in a controlled environment. This project is designed for educational purposes, aiding in understanding network security and vulnerabilities.",68,776,https://avatars.githubusercontent.com/u/75809682?u=f960da7ac3c5c695a5affb1c1e6a00b7acbcbc9f&v=4
842211213,git-github,platzi/git-github,HTML,107,Repositorio del Curso de Git y GitHub,307,233,https://avatars.githubusercontent.com/u/2975064?v=4
