id,name,full_name,language,new stars,description,forks_count,stargazers_count,avatar_url
2325298,linux,torvalds/linux,C,404,Linux kernel source tree,41080,125543,https://avatars.githubusercontent.com/u/1024025?v=4
10744183,netdata,netdata/netdata,C,17,"Real-time performance monitoring, done right! https://www.netdata.cloud",5161,57514,https://avatars.githubusercontent.com/u/43390781?v=4
36502,git,git/git,C,20,Git Source Code Mirror - This is a publish-only repository but pull requests can be turned into patches to the mailing list via GitGitGadget (https://gitgitgadget.github.io/). Please follow Documentation/SubmittingPatches procedure for any of your improvements.,22866,40890,https://avatars.githubusercontent.com/u/18133?v=4
13233158,obs-studio,obsproject/obs-studio,C,72,OBS Studio - Free and open source software for live streaming and screen recording,5566,35446,https://avatars.githubusercontent.com/u/7725691?v=4
5101141,jq,stedolan/jq,C,10,Command-line JSON processor,1254,21200,https://avatars.githubusercontent.com/u/79765?v=4
7634677,openssl,openssl/openssl,C,5,TLS/SSL and crypto library,7647,17470,https://avatars.githubusercontent.com/u/3279138?v=4
18496166,mimikatz,gentilkiwi/mimikatz,C,10,A little tool to play with Windows security,2943,14785,https://avatars.githubusercontent.com/u/2307945?v=4
13836499,raylib,raysan5/raylib,C,8,A simple and easy-to-use library to enjoy videogames programming,1024,8503,https://avatars.githubusercontent.com/u/5766837?u=28d52cd1077b2f8b48d3897e82f03280a565e8d6&v=4
69828680,Mirai-Source-Code,jgamblin/Mirai-Source-Code,C,11,Leaked Mirai Source Code for Research/IoC Development Purposes,3308,7153,https://avatars.githubusercontent.com/u/8428124?u=f58823b5fceca7d5479e73fa726f83e78e42df7b&v=4
5870069,librdkafka,edenhill/librdkafka,C,2,The Apache Kafka C/C++ library,2566,5705,https://avatars.githubusercontent.com/u/524990?v=4
241659610,itlwm,OpenIntelWireless/itlwm,C,3,Intel Wi-Fi Drivers for macOS,514,5238,https://avatars.githubusercontent.com/u/67850724?v=4
29933948,fluent-bit,fluent/fluent-bit,C,2,"Fast and Lightweight Logs and Metrics processor for Linux, BSD, OSX and Windows",955,3294,https://avatars.githubusercontent.com/u/859518?v=4
114948816,h3,uber/h3,C,4,Hexagonal hierarchical geospatial indexing system,321,3243,https://avatars.githubusercontent.com/u/538264?v=4
214011414,WindTerm,kingToolbox/WindTerm,C,7,A professional cross-platform SSH/Sftp/Shell/Telnet/Serial terminal.,207,3185,https://avatars.githubusercontent.com/u/51009775?v=4
330008801,SDL,libsdl-org/SDL,C,9,Simple Directmedia Layer,485,2513,https://avatars.githubusercontent.com/u/77683370?v=4
3276860,Unity,ThrowTheSwitch/Unity,C,2,Simple Unit Testing for C,702,2308,https://avatars.githubusercontent.com/u/1049138?v=4
204459250,xv6-riscv,mit-pdos/xv6-riscv,C,6,Xv6 for RISC-V,639,2092,https://avatars.githubusercontent.com/u/12404246?v=4
334777857,airyx,mszoek/airyx,C,205,A BSD-based OS project that aims to provide an experience like and some compatibility with macOS,60,1951,https://avatars.githubusercontent.com/u/60144291?u=09457716dc284aef6c99b4155d73c375010f5519&v=4
96348842,dpdk,DPDK/dpdk,C,3,Data Plane Development Kit,764,1673,https://avatars.githubusercontent.com/u/29926404?v=4
452081015,CVE-2021-4034,berdav/CVE-2021-4034,C,144,CVE-2021-4034 1day,263,912,https://avatars.githubusercontent.com/u/1332095?v=4
80314213,libexpat,libexpat/libexpat,C,3,:herb: Expat library: Fast streaming XML parser written in C99; in the process of migrating from SourceForge to GitHub,348,687,https://avatars.githubusercontent.com/u/20887397?v=4
452094681,CVE-2021-4034,arthepsy/CVE-2021-4034,C,101,PoC for PwnKit: Local Privilege Escalation Vulnerability in polkit’s pkexec (CVE-2021-4034),185,589,https://avatars.githubusercontent.com/u/7356025?u=4bf80d665e0f24d1a7126a23c52208d3a0ed8dc9&v=4
452306200,PwnKit,ly4k/PwnKit,C,79,Self-contained exploit for CVE-2021-4034 - Pkexec Local Privilege Escalation,41,244,https://avatars.githubusercontent.com/u/53348818?u=f4a80365b2ed2780ae5697600f6733846066c4c7&v=4
448868245,kernel_new_features,0voice/kernel_new_features,C,18,"一个深挖 Linux 内核的新功能特性，以 io_uring, cgroup, ebpf, llvm 为代表，包含开源项目，代码案例，文章，视频，架构脑图等",23,193,https://avatars.githubusercontent.com/u/43104160?v=4
452072547,CVE-2021-4034,ryaagard/CVE-2021-4034,C,6,Local Privilege Escalation in polkit's pkexec,22,37,https://avatars.githubusercontent.com/u/46634151?u=d869ce0da722765b63eb01c40a36861a5b3e21d1&v=4
