id,name,full_name,language,new stars,description,forks_count,stargazers_count,avatar_url
49609581,PowerShell,PowerShell/PowerShell,C#,1183,PowerShell for every system!,7347,39853,https://avatars.githubusercontent.com/u/11524380?v=4
17620347,aspnetcore,dotnet/aspnetcore,C#,261,"ASP.NET Core is a cross-platform .NET framework for building modern cloud-based web applications on Windows, Mac, or Linux.",9208,32067,https://avatars.githubusercontent.com/u/9141961?v=4
164140756,Files,files-community/Files,C#,556,Building the best file manager experience for Windows,1824,28048,https://avatars.githubusercontent.com/u/65931357?v=4
70104825,eShopOnContainers,dotnet-architecture/eShopOnContainers,C#,477,"Cross-platform .NET sample microservices and container based application that runs on Linux Windows and macOS. Powered by .NET 7, Docker Containers and Azure Kubernetes Services. Supports Visual Studio, VS for Mac and CLI based environments with Docker CLI, dotnet CLI, VS Code or any other code editor.",10235,23801,https://avatars.githubusercontent.com/u/27453006?v=4
38380854,dnSpy,dnSpy/dnSpy,C#,195,.NET debugger and assembly editor,4624,23603,https://avatars.githubusercontent.com/u/67931932?v=4
262395224,maui,dotnet/maui,C#,166,".NET MAUI is the .NET Multi-platform App UI, a framework for building native device applications spanning mobile, tablet, and desktop.",1323,19172,https://avatars.githubusercontent.com/u/9141961?v=4
14964475,Avalonia,AvaloniaUI/Avalonia,C#,434,"Develop Desktop, Embedded, Mobile and WebAssembly apps with C# and XAML. The most popular .NET Foundation community project.",1571,18472,https://avatars.githubusercontent.com/u/14075148?v=4
29078997,roslyn,dotnet/roslyn,C#,142,The Roslyn .NET compiler provides C# and Visual Basic languages with rich code analysis APIs.,3901,17557,https://avatars.githubusercontent.com/u/9141961?v=4
321682465,SteamTools,BeyondDimension/SteamTools,C#,367,🛠「Watt Toolkit」是一个开源跨平台的多功能 Steam 工具箱。,875,14083,https://avatars.githubusercontent.com/u/79355691?v=4
30474266,MaterialDesignInXamlToolkit,MaterialDesignInXAML/MaterialDesignInXamlToolkit,C#,160,"Google's Material Design in XAML & WPF, for C# & VB.Net. ",3269,13716,https://avatars.githubusercontent.com/u/16655083?v=4
375939072,FastGithub,dotnetcore/FastGithub,C#,447,github加速神器，解决github打不开、用户头像无法加载、releases无法上传下载、git-clone、git-pull、git-push失败等问题,1787,13036,https://avatars.githubusercontent.com/u/19404084?v=4
213460285,CleanArchitecture,jasontaylordev/CleanArchitecture,C#,455,Clean Architecture Solution Template for ASP.NET Core,2819,12466,https://avatars.githubusercontent.com/u/1988321?u=a1c4449e215a2e4ea54a1a5787c01ca32add274a&v=4
210716005,runtime,dotnet/runtime,C#,209,".NET is a cross-platform runtime for cloud, mobile, desktop, and IoT apps.",4006,12197,https://avatars.githubusercontent.com/u/9141961?v=4
44897462,ArchiSteamFarm,JustArchiNET/ArchiSteamFarm,C#,139,C# application with primary purpose of farming Steam cards from multiple accounts simultaneously.,1011,9569,https://avatars.githubusercontent.com/u/40950157?v=4
18586705,nopCommerce,nopSolutions/nopCommerce,C#,81,ASP.NET Core eCommerce software. nopCommerce is a free and open-source shopping cart.,4688,8208,https://avatars.githubusercontent.com/u/7234683?v=4
125612271,EntityComponentSystemSamples,Unity-Technologies/EntityComponentSystemSamples,C#,242,,1350,5862,https://avatars.githubusercontent.com/u/426196?v=4
187499284,UniTask,Cysharp/UniTask,C#,147,Provides an efficient allocation free async/await integration for Unity.,599,5610,https://avatars.githubusercontent.com/u/44487420?v=4
288428676,MudBlazor,MudBlazor/MudBlazor,C#,170,Blazor Component Library based on Material design with an emphasis on ease of use. Mainly written in C# with Javascript kept to a bare minimum it empowers .NET developers to easily debug it if needed.,943,5568,https://avatars.githubusercontent.com/u/79755064?v=4
122837111,xdm,subhra74/xdm,C#,178,Powerfull download accelerator and video downloader,1017,5436,https://avatars.githubusercontent.com/u/8403090?v=4
100711978,btcpayserver,btcpayserver/btcpayserver,C#,162,"Accept Bitcoin payments. Free, open-source & self-hosted, Bitcoin payment processor. ",1266,5039,https://avatars.githubusercontent.com/u/31132886?v=4
158405551,git-credential-manager,git-ecosystem/git-credential-manager,C#,207,"Secure, cross-platform Git credential storage with authentication to GitHub, Azure Repos, and other popular Git hosting services.",1494,4646,https://avatars.githubusercontent.com/u/64464614?v=4
46884929,SteamDesktopAuthenticator,Jessecar96/SteamDesktopAuthenticator,C#,292,Desktop implementation of Steam's mobile authenticator app,602,2672,https://avatars.githubusercontent.com/u/1954840?u=2a9ad98a4365a67f9267a5a1bd85afd9d02b6c87&v=4
577665741,Redream,Fictiverse/Redream,C#,1288,"Realtime Diffusion, using Automatic1111 Stable Diffusion API",78,1551,https://avatars.githubusercontent.com/u/111762798?u=0661091adb1cb4a6ef1880b1aaf558bab700e43f&v=4
600246354,g-helper,seerge/g-helper,C#,418,"Lightweight Armoury Crate alternative for Asus laptops. Control tool for ROG Zephyrus G14, G15, G16, M16, Flow X13, Flow X16, TUF, Strix, Scar and other models",69,1407,https://avatars.githubusercontent.com/u/5920850?u=80e9cb264b3e5070554c2ddc3ece67df71804927&v=4
474724520,Rectify11Installer,MishaProductions/Rectify11Installer,C#,135,A Windows 11 modification to make Windows more consistent.,92,818,https://avatars.githubusercontent.com/u/106913236?u=f256dde6009db0487c5d4dc4061b932b1a5c7a72&v=4
