id,name,full_name,language,new stars,description,forks_count,stargazers_count,avatar_url
111583593,scrcpy,Genymobile/scrcpy,C,2917,Display and control your Android device,8932,87322,https://avatars.githubusercontent.com/u/3427627?v=4
10744183,netdata,netdata/netdata,C,428,"Real-time performance monitoring, done right! https://www.netdata.cloud",5578,63618,https://avatars.githubusercontent.com/u/43390781?v=4
246335987,Ventoy,ventoy/Ventoy,C,1199,A new bootable USB solution.,3641,50658,https://avatars.githubusercontent.com/u/59477474?u=16f38c14b69580f87f4717b71c0e5e85e9559cb1&v=4
13233158,obs-studio,obsproject/obs-studio,C,828,OBS Studio - Free and open source software for live streaming and screen recording,7000,48758,https://avatars.githubusercontent.com/u/7725691?v=4
1614410,FFmpeg,FFmpeg/FFmpeg,C,614,Mirror of https://git.ffmpeg.org/ffmpeg.git,11083,37101,https://avatars.githubusercontent.com/u/729418?v=4
1903522,php-src,php/php-src,C,148,The PHP Interpreter,7580,35635,https://avatars.githubusercontent.com/u/25158?v=4
612354784,llama.cpp,ggerganov/llama.cpp,C,4171,Port of Facebook's LLaMA model in C/C++,4756,33845,https://avatars.githubusercontent.com/u/1991296?u=28314d364d7c28f8ec232fadb767970d3ad74e7b&v=4
7634677,openssl,openssl/openssl,C,341,TLS/SSL and crypto library,9714,22126,https://avatars.githubusercontent.com/u/3279138?v=4
14812739,libuv,libuv/libuv,C,215,Cross-platform asynchronous I/O,3409,21797,https://avatars.githubusercontent.com/u/4030929?v=4
60667730,lvgl,lvgl/lvgl,C,221,"Embedded graphics library to create beautiful UIs for any MCU, MPU and display type. It's boosted by a professional yet affordable drag and drop UI editor, called SquareLine Studio.",2517,12351,https://avatars.githubusercontent.com/u/19811762?v=4
3299208,vlc,videolan/vlc,C,159,"VLC media player - All pull requests are ignored, please follow https://wiki.videolan.org/Sending_Patches_VLC/",4012,11119,https://avatars.githubusercontent.com/u/1389585?v=4
39242894,coturn,coturn/coturn,C,140,coturn TURN server project,1823,9361,https://avatars.githubusercontent.com/u/6572098?v=4
50824485,systeminformer,winsiderss/systeminformer,C,216,"A free, powerful, multi-purpose tool that helps you monitor system resources, debug software and detect malware. Brought to you by Winsider Seminars & Solutions, Inc. @ http://www.windows-internals.com",1232,9105,https://avatars.githubusercontent.com/u/105516054?v=4
1979797,FreeRDP,FreeRDP/FreeRDP,C,134,FreeRDP is a free remote desktop protocol library and clients,23175,8413,https://avatars.githubusercontent.com/u/663376?v=4
59771425,zephyr,zephyrproject-rtos/zephyr,C,197,"Primary Git Repository for the Zephyr Project. Zephyr is a new generation, scalable, optimized, secure RTOS for multiple hardware architectures.",4978,7989,https://avatars.githubusercontent.com/u/19595895?v=4
5870069,librdkafka,confluentinc/librdkafka,C,81,The Apache Kafka C/C++ library,3115,6780,https://avatars.githubusercontent.com/u/9439498?v=4
40556106,wazuh,wazuh/wazuh,C,143,Wazuh - The Open Source Security Platform. Unified XDR and SIEM protection for endpoints and cloud workloads.,1066,6195,https://avatars.githubusercontent.com/u/13752566?v=4
538180525,ggml,ggerganov/ggml,C,2630,Tensor library for machine learning,511,5367,https://avatars.githubusercontent.com/u/1991296?u=28314d364d7c28f8ec232fadb767970d3ad74e7b&v=4
1286805,OpenBLAS,xianyi/OpenBLAS,C,86,OpenBLAS is an optimized BLAS library based on GotoBLAS2 1.13 BSD version. ,1326,5327,https://avatars.githubusercontent.com/u/371600?v=4
359952601,pgvector,pgvector/pgvector,C,755,Open-source vector similarity search for Postgres,161,4450,https://avatars.githubusercontent.com/u/98363230?v=4
6687936,mbedtls,Mbed-TLS/mbedtls,C,67,"An open source, portable, easy to use, readable and flexible TLS library, and reference implementation of the PSA Cryptography API. Releases are on a varying cadence, typically around 3 - 6 months between releases.",2307,4276,https://avatars.githubusercontent.com/u/97226525?v=4
26537135,u-boot,u-boot/u-boot,C,80,"""Das U-Boot"" Source Tree",2999,2972,https://avatars.githubusercontent.com/u/9681997?v=4
207354223,FreeRTOS-Kernel,FreeRTOS/FreeRTOS-Kernel,C,55,"FreeRTOS kernel files only, submoduled into https://github.com/FreeRTOS/FreeRTOS and various other repos.",826,1748,https://avatars.githubusercontent.com/u/54647343?v=4
505613691,Onion,OnionUI/Onion,C,226,OS overhaul for Miyoo Mini ,90,1620,https://avatars.githubusercontent.com/u/109221246?v=4
636004047,DelugeFirmware,SynthstromAudible/DelugeFirmware,C,264,,53,301,https://avatars.githubusercontent.com/u/132480762?v=4
