id,name,full_name,language,new stars,description,forks_count,stargazers_count,avatar_url
29028775,react-native,facebook/react-native,C++,147,A framework for building native applications using React,24449,120247,https://avatars.githubusercontent.com/u/69631?v=4
100060912,terminal,microsoft/terminal,C++,130,"The new Windows Terminal and the original Windows console host, all in the same place!",8416,96552,https://avatars.githubusercontent.com/u/6154722?v=4
612354784,llama.cpp,ggerganov/llama.cpp,C++,470,LLM inference in C/C++,10309,71196,https://avatars.githubusercontent.com/u/1991296?u=28314d364d7c28f8ec232fadb767970d3ad74e7b&v=4
23357588,protobuf,protocolbuffers/protobuf,C++,92,Protocol Buffers - Google's data interchange format,15593,66396,https://avatars.githubusercontent.com/u/26310541?v=4
22887094,tesseract,tesseract-ocr/tesseract,C++,186,Tesseract Open Source OCR Engine (main repository),9650,64017,https://avatars.githubusercontent.com/u/8401422?v=4
98771110,TrafficMonitor,zhongyang219/TrafficMonitor,C++,263,è¿™æ˜¯ä¸€ä¸ªç”¨äºæ˜¾ç¤ºå½“å‰ç½‘é€Ÿã€CPUåŠå†…å­˜åˆ©ç”¨ç‡çš„æ¡Œé¢æ‚¬æµ®çª—è½¯ä»¶ï¼Œå¹¶æ”¯æŒä»»åŠ¡æ æ˜¾ç¤ºï¼Œæ”¯æŒæ›´æ¢çš®è‚¤ã€‚,3320,36077,https://avatars.githubusercontent.com/u/30562462?u=18ad9b9dfa6e784088d28deb7e0dbe830afcc0b7&v=4
39840932,googletest,google/googletest,C++,56,GoogleTest - Google Testing and Mocking Framework,10234,35349,https://avatars.githubusercontent.com/u/1342004?v=4
4524181,folly,facebook/folly,C++,237,An open-source C++ library developed and used at Facebook.,5633,28901,https://avatars.githubusercontent.com/u/69631?v=4
1217614,xbmc,xbmc/xbmc,C++,68,"Kodi is an award-winning free and open source home theater/media center software and entertainment hub for digital media. With its beautiful interface and powerful skinning engine, it's available for Android, BSD, Linux, macOS, iOS, tvOS and Windows.",6332,18838,https://avatars.githubusercontent.com/u/199122?v=4
27500243,libphonenumber,google/libphonenumber,C++,25,"Google's common Java, C++ and JavaScript library for parsing, formatting, and validating international phone numbers.",2084,16901,https://avatars.githubusercontent.com/u/1342004?v=4
556675672,shadPS4,shadps4-emu/shadPS4,C++,1398,"PlayStation 4 emulator for Windows, Linux and macOS written in C++",952,15259,https://avatars.githubusercontent.com/u/152868421?v=4
51905353,arrow,apache/arrow,C++,46,Apache Arrow is the universal columnar format and multi-language toolbox for fast data interchange and in-memory analytics,3600,14890,https://avatars.githubusercontent.com/u/47359?v=4
5909706,cpp-httplib,yhirose/cpp-httplib,C++,100,A C++ header-only HTTP/HTTPS server and client library,2348,13543,https://avatars.githubusercontent.com/u/357397?u=c537858a711fa4a23ac0d59903a97c6bfdc6b67c&v=4
11986447,xournalpp,xournalpp/xournalpp,C++,122,"Xournal++ is a handwriting notetaking software with PDF annotation support. Written in C++ with GTK3, supporting Linux (e.g. Ubuntu, Debian, Arch, SUSE), macOS and Windows 10. Supports pen input from devices such as Wacom Tablets.",843,11796,https://avatars.githubusercontent.com/u/5192682?v=4
40556106,wazuh,wazuh/wazuh,C++,71,Wazuh - The Open Source Security Platform. Unified XDR and SIEM protection for endpoints and cloud workloads.,1723,11517,https://avatars.githubusercontent.com/u/13752566?v=4
324829379,organicmaps,organicmaps/organicmaps,C++,53,"ğŸƒ Organic Maps is a free Android & iOS offline maps app for travelers, tourists, hikers, and cyclists. It uses crowd-sourced OpenStreetMap data and is developed with love by the community. No ads, no tracking, no data collection, no crapware. Please donate to support the development!",1005,10368,https://avatars.githubusercontent.com/u/76659619?v=4
224908244,WasmEdge,WasmEdge/WasmEdge,C++,159,"WasmEdge is a lightweight, high-performance, and extensible WebAssembly runtime for cloud native, edge, and decentralized applications. It powers serverless apps, embedded functions, microservices, smart contracts, and IoT devices.",788,8898,https://avatars.githubusercontent.com/u/83329692?v=4
5298790,PX4-Autopilot,PX4/PX4-Autopilot,C++,37,PX4 Autopilot Software,13655,8823,https://avatars.githubusercontent.com/u/2096014?v=4
22660515,doctest,doctest/doctest,C++,17,The fastest feature-rich C++11/14/17/20/23 single-header testing framework,650,6074,https://avatars.githubusercontent.com/u/70880936?v=4
531380835,sherpa-onnx,k2-fsa/sherpa-onnx,C++,158,"Speech-to-text, text-to-speech, speaker diarization, and VAD using next-gen Kaldi with onnxruntime without Internet connection. Support embedded systems, Android, iOS, HarmonyOS, Raspberry Pi, RISC-V, x86_64 servers, websocket server/client, C/C++, Python, Kotlin, C#, Go, NodeJS, Java, Swift, Dart, JavaScript, Flutter, Object Pascal, Lazarus, Rust",506,4415,https://avatars.githubusercontent.com/u/71431748?v=4
206946371,ton,ton-blockchain/ton,C++,188,Main TON monorepo,1096,3398,https://avatars.githubusercontent.com/u/55018343?v=4
86362856,gtsam,borglab/gtsam,C++,17,"GTSAM is a library of C++ classes that implement smoothing and mapping (SAM) in robotics and vision, using factor graphs and Bayes networks as the underlying computing paradigm rather than sparse matrices.",791,2721,https://avatars.githubusercontent.com/u/26720769?v=4
279067598,Interview_DS_Algo,MAZHARMIK/Interview_DS_Algo,C++,64,Super Repository for Coding Interview Preperation,1104,2031,https://avatars.githubusercontent.com/u/17107752?u=801f3912768eba988dceebc72fe4c682a0feff34&v=4
603860295,Battery-Emulator,dalathegreat/Battery-Emulator,C++,28,This revolutionary software enables EV battery packs to be easily reused for stationary storage in combination with solar inverters,176,1254,https://avatars.githubusercontent.com/u/26695010?u=8dd905239bc7750f67e49fe935ad36d93fee2099&v=4
