id,name,full_name,language,new stars,description,forks_count,stargazers_count,avatar_url
23096959,go,golang/go,Go,362,The Go programming language,15739,107054,https://avatars.githubusercontent.com/u/4314092?v=4
7691631,moby,moby/moby,Go,99,Moby Project - a collaborative project for the container ecosystem to assemble container-based systems,18428,64808,https://avatars.githubusercontent.com/u/27259197?v=4
11180687,hugo,gohugoio/hugo,Go,133,The world’s fastest framework for building websites.,6943,64395,https://avatars.githubusercontent.com/u/29385237?v=4
17803236,rclone,rclone/rclone,Go,130,"""rsync for cloud storage"" - Google Drive, S3, Dropbox, Backblaze B2, One Drive, Swift, Hubic, Wasabi, Google Cloud Storage, Yandex Files",3313,36179,https://avatars.githubusercontent.com/u/24937341?v=4
133251103,dive,wagoodman/dive,Go,137,A tool for exploring each layer in a docker image,1402,35064,https://avatars.githubusercontent.com/u/590471?u=b78d631287f3a5422d8e1492f632965bb410c9bc&v=4
510607652,pocketbase,pocketbase/pocketbase,Go,1186,Open Source realtime backend in 1 file,695,18668,https://avatars.githubusercontent.com/u/101000011?v=4
13624859,websocket,gorilla/websocket,Go,40,"A fast, well-tested and widely used WebSocket implementation for Go.",3136,18627,https://avatars.githubusercontent.com/u/489566?v=4
72891330,ingress-nginx,kubernetes/ingress-nginx,Go,45,Ingress-NGINX Controller for Kubernetes,7356,14075,https://avatars.githubusercontent.com/u/13629408?v=4
48109239,cilium,cilium/cilium,Go,73,"eBPF-based Networking, Security, and Observability",1947,13884,https://avatars.githubusercontent.com/u/21054566?v=4
46089560,containerd,containerd/containerd,Go,57,An open and reliable container runtime,2620,12823,https://avatars.githubusercontent.com/u/14037953?v=4
30711774,validator,go-playground/validator,Go,115,":100:Go Struct and Field validation, including Cross Field, Cross Struct, Map, Slice and Array diving",1106,12149,https://avatars.githubusercontent.com/u/14768796?v=4
11206255,sarama,Shopify/sarama,Go,29,Sarama is a Go library for Apache Kafka.,1590,9476,https://avatars.githubusercontent.com/u/8085?v=4
193833307,listmonk,knadh/listmonk,Go,97,"High performance, self-hosted, newsletter and mailing list manager with a modern dashboard. Single binary app.",740,9165,https://avatars.githubusercontent.com/u/547147?u=b2b2d466d5344d6a5154edf7ddf5d077774aa413&v=4
154643390,phoneinfoga,sundowndev/phoneinfoga,Go,426,Information gathering framework for phone numbers,2462,8516,https://avatars.githubusercontent.com/u/16480203?u=736dd20996f73fe51ad2ee2c8dc058d9e89c7a69&v=4
193160679,sqlc,kyleconroy/sqlc,Go,81,Generate type-safe code from SQL,479,7038,https://avatars.githubusercontent.com/u/34893?u=2a72510548627c1bcb6fe6913429d876dcfa2f91&v=4
93808874,go-clean-arch,bxcodec/go-clean-arch,Go,44,Go (Golang) Clean Architecture based on Reading Uncle Bob's Clean Architecture,1015,6995,https://avatars.githubusercontent.com/u/11002383?v=4
27146054,tools,golang/tools,Go,23,[mirror] Go Tools,2130,6586,https://avatars.githubusercontent.com/u/4314092?v=4
542931741,answer,answerdev/answer,Go,524,"An open-source knowledge-based community software. You can use it quickly to build Q&A community for your products, customers, teams, and more.",259,5193,https://avatars.githubusercontent.com/u/114210575?v=4
230660669,rtsp-simple-server,aler9/rtsp-simple-server,Go,91,"ready-to-use RTSP / RTMP / LL-HLS / WebRTC server and proxy that allows to read, publish and proxy video and audio streams",728,4722,https://avatars.githubusercontent.com/u/46489434?u=4911ba7a1a2ed25e761d32dd756c92d76a3b3353&v=4
94702367,pdfcpu,pdfcpu/pdfcpu,Go,687,A PDF processor written in Go.,306,4221,https://avatars.githubusercontent.com/u/53127365?v=4
440752086,coder,coder/coder,Go,60,A tool that provisions remote development environments via Terraform,210,3078,https://avatars.githubusercontent.com/u/95932066?v=4
535304995,Havoc,HavocFramework/Havoc,Go,95,The Havoc Framework.,448,3062,https://avatars.githubusercontent.com/u/110123898?v=4
565629124,osv-scanner,google/osv-scanner,Go,577,Vulnerability scanner written in Go which uses the data provided by https://osv.dev,143,2864,https://avatars.githubusercontent.com/u/1342004?v=4
527578222,helm-dashboard,komodorio/helm-dashboard,Go,422,The missing UI for Helm - visualize your releases,108,2735,https://avatars.githubusercontent.com/u/60484489?v=4
575295397,aiac,gofireflyio/aiac,Go,139,Artificial Intelligence Infrastructure-as-Code Generator.,21,466,https://avatars.githubusercontent.com/u/100200663?v=4
