id,name,full_name,language,new stars,description,forks_count,stargazers_count,avatar_url
22790488,java-design-patterns,iluwatar/java-design-patterns,Java,10,Design patterns implemented in Java,26467,89534,https://avatars.githubusercontent.com/u/582346?u=7aecf4c397c8dffaf0b84bd4c9d4198290f00de1&v=4
63477660,Java,TheAlgorithms/Java,Java,23,All Algorithms implemented in Java,19065,58948,https://avatars.githubusercontent.com/u/20487725?v=4
1148753,spring-framework,spring-projects/spring-framework,Java,9,Spring Framework,38018,56332,https://avatars.githubusercontent.com/u/317776?v=4
133134007,openapi-generator,OpenAPITools/openapi-generator,Java,7,"OpenAPI Generator allows generation of API client libraries (SDK generation), server stubs, documentation and configuration automatically given an OpenAPI Spec (v2, v3)",6487,21453,https://avatars.githubusercontent.com/u/37325267?v=4
75164823,rocketmq,apache/rocketmq,Java,3,"Apache RocketMQ is a cloud native messaging and streaming platform, making it simple to build event-driven applications.",11644,21131,https://avatars.githubusercontent.com/u/47359?v=4
6358188,druid,apache/druid,Java,3,Apache Druid: a high performance real-time analytics database.,3690,13437,https://avatars.githubusercontent.com/u/47359?v=4
3148979,spring-security,spring-projects/spring-security,Java,4,Spring Security,5869,8745,https://avatars.githubusercontent.com/u/317776?v=4
50904245,beam,apache/beam,Java,2,Apache Beam is a unified programming model for Batch and Streaming data processing.,4231,7801,https://avatars.githubusercontent.com/u/47359?v=4
5244445,AntennaPod,AntennaPod/AntennaPod,Java,2,A podcast manager for Android,1396,6308,https://avatars.githubusercontent.com/u/10713470?v=4
961036,hibernate-orm,hibernate/hibernate-orm,Java,1,Hibernate's core Object/Relational Mapping functionality,3524,5910,https://avatars.githubusercontent.com/u/348262?v=4
4992906,pmd,pmd/pmd,Java,5,An extensible multilanguage static code analyzer.,1488,4833,https://avatars.githubusercontent.com/u/1958157?v=4
2019791,liquibase,liquibase/liquibase,Java,0,Main Liquibase Source,1846,4653,https://avatars.githubusercontent.com/u/438548?v=4
54298946,camunda,camunda/camunda,Java,2,Process Orchestration Framework,596,3267,https://avatars.githubusercontent.com/u/2443838?v=4
341631350,lucene,apache/lucene,Java,1,Apache Lucene open-source search software,1020,2614,https://avatars.githubusercontent.com/u/47359?v=4
298323699,vprofile-project,devopshydclub/vprofile-project,Java,3,,8804,2353,https://avatars.githubusercontent.com/u/46835275?v=4
95247959,aws-sdk-java-v2,aws/aws-sdk-java-v2,Java,0,The official AWS SDK for Java - Version 2,840,2166,https://avatars.githubusercontent.com/u/2232217?v=4
263442622,rewrite,openrewrite/rewrite,Java,1,Automated mass refactoring of source code.,320,2146,https://avatars.githubusercontent.com/u/61478321?v=4
172750723,opentelemetry-java,open-telemetry/opentelemetry-java,Java,1,OpenTelemetry Java SDK,817,1974,https://avatars.githubusercontent.com/u/49998002?v=4
210933087,opentelemetry-java-instrumentation,open-telemetry/opentelemetry-java-instrumentation,Java,4,OpenTelemetry auto-instrumentation and instrumentation libraries for Java,839,1919,https://avatars.githubusercontent.com/u/49998002?v=4
32895424,java-docs-samples,GoogleCloudPlatform/java-docs-samples,Java,0,Java and Kotlin Code samples used on cloud.google.com,2823,1754,https://avatars.githubusercontent.com/u/2810941?v=4
738201143,CCTV_Viewer,Eanya-Tonic/CCTV_Viewer,Java,14,电视浏览器，一款基于tv.cctv.com和央视频的简易电视直播收看软件，用于方便的在机顶盒上收看电视节目,134,1415,https://avatars.githubusercontent.com/u/74545593?u=ee2d51461e8b21137348457d38a48d29037aa457&v=4
48418599,fineract,apache/fineract,Java,1,Apache Fineract,1629,1337,https://avatars.githubusercontent.com/u/47359?v=4
