id,name,full_name,language,new stars,description,forks_count,stargazers_count,avatar_url
20904437,gin,gin-gonic/gin,Go,31,"Gin is a HTTP web framework written in Go (Golang). It features a Martini-like API with much better performance -- up to 40 times faster. If you need smashing performance, get yourself some Gin.",6141,53953,https://avatars.githubusercontent.com/u/7894478?v=4
29261473,minio,minio/minio,Go,8,"High Performance, Kubernetes Native Object Storage",3493,30699,https://avatars.githubusercontent.com/u/695951?v=4
17728164,terraform,hashicorp/terraform,Go,9,"Terraform enables you to safely and predictably create, change, and improve infrastructure. It is an open source tool that codifies APIs into declarative configuration files that can be shared amongst team members, treated as code, edited, reviewed, and versioned.",7151,30474,https://avatars.githubusercontent.com/u/761456?v=4
61137153,esbuild,evanw/esbuild,Go,21,An extremely fast JavaScript and CSS bundler and minifier,716,29367,https://avatars.githubusercontent.com/u/406394?u=311ddafa2f676e0b821384e18b05f0f4e08bcacc&v=4
16563587,cockroach,cockroachdb/cockroach,Go,5,"CockroachDB - the open source, cloud-native distributed SQL database.",2963,22695,https://avatars.githubusercontent.com/u/6748139?v=4
107286889,croc,schollz/croc,Go,22,Easily and securely send things from one computer to another :crocodile: :package:,753,17825,https://avatars.githubusercontent.com/u/6550035?v=4
29217054,go-micro,asim/go-micro,Go,4,A pluggable Go framework for distributed systems development,1951,17348,https://avatars.githubusercontent.com/u/17530?u=54a5bd782851e18e32f1d3c171b6b8532b1c3a1a&v=4
165041732,kratos,go-kratos/kratos,Go,12,A modular-designed and easy-to-use microservices framework in Go.,3153,15835,https://avatars.githubusercontent.com/u/62791634?v=4
27729907,grpc-go,grpc/grpc-go,Go,2,The Go language implementation of gRPC. HTTP/2 based RPC,3329,15038,https://avatars.githubusercontent.com/u/7802525?v=4
167596393,k9s,derailed/k9s,Go,12,🐶 Kubernetes CLI To Manage Your Clusters In Style!,905,14581,https://avatars.githubusercontent.com/u/4060?u=da7d94a90451eff23ec09dc1764d9104800448c9&v=4
181461073,v2ray-core,v2fly/v2ray-core,Go,26,A platform for building proxies to bypass network restrictions.,2271,13421,https://avatars.githubusercontent.com/u/49637375?v=4
8966356,packer,hashicorp/packer,Go,13,Packer is a tool for creating identical machine images for multiple platforms from a single source configuration.,3184,13379,https://avatars.githubusercontent.com/u/761456?v=4
109145553,podman,containers/podman,Go,16,Podman: A tool for managing OCI containers and pods.,1157,11430,https://avatars.githubusercontent.com/u/5874934?v=4
180687624,trivy,aquasecurity/trivy,Go,21,"Scanner for vulnerabilities in container images, file systems, and Git repositories, as well as for configuration issues",885,9667,https://avatars.githubusercontent.com/u/12783832?v=4
65434192,gjson,tidwall/gjson,Go,6,Get JSON values quickly - JSON parser for Go,635,9451,https://avatars.githubusercontent.com/u/1156077?u=a69712c52c568b3c3bfc7073f9a4bdc5a33b8239&v=4
201658460,7days-golang,geektutu/7days-golang,Go,16,"7 days golang programs from scratch (web framework Gee, distributed cache GeeCache, object relational mapping ORM framework GeeORM, rpc framework GeeRPC etc)  7天用Go动手写/从零实现系列",1442,9269,https://avatars.githubusercontent.com/u/13294018?u=5586b09871dbf49af015acf45173b0512206aab9&v=4
208728772,milvus,milvus-io/milvus,Go,2,An open-source vector database for embedding similarity search and AI applications.,1372,9014,https://avatars.githubusercontent.com/u/51735404?v=4
133067498,kustomize,kubernetes-sigs/kustomize,Go,4,Customization of kubernetes YAML configurations,1624,7878,https://avatars.githubusercontent.com/u/36015203?v=4
815644,dns,miekg/dns,Go,5,DNS library in Go,935,5944,https://avatars.githubusercontent.com/u/353371?u=b98951c0352124cc5ac3e526f0a372accf41041a&v=4
105262714,oauth2-proxy,oauth2-proxy/oauth2-proxy,Go,8,"A reverse proxy that provides authentication with Google, Azure, OpenID Connect and many more identity providers.",861,4497,https://avatars.githubusercontent.com/u/62798169?v=4
67828134,cri-o,cri-o/cri-o,Go,3,Open Container Initiative-based implementation of Kubernetes Container Runtime Interface,722,3755,https://avatars.githubusercontent.com/u/29074118?v=4
177010499,ko,google/ko,Go,6,Build and deploy Go applications on Kubernetes,218,3748,https://avatars.githubusercontent.com/u/1342004?v=4
125619154,keto,ory/keto,Go,2,"Open Source (Go) implementation of ""Zanzibar: Google's Consistent, Global Authorization System"". Ships gRPC, REST APIs, newSQL, and an easy and granular permission language. Supports ACL, RBAC, and other access models.",201,2927,https://avatars.githubusercontent.com/u/25334553?v=4
437325270,log4jScanner,proferosec/log4jScanner,Go,33,,10,130,https://avatars.githubusercontent.com/u/53979706?v=4
438041681,mess-with-dns-backend,jvns/mess-with-dns-backend,Go,8,,6,113,https://avatars.githubusercontent.com/u/817739?u=4991e958f95a61253be9ba9a8eb7f4b306612787&v=4
