id,name,full_name,language,new stars,description,forks_count,stargazers_count,avatar_url
184456251,PowerToys,microsoft/PowerToys,C#,1535,Windows system utilities to maximize productivity,6723,114255,https://avatars.githubusercontent.com/u/6154722?v=4
199570071,v2rayN,2dust/v2rayN,C#,2022,"A GUI client for Windows, Linux and macOS, support Xray and sing-box and others",12087,74085,https://avatars.githubusercontent.com/u/31833384?v=4
49609581,PowerShell,PowerShell/PowerShell,C#,299,PowerShell for every system!,7429,46091,https://avatars.githubusercontent.com/u/11524380?v=4
607289185,semantic-kernel,microsoft/semantic-kernel,C#,446,Integrate cutting-edge LLM technology quickly and easily into your apps,3436,22818,https://avatars.githubusercontent.com/u/6154722?v=4
1327739,ILSpy,icsharpcode/ILSpy,C#,304,".NET Decompiler with support for PDB generation, ReadyToRun, Metadata (&more) - cross-platform!",3403,22170,https://avatars.githubusercontent.com/u/343434?v=4
210716005,runtime,dotnet/runtime,C#,225,".NET is a cross-platform runtime for cloud, mobile, desktop, and IoT apps.",4834,15744,https://avatars.githubusercontent.com/u/9141961?v=4
959908,OpenRA,OpenRA/OpenRA,C#,195,"Open Source real-time strategy game engine for early Westwood games such as Command & Conquer: Red Alert written in C# using SDL and OpenGL. Runs on Windows, Linux, *BSD and Mac OS X.",2709,15032,https://avatars.githubusercontent.com/u/409046?v=4
45195614,Jackett,Jackett/Jackett,C#,264,API Support for your favorite torrent trackers,1335,12810,https://avatars.githubusercontent.com/u/15383019?v=4
681372871,garnet,microsoft/garnet,C#,209,"Garnet is a remote cache-store from Microsoft Research that offers strong performance (throughput and latency), scalability, storage, recovery, cluster sharding, key migration, and replication features. Garnet can work with existing Redis clients.",550,10746,https://avatars.githubusercontent.com/u/6154722?v=4
157858597,YoutubeDownloader,Tyrrrz/YoutubeDownloader,C#,491,Downloads videos and playlists from YouTube,1350,10037,https://avatars.githubusercontent.com/u/1935960?u=40a06549de224471e1a81877536f8e24d4e96f09&v=4
21611723,Quasar,quasar/Quasar,C#,102,Remote Administration Tool for Windows,2517,8950,https://avatars.githubusercontent.com/u/13819829?v=4
288428676,MudBlazor,MudBlazor/MudBlazor,C#,187,Blazor Component Library based on Material Design principles with an emphasis on ease of use and extensibility,1343,8485,https://avatars.githubusercontent.com/u/79755064?v=4
61176492,DriverStoreExplorer,lostindark/DriverStoreExplorer,C#,186,Driver Store Explorer [RAPR],414,7229,https://avatars.githubusercontent.com/u/8030927?u=c8f088e07bf794fc98dee1b4a234b61c46dd5941&v=4
158405551,git-credential-manager,git-ecosystem/git-credential-manager,C#,146,"Secure, cross-platform Git credential storage with authentication to GitHub, Azure Repos, and other popular Git hosting services.",1923,7183,https://avatars.githubusercontent.com/u/64464614?v=4
683560668,better-genshin-impact,babalae/better-genshin-impact,C#,1019,ğŸ“¦BetterGI Â· æ›´å¥½çš„åŸç¥ - è‡ªåŠ¨æ‹¾å– | è‡ªåŠ¨å‰§æƒ… | å…¨è‡ªåŠ¨é’“é±¼(AI) | å…¨è‡ªåŠ¨ä¸ƒåœ£å¬å”¤ | è‡ªåŠ¨ä¼æœ¨ | è‡ªåŠ¨åˆ·æœ¬ | è‡ªåŠ¨é‡‡é›†/æŒ–çŸ¿/é”„åœ° | ä¸€æ¡é¾™ | å…¨è¿éŸ³æ¸¸ - UI Automation Testing Tools For Genshin Impact,436,6716,https://avatars.githubusercontent.com/u/72920340?v=4
184286875,runner,actions/runner,C#,95,The Runner for GitHub Actions :rocket:,999,5063,https://avatars.githubusercontent.com/u/44036562?v=4
39425864,tModLoader,tModLoader/tModLoader,C#,75,A mod to make and play Terraria mods. Supports Terraria 1.4 (and earlier) installations ,1902,4313,https://avatars.githubusercontent.com/u/36521970?v=4
211763756,OpenTabletDriver,OpenTabletDriver/OpenTabletDriver,C#,61,"Open source, cross-platform, user-mode tablet driver",362,2856,https://avatars.githubusercontent.com/u/76072354?v=4
92001425,space-station-14,space-wizards/space-station-14,C#,100,A multiplayer game about paranoia and chaos on a space station. Remake of the cult-classic Space Station 13.,3705,2832,https://avatars.githubusercontent.com/u/10567778?v=4
520583586,bloxstrap,bloxstraplabs/bloxstrap,C#,111,An alternative bootstrapper for Roblox with a bunch of extra features.,392,2034,https://avatars.githubusercontent.com/u/147950331?v=4
818118661,SwarmUI,mcmonkeyprojects/SwarmUI,C#,214,"SwarmUI (formerly StableSwarmUI), A Modular Stable Diffusion Web-User-Interface, with an emphasis on making powertools easily accessible, high performance, and extensibility.",139,1847,https://avatars.githubusercontent.com/u/43497670?v=4
875403491,Flyby11,builtbybel/Flyby11,C#,138,Windows 11 Upgrading Assistant,55,778,https://avatars.githubusercontent.com/u/48735732?v=4
401546387,Sidekick,Sidekick-Poe/Sidekick,C#,118,"The main repository for the Sidekick project, a companion trade tool for Path of Exile and Path of Exile 2.",34,318,https://avatars.githubusercontent.com/u/89821696?v=4
