id,name,full_name,language,new stars,description,forks_count,stargazers_count,avatar_url
27574418,nerd-fonts,ryanoasis/nerd-fonts,CSS,620,"Iconic font aggregator, collection, & patcher. 3,600+ icons, 50+ patched fonts: Hack, Source Code Pro, more. Glyph collections: Font Awesome, Material Design Icons, Octicons, & more",3686,55882,https://avatars.githubusercontent.com/u/8083459?u=1645f43000c842a948268609231bdecb1433c470&v=4
50264296,bulma,jgthms/bulma,CSS,122,Modern CSS framework based on Flexbox,3950,49482,https://avatars.githubusercontent.com/u/1254808?u=1d9df343bac6f57e7bff85f0074aac2de34f5dcc&v=4
41058054,CppCoreGuidelines,isocpp/CppCoreGuidelines,CSS,185,"The C++ Core Guidelines are a set of tried-and-true guidelines, rules, and best practices about coding in C++",5448,43111,https://avatars.githubusercontent.com/u/13841574?v=4
313330998,50projects50days,bradtraversy/50projects50days,CSS,377,"50+ mini web projects using HTML, CSS & JS",9295,37903,https://avatars.githubusercontent.com/u/5550850?u=45352e59e108ddd00ead26981cd6a4a53b151b1d&v=4
5362524,source-code-pro,adobe-fonts/source-code-pro,CSS,113,Monospaced font family for user interface and coding environments,1634,20038,https://avatars.githubusercontent.com/u/4028872?v=4
221892711,pico,picocss/pico,CSS,244,Minimal CSS Framework for semantic HTML,418,14164,https://avatars.githubusercontent.com/u/57780293?v=4
141040549,seeker,thewhiteh4t/seeker,CSS,161,Accurately Locate Smartphones using Social Engineering ,1760,7436,https://avatars.githubusercontent.com/u/36354846?u=99d06a9237c301569774dac1c70218d5c032773a&v=4
282550237,obsidian-minimal,kepano/obsidian-minimal,CSS,80,A distraction-free and highly customizable theme for Obsidian.,187,3864,https://avatars.githubusercontent.com/u/10565871?u=331db9a72c1d1d7ff58c32b3e7236fd6d2753527&v=4
335290328,Fluent-gtk-theme,vinceliuice/Fluent-gtk-theme,CSS,14,Fluent design gtk theme for linux desktops,61,1099,https://avatars.githubusercontent.com/u/7604295?u=f7c06972e1f9eeb6085d367ad1376621c2d5402d&v=4
668453226,hextra,imfing/hextra,CSS,103,"🔯 Modern, batteries-included Hugo theme for creating beautiful doc, blog and static websites",203,893,https://avatars.githubusercontent.com/u/5097752?u=2c29af47e2785926f25bb4745bd63c7e3ea8482d&v=4
412858397,midnight-discord,refact0r/midnight-discord,CSS,42,"A dark, rounded discord theme.",375,734,https://avatars.githubusercontent.com/u/34758569?u=f463dd0a3d48bd5d85222ed94fbc3e530913abde&v=4
487404679,project-wordle,joy-of-react/project-wordle,CSS,1,,1368,129,https://avatars.githubusercontent.com/u/102046975?v=4
574273163,project-toast,joy-of-react/project-toast,CSS,2,,755,63,https://avatars.githubusercontent.com/u/102046975?v=4
