id,name,full_name,language,new stars,description,forks_count,stargazers_count,avatar_url
65600975,pytorch,pytorch/pytorch,C++,360,Tensors and Dynamic neural networks in Python with strong GPU acceleration,17883,64703,https://avatars.githubusercontent.com/u/21003710?v=4
22887094,tesseract,tesseract-ocr/tesseract,C++,176,Tesseract Open Source OCR Engine (main repository),8452,50053,https://avatars.githubusercontent.com/u/8401422?v=4
65214191,envoy,envoyproxy/envoy,C++,54,Cloud-native high-performance edge/middle/service proxy,4199,21711,https://avatars.githubusercontent.com/u/30125649?v=4
81227005,faiss,facebookresearch/faiss,C++,437,A library for efficient similarity search and clustering of dense vectors.,2852,20338,https://avatars.githubusercontent.com/u/16943930?v=4
437245741,dragonfly,dragonflydb/dragonfly,C++,552,A modern replacement for Redis and Memcached,623,18496,https://avatars.githubusercontent.com/u/104819355?v=4
192025001,Qv2ray,Qv2ray/Qv2ray,C++,67,:star: Linux / Windows / macOS 跨平台 V2Ray 客户端 | 支持 VMess / VLESS / SSR / Trojan / Trojan-Go / NaiveProxy / HTTP / HTTPS / SOCKS5 | 使用 C++ / Qt 开发 | 可拓展插件式设计 :star:,3140,15196,https://avatars.githubusercontent.com/u/60087221?v=4
5736080,FreeCAD,FreeCAD/FreeCAD,C++,78,"This is the official source code of FreeCAD, a free and opensource multiplatform 3D parametric modeler.",3165,13632,https://avatars.githubusercontent.com/u/2306237?v=4
194269070,skyline,skyline-emu/skyline,C++,75,Run Nintendo Switch homebrew & games on your Android device!,1566,12327,https://avatars.githubusercontent.com/u/52578041?v=4
5973855,Cataclysm-DDA,CleverRaven/Cataclysm-DDA,C++,54,Cataclysm - Dark Days Ahead. A turn-based survival game set in a post-apocalyptic world.,3669,8428,https://avatars.githubusercontent.com/u/4367009?v=4
19866730,citra,citra-emu/citra,C++,42,A Nintendo 3DS Emulator,1574,8324,https://avatars.githubusercontent.com/u/7605670?v=4
181436799,MNN,alibaba/MNN,C++,29,"MNN is a blazing fast, lightweight deep learning framework, battle-tested by business-critical use cases in Alibaba",1512,7475,https://avatars.githubusercontent.com/u/1961952?v=4
470730648,Hyprland,hyprwm/Hyprland,C++,253,Hyprland is a highly customizable dynamic tiling Wayland compositor that doesn't sacrifice on its looks.,246,7145,https://avatars.githubusercontent.com/u/107882187?v=4
84183882,sentencepiece,google/sentencepiece,C++,85,Unsupervised text tokenizer for Neural Network-based text generation.,913,6972,https://avatars.githubusercontent.com/u/1342004?v=4
143324737,devilutionX,diasurgical/devilutionX,C++,23,Diablo build for modern operating systems,670,6323,https://avatars.githubusercontent.com/u/40645014?v=4
52882701,PrusaSlicer,prusa3d/PrusaSlicer,C++,51,"G-code generator for 3D printers (RepRap, Makerbot, Ultimaker etc.)",1579,5932,https://avatars.githubusercontent.com/u/14859759?v=4
372536760,oceanbase,oceanbase/oceanbase,C++,123,"OceanBase is an enterprise distributed relational database with high availability, high performance, horizontal scalability, and compatibility with SQL standards.",1186,5445,https://avatars.githubusercontent.com/u/82347605?v=4
81634683,oneflow,Oneflow-Inc/oneflow,C++,143,"OneFlow is a deep learning framework designed to be user-friendly, scalable and efficient.",557,4786,https://avatars.githubusercontent.com/u/24632470?v=4
527719753,Cemu,cemu-project/Cemu,C++,63,Cemu - Wii U emulator,272,4531,https://avatars.githubusercontent.com/u/40145098?v=4
201692465,GASDocumentation,tranek/GASDocumentation,C++,29,My understanding of Unreal Engine 5's GameplayAbilitySystem plugin with a simple multiplayer sample project.,549,2567,https://avatars.githubusercontent.com/u/1534735?v=4
96431386,hnswlib,nmslib/hnswlib,C++,89,Header-only C++/python library for fast approximate nearest neighbors,443,2536,https://avatars.githubusercontent.com/u/37882366?v=4
488177011,nekoray,MatsuriDayo/nekoray,C++,84,Qt based cross-platform GUI proxy configuration manager (backend: v2ray / sing-box),189,2079,https://avatars.githubusercontent.com/u/95122236?v=4
168555392,REFramework,praydog/REFramework,C++,77,"Scripting platform, modding framework and VR support for all RE Engine games",195,1542,https://avatars.githubusercontent.com/u/2909949?v=4
527819251,CV-CUDA,CVCUDA/CV-CUDA,C++,70,"CV-CUDA™ is an open-source, GPU accelerated library for cloud-scale image processing and computer vision.",124,1430,https://avatars.githubusercontent.com/u/111754012?v=4
353251675,gaggiuino,Zer0-bit/gaggiuino,C++,64,A Gaggia Classic control project using microcontrollers.,120,1067,https://avatars.githubusercontent.com/u/42692077?u=205ebd0fdb75e88781f3fba33d394ee088f73d5a&v=4
402762873,SKRoot-linuxKernelRoot,abcz316/SKRoot-linuxKernelRoot,C++,479,新一代SKRoot，挑战全网root检测手段，跟面具完全不同思路，摆脱面具被检测的弱点，完美隐藏root功能，全程不需要暂停SELinux，实现真正的SELinux 0%触碰，通用性强，通杀所有内核，不需要内核源码，直接patch内核，兼容安卓APP直接JNI调用，稳定、流畅、不闪退。,291,1014,https://avatars.githubusercontent.com/u/60607547?v=4
