id,name,full_name,language,new stars,description,forks_count,stargazers_count,avatar_url
111583593,scrcpy,Genymobile/scrcpy,C,504,Display and control your Android device,8274,80050,https://avatars.githubusercontent.com/u/3427627?v=4
10744183,netdata,netdata/netdata,C,97,"Real-time performance monitoring, done right! https://www.netdata.cloud",5479,62417,https://avatars.githubusercontent.com/u/43390781?v=4
246335987,Ventoy,ventoy/Ventoy,C,408,A new bootable USB solution.,3304,47003,https://avatars.githubusercontent.com/u/59477474?u=16f38c14b69580f87f4717b71c0e5e85e9559cb1&v=4
569041,curl,curl/curl,C,126,"A command line tool and library for transferring data with URL syntax, supporting DICT, FILE, FTP, FTPS, GOPHER, GOPHERS, HTTP, HTTPS, IMAP, IMAPS, LDAP, LDAPS, MQTT, POP3, POP3S, RTMP, RTMPS, RTSP, SCP, SFTP, SMB, SMBS, SMTP, SMTPS, TELNET, TFTP, WS and WSS. libcurl offers a myriad of powerful features",5639,28996,https://avatars.githubusercontent.com/u/16928085?v=4
2810292,rufus,pbatard/rufus,C,164,The Reliable USB Formatting Utility,2231,22300,https://avatars.githubusercontent.com/u/1206968?u=ed1be5451352656cffecc840d661bb793c3bad05&v=4
20159867,stb,nothings/stb,C,78,stb single-file public domain libraries for C/C++,7435,21436,https://avatars.githubusercontent.com/u/7525026?u=a23ba3a549fff291e35446cb32c8979bd29be6c9&v=4
612354784,llama.cpp,ggerganov/llama.cpp,C,3744,Port of Facebook's LLaMA model in C/C++,2034,14941,https://avatars.githubusercontent.com/u/1991296?u=28314d364d7c28f8ec232fadb767970d3ad74e7b&v=4
45821540,openwrt,openwrt/openwrt,C,92,This repository is a mirror of https://git.openwrt.org/openwrt/openwrt.git It is for reference only and is not active for check-ins.  We will continue to accept Pull Requests here. They will be merged via staging trees then into openwrt.git.,8475,14481,https://avatars.githubusercontent.com/u/2528830?v=4
541269386,whisper.cpp,ggerganov/whisper.cpp,C,1449,Port of OpenAI's Whisper model in C/C++,1052,13459,https://avatars.githubusercontent.com/u/1991296?u=28314d364d7c28f8ec232fadb767970d3ad74e7b&v=4
13836499,raylib,raysan5/raylib,C,215,A simple and easy-to-use library to enjoy videogames programming,1471,12410,https://avatars.githubusercontent.com/u/5766837?u=28d52cd1077b2f8b48d3897e82f03280a565e8d6&v=4
36749153,react-native-code-push,microsoft/react-native-code-push,C,10,React Native module for CodePush,1369,8420,https://avatars.githubusercontent.com/u/6154722?v=4
59676171,klipper,Klipper3d/klipper,C,38,Klipper is a 3d-printer firmware,4398,6400,https://avatars.githubusercontent.com/u/90982958?v=4
470579591,unleashed-firmware,DarkFlippers/unleashed-firmware,C,200,Flipper Zero Unleashed Firmware,573,6242,https://avatars.githubusercontent.com/u/115378555?v=4
284134871,flipperzero-firmware,flipperdevices/flipperzero-firmware,C,253,Flipper Zero firmware source code,1683,6115,https://avatars.githubusercontent.com/u/57576566?v=4
490465859,Flipper,UberGuidoZ/Flipper,C,123,Playground (and dump) of stuff I make or modify for the Flipper Zero,1367,5674,https://avatars.githubusercontent.com/u/57457139?u=3b283c3083a1fee457b897d7c8fda97b873e9807&v=4
146155284,flecs,SanderMertens/flecs,C,67,A fast entity component system (ECS) for C & C++,293,3739,https://avatars.githubusercontent.com/u/9919222?u=c255d45d76514ff1c73de590bc5793f2e080a6ee&v=4
32148604,inav,iNavFlight/inav,C,15,INAV: Navigation-enabled flight control software,1228,2336,https://avatars.githubusercontent.com/u/15979895?v=4
154525111,freeswitch,signalwire/freeswitch,C,11,"FreeSWITCH is a Software Defined Telecom Stack enabling the digital transformation from proprietary telecom switches to a versatile software implementation that runs on any commodity hardware. From a Raspberry PI to a multi-core server, FreeSWITCH can unlock the telecommunications potential of any device.",1076,2246,https://avatars.githubusercontent.com/u/34925332?v=4
2339555,util-linux,util-linux/util-linux,C,15,,1062,2077,https://avatars.githubusercontent.com/u/93589837?v=4
172523426,xdp-tutorial,xdp-project/xdp-tutorial,C,17,XDP tutorial,451,1708,https://avatars.githubusercontent.com/u/45232901?v=4
538180525,ggml,ggerganov/ggml,C,165,Tensor library for machine learning,62,989,https://avatars.githubusercontent.com/u/1991296?u=28314d364d7c28f8ec232fadb767970d3ad74e7b&v=4
505613691,Onion,OnionUI/Onion,C,54,OS overhaul for Miyoo Mini ,41,981,https://avatars.githubusercontent.com/u/109221246?v=4
589514195,audioFlux,libAudioFlux/audioFlux,C,538,"A library for audio and music analysis, feature extraction.",34,968,https://avatars.githubusercontent.com/u/105165315?v=4
613051742,bloomz.cpp,NouamaneTazi/bloomz.cpp,C,106,C++ implementation for BLOOM,28,552,https://avatars.githubusercontent.com/u/29777165?u=8d54f7bff7ab08bc4d181547d4453eac8eda2d2a&v=4
520421101,learning-ebpf,lizrice/learning-ebpf,C,107,"Learning eBPF, published by O'Reilly - out now! Here's where you'll find a VM config for the examples, and more",43,331,https://avatars.githubusercontent.com/u/458616?v=4
