id,name,full_name,language,new stars,description,forks_count,stargazers_count,avatar_url
111583593,scrcpy,Genymobile/scrcpy,C,2340,Display and control your Android device,10846,113953,https://avatars.githubusercontent.com/u/3427627?v=4
1903522,php-src,php/php-src,C,241,The PHP Interpreter,7773,38373,https://avatars.githubusercontent.com/u/25158?v=4
727213319,my-tv,lizongying/my-tv,C,629,我的电视 电视直播软件，安装即可使用,3426,30595,https://avatars.githubusercontent.com/u/16871545?u=8c1965dc6e0c9f6c1e2a688bdc54c05c76019d42&v=4
214011414,WindTerm,kingToolbox/WindTerm,C,824,A professional cross-platform SSH/Sftp/Shell/Telnet/Serial terminal.,1839,24026,https://avatars.githubusercontent.com/u/51009775?v=4
13836499,raylib,raysan5/raylib,C,695,A simple and easy-to-use library to enjoy videogames programming,2309,23182,https://avatars.githubusercontent.com/u/5766837?u=28d52cd1077b2f8b48d3897e82f03280a565e8d6&v=4
45821540,openwrt,openwrt/openwrt,C,501,This repository is a mirror of https://git.openwrt.org/openwrt/openwrt.git It is for reference only and is not active for check-ins.  We will continue to accept Pull Requests here. They will be merged via staging trees then into openwrt.git.,10607,20693,https://avatars.githubusercontent.com/u/2528830?v=4
470579591,unleashed-firmware,DarkFlippers/unleashed-firmware,C,359,Flipper Zero Unleashed Firmware,1469,17805,https://avatars.githubusercontent.com/u/115378555?v=4
60667730,lvgl,lvgl/lvgl,C,1017,"Embedded graphics library to create beautiful UIs for any MCU, MPU and display type. ",3316,17638,https://avatars.githubusercontent.com/u/19811762?v=4
6041301,sumatrapdf,sumatrapdfreader/sumatrapdf,C,235,SumatraPDF reader,1739,13888,https://avatars.githubusercontent.com/u/9777518?v=4
543276238,libsql,tursodatabase/libsql,C,2042,"libSQL is a fork of SQLite that is both Open Source, and Open Contributions.",307,12069,https://avatars.githubusercontent.com/u/139391156?v=4
59771425,zephyr,zephyrproject-rtos/zephyr,C,222,"Primary Git Repository for the Zephyr Project. Zephyr is a new generation, scalable, optimized, secure RTOS for multiple hardware architectures.",6718,11043,https://avatars.githubusercontent.com/u/19595895?v=4
54280778,cJSON,DaveGamble/cJSON,C,121,Ultralightweight JSON parser in ANSI C,3228,10905,https://avatars.githubusercontent.com/u/118247?v=4
330008801,SDL,libsdl-org/SDL,C,514,Simple Directmedia Layer,1880,10423,https://avatars.githubusercontent.com/u/77683370?v=4
53614190,mosquitto,eclipse-mosquitto/mosquitto,C,119,Eclipse Mosquitto - An open source MQTT broker,2415,9183,https://avatars.githubusercontent.com/u/185921483?v=4
88327406,xmrig,xmrig/xmrig,C,170,"RandomX, KawPow, CryptoNight and GhostRider unified CPU/GPU miner and RandomX benchmark",3478,8861,https://avatars.githubusercontent.com/u/27528955?u=555699fb82e7598ed7dd1f6e47302042b48a10c3&v=4
37060852,betaflight,betaflight/betaflight,C,155,Open Source Flight Controller Firmware,3076,8726,https://avatars.githubusercontent.com/u/19597933?v=4
124678204,aircrack-ng,aircrack-ng/aircrack-ng,C,127,WiFi security auditing tools suite,958,5560,https://avatars.githubusercontent.com/u/4042925?u=2e4aed03769fc637d27c21e223a530d4240e59e0&v=4
27359183,GmSSL,guanzhi/GmSSL,C,84,支持国密SM2/SM3/SM4/SM9/SSL的密码工具箱,1680,5261,https://avatars.githubusercontent.com/u/1787781?u=c71c577b7da3afe39a461344fdca316d82f91735&v=4
331380723,pico-sdk,raspberrypi/pico-sdk,C,86,,960,3817,https://avatars.githubusercontent.com/u/1294177?v=4
251043704,mayhem-firmware,portapack-mayhem/mayhem-firmware,C,134,Custom firmware for the HackRF+PortaPack H1/H2/H4,579,3586,https://avatars.githubusercontent.com/u/136080346?v=4
32148604,inav,iNavFlight/inav,C,50,INAV: Navigation-enabled flight control software,1500,3228,https://avatars.githubusercontent.com/u/15979895?v=4
795166961,Bruce,pr3y/Bruce,C,480,Predatory ESP32 Firmware,131,1095,https://avatars.githubusercontent.com/u/67231282?v=4
