id,name,full_name,language,new stars,description,forks_count,stargazers_count,avatar_url
658928958,ollama,ollama/ollama,Go,4812,"Get up and running with Llama 3.2, Mistral, Gemma 2, and other large language models.",8034,100781,https://avatars.githubusercontent.com/u/151674099?v=4
48378947,frp,fatedier/frp,Go,1280,A fast reverse proxy to help you expose a local server behind a NAT or firewall to the internet.,13430,87206,https://avatars.githubusercontent.com/u/7346661?u=721c6ac19c725486a09c728572e7aee0460e42c0&v=4
133251103,dive,wagoodman/dive,Go,2039,A tool for exploring each layer in a docker image,1806,48118,https://avatars.githubusercontent.com/u/590471?u=b78d631287f3a5422d8e1492f632965bb410c9bc&v=4
187335810,lazydocker,jesseduffield/lazydocker,Go,1973,The lazier way to manage everything docker,1240,39039,https://avatars.githubusercontent.com/u/8456633?u=1183e9d1442669992861877a4f313b51e3bbd119&v=4
24268127,nvm-windows,coreybutler/nvm-windows,Go,605,A node.js version management utility for Windows. Ironically written in Go.,3375,38299,https://avatars.githubusercontent.com/u/770982?u=81e8d113dd0628720745aa8869123f9f28c955eb&v=4
615869301,LocalAI,mudler/LocalAI,Go,2385,":robot: The free, Open Source alternative to OpenAI, Claude and others. Self-hosted and local-first. Drop-in replacement for OpenAI,  running on consumer-grade hardware. No GPU required. Runs gguf, transformers, diffusers and many more models architectures. Features: Generate Text, Audio, Video, Images, Voice Cloning, Distributed, P2P inference",1990,26694,https://avatars.githubusercontent.com/u/2420543?u=88a72adb708b5bf2ca40acda912778e65ac4cf43&v=4
180687624,trivy,aquasecurity/trivy,Go,446,"Find vulnerabilities, misconfigurations, secrets, SBOM in containers, Kubernetes, code repositories, clouds and more",2348,23907,https://avatars.githubusercontent.com/u/12783832?v=4
526081371,go2rtc,AlexxIT/go2rtc,Go,2264,"Ultimate camera streaming application with support RTSP, RTMP, HTTP-FLV, WebRTC, MSE, HLS, MP4, MJPEG, HomeKit, FFmpeg, etc.",531,7339,https://avatars.githubusercontent.com/u/511909?u=e204ee17a09c8f5949b1322cb26aa5700d7422ba&v=4
703404066,go-blueprint,Melkeydev/go-blueprint,Go,1514,Go-blueprint allows users to spin up a quick Go project using a popular framework,338,5987,https://avatars.githubusercontent.com/u/53410236?u=4a0b00602c76212427a806ec50588c51ce8b4d91&v=4
201546443,assets,trustwallet/assets,Go,89,"A comprehensive, up-to-date collection of information about several thousands (!) of crypto tokens.",22792,4699,https://avatars.githubusercontent.com/u/32179889?v=4
558188628,higress,alibaba/higress,Go,414,🤖 AI Gateway | AI Native API Gateway,535,3592,https://avatars.githubusercontent.com/u/1961952?v=4
