id,name,full_name,language,new stars,description,forks_count,stargazers_count,avatar_url
658928958,ollama,ollama/ollama,Go,5248,"Get up and running with Llama 3.3, Mistral, Gemma 2, and other large language models.",8181,102502,https://avatars.githubusercontent.com/u/151674099?v=4
48378947,frp,fatedier/frp,Go,1358,A fast reverse proxy to help you expose a local server behind a NAT or firewall to the internet.,13470,87613,https://avatars.githubusercontent.com/u/7346661?u=721c6ac19c725486a09c728572e7aee0460e42c0&v=4
138547797,mkcert,FiloSottile/mkcert,Go,1727,A simple zero-config tool to make locally trusted development certificates with any names you'd like.,2691,51179,https://avatars.githubusercontent.com/u/1225294?u=f9186107b90a6f746f8e7192ee7b1d5a68f4ab07&v=4
133251103,dive,wagoodman/dive,Go,2221,A tool for exploring each layer in a docker image,1816,48404,https://avatars.githubusercontent.com/u/590471?u=b78d631287f3a5422d8e1492f632965bb410c9bc&v=4
15452919,go-ethereum,ethereum/go-ethereum,Go,381,Go implementation of the Ethereum protocol,20283,47886,https://avatars.githubusercontent.com/u/6250754?v=4
72495579,gitea,go-gitea/gitea,Go,628,"Git with a cup of tea! Painless self-hosted all-in-one software development service, including Git hosting, code review, team collaboration, package registry and CI/CD",5538,45616,https://avatars.githubusercontent.com/u/12724356?v=4
17728164,terraform,hashicorp/terraform,Go,555,"Terraform enables you to safely and predictably create, change, and improve infrastructure. It is a source-available tool that codifies APIs into declarative configuration files that can be shared amongst team members, treated as code, edited, reviewed, and versioned.",9586,43221,https://avatars.githubusercontent.com/u/761456?v=4
510607652,pocketbase,pocketbase/pocketbase,Go,1629,Open Source realtime backend in 1 file,1973,42077,https://avatars.githubusercontent.com/u/101000011?v=4
187335810,lazydocker,jesseduffield/lazydocker,Go,2107,The lazier way to manage everything docker,1247,39285,https://avatars.githubusercontent.com/u/8456633?u=1183e9d1442669992861877a4f313b51e3bbd119&v=4
615869301,LocalAI,mudler/LocalAI,Go,1945,":robot: The free, Open Source alternative to OpenAI, Claude and others. Self-hosted and local-first. Drop-in replacement for OpenAI,  running on consumer-grade hardware. No GPU required. Runs gguf, transformers, diffusers and many more models architectures. Features: Generate Text, Audio, Video, Images, Voice Cloning, Distributed, P2P inference",2016,26962,https://avatars.githubusercontent.com/u/2420543?u=88a72adb708b5bf2ca40acda912778e65ac4cf43&v=4
626896474,SafeLine,chaitin/SafeLine,Go,1347,serve as a reverse proxy to protect your web services from attacks and exploits.,858,14110,https://avatars.githubusercontent.com/u/7302766?v=4
753490180,daytona,daytonaio/daytona,Go,2913,The Open Source Dev Environment Manager.,1024,13181,https://avatars.githubusercontent.com/u/130513197?v=4
150954997,VictoriaMetrics,VictoriaMetrics/VictoriaMetrics,Go,452,"VictoriaMetrics: fast, cost-effective monitoring solution and time series database",1254,12770,https://avatars.githubusercontent.com/u/43720803?v=4
326228917,katana,projectdiscovery/katana,Go,1361,A next-generation crawling and spidering framework.,655,12590,https://avatars.githubusercontent.com/u/50994705?v=4
197914161,sftpgo,drakkan/sftpgo,Go,237,"Full-featured and highly configurable SFTP, HTTP/S, FTP/S and WebDAV server - S3, Google Cloud Storage, Azure Blob",751,9626,https://avatars.githubusercontent.com/u/553263?u=383412442399c019c1f9678ff569695ca184ccdb&v=4
774468912,superfile,yorukot/superfile,Go,1722,Pretty fancy and modern terminal file manager,184,8091,https://avatars.githubusercontent.com/u/107802416?u=4314dfeae3eef151614116ea6cdb42040d839f3b&v=4
247350713,neko,m1k1o/neko,Go,588,A self hosted virtual browser that runs in docker and uses WebRTC.,593,8070,https://avatars.githubusercontent.com/u/7534274?u=4e7d61e109f1b8419af30c9de5daec6c9d585a6f&v=4
220588935,nezha,nezhahq/nezha,Go,599,":trollface: Self-hosted, lightweight server and website monitoring and O&M tool",1348,7813,https://avatars.githubusercontent.com/u/105093572?v=4
473949053,frankenphp,dunglas/frankenphp,Go,288,🧟 The modern PHP app server,251,7171,https://avatars.githubusercontent.com/u/57224?u=a7ed2cf3f0ae84c9e06925b94091b85a7d6324b0&v=4
206214867,gatus,TwiN/gatus,Go,321,⛑ Automated developer-oriented status page,439,6682,https://avatars.githubusercontent.com/u/15699766?u=b9348c9b30b9364587c8d68a82dcb456fe6cbf6a&v=4
703404066,go-blueprint,Melkeydev/go-blueprint,Go,1569,Go-blueprint allows users to spin up a quick Go project using a popular framework,345,6122,https://avatars.githubusercontent.com/u/53410236?u=4a0b00602c76212427a806ec50588c51ce8b4d91&v=4
603535454,langchaingo,tmc/langchaingo,Go,560,"LangChain for Go, the easiest way to write LLM-based programs in Go",660,5148,https://avatars.githubusercontent.com/u/3977?u=ba15c36cd7e0fd2d5fd1a4eb4df77420618a6d9e&v=4
185861173,opentelemetry-collector,open-telemetry/opentelemetry-collector,Go,119,OpenTelemetry Collector,1491,4548,https://avatars.githubusercontent.com/u/49998002?v=4
459870310,kueue,kubernetes-sigs/kueue,Go,117,Kubernetes-native Job Queueing,275,1510,https://avatars.githubusercontent.com/u/36015203?v=4
