id,name,full_name,language,new stars,description,forks_count,stargazers_count,avatar_url
83222441,system-design-primer,donnemartin/system-design-primer,Python,5748,Learn how to design large-scale systems. Prep for the system design interview.  Includes Anki flashcards.,47310,282988,https://avatars.githubusercontent.com/u/5458997?u=f1007b583e55e7ccfb6ccf0e200051156112dd9b&v=4
599320067,langflow,langflow-ai/langflow,Python,5278,"Langflow is a low-code app builder for RAG and multi-agent AI applications. It’s Python-based and agnostic to any model, API, or database.",4594,40866,https://avatars.githubusercontent.com/u/85702467?v=4
91629816,freqtrade,freqtrade/freqtrade,Python,1759,"Free, open source crypto trading bot",6609,33029,https://avatars.githubusercontent.com/u/37536846?v=4
587050620,dspy,stanfordnlp/dspy,Python,1284,DSPy: The framework for programming—not prompting—language models,1549,20515,https://avatars.githubusercontent.com/u/3046006?v=4
702796244,fish-speech,fishaudio/fish-speech,Python,3090,SOTA Open Source TTS,1328,17763,https://avatars.githubusercontent.com/u/122017386?v=4
826168160,docling,DS4SD/docling,Python,5698,Get your documents ready for gen AI,859,16726,https://avatars.githubusercontent.com/u/105039151?v=4
853189791,PDFMathTranslate,Byaidu/PDFMathTranslate,Python,8448,PDF scientific paper translation with preserved formats - 基于 AI 完整保留排版的 PDF 文档全文双语翻译，支持 Google/DeepL/Ollama/OpenAI 等服务，提供 CLI/GUI/Docker,843,11608,https://avatars.githubusercontent.com/u/21212051?u=819b2de573c644e6e436a54b31ff5f69067c7c29&v=4
822285449,aisuite,andrewyng/aisuite,Python,7523,"Simple, unified interface to multiple Generative AI providers ",835,9359,https://avatars.githubusercontent.com/u/3710007?u=4c1b9232e08bfc56050a7f9ce6643b7ccf23ff14&v=4
179163124,hummingbot,hummingbot/hummingbot,Python,388,Open source software that helps you create and deploy high-frequency crypto trading bots,2953,8774,https://avatars.githubusercontent.com/u/88165212?v=4
17420614,SeleniumBase,seleniumbase/SeleniumBase,Python,2486,"Python APIs for web automation, testing, and bypassing bot-detection.",1080,7994,https://avatars.githubusercontent.com/u/17287301?v=4
616738094,stock,myhhub/stock,Python,4821,"stock股票.获取股票数据,计算股票指标,识别股票形态,综合选股,选股策略,股票验证回测,股票自动交易,支持PC及移动设备。",1215,6643,https://avatars.githubusercontent.com/u/41766026?u=bfccaed5ff9864e9e941602bad48ccd95e179b0a&v=4
729453988,ollama-python,ollama/ollama-python,Python,703,Ollama Python library,465,5498,https://avatars.githubusercontent.com/u/151674099?v=4
638951438,opik,comet-ml/opik,Python,1574,"From RAG chatbots to code assistants to complex agentic pipelines and beyond, build LLM systems that run better, faster, and cheaper with tracing, evaluations, and dashboards.",213,3772,https://avatars.githubusercontent.com/u/31487821?v=4
817354652,TEN-Agent,TEN-framework/TEN-Agent,Python,2081,"TEN Agent is a conversational AI powered by the TEN, integrating Gemini 2.0 Live, OpenAI Realtime, RTC, and more. It delivers real-time capabilities to see, hear, and speak, while being fully compatible with popular workflow platforms like Dify and Coze.",370,3766,https://avatars.githubusercontent.com/u/113095513?v=4
832647441,multi-agent-orchestrator,awslabs/multi-agent-orchestrator,Python,1464,Flexible and powerful framework for managing multiple AI agents and handling complex conversations,265,3607,https://avatars.githubusercontent.com/u/3299148?v=4
862584018,python-sdk,modelcontextprotocol/python-sdk,Python,776,The official Python SDK for Model Context Protocol servers and clients,103,1051,https://avatars.githubusercontent.com/u/182288589?v=4
