id,name,full_name,language,new stars,description,forks_count,stargazers_count,avatar_url
45717250,tensorflow,tensorflow/tensorflow,C++,966,An Open Source Machine Learning Framework for Everyone,73723,181171,https://avatars.githubusercontent.com/u/15658638?v=4
29028775,react-native,facebook/react-native,C++,1034,A framework for building native applications using React,23767,114968,https://avatars.githubusercontent.com/u/69631?v=4
44838949,swift,apple/swift,C++,468,The Swift Programming Language,10138,65518,https://avatars.githubusercontent.com/u/10639145?v=4
160083795,serenity,SerenityOS/serenity,C++,910,The Serenity Operating System 🐞,2945,27916,https://avatars.githubusercontent.com/u/50811782?v=4
191820100,mediapipe,google/mediapipe,C++,418,"Cross-platform, customizable ML solutions for live and streaming media.",4917,24983,https://avatars.githubusercontent.com/u/1342004?v=4
615869301,LocalAI,mudler/LocalAI,C++,1159,":robot: The free, Open Source OpenAI alternative. Self-hosted, community-driven and local-first. Drop-in replacement for OpenAI running on consumer-grade hardware. No GPU required. Runs gguf, transformers, diffusers and many more models architectures. It allows to generate Text, Audio, Video, Images. Also with voice cloning capabilities.",1267,17383,https://avatars.githubusercontent.com/u/2420543?u=88a72adb708b5bf2ca40acda912778e65ac4cf43&v=4
138754790,duckdb,duckdb/duckdb,C++,734,DuckDB is an in-process SQL OLAP Database Management System,1356,15061,https://avatars.githubusercontent.com/u/82039556?v=4
470730648,Hyprland,hyprwm/Hyprland,C++,1039,Hyprland is a highly customizable dynamic tiling Wayland compositor that doesn't sacrifice on its looks.,587,15059,https://avatars.githubusercontent.com/u/107882187?v=4
14981376,dogecoin,dogecoin/dogecoin,C++,76,very currency,2743,14293,https://avatars.githubusercontent.com/u/6122353?v=4
11577304,dolphin,dolphin-emu/dolphin,C++,340,"Dolphin is a GameCube / Wii emulator, allowing you to play games for these two platforms on PC with improvements.",2517,11834,https://avatars.githubusercontent.com/u/5050316?v=4
438803890,Sunshine,LizardByte/Sunshine,C++,918,Self-hosted game stream host for Moonlight.,495,11016,https://avatars.githubusercontent.com/u/84790584?v=4
3386088,nix,NixOS/nix,C++,369,"Nix, the purely functional package manager",1318,10268,https://avatars.githubusercontent.com/u/487568?v=4
23496542,triton,openai/triton,C++,487,Development repository for the Triton language and compiler,1152,10216,https://avatars.githubusercontent.com/u/14957082?v=4
84183882,sentencepiece,google/sentencepiece,C++,252,Unsupervised text tokenizer for Neural Network-based text generation.,1092,9179,https://avatars.githubusercontent.com/u/1342004?v=4
14303048,mame,mamedev/mame,C++,327,MAME,1875,7452,https://avatars.githubusercontent.com/u/9024458?v=4
52882701,PrusaSlicer,prusa3d/PrusaSlicer,C++,118,"G-code generator for 3D printers (RepRap, Makerbot, Ultimaker etc.)",1828,7205,https://avatars.githubusercontent.com/u/14859759?v=4
527719753,Cemu,cemu-project/Cemu,C++,266,Cemu - Wii U emulator,459,6203,https://avatars.githubusercontent.com/u/40145098?v=4
679366051,TensorRT-LLM,NVIDIA/TensorRT-LLM,C++,998,TensorRT-LLM provides users with an easy-to-use Python API to define Large Language Models (LLMs) and build TensorRT engines that contain state-of-the-art optimizations to perform inference efficiently on NVIDIA GPUs. TensorRT-LLM also contains components to create Python and C++ runtimes that execute those TensorRT engines.,537,5736,https://avatars.githubusercontent.com/u/1728152?v=4
153097643,openvino,openvinotoolkit/openvino,C++,191,OpenVINO™ is an open-source toolkit for optimizing and deploying AI inference,1909,5570,https://avatars.githubusercontent.com/u/55443902?v=4
325036684,pineapple-src,pineappleEA/pineapple-src,C++,1331,A former citrus fruit-named emulator's Early Access source code,1173,5338,https://avatars.githubusercontent.com/u/67879877?u=7376b3a05a54da81e1a1319651192349051020ff&v=4
32231207,endless-sky,endless-sky/endless-sky,C++,333,"Space exploration, trading, and combat game.",941,5126,https://avatars.githubusercontent.com/u/11450262?v=4
10126031,mixxx,mixxxdj/mixxx,C++,102,Mixxx is Free DJ software that gives you everything you need to perform live mixes.,1199,4007,https://avatars.githubusercontent.com/u/1743769?v=4
521191759,FluidX3D,ProjectPhysX/FluidX3D,C++,110,"The fastest and most memory efficient lattice Boltzmann CFD software, running on all GPUs via OpenCL.",242,3058,https://avatars.githubusercontent.com/u/90851087?u=42f86cacbdddb2da5e6bf1ce0a9cc4ea425851b2&v=4
523007292,xla,openxla/xla,C++,94,"A machine learning compiler for GPUs, CPUs, and ML accelerators",301,2039,https://avatars.githubusercontent.com/u/107584881?v=4
334630126,bg3se,Norbyte/bg3se,C++,267,Baldur's Gate 3 Script Extender,52,913,https://avatars.githubusercontent.com/u/2243424?v=4
