id,name,full_name,language,new stars,description,forks_count,stargazers_count,avatar_url
2325298,linux,torvalds/linux,C,2235,Linux kernel source tree,51397,168230,https://avatars.githubusercontent.com/u/1024025?v=4
111583593,scrcpy,Genymobile/scrcpy,C,1970,Display and control your Android device,9811,100258,https://avatars.githubusercontent.com/u/3427627?v=4
156018,redis,redis/redis,C,674,"Redis is an in-memory database that persists on disk. The data model is key-value, but many different kind of values are supported: Strings, Lists, Sets, Sorted Sets, Hashes, Streams, HyperLogLogs, Bitmaps.",23195,64030,https://avatars.githubusercontent.com/u/1529926?v=4
13233158,obs-studio,obsproject/obs-studio,C,716,OBS Studio - Free and open source software for live streaming and screen recording,7458,54896,https://avatars.githubusercontent.com/u/7725691?v=4
36502,git,git/git,C,395,Git Source Code Mirror - This is a publish-only repository but pull requests can be turned into patches to the mailing list via GitGitGadget (https://gitgitgadget.github.io/). Please follow Documentation/SubmittingPatches procedure for any of your improvements.,24957,49226,https://avatars.githubusercontent.com/u/18133?v=4
1614410,FFmpeg,FFmpeg/FFmpeg,C,653,Mirror of https://git.ffmpeg.org/ffmpeg.git,11592,41655,https://avatars.githubusercontent.com/u/729418?v=4
569041,curl,curl/curl,C,627,"A command line tool and library for transferring data with URL syntax, supporting DICT, FILE, FTP, FTPS, GOPHER, GOPHERS, HTTP, HTTPS, IMAP, IMAPS, LDAP, LDAPS, MQTT, POP3, POP3S, RTMP, RTMPS, RTSP, SCP, SFTP, SMB, SMBS, SMTP, SMTPS, TELNET, TFTP, WS and WSS. libcurl offers a myriad of powerful features",6051,33849,https://avatars.githubusercontent.com/u/16928085?v=4
14812739,libuv,libuv/libuv,C,196,Cross-platform asynchronous I/O,3481,23079,https://avatars.githubusercontent.com/u/4030929?v=4
15337142,micropython,micropython/micropython,C,196,MicroPython - a lean and efficient Python implementation for microcontrollers and constrained systems,7252,18171,https://avatars.githubusercontent.com/u/6298560?v=4
272457606,cosmopolitan,jart/cosmopolitan,C,371,build-once run-anywhere c library,470,14416,https://avatars.githubusercontent.com/u/49262?u=ac68933ab61c639ab59ae693a41ae89cd874c16e&v=4
9524997,glfw,glfw/glfw,C,305,"A multi-platform library for OpenGL, OpenGL ES, Vulkan, window and input",4887,12083,https://avatars.githubusercontent.com/u/3905364?v=4
1856976,libevent,libevent/libevent,C,93,Event notification library,3321,10641,https://avatars.githubusercontent.com/u/833750?v=4
50874442,citus,citusdata/citus,C,207,Distributed PostgreSQL as an extension,628,9670,https://avatars.githubusercontent.com/u/2545424?v=4
7408108,rt-thread,RT-Thread/rt-thread,C,122,RT-Thread is an open source IoT real-time operating system (RTOS).,4779,9406,https://avatars.githubusercontent.com/u/1783729?v=4
59771425,zephyr,zephyrproject-rtos/zephyr,C,179,"Primary Git Repository for the Zephyr Project. Zephyr is a new generation, scalable, optimized, secure RTOS for multiple hardware architectures.",5791,9395,https://avatars.githubusercontent.com/u/19595895?v=4
106586124,atomic-red-team,redcanaryco/atomic-red-team,C,180,Small and highly portable detection tests based on MITRE's ATT&CK.,2644,8912,https://avatars.githubusercontent.com/u/6877001?v=4
40556106,wazuh,wazuh/wazuh,C,589,Wazuh - The Open Source Security Platform. Unified XDR and SIEM protection for endpoints and cloud workloads.,1401,8842,https://avatars.githubusercontent.com/u/13752566?v=4
88327406,xmrig,xmrig/xmrig,C,119,"RandomX, KawPow, CryptoNight and GhostRider unified CPU/GPU miner and RandomX benchmark",3321,8259,https://avatars.githubusercontent.com/u/27528955?u=555699fb82e7598ed7dd1f6e47302042b48a10c3&v=4
94530674,nvtop,Syllo/nvtop,C,993,"GPU & Accelerator process monitoring for AMD, Apple, Huawei, Intel, NVIDIA and Qualcomm",262,7237,https://avatars.githubusercontent.com/u/2741868?u=76c9f7d03ce2f8b845a2cf22bd80704f808cdb60&v=4
127023441,cuda-samples,NVIDIA/cuda-samples,C,220,Samples for CUDA Developers which demonstrates features in CUDA Toolkit,1593,5133,https://avatars.githubusercontent.com/u/1728152?v=4
83160811,littlefs,littlefs-project/littlefs,C,104,A little fail-safe filesystem designed for microcontrollers,746,4696,https://avatars.githubusercontent.com/u/60944974?v=4
27359183,GmSSL,guanzhi/GmSSL,C,79,支持国密SM2/SM3/SM4/SM9/SSL的密码工具箱,1577,4656,https://avatars.githubusercontent.com/u/1787781?u=c71c577b7da3afe39a461344fdca316d82f91735&v=4
276293034,age,apache/age,C,175,Graph database optimized for fast analysis and real-time data processing. It is provided as an extension to PostgreSQL.,354,2561,https://avatars.githubusercontent.com/u/47359?v=4
595813523,Dopamine,opa334/Dopamine,C,371,Dopamine is a semi-untethered jailbreak for iOS 15 and 16,261,2518,https://avatars.githubusercontent.com/u/18235760?v=4
754477142,Femc-Reloaded-Project,MadMax1960/Femc-Reloaded-Project,C,66,Repo for Femc Reloaded Project,34,145,https://avatars.githubusercontent.com/u/30520119?u=ac40bcb1739287c91b8d4a0e73ceac66cab0c928&v=4
