id,name,full_name,language,new stars,description,forks_count,stargazers_count,avatar_url
679237742,gpt-pilot,Pythagora-io/gpt-pilot,Python,471,Dev tool that writes scalable apps from scratch while the developer oversees the implementation,1527,18425,https://avatars.githubusercontent.com/u/123263103?v=4
66474729,prowler,prowler-cloud/prowler,Python,8,"Prowler is an Open Source Security tool for AWS, Azure and GCP to perform Cloud Security best practices assessments, audits, incident response, compliance, continuous monitoring, hardening and forensics readiness. Includes CIS, NIST 800, NIST CSF, CISA, FedRAMP, PCI-DSS, GDPR, HIPAA, FFIEC, SOC2, GXP, Well-Architected Security, ENS and more.",1320,8942,https://avatars.githubusercontent.com/u/97106991?v=4
724635656,StreamDiffusion,cumulo-autumn/StreamDiffusion,Python,1332,StreamDiffusion: A Pipeline-Level Solution for Real-Time Interactive Generation,361,5857,https://avatars.githubusercontent.com/u/32358491?u=a79d18dd415ac3d2fad6f3225080ab34ab4e4b9d&v=4
633262635,danswer,danswer-ai/danswer,Python,96,"Ask Questions in natural language and get Answers backed by private sources. Connects to tools like Slack, GitHub, Confluence, etc.",574,5671,https://avatars.githubusercontent.com/u/131946000?v=4
701540574,ml-ferret,apple/ml-ferret,Python,933,,217,4762,https://avatars.githubusercontent.com/u/10639145?v=4
720798474,clone-voice,jianchang512/clone-voice,Python,303,"A sound cloning tool with a web interface, using your voice or any sound to record audio / 一个带web界面的声音克隆工具，使用你的音色或任意声音来录制音频",340,3960,https://avatars.githubusercontent.com/u/3378335?u=adc6504fe417784164e64a857edd4256b56dd84d&v=4
549007739,TikTokDownloader,JoeanAmier/TikTokDownloader,Python,386,完全免费开源，基于 Requests 模块实现：TikTok 主页/视频/图集/原声；抖音主页/视频/图集/收藏/直播/原声/合集/评论/账号/搜索/热榜数据采集工具,462,2911,https://avatars.githubusercontent.com/u/49263334?u=42a02c220c618b58a61c1f9e4a39b506cee241de&v=4
733899994,AppAgent,mnotgod96/AppAgent,Python,320,"AppAgent: Multimodal Agents as Smartphone Users, an LLM-based multimodal agent framework designed to operate smartphone apps.",180,2079,https://avatars.githubusercontent.com/u/27103154?u=5af9e6657cf2b3f155d6e17ff637a5eb49a101e2&v=4
653171718,promptbench,microsoft/promptbench,Python,246,A unified evaluation framework for large language models,93,1231,https://avatars.githubusercontent.com/u/6154722?v=4
