id,name,full_name,language,new stars,description,forks_count,stargazers_count,avatar_url
132750724,build-your-own-x,codecrafters-io/build-your-own-x,,12472,Master programming by recreating your favorite technologies from scratch.,26328,280585,https://avatars.githubusercontent.com/u/58904235?v=4
655806940,generative-ai-for-beginners,microsoft/generative-ai-for-beginners,Jupyter Notebook,5608,"18 Lessons, Get Started Building with Generative AI  🔗 https://microsoft.github.io/generative-ai-for-beginners/",27063,50342,https://avatars.githubusercontent.com/u/6154722?v=4
589831718,ComfyUI,comfyanonymous/ComfyUI,Python,4389,"The most powerful and modular stable diffusion GUI, api and backend with a graph/nodes interface.",4335,40664,https://avatars.githubusercontent.com/u/121283862?u=00e0967075548ed41bd53ed0eacd34ac42d8cef0&v=4
332880689,coolify,coollabsio/coolify,PHP,9190,An open-source & self-hostable Heroku / Netlify / Vercel alternative.,1313,25924,https://avatars.githubusercontent.com/u/60715044?v=4
138754790,duckdb,duckdb/duckdb,C++,2892,DuckDB is an analytical in-process SQL database management system,1658,20443,https://avatars.githubusercontent.com/u/82039556?v=4
760231710,Open-Sora,hpcaitech/Open-Sora,Python,2842,Open-Sora: Democratizing Efficient Video Production for All,1892,19967,https://avatars.githubusercontent.com/u/88699314?v=4
738733003,fabric,danielmiessler/fabric,Python,4452,fabric is an open-source framework for augmenting humans using AI. It provides a modular framework for solving specific problems using a crowdsourced set of AI prompts that can be used anywhere.,1831,17828,https://avatars.githubusercontent.com/u/50654?u=cb240d3a67938da653614ef5ec97c58c0c173abe&v=4
175405157,oh-my-posh,JanDeDobbeleer/oh-my-posh,Go,1240,The most customisable and low-latency cross platform/shell prompt renderer,2282,15727,https://avatars.githubusercontent.com/u/2492783?u=9efc0865ae5e7d420eb83663315e5b4518d11387&v=4
583706111,LazyVim,LazyVim/LazyVim,Lua,1531,Neovim config for the lazy,1050,15252,https://avatars.githubusercontent.com/u/122150220?v=4
712111618,marker,VikParuchuri/marker,Python,4368,Convert PDF to markdown quickly with high accuracy,678,13683,https://avatars.githubusercontent.com/u/913340?v=4
601161044,transformers.js,xenova/transformers.js,JavaScript,1929,"State-of-the-art Machine Learning for the web. Run 🤗 Transformers directly in your browser, with no need for a server!",581,9852,https://avatars.githubusercontent.com/u/26504141?u=0e82815ed3ab279a77815adccc63b9d73725edde&v=4
749647889,MiniCPM-V,OpenBMB/MiniCPM-V,Python,3378,MiniCPM-Llama3-V 2.5: A GPT-4V Level Multimodal LLM on Your Phone,533,7726,https://avatars.githubusercontent.com/u/89920203?v=4
699432836,pyvideotrans,jianchang512/pyvideotrans,Python,1620,Translate the video from one language to another and add dubbing.         将视频从一种语言翻译为另一种语言，并添加配音,848,7651,https://avatars.githubusercontent.com/u/3378335?u=adc6504fe417784164e64a857edd4256b56dd84d&v=4
639772835,StableSwarmUI,Stability-AI/StableSwarmUI,C#,1417,"StableSwarmUI, A Modular Stable Diffusion Web-User-Interface, with an emphasis on making powertools easily accessible, high performance, and extensibility.",328,4046,https://avatars.githubusercontent.com/u/100950301?v=4
531380835,sherpa-onnx,k2-fsa/sherpa-onnx,C++,1231,"Speech-to-text, text-to-speech, and speaker recognition using next-gen Kaldi with onnxruntime without Internet connection. Support embedded systems, Android, iOS, Raspberry Pi, RISC-V, x86_64 servers, websocket server/client, C/C++, Python, Kotlin, C#, Go, NodeJS, Java, Swift, Dart, JavaScript, Flutter",270,2236,https://avatars.githubusercontent.com/u/71431748?v=4
