id,name,full_name,language,new stars,description,forks_count,stargazers_count,avatar_url
54346799,public-apis,public-apis/public-apis,Python,10819,A collective list of free APIs,32893,307287,https://avatars.githubusercontent.com/u/51121562?v=4
123458551,Python-100-Days,jackfrued/Python-100-Days,Python,1602,Python - 100天从新手到大师,51792,153380,https://avatars.githubusercontent.com/u/7474657?u=902200c2389c203cf2139888e10314845edd2a2a&v=4
1039520,youtube-dl,ytdl-org/youtube-dl,Python,829,Command-line program to download videos from YouTube.com and other video sites,9833,130291,https://avatars.githubusercontent.com/u/48381040?v=4
101138315,d2l-zh,d2l-ai/d2l-zh,Python,1545,《动手学深度学习》：面向中文读者、能运行、可讨论。中英文版被70多个国家的500多所大学用于教学。,10703,59840,https://avatars.githubusercontent.com/u/43974506?v=4
222751131,30-Days-Of-Python,Asabeneh/30-Days-Of-Python,Python,5819,"30 days of Python programming challenge is a step-by-step guide to learn the Python programming language in 30 days. This challenge may take more than100 days, follow your own pace.  These videos may help too: https://www.youtube.com/channel/UC7PNRuno1rzYPb1xLa4yktw",7522,39180,https://avatars.githubusercontent.com/u/9008063?u=f81793c2c5326057180833e306ae4d5973a6eacf&v=4
143328315,mindsdb,mindsdb/mindsdb,Python,3486,The platform for building AI from enterprise data,4815,25866,https://avatars.githubusercontent.com/u/31035808?v=4
319029846,Depix,spipm/Depix,Python,219,Recovers passwords from pixelized screenshots,3133,25536,https://avatars.githubusercontent.com/u/4620457?u=65126c58db47d3d1d0d6cbd4b18d8e8134d65fbf&v=4
599547518,vllm,vllm-project/vllm,Python,2045,A high-throughput and memory-efficient inference and serving engine for LLMs,3420,23820,https://avatars.githubusercontent.com/u/136984999?v=4
656099147,mem0,mem0ai/mem0,Python,9161,The memory layer for Personalized AI,1717,18033,https://avatars.githubusercontent.com/u/137054526?v=4
638629097,aider,paul-gauthier/aider,Python,2221,aider is AI pair programming in your terminal,1386,14654,https://avatars.githubusercontent.com/u/69695708?u=1b1a608998950cb407854549123a52c964a202ec&v=4
505667511,CodeFormer,sczhou/CodeFormer,Python,485,[NeurIPS 2022] Towards Robust Blind Face Restoration with Codebook Lookup Transformer,3131,14535,https://avatars.githubusercontent.com/u/14334509?u=7d30c71af7c2ab4d4f2fbbdead98722f5886cee8&v=4
494232964,flash-attention,Dao-AILab/flash-attention,Python,912,Fast and memory-efficient exact attention,1130,12650,https://avatars.githubusercontent.com/u/139507659?v=4
3757435,pytube,pytube/pytube,Python,1179,"A lightweight, dependency-free Python library (and command-line utility) for downloading YouTube Videos.",2450,11734,https://avatars.githubusercontent.com/u/16789089?v=4
540842713,buzz,chidiwilliams/buzz,Python,675,Buzz transcribes and translates audio offline on your personal computer. Powered by OpenAI's Whisper.,856,11313,https://avatars.githubusercontent.com/u/17879672?u=aca9038931e8baf6600a49425f2c79d4a0607640&v=4
636372163,litgpt,Lightning-AI/litgpt,Python,1036,"20+ high-performance LLMs with recipes to pretrain, finetune and deploy at scale.",910,9102,https://avatars.githubusercontent.com/u/58386951?v=4
776854298,storm,stanford-oval/storm,Python,3756,An LLM-powered knowledge curation system that researches a topic and generates a full-length report with citations.,803,8584,https://avatars.githubusercontent.com/u/13667124?v=4
702796244,fish-speech,fishaudio/fish-speech,Python,4077,Brand new TTS solution,512,6567,https://avatars.githubusercontent.com/u/122017386?v=4
396413613,wxauto,cluic/wxauto,Python,611,Windows版本微信客户端（非网页版）自动化，可实现简单的发送、接收微信消息，简单微信机器人,395,2446,https://avatars.githubusercontent.com/u/88969402?u=a6f764df3169a8f8da3f52de69e103be6ddb5bc8&v=4
696572451,InternLM-XComposer,InternLM/InternLM-XComposer,Python,397,InternLM-XComposer-2.5: A Versatile Large Vision Language Model Supporting Long-Contextual Input and Output,141,2299,https://avatars.githubusercontent.com/u/135356492?v=4
774497032,PraisonAI,MervinPraison/PraisonAI,Python,935,"PraisonAI application combines AutoGen and CrewAI or similar frameworks into a low-code solution for building and managing multi-agent LLM systems, focusing on simplicity, customisation, and efficient human-agent collaboration. Chat with your ENTIRE Codebase.",248,1867,https://avatars.githubusercontent.com/u/454862?u=c1e352a7e6b62c0dc56d7dc04ed3e88e7051cc6f&v=4
