id,name,full_name,language,new stars,description,forks_count,stargazers_count,avatar_url
33614304,thefuck,nvbn/thefuck,Python,210,Magnificent app which corrects your previous console command.,3381,78399,https://avatars.githubusercontent.com/u/1114542?v=4
552661142,langchain,hwchase17/langchain,Python,352,⚡ Building applications with LLMs through composability ⚡,6904,53912,https://avatars.githubusercontent.com/u/11986836?u=f4c4f21a82b2af6c9f91e1f1d99ea40062f7a101&v=4
162405963,gradio,gradio-app/gradio,Python,46,Create UIs for your machine learning model in Python in 3 minutes,1318,19615,https://avatars.githubusercontent.com/u/51063788?v=4
560704231,llama_index,jerryjliu/llama_index,Python,70,LlamaIndex (GPT Index) is a data framework for your LLM applications,2081,18823,https://avatars.githubusercontent.com/u/4858925?u=eb0717916ba7f9d8b9402d17a22e6f645d0f97c7&v=4
106024057,pytorch_geometric,pyg-team/pytorch_geometric,Python,16,Graph Neural Network Library for PyTorch,3311,18032,https://avatars.githubusercontent.com/u/89995122?v=4
70908208,rasa,RasaHQ/rasa,Python,8,"💬   Open source machine learning framework to automate text- and voice-based conversations: NLU, dialogue management, connect to Slack, Facebook, and more - Create chatbots and voice assistants",4392,16670,https://avatars.githubusercontent.com/u/21214473?v=4
646480766,roop,s0md3v/roop,Python,363,one-click deepfake (face swap),2806,15832,https://avatars.githubusercontent.com/u/26716802?u=51ee13ab4744b9215b6c97974a741906ff47aa07&v=4
611618121,awesome-free-chatgpt,LiLittleCat/awesome-free-chatgpt,Python,109,"🆓免费的 ChatGPT 镜像网站列表，持续更新。List of free ChatGPT mirror sites, continuously updated. ",611,7751,https://avatars.githubusercontent.com/u/40536573?u=8d07e8ee2eddbd197617d337424ee92cd2496ccd&v=4
589831718,ComfyUI,comfyanonymous/ComfyUI,Python,227,A powerful and modular stable diffusion GUI with a graph/nodes interface.,638,7328,https://avatars.githubusercontent.com/u/121283862?u=f3e53b07cfbae7136f1796d4f6453827a12c2307&v=4
559584476,kohya_ss,bmaltais/kohya_ss,Python,22,,580,4452,https://avatars.githubusercontent.com/u/7474674?u=9080e36bd542746d6ecd104f11b22ce8c5305b0f&v=4
618613272,h2ogpt,h2oai/h2ogpt,Python,155,"Join us at H2O.ai to make the world's best open-source GPT with document and image Q&A, 100% private chat, no data leaks, Apache 2.0 https://arxiv.org/pdf/2306.08161.pdf   Live Demo: https://gpt.h2o.ai/",499,4342,https://avatars.githubusercontent.com/u/1402695?v=4
613731840,LLMSurvey,RUCAIBox/LLMSurvey,Python,263,"The official GitHub page for the survey paper ""A Survey of Large Language Models"".",290,3836,https://avatars.githubusercontent.com/u/54706620?v=4
660551251,MetaGPT,geekan/MetaGPT,Python,360,"🌟 The Multi-Agent Meta Programming Framework: Given one line Requirement, return PRD, Design, Tasks, Repo",411,2795,https://avatars.githubusercontent.com/u/2707039?u=463185951e02a6ba817bf59f549e917b7690348c&v=4
639095114,gpt-code-ui,ricklamers/gpt-code-ui,Python,77,An open source implementation of OpenAI's ChatGPT Code interpreter,220,2071,https://avatars.githubusercontent.com/u/1309307?u=2fac0eb1bacd8216e8a426599cd4618dcfdb9e67&v=4
185508052,Automatic_ticket_purchase,MakiNaruto/Automatic_ticket_purchase,Python,18,大麦网抢票脚本,420,1763,https://avatars.githubusercontent.com/u/25942376?u=d69ce5b6700992fadc9229731e7c9daf0b80323a&v=4
622697476,New-Grad-2024,ReaVNaiL/New-Grad-2024,Python,153,"👋 Hey there new grad🎉! We've put together a collection of full-time job openings for SWE, Quant, PM and tech roles in 2024! 🚀",93,1705,https://avatars.githubusercontent.com/u/59776018?u=0761c37df12cc1e62c2ca126a640b0c282df67a8&v=4
633262635,danswer,danswer-ai/danswer,Python,524,OpenSource Enterprise QA,61,1130,https://avatars.githubusercontent.com/u/131946000?v=4
325043692,decrypt-chrome-passwords,ohyicong/decrypt-chrome-passwords,Python,35,,112,540,https://avatars.githubusercontent.com/u/36614573?u=3899651bdbba67ca2dc13642d15e013a3c6c6410&v=4
657702191,Price-Tracking-Web-Scraper,techwithtim/Price-Tracking-Web-Scraper,Python,34,"An automated price tracker that uses bright data, playwright, react and flask.",242,536,https://avatars.githubusercontent.com/u/35348871?u=509fc2676791a044041ef05df9942f2abe07e5de&v=4
587821554,Pangu-Weather,198808xc/Pangu-Weather,Python,22,An official implementation of Pangu-Weather,62,337,https://avatars.githubusercontent.com/u/23566242?v=4
663009035,LongNet,kyegomez/LongNet,Python,45,"Implementation of plug in and play Attention from ""LongNet: Scaling Transformers to 1,000,000,000 Tokens""",31,321,https://avatars.githubusercontent.com/u/98760976?u=20f6194e354d56e7751f1c06283cc5422dd0285b&v=4
663443131,threads-net,dmytrostriletskyi/threads-net,Python,30,Unofficial and reverse-engineered Threads (threads.net) Python API wrapper. Supports read and write capabilities. ,32,254,https://avatars.githubusercontent.com/u/22666467?u=b0bce0c3acd4536f3cdd186cfc037763f73682f6&v=4
663121272,GPT4RoI,jshilong/GPT4RoI,Python,32,GPT4RoI: Instruction Tuning Large Language Model on Region-of-Interest,9,209,https://avatars.githubusercontent.com/u/61961338?u=f39aa901b998a8e8bf0efcbdd0a200132a5ce3d7&v=4
629044927,bump-pydantic,pydantic/bump-pydantic,Python,14,Convert Pydantic from V1 to V2 ♻,8,147,https://avatars.githubusercontent.com/u/110818415?v=4
664043408,sd-webui-xldemo-txt2img,lifeisboringsoprogramming/sd-webui-xldemo-txt2img,Python,33,Stable Diffusion XL 0.9 Demo webui extension,7,61,https://avatars.githubusercontent.com/u/119839123?u=ea6a1d6a32f749309288c591e75d63215939bc7c&v=4
