id,name,full_name,language,new stars,description,forks_count,stargazers_count,avatar_url
212639071,devops-exercises,bregman-arie/devops-exercises,Python,1406,"Linux, Jenkins, AWS, SRE, Prometheus, Docker, Python, Ansible, Git, Kubernetes, Terraform, OpenStack, SQL, NoSQL, Azure, GCP, DNS, Elastic, Network, Virtualization. DevOps Interview Questions",15508,69690,https://avatars.githubusercontent.com/u/10349437?u=bb7c3c533587d7cb2e3dd336e0f8a0d40544e5f5&v=4
660551251,MetaGPT,geekan/MetaGPT,Python,1185,"🌟 The Multi-Agent Framework: First AI Software Company, Towards Natural Language Programming",5781,48780,https://avatars.githubusercontent.com/u/2707039?u=463185951e02a6ba817bf59f549e917b7690348c&v=4
771302083,OpenHands,All-Hands-AI/OpenHands,Python,1037,"🙌 OpenHands: Code Less, Make More",5346,48668,https://avatars.githubusercontent.com/u/169105795?v=4
646410686,LLaMA-Factory,hiyouga/LLaMA-Factory,Python,1165,Unified Efficient Fine-Tuning of 100+ LLMs & VLMs (ACL 2024),5242,42916,https://avatars.githubusercontent.com/u/16256802?u=9622ad4c25aa0a0bfc6dfac3db6bd0d7732c0f1e&v=4
323048702,OpenBB,OpenBB-finance/OpenBB,Python,357,"Investment Research for Everyone, Everywhere.",3318,36607,https://avatars.githubusercontent.com/u/80064875?v=4
778431525,graphrag,microsoft/graphrag,Python,304,A modular graph-based Retrieval-Augmented Generation (RAG) system,2290,23073,https://avatars.githubusercontent.com/u/6154722?v=4
793375104,awesome-llm-apps,Shubhamsaboo/awesome-llm-apps,Python,1357,"Collection of awesome LLM apps with AI Agents and RAG using OpenAI, Anthropic, Gemini and opensource models.",2131,18699,https://avatars.githubusercontent.com/u/31396011?u=db73a4bd5d86eb3a3a0f270cfc6394c321864821&v=4
631258918,pandas-ai,sinaptik-ai/pandas-ai,Python,1218,"Chat with your database or your datalake (SQL, CSV, parquet). PandasAI makes data analysis conversational using LLMs and RAG.",1621,17383,https://avatars.githubusercontent.com/u/154438448?v=4
627480054,DB-GPT,eosphoros-ai/DB-GPT,Python,155,AI Native Data App Development framework with AWEL(Agentic Workflow Expression Language) and Agents,2031,14938,https://avatars.githubusercontent.com/u/140580304?v=4
834369920,minimind,jingyaogong/minimind,Python,1485,🚀🚀 「大模型」2小时完全从0训练26M的小参数GPT！🌏 Train a 26M-parameter GPT from scratch in just 2h!,1574,14249,https://avatars.githubusercontent.com/u/62287848?u=d4a009e1468818967e9bed23e8c32b92edd2b502&v=4
866513204,LightRAG,HKUDS/LightRAG,Python,290,"""LightRAG: Simple and Fast Retrieval-Augmented Generation""",1746,12440,https://avatars.githubusercontent.com/u/118165258?u=86ac39b85a7764887595bf0691716004139ddb7d&v=4
728770766,DiffSynth-Studio,modelscope/DiffSynth-Studio,Python,743,Enjoy the magic of Diffusion models!,678,7612,https://avatars.githubusercontent.com/u/109945100?v=4
812975380,agent-zero,frdel/agent-zero,Python,257,Agent Zero AI framework,1347,6143,https://avatars.githubusercontent.com/u/38891707?u=c4e65615d22ed17c9f5f7af1d316b0b7bcb1e9c6&v=4
860912552,KAG,OpenSPG/KAG,Python,263,KAG is a logical form-guided reasoning and retrieval framework based on OpenSPG engine and LLMs.  It is used to build logical reasoning and factual Q&A solutions for professional domain knowledge bases. It can effectively overcome the shortcomings of the traditional RAG vector similarity calculation model.,376,5720,https://avatars.githubusercontent.com/u/148738724?v=4
756637341,vision-agent,landing-ai/vision-agent,Python,800,Vision agent,423,3908,https://avatars.githubusercontent.com/u/34525670?v=4
863276973,PIKE-RAG,microsoft/PIKE-RAG,Python,394,PIKE-RAG: sPecIalized KnowledgE and Rationale Augmented Generation,102,1288,https://avatars.githubusercontent.com/u/6154722?v=4
