id,name,full_name,language,new stars,description,forks_count,stargazers_count,avatar_url
184456251,PowerToys,microsoft/PowerToys,C#,628,Windows system utilities to maximize productivity,5576,94954,https://avatars.githubusercontent.com/u/6154722?v=4
49609581,PowerShell,PowerShell/PowerShell,C#,91,PowerShell for every system!,7490,40475,https://avatars.githubusercontent.com/u/11524380?v=4
120231691,Ryujinx,Ryujinx/Ryujinx,C#,419,Experimental Nintendo Switch Emulator written in C#,2338,24690,https://avatars.githubusercontent.com/u/39036280?v=4
161012019,jellyfin,jellyfin/jellyfin,C#,369,The Free Software Media System,2244,24599,https://avatars.githubusercontent.com/u/45698031?v=4
14964475,Avalonia,AvaloniaUI/Avalonia,C#,100,"Develop Desktop, Embedded, Mobile and WebAssembly apps with C# and XAML. The most popular .NET Foundation community project.",1647,19495,https://avatars.githubusercontent.com/u/14075148?v=4
411493648,DevToys,veler/DevToys,C#,984,A Swiss Army knife for developers.,927,17056,https://avatars.githubusercontent.com/u/3747805?u=044bffcd8836f3a15f9f26378a9d7c85c5cffcfe&v=4
102904613,ml-agents,Unity-Technologies/ml-agents,C#,35,The Unity Machine Learning Agents Toolkit (ML-Agents) is an open-source project that enables games and simulations to serve as environments for training intelligent agents using deep reinforcement learning and imitation learning.,3938,15317,https://avatars.githubusercontent.com/u/426196?v=4
324473895,downkyi,leiurayer/downkyi,C#,154,哔哩下载姬downkyi，哔哩哔哩网站视频下载工具，支持批量下载，支持8K、HDR、杜比视界，提供工具箱（音视频提取、去水印等）。,1753,14613,https://avatars.githubusercontent.com/u/19290097?u=589c798ec2b77363ddf03308123a6f8c718a8426&v=4
375939072,FastGithub,dotnetcore/FastGithub,C#,178,github加速神器，解决github打不开、用户头像无法加载、releases无法上传下载、git-clone、git-pull、git-push失败等问题,1941,14167,https://avatars.githubusercontent.com/u/19404084?v=4
69673033,CleanArchitecture,ardalis/CleanArchitecture,C#,85,Clean Architecture Solution Template: A starting point for Clean Architecture with ASP.NET Core,2351,13305,https://avatars.githubusercontent.com/u/782127?u=75698de8f7b1cc3fda730cd742d8d8d59bd7a15c&v=4
213460285,CleanArchitecture,jasontaylordev/CleanArchitecture,C#,88,Clean Architecture Solution Template for ASP.NET Core,2931,13107,https://avatars.githubusercontent.com/u/1988321?u=a1c4449e215a2e4ea54a1a5787c01ca32add274a&v=4
16157746,efcore,dotnet/efcore,C#,21,"EF Core is a modern object-database mapper for .NET. It supports LINQ queries, change tracking, updates, and schema migrations.",3001,12751,https://avatars.githubusercontent.com/u/9141961?v=4
607289185,semantic-kernel,microsoft/semantic-kernel,C#,703,Integrate cutting-edge LLM technology quickly and easily into your apps,1791,12639,https://avatars.githubusercontent.com/u/6154722?v=4
201188122,lively,rocksdanister/lively,C#,234,Free and open-source software that allows users to set animated desktop wallpapers and screensavers powered by WinUI 3.,945,12020,https://avatars.githubusercontent.com/u/17554161?u=65f51a36d9c0072b244c13d215fc743e464f5cce&v=4
245235133,reverse-proxy,microsoft/reverse-proxy,C#,25,A toolkit for developing high-performance HTTP reverse proxy applications.,685,6877,https://avatars.githubusercontent.com/u/6154722?v=4
26884725,OrchardCore,OrchardCMS/OrchardCore,C#,30,"Orchard Core is an open-source modular and multi-tenant application framework built with ASP.NET Core, and a content management system (CMS) built on top of that framework.",2217,6756,https://avatars.githubusercontent.com/u/1159247?v=4
151148482,elsa-core,elsa-workflows/elsa-core,C#,82,A .NET workflows library,893,4921,https://avatars.githubusercontent.com/u/51759159?v=4
389218073,wpfui,lepoco/wpfui,C#,62,"WPF UI provides the Fluent experience in your known and loved WPF framework. Intuitive design, themes, navigation and new immersive controls. All natively and effortlessly.",543,4910,https://avatars.githubusercontent.com/u/87412094?v=4
133600987,Malware-Patch,the1812/Malware-Patch,C#,173,阻止中国流氓软件的管理员授权. / Prevent UAC authorization of Chinese malware.,179,3167,https://avatars.githubusercontent.com/u/26504152?u=0360dd7ed7fe68d694ffa0658bba30b101aad7c6&v=4
636565625,Starward,Scighost/Starward,C#,165,Game Launcher for miHoYo  -  米家游戏启动器,71,1440,https://avatars.githubusercontent.com/u/61003590?u=1f03b19f2b61aa8b5ede883be77e2ce9c2e92c4f&v=4
654569590,Translumo,Danily07/Translumo,C#,466,"Advanced real-time screen translator for games, hardcoded subtitles in videos, static text and etc.",42,1107,https://avatars.githubusercontent.com/u/29047281?u=4f0152b4c8ce41b01bcdcad7d62e521d9aa279f2&v=4
520583586,bloxstrap,pizzaboxer/bloxstrap,C#,29,"An open-source, feature-packed alternative bootstrapper for Roblox.",56,515,https://avatars.githubusercontent.com/u/41478239?u=43e7b9399f7319396b38279b0f3318f0e2a168f4&v=4
650737579,MegacityMultiplayer,Unity-Technologies/MegacityMultiplayer,C#,19,"Megacity Multiplayer is an action-packed, shooter game based on the original Megacity sample. It leverages the power of Netcode for Entities for an immersive, multiplayer experience that can support 64+ players simultaneously.",43,299,https://avatars.githubusercontent.com/u/426196?v=4
602764290,miyagi,Azure-Samples/miyagi,C#,22,Sample to envision intelligent apps with Microsoft's Copilot stack for AI-infused product experiences.,76,291,https://avatars.githubusercontent.com/u/1844662?v=4
662513403,C_Sharp,sksalahuddin2828/C_Sharp,C#,23,Explore something new,69,141,https://avatars.githubusercontent.com/u/127140921?u=745d5e1c661fb2312ea830b08eb5ccb109f6d8d8&v=4
