id,name,full_name,language,new stars,description,forks_count,stargazers_count,avatar_url
17620347,aspnetcore,dotnet/aspnetcore,C#,92,"ASP.NET Core is a cross-platform .NET framework for building modern cloud-based web applications on Windows, Mac, or Linux.",8520,30234,https://avatars.githubusercontent.com/u/9141961?v=4
262395224,maui,dotnet/maui,C#,78,".NET MAUI is the .NET Multi-platform App UI, a framework for building native device applications spanning mobile, tablet, and desktop.",1125,17695,https://avatars.githubusercontent.com/u/9141961?v=4
14964475,Avalonia,AvaloniaUI/Avalonia,C#,107,A cross-platform UI framework for .NET,1409,16056,https://avatars.githubusercontent.com/u/14075148?v=4
120231691,Ryujinx,Ryujinx/Ryujinx,C#,260,Experimental Nintendo Switch Emulator written in C#,1691,14209,https://avatars.githubusercontent.com/u/39036280?v=4
16157746,efcore,dotnet/efcore,C#,32,"EF Core is a modern object-database mapper for .NET. It supports LINQ queries, change tracking, updates, and schema migrations.",2852,11938,https://avatars.githubusercontent.com/u/9141961?v=4
69673033,CleanArchitecture,ardalis/CleanArchitecture,C#,75,Clean Architecture Solution Template: A starting point for Clean Architecture with ASP.NET Core,2129,11583,https://avatars.githubusercontent.com/u/782127?u=75698de8f7b1cc3fda730cd742d8d8d59bd7a15c&v=4
28239455,AspNetCore.Docs,dotnet/AspNetCore.Docs,C#,34,Documentation for ASP.NET Core,25028,11139,https://avatars.githubusercontent.com/u/9141961?v=4
210716005,runtime,dotnet/runtime,C#,76,".NET is a cross-platform runtime for cloud, mobile, desktop, and IoT apps.",3573,10646,https://avatars.githubusercontent.com/u/9141961?v=4
213460285,CleanArchitecture,jasontaylordev/CleanArchitecture,C#,51,Clean Architecture Solution Template for .NET 7,2343,10328,https://avatars.githubusercontent.com/u/1988321?u=f96f36eed8f5bc57c4aab7213306f960efc072b1&v=4
182095352,N_m3u8DL-CLI,nilaoda/N_m3u8DL-CLI,C#,92,"[.NET] m3u8 downloader 开源的命令行m3u8/HLS/dash下载器，支持普通AES-128-CBC解密，多线程，自定义请求头等. 支持简体中文,繁体中文和英文. English Supported.",1773,10155,https://avatars.githubusercontent.com/u/20772925?u=6332a7ef3fc5f4f6ce844a764e912638fc01b64a&v=4
203892454,modular-monolith-with-ddd,kgrzybek/modular-monolith-with-ddd,C#,42,Full Modular Monolith application with Domain-Driven Design approach.,1142,7645,https://avatars.githubusercontent.com/u/1327418?v=4
372096057,Bili.Uwp,Richasy/Bili.Uwp,C#,57,适用于新系统UI的哔哩,456,6793,https://avatars.githubusercontent.com/u/27713596?u=9566724713f4741794fb48625c333fdedc5e5f1d&v=4
743436,ET,egametang/ET,C#,41,Unity3D Client And C# Server Framework,2407,6427,https://avatars.githubusercontent.com/u/315758?v=4
187499284,UniTask,Cysharp/UniTask,C#,42,Provides an efficient allocation free async/await integration for Unity.,456,4383,https://avatars.githubusercontent.com/u/44487420?v=4
288428676,MudBlazor,MudBlazor/MudBlazor,C#,37,"Blazor Component Library based on Material design. The goal is to do more with Blazor, utilizing CSS and keeping Javascript to a bare minimum.",759,4330,https://avatars.githubusercontent.com/u/79755064?v=4
117102183,hotchocolate,ChilliCream/hotchocolate,C#,42,"Welcome to the home of the Hot Chocolate GraphQL server for .NET, the Strawberry Shake GraphQL client for .NET and Banana Cake Pop the awesome Monaco based GraphQL IDE.",576,4022,https://avatars.githubusercontent.com/u/16239022?v=4
100711978,btcpayserver,btcpayserver/btcpayserver,C#,145,"Accept Bitcoin payments. Free, open-source & self-hosted, Bitcoin payment processor. ",981,4017,https://avatars.githubusercontent.com/u/31132886?v=4
85242321,MQTTnet,dotnet/MQTTnet,C#,24,MQTTnet is a high performance .NET library for MQTT based communication. It provides a MQTT client and a MQTT server (broker). The implementation is based on the documentation from http://mqtt.org/.,835,3211,https://avatars.githubusercontent.com/u/9141961?v=4
363866643,ToastFish,Uahh/ToastFish,C#,486,一个利用摸鱼时间背单词的软件。,259,2560,https://avatars.githubusercontent.com/u/40496762?u=d2d6b7bbebc4e0f70df49c9d0c949fab0324a773&v=4
21311240,PKHeX,kwsch/PKHeX,C#,116,Pokémon Save File Editor,484,2424,https://avatars.githubusercontent.com/u/6393368?v=4
63984307,sdk,dotnet/sdk,C#,13,"Core functionality needed to create .NET Core projects, that is shared between Visual Studio and CLI",856,2049,https://avatars.githubusercontent.com/u/9141961?v=4
92001425,space-station-14,space-wizards/space-station-14,C#,19,A multiplayer game about paranoia and chaos on a space station. Remake of the cult-classic Space Station 13.,963,986,https://avatars.githubusercontent.com/u/10567778?v=4
364304792,TodoApi,davidfowl/TodoApi,C#,206, ASP.NET Core API with JWT authentication and authorization,99,758,https://avatars.githubusercontent.com/u/95136?u=7c54b5f134fd50fa67af8d3e7604f51626242985&v=4
557943202,GoogleTranslateIpCheck,Ponderfly/GoogleTranslateIpCheck,C#,153,,85,738,https://avatars.githubusercontent.com/u/22912560?v=4
474724520,Rectify11Installer,MishaTY/Rectify11Installer,C#,30,Official Rectify11 installer source code. Note: not completed,33,265,https://avatars.githubusercontent.com/u/46088515?u=cfc2b9fcf7bdc41f5ff6101c3380779c49f34118&v=4
