id,name,full_name,language,new stars,description,forks_count,stargazers_count,avatar_url
17620347,aspnetcore,dotnet/aspnetcore,C#,93,"ASP.NET Core is a cross-platform .NET framework for building modern cloud-based web applications on Windows, Mac, or Linux.",8521,30235,https://avatars.githubusercontent.com/u/9141961?v=4
262395224,maui,dotnet/maui,C#,91,".NET MAUI is the .NET Multi-platform App UI, a framework for building native device applications spanning mobile, tablet, and desktop.",1124,17710,https://avatars.githubusercontent.com/u/9141961?v=4
14964475,Avalonia,AvaloniaUI/Avalonia,C#,106,A cross-platform UI framework for .NET,1409,16059,https://avatars.githubusercontent.com/u/14075148?v=4
120231691,Ryujinx,Ryujinx/Ryujinx,C#,273,Experimental Nintendo Switch Emulator written in C#,1691,14232,https://avatars.githubusercontent.com/u/39036280?v=4
16157746,efcore,dotnet/efcore,C#,33,"EF Core is a modern object-database mapper for .NET. It supports LINQ queries, change tracking, updates, and schema migrations.",2852,11938,https://avatars.githubusercontent.com/u/9141961?v=4
69673033,CleanArchitecture,ardalis/CleanArchitecture,C#,76,Clean Architecture Solution Template: A starting point for Clean Architecture with ASP.NET Core,2129,11586,https://avatars.githubusercontent.com/u/782127?u=75698de8f7b1cc3fda730cd742d8d8d59bd7a15c&v=4
28239455,AspNetCore.Docs,dotnet/AspNetCore.Docs,C#,33,Documentation for ASP.NET Core,25028,11138,https://avatars.githubusercontent.com/u/9141961?v=4
210716005,runtime,dotnet/runtime,C#,77,".NET is a cross-platform runtime for cloud, mobile, desktop, and IoT apps.",3573,10648,https://avatars.githubusercontent.com/u/9141961?v=4
213460285,CleanArchitecture,jasontaylordev/CleanArchitecture,C#,49,Clean Architecture Solution Template for .NET 7,2343,10329,https://avatars.githubusercontent.com/u/1988321?u=f96f36eed8f5bc57c4aab7213306f960efc072b1&v=4
182095352,N_m3u8DL-CLI,nilaoda/N_m3u8DL-CLI,C#,85,"[.NET] m3u8 downloader 开源的命令行m3u8/HLS/dash下载器，支持普通AES-128-CBC解密，多线程，自定义请求头等. 支持简体中文,繁体中文和英文. English Supported.",1773,10155,https://avatars.githubusercontent.com/u/20772925?u=6332a7ef3fc5f4f6ce844a764e912638fc01b64a&v=4
203892454,modular-monolith-with-ddd,kgrzybek/modular-monolith-with-ddd,C#,42,Full Modular Monolith application with Domain-Driven Design approach.,1143,7647,https://avatars.githubusercontent.com/u/1327418?v=4
372096057,Bili.Uwp,Richasy/Bili.Uwp,C#,58,适用于新系统UI的哔哩,456,6794,https://avatars.githubusercontent.com/u/27713596?u=9566724713f4741794fb48625c333fdedc5e5f1d&v=4
743436,ET,egametang/ET,C#,42,Unity3D Client And C# Server Framework,2409,6429,https://avatars.githubusercontent.com/u/315758?v=4
187499284,UniTask,Cysharp/UniTask,C#,43,Provides an efficient allocation free async/await integration for Unity.,456,4386,https://avatars.githubusercontent.com/u/44487420?v=4
288428676,MudBlazor,MudBlazor/MudBlazor,C#,39,"Blazor Component Library based on Material design. The goal is to do more with Blazor, utilizing CSS and keeping Javascript to a bare minimum.",759,4332,https://avatars.githubusercontent.com/u/79755064?v=4
117102183,hotchocolate,ChilliCream/hotchocolate,C#,44,"Welcome to the home of the Hot Chocolate GraphQL server for .NET, the Strawberry Shake GraphQL client for .NET and Banana Cake Pop the awesome Monaco based GraphQL IDE.",576,4023,https://avatars.githubusercontent.com/u/16239022?v=4
100711978,btcpayserver,btcpayserver/btcpayserver,C#,145,"Accept Bitcoin payments. Free, open-source & self-hosted, Bitcoin payment processor. ",982,4019,https://avatars.githubusercontent.com/u/31132886?v=4
85242321,MQTTnet,dotnet/MQTTnet,C#,22,MQTTnet is a high performance .NET library for MQTT based communication. It provides a MQTT client and a MQTT server (broker). The implementation is based on the documentation from http://mqtt.org/.,835,3211,https://avatars.githubusercontent.com/u/9141961?v=4
363866643,ToastFish,Uahh/ToastFish,C#,484,一个利用摸鱼时间背单词的软件。,259,2561,https://avatars.githubusercontent.com/u/40496762?u=d2d6b7bbebc4e0f70df49c9d0c949fab0324a773&v=4
21311240,PKHeX,kwsch/PKHeX,C#,117,Pokémon Save File Editor,485,2429,https://avatars.githubusercontent.com/u/6393368?v=4
63984307,sdk,dotnet/sdk,C#,14,"Core functionality needed to create .NET Core projects, that is shared between Visual Studio and CLI",856,2050,https://avatars.githubusercontent.com/u/9141961?v=4
92001425,space-station-14,space-wizards/space-station-14,C#,19,A multiplayer game about paranoia and chaos on a space station. Remake of the cult-classic Space Station 13.,964,986,https://avatars.githubusercontent.com/u/10567778?v=4
364304792,TodoApi,davidfowl/TodoApi,C#,227, ASP.NET Core API with JWT authentication and authorization,99,778,https://avatars.githubusercontent.com/u/95136?u=7c54b5f134fd50fa67af8d3e7604f51626242985&v=4
557943202,GoogleTranslateIpCheck,Ponderfly/GoogleTranslateIpCheck,C#,156,,85,743,https://avatars.githubusercontent.com/u/22912560?v=4
474724520,Rectify11Installer,MishaTY/Rectify11Installer,C#,24,Official Rectify11 installer source code. Note: not completed,32,266,https://avatars.githubusercontent.com/u/46088515?u=cfc2b9fcf7bdc41f5ff6101c3380779c49f34118&v=4
