id,name,full_name,language,new stars,description,forks_count,stargazers_count,avatar_url
5108051,opencv,opencv/opencv,C++,632,Open Source Computer Vision Library,55645,76635,https://avatars.githubusercontent.com/u/5009934?v=4
44838949,swift,swiftlang/swift,C++,570,The Swift Programming Language,10270,66584,https://avatars.githubusercontent.com/u/42816656?v=4
22887094,tesseract,tesseract-ocr/tesseract,C++,730,Tesseract Open Source OCR Engine (main repository),9208,59283,https://avatars.githubusercontent.com/u/8401422?v=4
22067521,imgui,ocornut/imgui,C++,889,Dear ImGui: Bloat-free Graphical User interface for C++ with minimal dependencies,9868,57254,https://avatars.githubusercontent.com/u/8225057?u=de42cf0fa1f1970187db446beea30c61b9c1e6d3&v=4
19416551,sqlitebrowser,sqlitebrowser/sqlitebrowser,C++,211,"Official home of the DB Browser for SQLite (DB4S) project. Previously known as ""SQLite Database Browser"" and ""Database Browser for SQLite"". Website at: ",2087,20210,https://avatars.githubusercontent.com/u/7454271?v=4
138754790,duckdb,duckdb/duckdb,C++,2778,DuckDB is an analytical in-process SQL database management system,1621,20079,https://avatars.githubusercontent.com/u/82039556?v=4
5736080,FreeCAD,FreeCAD/FreeCAD,C++,364,"This is the official source code of FreeCAD, a free and opensource multiplatform 3D parametric modeler.",3853,18136,https://avatars.githubusercontent.com/u/2306237?v=4
438803890,Sunshine,LizardByte/Sunshine,C++,1726,Self-hosted game stream host for Moonlight.,718,14951,https://avatars.githubusercontent.com/u/84790584?v=4
131236938,drogon,drogonframework/drogon,C++,204,Drogon: A C++14/17/20 based HTTP web application framework running on Linux/macOS/Unix/Windows,1056,11015,https://avatars.githubusercontent.com/u/48876018?v=4
184657328,TensorRT,NVIDIA/TensorRT,C++,862,NVIDIA® TensorRT™ is an SDK for high-performance deep learning inference on NVIDIA GPUs. This repository contains the open source components of TensorRT.,2071,10087,https://avatars.githubusercontent.com/u/1728152?v=4
26255337,concurrentqueue,cameron314/concurrentqueue,C++,551,"A fast multi-producer, multi-consumer lock-free concurrent queue for C++11",1649,9455,https://avatars.githubusercontent.com/u/116235?v=4
90506918,cudf,rapidsai/cudf,C++,499,cuDF - GPU DataFrame Library ,860,7937,https://avatars.githubusercontent.com/u/43887749?v=4
731842419,PowerInfer,SJTU-IPADS/PowerInfer,C++,548,High-speed Large Language Model Serving on PCs with Consumer-grade GPUs,395,7542,https://avatars.githubusercontent.com/u/10797537?v=4
1764646,wxWidgets,wxWidgets/wxWidgets,C++,102,Cross-Platform C++ GUI Library,1721,5874,https://avatars.githubusercontent.com/u/791023?v=4
514553345,OrcaSlicer,SoftFever/OrcaSlicer,C++,468,"G-code generator for 3D printers (Bambu, Prusa, Voron, VzBot, RatRig, Creality, etc.)",665,5824,https://avatars.githubusercontent.com/u/103989404?u=5ce996a351ee08333a2e41329d5f7a09823b3724&v=4
700860305,PlayIntegrityFix,chiteroman/PlayIntegrityFix,C++,363,Fix Play Integrity (and SafetyNet) verdicts.,201,3841,https://avatars.githubusercontent.com/u/98092901?v=4
48289924,ESPAsyncWebServer,me-no-dev/ESPAsyncWebServer,C++,56,Async Web Server for ESP8266 and ESP32,1167,3566,https://avatars.githubusercontent.com/u/12663778?u=73fccd3b044318b8c0dece627b58c0ad608d65ba&v=4
677953180,stable-diffusion.cpp,leejet/stable-diffusion.cpp,C++,201,Stable Diffusion in pure C/C++,227,2859,https://avatars.githubusercontent.com/u/31925346?u=be61e542cfdf0f2e67ca12949ae001a13f5cb630&v=4
206946371,ton,ton-blockchain/ton,C++,122,Main TON monorepo,701,2557,https://avatars.githubusercontent.com/u/55018343?v=4
227091502,perfetto,google/perfetto,C++,80,"Performance instrumentation and tracing for Android, Linux and Chrome (read-only mirror of https://android.googlesource.com/platform/external/perfetto/)",325,2550,https://avatars.githubusercontent.com/u/1342004?v=4
531380835,sherpa-onnx,k2-fsa/sherpa-onnx,C++,1075,"Speech-to-text, text-to-speech, and speaker recognition using next-gen Kaldi with onnxruntime without Internet connection. Support embedded systems, Android, iOS, Raspberry Pi, RISC-V, x86_64 servers, websocket server/client, C/C++, Python, Kotlin, C#, Go, NodeJS, Java, Swift, Dart, JavaScript, Flutter",264,2041,https://avatars.githubusercontent.com/u/71431748?v=4
449738859,geode,geode-sdk/geode,C++,126,The ultimate Geometry Dash modding framework,108,621,https://avatars.githubusercontent.com/u/88206422?v=4
718314761,onnxruntime-genai,microsoft/onnxruntime-genai,C++,104,Generative AI extensions for onnxruntime,67,277,https://avatars.githubusercontent.com/u/6154722?v=4
