id,name,full_name,language,new stars,description,forks_count,stargazers_count,avatar_url
44838949,swift,swiftlang/swift,C++,539,The Swift Programming Language,10270,66562,https://avatars.githubusercontent.com/u/42816656?v=4
22887094,tesseract,tesseract-ocr/tesseract,C++,755,Tesseract Open Source OCR Engine (main repository),9204,59255,https://avatars.githubusercontent.com/u/8401422?v=4
22067521,imgui,ocornut/imgui,C++,886,Dear ImGui: Bloat-free Graphical User interface for C++ with minimal dependencies,9862,57218,https://avatars.githubusercontent.com/u/8225057?u=de42cf0fa1f1970187db446beea30c61b9c1e6d3&v=4
34777562,srs,ossrs/srs,C++,278,"SRS is a simple, high-efficiency, real-time video server supporting RTMP, WebRTC, HLS, HTTP-FLV, SRT, MPEG-DASH, and GB28181.",5276,24635,https://avatars.githubusercontent.com/u/12165287?v=4
138754790,duckdb,duckdb/duckdb,C++,2749,DuckDB is an analytical in-process SQL database management system,1617,19991,https://avatars.githubusercontent.com/u/82039556?v=4
5736080,FreeCAD,FreeCAD/FreeCAD,C++,365,"This is the official source code of FreeCAD, a free and opensource multiplatform 3D parametric modeler.",3850,18119,https://avatars.githubusercontent.com/u/2306237?v=4
438803890,Sunshine,LizardByte/Sunshine,C++,1802,Self-hosted game stream host for Moonlight.,717,14910,https://avatars.githubusercontent.com/u/84790584?v=4
35129809,transmission,transmission/transmission,C++,162,Official Transmission BitTorrent client repository,1178,11626,https://avatars.githubusercontent.com/u/223312?v=4
131236938,drogon,drogonframework/drogon,C++,192,Drogon: A C++14/17/20 based HTTP web application framework running on Linux/macOS/Unix/Windows,1058,10999,https://avatars.githubusercontent.com/u/48876018?v=4
184657328,TensorRT,NVIDIA/TensorRT,C++,853,NVIDIA® TensorRT™ is an SDK for high-performance deep learning inference on NVIDIA GPUs. This repository contains the open source components of TensorRT.,2070,10067,https://avatars.githubusercontent.com/u/1728152?v=4
26255337,concurrentqueue,cameron314/concurrentqueue,C++,554,"A fast multi-producer, multi-consumer lock-free concurrent queue for C++11",1650,9450,https://avatars.githubusercontent.com/u/116235?v=4
90506918,cudf,rapidsai/cudf,C++,506,cuDF - GPU DataFrame Library ,860,7933,https://avatars.githubusercontent.com/u/43887749?v=4
731842419,PowerInfer,SJTU-IPADS/PowerInfer,C++,542,High-speed Large Language Model Serving on PCs with Consumer-grade GPUs,395,7536,https://avatars.githubusercontent.com/u/10797537?v=4
1764646,wxWidgets,wxWidgets/wxWidgets,C++,102,Cross-Platform C++ GUI Library,1721,5872,https://avatars.githubusercontent.com/u/791023?v=4
514553345,OrcaSlicer,SoftFever/OrcaSlicer,C++,459,"G-code generator for 3D printers (Bambu, Prusa, Voron, VzBot, RatRig, Creality, etc.)",661,5797,https://avatars.githubusercontent.com/u/103989404?u=5ce996a351ee08333a2e41329d5f7a09823b3724&v=4
700860305,PlayIntegrityFix,chiteroman/PlayIntegrityFix,C++,378,Fix Play Integrity (and SafetyNet) verdicts.,201,3827,https://avatars.githubusercontent.com/u/98092901?v=4
48289924,ESPAsyncWebServer,me-no-dev/ESPAsyncWebServer,C++,55,Async Web Server for ESP8266 and ESP32,1166,3563,https://avatars.githubusercontent.com/u/12663778?u=73fccd3b044318b8c0dece627b58c0ad608d65ba&v=4
677953180,stable-diffusion.cpp,leejet/stable-diffusion.cpp,C++,200,Stable Diffusion in pure C/C++,228,2849,https://avatars.githubusercontent.com/u/31925346?u=be61e542cfdf0f2e67ca12949ae001a13f5cb630&v=4
206946371,ton,ton-blockchain/ton,C++,120,Main TON monorepo,698,2551,https://avatars.githubusercontent.com/u/55018343?v=4
227091502,perfetto,google/perfetto,C++,85,"Performance instrumentation and tracing for Android, Linux and Chrome (read-only mirror of https://android.googlesource.com/platform/external/perfetto/)",324,2549,https://avatars.githubusercontent.com/u/1342004?v=4
531380835,sherpa-onnx,k2-fsa/sherpa-onnx,C++,1042,"Speech-to-text, text-to-speech, and speaker recognition using next-gen Kaldi with onnxruntime without Internet connection. Support embedded systems, Android, iOS, Raspberry Pi, RISC-V, x86_64 servers, websocket server/client, C/C++, Python, Kotlin, C#, Go, NodeJS, Java, Swift, Dart, JavaScript",259,1998,https://avatars.githubusercontent.com/u/71431748?v=4
449738859,geode,geode-sdk/geode,C++,115,The ultimate Geometry Dash modding framework,104,608,https://avatars.githubusercontent.com/u/88206422?v=4
718314761,onnxruntime-genai,microsoft/onnxruntime-genai,C++,117,Generative AI extensions for onnxruntime,66,273,https://avatars.githubusercontent.com/u/6154722?v=4
