id,name,full_name,language,new stars,description,forks_count,stargazers_count,avatar_url
111583593,scrcpy,Genymobile/scrcpy,C,1604,Display and control your Android device,10149,104341,https://avatars.githubusercontent.com/u/3427627?v=4
246335987,Ventoy,ventoy/Ventoy,C,1774,A new bootable USB solution.,3916,59869,https://avatars.githubusercontent.com/u/59477474?u=16f38c14b69580f87f4717b71c0e5e85e9559cb1&v=4
2810292,rufus,pbatard/rufus,C,453,The Reliable USB Formatting Utility,2484,27435,https://avatars.githubusercontent.com/u/1206968?u=ed1be5451352656cffecc840d661bb793c3bad05&v=4
7634677,openssl,openssl/openssl,C,465,TLS/SSL and crypto library,9888,24741,https://avatars.githubusercontent.com/u/3279138?v=4
13836499,raylib,raysan5/raylib,C,750,A simple and easy-to-use library to enjoy videogames programming,2070,20035,https://avatars.githubusercontent.com/u/5766837?u=28d52cd1077b2f8b48d3897e82f03280a565e8d6&v=4
41215835,HandBrake,HandBrake/HandBrake,C,405,HandBrake's main development repository ,1273,16081,https://avatars.githubusercontent.com/u/627269?v=4
60667730,lvgl,lvgl/lvgl,C,370,"Embedded graphics library to create beautiful UIs for any MCU, MPU and display type. ",3038,15438,https://avatars.githubusercontent.com/u/19811762?v=4
65899476,esp-idf,espressif/esp-idf,C,182,Espressif IoT Development Framework. Official development framework for Espressif SoCs.,7060,12727,https://avatars.githubusercontent.com/u/9460735?v=4
284134871,flipperzero-firmware,flipperdevices/flipperzero-firmware,C,407,Flipper Zero firmware source code,2573,11603,https://avatars.githubusercontent.com/u/57576566?v=4
359952601,pgvector,pgvector/pgvector,C,551,Open-source vector similarity search for Postgres,446,10115,https://avatars.githubusercontent.com/u/98363230?v=4
59771425,zephyr,zephyrproject-rtos/zephyr,C,211,"Primary Git Repository for the Zephyr Project. Zephyr is a new generation, scalable, optimized, secure RTOS for multiple hardware architectures.",6109,9926,https://avatars.githubusercontent.com/u/19595895?v=4
689344,RetroArch,libretro/RetroArch,C,356,"Cross-platform, sophisticated frontend for the libretro API. Licensed GPLv3.",1760,9687,https://avatars.githubusercontent.com/u/1812827?v=4
671061529,winlator,brunodev85/winlator,C,874,Android application for running Windows applications with Wine and Box86/Box64,258,6258,https://avatars.githubusercontent.com/u/11407071?u=b8e72693930cd1e2d2ea4e0423fb27e0e905b84d&v=4
29933948,fluent-bit,fluent/fluent-bit,C,94,"Fast and Lightweight Logs and Metrics processor for Linux, BSD, OSX and Windows",1492,5469,https://avatars.githubusercontent.com/u/859518?v=4
12989790,moonlight-android,moonlight-stream/moonlight-android,C,252,GameStream client for Android,521,3377,https://avatars.githubusercontent.com/u/6118379?v=4
595813523,Dopamine,opa334/Dopamine,C,167,Dopamine is a semi-untethered jailbreak for iOS 15 and 16,990,2982,https://avatars.githubusercontent.com/u/18235760?v=4
472575717,Shipwright,HarbourMasters/Shipwright,C,195,,465,2946,https://avatars.githubusercontent.com/u/88675208?v=4
310123680,webui,webui-dev/webui,C,213,"Use any web browser or WebView as GUI, with your preferred language in the backend and HTML5 in the frontend, all in a lightweight portable lib.",139,2297,https://avatars.githubusercontent.com/u/133399259?v=4
247875852,mm,zeldaret/mm,C,70,Decompilation of The Legend of Zelda: Majora's Mask,427,1125,https://avatars.githubusercontent.com/u/50950276?v=4
