id,name,full_name,language,new stars,description,forks_count,stargazers_count,avatar_url
111583593,scrcpy,Genymobile/scrcpy,C,1616,Display and control your Android device,10171,104542,https://avatars.githubusercontent.com/u/3427627?v=4
10744183,netdata,netdata/netdata,C,821,The open-source observability platform everyone needs!,5777,69174,https://avatars.githubusercontent.com/u/43390781?v=4
246335987,Ventoy,ventoy/Ventoy,C,1835,A new bootable USB solution.,3918,59982,https://avatars.githubusercontent.com/u/59477474?u=16f38c14b69580f87f4717b71c0e5e85e9559cb1&v=4
13233158,obs-studio,obsproject/obs-studio,C,994,OBS Studio - Free and open source software for live streaming and screen recording,7689,56922,https://avatars.githubusercontent.com/u/7725691?v=4
1903522,php-src,php/php-src,C,165,The PHP Interpreter,7683,37514,https://avatars.githubusercontent.com/u/25158?v=4
7634677,openssl,openssl/openssl,C,452,TLS/SSL and crypto library,9897,24762,https://avatars.githubusercontent.com/u/3279138?v=4
60667730,lvgl,lvgl/lvgl,C,362,"Embedded graphics library to create beautiful UIs for any MCU, MPU and display type. ",3044,15462,https://avatars.githubusercontent.com/u/19811762?v=4
284134871,flipperzero-firmware,flipperdevices/flipperzero-firmware,C,413,Flipper Zero firmware source code,2574,11633,https://avatars.githubusercontent.com/u/57576566?v=4
359952601,pgvector,pgvector/pgvector,C,565,Open-source vector similarity search for Postgres,457,10188,https://avatars.githubusercontent.com/u/98363230?v=4
59771425,zephyr,zephyrproject-rtos/zephyr,C,198,"Primary Git Repository for the Zephyr Project. Zephyr is a new generation, scalable, optimized, secure RTOS for multiple hardware architectures.",6120,9940,https://avatars.githubusercontent.com/u/19595895?v=4
689344,RetroArch,libretro/RetroArch,C,298,"Cross-platform, sophisticated frontend for the libretro API. Licensed GPLv3.",1762,9700,https://avatars.githubusercontent.com/u/1812827?v=4
3671479,nmap,nmap/nmap,C,160,Nmap - the Network Mapper. Github mirror of official SVN repository.,2321,9516,https://avatars.githubusercontent.com/u/63385?v=4
105944401,yugabyte-db,yugabyte/yugabyte-db,C,81,YugabyteDB - the cloud native distributed SQL database for mission-critical applications.,1029,8597,https://avatars.githubusercontent.com/u/17074854?v=4
671061529,winlator,brunodev85/winlator,C,832,Android application for running Windows applications with Wine and Box86/Box64,267,6381,https://avatars.githubusercontent.com/u/11407071?u=b8e72693930cd1e2d2ea4e0423fb27e0e905b84d&v=4
127023441,cuda-samples,NVIDIA/cuda-samples,C,215,Samples for CUDA Developers which demonstrates features in CUDA Toolkit,1678,5651,https://avatars.githubusercontent.com/u/1728152?v=4
63369078,picom,yshui/picom,C,64,A lightweight compositor for X11,578,3905,https://avatars.githubusercontent.com/u/366851?v=4
12989790,moonlight-android,moonlight-stream/moonlight-android,C,250,GameStream client for Android,522,3416,https://avatars.githubusercontent.com/u/6118379?v=4
472575717,Shipwright,HarbourMasters/Shipwright,C,189,,467,2967,https://avatars.githubusercontent.com/u/88675208?v=4
