id,name,full_name,language,new stars,description,forks_count,stargazers_count,avatar_url
2561582,animate.css,animate-css/animate.css,CSS,218,🍿 A cross-browser library of CSS animations. As easy to use as an easy thing.,16233,80023,https://avatars.githubusercontent.com/u/64791939?v=4
27574418,nerd-fonts,ryanoasis/nerd-fonts,CSS,712,"Iconic font aggregator, collection, & patcher. 3,600+ icons, 50+ patched fonts: Hack, Source Code Pro, more. Glyph collections: Font Awesome, Material Design Icons, Octicons, & more",3587,52370,https://avatars.githubusercontent.com/u/8083459?u=1645f43000c842a948268609231bdecb1433c470&v=4
1700621,normalize.css,necolas/normalize.css,CSS,162,A modern alternative to CSS resets,10699,52043,https://avatars.githubusercontent.com/u/239676?u=4b545d3dd62d217b40a624ebbe987cfc67e73803&v=4
17446152,2048,gabrielecirulli/2048,CSS,40,A small clone of 1024 (https://web.archive.org/web/20140328011720/https://play.google.com/store/apps/details?id=com.veewo.a1024),16907,12068,https://avatars.githubusercontent.com/u/886011?v=4
13099301,flag-icons,lipis/flag-icons,CSS,112,:flags: A curated collection of all country flags in SVG — plus the CSS for easier integration,1829,10366,https://avatars.githubusercontent.com/u/125676?u=ed6b72344fe5cb2195b3e213b2ee5be905bd2766&v=4
49767244,primeng,primefaces/primeng,CSS,225,The Most Complete Angular UI Component Library,4493,9762,https://avatars.githubusercontent.com/u/3494069?v=4
114846052,WebStackPage.github.io,WebStackPage/WebStackPage.github.io,CSS,154,❤️静态响应式网址导航网站 - webstack.cc,1728,6065,https://avatars.githubusercontent.com/u/34702247?v=4
505538251,pokemon-cards-css,simeydotme/pokemon-cards-css,CSS,97,A collection of advanced CSS styles to create realistic-looking effects for the faces of Pokemon cards.,477,5175,https://avatars.githubusercontent.com/u/2817396?u=96a19c0cb67961a77a00861828a5fa57e5b18c09&v=4
299116052,react-projects,john-smilga/react-projects,CSS,39,,3860,4755,https://avatars.githubusercontent.com/u/42133389?u=9d63b6d71fba139347cddf2c840a858c8ff97168&v=4
292673424,cloudflare-docs,cloudflare/cloudflare-docs,CSS,79,Cloudflare’s documentation,2737,2676,https://avatars.githubusercontent.com/u/314135?v=4
560236194,zoraxy,tobychui/zoraxy,CSS,688,A general purpose HTTP reverse proxy and forwarding tool. Now written in Go!,112,2055,https://avatars.githubusercontent.com/u/24617523?u=0c296d98ddbab7f6224d14246fbdf60b2612fdb9&v=4
98973062,BetterDiscordAddons,mwittrien/BetterDiscordAddons,CSS,18,A series of plugins and themes for BetterDiscord.,3879,2033,https://avatars.githubusercontent.com/u/23700969?u=fe826320107e31529241df047b5694e7a85a6190&v=4
375785061,30DaysOfJavaScript,swapnilsparsh/30DaysOfJavaScript,CSS,76,Projects made during the 30 days of the JavaScript challenge,647,870,https://avatars.githubusercontent.com/u/69387608?u=8c32fa1ceb8f18cd89e2f969c77476229eec6994&v=4
10321675,the-internet,saucelabs/the-internet,CSS,10,An example application that captures prominent and ugly functionality found on the web. Perfect for writing automated acceptance tests against.,615,756,https://avatars.githubusercontent.com/u/88837?v=4
668453226,hextra,imfing/hextra,CSS,57,"🔯 Modern, batteries-included Hugo theme for creating beautiful doc, blog and static websites",118,434,https://avatars.githubusercontent.com/u/5097752?u=2c29af47e2785926f25bb4745bd63c7e3ea8482d&v=4
649290132,bspwm-dotfiles,Zproger/bspwm-dotfiles,CSS,65,A minimalistic Arch Linux build that is designed to make your development easier and faster,35,206,https://avatars.githubusercontent.com/u/81753080?u=acab8ee852a3ecf2e0bd52e945d73572eba913a1&v=4
732725231,Beautiify,Rakesh9100/Beautiify,CSS,56,"Beautiify comprises a curated selection of beautifully designed components and animations that can be seamlessly incorporated into any website, elevating its overall UI experience.",304,181,https://avatars.githubusercontent.com/u/73993775?u=477d4fafeaaf9020b69a7fc77311812141cceb9b&v=4
335394569,moveit2_tutorials,moveit/moveit2_tutorials,CSS,8,A sphinx-based centralized documentation repo for MoveIt 2,184,130,https://avatars.githubusercontent.com/u/4408844?v=4
