id,name,full_name,language,new stars,description,forks_count,stargazers_count,avatar_url
10270250,react,facebook/react,JavaScript,2040,The library for web and native user interfaces.,45624,223985,https://avatars.githubusercontent.com/u/69631?v=4
70107786,next.js,vercel/next.js,JavaScript,1273,The React Framework,26102,122009,https://avatars.githubusercontent.com/u/14985020?v=4
576201,three.js,mrdoob/three.js,JavaScript,751,JavaScript 3D Library.,35161,99746,https://avatars.githubusercontent.com/u/97088?u=95046da3776175b5f3d1ad2137704cd123e04d9e&v=4
157616880,iptv,iptv-org/iptv,JavaScript,1067,Collection of publicly available IPTV channels from all over the world,1894,79389,https://avatars.githubusercontent.com/u/55937028?v=4
382496361,uptime-kuma,louislam/uptime-kuma,JavaScript,1466,A fancy self-hosted monitoring tool,4597,51180,https://avatars.githubusercontent.com/u/1336778?u=5f96cafa12ed95d786d4b84bcf284e8fb2bedd89&v=4
1663468,pdf.js,mozilla/pdf.js,JavaScript,442,PDF Reader in JavaScript,9758,46766,https://avatars.githubusercontent.com/u/131524?v=4
85031442,hiring-without-whiteboards,poteto/hiring-without-whiteboards,JavaScript,856,â­ï¸  Companies that don't have a broken hiring process,3371,42295,https://avatars.githubusercontent.com/u/1390709?u=2af51a1edba730772ff211c157face57164931f4&v=4
352933140,ToolJet,ToolJet/ToolJet,JavaScript,1260,"Low-code platform for building business applications. Connect to databases, cloud storages, GraphQL, API endpoints, Airtable, Google sheets, OpenAI, etc and build apps using drag and drop application builder. Built using JavaScript/TypeScript. ğŸš€",3388,27882,https://avatars.githubusercontent.com/u/82193554?v=4
280567579,EasySpider,NaiboWang/EasySpider,JavaScript,4412,A visual no-code/code-free web crawler/spideræ˜“é‡‡é›†ï¼šä¸€ä¸ªå¯è§†åŒ–æµè§ˆå™¨è‡ªåŠ¨åŒ–æµ‹è¯•/æ•°æ®é‡‡é›†/çˆ¬è™«è½¯ä»¶ï¼Œå¯ä»¥æ— ä»£ç å›¾å½¢åŒ–çš„è®¾è®¡å’Œæ‰§è¡Œçˆ¬è™«ä»»åŠ¡ã€‚åˆ«åï¼šServiceWrapperé¢å‘Webåº”ç”¨çš„æ™ºèƒ½åŒ–æœåŠ¡å°è£…ç³»ç»Ÿã€‚,3192,27373,https://avatars.githubusercontent.com/u/30287768?u=430d71312cd7b74533c807b08d7211a6e25d4edd&v=4
304344049,kit,sveltejs/kit,JavaScript,214,"web development, streamlined",1801,17930,https://avatars.githubusercontent.com/u/23617963?v=4
722534765,multipleWindow3dScene,bgstaal/multipleWindow3dScene,JavaScript,429,"A quick example of how one can ""synchronize"" a 3d scene across multiple windows using three.js and localStorage",2552,16252,https://avatars.githubusercontent.com/u/165258?v=4
276008164,ios_rule_script,blackmatrix7/ios_rule_script,JavaScript,630,åˆ†æµè§„åˆ™ã€é‡å†™å†™è§„åˆ™åŠè„šæœ¬ã€‚,2543,15833,https://avatars.githubusercontent.com/u/27717518?u=d6899ff9f71f825ef4e85ece8b6d176afb6d24f8&v=4
649170660,anything-llm,Mintplex-Labs/anything-llm,JavaScript,2960,The all-in-one Desktop & Docker AI application with full RAG and AI Agent capabilities.,1651,15684,https://avatars.githubusercontent.com/u/134426827?v=4
253044228,nuclei-templates,projectdiscovery/nuclei-templates,JavaScript,241,Community curated list of templates for the nuclei engine to find security vulnerabilities.,2375,8296,https://avatars.githubusercontent.com/u/50994705?v=4
320850140,edgetunnel,zizifn/edgetunnel,JavaScript,582,Running V2ray inside edge/serverless runtime,15892,5712,https://avatars.githubusercontent.com/u/1803942?v=4
705574656,Noi,lencx/Noi,JavaScript,1390,"ğŸš€ Power Your World with AI - Explore, Extend, Empower.",358,5058,https://avatars.githubusercontent.com/u/16164244?u=e494bcc61f8128a85aaa9c717958a053f8747402&v=4
447363864,Baileys,WhiskeySockets/Baileys,JavaScript,374,Lightweight full-featured typescript/javascript WhatsApp Web API,1018,2951,https://avatars.githubusercontent.com/u/131354555?v=4
164221924,jellyfin-web,jellyfin/jellyfin-web,JavaScript,296,Web Client for Jellyfin,1129,2121,https://avatars.githubusercontent.com/u/45698031?v=4
