id,name,full_name,language,new stars,description,forks_count,stargazers_count,avatar_url
100060912,terminal,microsoft/terminal,C++,33,"The new Windows Terminal and the original Windows console host, all in the same place!",7319,82478,https://avatars.githubusercontent.com/u/6154722?v=4
23357588,protobuf,protocolbuffers/protobuf,C++,33,Protocol Buffers - Google's data interchange format,13999,54073,https://avatars.githubusercontent.com/u/26310541?v=4
27729880,grpc,grpc/grpc,C++,16,"The C based gRPC (C++, Python, Ruby, Objective-C, PHP, C#)",9001,34008,https://avatars.githubusercontent.com/u/7802525?v=4
39840932,googletest,google/googletest,C++,8,GoogleTest - Google Testing and Mocking Framework,8477,25638,https://avatars.githubusercontent.com/u/1342004?v=4
6934395,rocksdb,facebook/rocksdb,C++,22,"A library that provides an embeddable, persistent key-value store for fast storage.",5101,22352,https://avatars.githubusercontent.com/u/69631?v=4
19953044,flatbuffers,google/flatbuffers,C++,10,FlatBuffers: Memory Efficient Serialization Library,2760,17760,https://avatars.githubusercontent.com/u/1342004?v=4
81227005,faiss,facebookresearch/faiss,C++,6,A library for efficient similarity search and clustering of dense vectors.,2586,16739,https://avatars.githubusercontent.com/u/16943930?v=4
1062572,Catch2,catchorg/Catch2,C++,6,"A modern, C++-native, test framework for unit-tests, TDD and BDD - using C++14, C++17 and later (C++11 support is in v2.x branch, and C++03 on the Catch1.x branch)",2540,14780,https://avatars.githubusercontent.com/u/33321405?v=4
26038648,spdlog,gabime/spdlog,C++,10,Fast C++ logging library.,3066,14375,https://avatars.githubusercontent.com/u/6052198?u=a5aaa778f219603fd3a6e221c79370ac5f0fa182&v=4
95879426,ncnn,Tencent/ncnn,C++,10,ncnn is a high-performance neural network inference framework optimized for the mobile platform,3423,14319,https://avatars.githubusercontent.com/u/18461506?v=4
27500243,libphonenumber,google/libphonenumber,C++,12,"Google's common Java, C++ and JavaScript library for parsing, formatting, and validating international phone numbers.",1816,13609,https://avatars.githubusercontent.com/u/1342004?v=4
20570214,tink,google/tink,C++,4,"Tink is a multi-language, cross-platform, open source library that provides cryptographic APIs that are secure, easy to use correctly, and hard(er) to misuse.",1086,12288,https://avatars.githubusercontent.com/u/1342004?v=4
3925242,bgfx,bkaradzic/bgfx,C++,4,"Cross-platform, graphics API agnostic, ""Bring Your Own Engine/Framework"" style rendering library.",1630,11341,https://avatars.githubusercontent.com/u/814772?v=4
23086893,re2,google/re2,C++,4,"RE2 is a fast, safe, thread-friendly alternative to backtracking regular expression engines like those used in PCRE, Perl, and Python. It is a C++ library.",972,6802,https://avatars.githubusercontent.com/u/1342004?v=4
46374199,librealsense,IntelRealSense/librealsense,C++,4,Intel® RealSense™ SDK,4212,5943,https://avatars.githubusercontent.com/u/14095512?v=4
39211337,engine,flutter/engine,C++,5,The Flutter engine,4353,5640,https://avatars.githubusercontent.com/u/14101776?v=4
2345629,websocketpp,zaphoyd/websocketpp,C++,7,C++ websocket client/server library,1669,5464,https://avatars.githubusercontent.com/u/1006976?v=4
124976393,oatpp,oatpp/oatpp,C++,4,🌱Light and powerful C++ web framework for highly scalable and resource-efficient web application. It's zero-dependency and easy-portable.,1055,5241,https://avatars.githubusercontent.com/u/37167448?v=4
138754790,duckdb,duckdb/duckdb,C++,14,DuckDB is an in-process SQL OLAP Database Management System,449,4733,https://avatars.githubusercontent.com/u/82039556?v=4
3633213,thrust,NVIDIA/thrust,C++,2,The C++ parallel algorithms library.,658,3800,https://avatars.githubusercontent.com/u/1728152?v=4
83542585,LeetCode,wisdompeak/LeetCode,C++,28,This repository contains the solutions and explanations to the algorithm problems on LeetCode. Only medium or above are included. All are written in C++/Python and implemented by myself. The problems attempted multiple times are labelled with hyperlinks.,710,2544,https://avatars.githubusercontent.com/u/25891014?v=4
456549280,ydb,ydb-platform/ydb,C++,338,YDB server (daemon) source code,80,1601,https://avatars.githubusercontent.com/u/88314308?v=4
382912430,mach,hexops/mach,C++,9,Mach is a game engine & graphics toolkit for the future.,28,829,https://avatars.githubusercontent.com/u/19482899?v=4
246939908,Slicer,Slicer/Slicer,C++,2,"Multi-platform, free open source software for visualization and image computing.",295,646,https://avatars.githubusercontent.com/u/324362?v=4
459693490,open_mower_ros,ClemensElflein/open_mower_ros,C++,14,,6,85,https://avatars.githubusercontent.com/u/2864655?u=2591ac55224d26b785305baa47b3b89c5dab7a21&v=4
