id,name,full_name,language,new stars,description,forks_count,stargazers_count,avatar_url
62607227,tech-interview-handbook,yangshun/tech-interview-handbook,TypeScript,505,💯 Curated coding interview preparation materials for busy software engineers,15183,124163,https://avatars.githubusercontent.com/u/1315101?u=0072fd0322e6b282bba91092eb379f985377a1f0&v=4
721767116,clash-verge-rev,clash-verge-rev/clash-verge-rev,TypeScript,179,"A modern GUI client based on Tauri, designed to run in Windows, macOS and Linux for tailored proxy experience",4042,51620,https://avatars.githubusercontent.com/u/152534467?v=4
519859998,AFFiNE,toeverything/AFFiNE,TypeScript,468,"There can be more than Notion and Miro. AFFiNE(pronounced [ə‘fain]) is a next-gen knowledge base that brings planning, sorting and creating all together. Privacy first, open-source, customizable and ready to use. ",3178,48414,https://avatars.githubusercontent.com/u/78728988?v=4
695864515,Deep-Live-Cam,hacksider/Deep-Live-Cam,Python,34,real time face swap and one-click video deepfake with only a single image,6722,44841,https://avatars.githubusercontent.com/u/1267200?v=4
888092115,markitdown,microsoft/markitdown,Python,206,Python tool for converting files and office documents to Markdown.,1925,40759,https://avatars.githubusercontent.com/u/6154722?v=4
323048702,OpenBB,OpenBB-finance/OpenBB,Python,150,"Investment Research for Everyone, Everywhere.",3432,37943,https://avatars.githubusercontent.com/u/80064875?v=4
869741127,zapret-discord-youtube,Flowseal/zapret-discord-youtube,Batchfile,83,,688,11135,https://avatars.githubusercontent.com/u/50780822?u=d3975394299a317f64749943703f4a3521d0be19&v=4
827005317,fragments,e2b-dev/fragments,TypeScript,103,Open-source Next.js template for building apps that are fully generated by AI. By E2B.,638,4825,https://avatars.githubusercontent.com/u/129434473?v=4
828972950,awesome-selfhost-docker,hotheadhacker/awesome-selfhost-docker,HTML,608,"🚀 Curated list of open-source, self-hosted projects deployable with Docker and docker-compose. Your go-to resource for amazing self-hostable software.",67,1873,https://avatars.githubusercontent.com/u/18418340?u=0aea2462aa9134bed3d3633e1156ad82ecba62b1&v=4
