id,name,full_name,language,new stars,description,forks_count,stargazers_count,avatar_url
132464395,JavaGuide,Snailclimb/JavaGuide,Java,83,ã€ŒJavaå­¦ä¹ +é¢è¯•æŒ‡å—ã€ä¸€ä»½æ¶µç›–å¤§éƒ¨åˆ† Java ç¨‹åºå‘˜æ‰€éœ€è¦æŒæ¡çš„æ ¸å¿ƒçŸ¥è¯†ã€‚å‡†å¤‡ Java é¢è¯•ï¼Œé¦–é€‰ JavaGuideï¼,45042,141639,https://avatars.githubusercontent.com/u/29880145?u=d2f8361655b9ebd973f5375acf014500bc0a4197&v=4
22790488,java-design-patterns,iluwatar/java-design-patterns,Java,30,Design patterns implemented in Java,25815,86037,https://avatars.githubusercontent.com/u/582346?u=7aecf4c397c8dffaf0b84bd4c9d4198290f00de1&v=4
507775,elasticsearch,elastic/elasticsearch,Java,15,"Free and Open, Distributed, RESTful Search Engine",23920,67014,https://avatars.githubusercontent.com/u/6764390?v=4
561730219,hello-algo,krahets/hello-algo,Java,334,"ã€ŠHello ç®—æ³•ã€‹ï¼šåŠ¨ç”»å›¾è§£ã€ä¸€é”®è¿è¡Œçš„æ•°æ®ç»“æ„ä¸ç®—æ³•æ•™ç¨‹ï¼Œæ”¯æŒ Python, C++, Java, C#, Go, Swift, JS, TS, Dart, Rust, C, Zig ç­‰è¯­è¨€ã€‚English edition ongoing",8146,66083,https://avatars.githubusercontent.com/u/26993056?u=12c6a8ef18768abc773c64a56a56c0fd67241ed2&v=4
9754983,tutorials,eugenp/tutorials,Java,9,"Just Announced - ""Learn Spring Security OAuth"": ",54165,35750,https://avatars.githubusercontent.com/u/1022859?u=9ea4d620f7c354086bbc37fb7a221ceff15497ec&v=4
137451403,nacos,alibaba/nacos,Java,13,"an easy-to-use dynamic service discovery, configuration and service management platform for building cloud native applications.",12392,28707,https://avatars.githubusercontent.com/u/1961952?v=4
149001365,leetcode,doocs/leetcode,Java,35,ğŸ”¥LeetCode solutions in any programming language | å¤šç§ç¼–ç¨‹è¯­è¨€å®ç° LeetCodeã€ã€Šå‰‘æŒ‡ Offerï¼ˆç¬¬ 2 ç‰ˆï¼‰ã€‹ã€ã€Šç¨‹åºå‘˜é¢è¯•é‡‘å…¸ï¼ˆç¬¬ 6 ç‰ˆï¼‰ã€‹é¢˜è§£,4805,28261,https://avatars.githubusercontent.com/u/43716716?v=4
20587599,flink,apache/flink,Java,7,Apache Flink,12851,22958,https://avatars.githubusercontent.com/u/47359?v=4
1103607,jenkins,jenkinsci/jenkins,Java,4,Jenkins automation server,8456,22184,https://avatars.githubusercontent.com/u/107424?v=4
133134007,openapi-generator,OpenAPITools/openapi-generator,Java,21,"OpenAPI Generator allows generation of API client libraries (SDK generation), server stubs, documentation and configuration automatically given an OpenAPI Spec (v2, v3)",5982,19361,https://avatars.githubusercontent.com/u/37325267?v=4
27954927,caffeine,ben-manes/caffeine,Java,6,A high performance caching library for Java,1541,15022,https://avatars.githubusercontent.com/u/378614?v=4
117965972,DataX,alibaba/DataX,Java,4,DataXæ˜¯é˜¿é‡Œäº‘DataWorksæ•°æ®é›†æˆçš„å¼€æºç‰ˆæœ¬ã€‚,5192,14939,https://avatars.githubusercontent.com/u/1961952?v=4
1911523,vert.x,eclipse-vertx/vert.x,Java,3,Vert.x is a tool-kit for building reactive applications on the JVM,2032,13980,https://avatars.githubusercontent.com/u/19804680?v=4
99919302,doris,apache/doris,Java,12,"Apache Doris is an easy-to-use, high performance and unified analytics database.",2976,10995,https://avatars.githubusercontent.com/u/47359?v=4
33218414,react-native-camera,react-native-camera/react-native-camera,Java,0,A Camera component for React Native. Also supports barcode scanning!,3524,9642,https://avatars.githubusercontent.com/u/71153400?v=4
66023605,aws-doc-sdk-examples,awsdocs/aws-doc-sdk-examples,Java,7,"Welcome to the AWS Code Examples Repository.  This repo contains code examples used in the AWS documentation, AWS SDK Developer Guides, and more. For more information, see the Readme.md file below.",5415,8767,https://avatars.githubusercontent.com/u/8661631?v=4
50160261,Paper,PaperMC/Paper,Java,21,"The most widely used, high performance Minecraft server that aims to fix gameplay and mechanics inconsistencies",2079,8694,https://avatars.githubusercontent.com/u/7608950?v=4
1222504,sonarqube,SonarSource/sonarqube,Java,8,Continuous Inspection,1903,8459,https://avatars.githubusercontent.com/u/545988?v=4
224230574,kafka-ui,provectus/kafka-ui,Java,15,Open-Source Web UI for Apache Kafka Management,1019,8159,https://avatars.githubusercontent.com/u/1528944?v=4
204164353,kestra,kestra-io/kestra,Java,18,"Infinitely scalable, event-driven, language-agnostic orchestration and scheduling platform to manage millions of workflows declaratively in code.",299,5490,https://avatars.githubusercontent.com/u/59033362?v=4
455584258,hertzbeat,dromara/hertzbeat,Java,10,"A real-time monitoring system with agentless, performance cluster, prometheus-compatible, custom monitoring and status page building capabilities.",758,4349,https://avatars.githubusercontent.com/u/41095225?v=4
2019791,liquibase,liquibase/liquibase,Java,0,Main Liquibase Source,1771,4319,https://avatars.githubusercontent.com/u/438548?v=4
439355916,LeetCode-Book,krahets/LeetCode-Book,Java,42,"ã€Šå‰‘æŒ‡ Offerã€‹ Python, Java, C++ è§£é¢˜ä»£ç ï¼ŒLeetBookã€Šå›¾è§£ç®—æ³•æ•°æ®ç»“æ„ã€‹é…å¥—ä»£ç ä»“",546,4154,https://avatars.githubusercontent.com/u/26993056?u=12c6a8ef18768abc773c64a56a56c0fd67241ed2&v=4
583335116,spring-boot-3-jwt-security,ali-bouali/spring-boot-3-jwt-security,Java,3,Sample project on how to implement JWT security based using Spring boot 3 and Spring security 6,724,1504,https://avatars.githubusercontent.com/u/16446014?u=7e2b07b64619cf009869d7fbcb77b81fcc160283&v=4
402527443,media,androidx/media,Java,2,"Jetpack Media3 support libraries for media use cases, including ExoPlayer, an extensible media player for Android",250,1091,https://avatars.githubusercontent.com/u/6955922?v=4
