id,name,full_name,language,new stars,description,forks_count,stargazers_count,avatar_url
184456251,PowerToys,microsoft/PowerToys,C#,835,Windows system utilities to maximize productivity,6101,100071,https://avatars.githubusercontent.com/u/6154722?v=4
38380854,dnSpy,dnSpy/dnSpy,C#,86,.NET debugger and assembly editor,4808,24548,https://avatars.githubusercontent.com/u/67931932?v=4
64713769,ScreenToGif,NickeManarin/ScreenToGif,C#,85,"ğŸ¬ ScreenToGif allows you to record a selected area of your screen, edit and save it as a gif or video.",2099,21712,https://avatars.githubusercontent.com/u/14798947?u=3b8eb996aeb9fe617c733a21fd8e067f2c2fcb4f&v=4
324473895,downkyi,leiurayer/downkyi,C#,251,å“”å“©ä¸‹è½½å§¬downkyiï¼Œå“”å“©å“”å“©ç½‘ç«™è§†é¢‘ä¸‹è½½å·¥å…·ï¼Œæ”¯æŒæ‰¹é‡ä¸‹è½½ï¼Œæ”¯æŒ8Kã€HDRã€æœæ¯”è§†ç•Œï¼Œæä¾›å·¥å…·ç®±ï¼ˆéŸ³è§†é¢‘æå–ã€å»æ°´å°ç­‰ï¼‰ã€‚,1924,16273,https://avatars.githubusercontent.com/u/19290097?u=589c798ec2b77363ddf03308123a6f8c718a8426&v=4
1135454,CefSharp,cefsharp/CefSharp,C#,13,.NET (WPF and Windows Forms) bindings for the Chromium Embedded Framework,2913,9508,https://avatars.githubusercontent.com/u/5076038?v=4
203892454,modular-monolith-with-ddd,kgrzybek/modular-monolith-with-ddd,C#,190,Full Modular Monolith application with Domain-Driven Design approach.,1447,9366,https://avatars.githubusercontent.com/u/1327418?v=4
282637924,BBDown,nilaoda/BBDown,C#,85,Bilibili Downloader. ä¸€æ¬¾å‘½ä»¤è¡Œå¼å“”å“©å“”å“©ä¸‹è½½å™¨.,750,7229,https://avatars.githubusercontent.com/u/20772925?u=6332a7ef3fc5f4f6ce844a764e912638fc01b64a&v=4
152370823,AspNetCoreDiagnosticScenarios,davidfowl/AspNetCoreDiagnosticScenarios,C#,31,This repository has examples of broken patterns in ASP.NET Core applications,706,7127,https://avatars.githubusercontent.com/u/95136?u=598ed17571853b315c1b21f792f2652a3513c02b&v=4
288428676,MudBlazor,MudBlazor/MudBlazor,C#,50,Blazor Component Library based on Material design with an emphasis on ease of use. Mainly written in C# with Javascript kept to a bare minimum it empowers .NET developers to easily debug it if needed.,1071,6463,https://avatars.githubusercontent.com/u/79755064?v=4
41822320,NSwag,RicoSuter/NSwag,C#,22,"The Swagger/OpenAPI toolchain for .NET, ASP.NET Core and TypeScript. ",1177,6225,https://avatars.githubusercontent.com/u/2603405?u=eaf8de2141873385ae3d6c2cefb7afefabd8c78d&v=4
389218073,wpfui,lepoco/wpfui,C#,120,"WPF UI provides the Fluent experience in your known and loved WPF framework. Intuitive design, themes, navigation and new immersive controls. All natively and effortlessly.",634,5617,https://avatars.githubusercontent.com/u/87412094?v=4
116210568,ScottPlot,ScottPlot/ScottPlot,C#,37,Interactive plotting library for .NET,670,4090,https://avatars.githubusercontent.com/u/76536295?v=4
10601208,Umbraco-CMS,umbraco/Umbraco-CMS,C#,11,"The simple, flexible and friendly ASP.NET CMS used by more than 730.000 websites",2589,4060,https://avatars.githubusercontent.com/u/1419552?v=4
85242321,MQTTnet,dotnet/MQTTnet,C#,17,MQTTnet is a high performance .NET library for MQTT based communication. It provides a MQTT client and a MQTT server (broker). The implementation is based on the documentation from http://mqtt.org/.,993,3972,https://avatars.githubusercontent.com/u/9141961?v=4
121067132,BepInEx,BepInEx/BepInEx,C#,70,Unity / XNA game patcher and plugin framework,513,3803,https://avatars.githubusercontent.com/u/39589027?v=4
150035938,Rubeus,GhostPack/Rubeus,C#,24,Trying to tame the three-headed dog.,730,3588,https://avatars.githubusercontent.com/u/41304335?v=4
5616877,Thrive,Revolutionary-Games/Thrive,C#,21,The main repository for the development of the evolution game Thrive. ,471,2453,https://avatars.githubusercontent.com/u/2249537?v=4
348132133,fluentui-blazor,microsoft/fluentui-blazor,C#,103,Microsoft Fluent UI Blazor components library. For use with .NET 6.0 or higher Blazor applications,208,2434,https://avatars.githubusercontent.com/u/6154722?v=4
92001425,space-station-14,space-wizards/space-station-14,C#,24,A multiplayer game about paranoia and chaos on a space station. Remake of the cult-classic Space Station 13.,2107,1694,https://avatars.githubusercontent.com/u/10567778?v=4
682723630,UnityGaussianSplatting,aras-p/UnityGaussianSplatting,C#,57,Toy Gaussian Splatting visualization in Unity,128,1416,https://avatars.githubusercontent.com/u/348087?u=41311731f3f004fab8817c14c0440e09a29caa48&v=4
652941996,StabilityMatrix,LykosAI/StabilityMatrix,C#,62,Multi-Platform Package Manager for Stable Diffusion,75,1370,https://avatars.githubusercontent.com/u/136279213?v=4
525406711,pocket-updater-utility,mattpannella/pocket-updater-utility,C#,21,Analogue Pocket Updater Utility,29,709,https://avatars.githubusercontent.com/u/4806679?u=7cbdab06c915533744a526afe890ce570ddd8fe0&v=4
666163354,kernel-memory,microsoft/kernel-memory,C#,33,"Index and query any data using LLM and natural language, tracking sources and showing citations.",123,697,https://avatars.githubusercontent.com/u/6154722?v=4
635446707,SecHex-Spoofy,SecHex/SecHex-Spoofy,C#,32,"C# HWID Changer ğŸ”‘ï¸ Disk, Guid, Mac, Gpu, Pc-Name, Win-ID, EFI, SMBIOS Spoofing [Usermode]",88,470,https://avatars.githubusercontent.com/u/96635023?u=edad558f991f0e8c46d3df2e8b56f5bad833ed98&v=4
702911793,Aimmy,Babyhamsta/Aimmy,C#,23,Universal Second Eye for Gamers with Impairments (Universal AI Aim Aligner - YOLOv8),57,175,https://avatars.githubusercontent.com/u/22938086?u=b0d7a435727b20b124f84d1e6bd9206ecb060d1a&v=4
